type,id,author,title,score,created_utc,url,num_comments,subreddit,body,parent_id,depth,post_id
post,1gmli9k,a_Ninja_b0y,"According to Apple analyst Ming-Chi Kuo, Apple is working on a significant camera upgrade for the iPhone 18 coming in 2026 / The analyst says the iPhone 18’s main rear camera will be upgraded to a variable aperture lens for the first time.",0,2024-11-08 15:44:30,https://www.reddit.com/r/gadgets/comments/1gmli9k/according_to_apple_analyst_mingchi_kuo_apple_is/,33.0,gadgets,,,,
comment,lw3u909,emiliabow,,10,2024-11-08 16:59:39,,,,Im like the camera is already fine and I havent paid attention to any of the new upgrades,,0.0,1gmli9k
comment,lwoupfz,None,,0,2024-11-12 02:53:21,,,,lol they keep doing things no one is asking for Give us a new phone design All these iPhone 4s of various sizes every year is just lazy as fuck,lw3u909,1.0,1gmli9k
comment,lx2b1e6,Simple_Character6737,,1,2024-11-14 09:45:32,,,,I wish they would get rid of the Dynamic Island already Im on a 14pro max and not about to upgrade for a camera I dont even use some speed that doesnt matter,lwoupfz,2.0,1gmli9k
comment,lw3vl4k,jesus_fucking_marry,,8,2024-11-08 17:06:08,,,,Do something about the horrible lens flare,,0.0,1gmli9k
comment,lw3xehs,FungZhi,,4,2024-11-08 17:14:57,,,,seems possible to get reduction with the aperture control,lw3vl4k,1.0,1gmli9k
comment,lwdm606,Tipop,,3,2024-11-10 07:00:21,,,,Clean your lenses,lw3vl4k,1.0,1gmli9k
comment,lw3zcvd,yutfree,,2,2024-11-08 17:24:27,,,,iPhone 17 WTF,,0.0,1gmli9k
comment,lw437fp,limitless__,,2,2024-11-08 17:43:04,,,,Sweet our 2700 iPhone will have a nice camera Bonus,,0.0,1gmli9k
comment,lw3f9xt,roofus85,,5,2024-11-08 15:47:12,,,,gifgiphyZB95y3XSFbljaNu7mT,,0.0,1gmli9k
comment,lw3yt62,mockingbird-,,2,2024-11-08 17:21:49,,,,Chidi is still figuring out the ramification of this,lw3f9xt,1.0,1gmli9k
comment,lw3i6ez,kutkun,,4,2024-11-08 16:01:21,,,,I think onbutton or underdisplay TouchID would be great as really useful highusability features I also believe that more and more pixels doesnt mean much,,0.0,1gmli9k
comment,lw3qwbh,fearrange,,3,2024-11-08 16:43:38,,,,I would welcome an adjustable aperture Im tired of heavily bokehd photos that claim DSLR quality There are times when I really dont want bokeh and want to show the background as well,,0.0,1gmli9k
comment,lw3rouc,johndoe1130,,2,2024-11-08 16:47:25,,,,As great as the camera technically is Id love some sort of cover that protects the lens from fingerprints and dust etc I had a Nokia N97 years ago which managed this very nicely indeed,,0.0,1gmli9k
comment,lw3s897,Kike328,,2,2024-11-08 16:50:00,,,,whyyyyy,,0.0,1gmli9k
comment,lwzv5ri,gayfucboi,,1,2024-11-13 22:51:47,,,,adjustable bokeh and light from the lens,lw3s897,1.0,1gmli9k
comment,lw41w3k,zork2001,,1,2024-11-08 17:36:43,,,,I have the iphone 13 pro and I buy a new phone every 5 years so I was already planning on buying the iphone 18 at least it will have a worthy upgrade,,0.0,1gmli9k
comment,lw3yk7k,karatekid430,,1,2024-11-08 17:20:35,,,,The iPhone 16 only just came out dont you have anything better to do,,0.0,1gmli9k
comment,lw6sl84,jackedwizard,,2,2024-11-09 02:27:27,,,,And I thought they were slowing down releases to happen every two years instead of every year Or are they just skipping the 17 I feel like 17 is such a good number compared to 18,lw3yk7k,1.0,1gmli9k
comment,lw72ypl,karatekid430,,0,2024-11-09 03:34:41,,,,I have not heard anything about that,lw6sl84,2.0,1gmli9k
comment,lw7dbyh,jackedwizard,,0,2024-11-09 04:51:06,,,,,lw72ypl,3.0,1gmli9k
comment,lw92cqa,karatekid430,,1,2024-11-09 14:20:52,,,,lol you didnt even read your own article It says a move that could lead to more frequent releases,lw7dbyh,4.0,1gmli9k
comment,lw77bpw,OldTimeyWizard,,2,2024-11-09 04:05:46,,,,What exactly do you expect the iPhone engineering team to be doing other than engineering new generations of iPhone,lw3yk7k,1.0,1gmli9k
