type,id,author,title,score,created_utc,url,num_comments,subreddit,body,parent_id,depth,post_id
comment,lwcl4mx,NextWhiteDeath,,0,2024-11-10 02:16:58,,,,For many companies the cost of having a supply chain for spare parts is very expensive As now you have to document everything keep those document up to date stock the spare parts after the product has been changed or reached end of production More then anything for a lot but not all companies it comes down to price They make stuff that breaks faster because if it is 10 cheaper they sell a lot more of them The same was having a long and detailed supply chain for post purchase support is expensive Especially as often people replace products before they break,lwb4wlz,3.0,1gnbb2y
comment,lw9o9lf,SternLecture,,-2,2024-11-09 16:27:27,,,,just microwave your water,,0.0,1gnbb2y
comment,lwadg1a,denissRenaulds,,0,2024-11-09 18:41:26,,,,Nucleation points make this a somewhat poor idea also is less convenient when youre making multiple cups of tea,lw9o9lf,1.0,1gnbb2y
comment,lwamfa1,TooStrangeForWeird,,0,2024-11-09 19:29:39,,,,Throw the teabag in while its microwaving You can also do multiple cups at once Iirc you actually get more of the nutrients doing it this way too,lwadg1a,2.0,1gnbb2y
comment,lwaootj,denissRenaulds,,1,2024-11-09 19:41:40,,,,The nutrients in your average cup of tea are negligable And maybe you could fit possibly 2 or 3 mugs in the microwave it doesnt match up to the might of the kettle,lwamfa1,3.0,1gnbb2y
comment,lw9p4hm,tiger331,,-1,2024-11-09 16:32:01,,,,How long before they died with gunshots in the back after falling out of the window,,0.0,1gnbb2y
comment,lw9gvf3,Wheedies,,0,2024-11-09 15:46:47,,,,I need a gooseneck though that kettle is useless for me,,0.0,1gnbb2y
comment,lwcp23u,Pizza_Low,,0,2024-11-10 02:42:34,,,,I guess Ive never understood the appeal of a kettle A mug or even Pyrex pitcher in the microwave does the same thing 23 minutes will get a standard mug of water to boiling hot just fine None of the issues with another appliance in the kitchen or the scale buildup and repeatedly reheating the same water every time you want another glass of hot water,,0.0,1gnbb2y
