type,id,author,title,score,created_utc,url,num_comments,subreddit,body,parent_id,depth,post_id
post,1gnbb2y,chrisdh79,UK student invents repairable kettle that anyone can fix | Gabriel Kay hopes his design can help tackle the problems caused by discarded electrical goods,2826,2024-11-09 14:30:26,https://www.reddit.com/r/gadgets/comments/1gnbb2y/uk_student_invents_repairable_kettle_that_anyone/,200.0,gadgets,,,,
comment,lw9bf8v,NobleRotter,,422,2024-11-09 15:16:02,,,,Better looking kettle than most too Not sure Ive ever had a kettle break though Living Inna hard water area they just eventually turn to stone,,0.0,1gnbb2y
comment,lw9d7xi,jobe_br,,155,2024-11-09 15:26:21,,,,Just soak in a citric acid solution for a bit I get a few ounces of crystallized citric acid on Amazon and put a couple tablespoons in the kettle add cold water heat let sit for a bit to let the CA do its thing usually does the trick first time if theres anything left repeat a second time 30 minutes later and you have a fresh clean kettle,lw9bf8v,1.0,1gnbb2y
comment,lwa4eaj,skylarmt_,,94,2024-11-09 17:53:33,,,,Or just boil white vinegar in it for a while,lw9d7xi,2.0,1gnbb2y
comment,lwa500f,jobe_br,,49,2024-11-09 17:56:42,,,,Yep same principle The CA is just faster,lwa4eaj,3.0,1gnbb2y
comment,lwat9zw,SabreSeb,,53,2024-11-09 20:06:39,,,,And it doesnt stink like vinegar,lwa500f,4.0,1gnbb2y
comment,lwayof9,jobe_br,,19,2024-11-09 20:36:25,,,,Yep this is one of the benefits,lwat9zw,5.0,1gnbb2y
comment,lwbijpz,Malawi_no,,6,2024-11-09 22:26:03,,,,Would think its also cheaper than vinegar,lwat9zw,5.0,1gnbb2y
comment,lwbkp0m,NeilDeWheel,,35,2024-11-09 22:38:19,,,,Just dont leave it in the kettle overnight and forget to tell your partner In the morning my partner made herself a cup of tea and nearly threw up when she took a sip And definitely dont laugh at them for half and hour afterwards,lwbijpz,6.0,1gnbb2y
comment,lwbvbgd,VariousProfit3230,,8,2024-11-09 23:40:57,,,,Okay but hear me out maybe you want an express ticket to Suplex City,lwbkp0m,7.0,1gnbb2y
comment,lwc6jwi,ladyrift,,2,2024-11-10 00:47:39,,,,What do you pay for vinegar I can get 4L for like 2 Canadian,lwbijpz,6.0,1gnbb2y
comment,lwc78ma,SlootjeRijk,,4,2024-11-10 00:51:45,,,,Whos your vinegar guy,lwc6jwi,7.0,1gnbb2y
comment,lwc9n75,ladyrift,,3,2024-11-10 01:06:22,,,,My guy is Galen Weston,lwc78ma,8.0,1gnbb2y
comment,lwdboyd,Malawi_no,,2,2024-11-10 05:24:04,,,,Its quite a bit more expensive here in Norway Guess the most bang for the krone would be a liter of 32 at about 6 CAD It would be equal in effect to 45 liters of regular vinegard For around the same price probarbly 12 CAD more I could buy 700grams of citric acid powder,lwc6jwi,7.0,1gnbb2y
comment,lwhoua4,Unparalleled_,,1,2024-11-10 23:02:48,,,,Cheapest for me is using the leftover lemons or limes that I dont need from cookingbaking etc,lwbijpz,6.0,1gnbb2y
comment,lwaktdq,read_listen_think,,5,2024-11-09 19:21:01,,,,I used lemons when I had a prolific tree,lwa500f,4.0,1gnbb2y
comment,lwas3k5,bikeonychus,,7,2024-11-09 20:00:06,,,,This is what I do too Usually all the limescale is gone after 3 boils with the same vinegar in there Takes about 15 minutes Just Remember to rinse really well before making a cup of tea You will find out as soon as you pour the milk in if you didnt rinse it enough,lwa4eaj,3.0,1gnbb2y
comment,lwawzyw,skylarmt_,,7,2024-11-09 20:27:10,,,,Surprise cheese is best cheese,lwas3k5,4.0,1gnbb2y
comment,lwbiqb5,Malawi_no,,3,2024-11-09 22:27:05,,,,One of my core childhood memories is from getting milk in my tea that already had lemon in it,lwawzyw,5.0,1gnbb2y
comment,lwe4zzv,Wiggles69,,2,2024-11-10 10:25:15,,,,Dilute the vinegar first I rendered the school common room uninhabitable for an hour boiling straight vinegar to clean the urn,lwa4eaj,3.0,1gnbb2y
comment,lwenvj9,idk_lets_try_this,,1,2024-11-10 13:22:25,,,,Citric acid is gentler on the metal and doesnt damage silicone seals if a low grade silicone was used Thats why professional product for descaling are citric acid with a color indicator,lwa4eaj,3.0,1gnbb2y
comment,lwc7o26,waynetuba,,3,2024-11-10 00:54:19,,,,Im gonna try this with my old one I still use the electric kettle that my dad gave me it was in the pentagon when it got hit during 911 which is why I havent gotten rid of it yet,lw9d7xi,2.0,1gnbb2y
comment,lwcb9wa,jobe_br,,1,2024-11-10 01:16:21,,,,Nice Post back with a pic when youre done,lwc7o26,3.0,1gnbb2y
comment,lwj99ct,LumpySpacePrincesse,,1,2024-11-11 04:47:14,,,,I got a hot tap fucking changed my life the minutes saved every morning MINUTES,lw9d7xi,2.0,1gnbb2y
comment,lwjeay8,jobe_br,,1,2024-11-11 05:26:57,,,,Fucking minutes love it,lwj99ct,3.0,1gnbb2y
comment,lwjhb40,LumpySpacePrincesse,,1,2024-11-11 05:53:05,,,,Mate i fill my flask of tea thats a litre then my flattie does his coffee we both would never go back to a kettle The one we have is a commercial one i pulled out but we have both agreed if that fucks out we are getting a new one I am such a spastic in the morning man even the effort of filling a kettle cant do it no more man You want tea bang the bag in hit the button boom,lwjeay8,4.0,1gnbb2y
comment,lwmpqhc,jobe_br,,1,2024-11-11 19:45:54,,,,Very nice Jealous,lwjhb40,5.0,1gnbb2y
comment,lwdbx6l,None,,0,2024-11-10 05:25:58,,,,Hmm wonder if thats how CLR works,lw9d7xi,2.0,1gnbb2y
comment,lw9txfy,GrynaiTaip,,27,2024-11-09 16:57:42,,,,The switch lever broke on mine because the little plastic tabs on it were very thin and just barely held up for five years I grabbed a piece of plastic sheet cut out multiple shapes of that lever and stacked them to get the right thickness It broke a year later so I made a stronger version Its still working half a decade later,lw9bf8v,1.0,1gnbb2y
comment,lwaxb26,None,,5,2024-11-09 20:28:53,,,,Im still rocking a 10 stainless steel cookworks kettle I bought from argos in 20056 The plastic ring on the base broke a couple years back but you could unscrew it from the bottom to remove the wirecontacts and then I used the plastic top of a fairly liquid bottle some milliput and glue to fix it Still going strong now if it breaks again Ill make a replacement using my 3D printer,lw9txfy,2.0,1gnbb2y
comment,lwccht0,GrynaiTaip,,1,2024-11-10 01:23:51,,,,Funny that you mentioned I lived and studied in the UK a few years ago and the rental house had this really old kettle I did some googling and it appeared to be from the 70s The company was still in business so I emailed them asking for an owners manual or some other info just for fun but they never replied That kettle worked great it even survived a renovation when I had to make a cuppa for three guys once an hour for several days,lwaxb26,3.0,1gnbb2y
comment,lwcdp40,stellvia2016,,2,2024-11-10 01:31:05,,,,Probably a good candidate for 3D printing as well There are some really neat things people share the plans for on sites like Thingiverse,lw9txfy,2.0,1gnbb2y
comment,lwcfp0q,GrynaiTaip,,2,2024-11-10 01:43:08,,,,Absolutely Ive printed a ton of practical things too In this particular case I figured that plastic sheet is better in terms of strength Not everything is best when printed,lwcdp40,3.0,1gnbb2y
comment,lwawk3y,gargravarr2112,,13,2024-11-09 20:24:46,,,,My first thought When have kettles ever broken They are like the simplest possible appliance Scale obviously becomes a problem but so much less since designers started using flat bases instead of elements in the water The only time Ive known my family replace a kettle was for aesthetics Ive had the same kettle for 10 years since I moved into my first flat Descale it every year or two and carry on,lw9bf8v,1.0,1gnbb2y
comment,lwdokw4,razirazo,,3,2024-11-10 07:24:56,,,,I had one kettle that I throw out due to sensor issue Thing keep boiling until the water dries without any cut off,lwawk3y,2.0,1gnbb2y
comment,lwgi1xq,CosmicCreeperz,,1,2024-11-10 19:24:47,,,,I am on my 3rd in 10 years I use it all the time but eventually the electronics go out I guess all of the humidity Now note mine has different temp settings ie for different tea types French press or pour over coffee etc and auto shutoff My issue with this kettle is he basically just lets you swap all of the electronics out Which is guess is better than tossing a whole kettle but still doesnt seem like much of a repair vs someone actually swapping a potentiometer or resoldering broken contacts Then again Im an EE who could probably fix it and I dont bother since spending a day trying to repair a 100 kettle isnt worth my time,lwawk3y,2.0,1gnbb2y
comment,lwgq6vu,gargravarr2112,,2,2024-11-10 20:05:56,,,,Part of my point is that kettles arent supposed to have electronics theyre supposed to be electrical because as youve correctly pointed out the electronics are the usual point of failure Now to be fair I have never had cause to need different temperature settings so I wouldnt understand the benefit I just boil the kettle and toss the hot water in a mug I bought the cheapest stainlesssteel kettle at the supermarket 12 years ago It has exactly two settings on and off I made 3 cups of tea with it today Theres just nothing to go wrong in it But as you say making this device repairable by essentially making the electronics modular doesnt really solve the problem Because as you point out its still an entire electronics module composed of many smaller electronic components that has to be swapped out and then disposed of rather than fixing the one or two actual faulty components It reduces the electrical waste but doesnt eliminate it,lwgi1xq,3.0,1gnbb2y
comment,lwgugh4,CosmicCreeperz,,1,2024-11-10 20:27:26,,,,Who says they are not supposed to have electronics I bet 80 years ago people said there was no reason they should be electrical why not just use a gas range Thats how we did it as a kid thats good enough for everyone I like my kettle that has 8 temp buttons and a keep warm setting with auto shutoff and emptyno water safety detection I use mine for everything from white oolong green and black teas French press aero press and Americano coffee ramen miso or other quick soups and heh even warming water to defrost small rats to feed my ball python Sometimes my family uses it 10x a day Which is why I guess Im ok that the last one only lasted 5 years,lwgq6vu,4.0,1gnbb2y
comment,lwca4wg,boomchacle,,1,2024-11-10 01:09:22,,,,I always just assumed that a kettle is literally just a switch coil and thermometer What is there to break that could be replaced without creating E waste,lwawk3y,2.0,1gnbb2y
comment,lwenns4,gargravarr2112,,3,2024-11-10 13:20:49,,,,Its not even a thermometer its a simple and reliable bimetallic strip on heating one side expands faster than the other causing it to bend and flip the switch to off Those things last decades,lwca4wg,3.0,1gnbb2y
comment,lwgidrf,CosmicCreeperz,,1,2024-11-10 19:26:24,,,,A lot of decent ones have multiple temperature settings Also a bimetallic strip is basically a thermometer without the needle,lwenns4,4.0,1gnbb2y
comment,lwgqxz0,gargravarr2112,,2,2024-11-10 20:09:44,,,,Very true on both counts My point is that a bimetallic strip is extremely reliable dramatically more so than electronics accomplishing the same job and why this kettle apparently exists You could probably use such a strip or a couple of them to handle multiple temperatures rather than doing it electronically but that wouldnt look nearly as modern or futuristic would it,lwgidrf,5.0,1gnbb2y
comment,lwh3yt9,CosmicCreeperz,,1,2024-11-10 21:12:54,,,,And at some point a few 010 electrical components is much cheaper to build especially if you dont care how long it lasts,lwgqxz0,6.0,1gnbb2y
comment,lwcdmuk,achangb,,-2,2024-11-10 01:30:42,,,,This kettle is obsolete as soon as you buy itWho wants a dumb kettle these days Give me a Bluetooth wifi connected kettle that has OTA firmware updates color screen phine app and can even be hacked to play games,lwawk3y,2.0,1gnbb2y
comment,lwenxuf,gargravarr2112,,1,2024-11-10 13:22:53,,,,Im waiting for a smart kettle that gets around the fact that a human has to physically pour water into it Because flipping a physical switch on the kettle while standing in front of it is far far harder than grabbing your phone opening the app waiting for updates to finish waiting for Bluetooth to connect swiping past the ads and then choosing exactly how you want to boil the water,lwcdmuk,3.0,1gnbb2y
comment,lw9fb2z,Tasty-Traffic-680,,13,2024-11-09 15:38:03,,,,Come on over to the US the land of 120V and broke ass electric kettles They dont seem to hold up well with lower voltagehigher current,lw9bf8v,1.0,1gnbb2y
comment,lw9hykf,NobleRotter,,25,2024-11-09 15:52:49,,,,Life is too short for 120v,lw9fb2z,2.0,1gnbb2y
comment,lwb0dpn,Bigwhtdckn8,,1,2024-11-09 20:45:37,,,,Especially if you cut through a 350v max mains cable,lw9hykf,3.0,1gnbb2y
comment,lw9qq9m,rdmusic16,,15,2024-11-09 16:40:39,,,,Is that true In Canada we have the same and my electric kettle is 15 years old I properly clean it once a year I cant say Ive always used it daily during all that time but Ive always used it and its definitely turned on 34 times a day for a long time now Still works perfectly fine,lw9fb2z,2.0,1gnbb2y
comment,lw9xcq8,NootHawg,,6,2024-11-09 17:16:05,,,,I have one I bought from amazon for 12 right around 10 years ago and I cant find anything wrong with it its 120v,lw9qq9m,3.0,1gnbb2y
comment,lwa8hsu,Coal_Morgan,,1,2024-11-09 18:15:13,,,,Canadian also and my wife and I got our kettle when we got married 20ish years ago Its rock solid I always thought kettles were pretty much bomb proof,lw9xcq8,4.0,1gnbb2y
comment,lwbfcnf,Tasty-Traffic-680,,2,2024-11-09 22:07:51,,,,Im starting to think it might just be the shitty Hamilton Beach ones Ive bought in the past but even the more expensive one I last purchased only lasted a few years before getting flakey with the connection to the base It has to be turned to exactly the right spot to turn on,lw9qq9m,3.0,1gnbb2y
comment,lwbqari,Nkechinyerembi,,1,2024-11-09 23:10:59,,,,I have to clean mine once a week due to hard water but its been reliable for several years now,lw9qq9m,3.0,1gnbb2y
comment,lwcbkam,rdmusic16,,2,2024-11-10 01:18:09,,,,Our water isnt bad for that but if I still lived in a small town or on a farm yeah Id probably have to clean mine waaaay more often,lwbqari,4.0,1gnbb2y
comment,lw9yarj,Practical-Custard-64,,4,2024-11-09 17:21:07,,,,Higher current but not that much higher I believe correct me if Im wrong that appliances are limited to 1500W in the US Here in the UK we use 240V and kettles are up to 3500W 13A under 240V,lw9fb2z,2.0,1gnbb2y
comment,lwaj0cq,BeefyIrishman,,3,2024-11-09 19:11:24,,,,Most circuits in a house in the US are on 15A breakers with 14AWG wire about 25mm² so 1800W will trip the breaker The 1500W helps avoid accidentally tripping the breaker all the time This is why you dont see electric kettles as often in the US Usually people just have a normal kettle that they use on their stovetop hob since stoves runs at 240V instead of 120V and therefore you can typically boil water faster than an electric kettle Side note Kitchens are actually required to be on 20A breaker 2400W with 12AWG wire about 4mm² but that is just because you typically have a lot of higher current devices in the kitchen Most devices wont be able to use the extra current as they are designed to run on any circuit in the house You can technically buy some devices that use the 20A but they are rare The 20A outlets are designed to allow both 15A and 20A plugs to be inserted into them but a 15A outlet will only allow 15A plugs,lw9yarj,3.0,1gnbb2y
comment,lwb0g1u,None,,3,2024-11-09 20:45:58,,,,Yeah thats pretty low by our standards the UK most kitchens are on a 32A Breaker 75kW with each individual socket rated technically rated to 13A 230V but in reality the UK still gets around 240V tolerance is 216 to 253 Most kettles top out at 3000W though you can get 10KW wall mounted instant water boilers but they need wired on their own connection and tend to be used commercially UK sockets also mostly use 25mm cable twin and earth but wired in a ring so can handle that 32A compared to a radial circuit like used in the US mostly,lwaj0cq,4.0,1gnbb2y
comment,lwb4cuh,BeefyIrishman,,3,2024-11-09 21:07:16,,,,You can also get instant water boilers here but they typically will get their own circuit anyways so it can be run as a 240V circuit The odd thing is our mains power is actually 240V we just split that into two 120V lines by tapping a neutral off the center and tying it to ground So if you go L1 hot or L2 hot to neutral you get 120V and if you go from L1 to L2 you get 240V Usually only electric clothes dryers water heaters AC units and stoves ovens and electric car chargers if you have one run at 240V though pretty much everything else runs 120V There is actually nothing stopping you other than cost from running 240V circuits in your house and buying 240V electronics if you wanted to There are 240V plugsoutlets for both 15A and 20A that are very similar to our normal plugs they just have some of the flat pins rotated but you typically only see those used in commercial spaces They are pretty rare in residential I have a few that I installed in my garage for some woodworking tools but most houses dont have them,lwb0g1u,5.0,1gnbb2y
comment,lwbao5n,None,,1,2024-11-09 21:42:05,,,,Thats odd must be 180 out phase then We dont have that we can get 3 phase so if you DeltaY it you get 400V this is usually only used in industry though or very large buildings like blocks of flats once it gets to residential its almost never used you can but it costs more for the electric company to hook you up Generally more used for heavy machinery big power tools etc,lwb4cuh,6.0,1gnbb2y
comment,lwbijey,BeefyIrishman,,2,2024-11-09 22:26:01,,,,Yeah for residential its 180 out of phase For commercial use we do have 3 phase power and that has many different versions These are the most common from what I have seen at manufacturing facilities where I have worked 120208V 208V Wye 208V between phases 120V any phase to Neutral 277480V 480V Wye 480V between phases 277V any phase to Neutral 347600V 600V Wye 600V between phases 347V any phase to Neutral 208V Delta 4 wire 240V between phases 208V on Phase B wild leg to Neutral 120V Phase A C to Neutral You apparently occasionally see Delta on the higher voltages well but I havent seen these personally 208V Delta 3 wire 208V between phases no Neutral 480V Delta 3 wire 480V between phases no Neutral 480V Delta 4 wire 480V between phases 415V on Phase B wild leg to Neutral 240V Phase A C to Neutral 600V Delta 3 wire 600V between phases no Neutral I am sure there are others as well It can start getting really convoluted in commercial power,lwbao5n,7.0,1gnbb2y
comment,lwa8eru,HandsyBread,,4,2024-11-09 18:14:47,,,,Maybe Im the crazy one but my cheap kettle has lasted me nearly 10 years and it gets fired up nearly daily,lw9fb2z,2.0,1gnbb2y
comment,lwb1lhp,Tasty-Traffic-680,,1,2024-11-09 20:52:11,,,,Im very sorry you must have accidentally got one of the good ones Feel free to replace it with any piece of shit made by Hamilton Beach at your convenience s Tbh I think the biggest issue is I buy shitty electric kettles however even the last one I spent more money on barely lasted a few years before getting a flaky connection with the base No matter I gave up most caffeine anyway,lwa8eru,3.0,1gnbb2y
comment,lw9g29m,nopersonality85,,3,2024-11-09 15:42:17,,,,Ill ever forget plugging in my trimmer on a cruise ship where you can change voltage and it sounded like a lawn mower,lw9fb2z,2.0,1gnbb2y
comment,lwah7hq,TooStrangeForWeird,,2,2024-11-09 19:01:39,,,,The 240v ones usually still use high amps They usually max out at 1500 watts but in 240v countries they can be 3000,lw9fb2z,2.0,1gnbb2y
comment,lwdsex8,WolfyCat,,2,2024-11-10 08:05:34,,,,Ive had 3 kettles break in 10 years Averaging 33 years per kettle feels wrong because I remember as a kid we had a kettle for many more years or at least it certainly feels like that We live in a reasonably softish water area in Yorkshire too,lw9bf8v,1.0,1gnbb2y
comment,lwdzgm4,NobleRotter,,2,2024-11-10 09:23:11,,,,Maybe its the timescale holding ours together Our current kettle was a cheap Amazon purchase in 2015 Its still fine but the timescale splashes make it look grubby,lwdsex8,2.0,1gnbb2y
comment,lwa9js8,boykinsir,,1,2024-11-09 18:20:51,,,,Boil vinegar in it every 3 months or so Takes the scale right off,lw9bf8v,1.0,1gnbb2y
comment,lwb6alz,NobleRotter,,1,2024-11-09 21:18:02,,,,We do Scale catchers are also great preventatives It doesnt stop build up around the spout though,lwa9js8,2.0,1gnbb2y
comment,lxhvqr4,boykinsir,,1,2024-11-16 21:39:27,,,,Acid Baggie Rubber band Prop kettle so the baggie stays full while the rubber band holds it on Alternatively use a bottle brush that fits the spout weekly,lwb6alz,3.0,1gnbb2y
comment,lwbwd90,Chrunchyhobo,,1,2024-11-09 23:47:09,,,,Not sure Ive ever had a kettle break though Living Inna hard water area they just eventually turn to stone I present to you the Burco 4L Catering Kettle Ive had two of the heaps of shit melt their own C13 plug,lw9bf8v,1.0,1gnbb2y
comment,lwaoivk,BlastFX2,,0,2024-11-09 19:40:48,,,,Its a render If it ever gets made which I doubt because kettles breaking really isnt an issue It will probably not look quite like that,lw9bf8v,1.0,1gnbb2y
comment,lw9g8ei,Plank_With_A_Nail_In,,211,2024-11-09 15:43:14,,,,So repairing is unscrewing the entire heating element and fully replacing it Im sure the replacement part wont cost more than the full kettle Kettles arent exactly complicated high technology its just a heating element and a heat controlled switch I cant remember the last time one actually broke on me,,0.0,1gnbb2y
comment,lw9ozvd,Thread_water,,49,2024-11-09 16:31:21,,,,If you buy the absolute dirt cheap ones then yes they break We had two or three break on us and then went and bought one that was just a little more expensive and its still going strong a few years later,lw9g8ei,1.0,1gnbb2y
comment,lw9xi2c,READMYSHIT,,13,2024-11-09 17:16:52,,,,I worked in a call center where 400 staff used the same kettle all day every day We went through the cheapest kettles almost every two weeks The company did not give a shit to provide proper facilities though because inevitably staff would be without a kettle and someone would just go buy another cheap one from their own pocket,lw9ozvd,2.0,1gnbb2y
comment,lwaetum,MINKIN2,,15,2024-11-09 18:48:48,,,,400 people and one kettle Did no one ever consider a tea urn,lw9xi2c,3.0,1gnbb2y
comment,lwb123p,READMYSHIT,,8,2024-11-09 20:49:17,,,,Did I mention it was a call center,lwaetum,4.0,1gnbb2y
comment,lwao1zg,None,,20,2024-11-09 19:38:19,,,,The dirt cheap ones last forever if you live in a soft water area the reason they break most of the time is hard water with no descaling or abuse as in smashing them Ive seen 5 supermarket brandargos cookworks iirc kettles 1520 years old in factories still going strong Hell Ive seen a few 80s swan kettles knocking about,lw9ozvd,2.0,1gnbb2y
comment,lwe2o2m,unepmloyed_boi,,3,2024-11-10 09:59:19,,,,Been using a 8 kettle for 11years Everyone whos house ive visited have been using cheap kmarttarget kettles for years As others have said the electronics within them are not that complicated and theres not much to fail,lw9ozvd,2.0,1gnbb2y
comment,lwbgz1t,glytxh,,8,2024-11-09 22:17:02,,,,My 899 kettle has lasted me 7 years so far and Id be willing to bet I could replace it three times over for the price of a product like this Higher manufacturing costs and I really doubt they have scale on their side Id very much like to be wrong though Id love products like this if they became a standard,lw9g8ei,1.0,1gnbb2y
comment,lwb5qv4,JBWalker1,,5,2024-11-09 21:14:59,,,,,lw9g8ei,1.0,1gnbb2y
comment,lwerfco,ICC-u,,1,2024-11-10 13:47:46,,,,I feel like people give away their old kettles Who are they giving them away to Kettles start at about 10 its one of the cheapest and most common kitchen items I dont know anyone who doesnt own one and if I did how would they make tea when I visit,lwb5qv4,2.0,1gnbb2y
comment,lw9b5oh,Pitoucc,,87,2024-11-09 15:14:31,,,,Most kettles are already repairable The main problem is sourcing parts,,0.0,1gnbb2y
comment,lw9skfd,Hendlton,,22,2024-11-09 16:50:27,,,,Thats the problem for pretty much everything It would be nice if manufacturers provided a spec sheet or something so you can order parts directly from China Ive thrown away countless things after blindly guessing what to order and never receiving quite the right part But when something costs 200300 to buy new its worth a couple blind guesses at like 20 a piece,lw9b5oh,1.0,1gnbb2y
comment,lwa1v2h,Pitoucc,,4,2024-11-09 17:40:10,,,,Be there with some cameras before I eventually found the same model but broken and was able to harvest the replacement parts If it wasnt for that it would have been 400 camera in the trash,lw9skfd,2.0,1gnbb2y
comment,lwdzy6z,IntrinsicGiraffe,,1,2024-11-10 09:28:40,,,,Thats why some folks aim for opensource and why patents are a pain,lw9skfd,2.0,1gnbb2y
comment,lwa3azi,None,,9,2024-11-09 17:47:47,,,,And that the parts are about as much as a new one I aint spending time ordering parts waiting a week for delivery and then doing the work of replacing the part assuming I diagnosed the problem correctly to save a dollar,lw9b5oh,1.0,1gnbb2y
comment,lwang6f,BlastFX2,,1,2024-11-09 19:35:04,,,,I would Hell Im willing to spend more to fix things because I hate waste Problem is spare parts are often just not sold at all,lwa3azi,2.0,1gnbb2y
comment,lwa5ecd,Yodiddlyyo,,-11,2024-11-09 17:58:47,,,,And thats the problem People like you are why our landfills are filled with electronics Because youd rather put plastic in a landfill than be minorly inconvenienced for a few days,lwa3azi,2.0,1gnbb2y
