type,id,author,title,score,created_utc,url,num_comments,subreddit,body,parent_id,depth,post_id
comment,lwafxy1,__dontpanic__,,9,2024-11-09 18:54:49,,,,The problem is that most parts arent easily accessible and even if they can be obtained you need additional tools and skills to properly repair the product So that puts it out of reach for most The other alternative is to pay someone to do the repairs but that often ends up costing the same as buying a whole new unit with a brand new warranty Unless manufacturers make repairs easier and cheaper the convenience and economics for the end user will never stack up The only way I could conceivably see things changing is if governments regulate repairability or place a levy or tax on products that dont meet repairablity standards which would hopefully make repairable products cheaper or more attractive to consumers than nonrepairable ones The free market on its own will never solve this problem,lwa5ecd,3.0,1gnbb2y
comment,lwbd49q,Yodiddlyyo,,1,2024-11-09 21:55:23,,,,Right thats a problem,lwafxy1,4.0,1gnbb2y
comment,lwaaflq,boykinsir,,0,2024-11-09 18:25:34,,,,Yo right theres the problem Instead of opening up a repair shop to combat the problem you get on the internet from mommies basement and keyboard warrior it trying to transfer your depeession to others,lwa5ecd,3.0,1gnbb2y
comment,lwbd1ia,Yodiddlyyo,,1,2024-11-09 21:54:58,,,,Our culture of throwing away plastic instead of reusing or repairing it is a common well understood problem that has caused pollution and tons of plastic in our ocean Not sure how that offends you enough to try to badly insult a stranger,lwaaflq,4.0,1gnbb2y
comment,lxhv4iw,boykinsir,,1,2024-11-16 21:36:02,,,,Be the fix to the problem if you care that much Dont be a cranky baby about it,lwbd1ia,5.0,1gnbb2y
comment,lwb3roa,Significant_Sign,,1,2024-11-09 21:04:03,,,,I saved up and bought a Dualit after 3 Hamilton Beach kettle died in four years It cost the same as 25 HB kettles Its repairable and I can source the parts from Dualit or send it to them to fix Plus its actually made by Dualit employees in England not some contracted mystery factory elsewhere that will never get their reputation or sales dinged from too much shoddy work So far I am really enjoying it Its very fast even though I live in America and use the weak electricity and has the most stainless steel interior I could find,lw9b5oh,1.0,1gnbb2y
comment,lwbj9md,Malawi_no,,1,2024-11-09 22:30:09,,,,And its likely not the heating element but some plastic thingy,lw9b5oh,1.0,1gnbb2y
comment,lwfpso5,realcoray,,1,2024-11-10 17:03:25,,,,There isnt much to them but this was my experience The cheap ones have an inline fuse that blows and good luck finding and replacing it,lw9b5oh,1.0,1gnbb2y
comment,lw9f2c9,In-All-Unseriousness,,22,2024-11-09 15:36:42,,,,I recently fixed my soundbar by ordering and replacing a part that cost 50 cents I nearly threw it out but decided to check youtube out of curiosity Now imagine millions of appliances that are thrown out that could probably be repaired just as easily,,0.0,1gnbb2y
comment,lwa7ssv,awkwardwatch,,5,2024-11-09 18:11:31,,,,iFixit and YouTube tutorials also repaired some of my precious things Like the infamous Logitech spotlight and my fitness tracker that had a dead battery also a switch controller where the joystick had continuous drift Repairing is a lot of fun once you get the hang of it,lw9f2c9,1.0,1gnbb2y
comment,lwc17l9,Present-Perception77,,1,2024-11-10 00:15:42,,,,I was just watching a YouTube video on fixing batteries for cordless tools I am livid You just have to basically jump start it to get it to communicate with the charger dock took 2 seconds I just threw away a whole vacuum cleaner because I couldnt find a replacement battery it was only 2 yrs old,lw9f2c9,1.0,1gnbb2y
comment,lwaaaj5,whk1992,,9,2024-11-09 18:24:49,,,,A 15 ULlisted kettle lasts a decade easily Whats the student smoking in the UK these days,,0.0,1gnbb2y
comment,lwa5rqc,MaguroSushiPlease,,15,2024-11-09 18:00:45,,,,Feels like Greenwashing I bet the part costs as much as buying a whole new kettle from Costco There are so many other ways to help the environmentlike eating Billionaires,,0.0,1gnbb2y
comment,lwa92kp,boykinsir,,-4,2024-11-09 18:18:18,,,,For people who advocate cannibalism Volunteer to your cult first,lwa5rqc,1.0,1gnbb2y
comment,lwam29y,TooStrangeForWeird,,4,2024-11-09 19:27:43,,,,Kinda doubt theyre a billionaire though,lwa92kp,2.0,1gnbb2y
comment,lwa9ru3,Qui-gone_gin,,6,2024-11-09 18:22:03,,,,Or you could just get a regular metal one and never have to worry about creating extra waste It may take slightly longer but they never dont work,,0.0,1gnbb2y
comment,lw9a2re,GeneralCommand4459,,13,2024-11-09 15:08:12,,,,Just need the button to last more than 12 months Every kettle Ive bought the plastic onoff button breaks around the same time and the kettle is useless,,0.0,1gnbb2y
comment,lw9gy3c,Jack123610,,11,2024-11-09 15:47:12,,,,The saying is if you use something enough to break it then buy a quality one,lw9a2re,1.0,1gnbb2y
comment,lw9jkw8,GeneralCommand4459,,3,2024-11-09 16:01:48,,,,The one that has lasted the longest is actually the cheapest one I bought,lw9gy3c,2.0,1gnbb2y
comment,lwaeukd,None,,3,2024-11-09 18:48:55,,,,Yeah the problem is more expensive doesnt always mean better quality my first kettle was cheap and broke in 2 years second kettle was expensive but also broke in 2 years the third time I bought a Braun kettle and its still going strong after 10 years,lw9jkw8,3.0,1gnbb2y
comment,lw9o5lt,SmashingK,,2,2024-11-09 16:26:50,,,,The problem with kettles is almost all of them get made by the same company They get branded for each name brand you see in the stores Apparently they have a bunch of prototype designs made each year All the brands go round to look and choose which one they want and put in orders I cant remember which brand actually produces its own kettles,lw9gy3c,2.0,1gnbb2y
comment,lwbhwuf,alchemy3083,,1,2024-11-09 22:22:23,,,,Protip get the UL listing number for the product On the product on the box on the user manual or on request from the manufacturer When two products have the same number theyre rebrands of the same design and manufacturing process Also if you look up the number on the UL website you can see if its made by a manufacturer under its own name or if its just a branded generic design Rebrands arent always terrible oftentimes the thing youre buying works the same dirtcheap or topoftheline I have a stick vac that at least 10 companies rebrand and the quality is plenty sufficient for its normal use But anything that gets really really hot on purpose is clearly a product you want a high level of accountability on,lw9o5lt,3.0,1gnbb2y
comment,lw9clbm,lurkindasub,,2,2024-11-09 15:22:44,,,,Try Philips HD935990R1 its very durable and you can set temperature itll stop at and also set it to keep that temperature until youre ready Quite nifty,lw9a2re,1.0,1gnbb2y
comment,lw9gimw,Plank_With_A_Nail_In,,-2,2024-11-09 15:44:48,,,,I been using the same kettle for 12 years maybe dont buy the cheapest one next time Lol have you really had 12 kettles in the time I have had one If you had spent 100 on it you would still be up in terms of money Thats the one I have Either your story is bullshit or this is some really Sam Vimes boots stuff,lw9a2re,1.0,1gnbb2y
comment,lw9nimo,brocollee,,9,2024-11-09 16:23:20,,,,Heres a cleaner link for you Everything after the question mark including it is only helping Amazon analytics get smarter,lw9gimw,2.0,1gnbb2y
comment,lwad50r,denissRenaulds,,3,2024-11-09 18:39:51,,,,This is so silly a kettle is so simple and doesnt contain any rare or hazardous or expensive materials The issue with discarded electronics is typically they have batteries which can be bad for the environment or contain rare elements or components which are effectively lost when theyre sent to landfill but a kettle has none of these If a kettle is thrown away theres no real loss there its made of probably stainless steel and aluminium big whoop,,0.0,1gnbb2y
comment,lwav9f4,wordfool,,4,2024-11-09 20:17:40,,,,Every kettle Ive owned thats needed replacing had some mechanical issue not anything related to electronics The last one had a busted lid opening mechanism because the manufacturer decided to save 10c and use plastic in a key stress area rather than metal,,0.0,1gnbb2y
comment,lwcohur,munkijunk,,4,2024-11-10 02:38:52,,,,Eh What A basic kettle is a bucket and element and a switch Theres fuck all too it and anyone can fix one with basic tools This is fucking dumb,,0.0,1gnbb2y
comment,lw9j2da,wumbologist-2,,3,2024-11-09 15:58:58,,,,But does it come in 20 colors and a collectable pushed by influencers to then discard when its not fashionable,,0.0,1gnbb2y
comment,lwb9okt,None,,3,2024-11-09 21:36:40,,,,Kettles always used to be repairable you undid a nut and the element came out All kettles were the same back then though then the disposable jug kettle wiped them away in the 90s,,0.0,1gnbb2y
comment,lwc1br7,AlbertFannie,,3,2024-11-10 00:16:24,,,,Couldnt we just buy stovetop kettles again,,0.0,1gnbb2y
comment,lwa6jb3,zorasht,,2,2024-11-09 18:04:48,,,,I have had the same kettle for the last 25 years Tefal VItesse an unremarkable white plastic thing The kettle is older than that I inherited it from a flat mate I had 25 years ago and it has been with me since then The part in worse shape is the filter from where the water leave the kettle So I didnt even know that the kettle were commonly faulty,,0.0,1gnbb2y
comment,lwacrr8,PRC_Spy,,2,2024-11-09 18:37:54,,,,Hardly a new invention My parents used to have a stainless steel electric kettle with a replaceable element When it stopped working you bought a new element If the cord broke just buy a new cord Shops stopped selling the elements when cheap disposable import plastic kettles dropped to a similar price Then small town hardware stores vanished as well,,0.0,1gnbb2y
comment,lwb27fi,captaincinders,,2,2024-11-09 20:55:30,,,,Designing a repairable kettle is easy What is difficult is designing it so it cheaper to buy and repair than it is to buy another one And who is going to be stocking these replacement elements for years to come Also I have never had to replace a kettle because the element broke Is is because something mechanical broke or it leaked I went to buy a toilet One had this feature where the flushing mechanism was easily replaceable Great idea no I asked if they had any of the replaceable flushing mechanisms in stock Nope I asked how much the flushing mechanism was to replace No idea They said that I had to get in contact with the manufacturer and they would supply me one Yeah right 10 years later the cheaper toilet I did buy is still working The manufacturer of that replaceable flushing mechanism Not a clue if they are even still in business,,0.0,1gnbb2y
comment,lwb3o8v,captaincinders,,2,2024-11-09 21:03:32,,,,I want to lay a bet in three parts 1 the cost of the replicable element kettle is much more than a normal kettle 2 The cost of the replicable element is as much as a new normal kettle 3 In a couple of years the replaceable element will be out of stock Anyone wanna give me odds,,0.0,1gnbb2y
comment,lwb4uz8,Untimely_manners,,2,2024-11-09 21:10:04,,,,He fixed what wasnt broke Ive never had an old school kettle break I had a smart kettle which eventually broke as the glass separated and leaked so I went back to a dumb kettle,,0.0,1gnbb2y
comment,lwbl9dq,Plastic_Acanthaceae3,,2,2024-11-09 22:41:33,,,,Cool design but stupid article no ones kettle has ever broken in the history of kettles,,0.0,1gnbb2y
comment,lwbo59l,triadwarfare,,1,2024-11-09 22:58:17,,,,I had a couple of broken kettles One was I plugged it without water when I was a kid The other just broke through regular use Not sure why it got broken but it was no longer working when we plugged it,lwbl9dq,1.0,1gnbb2y
comment,lwbqu7p,iBUYbrokenSUBARUS,,2,2024-11-09 23:14:14,,,,Dumb,,0.0,1gnbb2y
comment,lwcct96,senddickslol,,2,2024-11-10 01:25:47,,,,aw oil companies hate them,,0.0,1gnbb2y
comment,lwdcgt7,MrHouse-38,,2,2024-11-10 05:30:32,,,,Thats great but a kettle costs about 15 anyway so is the repair point really worth it,,0.0,1gnbb2y
comment,lwdns3v,latortillablanca,,2,2024-11-10 07:16:35,,,,Have you tested it in front of an undecided American voter though,,0.0,1gnbb2y
comment,lwdrgpc,soshield,,2,2024-11-10 07:55:29,,,,Im getting clock boy vibes for some reason I invented a replaceable heating coil,,0.0,1gnbb2y
comment,lxu1aj6,seeking_derangements,,2,2024-11-18 22:46:58,,,,I melted my electric kettle on the stove not everyone can be helped,,0.0,1gnbb2y
comment,lw98efs,dunder_mifflin_paper,,3,2024-11-09 14:58:19,,,,Coincidentally I made a post about this kind of stuff the other day Build like they used to,,0.0,1gnbb2y
comment,lwauehz,None,,3,2024-11-09 20:12:55,,,,Itll never work they already build it like they used to for commercial purposes or wealthy people Most people suffer from the Sam Vimes Boots theory of socioeconomic unfairness That is who can afford or risk the opportunity loss to spend 100 or more now on a kettle that might with care and an additional 2050 worth of maintenance last you 25 years maybe even 50 years basically for life Assuming you can even guarantee spare parts for that long When you can buy a 10 kettle from ArgoSupermarket 8 in ASDA right now that lasts 5 years 10 years if you are lucky A few years ago I saw a Swan kettle from the 80s still going strong and they were considered cheap crap at the time also in a break room that gets boiled 45 times a day I personally have a stainless steel cookworks kettle I bought in 20056 still going strong descaled it 2 maybe 3 times in that time I think I also have a 5 white plastic tesco kettle in the garage that would probably work that is older the cookworks replaced it Basically the 1230 one here Its all well and good over engineering something so that it might last for decades but the people who need them cant afford them and the people that can change their appliances whenever they decorate for the aesthetics,lw98efs,1.0,1gnbb2y
comment,lwb0xow,theholyraptor,,2,2024-11-09 20:48:37,,,,And ops design isnt really green It saves some waste but if youre just removing the most expensive parts and tossing those which are also more negative as waste and in production youre saving little And that replacement module will most likely cost as much as a new one because its the more expensive costly parts,lwauehz,2.0,1gnbb2y
comment,lwbr7p1,Malawi_no,,1,2024-11-09 23:16:28,,,,What might be a nice idea would be if you could buy the kettle itself a little cheaper without the basewire Typically its some plastic thingy in the lid or a button that breaks while the base is everlasting,lwb0xow,3.0,1gnbb2y
comment,lwbrn28,theholyraptor,,2,2024-11-09 23:19:03,,,,Buttons are physically connected to the electronics and wouldnt be separate unless its a switch that has a knob that breaks Which while maybe not something any idiot can do is pretty repairable It its a fancier electronic button than youre more screwed,lwbr7p1,4.0,1gnbb2y
comment,lwbtnnh,Malawi_no,,1,2024-11-09 23:31:04,,,,Might have used a wrong word as I was not thinking of an electric button When a kettle have failed me its been either the hinge part of the lid that breaks off or some internal thing in the button that opens the lid,lwbrn28,5.0,1gnbb2y
comment,lwa374y,None,,1,2024-11-09 17:47:13,,,,Well thats my next kettle,,0.0,1gnbb2y
comment,lwaeix0,MarvinArbit,,1,2024-11-09 18:47:10,,,,Looks like it is likely to leak over time if the base just pops off like that Leaks are what has killed most of my past kettles,,0.0,1gnbb2y
comment,lwafg72,Alienhaslanded,,1,2024-11-09 18:52:09,,,,Thats a problem Those things last decades,,0.0,1gnbb2y
comment,lwah5nj,ashyjay,,1,2024-11-09 19:01:22,,,,With how hard a lot of UK water is which kills a lot of kettles this is fantastic,,0.0,1gnbb2y
comment,lwakg3k,KAKYBAC,,1,2024-11-09 19:19:04,,,,Laughs in capitalism,,0.0,1gnbb2y
comment,lwas3ke,kamilman,,1,2024-11-09 20:00:06,,,,and he was never heard from or seen ever again,,0.0,1gnbb2y
comment,lwaxfd0,Lord_Dreamweaver,,1,2024-11-09 20:29:33,,,,Any of the kettle makers could do this They want it to break and for us to buy new ones,,0.0,1gnbb2y
comment,lwaxfpt,Memes_Haram,,1,2024-11-09 20:29:36,,,,My posh Dualit kettle already has a replaceable element,,0.0,1gnbb2y
comment,lwaxv6w,wizzard419,,1,2024-11-09 20:31:57,,,,Love the concept but do kettles not last as long in the UK I am using mine several times a day here in the US Morning beverage possibly to brew up iced tea during the day and evening tea and normally they last about 5 years I will say getting a water softener and rO system also helps extend lifespans since the water is is like drinking rocks Now all that being said the idea of selfserviceable appliances is wonderful but I can see a few major unintended issues The first being that unless they become universal parts then you have the issue of supplies being limited possibly unsustainable for companies which then could make the price to fix the kettle more than just buying a new one The other is that this potentially would encourage companies to make their products have shorter lifespans If they know they will get further sales from you it would encourage them to get you to that repair point faster An example of this can be seen in Toyotas with city modes for their engines when you stop the engine shuts off once a certain number of starts the car will throw a repair signal for you to take it in even if its not failing,,0.0,1gnbb2y
comment,lwbglhn,HaHaEpicForTheWin,,1,2024-11-09 22:14:52,,,,Looks like its made of plastic,,0.0,1gnbb2y
comment,lwbikp6,dogma4you,,1,2024-11-09 22:26:13,,,,While Repairability is important manufacturers have this technology already manufactured obsolescence is the problem not repairability challenges,,0.0,1gnbb2y
comment,lwcbwq2,facest,,1,2024-11-10 01:20:16,,,,People also like to own new things and kettles are in that I see it every day and its not an expensive item category so they get replaced long before they disintegrate Ive never had a kettle break and the only busted up kettles Ive ever seen have been at work and those are ancient Kettles are I guess an easy product to apply this to because of their simple design but maybe just replacing electric kettles with stovetop kettles if waste is important is a better idea,lwbikp6,1.0,1gnbb2y
comment,lwbjlcl,DonaldJenkins,,1,2024-11-09 22:32:02,,,,Invents is not the right terms here They should really hire an editor,,0.0,1gnbb2y
comment,lwbkc4o,ZacharyTaylorORR,,1,2024-11-09 22:36:16,,,,now no company will make it in large numbers because if ya sell kettles making them repairable aint in your interest,,0.0,1gnbb2y
comment,lwbm22z,bcyng,,1,2024-11-09 22:46:09,,,,How do u repair the plastic pieces that disintegrate,,0.0,1gnbb2y
comment,lwbm8km,None,,1,2024-11-09 22:47:11,,,,Big Kettle wont like this,,0.0,1gnbb2y
comment,lwbo8pn,agdnan,,1,2024-11-09 22:58:50,,,,Where can I buy one,,0.0,1gnbb2y
comment,lwbrr98,None,,1,2024-11-09 23:19:45,,,,ive never broken a kettle i just get a new one randomly every few years,,0.0,1gnbb2y
comment,lwcli3s,Darkstool,,1,2024-11-10 02:19:25,,,,Im not sure this was a problem The kettle is not ewaste its just regular appliance recycle,,0.0,1gnbb2y
comment,lwcmv4y,nanfanpancam,,1,2024-11-10 02:28:14,,,,I have a ceramic electric kettle from Bella The inside gasket broke They offer no replacement part Very disappointing Do I throw away and working kettle,,0.0,1gnbb2y
comment,lwcpcjh,Kflynn1337,,1,2024-11-10 02:44:28,,,,I think he slightly overestimates most peoples ability with a screwdriver I know people who couldnt change a fuse much less repair a kettle,,0.0,1gnbb2y
comment,lwcw8x3,BlasterPhase,,1,2024-11-10 03:29:31,,,,The main problem causing electrical and electronic waste are shareholders They want bigger numbers every quarter and making things that last or are repairable goes against this notion,,0.0,1gnbb2y
comment,lwcx7ti,chance_encounter4u,,1,2024-11-10 03:36:08,,,,So he made a coffee pot,,0.0,1gnbb2y
comment,lwd3qav,bonesnaps,,1,2024-11-10 04:22:03,,,,That instructional guide in the article did not explain how to fix the kettle yourself Swap a component and send to the manufacturer for refurbishment What,,0.0,1gnbb2y
comment,lwdgqhe,tamagotchiassassin,,1,2024-11-10 06:07:59,,,,Thats a lot of plastic,,0.0,1gnbb2y
comment,lwdju9c,solidaritystorm,,1,2024-11-10 06:37:26,,,,Or we could just produce good that are meant to last rather than break after a year of use But planned obsolescence pays better for our oligarchs,,0.0,1gnbb2y
comment,lwdte44,wolfiasty,,1,2024-11-10 08:16:08,,,,so that student is actually naive or what Electrical goods are made to artificially break down after some time usually right after warranty expires They are built that way on purpose UNLESS someone is actually looking after it cleaning it DIY servicing etc Then it tends to work nicely for much longer than intended and kettle We have one bought for 10 for good 6 years and its been working fine Ofc we do descale it regularly Other thing is producers would not be selling so much stuff if it would be built to last and they would grow much slower,,0.0,1gnbb2y
comment,lwe4ywd,jcacedit,,1,2024-11-10 10:24:53,,,,Go Wildcats,,0.0,1gnbb2y
comment,lwehbsz,TheTwinSet02,,1,2024-11-10 12:30:23,,,,Its a cool design When I first moved out of home we had these ceramic electric kettles with replaceable elements which seems so sensible now,,0.0,1gnbb2y
comment,lwf0bco,fullautohotdog,,1,2024-11-10 14:45:28,,,,my electric kettle is from 1975 Unless you throw it it wont break,,0.0,1gnbb2y
comment,lwf2pif,JollyReading8565,,1,2024-11-10 14:59:24,,,,Big teapot when they catch wind of this teen inventor found shot dead in home,,0.0,1gnbb2y
comment,lwpwviz,allislost77,,1,2024-11-12 08:13:18,,,,I love how this thread got derailed so quickly on how to clean a kettle,,0.0,1gnbb2y
comment,lx2dp6y,6femb0y,,1,2024-11-14 10:15:15,,,,has anyone ever had a kettle break on them i just buy the very cheapest one i can find and it works fine will definitely outlive me,,0.0,1gnbb2y
comment,lw9kbe1,None,,1,2024-11-09 16:05:51,,,,Such a dumb niche idea Will have no impact on discarded consumer electronics,,0.0,1gnbb2y
comment,lwaae1m,Mysterious-Tie7039,,1,2024-11-09 18:25:20,,,,Great until some company buys it and kills it Planned obsolescence and lack of Right to Repair are done by design You wont keep buying replacement things if they last a long time andor you can repair them,,0.0,1gnbb2y
comment,lwavqwe,None,,2,2024-11-09 20:20:22,,,,No one would buy it to kill it they wont need to The price of these would be obscene for the average consumer Sam Vimes Boots theory no one will spend a 100 on a kettle that in 20 hell even 50 years time theyll maybe assuming the company survives be able to buy replacement parts for for 20 30 If needed Not when they can spend 8 at Asda rn to 20 for a kettle that will probably last 5 years with luck 10 Only wealthy people would to feel good about themselves and even then theyd replace it the next time they decorated the kitchen and it no longer matched,lwaae1m,1.0,1gnbb2y
comment,lwb2hnf,theholyraptor,,0,2024-11-09 20:57:05,,,,Are they done by design a little bit But its not the grand conspiracy people love to think Most people want cheap products To hit that level of cheapness designs make sacrifices Take this design Itll cost a lot They are replacing pretty much all the expensive components as the repair So replacement parts will cost almost as much as a new one And this is for an item thats exceedingly simple in design mechanically and electrically A lot of the shitty aspects of electronics for repair is the extreme measures companies go for water proofing and sandwiching the whole product into the smallest form factor possible People care about bulk on their phones and aesethtics And electronics are microscopic these days and require highly specialized knowledge and tools to have any hope of repairing Is their a subsection of the population that wants more dumb products that would be easier to repair Sure But theres many that are either too wealthy too uninterested or would never attempt repairs Do you as a manufacture spend millions to tool up a 2nd product sku for the smaller market Or do you make one that is mostly broadly acceptedpurchased Its mostly economics and design limitations and human preferences not purposeful greed driving these decisions,lwaae1m,1.0,1gnbb2y
comment,lwb4wlz,Mysterious-Tie7039,,2,2024-11-09 21:10:19,,,,You dont think that companies refusing to sell repair parts and work only being able to be performed by an authorized dealer is done by design Apple recently specifically designed their glass on their phones to only be replaceable by Apple stores IIRC this has since been undone Auto dealerships are working towards that same thing forcing out the honest mom pop stores John Deere is purposely making it so farmers are unable to work on their own tractors and instead have to pay for a service tech to come out,lwb2hnf,2.0,1gnbb2y
comment,lwb5pbr,theholyraptor,,0,2024-11-09 21:14:46,,,,I would say the vast majority of issues people encounter is not purposefully done Sure some bad actors exist Cars have become complex computers driving the complexity and cost of parts to test and fix many things up Beyond that I dont see too much forcing you to go to a dealer Ive never gone to a dealer for any work and refuse to do so,lwb4wlz,3.0,1gnbb2y
