type,id,author,title,score,created_utc,url,num_comments,subreddit,body,parent_id,depth,post_id
comment,lwme6nt,Greyboxer,,2,2024-11-11 18:47:11,,,,You gotta admit though that what youre describing is a 1 use case of a person who already has a top 1 of hardware Making it relevant like 1 out of 10000 times,lwmc9yd,4.0,1govhyh
comment,lwmhe8b,GrompIsMyBae,,1,2024-11-11 19:03:32,,,,I really wouldnt go as far as saying its a 1 use case considering how popular competitive games are,lwme6nt,5.0,1govhyh
comment,lwmlid9,Greyboxer,,2,2024-11-11 19:24:25,,,,I think 1 is an overestimation of the rate of truly competitive valorant or CS2 players there are who would notice a 25 performance uplift out of the entire population of 4K players with a 4090,lwmhe8b,6.0,1govhyh
comment,lwnqgt6,iamcts,,0,2024-11-11 22:56:01,,,,This is gold right here Before AMD started dumpstering Intel the only thing Intel fanboys could still hold onto to was single core performance on their 500 CPU Now that AMD beats Intel in nearly all metrics theyre resorting to not needing a good CPU anymore because the price to performance ratio isnt there,lwlx2f0,3.0,1govhyh
comment,lwnss0r,Greyboxer,,1,2024-11-11 23:09:03,,,,who the fuck fanboys anymore is this the core 2 duo days or something its 2024 brother get with the rest of humanity No one fanboys a brand of CPU,lwnqgt6,4.0,1govhyh
comment,lwlwwwo,Greyboxer,,-6,2024-11-11 17:19:45,,,,Lmao being downvoted for quoting from a chart,lwltkas,1.0,1govhyh
comment,lwme4qz,XDenzelMoshingtonX,,7,2024-11-11 18:46:56,,,,Downvoted for at 4K in my case Doesnt mean anything since it fully depends on the games youre playing,lwlwwwo,2.0,1govhyh
comment,lwmloru,i7-4790Que,,4,2024-11-11 19:25:19,,,,Lmao getting buttmad over internet points,lwlwwwo,2.0,1govhyh
