type,id,author,title,score,created_utc,url,num_comments,subreddit,body,parent_id,depth,post_id
post,1govhyh,a_Ninja_b0y,"UserBenchmark faces backlash over Ryzen 7 9800X3D review, suggests 13600K and 14600K instead | ""Spending more on a gaming CPU is often pointless""",889,2024-11-11 15:57:51,https://www.reddit.com/r/gadgets/comments/1govhyh/userbenchmark_faces_backlash_over_ryzen_7_9800x3d/,197.0,gadgets,,,,
comment,lwlolsi,Blunt552,,310,2024-11-11 16:37:04,,,,When does Userclownmark not get backlash They are a literal meme,,0.0,1govhyh
comment,lwm1xsr,cobalt4d,,71,2024-11-11 17:45:23,,,,ppl dont look at the reviews on the side i think most people just look at the benchmarks,lwlolsi,1.0,1govhyh
comment,lwmv0ch,danielv123,,32,2024-11-11 20:12:44,,,,Even then the review text for the 9800x3d admits its far superior to Intels offering telling you to go for a low end chip instead yet when you compare it to the 285k the Intel chip somehow shows as faster on everything but memory latency In my experience the numbers have been very reliable in the past and the flavour text has always been good fun but now I am not so sure anymore How did they get those results,lwm1xsr,2.0,1govhyh
comment,lwnacax,StaysAwakeAllWeek,,41,2024-11-11 21:30:43,,,,Their benchmarks are the most contrived bs you could possibly imagine They used to use a bunch of outdated esports type titles with no intensive games included at all but now afaik its all synthetics that are carefully designed to run best on Intel chips All the info on the site is increasingly outdated because they know they cant update it without making AMD look better,lwmv0ch,3.0,1govhyh
comment,lwo8viz,None,,5,2024-11-12 00:43:02,,,,Does Intel pay Userbenchmark for their promotion Or they are just fanboys,lwnacax,4.0,1govhyh
comment,lwo8znc,StaysAwakeAllWeek,,29,2024-11-12 00:43:42,,,,They are antiAMD not proIntel They bash AMD GPUs too,lwo8viz,5.0,1govhyh
comment,lwpoyi1,Nah_Id__Win,,14,2024-11-12 06:48:45,,,,They are banned from the rintel sub,lwo8viz,5.0,1govhyh
comment,lwxjomw,lo0u,,1,2024-11-13 15:45:46,,,,No They are fanboys for free and not even rIntel wants them there You cant get much lower than that,lwo8viz,5.0,1govhyh
comment,lwnr4ea,None,,0,2024-11-11 22:59:39,,,,I never do Its all about the BMks,lwm1xsr,2.0,1govhyh
comment,lwlhrwl,karatekid430,,449,2024-11-11 16:01:24,,,,I am shook Hasnt it always been an Intel shill,,0.0,1govhyh
comment,lwljndr,mcoombes314,,205,2024-11-11 16:11:14,,,,Not always ie before Zen when Intel were comfortably ahead at everything theyd recommend AMD as a budget option But pretty much as soon as AMD started trading blows with Intel Ryzen 20003000ish UB became what it is now,lwlhrwl,1.0,1govhyh
comment,lwmu4ru,Impossible_Angle752,,10,2024-11-11 20:08:15,,,,Before Intel rolled out DDR4 support that was the correct opinion,lwljndr,2.0,1govhyh
comment,lwljni0,burnSMACKER,,117,2024-11-11 16:11:15,,,,Yes its a dangerous website These articles are just easy things to pump out every new amd chip because its the same story every time,lwlhrwl,1.0,1govhyh
comment,lwlqpgq,101m4n,,58,2024-11-11 16:47:49,,,,Its also oddly anonymous nobody knows who actually runs it,lwljni0,2.0,1govhyh
comment,lwltsvd,dargonmike1,,35,2024-11-11 17:03:42,,,,Its run by the users obviously Its right in the name,lwlqpgq,3.0,1govhyh
comment,lwm0cyc,Igot1forya,,14,2024-11-11 17:37:18,,,,It would be funny if the persons real name was User,lwltsvd,4.0,1govhyh
comment,lwm4skj,QuickQuirk,,3,2024-11-11 17:59:41,,,,Dads name is Elon,lwm0cyc,5.0,1govhyh
comment,lwmj7of,-Badger3-,,3,2024-11-11 19:12:46,,,,Its that guy who put all his grandmas money into INTC,lwlqpgq,3.0,1govhyh
comment,lwmtmsx,101m4n,,3,2024-11-11 20:05:44,,,,F,lwmj7of,4.0,1govhyh
comment,lwls654,burnSMACKER,,3,2024-11-11 16:55:16,,,,The person is surely self aware and knows what theyre doing Anonymity is necessary when dealing with computer fanboys lol,lwlqpgq,3.0,1govhyh
comment,lwm0m4p,101m4n,,36,2024-11-11 17:38:37,,,,I disagree The people in this space who are worthy of respect jz2c gamers nexus ian cutress etc all hold their opinions publicly CPUpro whoever they are knows theyre peddling batshit conspiracy theories and tweaking the numbers in a way that misleads people Its why they dont put their name to anything they say,lwls654,4.0,1govhyh
comment,lwm2qb0,burnSMACKER,,15,2024-11-11 17:49:24,,,,Yes I specifically mean anonymity for outlets who are intentionally misleading consumers Anonymity is paramount for them because theyre complete liars and they themselves know it I just fail to see where the money is for those people,lwm0m4p,5.0,1govhyh
comment,lwmunyw,101m4n,,3,2024-11-11 20:11:00,,,,Ah I see what you mean Thought you were saying tech reviewers needed anonymity to protect them from fanboys,lwm2qb0,6.0,1govhyh
comment,lxhmwnx,shroudedwolf51,,1,2024-11-16 20:51:16,,,,Ill mostly agree with that other than one Jayz2Cents does not deserve the badge of credibility Sure on average they skew sensiblebut they tend to regularly dip into takes and editorializing that is so utterly wild that it makes LTT sound reasonable,lwm0m4p,5.0,1govhyh
comment,lxhweml,101m4n,,2,2024-11-16 21:43:07,,,,He has taken good stances on anticonsumer nonsense in the past so Im alright with him on the whole,lxhmwnx,6.0,1govhyh
comment,lwlr4kk,pukem0n,,42,2024-11-11 16:49:59,,,,Imagine fanboying about fucking CPUs lmao,lwlhrwl,1.0,1govhyh
comment,lwm4kpj,NeuroXc,,10,2024-11-11 17:58:35,,,,You dont fuck CPUs Its the perfect fetish for my 15nm penis,lwlr4kk,2.0,1govhyh
comment,lwm8qzm,JefferzTheGreat,,5,2024-11-11 18:19:47,,,,You should have seen the freakout over a box in the background of a GamersNexus video,lwlr4kk,2.0,1govhyh
comment,lwm097d,ilyich_commies,,14,2024-11-11 17:36:48,,,,It would be kinda embarrassing if they werent taking bribes,lwlr4kk,2.0,1govhyh
comment,lwmik28,SteveThePurpleCat,,2,2024-11-11 19:09:27,,,,When CPUs can cost multiple hundreds of sometimes even thousands and human nature being what it is you will likely tend to back your financial decision pretty hard You are now invested and the other people who chose differently well they are clearly wrong and dumb Not like you a much smarter person,lwlr4kk,2.0,1govhyh
comment,lwm04hz,MineralShadows,,1,2024-11-11 17:36:08,,,,placid subsequent direful mysterious steer offbeat gullible homeless humor complete This post was mass deleted and anonymized with Redact,lwlr4kk,2.0,1govhyh
comment,lwmr10a,QuickQuirk,,6,2024-11-11 19:52:27,,,,you became a CPU fan Stay cool,lwm04hz,3.0,1govhyh
comment,lwmh5kd,karatekid430,,0,2024-11-11 19:02:18,,,,I mean its not inconceivable that Intel be funding it in some way I am not suggesting they are But we all know about big corps sponsoring scientific studies which say food additives are not giving us cancer,lwlr4kk,2.0,1govhyh
comment,lwlr3ps,_EleGiggle_,,-10,2024-11-11 16:49:51,,,,So whats a better alternative that covers every consumer CPU from the last 10 15 years I guess the last 5 years is fine but many of us still have older CPUs and see no reason to upgrade yet It should at least compare a benchmark number and the most important specs Edit Im not sure why Im getting downvotes for asking for an alternative site So apparently this one is inaccurate but asking for an alternative more accurate site is also bad You might have found your reason why UserBenchmark is so popular if you assume everybody knows about this tech drama while the website is number one on Google in the mean time,lwlhrwl,1.0,1govhyh
comment,lwn5xov,stellvia2016,,12,2024-11-11 21:08:21,,,,Toms Hardware and Anandtech both maintained yearly benchmarks for CPUs and GPUs They were the gold standard afaik for written format benchmarks Otherwise there are a number channels that offer benchmark videos on Youtube but that would be more for the last 710 years instead of 1015 UserBenchmark was popular because they shilled the SEO game as hard as they could to be put at the top of results thats all Their numbers were always rather dubious even early on because IPC was what really matters And now even IPC is only part of the picture due to autooverclocking and thermal thresholds,lwlr3ps,2.0,1govhyh
comment,lwndi4y,_EleGiggle_,,2,2024-11-11 21:46:49,,,,Toms Hardware and Anandtech both maintained yearly benchmarks for CPUs and GPUs They were the gold standard afaik for written format benchmarks Thanks Ive used Toms Hardware for a few reviews but I think that was for a TV and a monitor Although I used their Intel i5 2500k over clocking guide I guess thats been a while Did you intentionally write were So they arent anymore End of the Road An AnandTech Farewell Oh I see Thats from August this year Did Toms Hardware change as well At least theres no article about them quitting,lwn5xov,3.0,1govhyh
comment,lwni2lv,stellvia2016,,5,2024-11-11 22:10:31,,,,All of the major tech websites have declined Slashdot used to be a major nerdtech news site for example but its barely hanging on at this point Toms Hardware is still around but its also not what it once was I havent checked in several years if their benchmarks are still there or still relevant Others in this thread mentioned Gamers Nexus puts all the charts from their videos onto their website so thats probably a good place to check And Linus Tech Tips has been standing up their LTT Labs effort for around a year now I think theyre only mostly doing PSU testing currently but it looks like they have some keyboards mice and budget GPUs as well CPUs says coming soon so until then I think their charts are only in their videos,lwndi4y,4.0,1govhyh
comment,lwmhkkj,karatekid430,,4,2024-11-11 19:04:26,,,,I ask you why you would consider any site which provides heavily biased data be desirable to use or better than no data at all,lwlr3ps,2.0,1govhyh
comment,lwmjodb,_EleGiggle_,,6,2024-11-11 19:15:06,,,,What Im just asking for an alternative site that has multiple CPUs listed and can compare them So for example the latest LTT video where they benchmark a single CPU wouldnt count But if someone were to aggregate that data for comparison that would be helpful Their lab site already does this but not for CPUs although for graphic cards power supplys and more Are you saying there is no such alternative Edit Is it an unwritten rule of rgadgets to hate UserBenchmark without providing an alternative,lwmhkkj,3.0,1govhyh
comment,lwmo1ry,TooStrangeForWeird,,9,2024-11-11 19:37:20,,,,works well Plain and simple data Its what I normally use,lwmjodb,4.0,1govhyh
comment,lwmtraf,_EleGiggle_,,0,2024-11-11 20:06:22,,,,Thanks Finally someone who just provides a legit alternative So this site basically does a PassMark benchmark with every CPU and uploads the result,lwmo1ry,5.0,1govhyh
comment,lwnpbu6,TooStrangeForWeird,,2,2024-11-11 22:49:42,,,,Yup If you want something a little more comprehensive you can use CPU monkey Scroll down quite a bit and theres quite a few benchmarks to compare Problem is that theyre often missing benchmarks for some processors These are popular and old enough that theyre filled in pretty well but newer processors and lowmidrange processors sometimes dont get filled in So I still end up using CPU benchmark for quick comparisons,lwmtraf,6.0,1govhyh
comment,lwn19o8,karatekid430,,-3,2024-11-11 20:44:43,,,,I dont have to prove that they exist or provide evidence of a given better alternative The argument I make is that biased or tainted data is not better than having nothing all I do not make any claim to whether an alternative exists or not,lwmjodb,4.0,1govhyh
comment,lwn47ac,_EleGiggle_,,2,2024-11-11 20:59:32,,,,I dont have to prove that they exist or provide evidence of a given better alternative So why did you respond to my question with an unrelated argument while you dont intend to answer my question The argument I make is that biased or tainted data is not better than having nothing all Who claimed that Its like youre making up arguments in your head I do not make any claim to whether an alternative exists or not Again why respond to a question that you dont intent to answer Its the first time I heard about the UserBenchmark website not being trustworthy Ive seen it before of course given its number one on Google lots of the time,lwn19o8,5.0,1govhyh
comment,lwmvcv5,Impossible_Angle752,,1,2024-11-11 20:14:30,,,,Honestly just look up the CPU on YouTube and watch a launch review for whatever CPU from a channel with 1 million subscribers Preferably more Even if youre just looking at a launch review for an older CPU youll get a decent representation of where it stood at that point,lwlr3ps,2.0,1govhyh
comment,lwmvzf5,_EleGiggle_,,2,2024-11-11 20:17:42,,,,Im usually not looking up any CPU model but searching for a replacement for my existing one I want the best CPU for the money I spend and dont care much about Intel or AMD So if a site includes the current availabilities and uses uptodate prices its even better Especially if it considers the benchmark points per so Im getting the most value for my money It should also fit my GPU so Im not accidentally buying a combo where either one does barely any work If I search my current CPU model and replacement Im getting nothing recent because its too old what good are GPU benchmarks if 90 were sold out,lwmvcv5,3.0,1govhyh
comment,lwngck4,stellvia2016,,2,2024-11-11 22:01:25,,,,Most of the YouTube reviews include things like that They show where they stand vs the current gen and usually 12 gens before that Original MSRP vs current prices etc Gamers Nexus even includes charts for stuff like per FPS increase in power vs perf for specific games or usecases etc Plenty of other channels like Jayz Twocents Linus Techtips etc,lwmvzf5,4.0,1govhyh
comment,lwnivym,_EleGiggle_,,1,2024-11-11 22:14:50,,,,If only I were just 1 or 2 gens behind They probably dont produce the new model anymore when Im looking for a new CPU Edit I think I remember my CPU Its a Ryzen 5 2600 from about 2018 Edit 2 As suspected the people asking for a replacement asked in 2022 on sites like Reddit Replacing this CPU usually comes with a motherboard and RAM DDR4 to DDR5 etc,lwngck4,5.0,1govhyh
comment,lwnk4dc,stellvia2016,,3,2024-11-11 22:21:25,,,,Does it really matter at that point then Even AMD only supports a socket for 45 years so at best you could buy a system when the socket was new then buy the last gen of CPU for that socket even if the upgrade happened 67 years later If you only buy new parts at the point youre always building an entirely new system simply look for whatever has the best bang for the buck for your usecase If youre still on AM4 the 5800X3D is still quite a good gaming CPU If youre on Intel then likely you need a full upgrade regardless because they only tend to support 23 years at a time,lwnivym,6.0,1govhyh
comment,lwnkxns,_EleGiggle_,,1,2024-11-11 22:25:46,,,,Kinda Im on a Ryzen 5 2600 with 32 GB DDR4 RAM and an RTX 3060 That was enough for Elden Ring before I finally got a PS5 Do I want to stay on AM4 or upgrade to AM5 or Intel Is my power supply strong enough or should I replace it just to make sure I have a RTX 3060 as well so I could keep that Or another option Do I wait with upgrades and keep gaming on my PS5 instead How does the PS5 compare to a computer What GPU is equivalent Thats why I want to compare my existing CPU like once a year if there was maybe a huge jump in performance that I can get for cheap but it seems like those days are over My first OS was Windows 98 so Ive been doing this for a while Currently Im mainly on my MacBook Air M3 and took a liking to the enormous battery life from an ARM processor So do I want to upgrade my Windows PC at all Edit Told you its no easy question,lwnk4dc,7.0,1govhyh
comment,lwnnjol,stellvia2016,,2,2024-11-11 22:39:56,,,,Really depends on what your budget is Assuming your board supports it you probably have to update the BIOS is all the 5800X3D would probably be double the performance in games compared to your current CPU as per the GN video Which does list the Ryzen5 2600 at the very bottom of the chart That would only cost you around 200ish USD Dont know what country youre in so it might be more Otherwise assuming you kept the same case PSU and storage etc A moboramcpucpu cooler would be around 800900 For you to jump to the 7800X3D or 9800X3D For PSU youd probably want at least a 650W Socket AM5 that the 7800X3D and 9800X3D are on they say will be supported through at least 2027 If youre relatively content with the PS5 Id probably simply drop in the 5800X3D into your current system and call it a day If youre using the stock cooler with the 2600 I would buy a new one for the 5800 Something like the Peerless Assassin 140mm are very solid cheap air coolers that should do a decent job,lwnkxns,8.0,1govhyh
comment,lwnu8qw,_EleGiggle_,,1,2024-11-11 23:17:25,,,,Unfortunately they arent selling the AMD 5800X3D anymore in Austria or Germany so am I supposed to get that one used Amazon and sites that crawl all electronics sellers didnt find a single listing in Austria or Germany Thats the correct listing am I right It just says Derzeit nicht verfügbar which means currently not available not even from third party sellers Im also not sure if this CPU needs more power than my current one I probably forgot to mention that I got a pretty good OC so Im probably not getting that much from the CPU Thats why I already have beefier cooler though A GAMMAXX 400 probably the first version because I just found a V2 and it looks older I definitely appreciate your effort though How much performance should I get from the new CPU on average Because IIRC I overclocked my current one from 34 GHz to a stable 4 GHz on all cores So Im a bit afraid of spending money to get a CPU thats basically the same speed Edit Technically I found a listing for 500 and theyll ship a new CPU sometime between 25 December 2024 and 28 January 2025 Seems like a scalper to me,lwnnjol,9.0,1govhyh
comment,lwnwsve,stellvia2016,,2,2024-11-11 23:32:12,,,,That must be why the GN charts most recently only showed the 5700X3D which is also on that chart So you could get that or a used one if you cant find a new one from Schengen sellers Clock speed doesnt tell you much about CPU performance these days which is why userbenchmarks site is so bad Instructions Per Second per core are what matters Also most games still only use 12 cores so 8 cores vs 1216 doesnt matter for games eg 14900K turbos to 62ghz but gets beat by the 7800X3D that only goes to 54ghz,lwnu8qw,10.0,1govhyh
comment,lwom85o,_EleGiggle_,,1,2024-11-12 02:01:54,,,,Edit I misread what you wrote We were talking about the same card after all The CPU with the lower number 5700X3D is from 2024 although the higher one 5800X3D is from 2022 but better Im not a fan of this CPU naming scheme but its crazy I can still use a socket from a board bought in 2019 for a CPU from 2024 Edit 2 Just to be sure is the Asrock Fatal1ty B450 Gaming K4 making everything out of that CPU Its in the CPU support list but does it use the X 3D VCache as supposed I could get AMD Ryzen 7 5700X3D instead for about 200 Its has CPU Mark score of 26355 instead of the 28302 from the 5800X3D Meanwhile my AMD Ryzen 5 2600 is still at 13189 Would that upgrade be worth it There are some older Ryzen 9 processors with a much higher score for the same price but they dont have the X3D so they arent that good for gaming according to the website I dont see how much that matters though the game benchmarks all used a 5800X3D to achieve more FPS Should I rather not upgrade and wait until the 5800X3D is in stock again Or maybe buy basically a new PC where everything is upgraded except the SSDs,lwnwsve,11.0,1govhyh
comment,lwpiwet,stellvia2016,,2,2024-11-12 05:50:44,,,,The reason for the peculiarity of the 5700X3D coming out in 2024 when the 5800X3D is from 2022 is AMD is using up the remainder of their wafers they purchased for that fabrication size of production They previously released a small amount of 5600X3D as well which were actually rejected 5800X3D where some of the cores were defective So they merely deactivated them and sold the 5600 as a 6 core instead of 8 core CPU I would update the bios just to make sure but it shouldnt have issues with the new one As far as if its worth it Everything else being equal it appears to be broadly a doubling of FPS for most games looking through the various benchmarks in that GN video Assuming were talking 1080p gaming If its not something you use all the time and you dont try to push brand new AAA games at Ultra on like 1440p or something I could see it buying you another 3 years np The alternative is a complete system rebuild of moboramcpu and possibly psu which will cost you 45x as much and be around 20 more fps than the 5800X3D Supposedly the 9800X3D is unlocked to allow overclocking as well but Im not going to count that bc most people wont resort to that,lwom85o,12.0,1govhyh
comment,lwpnb26,_EleGiggle_,,2,2024-11-12 06:32:25,,,,Thanks for the explanation I just ordered the 5700X3D from Amazon and some Noctua NTH2 thermal paste,lwpiwet,13.0,1govhyh
comment,lxc7x01,stellvia2016,,2,2024-11-15 22:13:47,,,,Sure thing Let me know how much FPS uplift it is when you get it installed My friend was poopooing not moving to AM5 but its hard to justify that much extra money for only 2025 more uplift,lwpnb26,14.0,1govhyh
comment,lwlhs2e,Cornflakes_91,,95,2024-11-11 16:01:26,,,,average userbenchmark moment,,0.0,1govhyh
comment,lwlhzv5,heickelrrx,,175,2024-11-11 16:02:34,,,,honestly Techspot should have not write this article Userbenchmark is troll and everyone knew it and we keep giving the site engagement they wanted if we gonna kill Userbenchmark we should make it obscured so it fade away not giving it spotlight,,0.0,1govhyh
comment,lwlku15,fixminer,,135,2024-11-11 16:17:26,,,,We are in an enthusiast bubble We know to avoid UB but if you google processor x vs processor y UB is always one of the top results It is probably one of the main sources of information for casual buyers Articles like this may help to warn more people that UB cant be trusted,lwlhzv5,1.0,1govhyh
comment,lwlosd0,JMacPhoneTime,,36,2024-11-11 16:37:59,,,,Lol I was comparing CPUs awhile ago and wound up there as the first result It said the AMD CPU I was looking at was 50 better than my Intel CPU Then I got to the bottom and read the blurbs It actually helped confirm my decision to upgrade to the AMD It seemed so obviously biased and still said the AMD was much better so I figured it must be a good upgrade,lwlku15,2.0,1govhyh
comment,lwlp9cd,fixminer,,13,2024-11-11 16:40:24,,,,They did change their benchmarks in the past to favor Intel but you can only fudge the data so much,lwlosd0,3.0,1govhyh
comment,lwnbfrt,StaysAwakeAllWeek,,7,2024-11-11 21:36:20,,,,but you can only fudge the data so much Their current favorite fudge is to talk about memory latency and how much it matters in games and how much better it is on Intel cpus And all of that is true but it doesnt change the fact that everything else is better on AMD and the 3d cache literally exists to make it irrelevant There really is no limit to their fudging They are pointing to a number that has been made irrelevant years ago as the sole contributor to gaming performance,lwlp9cd,4.0,1govhyh
comment,lwmr94c,QuickQuirk,,1,2024-11-11 19:53:36,,,,yeap Its always frustrating because the information is quite often inaccurate and its one of the top hits along with some other junk sites,lwlku15,2.0,1govhyh
comment,lxj6yht,shroudedwolf51,,1,2024-11-17 02:27:56,,,,Im not sure Ive ever seen UB not be first search result as well as several subsequent ones Even when I search for a specific website if I search by name rather than use site then UB is right there,lwmr94c,3.0,1govhyh
comment,lxniq1w,QuickQuirk,,1,2024-11-17 21:16:29,,,,Google no longer tells us if the top couple hits are sponsored or not which to me implies that the entire first page of hits is mostly content people have paid to put there UB is likely just throwing money at google to make sure of it Its why google has steadily gotten worse over the past couple years,lxj6yht,4.0,1govhyh
comment,lwm6sz9,heickelrrx,,1,2024-11-11 18:09:53,,,,That is because the tech site always mentioning it The internet is changing if people keep make UB relevant the SOA Algorithm will keep make it relevant,lwlku15,2.0,1govhyh
comment,lwliyji,zoobrix,,38,2024-11-11 16:07:38,,,,You might know that but a lot of people just click on the first performance data site they see and unfortunately thats often userbenchmark Articles like this that spread the word theyre to be avoided are good because they reach more people so they know that the site is BS as well Some people do make purchasing decisions based on few if any sources and warning them about userbenchmark is a good thing,lwlhzv5,1.0,1govhyh
comment,lwlme06,Cuteitch,,7,2024-11-11 16:25:34,,,,What other sites should someone use when looking for quick comparisons between components,lwliyji,2.0,1govhyh
comment,lwlygii,NorysStorys,,9,2024-11-11 17:27:36,,,,Gamersnexus Edit specifically this page,lwlme06,3.0,1govhyh
comment,lwm19qp,Cuteitch,,1,2024-11-11 17:41:57,,,,Awesome I wasnt to far off the mark when suggesting specific CPUs based off their recommendations so thats good to know Ill use them more in the future going forward,lwlygii,4.0,1govhyh
comment,lwmrq51,QuickQuirk,,1,2024-11-11 19:56:01,,,,I had no idea this existed Its never pimped by google in search results since google doesnt get any advertising revenue from the site This is exactly what Ive been looking for for a while And Ive been a long time viewer of their channel too,lwlygii,4.0,1govhyh
comment,lwm4bx2,aw3sum,,2,2024-11-11 17:57:23,,,,cpubenchmark is a more complicated site that has single and multicore scores for a buncha cpus,lwlme06,3.0,1govhyh
