type,id,author,title,score,created_utc,url,num_comments,subreddit,body,parent_id,depth,post_id
comment,lwlr8ox,_EleGiggle_,,-4,2024-11-11 16:50:34,,,,This So whats a better alternative that covers every consumer CPU from the last 10 15 years It should at least compare a benchmark number and the most important specs,lwlme06,3.0,1govhyh
comment,lwloww2,hbkdll,,1,2024-11-11 16:38:38,,,,I agree Iam someone who just recently got interested in comparing benchmarks and sucked various sites and I may have visited ub multiple times But also came to find they are shill and more about them,lwliyji,2.0,1govhyh
comment,lwlltfz,Arlcas,,13,2024-11-11 16:22:37,,,,Userbenchmark is one of the first results when searching comparisons on google no amount of random news site engagement is comparable to that,lwlhzv5,1.0,1govhyh
comment,lwlrqq8,101m4n,,4,2024-11-11 16:53:06,,,,If someone wants to kill user benchmark all they need to do is make a better site,lwlhzv5,1.0,1govhyh
comment,lwln61r,LeCrushinator,,3,2024-11-11 16:29:35,,,,I wouldnt have known about it if it werent for this article Not that I use it anyway but articles like this can help spread the word,lwlhzv5,1.0,1govhyh
comment,lwlnyje,NgonEerie,,-4,2024-11-11 16:33:42,,,,Correct Sadly people have a hard time understanding this,lwlhzv5,1.0,1govhyh
comment,lwm32qt,SaiyanRajat,,21,2024-11-11 17:51:08,,,,Do people still use that nonsense website,,0.0,1govhyh
comment,lwmiy93,SteveThePurpleCat,,27,2024-11-11 19:11:26,,,,Its hard to avoid pretty much the defacto google result for any CPU comparison search,lwm32qt,1.0,1govhyh
comment,lwmbr4u,Bwadark,,18,2024-11-11 18:34:59,,,,Ive used this site in the past Can anyone suggest website alternatives,,0.0,1govhyh
comment,lwojogy,theageofspades,,16,2024-11-12 01:46:48,,,,Unless something has changed Passmark is the gold standard for similar to UB sites,lwmbr4u,1.0,1govhyh
comment,lwp71or,Jubenheim,,7,2024-11-12 04:14:48,,,,In addition to the guys comment below I always checked out YouTube with GamersNexus Theyve never steered me wrong and give great analyses and comparisons,lwmbr4u,1.0,1govhyh
comment,lwo1i9a,DriftMantis,,8,2024-11-11 23:59:53,,,,Its weird because this article is obvious bias However the point about cpus for gaming is not terrible It may make sense to get a lower end or last gen cpu if that raises the gpu budget Reason being is that your more likely to be gpu locked than cpu locked Your cpu can not boost your framerate if its waiting on the gpu I think a fairly balanced build is a good idea The obvious exception to this would be you game at a low resolution or really need to max out refresh rate to some ridiculous level for competitive gaming,,0.0,1govhyh
comment,lwyvsfi,cvelde,,1,2024-11-13 19:49:25,,,,The other obvious exception I find very much worth mentioning is simply games that are cpu bound Be it Simulators like Kerbal space Program strategy and 4x games like Stellaris or Total War colony builders like Rimworld or Dwarf fortress or even just simply Minecraft A surprising amount of games is cpu limited and specifically often limited by a single thread doing the most important stuff The FPS here is mostly secondary instead we care about turn and simulation speeds Measuring FPS in say Stellaris is practically worthless instead a measurement of how long a CPU takes to simulate a year of gametime is a more useful metric Thankfully a few outlets do this recently but there is much room for improvement,lwo1i9a,1.0,1govhyh
comment,lwz9xgv,DriftMantis,,2,2024-11-13 21:01:37,,,,Those are great points youve made There are also real time games like Microsoft flight Sim that are very cpu bound as well that benefit from more expensive cpus even at 4k resolution Its worth noting also that gpus that support frame generation can boost performance in cpu bound games that support that technique However of course they are not real rendered frames so you are not getting the reduced input latency that you would get from just boosting performance using faster cpu hardware unfortunately,lwyvsfi,2.0,1govhyh
comment,lwlk546,uniq_username,,6,2024-11-11 16:13:49,,,,shocked Pikachu,,0.0,1govhyh
comment,lwmkafm,Jamizon1,,5,2024-11-11 19:18:12,,,,Userskidmark,,0.0,1govhyh
comment,lwlk6du,XDenzelMoshingtonX,,17,2024-11-11 16:13:59,,,,I absolutely love this UserBenchmark saga from an entertainment pov,,0.0,1govhyh
comment,lwln4uw,phoenixmatrix,,17,2024-11-11 16:29:25,,,,Havent the benchmark for MH Wild shown its actually very very much worthwhile and thats a game a lot of PC gamers will care about My partner has the exact same PC spec as me except for a 7800x3d I have a 13700k and the difference was nontrivial So 9800x3d vs 13600k sounds like a bad move Ive been an intel shill ever since I stopped using my Athlon to heat up my bedroom back in the days and I just cant anymore,,0.0,1govhyh
comment,lwlniwe,XDenzelMoshingtonX,,30,2024-11-11 16:31:26,,,,UB is a known Intel shill blaming good benchmark results by independent sources on AMD paying them lol,lwln4uw,1.0,1govhyh
comment,lwlny5r,JoeyBigtimes,,3,2024-11-11 16:33:38,,,,Yeah if Intel keeps giving me the runaround with my 13900K RMA Im gonna become an AMD shill At least until Nvidia starts making CPUs,lwln4uw,1.0,1govhyh
comment,lwntsyc,Blue-Thunder,,4,2024-11-11 23:14:53,,,,Im still surprised AMD hasnt sued them out of existence for their lies,,0.0,1govhyh
comment,lwryh4j,Type_Impossible,,3,2024-11-12 17:16:12,,,,well your first mistake was trusting something that UB says,,0.0,1govhyh
comment,lwll6ng,Winterspawn1,,6,2024-11-11 16:19:16,,,,I have very reliable benchmarks that tell me otherwise I see no reason to believe this,,0.0,1govhyh
comment,lwn1s9z,Finlander95,,7,2024-11-11 20:47:21,,,,Its not completely wrong In many cases 7600 or 13600k are superior options if you can use that money for gpu upgrade instead 13600k was extremely cheap and close to 7600 in price in US sometimes,,0.0,1govhyh
comment,lwndaju,Dirty_Dragons,,8,2024-11-11 21:45:43,,,,Yup thats exactly what the actual review says Nevertheless the 13600K and 14600K still deliver almost unparalleled realworld gaming performance for around 200 USD Spending more on a gaming CPU is often pointless as games are generally limited by the GPU in realworld scenarios If you have 1000 to spend on a gaming PC youll get the most bang for you buck by getting a mid high GPU,lwn1s9z,1.0,1govhyh
comment,lwpgl29,ga9213,,4,2024-11-12 05:30:06,,,,Its such a weird choice for me For the x3d chips to make a quantifiable difference you need to be running 1080p But then if youre spending almost 500 on a CPU youre definitely buying a good graphics card and if youre doing that why are you gaming at 1080 and not taking advantage of the massive fidelity boost with 2k or 4k and high refresh rate monitors I went with a 7700x for my 4090 after trying both it and a 7800x3d and at 4k there is no difference Actually I think RDR2 was worse on the 7800x3d,lwndaju,2.0,1govhyh
comment,lwrwog3,Ruty_The_Chicken,,1,2024-11-12 17:06:56,,,,the 9800x3d is clearly much better at 4k than the 7700x the difference only grows with more recent games and the more demanding they are the bigger the difference Besides a lot of these people will be getting the 5090 or whatever its called which will only make a bigger difference,lwpgl29,3.0,1govhyh
comment,lwrwzr3,ga9213,,1,2024-11-12 17:08:34,,,,Do you have a source for the game comparison at 4k between the two CPUs,lwrwog3,4.0,1govhyh
comment,lwv4vac,NeverComments,,1,2024-11-13 03:49:59,,,,why are you gaming at 1080 and not taking advantage of the massive fidelity boost with 2k or 4k and high refresh rate monitors High refresh rate is often a scenario where CPU bottlenecks become an issue since it doesnt matter how fast your GPU can render a frame if your CPU isnt able to prepare frames quickly enough to hit the low frame time targets If youve got a beefy GPU and only 23ms of each frame is render but the CPU takes 12ms to prepare it youre not going to be able to make the jump from 60Hz to 120Hz and beyond without upgrading the CPU thats bottlenecking the system CPU tests are conducted at lower resolutions because it puts the system in a scenario where this is true a high end GPU will crank through a low resolution frame in a short millisecond or two while the bulk of the work falls on the CPU and in a likeforlike comparison that allows us to see how two CPUs perform relative to one another That doesnt mean this only happens at low resolutions though it depends entirely on the game and scene in question CounterStrike 2 is going to be a lot easier to CPU bottleneck at 4k than Alan Wake 2 because the GPU isnt particularly stressed doing 4k renders in the former,lwpgl29,3.0,1govhyh
comment,lwrw0nj,Ruty_The_Chicken,,0,2024-11-12 17:03:28,,,,That is absolutely NOT what the review says besides who the fuck is buying a high end cpu without actually getting a high end gpu People who buy a 9800x3d on release dont have a limited budget theyre looking for the best of the best for each part of the build,lwndaju,2.0,1govhyh
comment,lx6w6nc,Finlander95,,1,2024-11-15 01:54:30,,,,You would be surprised Nowadays many people build for esports so they go like 9800x3d and 7700xt 7800xt even Also many prebuilts often have way beefier cpus than graphic cards,lwrw0nj,3.0,1govhyh
comment,lwp93h4,areyouhungryforapple,,2,2024-11-12 04:29:54,,,,Its genuinely annoying how highly theyre placed in Google searches Such a useless site,,0.0,1govhyh
comment,lwpvda4,thedanyes,,2,2024-11-12 07:56:36,,,,I think the userbenchmark editorial is questionable for sure That said I personally would give up a lot of other specs before I gave up 4k resolution and even a midrange CPU from 23 generations back is nearly never the bottleneck in 4k gaming I know there are those who really vibe on 90 FPS but I have literally never been competitive at firstperson shooters so I can enjoy 90FPS just as well as 480 FPS,,0.0,1govhyh
comment,lwrja1y,iamtheju,,2,2024-11-12 15:57:23,,,,Doesnt Intel currently have a massive issue where they were hiding the fact that the 13th and 14th gen chips were frying themselves in normal use Seems a strange time to recommend them,,0.0,1govhyh
comment,lwn2v3l,Orange152horn3,,1,2024-11-11 20:52:46,,,,Tell that to the new monster hunter game,,0.0,1govhyh
comment,lwo70u0,firedrakes,,1,2024-11-12 00:32:14,,,,Another karma farmer ub title,,0.0,1govhyh
comment,lwq4ssc,Jack123610,,1,2024-11-12 09:44:46,,,,Its been known forever that Userbenchmark is completely worthless and just shills for Intel In fact the owner turns into a bit of a dumb ass if you call him out on it,,0.0,1govhyh
comment,lwv7wwf,karrotwin,,1,2024-11-13 04:11:03,,,,Wait so the evidence that disproves the idea that that buying an expensive CPU for gaming is a bad choice is a benchmark with a fucking RTX 4090 a GPU that almost no one in the real world has Look at the steam survey of what GPUs people actually ownyoull see a bunch of shitty cards like the RTX 3060 at best you get 3060ti3070 type cards The 4090 is less than 1 market share What do you think the difference between a 9800X3D a 13600k or like a fucking 5600x from 4 years ago will be if youre using a RTX 3060,,0.0,1govhyh
comment,lx4zrku,Mormon_Dude,,1,2024-11-14 19:49:47,,,,Honestly at this point Im just here for the clown show Its really entertaining to read these reviews,,0.0,1govhyh
comment,lwpyw7x,mrureaper,,1,2024-11-12 08:36:19,,,,Intel shills are gonna shill Even when given literal shit they will eat it,,0.0,1govhyh
comment,lwq5ia0,Jack123610,,2,2024-11-12 09:52:54,,,,The Intel subreddit doesnt even allow userbenchmark everyone agrees its shit but its the top result if youre just googling comparisons,lwpyw7x,1.0,1govhyh
comment,lwlrcz2,101m4n,,-7,2024-11-11 16:51:10,,,,I hate UB as much as the next guy But devils advocate here he has a point with not needing a top end CPU for gaming Im one of the chumps who bought into trx40 so Im still on zen2 and honestly Ive still not come across anything that doesnt run plenty well enough PS To be clear here Im not advocating for user benchmark I think its a negative force in the industry and i hate that it probably misleads many less informed consumers But the point still stands you dont need a top end CPU for games,,0.0,1govhyh
comment,lwlwsi7,XDenzelMoshingtonX,,7,2024-11-11 17:19:07,,,,point is that the 9800X3D is the best gaming CPU its specifically worse at tasks actual top end CPUs like your TR or even the regular 9950X excel at But yeah if youre the standard AAA gamer whos playing at 4K then youre gonna be GPU bound anyway Completely different story if youre into competitive shooters and running funny shit like 540Hz panels and the likes,lwlrcz2,1.0,1govhyh
comment,lwma66x,_dharwin,,6,2024-11-11 18:26:57,,,,Based on Steams hardware survey I would be shocked if most people were playing at 4k with those GPUs In the US a Ryzen 7 7700x is 270 while a 9800x3d is 480 at MSRP That 210 dollars is about the difference between most levels of GPUs 4060 4070 4070 ti super 4080 super Unless youre targeting 1080p w insane FPS most people would get better performance with the 7700x and getting the next step up GPU Moving between those tiers is roughly 30 performance improvement depending on resolution closer to 15 from 4070 ti super to 80 super A 7700x to 9800x3d is only 10 improvement at 1440p and 13 at 1080p when benchmarked with a 4090 removing as much of a GPU bottleneck as possible In other words if the option is spending 200 more for a 9800x3d or for a higher tier GPU in almost all cases youll get more performance from the better GPU Which is the point UB is making Youre better off spending the money on the GPU rather than the CPU for most gamers,lwlwsi7,2.0,1govhyh
comment,lwmc0gn,XDenzelMoshingtonX,,2,2024-11-11 18:36:17,,,,Yes UB is right in that regard but theyre using it to discredit the 9800X3D which they never did when Intel was still on top A 9900K was just as pointless for the majority of gamers,lwma66x,3.0,1govhyh
comment,lwme9lq,_dharwin,,2,2024-11-11 18:47:37,,,,Im not familiar enough with their history to know I read the actual UB review and its definitely slanted but not for the quotes we often see repeated Saying save money on the CPU for a better GPU is generally good advice Talking about Intel stock performance AMD advertising and recommending the 13600k and 14600k without mentioning the oxidation issues is where I think the review goes off the rails,lwmc0gn,4.0,1govhyh
comment,lwmfqpf,XDenzelMoshingtonX,,4,2024-11-11 18:55:08,,,,Yeah they exclusively use that save money on the CPU phrase when AMD beats intel at the topend of the product line Compare it to the 13900K or 285K reviews where they instead talk about Intels technical advancements or performance uplift from the previous generation,lwme9lq,5.0,1govhyh
comment,lwlzmrm,101m4n,,1,2024-11-11 17:33:37,,,,Aye obviously there are cases where you may want that and Im not disputing that its the fastest CPU for games It definitely is But when you look at CPU benchmark graphs today you see even midrange parts from 4 years ago are still pulling 150 frames or more I bet in 99 of cases getting one of those and dropping the savings on the GPU is going to net better results overall,lwlwsi7,2.0,1govhyh
comment,lwmb31z,SlightlyOffWhiteFire,,0,2024-11-11 18:31:36,,,,But the review didnt say its not the best they said the prices dont justify the benefits Hell i was running AAA games fine on my i5 7600k for the better part of a decade,lwlwsi7,2.0,1govhyh
comment,lwmchrk,XDenzelMoshingtonX,,4,2024-11-11 18:38:45,,,,I mean its a high end CPU lol they are never really justified for gaming Point is that people have been buying i9s for years and UB never made these kind of remarks towards that tier of intel CPUs EDIT just check their review on the 13900K for example absolutely hilarious,lwmb31z,3.0,1govhyh
comment,lwmw9jg,SlightlyOffWhiteFire,,-2,2024-11-11 20:19:09,,,,Honestly I dont think you really have a point It seems to change with each passing comment,lwmchrk,4.0,1govhyh
comment,lwmxx5d,XDenzelMoshingtonX,,2,2024-11-11 20:27:40,,,,Whatever youre saying broski lol,lwmw9jg,5.0,1govhyh
comment,lwn643q,SlightlyOffWhiteFire,,-1,2024-11-11 21:09:15,,,,People have been making that point about i9s since they debuted I distinctly remember having conversations about this back in the 2010s before Ryzens emerged as real competitors to iX cores I think you are just kind of a hack,lwmxx5d,6.0,1govhyh
comment,lwn7csm,XDenzelMoshingtonX,,2,2024-11-11 21:15:35,,,,Yes so what What are you trying to say here broski,lwn643q,7.0,1govhyh
comment,lwnllq5,SlightlyOffWhiteFire,,-1,2024-11-11 22:29:23,,,,Point is that people have been buying i9s for years and UB never made these kind of remarks towards that tier of intel CPUs Hack,lwn7csm,8.0,1govhyh
comment,lwpwjdq,XDenzelMoshingtonX,,2,2024-11-12 08:09:31,,,,thats the German word for Tatar Delicious,lwnllq5,9.0,1govhyh
comment,lxpv1hs,moderngamer327,,0,2024-11-18 06:12:20,,,,It does if you are either running for high refresh setups or are playing CPU bound games like KSP Civ or Stellaris,lwmb31z,3.0,1govhyh
comment,lxr2m7p,SlightlyOffWhiteFire,,1,2024-11-18 13:20:41,,,,You can play all three of those games on toasters,lxpv1hs,4.0,1govhyh
comment,lxrj515,moderngamer327,,1,2024-11-18 15:04:17,,,,Not enjoyably KSP especially with bigger rockets is awful on a low end CPU Civ can takes minutes between turns in the late game,lxr2m7p,5.0,1govhyh
comment,lwm27k4,ilyich_commies,,4,2024-11-11 17:46:45,,,,I have a ryzen 7 5700x3d and I literally cannot imagine needing something more powerful unless I was professional competitive fps player It easily keeps up with my 3090 and would probably do just fine with a 4090,lwlrcz2,1.0,1govhyh
comment,lwmu4n6,101m4n,,1,2024-11-11 20:08:14,,,,I have a friend with a 5800x3d and hes in the same boat Im not sure why people seem to think this is a controversial statement,lwm27k4,2.0,1govhyh
comment,lwlz6vp,Sk1-ba-bop-ba-dop-bo,,1,2024-11-11 17:31:22,,,,it depends though with the performance of the latest ryzen chips it really is just worth grabbing an X3D chip if you have the money for it not so much for maximum FPS as much as the 1 lows but honestly devils advocate is misplaced here that site has been tampered with so much that even inteltointel comparisons used to be messed up,lwlrcz2,1.0,1govhyh
comment,lwmanv5,SlightlyOffWhiteFire,,2,2024-11-11 18:29:26,,,,If you have the money is pulling a looot of weight there We are talking a 400 dollar difference Even to people with a good salary thats a significant difference I also agree that userbenchmark is garbage but hasnt it been general wisdom for a long time now that you dont need to pour money into your cpu for gaming Looking around at other tech reviewers talking about these chips its not even like userbenchmark is really going against the grain The consensus seems to being going with the 9000x3d series over i13000 or i14000 is a lot of extra money for disproportional gains,lwlz6vp,2.0,1govhyh
comment,lwmfacr,XDenzelMoshingtonX,,2,2024-11-11 18:52:49,,,,There are a lot of cases where a system with a stronger CPU can make sense Any competitive FPS game valo cs apex etc profits greatly from the vcache MSFS does greatly the countless of sim racing games all do etc So not exactly niche games overall Youre probably getting better performance with a 9800X3D and a 4070 than a 9700X and a 4080S or 4090 Sure your AAA ultra settings timmies are never gonna see those gains,lwmanv5,3.0,1govhyh
comment,lwmylij,SlightlyOffWhiteFire,,1,2024-11-11 20:31:07,,,,I feel like you are drastically overestimating the demographic size of people who play those games so competitively that they will spend an extra 400 dollars on a cpu to eek out milliseconds of reaction time,lwmfacr,4.0,1govhyh
comment,lwn02t0,XDenzelMoshingtonX,,0,2024-11-11 20:38:40,,,,And I think you are drastically underestimating it lol,lwmylij,5.0,1govhyh
comment,lwn5c64,SlightlyOffWhiteFire,,1,2024-11-11 21:05:20,,,,I think you need to leave the gamer space for a sec,lwn02t0,6.0,1govhyh
comment,lwn5qr3,XDenzelMoshingtonX,,0,2024-11-11 21:07:22,,,,No thank you buddy,lwn5c64,7.0,1govhyh
comment,lwn697o,SlightlyOffWhiteFire,,1,2024-11-11 21:09:59,,,,You know computers are for more than just gaming right,lwn5qr3,8.0,1govhyh
comment,lwn752v,XDenzelMoshingtonX,,1,2024-11-11 21:14:30,,,,Yes but the 9800X3D is specifically designed for gaming its the whole point of the CPU,lwn697o,9.0,1govhyh
comment,lwnlo83,SlightlyOffWhiteFire,,1,2024-11-11 22:29:46,,,,Youve more than lost the plot,lwn752v,10.0,1govhyh
comment,lwpwhl1,XDenzelMoshingtonX,,0,2024-11-12 08:08:58,,,,the keeper of the trve hardware conversation has spoken,lwnlo83,11.0,1govhyh
comment,lwqip2l,SlightlyOffWhiteFire,,1,2024-11-12 12:05:28,,,,Man you need therapy Have a good one,lwpwhl1,12.0,1govhyh
comment,lwqom8r,XDenzelMoshingtonX,,0,2024-11-12 12:51:41,,,,thank you you too,lwqip2l,13.0,1govhyh
comment,lwntycn,BranTheUnboiled,,2,2024-11-11 23:15:45,,,,400 dollar difference compared to what You mention later the i5 Microcenter has the i514400 for 200 the i514600k for 230 and the 9800x3d for 480 I would compare it to an i7 which is 310 or 330,lwmanv5,3.0,1govhyh
comment,lwnwya8,SlightlyOffWhiteFire,,0,2024-11-11 23:33:06,,,,The article is about the 13th and 14th gen 600 series And either way you have to get all the i9s to get into the same price bracket,lwntycn,4.0,1govhyh
comment,lwnzykq,BranTheUnboiled,,0,2024-11-11 23:50:50,,,,The article is about the 13th and 14th gen 600 series Yes And then I listed the 14600k and showed it was not a 400 difference,lwnwya8,5.0,1govhyh
comment,lwmggt1,Sk1-ba-bop-ba-dop-bo,,0,2024-11-11 18:58:49,,,,and thats part of the problem I think youd still be better off with AMD chips of comparable tiers so nonx3d options right now if youd like to stay within budget Intel is that cooked,lwmanv5,3.0,1govhyh
comment,lwmy4i0,SlightlyOffWhiteFire,,1,2024-11-11 20:28:42,,,,I was recently shopping for exactly that price range of cpu and none of the tech websites I checked preferred the Ryzens over the i5s They tended to lean towards the i5s but not particularly strongly mostly leaving it up to a few nuances in user preference So honestly what youre saying here sounds more like fanboying,lwmggt1,4.0,1govhyh
comment,lwnwndb,zoiks66,,0,2024-11-11 23:31:18,,,,YouTube and Reddit are funny places when it comes to CPUs and PCs in general Their users dont understand what a small blip gamers are for overall PC sales Intel has about 80 of the overall client PC market No corporate IT department wants to buy a desktop or laptop with an AMD CPU as it would mean having to manage clients with nonIntel chip onboard Ethernet and WiFi chips Reddit and YouTube are full of people screaming at each other over 3 performance difference between CPUs when in reality those performance differences have effectively no effect upon CPU sales numbers,,0.0,1govhyh
comment,lxpv960,moderngamer327,,1,2024-11-18 06:14:19,,,,It departments are not going to care what CPU is in a computer in the vast majority of cases Also AMD has been gaining a lot of market share especially in the Mobile department,lwnwndb,1.0,1govhyh
comment,lwmoasz,burito23,,0,2024-11-11 19:38:37,,,,Well in reality yes Gaming performance is kind of saturating now If a game can go 2000FPS would you even notice it from 144 FPS Save your money,,0.0,1govhyh
comment,lxpvb1s,moderngamer327,,1,2024-11-18 06:14:48,,,,Still useful in CPU bound games or if you need it for other CPU heavy tasks,lwmoasz,1.0,1govhyh
comment,lwltkas,Greyboxer,,-18,2024-11-11 17:02:28,,,,Outrage brigade aside theyre right tho At 4K its 25 faster than a 13600k according to techpowerups charts Edit the outrage brigade found me,,0.0,1govhyh
comment,lwlwbp9,otaconucf,,15,2024-11-11 17:16:42,,,,Because at 4k your performance is being limited more by your graphics card than your CPU This is why the performance gains are higher at lower resolutions where the GPU stops being the bottleneck on performance,lwltkas,1.0,1govhyh
comment,lwnetkq,Dirty_Dragons,,1,2024-11-11 21:53:34,,,,This is why the performance gains are higher at lower resolutions Which is irrelevant if you are gaming at 4k I dont plan to ever game at 1080p again so I just dont care how many FPS games get at that resolution,lwlwbp9,2.0,1govhyh
comment,lx0vn8u,UglyFrustratedppl,,2,2024-11-14 02:26:16,,,,Its not irrelevant The CPU performance is still there just hidden under a bottleneck As graphics cards get better overtime more of the CPU gets utilized Somebody who bought a cheap CPU to run 4K might eventually find that its not able to keep up in terms of futureproofing,lwnetkq,3.0,1govhyh
comment,lwm7729,Rxyro,,0,2024-11-11 18:11:51,,,,It depends on your game heavily,lwlwbp9,2.0,1govhyh
comment,lwlx2f0,Greyboxer,,-14,2024-11-11 17:20:31,,,,Did you feel like you needed to explain that to me for some reason Anyone with 4K and a 4090 doesnt need a 9800x3d or anything more than a midrange cpu Gains are minimal Its blatantly obvious The point is theres no reason outside of a uplift near margin of error to upgrade your CPU to the highest of high end when youre already at 4K with a 4090,lwlwbp9,2.0,1govhyh
comment,lxpvg1n,moderngamer327,,1,2024-11-18 06:16:04,,,,There are still plenty of games that are bottlenecked by the CPU at 4K,lwlx2f0,3.0,1govhyh
comment,lwmc9yd,GrompIsMyBae,,1,2024-11-11 18:37:38,,,,Its not blatantly obvious nothing stops a person with a 4090 and a 4K monitor from playing say competitive CS2 or Valorant in which case X3D CPUs are MUCH better than any i5 out there because those games are CPU bottlenecked even at 4K That said I somewhat agree with your sentiment somewhat,lwlx2f0,3.0,1govhyh
