type,id,author,title,score,created_utc,url,num_comments,subreddit,body,parent_id,depth,post_id
comment,lxxh3w0,Dwarfinator1,,2,2024-11-19 14:19:00,,,,As a disabled person who cant just up and walkdrive to the post office the shit that FedEx person did is astronomically infuriating I had a recent encounter with DHL just refusing to fucking deliver or even come to our apartment it was so fucking annoying,lxsvxnt,3.0,1gu72uh
comment,lxy440d,LetThemEatVeganCake,,2,2024-11-19 16:22:07,,,,When I ordered mine through ATT FedEx didnt even try to take it to my house They just sent it to a distribution center and made me go there to pick it up No notification that I needed to do that or anything I only noticed because I went snooping on the tracking info wondering where it was The guy at FedEx said they had too many stolen so werent even attempting delivery anymore for any phones from ATT since they wont pay for signature service It wasnt neighborhoodspecific either just everything coming out of that distribution center,lxsvxnt,3.0,1gu72uh
comment,lxvekzs,PocketNicks,,0,2024-11-19 03:36:20,,,,I get almost all my packages delivered to my local post office about a 3 minute walk from my home Theres always someone there to sign for it no missed delivery Doesnt cost me anything I grt an email notification from the post office within minutes of the delivery and I can pick it up same day if I get there before they close,lxsvxnt,3.0,1gu72uh
comment,lxwrqjw,mkhush02,,3,2024-11-19 11:14:27,,,,We here have a thing called open box delivery where the delivery person opens it right in front of you and then you can choose wether to accept it or not,lxruy0w,2.0,1gu72uh
comment,lxrtn8z,Nacho_Dan677,,82,2024-11-18 16:01:39,,,,FedEx drivers in the US could literally see you and still not care and mark it as a missed delivery I dont think in the US a driver will ever be forced or feel that they have to actually deliver the package until they are paid more,lxrq7tu,1.0,1gu72uh
comment,lxs5d9n,Drone314,,27,2024-11-18 17:02:07,,,,Literally yesterday I was standing outside of my garage and the fedex guy pulled in front of my mailbox and bumped the package in the flower bed Like dudeIm standing right there They are the worst,lxrtn8z,2.0,1gu72uh
comment,lxs5q3o,Pauly_Amorous,,13,2024-11-18 17:03:57,,,,I live in an apartment complex where the front office doesnt accept packages If packages arent small enough to fit in the mail room lockers drivers just leave packages by the door and 99 of the time they dont knock So if you dont work from home like I do you could have a 1000 phone just sitting out in the breezeway for hours,lxrtn8z,2.0,1gu72uh
comment,lxrwv0n,trainbrain27,,34,2024-11-18 16:18:39,,,,There are several layers between FedEx and the folks that refuse to deliver your packages Theyve intentionally subcontracted it out so much that they can either dodge responsibility or make you talk to AIs and underpaid undertrained call center workers until you give up,lxrtn8z,2.0,1gu72uh
comment,lxv0tnv,Swastik496,,4,2024-11-19 02:12:12,,,,good thing its not your problem Chargeback and make it the merchants problem Their lawyers will deal with Fedexs lawyers if package theft becomes a big enough issue,lxrwv0n,3.0,1gu72uh
comment,lxviwkf,StateChemist,,3,2024-11-19 04:04:41,,,,At work we use UPS and FedEx both Literally all of our bullshit complaints are on Fedex,lxrtn8z,2.0,1gu72uh
comment,lxt8rnc,None,,5,2024-11-18 20:20:27,,,,Half the time any mail carriers coming through on a Sunday will just mark that the mailbox was inaccessible and not even drive down our street Its wild that the employees for these companies have gotten so obviously lazy when nowadays every house has a camera out front I guess that footage would have an impact if they allowed you to share it No one lets you report issues with your driver I guess its cheaper to put in an insurance claim here and there for package issues than it is to hire enough people to keep your business reputable,lxrtn8z,2.0,1gu72uh
comment,lxt9jgw,Nacho_Dan677,,1,2024-11-18 20:24:22,,,,Its not even about hiring enough people People just simply arent compensated enough as prices go up While I dont like not receiving what I paid for I certainly also do dislike not getting paid enough more Its wrong for them to do but with potentially unrealistic delivery goals and driving times I can certainly see why some drivers may choose to mark something as not delivered mailbox inaccessible,lxt8rnc,3.0,1gu72uh
comment,lxvb175,ExpatMeNow,,4,2024-11-19 03:13:40,,,,Ive got 2 phones sitting in the Fed Ex place that I have to go and get myself tomorrow because twice now they claimed to have attempted delivery Like fuck they did Im home all day and have a ring doorbell as well Liars,lxrtn8z,2.0,1gu72uh
comment,lxta98w,Hopeful-Sir-2018,,5,2024-11-18 20:28:01,,,,Im in Texas Apple usually requires you to sign at the door Ive had them leave it at the door and sign my own name on my behalf Locally one dude caught a USPS dude signing peoples names and not even stopping Just outright stealing it Its fuckin wild,lxrq7tu,1.0,1gu72uh
comment,lxy953p,BusyUrl,,1,2024-11-19 16:47:13,,,,Im in Texas also and our mailman is legend for just not trying to get a signature and tossing shit in the box or at the door anyway Drives me crazy,lxta98w,2.0,1gu72uh
comment,lxrvj0x,None,,0,2024-11-18 16:11:39,,,,That would be seen as weird in US We dont want to be bothered Being forced to answer the door to accept a package is against one of the constitutional amendments or 10 commandments Something like that,lxrq7tu,1.0,1gu72uh
comment,lxrrexv,mobrocket,,1,2024-11-18 15:49:48,,,,Probably enough usually than paying for a signature This spike might change that,lxrq7tu,1.0,1gu72uh
comment,lxuy59y,WeeklyBanEvasion,,1,2024-11-19 01:56:19,,,,Most people arent home during the day to accept a package but they could ship it to a nearby store,lxrq7tu,1.0,1gu72uh
comment,lxve6s8,PocketNicks,,1,2024-11-19 03:33:49,,,,I live in Canada and in the last 20 years Ive never had a delivery left at my door Always in hand or they leave it at the post office for me to collect Never had a package stolen only had 2 packages go missing and the sellers replaced them,lxrq7tu,1.0,1gu72uh
comment,lxvz2ym,CarryOnRTW,,2,2024-11-19 06:11:30,,,,I live in Canada and in the last 20 years Ive had at least 30 packages left at the door Never had a package stolen or missing I do know people here who have though,lxve6s8,2.0,1gu72uh
comment,lxwmtyu,PocketNicks,,1,2024-11-19 10:23:52,,,,Probably depends where you live Ive always lived in a city where a package would easily be seen by 100 people walking past in the first hour it was left on a doorstep No chance it gets left there I know plenty of people in suburbia that have your experience though,lxvz2ym,3.0,1gu72uh
comment,lxte7aw,VirtualLife76,,1,2024-11-18 20:48:00,,,,It would cost a bunch What happens of they are not home and the time it takes to wait for someone to answer the door both add up to a lot of time when its X1000 doors Especially since they have more packages than they can deliver in a day anyway,lxrq7tu,1.0,1gu72uh
comment,lxup6mv,ernyc3777,,0,2024-11-19 01:04:51,,,,FedEx and UPS delivery drivers are highly compensated but theyre also highly scrutinized so they are often rushing to get their deliveries done Also the companies dont require signatures I guess,lxrq7tu,1.0,1gu72uh
comment,lxv4l6e,the_Q_spice,,1,2024-11-19 02:34:43,,,,I wouldnt say highly FedEx Express gets paid better than GroundHome who arent even corporate employees UPS is a pretty mixed bag At FedEx Express we are rushing because unlike basically anyone else all our deliveries have deadlines within a day 0930 or earlier in some markets 1030 12001330 1700 and 20002200 and if we fail to meet them the customer gets a full refund,lxup6mv,2.0,1gu72uh
comment,lxv8zw4,ernyc3777,,0,2024-11-19 03:01:02,,,,I have several friends who work for UPS and theyre all pulling in around 100k less than 5 years in And thus FedEx is pretty competitive Maybe a stronger union here than other areas,lxv4l6e,3.0,1gu72uh
comment,lxvb33w,ruffznap,,2,2024-11-19 03:14:01,,,,The VAST majority of UPS employees arent making anywhere NEAR 100kyr The folks who are are VERY lucky,lxv8zw4,4.0,1gu72uh
comment,lxwisp1,hughk,,2,2024-11-19 09:39:39,,,,Depends on how many iPhones they can sell,lxvb33w,5.0,1gu72uh
comment,lxsip5v,sbvp,,131,2024-11-18 18:09:04,,,,My new but defective iPhone 14 pro was sent back to apple for an applecare replacement and I received an email later saying they received an empty box and I would be charged 1K plus I was worried about this happening so after resetting it i signed in to just enable FMI before sending it back and sent applecare a screenshot from FMI maps of it in a random street near the UPS hub in the city i sent it back to Applecare released the hold I think a ups driver stole it,,0.0,1gu72uh
comment,lxsxsl1,None,,68,2024-11-18 19:24:40,,,,Thieves gonna steal but theres something extra ballsy about stealing items with global tracking built right into them Maybe if there were some actually penalties to it it might make people hesitate,lxsip5v,1.0,1gu72uh
comment,lxtfysh,sbvp,,40,2024-11-18 20:56:46,,,,Apple required fmi to be disabled in order to create a return or exchange But once the return was created fmi can be turned back on So I did Most people do not though,lxsxsl1,2.0,1gu72uh
comment,lxv7e1j,incubusfox,,8,2024-11-19 02:51:25,,,,I think a ups driver stole it I dont understand this fascination people have with blaming people who are working a career making bank that took them years to achieve Did a warehouse worker steal it Probably we have a constant turnover in our warehouses and theres always idiots who dont consider the benefits of the job theyre throwing away Did a driver lol fuck no a first year driver brings home enough to buy one every week by year 4 when they top out their salary has more than doubled,lxsip5v,1.0,1gu72uh
comment,lxvbenz,OfficialUberZ,,17,2024-11-19 03:16:02,,,,A first year driver earns enough to buy one a week yet they have been working years to achieve it People steal shit they could easily afford all the time,lxv7e1j,2.0,1gu72uh
comment,lxve1cm,incubusfox,,6,2024-11-19 03:32:51,,,,Unless no one else in the building wants to drive they can only hire 1 outside person to become a driver for every 6 people they hire from inside the building So yes almost all UPS drivers have waited years to go driving while toiling away in the warehouse,lxvbenz,3.0,1gu72uh
comment,ly5sbxs,sbvp,,1,2024-11-20 22:01:36,,,,I mainly was thinking from the perspective of an apple employee that It likely would not have happened once the box arrived at the applecare warehouse I suppose somewhere between coming off the plane and going onto the UPS truck for delivery would make the most sense My bad,lxv7e1j,2.0,1gu72uh
comment,lxrqnv9,Delayed_Wireless,,48,2024-11-18 15:45:49,,,,Reason why I pay for a private mailbox My items will be there safely until I pick them up,,0.0,1gu72uh
comment,lxs419m,joshuag71,,24,2024-11-18 16:55:20,,,,Im aware this obviously doesnt work for everyone but I always have anything of any real value delivered to me at work not at home Had a couple packages go missing and just said screw it Im at work during the day so I might as well just have these things delivered to where I am at the time instead of where Im going to be later,lxrqnv9,1.0,1gu72uh
comment,lxuaw2h,LetsJerkCircular,,5,2024-11-18 23:41:48,,,,Same Im at work five days a week On the offchance that anything is delivered when Im not there the coworker who gets it texts me and puts it in my locker If it gets delivered to the house its sitting on the stoop all day or I come home to the old sorry we missed you sticker,lxs419m,2.0,1gu72uh
comment,lxsz7ck,VaporCarpet,,7,2024-11-18 19:31:44,,,,You can also go to the store for your new phone And you dont have to wait for shipping,lxrqnv9,1.0,1gu72uh
comment,m0ldhvg,as_i_wander,,1,2024-12-05 20:13:59,,,,Last time I bought a phone my carrier would not allow store pickup option only delivery much to my dismay so thats not always possible,lxsz7ck,2.0,1gu72uh
comment,lxrnulx,spikeember,,69,2024-11-18 15:30:36,,,,Why not change the name back to theirs Porch pirates is too polite,,0.0,1gu72uh
comment,lxrqc4q,arwinda,,50,2024-11-18 15:44:05,,,,thieves,lxrnulx,1.0,1gu72uh
comment,lxrr78m,cmfreeman,,50,2024-11-18 15:48:40,,,,Wild solution here Require signatures,,0.0,1gu72uh
comment,lxs2h9m,ChafterMies,,59,2024-11-18 16:47:30,,,,The drivers wont even knock Ill be home all day and theyll leave a note that says failed delivery They are incentivized to make time and not happy customers,lxrr78m,1.0,1gu72uh
comment,lxv8ws9,incubusfox,,6,2024-11-19 03:00:30,,,,As a driver this is a mixed bag I knocked on a door on Friday for a pickup her Ring camera saw me her dogs heard me and barked my supervisor witnessed it while standing by the package car yet she still yelled at me when I was delivering my next stop 4 houses down about how I didnt knock,lxs2h9m,2.0,1gu72uh
comment,lxsby89,lump77777,,25,2024-11-18 17:35:20,,,,Ive watched my mailman from my front windows put a failed delivery slip in my mailbox when its cold or rainy out,lxrr78m,1.0,1gu72uh
comment,lxsgtmi,This_aint_my_real_ac,,6,2024-11-18 17:59:33,,,,Saw mine out in front to deliver my package let them do the job and went to the porch to get it Nothing Checked the tracking yup delivered to mailbox We have community mail boxes in one location for 20 or so houses Okay but why stop in front of my house Grab the mailbox key and head out the door Package was sitting smack dab in the middle of my driveway,lxsby89,2.0,1gu72uh
comment,lzvuz1e,StandUpForYourWights,,1,2024-12-01 15:54:29,,,,My guy drives all the way down my 400 foot driveway knocks and waits If we arent home he signs for me and puts it in the stash box I built for him Hes fucking awesome I love you Canada Post guy whose name I wont divulge,lxsgtmi,3.0,1gu72uh
comment,lxrt7ob,Menn1021,,6,2024-11-18 15:59:21,,,,Ive seen videos where the guy walks up to the door and signs for it and leaves,lxrr78m,1.0,1gu72uh
comment,lxuptcx,allllusernamestaken,,1,2024-11-19 01:08:33,,,,my new problem is that FedEx drivers will mark my packages as signed for and then drop them at the mailbox,lxrr78m,1.0,1gu72uh
comment,lxx19oo,edvek,,1,2024-11-19 12:35:40,,,,That prevents nothing Ive had items that required a signature and the driver walks up scans and drop my package and leaves They didnt get a signature they faked itlied And Ive had times where it was required and they posted a missed delivery slip and Im home Cars in the driveway and everything You will neve beat lazyemployees who dont care The only solution to that is have a policy that states if a signature is required and you dont get one and theres proof of it like video camera you will be immediately terminated and blacklisted for life Obviously this will never happen I had an issue with UPS and a package said signature needed I got an update as undelivered The guy never even came to my house I called UPS to let them know and they said the supervisor will look into it and call you Never called I understand everyone there is very busy and under a lot of pressure but one thing I cannot tolerate are lies If an employee is willing to lie for something small theyre willing to lie all the time to keep their job,lxrr78m,1.0,1gu72uh
comment,lxuz6cq,WeeklyBanEvasion,,-2,2024-11-19 02:02:22,,,,Could you imagine the number of angry iPhone users upset that they keep missing their phone delivery,lxrr78m,1.0,1gu72uh
comment,lxspce1,FrenzalRhomb1,,7,2024-11-18 18:42:28,,,,Heres my thoughts on this as someone that orders iPhones from ATT for work a lot When you place the order you get an email confirmation with the address and Fedex tracking number the only way to know the address is thru this email the tracking number when checked on fedexcom just says the city and the approx delivery time of by 530 pm for example I suspect these theives have access to Fedexs internal systems and can see the sender is ATT and obviously the recipients address they would also have more info on the drivers route to know more closely the delivery time so they dont have to sit in front of a random house for 8 hours the package label doesnt say it is from ATT its just some random address Also I was accepting a large iPad delivery from a Fedex driver at work and I said to him yay the iPads finally arrived and he told me to never tell a Fedex employee that as some of them will steal valuable items,,0.0,1gu72uh
comment,lxum2hd,khag,,1,2024-11-19 00:46:35,,,,Yeah I personally think the insiders selling information are in FedEx not ATT,lxspce1,1.0,1gu72uh
comment,lxv66lq,the_Q_spice,,1,2024-11-19 02:44:17,,,,Yall do realize we have literally no info on what is inside boxes right I only know a few warehouse addresses that Apple sends stuff from because recipients told me what it was but then again we also get medical devices and other random stuff from those same warehouse addresses The only time we know is if it is an international shipment because the shipper has to provide an itemized customs invoice At least at my station we also have only been getting 1 companys devices stolen how they tracked this issue ATTs So if we or UPS are at fault please explain why only 1 company is being affected when we deliver for all of them,lxspce1,1.0,1gu72uh
comment,lxt500i,Numerous-Loquat-1161,,10,2024-11-18 20:01:01,,,,They are following FedEx drivers Neighbor just had two phones stolen within minutes of the delivery,,0.0,1gu72uh
comment,lxtvxrq,GregAbbottsTinyPenis,,6,2024-11-18 22:18:10,,,,They are working with delivery drivers ftfy,lxt500i,1.0,1gu72uh
comment,lxsa4ge,aaronhayes26,,9,2024-11-18 17:26:10,,,,Why would you ever steal an iPhone These can all be remotely bricked at this point can they not,,0.0,1gu72uh
comment,lxsf9lc,ImSoRude,,18,2024-11-18 17:51:48,,,,Most stolen phones are used for parts locked software doesnt mean shit if youre being stripped for internals,lxsa4ge,1.0,1gu72uh
comment,lxsy44h,Drtysouth205,,16,2024-11-18 19:26:17,,,,Most of the important parts of the iPhone are serialized and are actually disabled also Its why the right to repair ppl get mad at Apple alot,lxsf9lc,2.0,1gu72uh
comment,lxuf8hp,Candle1ight,,4,2024-11-19 00:07:00,,,,The disable is only respected in the west theyre sold in China,lxsy44h,3.0,1gu72uh
comment,lxtvux0,GregAbbottsTinyPenis,,5,2024-11-18 22:17:44,,,,Carriers can get them blocked from the major North American networks Send it out of US MX or CA service areas and you can get around it DHS gets involved with these device theft rings a decent amount,lxsa4ge,1.0,1gu72uh
comment,lxsaexe,nearcatch,,1,2024-11-18 17:27:38,,,,The remote brick I think only works if the carrier respects it and apparently Chinese carriers dont,lxsa4ge,1.0,1gu72uh
comment,lxtrc9b,I_Hate_Traffic,,4,2024-11-18 21:54:08,,,,We got an iPad stolen in 10 minutes after delivery and we never had this issue before getting constant packages from Amazon Some shady stuff Either FedEx employees are in it or someone else knows whats in these boxes,,0.0,1gu72uh
comment,lxv5swz,steve_mobileappdev,,4,2024-11-19 02:42:01,,,,I have a level of packagetheft paranoia thats a little compulsive Ive got a cheap 25 lightbulb style cam looking outside and on the morning that Im expecting any delivery that day I carry my iPad everywhere from kitchen to bathroom to office keeping a lookout for a truck pulling up When that happens As soon as I look out my front door window and see them walk back to the truck after delivering to avoid imposing on them any kind of unwanted social stress I open the door promptly and receive package,,0.0,1gu72uh
comment,lxru07m,Ok-Seaworthiness4488,,6,2024-11-18 16:03:33,,,,New ATT jingle reach out and steal someones iPhone,,0.0,1gu72uh
comment,lxtvld3,GregAbbottsTinyPenis,,1,2024-11-18 22:16:18,,,,I worked in a phone stores for several years This happens with every carrier Thieves arent using carrier data to track phones Thieves are working with drivers they follow and take packages immediately after delivery The packages are incredibly easily identifiable Its difficult to breach a system remotely and have someone on the ground to intercept a package in perfect timing Its simple to have a driver send a text to let someone know they have devices on their route,lxru07m,1.0,1gu72uh
comment,lxuaxb7,What-the-Gank,,3,2024-11-18 23:42:00,,,,This is why you get important items deliver your work place if its practical to do so My boss gets alot of packages this time of year for Xmas prep,,0.0,1gu72uh
comment,lxw152v,ttak82,,1,2024-11-19 06:30:42,,,,Agreed with this It sucks in cases where you rely on company transit to go home and the delivery guy is coming after office hours Have to constantly remind them to deliver in the right time,lxuaxb7,1.0,1gu72uh
comment,lxw7738,firebuttman,,2,2024-11-19 07:31:04,,,,Retail stores are the source of much of the SIMswap fraud Theres a huge turnover because once they get caught they are fired Does not matter if an account is password protected Managers are in on the fraud or the bad guys find the managers creds and get access Another way is social engineering the customer care reps,,0.0,1gu72uh
comment,lxx5jdy,minarima,,2,2024-11-19 13:06:05,,,,Anyone else seen that video of two porch pirates going after the same phone immediately after its left by the delivery driver,,0.0,1gu72uh
comment,lxy7udm,candykhan,,2,2024-11-19 16:40:49,,,,This has been happening with Google Fi devices for years Empty delivery boxes lost replacements etc The carrier will turn their hold into a charge because they didnt get the phone back Its up to the consumer to notice harangue them to reverse the charge It happened to me No idea why it took 25 months for the charge to reverse Google never disagreed that it was FedExs fault I should not have been charged They even said a refund was totally justified They just wouldnt do it Oh sorry they said Only the billing department can refund a charge but we cannot transfer you to billing No the billing department does not have a direct number Mind boggling how this kind of BS is allowed A carriers billing department has no direct phone line or way to transfer Do they communicate by notes passed under doors Clearly thats a lie but why bother lying The cost of paying someone to agree with me on all those calls would have paid for multiple phones in labor hours,,0.0,1gu72uh
comment,lxrzwm6,lupin_bebop,,6,2024-11-18 16:34:27,,,,Its definitely some disgruntled former employees current employee who has been corrupted or planted ATT has pissed off and laid off a LOT of people to line their executives pockets They also have lax cybersecurity practicesstandards Rogue ATT employees Nah Its currently employed ATT associates This is internal and I think ATT knows it they just cant admit it because then they are the problem This is yet another reason to get you iPhone via Apple who forces you to sign for it and only uses carrier data for activation rather than your carrier Thats me though Ive always bought my iPhones via Apple because I dont have to deal with carrier BS that way for one and I get what I want from the source I do understand that Im lucky to live within 20 minutes of a few Apple stores so that is convenient and lucky,,0.0,1gu72uh
comment,lxt7p2r,Beneficial_Company51,,3,2024-11-18 20:14:55,,,,Where do you even get They also have lax cybersecurity practicesstandards From,lxrzwm6,1.0,1gu72uh
comment,lxv1ghg,lupin_bebop,,0,2024-11-19 02:15:58,,,,My dad Who worked for MaBell and ATT Helped build the 911 backbone for their cellular network Also helped build their IT and internal network backbones I believe him when he says something like that He doesnt do so outofpocket,lxt7p2r,2.0,1gu72uh
comment,lxsa6ho,nearcatch,,3,2024-11-18 17:26:27,,,,Sometimes you dont get a choice I took advantage of an upgrade program ATT had that let me trade in three iPhone 13 Pros for three iPhone 16 Pros for zero cost Had to receive them however ATT sent it One phone was sent using UPS one using FedEx one using USPS ATT didnt require signatures for anything FedEx one got stolen,lxrzwm6,1.0,1gu72uh
comment,lxsl5tm,lupin_bebop,,1,2024-11-18 18:21:29,,,,I am aware of that program They will usually let you do it at an Apple Store too I used to work at Apple so Im aware of what can be done in store Its not always true but usually they can usually match carrier deals I also mentioned that I understood that Im lucky to be near Apple Stores Im aware not everyone has that convenience The website still exists though shrug Again Im just lucky with proximity,lxsa6ho,2.0,1gu72uh
comment,lxu9uwv,nearcatch,,3,2024-11-18 23:35:48,,,,I didnt know Apple would price match carrier deals Probably wouldve done that,lxsl5tm,3.0,1gu72uh
comment,lxv9cbz,None,,2,2024-11-19 03:03:08,,,,I stopped buying iPhones directly from ATT years ago simply after dealing with one ATT rep that was so infuriatingly dumb and high pressure I trade in with Apple online with Apple online or at an Apple Store So much easier,lxu9uwv,4.0,1gu72uh
comment,ly0wvwb,lupin_bebop,,1,2024-11-20 01:04:22,,,,Yep You can always check Apple cant do every promo but most carrier promos they do Give it a shot,lxu9uwv,4.0,1gu72uh
comment,lxsj3pz,hawksdiesel,,4,2024-11-18 18:11:08,,,,Deliver it to someone or noone at all Lock box or a person Leaving it on a porch is dumb People steal,,0.0,1gu72uh
comment,lxuzld6,WeeklyBanEvasion,,2,2024-11-19 02:04:50,,,,Imagine taking a day off work just to get your iPhone in the mail,lxsj3pz,1.0,1gu72uh
comment,lxskby1,Smartnership,,1,2024-11-18 18:17:19,,,,noone Is the e silent,lxsj3pz,1.0,1gu72uh
comment,lxskz6p,hawksdiesel,,-5,2024-11-18 18:20:34,,,,what do you think,lxskby1,2.0,1gu72uh
