type,id,author,title,score,created_utc,url,num_comments,subreddit,body,parent_id,depth,post_id
post,1gu72uh,a_Ninja_b0y,Porch pirates appear to be using AT&T data to track iPhones,4372,2024-11-18 15:19:22,https://www.reddit.com/r/gadgets/comments/1gu72uh/porch_pirates_appear_to_be_using_att_data_to/,206.0,gadgets,,,,
comment,lxrs1cv,mobrocket,,1537,2024-11-18 15:53:07,,,,My guess is Current or former employee who still has network access Or someone who is able to log in as an employee due to name a reason My guess is ATT is like many companies who view good IT security just as an expense and not as a necessary asset,,0.0,1gu72uh
comment,lxrsxyp,VagSmoothie,,531,2024-11-18 15:57:55,,,,Its definitely internal fraud Someone on the inside has access to tracking and passes it off to the thieves for a cut Banks are quite good at tracking this kind of thing logging which employee accounts are accessing which customer accounts and doing a trace back to find the culprit I doubt that telecoms have ever really needed to do this type of thing so its gonna be a while before they can put a stop to it,lxrs1cv,1.0,1gu72uh
comment,lxsduex,akaender,,208,2024-11-18 17:44:45,,,,I built an integration to their backend API a few years ago for an internal company portal so that employees could selfservice manage their employee paid mobile plansdevices I ran into an issue where the integration was failing against their test environment that they had given us credentials for to test ordering devices etc without actual transactions happening So I escalate and eventually end up on a call with a lead developer on their side and he says oh yea the test environment has been broken for years and no one knows how to fix it Just test in production which is not a good idea so I challenged back If I run these test transactions through production wont that result in charges being applied to our account and devices shipped how do I flag them as test transactions so that this doesnt happen to which he confidently replies Just use this fake address to the North Pole we have this hard coded in production to automatically cancel the order This is how we test internally I take this info back to my management and told them no fuckin way was I going to use my own corporate pcard to run these tests against their prod because I had zero confidence in that working out well for me My manager thinks itll be fine though so gives me his pcard and Im like okay whatever you get to deal with the fallout of this You can probably guess what happened next I ran a small test batch of 10 device orders We received 4 cancel emails and 6 YOUR ORDER HAS SHIPPED emails My boss gets 6x iPhone charges on his pcard for devices shipped with tracking numbers to a fake address at the north pole They were unable to cancel those orders because the address was invalid yet the billing and labels had been printed somehow and the devices left the warehouse never to be seen again Fortunately since they never showed as delivered we were able to charge back the billing All that to say their backend is likely compromised in so many ways that this article doesnt surprise me at all,lxrsxyp,2.0,1gu72uh
comment,lxt4sa9,mccoyn,,71,2024-11-18 19:59:56,,,,Fun fact the lead developer lives in the North Pole,lxsduex,3.0,1gu72uh
comment,lxtc1jz,mrkstu,,56,2024-11-18 20:37:06,,,,Fun fact this is how Santa gets iPhones for Christmas,lxt4sa9,4.0,1gu72uh
comment,lxx5vdh,doyletyree,,9,2024-11-19 13:08:24,,,,God DAMMIT I knew there was something fishy about that guy,lxtc1jz,5.0,1gu72uh
comment,lxxhzld,None,,1,2024-11-19 14:24:16,,,,DUH My 6 year old knows this s,lxtc1jz,5.0,1gu72uh
comment,lxwh9t4,None,,10,2024-11-19 09:22:15,,,,Not a telecom company but my first job in IT at a community college had their help desk database cough running on nothing more then a shaky instance of a access databaseclunky front end Was being trained to do printer support hardware level mainly fixing the beastsclearing issues rather then computer level but still would setup network printers and found that out when the person teaching me would have to wait for the database The other back end support folks would rotate access to it quickly when the main support line wasnt ringing to get tickets if they lost them needed to add notesclosedelete didnt auto print etc As is the norm with your average institution too many folks demanded access to it and they lost the ability to fully keep a lid on it rather then upgrade it guess the status quo was better So one day they cant get into it We had 3 main campus locations and many satellite locations in town out of town and wayyyy out of town Turns out one of the wayyyyyy out of town locations had a power tripper demanding access to this patchy system of ill reputepoor design and then just disappeared went to lunch most likely That was a hilarious mess Always had my own work to do between printers or my primary purpose for getting hired in shuffling box trucks of equipment around for rolling upgrades but the sheer annoyancepanic of everyone just in the office im working in alone ill never forget Hey is your instance closed Yeah yours YEAH yours YES,lxsduex,3.0,1gu72uh
comment,lxtx8xw,Funny_Alternative_55,,15,2024-11-18 22:25:13,,,,The carriers system probably sent them to North Pole AK lol,lxsduex,3.0,1gu72uh
comment,lxxiqog,PriorWriter3041,,1,2024-11-19 14:28:41,,,,Its a fake address Thats what I would have said too D,lxsduex,3.0,1gu72uh
comment,lxs3r7n,Justinieon13,,328,2024-11-18 16:53:55,,,,Its internal fraud for sure In 2017 I was an ATT employee I called our internal ATT number to setup a directv employee account and once I hung up within 5 minutes I got a scam call out of Jamaica claiming it was the employee hotline and needed to verify card information for my purchase I just made Except it wasnt a purchase and payment was not needed They had my name and employee ID They rely heavily on 3rd party call centers that do very little in terms of information security,lxrsxyp,2.0,1gu72uh
comment,lxs6p8o,mobrocket,,88,2024-11-18 17:08:56,,,,WTF,lxs3r7n,3.0,1gu72uh
comment,lxsub85,Lotronex,,95,2024-11-18 19:07:15,,,,I worked at one of the 3rd party call centers for ATT from 20102015 ATT actually closed our WFH program down because one of the other centers was caught selling customer info like that But its so much cheaper they dont really care,lxs3r7n,3.0,1gu72uh
comment,lxsayl9,VagSmoothie,,29,2024-11-18 17:30:22,,,,WOW Thats nuts,lxs3r7n,3.0,1gu72uh
comment,lxu9pii,0O0O0OOO0O0O0,,25,2024-11-18 23:34:55,,,,Jamaican call centers are known for this People get jobs there because selling customer info pays more than the actual paycheck,lxs3r7n,3.0,1gu72uh
comment,lxtou7h,Cluelesswolfkin,,15,2024-11-18 21:41:29,,,,Can confirm Same thing for me but it was Optimum,lxs3r7n,3.0,1gu72uh
comment,lxufty0,sirhecsivart,,2,2024-11-19 00:10:24,,,,Optimums phone support went downhill once they moved customer care out of Newark,lxtou7h,4.0,1gu72uh
comment,lxujquz,cocktails4,,1,2024-11-19 00:33:06,,,,I cant imagine support much worse than what Optimum currently provides I was so happy when I finally got to cancel my service a couple years back Verizon 5G Home customer service is 100 real Americans,lxufty0,5.0,1gu72uh
comment,lxul6x2,sirhecsivart,,5,2024-11-19 00:41:31,,,,I would say Verizon Wireless support Verizon Wireline and Home 5G is good but wireless is horrible since Verizon Wireless and Wireline are run like 2 separate companies,lxujquz,6.0,1gu72uh
comment,lxudngu,microcandella,,5,2024-11-18 23:57:49,,,,3rd party call center for atts supposedly broke up monopoly in the 90s Our targets Unlisted numbers of homeowners aka rich old and private Our top service was a very fancy voicemail system at 4500 installed then 650month,lxs3r7n,3.0,1gu72uh
comment,lxtgkc2,apocalypsebuddy,,17,2024-11-18 20:59:45,,,,A 5 minute window sounds like someone has hooked into an API and the info is being automatically passed to someone,lxs3r7n,3.0,1gu72uh
comment,lxww3gz,MAXSuicide,,2,2024-11-19 11:54:10,,,,3rd party call centers Every western nation that does this to India Jamaica whatever 3rd world unfortunately goes the way you describe Spamscam Having said that though I worked a job where a guy had come from a call centre here in the UK that was specifically made to call up old people and keep them on the line for x amount of time in order to 1 provide unnecessary services to them 2 run up a big ol phone bill,lxs3r7n,3.0,1gu72uh
comment,lxrw1q9,mobrocket,,74,2024-11-18 16:14:22,,,,We had a similar leak in my company Almost 3 months undetected But our IT is shit we underpay and have constant turnover especially people leaving for better jobs,lxrsxyp,2.0,1gu72uh
comment,lxss0y7,nagi603,,14,2024-11-18 18:55:49,,,,But our IT is shit we underpay and have constant turnover especially people leaving for better jobs So same or better as ATT,lxrw1q9,3.0,1gu72uh
comment,lxsyu1i,rebbsitor,,14,2024-11-18 19:29:53,,,,They definitely should up their internal security but its strange this is still happening I mean they could just require a signature on delivery That ATT doesnt require a signature for a 1000 item is nuts,lxrsxyp,2.0,1gu72uh
comment,lxt53tg,mccoyn,,10,2024-11-18 20:01:33,,,,If the phone gets returned for no signature thats ATTs problem If it is delivered and stolen thats your problem,lxsyu1i,3.0,1gu72uh
comment,lxtb356,rebbsitor,,15,2024-11-18 20:32:15,,,,The opposite actually If someones not there to sign for a package FedEx will redeliver it or hold it for pickup Or worst case return it if no one ever gets it but at least they dont lose the phone A company is legally responsible for delivery of a product to the customer not their doorstep If it gets stolen off a porch the company has to file an insurance claim for it or eat the cost They may try to convince someone its their problem but legally the seller is on the hook for it Pretty much every other company does signatures on items like that for this reason ATT is the oddball here,lxt53tg,4.0,1gu72uh
comment,lxwzock,edvek,,2,2024-11-19 12:23:25,,,,That wouldnt stop much unfortunately When you order directly from Samsung they always require a signature One time through FedEx I had to go pick it up at their center because I missed it as I was at work The other time it was UPS and the guy just dropped it off and left Wasnt a big deal as I was home but he didnt even attempt to get my signature even though the shipping and all that clearly stated a signature was required Lazyemployees who dont carestill using COVID rules will just drop the package and leave If they have to take it back that means they have to return again to attempt delivery Why come back when I can just come once,lxsyu1i,3.0,1gu72uh
comment,lxrztft,mark-haus,,30,2024-11-18 16:33:59,,,,ISPs not taking their security in any domain seriously is practically a truism This tracks with their history,lxrsxyp,2.0,1gu72uh
comment,lxt6ear,Lint_baby_uvulla,,12,2024-11-18 20:08:13,,,,Oh So like having a public facing API to a test environment with no security or ratelimiting using production data and lets make the database increment new records by one Thanks Optus your 98 million customers are fucked,lxrztft,3.0,1gu72uh
comment,lxt1s9q,Sawses,,13,2024-11-18 19:44:48,,,,Banks are quite good at tracking this kind of thing logging which employee accounts are accessing which customer accounts and doing a trace back to find the culprit Theres no excuse for any organization with secure data to not log this The actual cost of it is minuscule and the benefit is that you can basically solve any of these problems by giving one person with a decent head on their shoulders access to the data,lxrsxyp,2.0,1gu72uh
comment,lxu60cm,Takemyfishplease,,1,2024-11-18 23:13:28,,,,What if that one person is the scammer tho Didnt that happen to the cia in the Cold War,lxt1s9q,3.0,1gu72uh
comment,lxu70q5,Sawses,,1,2024-11-18 23:19:19,,,,Fair enough Two people selected at random and a third person auditing both of them,lxu60cm,4.0,1gu72uh
comment,lxstggz,Sherifftruman,,7,2024-11-18 19:02:57,,,,Probably the same people that used to sell carrier unlocks on eBay until they cracked down on that,lxrsxyp,2.0,1gu72uh
comment,lxt32s7,mephi5to,,9,2024-11-18 19:51:19,,,,Internal fraud is great We once opened a credit card in HomeSence or similar shop to get X discount But didnt use it in store 2 weeks later had a charge on it we havent even remove sticker from it and called to activate it Ha,lxrsxyp,2.0,1gu72uh
comment,lxu9hgk,None,,2,2024-11-18 23:33:36,,,,Ship an AirTag as an iPhone,lxrsxyp,2.0,1gu72uh
comment,lxujxhm,RustySheriffsBadge1,,1,2024-11-19 00:34:10,,,,They can and they do You would be surprised at how deep our corporate investors can go Work at a major telecom company,lxrsxyp,2.0,1gu72uh
comment,lxwn5io,Tigerballs07,,1,2024-11-19 10:27:19,,,,The major telecommunications companys have internal fraud and criminal investigation teams that are huge only they generally are focused on sim swapping rings They 100 percent have the ability to track account access and could and probably will track this down I know this for reasons I cant disclose,lxrsxyp,2.0,1gu72uh
comment,lxzrogr,Usual-Housing4218,,1,2024-11-19 21:18:23,,,,Disclose it They dont know your Reddit Dont let corporations scare you,lxwn5io,3.0,1gu72uh
comment,lxzyank,Tigerballs07,,1,2024-11-19 21:51:35,,,,I mean what I said isnt negative if anything its a positive But Im also not about to disclose who I work for,lxzrogr,4.0,1gu72uh
comment,ly40fz7,TheRealLRonHoyabembe,,1,2024-11-20 15:27:12,,,,Its internal theft from the delivery carrier Cell providers use intranets You cant access the network without being in site their processing tablets tend to be geofenced The theft is happening from the delivery carriers I know this because as a former cellular provider rep we had return devices go missing that were hand delivered to fedexupsusps locations and never made it out of those locations Theyre being stolen in transit by drivers who are telling buddies what stops have phones The boxes theyre shipped in are super easy to identify They all look the same,lxrsxyp,2.0,1gu72uh
comment,lxsb0ti,Stimbes,,10,2024-11-18 17:30:41,,,,I agree When I read the title I was thinking something like SS7 but since its just ATT I think youre right about it being internal employees or a contractor with this same kind of access,lxrs1cv,1.0,1gu72uh
comment,lxslkab,tubezninja,,12,2024-11-18 18:23:30,,,,Without a doubt its gotta be disgruntled ATT employees most likely working retail Their pay is based heavily off commissions and they have increasingly unrealistic quotas and metrics they have to meet The system is heavily skewed to force motivate store salespeople to make sales If you go into a brick and mortar cell carrier store for help with your account or to just get a new SIM card youll discover pretty quickly that none of the staff there will want to help you unless they can sell you something If you walk away from the store without buying anything it counts negatively on their metrics And its not enough to just sell you a new phone Doing just that is also a negative They also have to try and push a a new line of service on your account Device insurance Their family location tracking addon Pet and car trackers that also require separate lines of service Accessories like chargers screen protectors cases and cables all of which you might already have or can get cheaper somewhere else Each sales employee has to sell a certain number of these If not they not only miss out on commission but they could be shown the door if they dont hit their quotas If you notice every once in a while people will post on rATT rVerizon or rtmobile about how they left a store and discovered they got got charged more than they were told and their account has addons and lines they didnt ask for this is why The customer probably needed something basic and the employee had their back to the wall because theyre required to upsell So they crammed what they could onto that customers account maybe confused the customer with a bunch of doublespeak and hoped they wouldnt notice long enough for it to stick to their metrics TLDR When you already have to be unethical to keep your job its not that far of a reach to start selling out customer data you have access to so someone else can go for device thefts This is why I tell people to avoid going into a brick and mortar phone shop unless theres some reason you absolutely have to If youre buying a new phone buy it unlocked direct from the company that makes it if you can like the Apple Store or direct from GoogleSamsungwhatever It sucks for anyone working at these shops who maybe dont have any other choice but going in there puts you in a grift thats a pain to get out of and your personal data is also at risk too when youre on the employees radar and they have reason to access it,lxrs1cv,1.0,1gu72uh
comment,lxtjj06,mikka1,,3,2024-11-18 21:14:39,,,,And its not enough to just sell you a new phone Doing just that is also a negative They also have to try and push a a new line of service on your account Device insurance LOL we had a recent story in one of the local immigrant groups from a guy who left a bit puzzled after he visited ATT office just to get his first line in the US and left with 438mo services 4 lines etc etc,lxslkab,2.0,1gu72uh
comment,lxwwy7w,SmokinOil,,5,2024-11-19 12:01:20,,,,I fully believe this I have att and had a phone stolen off the porch and that has never happened except the one time I was waiting for a replacement phone not one package and my girl orders shit all the time But they did send me another one no problem still a pain in the ass though having to wait another week,lxrs1cv,1.0,1gu72uh
comment,lxyczl6,UncoolSlicedBread,,2,2024-11-19 17:06:09,,,,I went over to my sisters house a week ago to sit around and wait for their phones to arrive during the day FedEx gave a time between 910am a random car pulled up along the yard across the road and sat there for a good hour Theyre just on their phone in the spot across the way FedEx switched the delivery time to 24pm and about the time my sister gets the notification the dude takes off,lxwwy7w,2.0,1gu72uh
comment,lxssplt,oboshoe,,8,2024-11-18 18:59:11,,,,Heres the thing about hackers They all have day jobs And those day jobs are sometimes usually in cyber security roles,lxrs1cv,1.0,1gu72uh
comment,lxtfr3y,adrian783,,1,2024-11-18 20:55:42,,,,case in point Thomas A Anderson,lxssplt,2.0,1gu72uh
comment,lxu6dqj,asspajamas,,1,2024-11-18 23:15:37,,,,mr anderson,lxtfr3y,3.0,1gu72uh
comment,lxs9he7,Alimayu,,9,2024-11-18 17:22:59,,,,Someone did this to me I was standing in line at the grocery store in Atlanta and someone commented on my internet history in full gangstalker format I had to complain about it to an Executive They were actually hacking cell towers in Atlanta and Blacking out coverage in parts of Atlanta This is why I dropped ATT,lxrs1cv,1.0,1gu72uh
comment,lxsdebh,BeardBootsBullets,,13,2024-11-18 17:42:32,,,,Its unlikely that they are jamming cell towers or at least its unlikely that theyll get away with it The FCC Office of Investigations takes their job very seriously and they will quickly respond if ATT even mutters anything about someone jamming cell towers There was a case of some nut job driving a car with a hardwired cell jammer installed and the FCC tracked him down because he had inadvertently passed cell towers while doing so 48000 fine,lxs9he7,2.0,1gu72uh
comment,lxsfxyg,Alimayu,,1,2024-11-18 17:55:11,,,,They didnt get away with it It stopped shortly after,lxsdebh,3.0,1gu72uh
comment,lxsaijk,mobrocket,,2,2024-11-18 17:28:09,,,,Thats a federal crime and you can get severe punishment because it could impact First Responder 911,lxs9he7,2.0,1gu72uh
comment,lxs98t8,srfrosky,,2,2024-11-18 17:21:47,,,,The see all regulations not just security as expenses What could we possibly gift telecoms for Xmas that could make all those pesky expenses go away,lxrs1cv,1.0,1gu72uh
comment,lxw13km,thanatossassin,,1,2024-11-19 06:30:18,,,,Definitely not instore or sales they dont have access to any of that information Has to be within the supply chain warehouse or logistics,lxrs1cv,1.0,1gu72uh
comment,lxw3c9v,Xenophonii10,,1,2024-11-19 06:52:01,,,,Dude the amount of internal abuses at phone companies is insane I was literally scammed by a Verizon store into getting a phone they told me was covered it wasnt On top of that scammers leakers of music and porn and such pay off phone store employees to get access to celebs phone numbers to do sim swapping and its pervasive as hell,lxrs1cv,1.0,1gu72uh
comment,lxta2ba,Hopeful-Sir-2018,,1,2024-11-18 20:27:03,,,,Current or former employee who still has network access If only we had tech privacy laws While stalking is one thing if we had laws that would anonymize data and users and hold companies accountable for failure to comply it would go pretty far But the alphabet agencies love being able to grab information anytime they want and for any reason they want so they view privacy and security as a threat So companies have zero incentive to value either of those,lxrs1cv,1.0,1gu72uh
comment,lxx6ygs,soytuamigo,,0,2024-11-19 13:15:43,,,,My guess is ATT is like many companies who view good IT security just as an expense and not as a necessary asset Thats not fair That someone is exploiting a vulnerability does not translate to company doesnt care about security All companies are vulnerable to having their system compromised Criminals only have to succeed once yaad yada,lxrs1cv,1.0,1gu72uh
comment,lxrq7tu,durielvs,,267,2024-11-18 15:43:26,,,,Here in Argentina they deliver the product to you in hand they dont leave it lying at your door How much is the savings so that companies leave products that can cost thousands of dollars at your door,,0.0,1gu72uh
comment,lxruy0w,ElevatedLegend,,139,2024-11-18 16:08:33,,,,I live in the US and for electronics over a certain price most of these companies do make you sign for the package so it is delivered in hand That did not stop someone from stealing the iPhone I bought through my carrier as I got an empty iPhone box delivered to my house that they wanted me to sign for Someone stole it before it even arrived to the shipper so the shipper box was intact but the iPhone box was ripped open,lxrq7tu,1.0,1gu72uh
comment,lxsvxnt,Dmage22,,55,2024-11-18 19:15:22,,,,Ive ordered two iPhone 16 pro last month UPS delivered one walked up to the door dropped it off at the gate rang the bell and walked away FedEx delivered the second one ran up to the gate slapped the we missed you note and ran away Didnt even ring the doorbell or anything We were waiting in living room for delivery the entire day we ran out the gate when we saw his truck but he was too fast and drove away,lxruy0w,2.0,1gu72uh
comment,lxvasac,ruffznap,,42,2024-11-19 03:12:07,,,,ran up to the gate slapped the we missed you note and ran away I so badly wish shipping companies would crack down on employees doing this shit They SO often do this with signature required packages Its annoying as hell,lxsvxnt,3.0,1gu72uh
comment,lxvjaw1,DadJokeBadJoke,,28,2024-11-19 04:07:25,,,,The employees are often doing it because theyre held to ridiculous standards by their employers,lxvasac,4.0,1gu72uh
comment,lxvemzw,PocketNicks,,10,2024-11-19 03:36:41,,,,I get almost all my packages delivered to my local post office about a 3 minute walk from my home Theres always someone there to sign for it no missed delivery Doesnt cost me anything I get an email notification from the post office within minutes of the delivery and I can pick it up same day if I get there before they close,lxvasac,4.0,1gu72uh
comment,ly3m49m,notjordansime,,3,2024-11-20 14:06:01,,,,Same except my post office is about 7km away I live in a rural town so the post office is also a liquor store rare in Ontario most liquor stores are dedicated establishments that ONLY sell alcohol Always fun to go pick up my estrogen and wine at the same location lmfao,lxvemzw,5.0,1gu72uh
comment,lxvv828,Mcpisspants38,,2,2024-11-19 05:37:42,,,,Did it to me with a couch last week Waited all day at home 2k couch Truck pulled up I think its backing into the driveway to back up the driveway Nope He didnt feel like driving up the long windy driveway and was just turining around to leave By the time I got in my car to chase after him he was gone Like what a fucking asshole Two days later Redelivery This time I drove down in advance and waited in my car as they approached I could tell the two guys were already planning to fuck this one as they didnt just turn into the driveway I jump out and was like go up to the house with the truck They looked thoroughly annoyed that I was there at the bottom so they couldnt just leave You cant see the house from the street so I guess they are afraid to just drive up a private driveway without knowing if they can turn around but too fucking bad You can back down if you have too They were also aware there was a incident report for the first attempt,lxvasac,4.0,1gu72uh
comment,lxxmvr6,digital43,,5,2024-11-19 14:52:14,,,,FedEx is just a group of thieves lurking around until someone has to ship a phone for trade in or receive a phone from new purchase There are so many reports of them doing this no joke,lxsvxnt,3.0,1gu72uh
comment,lxxoox6,Dmage22,,2,2024-11-19 15:02:04,,,,Coincidentally I also had an experience dropping off a phone at FedEx to send in for trade in I got an email later saying they received an empty box,lxxmvr6,4.0,1gu72uh
comment,lxxuvt8,Vallamost,,2,2024-11-19 15:35:07,,,,Still better than UPS UPS will charge you to send emails at their stores,lxxmvr6,4.0,1gu72uh
comment,lxxbskc,jeandlion9,,2,2024-11-19 13:46:41,,,,Thats what happens when routes are timed by management,lxsvxnt,3.0,1gu72uh
