type,id,author,title,score,created_utc,url,num_comments,subreddit,body,parent_id,depth,post_id
comment,lxslnb6,Smartnership,,1,2024-11-18 18:23:55,,,,Noon or Noonie,lxskz6p,3.0,1gu72uh
comment,lxsn3d1,hawksdiesel,,-2,2024-11-18 18:31:08,,,,whos,lxslnb6,4.0,1gu72uh
comment,lxu5gh8,Hottentott14,,2,2024-11-18 23:10:18,,,,Can someone explain to me an ignorant European why porch deliveries of packages are seemingly so extremely ubiquitous in the US despite all Ive heard about it for the last ten years being rampant porch piracy Im lucky enough to live in a country there this seemingly isnt that big of a problem though theres been an increase the last few years And thus fewer people are using that delivery method as there are 15 other options without that risk Why hasnt the US simply moved away from unguarded deliveries Whenever I hear about it its presented as a law of nature with absolutely no solution And thats just not the case,,0.0,1gu72uh
comment,lxv1tbs,Swastik496,,3,2024-11-19 02:18:04,,,,because its not the customers problem credit card consumer protections are very strong and amex will be happy to make sure Its the merchants problem,lxu5gh8,1.0,1gu72uh
comment,lxum2p8,Straight-Ad6926,,1,2024-11-19 00:46:37,,,,Porch deliveries are very common in the US and there are a few reasons for this One major factor is convenience Many people prefer having packages delivered directly to their homes rather than having to pick them up from a central location or locker The sheer size and population density of the US make centralized delivery points less practical in many areas While porch piracy is a known issue there are several measures being taken to combat it Some people use security cameras or video doorbells to monitor their porches Others have packages delivered to secure lockers or use services that allow deliveries to be made inside their homes or garages Some delivery companies are offering more flexible delivery options to minimize the risk of theft Its not that theres no solution but its a balance between convenience and security and different people and areas are adopting various strategies to address the problem,lxu5gh8,1.0,1gu72uh
comment,lxvaru3,incubusfox,,0,2024-11-19 03:12:03,,,,Another reason is just how many packages are delivered each day My UPS hub had 57k volume on Friday across 4 delivery centers and its only a medium sized hub covering the northern section of a major city ranking the top 30 by population theres a center covering the downtown area and another center on the other side of the city covering the southern expanse of this area All told its about 180 drivers in my building I believe each driving anywhere from 100250 stops though a good amount of those are to businesses To do what youre suggesting would truly be a paradigm shift And to be honest youre hearing a ton about porch piracy but in most of the country it isnt actually a thing,lxu5gh8,1.0,1gu72uh
comment,lxufpsf,top_value7293,,2,2024-11-19 00:09:45,,,,I think we are all going to have to get lockboxes to have packages put in Amazon drivers could have master keys or something I dunno Something needs done about these thieves,,0.0,1gu72uh
comment,lxv9ca8,PrometheusSmith,,1,2024-11-19 03:03:07,,,,You have to have a TSA approved lock to secure most luggage on an airline flight Its a secure lock with a master key like youre suggesting I can buy the 002 and 007 TSA keys for 9 on Covert Instruments The 007 is the most recent and common key pattern,lxufpsf,1.0,1gu72uh
comment,lxscyu5,Figsnbacon,,1,2024-11-18 17:40:24,,,,I recently had 4 new iPhones delivered from ATT but I chose to have them delivered to a UPS store because for whatever reason UPS always delivers my items to the next door neighbor even though both of us have huge address numbers in the front of our yards as well as on the house itself So happy I paid the 6 bucks to do this one,,0.0,1gu72uh
comment,lxsoytc,Better-Challenge-503,,1,2024-11-18 18:40:34,,,,I myself when ordering something expensive i us my work address,,0.0,1gu72uh
comment,lxt2z0a,ThannBanis,,1,2024-11-18 19:50:48,,,,This is why I get them delivered to my office,,0.0,1gu72uh
comment,lxufvyt,None,,1,2024-11-19 00:10:43,,,,Sounds like an inside job,,0.0,1gu72uh
comment,lxvynzl,mgonzales3,,1,2024-11-19 06:07:42,,,,Just add Google analytics to see who is tracking the shipment,,0.0,1gu72uh
comment,lxw34bb,Xenophonii10,,1,2024-11-19 06:49:50,,,,Smart,,0.0,1gu72uh
comment,lxw39e3,None,,1,2024-11-19 06:51:14,,,,This whole leaving packages on the porch is wild to see Cant yall just pick them up at the pick up point,,0.0,1gu72uh
comment,lzyyk25,CormoranNeoTropical,,1,2024-12-02 01:58:29,,,,There is no pickup point,lxw39e3,1.0,1gu72uh
comment,lxxhm7p,Hakaisha89,,1,2024-11-19 14:22:03,,,,I still dont understand why there are no post offices to avoid this,,0.0,1gu72uh
comment,lxyv1lf,None,,1,2024-11-19 18:34:38,,,,If all those items are being tracked by the same person internally it wont be long until ATT finds out who is providing the info,,0.0,1gu72uh
comment,lxzplve,CaptLuker,,1,2024-11-19 21:07:59,,,,Porch pirates are slacking Every iPhone that hits the Memphis FedEx facility is lost before the pirates can get it,,0.0,1gu72uh
comment,lxzq6ph,espressocycle,,1,2024-11-19 21:10:52,,,,Freaking ATT They let someone get an iPhone and tablet using my identity without actually pinging my credit then sold the debt so I only found out when they put it on my credit report,,0.0,1gu72uh
comment,lxzwo49,Jake24601,,1,2024-11-19 21:43:26,,,,All the good scams are always taken,,0.0,1gu72uh
comment,lxzz66u,Obvious-Pianist-7767,,1,2024-11-19 21:56:01,,,,What are porch pirates That sounds racist but Im not sure why,,0.0,1gu72uh
comment,ly1t5pi,CdnBison,,2,2024-11-20 04:23:40,,,,When a package is delivered by Amazon UPS etc they usually just leave it on the porch Porch pirates come along and swipe the package before the owner can take it inside,lxzz66u,1.0,1gu72uh
comment,ly646ig,Camera_dude,,1,2024-11-21 00:01:38,,,,When I bought an expensive monitor I used a delivery option to have it delivered to a local store then picked it up there My neighborhood is quiet and low crime but theres zero protection against a porch pirate and lots of random contractors driving around and people walking by The monitor was big enough that I knew it would be shipped in its own box rather than a plain brown box Its always a good idea to think about the delivery if it is a high value item,,0.0,1gu72uh
comment,lzhh5cq,RealPersonResponds,,1,2024-11-28 23:57:11,,,,They follow UPS and FedEx trucks and grab the packages after delivery,,0.0,1gu72uh
comment,lxu5ftz,user11711,,1,2024-11-18 23:10:12,,,,Had this happen to me They took the phone within minutes of it delivering,,0.0,1gu72uh
comment,lxvemcf,silent_fungus,,1,2024-11-19 03:36:34,,,,Ive never understood how people dont go to an authorized dealer when making such a high priced purchase,,0.0,1gu72uh
comment,lzyyld8,CormoranNeoTropical,,1,2024-12-02 01:58:42,,,,Where would that be,lxvemcf,1.0,1gu72uh
comment,lxswv4j,NookEBetts,,-4,2024-11-18 19:20:01,,,,People who do this kind of stuff are beyond stupid yeah you were smart enough to figure out how to track iPhones from ATT and steal them from peoples porches but apparently you arent smart enough to know that the iPhone is already linked to the persons icloud account that bought it and can be tracked to your home This is one of the many reasons I own an iPhone because theyre practically theft proof Edit 20 bucks says the person was generation z,,0.0,1gu72uh
comment,lxsxskp,Drtysouth205,,5,2024-11-18 19:24:40,,,,The phone isnt linked to any iCloud account until its signed in on the first time however Apple knows the imei and can just blacklist the phone making it useless,lxswv4j,1.0,1gu72uh
comment,lxxncbx,pirate742,,0,2024-11-19 14:54:44,,,,20 says youre gen z,lxswv4j,1.0,1gu72uh
comment,lxxqf2a,NookEBetts,,1,2024-11-19 15:11:28,,,,Ill be 40 in February,lxxncbx,2.0,1gu72uh
comment,lxxryyc,Datguyovahday,,-1,2024-11-19 15:19:45,,,,Well so youre a boomer who just gave away a good bit of your birthday on the Internet,lxxqf2a,3.0,1gu72uh
comment,lxytu3z,NookEBetts,,0,2024-11-19 18:28:41,,,,Millenial,lxxryyc,4.0,1gu72uh
comment,lxyzoru,Datguyovahday,,2,2024-11-19 18:57:13,,,,Its a mindset Im a millennial too,lxytu3z,5.0,1gu72uh
comment,lxz0xrb,NookEBetts,,1,2024-11-19 19:03:25,,,,No not at all im very much technologically inclined I literally moonlight as an IT tech Maybe its different for ATT but every time I order a new Apple product through Verizon wireless its automatically set up and linked through my iCloud account so when I turn on the phone all I really have to do is activate the line everything else is already there Its also traceable during delivery And being aware and weary of porch Pirates I never miss a package delivery But again thats just me,lxyzoru,6.0,1gu72uh
comment,lxz82ba,Datguyovahday,,1,2024-11-19 19:39:57,,,,And Im saying as someone who had att phone stolen by porch pirates five minutes after it was delivered you cant trace it until you activate it you big silly billy,lxz0xrb,7.0,1gu72uh
comment,lxuv491,raiderMoes,,0,2024-11-19 01:39:01,,,,Damn That is a little bit clever,,0.0,1gu72uh
comment,lxwv3ip,rupauls_tuck,,0,2024-11-19 11:45:34,,,,This is another example of one of Americas systems clearly being extremely flawed but nothing will change because its how it is in america and they cant imagine doing it differently,,0.0,1gu72uh
comment,lxxiqdg,None,,0,2024-11-19 14:28:38,,,,Porch pirate sound like a slur,,0.0,1gu72uh
comment,lzyyh2m,CormoranNeoTropical,,1,2024-12-02 01:58:01,,,,,lxxiqdg,1.0,1gu72uh
comment,lxsqnfm,throwaguey_,,-1,2024-11-18 18:49:01,,,,This is why I always get mine delivered by their service that also sets it up for you,,0.0,1gu72uh
comment,lxrs8z1,lordraiden007,,-19,2024-11-18 15:54:14,,,,If youre ordering an item that you cant afford losing and you arent requiring a signature picking it up from a safe location or having it delivered to a private mailbox directly I kind of dont have a ton of sympathy for you The only things you should be fine with being dropped unceremoniously on your front porch are things youre fine with possibly losing,,0.0,1gu72uh
comment,lxrwvvm,None,,5,2024-11-18 16:18:46,,,,Up to the company shipping it to add signature Verizon always does,lxrs8z1,1.0,1gu72uh
comment,lxrx36s,trainbrain27,,6,2024-11-18 16:19:51,,,,Thats certainly a take On the other hand if I pay for an item it must be delivered successfully or refunded,lxrs8z1,1.0,1gu72uh
comment,lxrxgnh,lordraiden007,,-11,2024-11-18 16:21:47,,,,But it is being delivered successfully to your porch which is what you agreed to Its always an option to just go buy it in a store or report a private mailbox as your address,lxrx36s,2.0,1gu72uh
