type,id,author,title,score,created_utc,url,num_comments,subreddit,body,parent_id,depth,post_id
post,1hlgveu,Sariel007,"A Bionic Leg Controlled by the Brain. A new kind of prosthetic limb depends on carbon fibre and computer chips—and the reëngineering of muscles, tendons, and bone.",1394,2024-12-24 16:21:34,https://www.reddit.com/r/gadgets/comments/1hlgveu/a_bionic_leg_controlled_by_the_brain_a_new_kind/,62.0,gadgets,,,,
comment,m3m0o6k,AutoModerator,,1,2024-12-24 16:21:34,,,,We have a giveaway running be sure to enter in the post linked below for your chance to win a Unihertz Jelly Max the Worlds Smallest 5G Smartphone Click here to enter I am a bot and this action was performed automatically Please contact the moderators of this subredditmessagecomposetorgadgets if you have any questions or concerns,,0.0,1hlgveu
comment,m3mjyw0,None,,136,2024-12-24 18:11:43,,,,Too bad health insurance wont cover it,,0.0,1hlgveu
comment,m3mppwo,Im_ur_Uncle_,,29,2024-12-24 18:44:45,,,,Dont worry One day they will be so common we will be replacing our arms like we do iphones,m3mjyw0,1.0,1hlgveu
comment,m3og225,SteelShroom,,26,2024-12-25 01:41:34,,,,Praise be to the Omnissiah,m3mppwo,2.0,1hlgveu
comment,m3n0l2p,srry72,,16,2024-12-24 19:48:41,,,,Until the repo man comes and takes it from you,m3mppwo,2.0,1hlgveu
comment,m3q8shg,BloodWork-Aditum,,6,2024-12-25 12:48:12,,,,Yeah and youll get 3 subscriptions with it what a nice utopia,m3mppwo,2.0,1hlgveu
comment,m3qg09p,FreonKennedy,,3,2024-12-25 13:54:13,,,,Theres a free version but it plays ads,m3q8shg,3.0,1hlgveu
comment,m3vrsb6,dr_wheel,,2,2024-12-26 15:05:50,,,,Watch 3 ads before you can brush your teeth,m3qg09p,4.0,1hlgveu
comment,m3rfwxz,pulseout,,2,2024-12-25 18:03:24,,,,Til you get too much chrome installed and turn into a cyberpsycho,m3mppwo,2.0,1hlgveu
comment,m3vp2x4,mrdevil413,,1,2024-12-26 14:47:52,,,,Its at least the beginning of back alley ripper docs,m3rfwxz,3.0,1hlgveu
comment,m3yr5w4,QuickQuirk,,1,2024-12-27 01:28:16,,,,Ive got chrome installed already and its turning me in to a psycho reading reddit,m3rfwxz,3.0,1hlgveu
comment,m3nwm55,duckliin,,5,2024-12-24 23:15:05,,,,150k leg run by a rPi zero and a few solenoids smh,m3mjyw0,1.0,1hlgveu
comment,m3oslsf,tuscaloser,,2,2024-12-25 03:24:04,,,,I await opensource prosthetics and upgrades,m3nwm55,2.0,1hlgveu
comment,m3n6m0a,JSteigs,,11,2024-12-24 20:25:21,,,,Theyll cover the install and own the prosthetic themselves But the insurance company will make you pay a monthly subscription to use it,m3mjyw0,1.0,1hlgveu
comment,m3mwf4p,cyborg_guy,,7,2024-12-24 19:24:05,,,,I had to fight 2 denials to get just a basic hydraulic model I dont even know how people get the microprocessor control knees covered,m3mjyw0,1.0,1hlgveu
comment,m3n0d44,None,,6,2024-12-24 19:47:24,,,,You have to fight really hard for it You also have to prove your K level Even then if youre lucky enough to get an insurance company to agree to buy you one theres the 20 copayment which even at their negotiated price still comes out to almost 15000 Thats a lot of money for most amputees to just come up with,m3mwf4p,2.0,1hlgveu
comment,m3mkcbx,Elmodogg,,9,2024-12-24 18:13:51,,,,Came here to post the same thing you beat me to it,m3mjyw0,1.0,1hlgveu
comment,m3nuicr,Zebracorn42,,8,2024-12-24 23:00:00,,,,gifgiphyLzJUDH47mStZZ0eQru,m3mjyw0,1.0,1hlgveu
comment,m3mt6nq,IntelligentStyle402,,2,2024-12-24 19:04:57,,,,Exactly,m3mjyw0,1.0,1hlgveu
comment,m3pjo3z,rab-byte,,2,2024-12-25 07:46:18,,,,Please subscribe to our premium license to unlock running mode and well include our exclusive sit feature for 6mo free,m3mjyw0,1.0,1hlgveu
comment,m3mn5v8,zachaboo777,,4,2024-12-24 18:29:59,,,,You just have to be white and come from a wealthy family then theyll cover it,m3mjyw0,1.0,1hlgveu
comment,m3qbqr1,Flaky-Ad3980,,1,2024-12-25 13:16:29,,,,gifgiphyhXJ1MWMzY7Af32UIUDdownsized,m3mjyw0,1.0,1hlgveu
comment,m3x8ss7,Anal_Probe_Director,,1,2024-12-26 20:05:43,,,,I lost two fingers at work Took several months for them to ok a 50k mechanical prosthetic They said shit like its only cosmetic,m3mjyw0,1.0,1hlgveu
comment,m3mrfe9,d_fa5,,35,2024-12-24 18:54:40,,,,Cool if you have a below the knee amputation I have an above knee amputation and wish the knee joints were better Some sort of assist that isnt a heavy bulky power knee would be cool,,0.0,1hlgveu
comment,m3qmi4h,Corgiboom2,,3,2024-12-25 14:47:05,,,,There are things out there for it I used to play milsim airsoft with a guy that lost his leg in combat above the knee He had a prosthetic and he was running around with the rest of us like nothing at all was wrong,m3mrfe9,1.0,1hlgveu
comment,m3qmqqj,d_fa5,,2,2024-12-25 14:48:55,,,,He probably had a genium x3 which allows you to run short distances But its momentum powered not powered by the device itself,m3qmi4h,2.0,1hlgveu
comment,m3rbynj,Corgiboom2,,3,2024-12-25 17:38:35,,,,Yeah it was momentum powered but I would have never been able to tell without seeing his pant leg come up a little when he was vaulting over a fence I thought it was awesome,m3qmqqj,3.0,1hlgveu
comment,m3tn2lq,d_fa5,,2,2024-12-26 02:52:41,,,,People often tell me the same thing If you have a long enough residual limb its not so bad But it still gets exhausting without a calf and knee I used to hike 1012 miles Now doing 5 miles wipes me out,m3rbynj,4.0,1hlgveu
comment,m3nd6xa,Ok-Seaworthiness4488,,48,2024-12-24 21:06:24,,,,We can rebuild him we have the technology UHC denied not medically necessary,,0.0,1hlgveu
comment,m3pdcy1,SwampyThang,,11,2024-12-25 06:34:55,,,,He can live as a potato denied,m3nd6xa,1.0,1hlgveu
comment,m3q42cs,simstim_addict,,7,2024-12-25 11:57:11,,,,The Six Million Dollar in Debt Man,m3nd6xa,1.0,1hlgveu
comment,m3n5uif,ShhhKeepHidden,,26,2024-12-24 20:20:37,,,,Thats ëxcëllënt Rëally grëat nëws,,0.0,1hlgveu
comment,m3o5kqi,_The_Professor_,,6,2024-12-25 00:21:05,,,,Looks like youve got diaeresis of the mouth,m3n5uif,1.0,1hlgveu
comment,m3oetsr,ShhhKeepHidden,,5,2024-12-25 01:31:52,,,,Explosivo,m3o5kqi,2.0,1hlgveu
comment,m3ok6su,AbcLmn18,,3,2024-12-25 02:14:48,,,,I havё a bad casё of diaёrёsis,m3o5kqi,2.0,1hlgveu
comment,m3owmq5,Leipurinen,,2,2024-12-25 03:58:14,,,,Oh god its sprëading,m3ok6su,3.0,1hlgveu
comment,m3q8xlc,BloodWork-Aditum,,3,2024-12-25 12:49:36,,,,Nöööö,m3owmq5,4.0,1hlgveu
comment,m3ogz1l,krippl3,,3,2024-12-25 01:48:49,,,,Below kneebelow knee and above knee gets the shaft again pun intended You already maintain a high level of mobility with below knee amputations above knee needs some real love sincerely this 17 year AKA,,0.0,1hlgveu
comment,m3tk4km,TheConnASSeur,,2,2024-12-26 02:30:17,,,,AKA The Cripple Kid AKA Johnny One Leg AKA Dongasaurus Rex AKA Old Robodick Took me too long to realize AKA was Above the Knee Amputation,m3ogz1l,1.0,1hlgveu
comment,m3mutj9,Zeconation,,5,2024-12-24 19:14:39,,,,One step closer to a being a half mech half human,,0.0,1hlgveu
comment,m3o85tp,NukuhPete,,2,2024-12-25 00:40:26,,,,Im curious if theres any protections or work towards making those protections in law for ensuring and safeguarding the continued functionality once installed If you miss a payment or the company stops supporting the software for the chip is it turned off Does it require software Id assume it would require instructions to function Im guessing these sorts of questions have popped up with pacemaker products and those have been around for decades,,0.0,1hlgveu
comment,m3p7ydy,billbixbyakahulk,,2,2024-12-25 05:39:39,,,,Sounds great for those who can afford the Neuropozyne,,0.0,1hlgveu
comment,m3powsv,thedanyes,,2,2024-12-25 08:50:11,,,,Ah yes reëngineering Like reengineering but the dash was reengineered into dots,,0.0,1hlgveu
comment,m3nrcjj,ToeKnail,,2,2024-12-24 22:38:17,,,,What is Billy Joel doing in this picture with a robot arm in an article about bionic leg gifgiphyRLUyfJnogtXK44pm9tdownsized,,0.0,1hlgveu
comment,m3o71rc,None,,2,2024-12-25 00:32:05,,,,gifgiphy5ZKrnu6JEOIak,,0.0,1hlgveu
comment,m3ntndv,357FireDragon357,,1,2024-12-24 22:54:00,,,,Too bad that my son whom has Spina Bifida probably wont be able to have something like this Maybe someday,,0.0,1hlgveu
comment,m3ofaey,Gestrid,,1,2024-12-25 01:35:32,,,,Something something Lab Rats on Disney XD,,0.0,1hlgveu
comment,m3ouxdy,TheMeticulousNinja,,1,2024-12-25 03:43:44,,,,Im getting Wolverine claws in bionic arms installed from the black market,,0.0,1hlgveu
comment,m3p5pma,thehairyhobo,,1,2024-12-25 05:18:32,,,,Awesome now make a synthetic butthole my hemorroids are killing me,,0.0,1hlgveu
comment,m3pikhu,GaulteriaBerries,,1,2024-12-25 07:33:27,,,,Would make a great stocking filler,,0.0,1hlgveu
comment,m3qb96e,DefinitelyChad,,1,2024-12-25 13:11:59,,,,These chooms are onto something,,0.0,1hlgveu
comment,m3qfrh7,Howdoyoudo614,,1,2024-12-25 13:52:06,,,,Cyberpunk arms hopefully will be soon,,0.0,1hlgveu
comment,m3tpvyi,artguy55,,1,2024-12-26 03:14:03,,,,What happens when the company that made it no longer updates the software,,0.0,1hlgveu
comment,m4lly0f,None,,1,2024-12-30 22:50:01,,,,This is awesome Im sure a lot of war veterans could use these in the future,,0.0,1hlgveu
comment,m3o3f1t,Adventurous_Meal1979,,0,2024-12-25 00:04:58,,,,How many years of firmware updates are available,,0.0,1hlgveu
comment,m3pjvyd,rab-byte,,0,2024-12-25 07:48:50,,,,Depends on your leased software license,m3o3f1t,1.0,1hlgveu
comment,m3o4tj5,weaselmaster,,0,2024-12-25 00:15:29,,,,Never knew Billy Joel was missing a hand,,0.0,1hlgveu
comment,m3o597l,DZhuFaded,,0,2024-12-25 00:18:42,,,,Not medically necessary,,0.0,1hlgveu
comment,m3pr65x,Oz24846,,0,2024-12-25 09:18:16,,,,gifgiphyBMJwle7UtiSSkdownsized,,0.0,1hlgveu
comment,m3qv8ja,Desperate_Elk_7369,,0,2024-12-25 15:49:35,,,,UHC denied my claim,,0.0,1hlgveu
