type,id,author,title,score,created_utc,url,num_comments,subreddit,body,parent_id,depth,post_id
post,1hvsp4l,BlueLightStruct,Meta Has Discontinued Its High-End VR Headset,1060,2025-01-07 14:32:52,https://www.reddit.com/r/gadgets/comments/1hvsp4l/meta_has_discontinued_its_highend_vr_headset/,148.0,gadgets,,,,
comment,m5vjwl8,AutoModerator,,1,2025-01-07 14:32:53,,,,We have a giveaway running be sure to enter in the post linked below for your chance to win a Unihertz Jelly Max the Worlds Smallest 5G Smartphone Click here to enter I am a bot and this action was performed automatically Please contact the moderators of this subredditmessagecomposetorgadgets if you have any questions or concerns,,0.0,1hvsp4l
comment,m5vm1ik,Chronotaru,,417,2025-01-07 14:45:17,,,,The problem always was that the Quest 3 had several things that were better than the Pro if the Pro was revised at the same time to be unambiguously better then it would still have a market position If they want another Pro headset they should release it at the same time as the Quest 4,,0.0,1hvsp4l
comment,m5vqtgm,Sykes83,,184,2025-01-07 15:11:41,,,,Its not just several things that were betterthe Quest 3 is better than the Quest Pro in almost every way It has a higher resolution better cameras a faster CPU and more And it was half the price Compared to the Pro the Quest 3 is missing the face and eye tracking mini LED backlight selftracking on controllers and a few other things but theyre mostly minor things The positioning of the Pro vs the Quest 3 never really made much sense to me Even when it first launched before the Quest 3 was available the Pro was a bit weirdthey positioned it as an AR powerhouse and then equipped it with the worlds worst cameras,m5vm1ik,1.0,1hvsp4l
comment,m5w3078,Agrippanux,,103,2025-01-07 16:14:10,,,,The Pro was launched early because Meta feared a holiday release of the AVP and wanted to get ahead of it The Pro wasnt ready and when the AVP was pushed back Meta deprioritized it quickly The Pro has been an afterthought 3 months after it launched they quickly pivoted to the Quest 3 Source I run a VR game company,m5vqtgm,2.0,1hvsp4l
comment,m5wuskn,Lobsterbib,,54,2025-01-07 18:29:25,,,,I dont see what the galactic conflict between Xenomorphs and the Yautja has to do with any of this,m5w3078,3.0,1hvsp4l
comment,m60rcvq,Portlander_in_Texas,,6,2025-01-08 08:36:34,,,,Intergalactic conflict makes it sound bigger than it actually is Its more like asshole hunters import a dangerous invasive species to a planet to hunt And with no natural predators the species propagates eventually overwhelming local fauna The Yaujta are just obnoxious trophy hunters,m5wuskn,4.0,1hvsp4l
comment,m5xh8a9,gestalto,,10,2025-01-07 20:17:39,,,,Thought a similar thing Didnt even know a new one was in the works,m5wuskn,4.0,1hvsp4l
comment,m5xooqz,Plank_With_A_Nail_In,,-34,2025-01-07 20:53:12,,,,Running a game company doesnt give you knowledge of the inner workings of Meta ffs Running a games company can just mean you and your two school friends burning through your parents savings for all we know,m5w3078,3.0,1hvsp4l
comment,m5y1vi9,live_from_the_gutter,,15,2025-01-07 21:56:15,,,,Wet blanket award,m5xooqz,4.0,1hvsp4l
comment,m603fgo,Buttonskill,,9,2025-01-08 04:58:10,,,,Established SW partners often get reference boards and dev kits well in advance of release Even without that 5 minutes spent in any collaborative external bug database will give you a pretty good idea of what platform or SKU a hardware vendor is prioritizing fixes for,m5xooqz,4.0,1hvsp4l
comment,m65o060,Frenzie24,,1,2025-01-09 02:01:52,,,,Devs talk to each other and meta has traditionally had great dev support,m5xooqz,4.0,1hvsp4l
comment,m5vsfgy,Chronotaru,,20,2025-01-07 15:20:15,,,,In general yes Quest 3 is better in the things that matter but that doesnt negate those things that are better on pro Eye tracking wouldnt be a minor thing if it actually was implemented on PC in most titles the way it is with PS5 and until its actually on their biggest selling headsets that wont change The controllers are a significant upgrade but if you want them they can be purchased separately so why get a Pro for them,m5vqtgm,2.0,1hvsp4l
comment,m631wcg,BaconAlmighty,,1,2025-01-08 17:58:59,,,,and Quest Pro uses miniLED display tech which provides greater contrast and richer color than is seen in the Quest 3,m5vsfgy,3.0,1hvsp4l
comment,m5xqb1a,nope_nic_tesla,,4,2025-01-07 21:00:47,,,,Im betting they manufactured too many Pros before the release of the Quest 3 so they just kept selling their inventory backlog until they ran out and now its discontinued,m5vqtgm,2.0,1hvsp4l
comment,m64di4y,alidan,,1,2025-01-08 21:48:34,,,,quest pro controllers are self tracking and dont require to be seen by the headset to track how much this matters is debatable but it was a clear win I believe it also had eye tracking for foveated rendering rather than relying on your eyes only being dead center but thats kind how halo products function they come out are the be all end all and then you take what you can from them and put them in the lower end skus quest 4 will likely have holocake lenses amd fingers crossed on oled display,m5vqtgm,2.0,1hvsp4l
comment,m5y1jrs,joomla00,,-5,2025-01-07 21:54:41,,,,The quest pro has next gen features that werent that important to the average user Quest 3 really hit it out of the park with its overall package But personally Ive given up on it at the moment 500 is about the right price pancake lenses were a big improvement but the screen and visual quality kicks me out of immersion Its a continuous reminder that this is an early gen product Im strapping to my face It really needs quality miniledOLED and eye trackers to get us to that next level of immersion,m5vqtgm,2.0,1hvsp4l
comment,m5zb8g5,Braidaney,,2,2025-01-08 02:00:35,,,,I think this is a problem with consoles and products of this type in general selling different versions of a product that vary slightly in price and slightly in quality confuses consumers and hurts the brand If people buy the lower end product theyll feel buyers remorse when they realize if they had just spent a bit more they could have had a better product however that doesnt mean theyre going to be willing to buy a whole new system more than likely they just get frustrated and lose all enthusiasm for trying out a newer product like vr,m5vm1ik,1.0,1hvsp4l
comment,m5z424j,Rollertoaster7,,1,2025-01-08 01:20:07,,,,Yeah itd be perfect if they added eyeface tracking to a 4 pro model,m5vm1ik,1.0,1hvsp4l
comment,m5z65r8,Chronotaru,,-1,2025-01-08 01:31:53,,,,They need to add it to the base model or theres no point,m5z424j,2.0,1hvsp4l
comment,m64s0r1,Felicity_Here,,2,2025-01-08 23:02:02,,,,Im not sure I expect that in the base model though It is lower priced for a reason,m5z65r8,3.0,1hvsp4l
comment,m64sskt,Chronotaru,,2,2025-01-08 23:06:14,,,,Sony made it happen Because they did most VR games on PS5 have foveated rendering,m64s0r1,4.0,1hvsp4l
comment,m64u34i,Felicity_Here,,2,2025-01-08 23:13:19,,,,You make a good point,m64sskt,5.0,1hvsp4l
comment,m606p42,Rollertoaster7,,3,2025-01-08 05:22:41,,,,As budget headsets keeping costs down is paramount and the average meta user likely would prefer advances to be made to the weight comfort and battery life before they added several new cameras inside the headset increasing cost power consumption etc,m5z65r8,3.0,1hvsp4l
comment,m60s2m0,TheNorthComesWithMe,,4,2025-01-08 08:44:14,,,,Even if the hardware was decades better than the current state of the art VR needs software Unique input features locked behind the less popular model makes it less likely to be implemented in third party software,m606p42,4.0,1hvsp4l
comment,m610ts1,Chronotaru,,2,2025-01-08 10:18:24,,,,And at the same time its on PSVR2 Without it being on the most popular headset then developers wont implement foveated rendering in their games which means theres no point it being on the premium headset either,m606p42,4.0,1hvsp4l
comment,m5w286z,Zodaztream,,47,2025-01-07 16:10:18,,,,I want a headset that is light enough comfortable enough and great enough for working 8 hours a day in then I would be sold on a vr headset,,0.0,1hvsp4l
comment,m5x8vqb,TehOwn,,38,2025-01-07 19:37:16,,,,Weve got that already You just cant take it off Ever,m5w286z,1.0,1hvsp4l
comment,m5xag9m,SomeIrishGuy,,15,2025-01-07 19:44:45,,,,Follow the white rabbit,m5x8vqb,2.0,1hvsp4l
comment,m6020fi,artsatisfied229,,4,2025-01-08 04:47:45,,,,You all look the same to me,m5xag9m,3.0,1hvsp4l
comment,m5vlyb8,pyrethedragon,,116,2025-01-07 14:44:46,,,,I have a Meta Quest 2 and maybe 20 hours on it in the last year It has a high initial interest for me and some games are quite fun But I just cant get into the social part of it Also gives me headaches after a while,,0.0,1hvsp4l
comment,m5xb8zz,mx3goose,,19,2025-01-07 19:48:35,,,,The pancake lens in the quest 3 took VR from this is fun for a little bit to I use this daily I didnt realize how terrible the layered frenzo lenses were until I used pancakes,m5vlyb8,1.0,1hvsp4l
comment,m5vncyu,DrCalamity,,42,2025-01-07 14:52:42,,,,Its a good budget PCVR headset but absolutely doesnt want you to use it that way,m5vlyb8,1.0,1hvsp4l
comment,m5x8lbq,TehOwn,,15,2025-01-07 19:35:52,,,,Eh with Steam Link I found it incredibly easy to use even over Wifi The only issue was one game that wouldnt work with SteamVR,m5vncyu,2.0,1hvsp4l
comment,m5vvotj,TheRogueMoose,,11,2025-01-07 15:37:20,,,,I use my Quest 3 for racing sims via link cable and Skyrim VR airlink The only time i ever do anything social is when my son wants us to play together he uses my old Quest 2 Usually its just us playing in social games like Population One RecRoom etc,m5vlyb8,1.0,1hvsp4l
comment,m5woeqf,PM_Me_Cool_Cars_,,4,2025-01-07 17:58:36,,,,How is the Quest 3 vs 2 for sim racing Currently using the 2 and like it but wondering if the 3 would be more comfortable and better quality,m5vvotj,2.0,1hvsp4l
comment,m5wrw95,TheRogueMoose,,4,2025-01-07 18:15:31,,,,I got an aftermarket head strap for them both So its hard to say comfort wise as it was the first thing i did with them both lol I hated the stock head strap I have the Bobovr M3 Pro for my Quest 3 and love it I also have the Kiwi design Upgraded Elite strap for the Quest 2 and loved it Tho 3 years later its starting to wear down I found without the straps it would just hang down and dig into my cheeks and just really hurt With the Bobovr strap on the 3 it doesnt even touch my face Quality wise much better in my opinion I wasnt a huge fan of the fresnel lens in the older headsets So much clearercleaner with pancake lenses,m5woeqf,3.0,1hvsp4l
comment,m5xuwca,Fugueknight,,1,2025-01-07 21:22:41,,,,Never used a 2 but one limitation of the 3 for sim racing in particular is that the video encoding can cause a lower quality video signal than your system is capable of rendering or the headset is capable of displaying Im happy with my 3 for something like dirt rally but it is a bit of a downgrade from my old reverb G2,m5woeqf,3.0,1hvsp4l
comment,m5wlrc5,PenislavVaginavich,,11,2025-01-07 17:45:58,,,,The Quest 3 is a major improvement its far better in almost every way to any other mixed reality or VR headset Ive used and I dont really get headaches with a good strapBut its still just not a super practical tool for most people as cool as it is Its not immersive enough for things like movies and YouTube 360 is mostly kind of a gimmick Theres just not enough good content out there to make it worthwhile for most people Mine mostly sits charging in the corner and I occasionally throw it on to play golf or table tennis or to use as PCVR for Alyx Thats about it,m5vlyb8,1.0,1hvsp4l
comment,m5x6ck9,Alchia79,,4,2025-01-07 19:24:59,,,,I have the quest 2 as well from Christmas 2020 We all used it a lot the first year I loved Supernatural Beat Saber The kids loved the games Now only my youngest uses it The novelty wears off It feels so heavy and uncomfortable after a bit,m5vlyb8,1.0,1hvsp4l
comment,m5vyerb,Abigail716,,7,2025-01-07 15:51:07,,,,I would try out the Quest 3 I know quite a few people including myself that could not use the Q2 for very long without getting a terrible headache But the three is way better Im now able to play it for hours without a problem at all IMO the Q3 is the first VR headset worth buying that isnt just a novelty,m5vlyb8,1.0,1hvsp4l
comment,m5w3gkc,djamp42,,1,2025-01-07 16:16:26,,,,Do you need a Facebook account to use quest I assume so,m5vlyb8,1.0,1hvsp4l
comment,m5w5zm5,byOlaf,,9,2025-01-07 16:28:54,,,,No I think you need a meta account but not sure It doesnt have to be linked to your Facebook,m5w3gkc,2.0,1hvsp4l
comment,m5wepu9,River41,,2,2025-01-07 17:11:42,,,,I made a new account with nothing on it just to link it to my quest account,m5w3gkc,2.0,1hvsp4l
comment,m5xcw2b,blazelet,,2,2025-01-07 19:56:24,,,,Is there a way for those of us who set up our Oculus 8 years ago when it had to be a facebook account to untether them without losing years of purchases Id love to delete my FB but dont want to lose all my purchases,m5wepu9,3.0,1hvsp4l
comment,m5xeg32,chewbadeetoo,,3,2025-01-07 20:03:58,,,,Yes there is I was able to untether and still have my library However I tend to not buy things on the oculus store if there is a choice,m5xcw2b,4.0,1hvsp4l
comment,m604xmz,blazelet,,1,2025-01-08 05:09:15,,,,Ill look into this thank you,m5xeg32,5.0,1hvsp4l
comment,m5xi9n2,River41,,1,2025-01-07 20:22:41,,,,Not sure definitely used to be the case but things may have changed,m5xcw2b,4.0,1hvsp4l
comment,m5zjw68,AlwaysLateToThaParty,,1,2025-01-08 02:50:57,,,,The primary thing i use my quest 2 for is watching 3D movies,m5vlyb8,1.0,1hvsp4l
comment,m7hx2fm,climber531,,1,2025-01-16 19:01:42,,,,i have had my Q2 since august 2024 and i have a few hundred hours i bought the BoboVR strap and its super comfortable havent really tried the social aspect in any other way than playing golf with my brother but its super fun for cardio and many interesting games normally play 2h at a time and never felt any headache or fatigue just get tired of playing the game after that long same with a normal monitor,m5vlyb8,1.0,1hvsp4l
comment,m5vrksa,NeutralTarget,,41,2025-01-07 15:15:43,,,,I remember VR setups in a mall arcade back in the mid 90s It was like 5 to play 10 years later another VR craze saying its the gaming of the future then another bringing us to today The tech keeps getting better but the average Joe is not buying Plus vertigo sucks,,0.0,1hvsp4l
comment,m5w1dzc,MukdenMan,,15,2025-01-07 16:06:04,,,,Yeah I remember playing one I think at Navy Pier in Chicago and it blew my mind It was a tank battle game and the headset tracked where my head was looking which was completely new to me at the time I thought a lot of games would be like that soon but didnt happen,m5vrksa,1.0,1hvsp4l
comment,m6775df,bremidon,,1,2025-01-09 09:23:00,,,,Back in the mid90s I lived in Chicago They had one at North Pier as well as a MechWarrior thing The game I played was some sort of onrails shooter with a wild end boss I seem to remember that a full game to the end took about 15 minutes I was one of only a few people who could beat it so that was always cool,m5w1dzc,2.0,1hvsp4l
comment,m678vi3,MukdenMan,,1,2025-01-09 09:41:59,,,,Maybe it was North Pier and I think it was the mechwarrior one The timeline makes sense,m6775df,3.0,1hvsp4l
comment,m679uie,bremidon,,1,2025-01-09 09:52:27,,,,Played the MechWarrior one with my girlfriend at the time now wife She actually beat me in that one because I was laughing so hard Her mech had one of the legs shot off and she was hopping around like crazy and I could barely see anything through the tears of laughter,m678vi3,4.0,1hvsp4l
comment,m5wkdq0,-Badger3-,,10,2025-01-07 17:39:16,,,,Its in the same realm of gimmick as the Xbox Kinect or Wii controllers imo Like yeah it can be a fun supplement to traditional gaming but its too janky to be a staple,m5vrksa,1.0,1hvsp4l
comment,m67d7tw,SuperSpecialAwesome-,,1,2025-01-09 10:28:37,,,,Have you ever tried Beat Saber,m5wkdq0,2.0,1hvsp4l
comment,m5zxb7k,zdiggler,,1,2025-01-08 04:14:49,,,,I want to get high AF sit on the couch and play games not fucking exercise,m5wkdq0,2.0,1hvsp4l
comment,m5wwd2v,triadwarfare,,6,2025-01-07 18:36:59,,,,I remember that too but it feels like framerates were too slow Its like those maze screensavers,m5vrksa,1.0,1hvsp4l
comment,m5x2673,Enderkr,,8,2025-01-07 19:04:39,,,,I can think of a half dozen amazing uses for ARVR off the top of my head but it sure seems like companies dont give a fuck about actual real world usage and instead keep pushing AR movies and bad video games To say nothing of the hyperlimiting form factor of a massive pair of goggles on your face,m5vrksa,1.0,1hvsp4l
comment,m60v5sr,TheNorthComesWithMe,,3,2025-01-08 09:17:49,,,,You could probably also think of dozens of amazing uses for regular phoneweb apps in the real world that also dont exist for the same reason Theres no money in it,m5x2673,2.0,1hvsp4l
comment,m5vz1iu,gwinerreniwg,,7,2025-01-07 15:54:16,,,,I agree w all this I feel like the killer app is yet to come Ive caught glimpses of the future from using the Apple Vision also flawed in many ways and the Quests but no one has managed to find the sweet spot yet I do think its a matter of chasing hardware Five years on or so and the most entertainment weve had so far are Beat Saber and Richies Plank Experience,m5vrksa,1.0,1hvsp4l
comment,m5whq0d,TheBroWhoLifts,,15,2025-01-07 17:26:22,,,,Half Life Alyx was one of the most engaging and thrilling gaming experiences Ive ever had If there was more content on oar with that it might attract a wider audience but the high price barrier to entry is going to be a problem A decent PC is required to run titles like that,m5vz1iu,2.0,1hvsp4l
comment,m5wxjyn,wingspantt,,9,2025-01-07 18:42:41,,,,Alyx unfortunately isnt mass market enough Its borderline horror it is the third or fourth entry in a series of games from 20 years ago meaning newyoung gamers dont have any connection to the story So the game is really good but it is also very alienating,m5whq0d,3.0,1hvsp4l
comment,m5wo9d6,kb_hors,,3,2025-01-07 17:57:53,,,,ehhh Alyx runs well in VR on an old 1660ti and a ryzen 2600 Thats Decent for 2019,m5whq0d,3.0,1hvsp4l
comment,m5wmy32,ajemik,,3,2025-01-07 17:51:39,,,,Sadly theres what Alyx and if you want to stretch it Boneworks Other than that theres not much to really sell pcvr Ive bought quest 1 on release still have it but it sits in the box for whenever anything actually good releases Its still a gimmick and despite how amazing Alyx was VR still is a niche,m5whq0d,3.0,1hvsp4l
comment,m5wn4rk,TheBroWhoLifts,,3,2025-01-07 17:52:33,,,,I will say we have been enjoying Walkabout Mini Golf immensely in our home and play nearly every day A really fun title worth checking out,m5wmy32,4.0,1hvsp4l
comment,m5wnhud,ajemik,,1,2025-01-07 17:54:15,,,,I might check that out then But the point is other games feel gimmicky compared to Alyx you know Like you try to find an excuse to put the headset on rather than not being able to wait to play it No idea if Im expressing it well enough but I hope I do haha,m5wn4rk,5.0,1hvsp4l
comment,m5won43,TheBroWhoLifts,,1,2025-01-07 17:59:42,,,,Absolutely Cartoonish unpolished Agreed I even found Bone works to be really lacking and clunky and I just didnt get it The sandbox got old after a while and even though Im pretty fit the parkour shit was exhausting and frustrating Maybe I didnt get far enough but I really didnt get into it Vail has some promise as a competitive first person shooter but by far the greatest VR coop experience was Firewall Zero Hour on the original PSVR Wow what a game And Moss Super Hot Astro Bot and Statik Institute of Retention fucking brilliant deserve honorable mentions as well Those are old games and not much on the PC really comes close Its depressing Oh I just remembered Resident Evil 4 is another one worth playing especially if youre nostalgic for the original which is 100 but in pretty thrilling VR Oh and definitely check out Compound Man that game is fun as hell Stylized 8bitish 90s vibe first person roguelite shooter I still play it when Im feeling the itch,m5wnhud,6.0,1hvsp4l
comment,m5xg4ic,gwinerreniwg,,1,2025-01-07 20:12:13,,,,While I dont disagree this is a good app is it really any different than any 3D shooter weve seen for the last 30y some of which were available on early VR systems and several of which were on Quest before Alyx too Its clear FPS are not the killer app and in fact are pretty boring and cliche at this point despite the intuitive leap that such games should be better in VR While not wrong its not what a new pardigm needs to drive a new market in my opinion of course,m5whq0d,3.0,1hvsp4l
comment,m5xiicp,TheBroWhoLifts,,1,2025-01-07 20:23:50,,,,Have you actually played Alyx It was made from the ground up to be only VR and you can tell Ive played a ton of VR and no other titles have come close not only in technicalgraphical terms but also interactivity story and environment Its a masterpiece And the community of creators makes it so that there is a ton of extra playability Story graphics and interaction matter and that game sets the gold standard,m5xg4ic,4.0,1hvsp4l
comment,m5xzkk0,gwinerreniwg,,-1,2025-01-07 21:45:10,,,,I do own Alyx Im not saying its not a good game I enjoyed it but theyre not breaking any new ground with the format with what is basically VR halflife how many decades old now Its original like the new Star Wars series are,m5xiicp,5.0,1hvsp4l
comment,m5wtojf,_bramwell_,,3,2025-01-07 18:24:10,,,,Is it useable as a home TV replacement Like sit on the sofa with the headset and watch a movie I always figured that would be the killer use case Big screen viewing in a personal footprint,m5vz1iu,2.0,1hvsp4l
comment,m5wxrw8,wingspantt,,7,2025-01-07 18:43:43,,,,Yes but if you live with other people it feels weird to not know if youre actually alone in the room,m5wtojf,3.0,1hvsp4l
comment,m5yb525,PrimeIntellect,,4,2025-01-07 22:42:55,,,,this is kind of the lynchpin that will make it never really take off people are already struggling hard with too much screentime and a new product that makes you in 100 screen is even worse and essentially removes any chance with interacting with people around you,m5wxrw8,4.0,1hvsp4l
comment,m5xf9u5,gwinerreniwg,,3,2025-01-07 20:08:01,,,,I think it depends on your stage in life As a single or young person perhaps but its not a universal appeal some ppl have equally good home theater systems w surround and all the trimmings others prefer the social interactions of having others visible and interacting in the room,m5wtojf,3.0,1hvsp4l
comment,m5zz9ng,nerevisigoth,,4,2025-01-08 04:28:18,,,,Theres also the terror of being licked by your dog when youre in VR,m5xf9u5,4.0,1hvsp4l
comment,m60eont,Responsible-Win5849,,1,2025-01-08 06:30:14,,,,Do you know anyone that uses the social interaction part locking downdisabling everything I could was step 1 before even powering on my headset but always curious if there are some people that actually want to run around with a hot mic all session,m5xf9u5,4.0,1hvsp4l
comment,m60vpox,TheNorthComesWithMe,,3,2025-01-08 09:23:52,,,,Whats the killer app of a laptop Or a smartphone Or a monitor Its not about having one single killer app but having a sufficient amount of usefulness,m5vz1iu,2.0,1hvsp4l
comment,m61jkqs,gwinerreniwg,,1,2025-01-08 13:03:16,,,,Laptop Lotus 123Excel Smartphone the app itself as a concept but arguably social media Monitor the FPS concept QuakeDoom,m60vpox,3.0,1hvsp4l
comment,m5ygx0u,None,,2,2025-01-07 23:13:19,,,,This The only thing I was interested in playing is Minecraft Too bad Mojang deleted this feature so now the only way to play Minecraft in VR is on PC using Java edition mods which is fine for many but it sucks for me because I play on bedrock only since I am a console gamer Like I have no other interesting things to do with a vr helmet,m5vz1iu,2.0,1hvsp4l
comment,m5wnuf2,kb_hors,,0,2025-01-07 17:55:54,,,,VR has no killer app is a strange thing for me to hear when Ive owned a VR Headset since 2022 exclusively to run VRChat which has a userbase big enough to pull 20k people to a weeklong online event and has an entire industry grown around it It absolutely has a killer app Is it one most people want or need No But for those who do Indispensable,m5vz1iu,2.0,1hvsp4l
comment,m5wzgkt,SimiKusoni,,12,2025-01-07 18:51:44,,,,Is it one most people want or need No A killer app is an application that drives hardware sales to the point where it is the primary or even sole driver of a platforms success There are certainly popular applications for VR but there is nothing that has captured the market to that degree and I think youd be hard pressed to make the argument that VRChat is significantly driving unit sales for VR headsets,m5wnuf2,3.0,1hvsp4l
comment,m5zjg8o,kb_hors,,2,2025-01-08 02:48:22,,,,I can make that argument incredibly easily because its true Ive met hundreds of VR users none of which did anything other than VRChat and a couple of other social VR experiences like that minigolf game whatever its called Thats the only reason to buy a VR Headset at all it has no other practical use You can see this in the entire market around VR Accessories Full body trackers are not for whatever Mark Facebook is advertising theyre for doing queer shit with furries,m5wzgkt,4.0,1hvsp4l
comment,m60ff4o,Responsible-Win5849,,3,2025-01-08 06:37:01,,,,And here I was wondering who on earth would want to waste time in virtual chatrooms beyond the usual preachers hunting children Glad to see the 2nd life folks found another place to go,m5zjg8o,5.0,1hvsp4l
