type,id,author,title,score,created_utc,url,num_comments,subreddit,body,parent_id,depth,post_id
comment,m5xjavj,gestalto,,2,2025-01-07 20:27:38,,,,Q23 sold not far off the same amount as the Xbox series SX in the same time period People underestimate how quickly they are becoming mainstream The sales are on par or thereabouts with Xbox Xbox series Gamecube and Wii U,m5vrksa,1.0,1hvsp4l
comment,m5wlof1,whewtang,,1,2025-01-07 17:45:35,,,,This just comes across like you havent tried anything since the 90s Got psvr2 on sale over the holidays Have been playing Gran Turismo 7 and its excellent Being able to see the cars as if youre sitting in them walking around them Actually being able to distinguish the elevation changes of real race tracks This isnt like a virtual boy or whatever,m5vrksa,1.0,1hvsp4l
comment,m5xei85,rockman12x,,0,2025-01-07 20:04:16,,,,Exactly what I think when I read comments like these Clearly they havent even touched a modern headset Vertigo What vertigo lol Even better when they mention screen door effect I really wish every comment here had a disclaimer if they have even used a quest 3 or psvr2,m5wlof1,2.0,1hvsp4l
comment,m60fpfb,Responsible-Win5849,,4,2025-01-08 06:39:38,,,,vertigomotion sickness can still happen with the newer headsets My wife gets a bit of nausea after 2030 minutes with the quest 3 while wearing glasses waiting to see if the lens inserts help with that,m5xei85,3.0,1hvsp4l
comment,m5ybad2,PrimeIntellect,,3,2025-01-07 22:43:41,,,,I mean thats basically why nobody really cares or wants to buy this shit because the whole premise is just kind of dumb,m5xei85,3.0,1hvsp4l
comment,m5ww0mj,MajorFuckingDick,,1,2025-01-07 18:35:19,,,,VR still isnt there for the average joe The standalone games are awesome but most people dont want that level of activity for a game Bringing back 3D gaming with a controller would be huge but thats another can of worms Setting it up for PCVR has an entire box of issues on its own that someone who just wants to play games will be annoyed with The amount of tinkering needed to access a lot of the things that enthusiast rave about is too much for most A console headset that lets you play normal games in 3D rather than just Theater Mode is a huge potential market that I foresee being the boom Personally watching my first 3D movie at home that rivaled or surpassed theater experience and racing with the direct feedback of my wheel sold me on VR forever A lot of big players see the writing on the wall but still cant crack the code I want to say that the next console generation will have the stuff needed to bring it into every home but that feels naive,m5vrksa,1.0,1hvsp4l
comment,m5vpx21,Mastoraz,,21,2025-01-07 15:06:47,,,,They shot themselves in the foot releasing it so weakened just before the Quest 3 If it had the same SOC and same passthrough as Quest 3 the Quest Pro would be doing a lot better And at 999 launch price instead of 1499,,0.0,1hvsp4l
comment,m5vwdq5,TheRogueMoose,,20,2025-01-07 15:40:54,,,,The Pro wasnt for gaming though It was targeting the business sector which has zero interest in it,m5vpx21,1.0,1hvsp4l
comment,m5vwp46,Mastoraz,,10,2025-01-07 15:42:31,,,,Yeah that too was idiotic lol It put the pedestal even higher since it was targeted for that and yet underperformed remarkably with that hardware and software lack of support they had on it,m5vwdq5,2.0,1hvsp4l
comment,m5ymaob,FlyingBishop,,2,2025-01-07 23:42:42,,,,Any realistic business use cases actually have higher requirements than gaming Even just virtual desktop you need 10x the specs to get an actually on par experience with conventional monitors And of course the monitors cost 110th the price,m5vwdq5,2.0,1hvsp4l
comment,m5zfoh7,mistercartmenes,,7,2025-01-08 02:26:33,,,,gifgiphycO39srN2EUIRaVqaVq,,0.0,1hvsp4l
comment,m5zxxuy,zdiggler,,13,2025-01-08 04:19:05,,,,FUCK FACEBOOK AND EVERYTHING THEY MAKE AND STAND FOR,,0.0,1hvsp4l
comment,m5wxcnw,Ghozer,,7,2025-01-07 18:41:43,,,,I have no desire for more mobility in VR than my CV1 Roomscale setup,,0.0,1hvsp4l
comment,m5xeiun,None,,-1,2025-01-07 20:04:21,,,,I dont even know what CV1 roomscale is,m5wxcnw,1.0,1hvsp4l
comment,m5xhdgs,axle66,,4,2025-01-07 20:18:21,,,,The Oculus Rift Consumer Version 1 It was the PC desktop headset released by oculus before they were acquired by Facebook If you get additional sensors you can do room scale with it,m5xeiun,2.0,1hvsp4l
comment,m60zbzk,ghhfcbhhv,,1,2025-01-08 10:02:31,,,,Facebook acquired them before the release of the DK2,m5xhdgs,3.0,1hvsp4l
comment,m5xwwtr,None,,-10,2025-01-07 21:32:19,,,,I see Still no interest or utility for me whatsoever 3D printing VR EV AI whats next thing that has way too much hype than it eventually is,m5xhdgs,3.0,1hvsp4l
comment,m60vtpj,thrownawaymane,,3,2025-01-08 09:25:05,,,,All 4 of those technologies are changing the world Plenty of money to be made by picking horses in each of those fields too Additive manufacturing especially is just mainstream now,m5xwwtr,4.0,1hvsp4l
comment,m60w7ul,None,,-2,2025-01-08 09:29:26,,,,Not as much as the hype said,m60vtpj,5.0,1hvsp4l
comment,m5yf8xd,SuicidalChair,,7,2025-01-07 23:04:21,,,,Like all of those things have tons of utility to everyone if they know what they can do and not just go into confused grandpa mode,m5xwwtr,4.0,1hvsp4l
comment,m60i0qy,UgarMalwa,,4,2025-01-08 07:01:21,,,,I used Meta Quest 3 honestly I found it impressive on what it could do and had fun playing it Especially if youre using apps like Youtube which lets you view the screen like a cinema and stuff The 360 videos are also fire Motion trackingcontrols are fine a bit like the Wii but actually more functional There are some negatives however Battery life sucks this isnt the fault of the system though because of how it works But you will notice that it will eat away after 30mins to an hour MetaHorizon can be a cesspool of shitty worlds full of screaming children and trolls Motion sickness happens especially when youre standing The app store feels somewhat empty with A lot of garbage shovelware youd expect from your IOS app Oh and obviously you cant use it outside not only is it dangerous since apps will obscure your vision but the sun can also cause screen damage There are work arounds but there is not real reason to in the first place I do have to give Meta credit however for the innovation of actually making something functional regardless of their questionable reputation,,0.0,1hvsp4l
comment,m5wqh52,sold_snek,,7,2025-01-07 18:08:38,,,,People in this thread acting like this is some huge L for Meta They discontinued because they dont need it anymore,,0.0,1hvsp4l
comment,m5wu8nz,None,,3,2025-01-07 18:26:49,,,,I love VR I wish more people used it,,0.0,1hvsp4l
comment,m60t3vl,ThisNameTakenTooLoL,,2,2025-01-08 08:55:24,,,,It wasnt high end It just had a high endish price,,0.0,1hvsp4l
comment,m60l5lr,l0veit0ral,,3,2025-01-08 07:32:07,,,,Would have been best to leave Occulus alone and let them keep being brilliant instead of buying them and gutting the talent there and think Mark knew how to do VR better SMDH,,0.0,1hvsp4l
comment,m60o3g2,GagOnMacaque,,0,2025-01-08 08:01:56,,,,Oculus you got it itself once it was bought Meta didnt have to do anything,m60l5lr,1.0,1hvsp4l
comment,m5ycgas,blackburnduck,,2,2025-01-07 22:49:39,,,,Biggest problem with quest is meta itself After spending hours diagnosing 40 quest 2 headsets and having to deal with the forced and terrible facebook integration I simply refuse to purchase the product The simple act of pairing remotes is a pain in the ass and feels like im back to the 80s Switch syncs with a click BT sincs with a press Quest Takes a whole process and serial codes for every remore They may be the best overall headset nowadays but Im never getting a quest because of this shoddy forced social integration,,0.0,1hvsp4l
comment,m5yfxst,SuicidalChair,,0,2025-01-07 23:08:04,,,,Well which is it the shoddy social integration or the bad controller pairing you do once or twice while owning it And you used switch as an example when every time a Nintendo switch opens a new screen or menu it disconnects all the controllers and asks you to resync them for player number lol,m5ycgas,1.0,1hvsp4l
comment,m5yhtrq,blackburnduck,,3,2025-01-07 23:18:13,,,,It is the same my man You need to connect the social part to pair a controler,m5yfxst,2.0,1hvsp4l
comment,m5xxcm4,pandaSmore,,2,2025-01-07 21:34:26,,,,Remember when it was just Oculus gifgiphy76x4gSMy8dT9u,,0.0,1hvsp4l
comment,m5zwr2t,zdiggler,,2,2025-01-08 04:11:03,,,,no one wants to wear crap on their head to play games Bottom line,,0.0,1hvsp4l
comment,m5z3sg7,Mysterious_Camera313,,1,2025-01-08 01:18:38,,,,Yay,,0.0,1hvsp4l
comment,m60gbxf,iaymnu,,1,2025-01-08 06:45:25,,,,There was a High end VR headset what was it called,,0.0,1hvsp4l
comment,m61au4d,Majestic-Seaweed7032,,1,2025-01-08 11:55:23,,,,Meta should discontinue as a whole,,0.0,1hvsp4l
comment,m61nux0,CiraKazanari,,1,2025-01-08 13:32:13,,,,The quest 3 is higher end so no they did not,,0.0,1hvsp4l
comment,m61vguo,punkrocknight,,1,2025-01-08 14:19:44,,,,I would never buy a META product,,0.0,1hvsp4l
comment,m66oilg,ober0n98,,1,2025-01-09 06:14:02,,,,Oh no what will the ten buyers do,,0.0,1hvsp4l
comment,m5z1mwf,AccomplishedBrain309,,1,2025-01-08 01:06:39,,,,They were unable to censer its content,,0.0,1hvsp4l
comment,m5w86gl,HellxKnight,,1,2025-01-07 16:39:40,,,,Saw this coming,,0.0,1hvsp4l
comment,m5wcmiy,DocHolidayPhD,,0,2025-01-07 17:01:24,,,,Hahahahahahaha,,0.0,1hvsp4l
comment,m5wfytp,MakarovIsMyName,,-4,2025-01-07 17:17:47,,,,I am having fries filet o fish sammiches for lunch,,0.0,1hvsp4l
comment,m9mv0hf,Acrobatic_Cow7637,,0,2025-01-28 13:47:46,,,,hilarious did you make that up yourself,m5wfytp,1.0,1hvsp4l
comment,m9nutwu,MakarovIsMyName,,1,2025-01-28 16:49:44,,,,makes more sense than this shit article,m9mv0hf,2.0,1hvsp4l
comment,m5w3yk4,RolePuzzleheaded7400,,0,2025-01-07 16:18:54,,,,When will the PC dongle for the PSVR2 become readily available Thats what I want to know,,0.0,1hvsp4l
comment,m5xsq2h,j_knolly,,-8,2025-01-07 21:12:23,,,,People actually bought these useless things,,0.0,1hvsp4l
comment,m5y1z44,CoasterThot,,-3,2025-01-07 21:56:44,,,,RIP one of the only ways to get into your Facebook account if it was hacked or locked out People would buy these and then Facebook would somehow magically be able to unlock your account when it wouldnt before,,0.0,1hvsp4l
comment,m5xotuq,ftatman,,-9,2025-01-07 20:53:51,,,,They forgot the absolutely golden rule Nobody wants to wear stupid shit on their face,,0.0,1hvsp4l
