type,id,author,title,score,created_utc,url,num_comments,subreddit,body,parent_id,depth,post_id
post,1hvw36p,a_Ninja_b0y,Acer’s newest Steam Deck rival is enormous with Nintendo Switch like controllers,203,2025-01-07 17:02:22,https://www.reddit.com/r/gadgets/comments/1hvw36p/acers_newest_steam_deck_rival_is_enormous_with/,56.0,gadgets,,,,
comment,m5wctgi,AutoModerator,,1,2025-01-07 17:02:22,,,,We have a giveaway running be sure to enter in the post linked below for your chance to win a Unihertz Jelly Max the Worlds Smallest 5G Smartphone Click here to enter I am a bot and this action was performed automatically Please contact the moderators of this subredditmessagecomposetorgadgets if you have any questions or concerns,,0.0,1hvw36p
comment,m5wfudt,garry4321,,117,2025-01-07 17:17:10,,,,What if we strap controllers to the sides of a laptop execs,,0.0,1hvw36p
comment,m5wjstn,rhodebot,,18,2025-01-07 17:36:28,,,,Everything old is new again Remember the Asus Eee sticks,m5wfudt,1.0,1hvw36p
comment,m5z9fby,Andrew_hl2,,6,2025-01-08 01:50:14,,,,Remember the Razer edge from 2013 that thing had like 40 mins of gaming battery and was super clunky haha,m5wjstn,2.0,1hvw36p
comment,m60sgdj,Itsumiamario,,1,2025-01-08 08:48:21,,,,Remember the Sega Game Gear That thing took like six batteries and had about ten minutes of play time,m5z9fby,3.0,1hvw36p
comment,m62h2vq,Andrew_hl2,,1,2025-01-08 16:15:22,,,,Had one with recheargable battery packs lol,m60sgdj,4.0,1hvw36p
comment,m5xfzzd,internetlad,,1,2025-01-07 20:11:37,,,,The most fun I had with an Asus EEE product was saying the name,m5wjstn,2.0,1hvw36p
comment,m61ieqd,leveled_81,,1,2025-01-08 12:55:01,,,,,m5xfzzd,3.0,1hvw36p
comment,m5xkgi3,The_Frostweaver,,4,2025-01-07 20:33:12,,,,What if you just bought one device and it could be your phone laptop and console windows phone has entered the chat,m5wfudt,1.0,1hvw36p
comment,m60dodu,gold_rush_doom,,5,2025-01-08 06:21:03,,,,You forgot TV and alarm clock,m5xkgi3,2.0,1hvw36p
comment,m64jdox,speculatrix,,3,2025-01-08 22:17:14,,,,Motorola Atrix enters the chat wheeled in inside a coffin,m5xkgi3,2.0,1hvw36p
comment,m5ypjei,thatevilman,,8,2025-01-08 00:00:23,,,,I cannot imagine that slab of a device being comfortable to use Even my Deck starts feeling uncomfortable after a while,,0.0,1hvw36p
comment,m5zlxcc,NecroCannon,,2,2025-01-08 03:02:42,,,,Im legit thinking of getting a pocket handheld because sometimes I just wanna be able to play games while laying down and not be in pain I wish one of these companies can just make a small one Android handheld it is just wish I could play AAA games,m5ypjei,1.0,1hvw36p
comment,m63fz0v,physeK,,3,2025-01-08 19:06:25,,,,Im using a Retroid Pocket 5 right now and just started using Xbox Game Pass Ultimate to stream games from the cloud Its surprisingly responsive and gives me access to a bunch of highpowered stuff as long as I have an internet connection,m5zlxcc,2.0,1hvw36p
comment,m63tivg,NecroCannon,,1,2025-01-08 20:11:58,,,,Yeah I was looking at getting that lol Seeing GeForce now get wider support Ill probably just upgrade my computer instead of getting rid of it for home streaming and get GeForce when Im on the go since I have 5GUW,m63fz0v,3.0,1hvw36p
comment,m5wody9,21Fudgeruckers,,17,2025-01-07 17:58:30,,,,That looks so goddamn uncomfortable,,0.0,1hvw36p
comment,m65qss7,Kriztauf,,1,2025-01-09 02:18:26,,,,It doesnt even look operable,m5wody9,1.0,1hvw36p
comment,m6i6qw9,kamildevonish,,1,2025-01-11 01:21:09,,,,It doesnt seem well thought out If the controllers are proportionate to the screen wouldnt the controller made from the joycons be weirdly larger than normal controllers,m65qss7,2.0,1hvw36p
comment,m5xhuai,jl_theprofessor,,4,2025-01-07 20:20:39,,,,Good fuck That is not a handheld,,0.0,1hvw36p
comment,m60g87s,exeis-maxus,,0,2025-01-08 06:44:28,,,,s _lapheld_,m5xhuai,1.0,1hvw36p
comment,m5zki37,pukem0n,,2,2025-01-08 02:54:26,,,,That image in the article of the dude holding it looks comical,,0.0,1hvw36p
comment,m603d84,Feesuat69,,2,2025-01-08 04:57:43,,,,Ill buy the third gen version when all the manufacturing defects have been removed,,0.0,1hvw36p
comment,m5x9y5d,Pokii,,2,2025-01-07 19:42:22,,,,Does it come with attachable suspenders to help distribute the weight,,0.0,1hvw36p
comment,m5yj5vs,Sick_Wave_,,4,2025-01-07 23:25:27,,,,No trackpad no buy,,0.0,1hvw36p
comment,m5wv493,OperatorJo_,,2,2025-01-07 18:30:59,,,,No need to work out your arms if you play on this thing 3 hours a day That thing looks HUGE,,0.0,1hvw36p
comment,m5xgd23,internetlad,,4,2025-01-07 20:13:23,,,,Acer the choice of swole nerds,m5wv493,1.0,1hvw36p
comment,m5xydt4,bingojed,,2,2025-01-07 21:39:27,,,,sulky enjoy north bear soup wise fanatical cable knee compare This post was mass deleted and anonymized with Redact,,0.0,1hvw36p
comment,m5yiuqr,Neo_Techni,,1,2025-01-07 23:23:47,,,,Yeah I can barely see the Steam Deck screen now,m5xydt4,1.0,1hvw36p
comment,m5x2as5,Retro1989,,1,2025-01-07 19:05:16,,,,Estimated gaming time 30 minutes,,0.0,1hvw36p
comment,m5yk5bf,shifty_coder,,1,2025-01-07 23:30:51,,,,Must have been designed by former SEGA engineers,m5x2as5,1.0,1hvw36p
comment,m5xbw5q,fullload93,,3,2025-01-07 19:51:40,,,,who the hell is buying these shit clone devices Its like MS trying to copy Apple but even worse in this situation,,0.0,1hvw36p
comment,m5xggt0,internetlad,,4,2025-01-07 20:13:53,,,,The funny thing is for me at least I use the touchpads on 95 of games and none of these devices have one,m5xbw5q,1.0,1hvw36p
comment,m60bc9j,LeonMust,,1,2025-01-08 06:00:28,,,,I was just telling my friend the other day that I wanted a 10 sized gaming handheld and one of the companies should make one I like everything about the 11 model but I feel it doesnt need 1600p resolution 1080p wouldve been fine for a screen that size,,0.0,1hvw36p
comment,m60xy4t,fatbongo,,1,2025-01-08 09:47:43,,,,Whats the deal with the fold up mobile controller,,0.0,1hvw36p
comment,m5xfx9v,internetlad,,1,2025-01-07 20:11:14,,,,Acer enormous switch joycon style controllers Its like the triangle of things I dont want in a handheld,,0.0,1hvw36p
comment,m6383ao,CutsAPromo,,1,2025-01-08 18:28:41,,,,Theres no such thing as a steamdeck rival,,0.0,1hvw36p
comment,m5xfumx,BrewKazma,,-2,2025-01-07 20:10:52,,,,So it has garbage controllers The last controller on earth Id want to be compared to are Switch controllers,,0.0,1hvw36p
comment,m5y251t,Randy_Muffbuster,,-2,2025-01-07 21:57:32,,,,For real man Ive got a switch gathering dust because my third pair of joycons started drifting with less than 80 hours of use Absolute trash I refuse to buy any more of them,m5xfumx,1.0,1hvw36p
comment,m5y2ik2,BrewKazma,,-2,2025-01-07 21:59:21,,,,Not only the drift but they are awkward and uncomfortable Bad design,m5y251t,2.0,1hvw36p
