type,id,author,title,score,created_utc,url,num_comments,subreddit,body,parent_id,depth,post_id
comment,m98dr2x,LaughingBeer,,4,2025-01-26 07:29:16,,,,Kept mine until last year Probably the longest I held onto a graphics card Gamed in 1440p I had to start putting more modern games at the mid range graphical settings but they still looked good Upgraded to 4090 and Im back to the highest settings in all games with no problems,m9577n2,3.0,1i9oky5
comment,m98fky2,Miragui,,3,2025-01-26 07:47:21,,,,I did exactly the same and the upgrade to the RTX 4090 seems better and better with all the reviews coming out I think the RTX 4090 price might even shoot up due to the disappointing specs of the RTX 50XX series,m98dr2x,4.0,1i9oky5
comment,m957ki6,Boltrag,,3,2025-01-25 19:52:41,,,,Im doing 1440p,m9577n2,3.0,1i9oky5
comment,m98k134,TrptJim,,2,2025-01-26 08:31:40,,,,Games are starting to require ray tracing and mesh shaders such as Indiana Jones and Alan Wake 2 respectively which Pascal and earlier GPUs do not properly support Were getting close to where a 1080ti is no longer relevant for modern graphics They held on for quite some time though my GTX 1080 lasted me 7 years of use,m9577n2,3.0,1i9oky5
comment,m947v4o,cricks1492,,1,2025-01-25 17:01:05,,,,Same At this point Im just kinda riding it out until that bad boy dies,m93sm3q,2.0,1i9oky5
comment,m942ydr,richardizard,,1,2025-01-25 16:37:52,,,,They should drop in price when the 50 series comes out plus Im sure youll find plenty of them used,m93k873,1.0,1i9oky5
comment,m957c1t,superpingu1n,,2,2025-01-25 19:51:32,,,,Or people will realize 4090 is worth gold,m942ydr,2.0,1i9oky5
comment,m988hpi,LegacySV,,1,2025-01-26 06:39:27,,,,The 5080 would the rtx 5070 ti would prob just be like 4080 performance,m93k873,1.0,1i9oky5
comment,m940fh9,SolarNachoes,,4,2025-01-25 16:25:54,,,,Doesnt 5080 have less ram than 4090,,0.0,1i9oky5
comment,m98b0h3,None,,3,2025-01-26 07:02:46,,,,Yep But that doesnt really matter for most applications,m940fh9,1.0,1i9oky5
comment,m93jhjq,Dirty_Dragons,,41,2025-01-25 14:59:54,,,,Its also a hell of a lot cheaper than a 4090,,0.0,1i9oky5
comment,m93kbok,Jackal239,,12,2025-01-25 15:04:31,,,,It isnt Current vendor pricing has most models of the 5080 around 1500,m93jhjq,1.0,1i9oky5
comment,m93o1u3,None,,17,2025-01-25 15:24:34,,,,You buying from a scalper or in Canada Lol,m93kbok,2.0,1i9oky5
comment,m93l6n1,Dirty_Dragons,,34,2025-01-25 15:09:16,,,,And how much do you think 4090 are going for now Never mind the fact that you cant even buy a 50 series GPU yet,m93kbok,2.0,1i9oky5
comment,m93lscl,Jackal239,,-14,2025-01-25 15:12:30,,,,1799 on Best Buy right now Thats not significantly cheaper,m93l6n1,3.0,1i9oky5
comment,m93ndlw,Dirty_Dragons,,13,2025-01-25 15:21:00,,,,The 5080 is listed at 99999 on Best Buy What point are you trying to make,m93lscl,4.0,1i9oky5
comment,m93oib9,Jackal239,,0,2025-01-25 15:26:55,,,,The FEs are going to get gobbled up by scalpers in seconds That price will only exist on paper just like when the 3080s launched The actual price that you will be able to buy one will be around 1500 Its like saying Arizona Sweet Tea only costs 99 cents because the price is on the can It does not at 99 of retailers,m93ndlw,5.0,1i9oky5
comment,m93zwht,bites_stringcheese,,8,2025-01-25 16:23:22,,,,AIB pricing for 5080 is 1100 to 1300 if you ignore Asus Still cheaper than a 4090 and many 4080S models,m93oib9,6.0,1i9oky5
comment,m94uptj,gokarrt,,2,2025-01-25 18:50:21,,,,you might as well go wholehog and compare scalper pricing,m93oib9,6.0,1i9oky5
comment,m93pfqp,Dirty_Dragons,,4,2025-01-25 15:31:45,,,,Dude I listed a primary source Thats it For the record I bought my 4070 Ti at launch for MSRP,m93oib9,6.0,1i9oky5
comment,m993lh6,None,,1,2025-01-26 11:48:26,,,,They took it off the can years ago,m93oib9,6.0,1i9oky5
comment,m948qvr,rtyrty100,,5,2025-01-25 17:05:18,,,,999 is in fact cheaper than 1599 And if were going to use AIB or inflated prices then its like 1500 vs 2100,m93kbok,2.0,1i9oky5
comment,m9bvrwn,CosmicCreeperz,,1,2025-01-26 20:46:19,,,,Thats not nVidias fault Their 4090 is 1800 and 5080 is 1000 They are for entirely different users and markets Markups and scalping have nothing to do with performance differences,m93kbok,2.0,1i9oky5
comment,m93l6fz,MachineStreet7107,,0,2025-01-25 15:09:14,,,,And The 4080 was faster and cheaper than the 3090 This article is focusing on the smaller jump in performance over the previous models But yes it is less expensive than the 4090 was at launch Its also less expensive than a Honda civic Still sucks that were getting less of a jump in performance,m93jhjq,1.0,1i9oky5
comment,m9bwvcr,CosmicCreeperz,,1,2025-01-26 20:51:24,,,,3090 was never really marketed as a gamingfirst card 24 GB RAM was the main reason for the markup which was more useful for content creators etc 4090 was definitely marketed as an enthusiast card since the overall gaming performance was such a jump,m93l6fz,2.0,1i9oky5
comment,m948lb7,getliquified,,19,2025-01-25 17:04:33,,,,Well I have a 3080 so Im still upgrading to a 5080,,0.0,1i9oky5
comment,m94lw84,SFXSpazzy,,26,2025-01-25 18:08:27,,,,This is where I am if Im paying 1k for a card Im not buying a used marked up 40804080S The jump from gen to gen isnt that big but from a 3080 to a 5080 will be a huge performance uplift I have a 3080ti currently,m948lb7,1.0,1i9oky5
comment,m96auvz,xtopcop,,6,2025-01-25 23:17:05,,,,Coming from a 2080 so I have the same mindset Im set on that 5080,m94lw84,2.0,1i9oky5
comment,m94ymd8,opeth10657,,1,2025-01-25 19:09:02,,,,Have a 3090ti atm will probably eventually try for a 5090 High end PC gaming has always been an expensive hobby but if you can afford it,m94lw84,2.0,1i9oky5
comment,m94upna,grumd,,6,2025-01-25 18:50:19,,,,I was also looking at a 5080 but been playing with my watercooled 3080s settings today and its so well tuned that Im kinda hesitant to let it go,m948lb7,1.0,1i9oky5
comment,m96mwf5,Mental_Medium3988,,2,2025-01-26 00:24:37,,,,im on a 3070 if it had more vram id be fine with keeping it for a while but im constantly hitting against that and it sucks i use a super ultrawide and its just short of being what i need,m948lb7,1.0,1i9oky5
comment,m96hbjn,NotUnpredictable,,2,2025-01-25 23:53:22,,,,2070 super here going for the 5080,m948lb7,1.0,1i9oky5
comment,m94x9dg,PM_ME_STEAM_KEY_PLZ,,1,2025-01-25 19:02:27,,,,Have a 4070 and Im in a weird spot,m948lb7,1.0,1i9oky5
comment,m95nvjg,Brisslayer333,,1,2025-01-25 21:15:32,,,,May as well have bought a 4080 super woulda had it longer,m948lb7,1.0,1i9oky5
comment,m95qcng,BlueLiquidPlus,,1,2025-01-25 21:27:55,,,,Same moved from a 1080 to a 3080 my new build will be a 5080 I can only assume and hope we will see a significant increase over the 3080s,m948lb7,1.0,1i9oky5
comment,m971jsd,Candle1ight,,1,2025-01-26 01:47:26,,,,Im tempted too its starting to struggle at 4k if Im pushing settings Ill see what it ends up actually costing at MSRP its tempting if its scalped its really not,m948lb7,1.0,1i9oky5
comment,m9590hz,FactHot5239,,-2,2025-01-25 19:59:58,,,,Shill,m948lb7,1.0,1i9oky5
comment,m950m0f,SpaceEggs_,,3,2025-01-25 19:18:41,,,,gifgiphy3kzJvEciJa94SMW3hN,,0.0,1i9oky5
comment,m953f7t,prroteus,,3,2025-01-25 19:32:17,,,,I think my 4090 is going to be with me until my kids are in college at this point,,0.0,1i9oky5
comment,m96clrb,TheSmJ,,3,2025-01-25 23:26:49,,,,The 50 series is really all about DLSS 40,,0.0,1i9oky5
comment,m9837r4,i_am_banished,,3,2025-01-26 05:54:03,,,,Me and my 3080 from 3 years ago just chilling and still playing everything i could possibly want to play Ill keep this going until deus ex human revolution takes place,,0.0,1i9oky5
comment,m93nxd1,KnightFan2019,,7,2025-01-25 15:23:54,,,,How many more times am i going to see this same title in the next couple weeks,,0.0,1i9oky5
comment,m94xjbk,namatt,,2,2025-01-25 19:03:47,,,,Wow who could have seen that coming,,0.0,1i9oky5
comment,m95gki0,PoisonGaz,,2,2025-01-25 20:38:29,,,,Tbh i havent upgrade since i bought my 1080ti Starting to finally see its age in some games but im not super hyped on this generation imo Might just wait a while longer and buy a 4090 if this is accurate certainly not shelling out 2 grand for current top of the line hardware,,0.0,1i9oky5
comment,m97oipc,SigmaLance,,2,2025-01-26 04:06:09,,,,I had a launch day 1080 and upgraded when the 4090 released I foresee another huge gap in between upgrades for me if I even upgrade again at all By the time I do have to upgrade prices will have become even more ridiculous than they are now,m95gki0,1.0,1i9oky5
comment,m998zfr,MarcusarilliuS,,1,2025-01-26 12:35:49,,,,Im also still on a 1080ti Ill see prices and available on the 5090 on Friday If its crazy high and low stock Ill just grab a used 4090,m95gki0,1.0,1i9oky5
comment,m95h9rn,dertechie,,2,2025-01-25 20:42:02,,,,Fully expected this after seeing the specs and 5090 benches Architectural improvements on the same node arent going to beat 50 more cores,,0.0,1i9oky5
comment,m95t41c,dudeitsmeee,,2,2025-01-25 21:42:00,,,,My money,,0.0,1i9oky5
comment,m960ezl,KryanSA,,2,2025-01-25 22:20:12,,,,I am SHOCKED Shocked I tell you,,0.0,1i9oky5
comment,m93v95k,nicenyeezy,,5,2025-01-25 16:00:42,,,,As someone with a 4090 this has soothed any fomo,,0.0,1i9oky5
comment,m96mk4n,MJOLNIRdragoon,,6,2025-01-26 00:22:42,,,,Jesus,m93v95k,1.0,1i9oky5
comment,m94a53j,flck,,3,2025-01-25 17:12:01,,,,haha yeah that was my first thought Granted I have a mobile 4090 so its more like a desktop 4080 but still same probably applies to the mobile chips,m93v95k,1.0,1i9oky5
comment,m98b5je,None,,2,2025-01-26 07:04:04,,,,The performance uplift will be even worse for the mobile chips because they wont be able to just crank power to compensate,m94a53j,2.0,1i9oky5
comment,m95s6fv,NahCuhFkThat,,3,2025-01-25 21:37:15,,,,For anyone wondering why this would be news or shocking A reminder of the standard Nvidia themselves set with 10series the GTX 1070 the REAL last XX70 card launched and it was faster than the GTX 980ti 649 and GTX Titan X 999 by a solid 810 So a 32 uplift from the GTX970 Oh and it launched cheaper than the Titan X and 980ti at just 379 MSRP This is like a humiliation ritual or some shit,,0.0,1i9oky5
comment,m9aa08r,cloudcity,,2,2025-01-26 16:15:17,,,,From a value standpoint 1070 is the GOAT in my opinion,m95s6fv,1.0,1i9oky5
comment,m9e4348,djphatjive,,1,2025-01-27 03:16:43,,,,They are dropping driver support for 10 series,m9aa08r,2.0,1i9oky5
comment,m93sb8r,stdstaples,,2,2025-01-25 15:46:23,,,,Yeah hardly a surprise,,0.0,1i9oky5
comment,m93vksa,Splatty15,,2,2025-01-25 16:02:17,,,,Not surprised Ill wait for the 9070 XT performance review,,0.0,1i9oky5
comment,m946lb5,combatsmithen1,,2,2025-01-25 16:55:00,,,,My 1070 still doing what I need,,0.0,1i9oky5
comment,m94bw82,LeCrushinator,,2,2025-01-25 17:20:32,,,,The 5000 series is a minor performance bump like 2030 and it was accomplished mostly though increased die size which means more power consumption and because of heat the clock speeds were not increased They were only able to go from a 5nm to a 4nm process which didnt give much room for efficiency improvements For the 5000 series theyre mostly relying on increased compute power and DLSS 4 to accomplish gains Because of the minor gains its no surprise that a 5080 isnt faster than a 4090,,0.0,1i9oky5
comment,m98blez,None,,1,2025-01-26 07:08:16,,,,Its more like 1015 if that in applestoapples comparison The 5090 has 33 more CUDA cores nearly 30 more power consumption and massively improved memory bandwidth due to being on a 512bit bus Thats the only reason it was able to beat a 4090 by 30 The 5080 has none of that The spec sheet looks very similar to a 4080 Super Very minor CUDA core count very minor power increase and very minor memory bandwidth increase relative to the 4080S means itll be a slightly better 4080 Super,m94bw82,1.0,1i9oky5
comment,m94qwcf,pazkal,,2,2025-01-25 18:32:09,,,,DO YOU LIKE MY JACKET,,0.0,1i9oky5
comment,m96kkpa,iamapinkelephant,,2,2025-01-26 00:11:35,,,,These comparisons of raster performance arent really relevant when the improvement between generations is meant to be and has been touted by NVIDIA as improvements in AI upscaling and framegen As much as articles and Redditors like to go brain dead and make absurd claims that additional framegen frames somehow increase input lag over just not having those frames exist at all the way everything is moving is towards generative AI backed rendering At this point in time everything has to move towards alternative rendering methods like AI gen unless we get a fundamental new technology that differs from the semiconductor That is unless you want to hear about how we all need three phase power to run our GPUs in the future,,0.0,1i9oky5
comment,m93ir8s,kclongest,,-6,2025-01-25 14:55:46,,,,Well no shit,,0.0,1i9oky5
comment,m93iyqb,Reablank,,21,2025-01-25 14:56:58,,,,Wasnt the case last gen,m93ir8s,1.0,1i9oky5
comment,m93k4x2,MachineStreet7107,,17,2025-01-25 15:03:30,,,,This breaks a long held chain that the new xx80 card is faster than the xx90 and so on for other models generally This new lineup of cards are barely faster than the last models when you discard all the software tricks Nvidia uses which are genuine innovation but the hardware jump is starting to get very small Just more proof that Moores law only gets stronger year after year Not really a no shit scenario but if being snarky makes you feel smart then go off king,m93ir8s,1.0,1i9oky5
comment,m93ln61,uiucfreshalt,,5,2025-01-25 15:11:44,,,,Long held chain brother there have only been 3 xx90 cards meaning there has been 2 times where xx80 was faster than the previous gen,m93k4x2,2.0,1i9oky5
comment,m93mumq,MachineStreet7107,,6,2025-01-25 15:18:11,,,,And so on for other models what did you think I meant by that I was not only referring to xx90 models The 770 was faster than the 680 too It is a long held chain,m93ln61,3.0,1i9oky5
comment,m93taoe,uiucfreshalt,,0,2025-01-25 15:51:11,,,,Read that as 5070 faster 4080 4070 faster 3080 etc my b,m93mumq,4.0,1i9oky5
comment,m93pa42,sylfy,,-3,2025-01-25 15:30:57,,,,The hardware improvements went into AI TOPS If you look at TOPS the 5080 increases nearly 15x over the 4090 Like it or not rasterization is dead and Nvidia is doubling down on AI The people screaming about fake frames or fake pixels are going to be left screaming into the void as they get left further and further begins with their AMD cards,m93k4x2,2.0,1i9oky5
comment,m93q5wr,MachineStreet7107,,2,2025-01-25 15:35:33,,,,Yup and to be honest it makes sense Moores law is alive as ever and software innovations and the hardware to support it is going to be key for making actually meaningful performance gains,m93pa42,3.0,1i9oky5
comment,m95jqiy,Dragons52495,,0,2025-01-25 20:54:31,,,,Go watch a video on mfg Its fucking ass So yes fake frames are in fact shit,m93pa42,3.0,1i9oky5
comment,m945gu4,ImAShaaaark,,0,2025-01-25 16:49:42,,,,This breaks a long held chain that the new xx80 card is faster than the xx90 and so on for other models generally Those were on new nodes and because of that the 4090 was way faster compared to the competition than the 3090 Getting roughly 4090 performance with less power draw and for half the MSRP is fantastic as that still represents a generational 30 improvement in raw raster performance with massive improvements in AI performance while staying on the same node Its unreasonable to assume we are gonna see 1080ti levels of improvement every generation,m93k4x2,2.0,1i9oky5
comment,m94bbt6,MachineStreet7107,,2,2025-01-25 17:17:48,,,,Where did I say I expect to see 1080ti levels of performance improvements every gen All I stated was the improvement between gens is diminishing which is expected but is still noteworthy And what card gets 4090 performance with less power draw and half the cost You must be referencing something utilizing 4x frame gen 5070 It still doesnt reach the same performance as it compromises latency IMO Frame gen is a great innovation and Im excited to see it grow more but right now it has a notable trade off in latency Youre right tho it is a cool feature that will be beneficial to consumers,m945gu4,3.0,1i9oky5
comment,m93kmdm,Valuable-Tomatillo76,,-23,2025-01-25 15:06:09,,,,It is a no shit situation if you even take a millisecond peak at the specs out of the corner of your cataract laden eyes But I suppose the vast majority of people will never look at that nor be able to deduce anything from it,m93k4x2,2.0,1i9oky5
comment,m93lia3,IllllIIIllllIl,,13,2025-01-25 15:11:00,,,,Its wild that some people are so touchy they get this aggro by a level response to someone elses comment,m93kmdm,3.0,1i9oky5
comment,m93ljn9,Fireal2,,6,2025-01-25 15:11:13,,,,,m93kmdm,3.0,1i9oky5
comment,m93m0z8,MachineStreet7107,,5,2025-01-25 15:13:46,,,,Ive seen the specs during the launch event but I appreciate the insult You must be a genius for reading spec sheets I could never My point is still 100 valid tho they are reporting on the small jump in performance The specs were surprisingly disappointing as is the performance for this new gen of cards Not sure who pissed in your cereal but maybe you could use your cataract laden eyes to read a book on anger management lol,m93kmdm,3.0,1i9oky5
comment,m93mlr2,Valuable-Tomatillo76,,-5,2025-01-25 15:16:52,,,,You seem a bit angry,m93m0z8,4.0,1i9oky5
comment,m93n7sv,MachineStreet7107,,3,2025-01-25 15:20:09,,,,Im not But I appreciate the concern,m93mlr2,5.0,1i9oky5
comment,m93lx0i,XTheGreat88,,3,2025-01-25 15:13:11,,,,The 40 series was a pretty big jump over the 30 series,m93ir8s,1.0,1i9oky5
comment,m93mzkg,Emu_milking_god,,1,2025-01-25 15:18:56,,,,I get the feeling this gen might go like the 20 series awesome cards that birthed ray tracing but the 30 series made them irrelevant I feel So hopefully the 60 series is where the next 1080ti will live,,0.0,1i9oky5
comment,m93ok5v,WhiteCharisma_,,3,2025-01-25 15:27:11,,,,Based on how things are going I put the 4080 Super as the loosely modern rendition of the 1080ti Cheaper and stronger than its previous model the 4080 When it was in production it was cheaper to buy this then wait and get the 5080 before all the cards got massively overpriced Power difference is minimal asides from dlss 4 Runs cooler and less power hungry Nvidia knew what it was doing by cutting production off the same year it released this card,m93mzkg,1.0,1i9oky5
comment,m93yezf,ResponsibleQuiet6611,,1,2025-01-25 16:16:09,,,,Yup this further validates my decision to go with the 4080 Super Got one 6 months ago and in Canada at the time it was 5001000 less than the cheapest 4080,m93ok5v,2.0,1i9oky5
comment,m948t9x,rtyrty100,,1,2025-01-25 17:05:37,,,,Its a ton cheaper than a 4090 Makes sense,,0.0,1i9oky5
comment,m949z01,MrTibbens,,1,2025-01-25 17:11:11,,,,Kind of lame I was waiting to build a new PC till the 5000 series came out Currently have a computer with a 2080 super which has been fine for years playing games at 1080 for 1440 I guess I have no choice,,0.0,1i9oky5
comment,m94cjjg,ArchusKanzaki,,1,2025-01-25 17:23:40,,,,Well as long as the price is the same I wont mind a 4080 Double Super,,0.0,1i9oky5
comment,m94d23j,havnar-,,1,2025-01-25 17:26:11,,,,gifgiphyVJHtXeMHViHRHvKGKmdownsized,,0.0,1i9oky5
comment,m94dbl8,SingleHitBox,,1,2025-01-25 17:27:28,,,,Waiting till 6080 or 7080 feels like game graphics havent really warranted the upgrade,,0.0,1i9oky5
comment,m94dcok,Agomir,,1,2025-01-25 17:27:37,,,,Looks like my 1660 Ti is going to keep me going for another generation Such an incredibly good value card Ive been wanting to significantly upgrade to get ray tracing and to have enough vram to run Stable Diffusion XL but most of the games Im interested in run just fine including BG3 and even VR performance is acceptable So I can wait as long as it doesnt break,,0.0,1i9oky5
comment,m94e74t,ILikeCutePuppies,,1,2025-01-25 17:31:41,,,,I would point out that sometimes performance boosts for particular cards to appear in a driver update but this is interesting Also the card does probably do generative AI better than the 4090 if thats something people use,,0.0,1i9oky5
comment,m94gsyb,qukab,,1,2025-01-25 17:44:03,,,,This is all very frustrating Ive been looking forward to this generation because my monitor 57 Samsung Ultrawide requires display port 21 to run at full resolution at 240hz Currently have to run it at a lower resolution to achieve that No 4 series cards support 21 all of the 5 series do I have a 4070 so the plan was to upgrade to the 5080 and sell my existing card Itll obviously still be a performance upgrade but not what I was expecting Feel like Id be upgrading just for DP 21 which is kind of ridiculous,,0.0,1i9oky5
comment,m95eeca,GregoryfromtheHood,,1,2025-01-25 20:27:25,,,,But you also will have multi frame generation which makes monitors like 4k 240hz pretty relevant now As per the digital foundry video if you can achieve somewhere like 90fps then MFG can take that up to 300 ish fps with a very minor basically unnoticeable amount of added latency,m94gsyb,1.0,1i9oky5
comment,m95gza3,qukab,,1,2025-01-25 20:40:33,,,,True which for some games Im all about but for competitive hero shooters which I play a lot of absolutely not Frame gen stays off for those Still a net positive though I play a lot of genres,m95eeca,2.0,1i9oky5
comment,m94kor0,staatsclaas,,1,2025-01-25 18:02:41,,,,Im fine with things staying steady at the top for a bit Really hard to have to keep up,,0.0,1i9oky5
comment,m94lxj8,Shloopadoop,,1,2025-01-25 18:08:38,,,,Ok so if Im on a 3080 and 5800X3D and decently happy with my 4k performanceused 408090 Hold out for 60 series Recede further into my modded SNES and CRT cave,,0.0,1i9oky5
comment,m99buaa,FearLeadsToAnger,,2,2025-01-26 12:58:27,,,,Exact same combo I might pick up a 5080 toward the end of its product cycle if I can get a deal otherwise 6 series This doesnt seem like enough,m94lxj8,1.0,1i9oky5
comment,m94pruy,SEE_RED,,1,2025-01-25 18:26:50,,,,Anyone shocked by this,,0.0,1i9oky5
comment,m94qqz5,Slow-Condition7942,,1,2025-01-25 18:31:27,,,,gotta keep that release cadence no matter what didnt you think of the shareholder,,0.0,1i9oky5
comment,m94utcg,Lunarcomplex,,1,2025-01-25 18:50:48,,,,Thank god lmao,,0.0,1i9oky5
comment,m94x4gx,ShootFishBarrel,,1,2025-01-25 19:01:47,,,,Looks like my 1080 Founder Edition is safe Again,,0.0,1i9oky5
comment,m952rms,EdCenter,,1,2025-01-25 19:29:06,,,,Isnt the 5080 priced the same as the 4080 Seems like the 5080 is just the 4080 Super 2025 Edition,,0.0,1i9oky5
comment,m959a5a,LiteralHorn,,1,2025-01-25 20:01:21,,,,Im rocking a 2080 super so Im still getting this thing,,0.0,1i9oky5
comment,m95kith,LemurMemer,,1,2025-01-25 20:58:29,,,,Have a 2080 Super and Im still most likely to cop the 5080 Im mostly concerned with power consumption and thermals,,0.0,1i9oky5
comment,m95may2,ThatTysonKid,,1,2025-01-25 21:07:33,,,,Ill wait for the 60XX My 3080 is good enough,,0.0,1i9oky5
comment,m95mrmi,piotrek211,,1,2025-01-25 21:09:55,,,,it was a known fact even before the announcement of the 5080 lol,,0.0,1i9oky5
comment,m95s661,TheGreatUdolf,,1,2025-01-25 21:37:13,,,,how surprising not,,0.0,1i9oky5
comment,m95y06u,Madjack66,,1,2025-01-25 22:07:25,,,,But isnt 5080 a bigger number than 4090,,0.0,1i9oky5
comment,m960bct,Ghostrider215,,1,2025-01-25 22:19:40,,,,What in the clickbait is this article,,0.0,1i9oky5
comment,m96fwxo,millsy98,,1,2025-01-25 23:45:24,,,,Everyone knew this was going to be the case once the US ruling on restricting cards as powerful or more so than a 4090 from being sold in China China will demand to get a high end model still so the 5080 was always going to be at or below 4090D performance,,0.0,1i9oky5
comment,m96j6tx,fpsfiend_ny,,1,2025-01-26 00:03:52,,,,DamnI may just keep my 4090 and wait until the 6xxx gifgiphygEvab1ilmJjA82FaSVdownsized,,0.0,1i9oky5
comment,m96rmgz,marcosg_aus,,1,2025-01-26 00:50:54,,,,So even if it doesnt out perform it if its close and cheaper than a 4090 and provides things like multiframe gen maybe its still a good thing I dont know a lot about gpus so admit I could be talking nonsense,,0.0,1i9oky5
comment,m975zqe,ARandomWalkInSpace,,1,2025-01-26 02:13:02,,,,Rocking two 1070s that I bought used Both are going strong,,0.0,1i9oky5
comment,m98ey0r,lostoppai,,1,2025-01-26 07:41:01,,,,5090 is too expensive and the 4090 is scalped to hell I guess Ill wait and see how the 5080 Ti performs an year from now and its price,,0.0,1i9oky5
comment,m98xs42,sillypicture,,1,2025-01-26 10:51:31,,,,My cards so far geforce 4 3090ti,,0.0,1i9oky5
comment,m99q8ff,14_In_Duck,,1,2025-01-26 14:32:20,,,,OK AMD Good one,,0.0,1i9oky5
comment,m9aobvi,RonJDio,,1,2025-01-26 17:24:05,,,,Holding out for the 6090,,0.0,1i9oky5
comment,m9atxb7,drewbiez,,1,2025-01-26 17:50:31,,,,My trusty 3080ti out here doing the lords work Guess hes sticking around,,0.0,1i9oky5
comment,m9b3llc,MaygarRodub,,1,2025-01-26 18:35:22,,,,My next rig is gonna be AMD and AMD,,0.0,1i9oky5
comment,m9djeef,aedspitpopd,,1,2025-01-27 01:30:51,,,,Money saved again,,0.0,1i9oky5
comment,m9i72n6,CatboiBrooke,,1,2025-01-27 19:31:52,,,,Yeah this generation is a dud,,0.0,1i9oky5
comment,m94671e,DarkFate13,,1,2025-01-25 16:53:07,,,,5000 series are crap,,0.0,1i9oky5
comment,m93p1fc,DoomSayerNihilus,,1,2025-01-25 15:29:41,,,,The 5090 is only that much faster than a 4090 What did people expect the 5080 to magically outperform it,,0.0,1i9oky5
comment,m94xdfh,Velocyra,,1,2025-01-25 19:03:00,,,,As someone who bought the 4090 last year that is great news,,0.0,1i9oky5
comment,m9a7k77,None,,1,2025-01-26 16:03:19,,,,Fake frames and AI No thanks,,0.0,1i9oky5
comment,m945j45,g0ll4m,,1,2025-01-25 16:50:00,,,,It is not slower for rendering and 3d apps we have all the benchmarks,,0.0,1i9oky5
