type,id,author,title,score,created_utc,url,num_comments,subreddit,body,parent_id,depth,post_id
comment,m98645l,ZZ9ZA,,2,2025-01-26 06:18:40,,,,Think of it a bit like the resolution of a screen but the smallest thing you can draw is much larger than one pixel,m965vzz,8.0,1i9oky5
comment,m9546a4,General_WCJ,,9,2025-01-25 19:35:58,,,,The issue with quantum tunneling is basically that electrons can phase through walls if those walls are thin enough,m9526pv,6.0,1i9oky5
comment,m95dvf5,zernoc56,,3,2025-01-25 20:24:41,,,,I imagine the Casimir effect is also a concern at some point as well,m9546a4,7.0,1i9oky5
comment,m955b7d,jack-K-,,1,2025-01-25 19:41:30,,,,In regards to the marketing term for the node Im pretty sure we can get down to the 1nm point eventually GP of 42 and MP of 16 maybe a decade or so before we see it in gaming hardware but at that point not only are we dancing next to quantum tunneling but also reaching the limits of current lithography resolution,m93xcp1,4.0,1i9oky5
comment,m93u2ru,ColonelRPG,,36,2025-01-25 15:55:00,,,,Theyve been saying that line for 20 years,m93th4v,3.0,1i9oky5
comment,m93w4k7,philly_jake,,14,2025-01-25 16:04:59,,,,20 years ago we were at what 90nm at the cutting edge Maybe 65nm So weve shrunk by roughly a factor of 1520 linearly meaning transistor densities up by several hundred fold We will never get another 20x linear improvement That means that better 3d stacking is the only way to continue increasing transistor density Perhaps we will move to a radically different technology than silicon wafers by 2045 but i kind of doubt it Neither optical nor quantum computing can really displace most of what we use transistors for now though they might be helpful for AI workloads,m93u2ru,4.0,1i9oky5
comment,m93yc9n,Apokolypze,,6,2025-01-25 16:15:46,,,,Forgive my ignorance but once we hit peak density whats stopping us from making that ultra dense wafer Bigger,m93w4k7,5.0,1i9oky5
comment,m93z2up,blither86,,18,2025-01-25 16:19:23,,,,Eventually I believe its distance Light only travels so fast and the processors are running at such a high rate that they start having to wait for info to come in I might be wrong but thats one of the best ways to convince someone to appear with the correct answer,m93yc9n,6.0,1i9oky5
comment,m9483vx,Valance23322,,4,2025-01-25 17:02:14,,,,There is some work being done to switch from electrical signals to optical,m93z2up,7.0,1i9oky5
comment,m94wcre,psilent,,2,2025-01-25 18:58:09,,,,From what I understand that would increase speed by like 20 at best assuming its speed of light in a vacuum and not glass medium So were not getting insane gains there afaik,m9483vx,8.0,1i9oky5
comment,m94z6xs,Valance23322,,1,2025-01-25 19:11:49,,,,Sure but that would let you make the chips 20 larger which could either help with cooling or to include more gates before running into timing issues,m94wcre,9.0,1i9oky5
comment,m9g38f4,Bdr1983,,1,2025-01-27 13:15:24,,,,I can assure you its more than some work I work in the photonics sector and every day is like seeing a magician at work,m9483vx,8.0,1i9oky5
comment,m94ilc3,Spacecowboy78,,2,2025-01-25 17:52:40,,,,,m93z2up,7.0,1i9oky5
comment,m93zct5,Apokolypze,,2,2025-01-25 16:20:43,,,,Ahh okay that definitely sounds plausible Otherwise youre right the best way to get the correct answer on the Internet is to confidently post the wrong one,m93z2up,7.0,1i9oky5
comment,m94gxay,ABetterKamahl1234,,4,2025-01-25 17:44:37,,,,Ahh okay that definitely sounds plausible Not just plausible but factual Its the same reason that dies just simply arent made bigger entirely As other guy says speed of light at high frequencies is a physical limit we simply cant surpass at least without rewriting our understanding in physics Itd be otherwise great as Im not really limited by space so having simply a physically large PC is a nonissue so a bigass die would be great and workable,m93zct5,8.0,1i9oky5
comment,m94jrjl,DaRadioman,,1,2025-01-25 17:58:16,,,,Thats why chiplet designs work well they keep the important things with more sensitive latency local,m93z2up,7.0,1i9oky5
comment,m94dy76,danielv123,,5,2025-01-25 17:30:29,,,,Also cost You can go out and buy a B200 today but its not cheap They retail for 200k though most of it is markup Each N2 wafer alone is 30k though so you have to fit a good number of GPUs on that to keep the price down Thing is if you were happy paying 2x the 5080 price for twice the performance you would just get the 5090 which is exactly that,m93yc9n,6.0,1i9oky5
comment,m94eoyu,alvenestthol,,1,2025-01-25 17:34:03,,,,They are getting bigger the 750mm2 of the 5090 released in 2025 is 20 bigger than the 628mm2 of the 3090 in 2020 which is 12 bigger than the 561mm2 of the GTX Titan in 2013,m93yc9n,6.0,1i9oky5
comment,m94s120,warp99,,1,2025-01-25 18:37:31,,,,Heat although on die water cooling will buy us a bit of time,m93yc9n,6.0,1i9oky5
comment,m95ctu5,EVILeyeINdaSKY,,1,2025-01-25 20:19:24,,,,Heat dissipation is a partial reason a silicon wafer can conduct heat only so fast If they go thicker new methods of cooling will have to be worked out possibly galleries inside the chip in which coolant may flow through like an automotive engine,m93yc9n,6.0,1i9oky5
comment,m99alwp,V1pArzZz,,1,2025-01-26 12:48:56,,,,Yield you can make them bigger but the bigger they are the lower success rate so they get more and more expensive,m93yc9n,6.0,1i9oky5
comment,m93w8ew,Juicyjackson,,15,2025-01-25 16:05:31,,,,We are actually quickly approaching the physical limitations Back in 2005 65nm was becoming a thing Now we are starting to see 2nm there isnt very much halving we can really do before we hit the physical size limitations of silicon,m93u2ru,4.0,1i9oky5
comment,m940zmv,NewKitchenFixtures,,13,2025-01-25 16:28:35,,,,Usually the semi industry only has visibility for the next 10 years of planned improvement IMEC tech center in Europe has a rolling roadmap for semi technology It generally has what scaling is expected next A lot of it requires new transistor structure instead of just shrinking,m93w8ew,5.0,1i9oky5
comment,m94jjc4,poofyhairguy,,6,2025-01-25 17:57:10,,,,We see new structures with the AMD 3D CPUs When that stacking is standard that will be a boost,m940zmv,6.0,1i9oky5
comment,m9a6691,CatProgrammer,,1,2025-01-26 15:56:34,,,,Dont they already have that Their 3D Vcache,m94jjc4,7.0,1i9oky5
comment,m95e18t,Knut79,,4,2025-01-25 20:25:31,,,,We have hit the physical limits long ago Like 10x the size the 5nm ones are marketed as Nm today is just the technology basically performs as if it was xnm and these sizes where possibe without physics screwing everything up for us,m93w8ew,5.0,1i9oky5
comment,m94rjl2,warp99,,1,2025-01-25 18:35:14,,,,They have been saying exactly that for 50 years,m93u2ru,4.0,1i9oky5
comment,m94369e,Ashamed-Status-9668,,1,2025-01-25 16:38:52,,,,Thats not really how it works with todays transistors Moving to TSMCs 2nm brings the GAA transistor which has even more of a 3D shape Think flat then house and now a second story house The transistors pack in tight but they have a vertical height to them That is to say even 2nm from TSMC isnt touching physics limits albeit they do start dealing with quantum tunneling,m93th4v,3.0,1i9oky5
comment,m944e1a,Juicyjackson,,3,2025-01-25 16:44:37,,,,Welp I guess there is a lot I wasnt taught in my Computer Architecture class lol All I got from that class was PTSD hardest class I have ever taken by far,m94369e,4.0,1i9oky5
comment,m946hi1,ChristopherDassx_16,,1,2025-01-25 16:54:30,,,,Im in the same boat as you hated that class,m944e1a,5.0,1i9oky5
comment,m949rd4,Ashamed-Status-9668,,1,2025-01-25 17:10:11,,,,Yeah It depends when and how up to date the curriculum was We had the first FinFET transistors in CPUs in late 2022 Before that transistors could be thought of as 2D and the way you were looking at would be valid This is still what is in use today Intels 18A and TSMCs 2nm move to GAA transistors for the first time this year,m944e1a,5.0,1i9oky5
comment,m95edbn,Knut79,,2,2025-01-25 20:27:16,,,,Because 2nm is marketing not actual transistor or gate sizes And hadnt been since 5030nm it just means they are designed and perform as if they where 2nm and 2nm where possible without breaking,m94369e,4.0,1i9oky5
comment,m9accrk,Ashamed-Status-9668,,1,2025-01-26 16:26:46,,,,Yes It didnt used to be that way with planar transistors Folks that took courses 20 ish years ago on this subject and didnt keep up to date may not realize since FinFETs it hasnt been true anymore,m95edbn,5.0,1i9oky5
comment,m94vuoo,SorryUseAlreadyTaken,,1,2025-01-25 18:55:49,,,,02 nm is the length of a bond not an atom,m93th4v,3.0,1i9oky5
comment,m94xgua,Juicyjackson,,0,2025-01-25 19:03:28,,,,The atomic radius of Silicon is 111 picometers which means diameter is 222 picometers 222 picometers is 022 nanometer,m94vuoo,4.0,1i9oky5
comment,m94ffe9,haloooloolo,,9,2025-01-25 17:37:31,,,,Crypto as in general cryptography or cryptocurrency mining,m93jsps,1.0,1i9oky5
comment,m95cggm,malfive,,6,2025-01-25 20:17:31,,,,They definitely meant cryptocurrency The only people who still use crypto in reference to cryptography are those in the security field,m94ffe9,2.0,1i9oky5
comment,m983wy7,Hydraxiler32,,3,2025-01-26 05:59:51,,,,mostly just confused why its mentioned as though its still relevant the only profitable stuff to mine is with ASICs which Im pretty sure nvidia has no interest in,m95cggm,3.0,1i9oky5
comment,m94iq5y,slayez06,,7,2025-01-25 17:53:18,,,,no one crypto mines on GPUs after ETH went to proof of stake All the other coins are not profitable unless you have free electricity and the new GPUs are going to be even worse,m93jsps,1.0,1i9oky5
comment,m949cyg,elheber,,5,2025-01-25 17:08:14,,,,Its a little simpler than that The transistors on microchips are reaching their theoretical limit now Its become almost impossible to make them any smaller faster and more efficient So the only direction left to go is bigger and more energy or in using tricks like machine learning to boost performance synthetically The 5000 series is using the same 4nm transistor node size as the previous 4000 series IMHO this is a highly skippable generation of GPUs,m93jsps,1.0,1i9oky5
comment,m93wyrr,NecroCannon,,20,2025-01-25 16:09:05,,,,The thing thats pissed me off about AI the most is the fact that so many businesses are letting products get worse for the average person for the sake of something still hallucinating sometimes and doesnt even have a use for the average person yet Youd think after a year or two something would result from the AI push but nope still worse products Even Apple based the 16pro around AI just to not even have it be fully released until fucking next year or the year after God I hope they piss off investors from the lack of returns eventually so much money being burned and its still not profitable it will one day somehow but not anytime soon,m93jsps,1.0,1i9oky5
comment,m95306c,Maniactver,,3,2025-01-25 19:30:15,,,,The thing is tech companies are expected to innovate And one of the reasons that AI is the new big buzzword is that there isnt really anything else right now for techbros to impress investors with,m93wyrr,2.0,1i9oky5
comment,m97ktea,NutellaGood,,1,2025-01-26 03:42:19,,,,And then after everything is AI innovation will completely stop,m95306c,3.0,1i9oky5
comment,m99016b,Maniactver,,1,2025-01-26 11:14:01,,,,Not really but it is possible that real innovation would come from somewhere outside of the big tech,m97ktea,4.0,1i9oky5
comment,m94hkod,ABetterKamahl1234,,1,2025-01-25 17:47:46,,,,Its simply because the AI stuff saves them money and unless the hallucinations and other stuff is costing more than hiring people itll continue Business ultimately only care about bottom line and profit margins Everything else is just details to get there,m93wyrr,2.0,1i9oky5
comment,m94gukd,ilyich_commies,,-6,2025-01-25 17:44:16,,,,Honestly I think its good that companies are investing so many billions into a technology that isnt profitable in the short term but will completely change the world in the future AI tech will eventually allow us to automate all human labor and completely eliminate scarcity and whether they mean to or not tech companies are helping bring about that future,m93wyrr,2.0,1i9oky5
comment,m94hlqw,NecroCannon,,12,2025-01-25 17:47:55,,,,I keep seeing this point but it instantly gets shut down when you take a look at the world around us and ask yourself How are companies that only care about profits are going to survive no one being able to afford anything due to consolidation while governments are taking two steps back for every step forward The reality would be thered be a lot of people unemployed and suffering but the people with money will be just fine,m94gukd,3.0,1i9oky5
comment,m95xuwe,vmsrii,,2,2025-01-25 22:06:39,,,,Then fucking sell it us then when its actually revolutionary Not now while its still a piece of shit,m94gukd,3.0,1i9oky5
comment,m94m7gl,None,,4,2025-01-25 18:09:57,,,,Sorry but weve been hearing this for 40 years now and other than a cool few tech demos of Will Smith eating spaghetti and ChatGPT hallucinating half the time you ask for a line of code I have yet to see anything interesting and actually usable come out of AI that people actually want,m94gukd,3.0,1i9oky5
comment,m94xbey,Confuciusz,,-1,2025-01-25 19:02:44,,,,Id say that AlphaFold is a bit more important than Will Smith eating spaghetti Other improvements are less groundbreaking on a surface level but Im saving a ton of time using LLMs for work and so do a lot of other people In that sense its having a direct positive impact on my worklife,m94m7gl,4.0,1i9oky5
comment,m944aey,manipulativedata,,-13,2025-01-25 16:44:08,,,,The fact that you havent found a use case for a modern LLM is more likely because you havent tried it Products arent degrading Theyre getting better No one is seriously claiming the 50 series isnt a better product than the 40 series because it factually isnt true It just might not be as massive of a leap as what the last few generations Thats a terrible bar I guess Im trying to figure out why youre so unhappy If you thought that thr AI features on the iPhone 16 werent worthwhile dont buy the product If you think DLSS and the incremental performance boost for the 50 series isnt worthwhile dont buy it Just buy a 4090 and be happy with it You dont need to be unhappy lol,m93wyrr,2.0,1i9oky5
comment,m9470gl,NecroCannon,,3,2025-01-25 16:57:01,,,,No I have tried it Heres my opinion as an artist since they struggle there I make comics and animation I learned the fundamentals which are important for execution well made art or to even break them to do your own thing It has no idea of the fundamentals I dont draw in a typical anime style so it struggles to work well with my projects and theres no tools made that can take care of tedious tasks like it was made to do Take animation in between as tend to get sourced to other countries to be done for cheap I dont have that money to do that with my projects so it takes a long time to animate However instead of listening to artists about how AI could be used instead they want to outright replace them while the leaders have no idea about what goes into well made products That leads to this topic of fucking course products are literally better on paper theyre not going to release an all around worse product But theyre sacrificing the consumer side of things for the sake of AI meaning RD doesnt go more into making sure they create a well rounded product bringing something to all kinds of consumers but what makes investors happy Whether you like AI or not everyone can agree that a product should be finished and be as advertised when it hits shelves unless you just want to defend their mistakes for some reason Everyone shouldnt be forced to participate or have their lives uprooted over an unwanted beta test Until they stop trying to make a program that can almost do anything and instead use LLMs for specific well defined tasks its going to keep sucking If its something made to benefit everyone one person shouldnt be having all their needs met while another deals with it failing at every use attempt,m944aey,3.0,1i9oky5
comment,m94q9cf,manipulativedata,,0,2025-01-25 18:29:07,,,,First I dont want to get into the debate of the ethics of generative AI AI is going to impact people and we need to be prepared for that Its never going to replace the demand of original work though People are always going to create as they have since the beginning of history but we are rushing too fast forward without understanding the consequences of current models and safeguarding livelihoods As you pointed out though outsourcing has claimed a significant number of jobs and AI is likely to bring those jobs back before eliminating work in the western world My whole point in even commenting though is that AI is the consumer side of things DLSS is a released product today that works ChatGPT Copilot Gemini are released products today that work They can help you today right now Anyone reading this post with no programming experience can get a walkthrough on how to create and deploy a working mobile app in a dev sandbox TODAY for free AI isnt about someone dictating how you use it its about using it the way you want Sure maybe it cant do the animation for you but have you ever asked for ways to streamline your current process It will help you with it You can screen scare with GPT4s AVM and it will talk you through a quicker process You can ask it to explain it to you in different ways or ask simpler questions I cant speak to iPhone specifically but I cant tell you how fundamentally flawed it is to think RD is bad for consumers Its literally the only thing that capitalism forces companies to do to improve and iterate and by the way Even art is iterative Iteration allows for significantly more complex things to be released Thats just the way things have worked since the beginning of time,m9470gl,4.0,1i9oky5
comment,m95z3or,vmsrii,,2,2025-01-25 22:13:15,,,,The funny part is literally everything you just listed can also be done by anyone for free after an hourlong tutorial on YouTube,m94q9cf,5.0,1i9oky5
comment,m96ko8c,manipulativedata,,0,2025-01-26 00:12:08,,,,No lol Videos arent interactive or collaborative Show me a series of videos one hour in length that will help choose and install software step by step setup the correct environments and write code that complies into a build in one hour that someone without any tech know how can follow I am not surprised the people on reddit are delusional about generative AI but even your claim is hilariously wrong Youve said two things that show you simply dont understand the discussion now lol It only takes one person to scream to ruin a flight and only a few loud children to try to ruin technology they dont understand Its ironic because 15 years ago people expected you to read books to gain knowledge and now the default is to what watch YouTube Thats really what youre going to rest your laurels on,m95z3or,6.0,1i9oky5
comment,m96tf1a,vmsrii,,2,2025-01-26 01:00:57,,,,No lol Videos arent interactive or collaborative Show me a series of videos one hour in length that will help choose and install software step by step setup the correct environments and write code that complies into a build in one hour that someone without any tech know how can follow Okay lol Heres another And another this ones a bit longer than an hour apologies Its not the ideal way to learn programming granted but if its between this and AI then yeah Im gonna rest my laurels on whichever source can reliably tell me how many Rs are in Strawberry if I ask,m96ko8c,7.0,1i9oky5
comment,m96x6xx,manipulativedata,,1,2025-01-26 01:22:14,,,,You have a basic misunderstanding of how LLMs work so youre asking the wrong questions apparently That strawberry example is a good one because you can ask ChatGPT that itll get it wrong then you can ask why it got wrong and itll explain it and tell you how to fix your prompt Your videos are also already bad because they required knowledge beforehand and since you cant ask the video you need to stop and Google within 5 minutes On your rust one he literally tells you to go find another site to have a better experience on a different playground without explaining the why or offering suggestions lol Current models of AI wont replace devs but the reasoning ones coming in the next generation or two will You can deny it You can cry about it You can cite common examples of AI folly while clutching your pearls Totally up to you,m96tf1a,8.0,1i9oky5
comment,m95ybqm,vmsrii,,1,2025-01-25 22:09:07,,,,The improvement in raw computational power versus energy draw has seen a pretty consistent parabolic drop every generation since the 10x0 cards what are you smoking,m944aey,3.0,1i9oky5
comment,m96edbs,manipulativedata,,1,2025-01-25 23:36:48,,,,Im not Im not complaining about the slightly narrower benchmark performance between the 4090 and 5080 either I think the newer cards are cool but I still rock 2080Tis in both of my machines for a reason People are just complaining about the 50 series because its not some generational improvement and the person I responded to was blaming their poorly perceived idea that DLSS or AI in general was the issue Im saying that as DLSS improves well see significant improvements in performance with only modest improvements in transitor tech and itll be because generative AI does some of the work The LLM thing was a tangent because the person Im replying to made specific comments about Apple phones and beta products which told me they had a misunderstanding of what current LLMs and generative AI is,m95ybqm,4.0,1i9oky5
comment,m93z9a3,correctingStupid,,7,2025-01-25 16:20:15,,,,Odd they wouldnt just make a line of consumer AI dedicated cards and not sell mixes Why sell one when you can sell two more precise cards I think they are simply pushing the gaming market into AI driven tech,m93jsps,1.0,1i9oky5
comment,m941eme,Gipetto,,25,2025-01-25 16:30:34,,,,Why make 2 different chips when you can sell the same chip to everybody Profit,m93z9a3,2.0,1i9oky5
comment,m95umg1,bearybrown,,2,2025-01-25 21:49:48,,,,They are pushing the problems and solutions as a bundle As gaming dev cutting corners with lighting and dumps it to ray tracing the user also needs to be on same tech to utilize it Also since FG provide pull out of ass frames they create an illusion that FG is improvement when its actually a way to minimize development cost in terms of optimizing,m93z9a3,2.0,1i9oky5
comment,m94eitn,danielv123,,2,2025-01-25 17:33:14,,,,Gaming is barely worth it I think we should be happy that we can benefit from the developments they make on the enterprise side otherwise I am not sure if we would be seeing any gains at all,m93z9a3,2.0,1i9oky5
comment,m98plle,Plebius-Maximus,,1,2025-01-26 09:28:31,,,,Gaming still makes them billions Nvidia arent ones to turn down extra profit The margins arent quite as high as data centre stuff but its a separate section of the market and still makes them a ton of money so they arent going to abandon it,m94eitn,3.0,1i9oky5
comment,m98yq7o,danielv123,,1,2025-01-26 11:00:57,,,,Sure but they only have so many developers and have to decide which projects to allocate them to,m98plle,4.0,1i9oky5
comment,m990hto,Plebius-Maximus,,1,2025-01-26 11:18:34,,,,Same for any tech company But Nvidia are currently the richest company on the planet They have their pick of the best engineersdevelopers on the planet They arent talentresource starved at all and can recruit the best in the business with relative ease for any projects they want to be done,m98yq7o,5.0,1i9oky5
comment,m990tqf,danielv123,,1,2025-01-26 11:21:48,,,,Sadly cant recruit seniority New staff takes a while getting to know the products to become really productive,m990hto,6.0,1i9oky5
comment,m94z5wz,BrunoEye,,1,2025-01-25 19:11:40,,,,Many motherboards cases and PSUs wouldnt support two cards They need to access similar data having combined memory helps this significantly AI will be behind most future graphical improvements AI shaders will be a big deal especially with traditionally demanding elements like dense foliage and translucency,m93z9a3,2.0,1i9oky5
comment,m93mpi5,Davidx91,,11,2025-01-25 15:17:26,,,,I said I was waiting on the 5070 Ti instead of a 4070Ti Super but if its not even worth it then Ill wait on a AMD 9000 series since its supposed to be like the 40 series just way way cheaper,m93jsps,1.0,1i9oky5
comment,m93od2v,namorblack,,4,2025-01-25 15:26:09,,,,Would be a shame if AMD were corpos and charged exactly as high as market not just you is willing to pay often not cheap due to demand,m93mpi5,2.0,1i9oky5
comment,m948jr7,bmore_conslutant,,2,2025-01-25 17:04:20,,,,Theyll be just cheap enough to draw business away from Nvidia Theyre not idiots,m93od2v,3.0,1i9oky5
comment,m93t4hx,Noteagro,,3,2025-01-25 15:50:21,,,,If past releases are any indication they will come in at a better bang for buck price range,m93od2v,3.0,1i9oky5
comment,m93rbg0,beleidigtewurst,,1,2025-01-25 15:41:27,,,,Yeah but nothing is supposed to be much faster than 4070Tis so what gives if it is cheaper,m93mpi5,2.0,1i9oky5
comment,m942h7u,Ashamed-Status-9668,,2,2025-01-25 16:35:38,,,,Naw its just about the money They have a small die that is cheap to make that they can sell for around 1K Then they have no real competition Until I see Intel or AMD laying waste to Nvidias lineup they are not giving up on gaming they are just milking customers,m93jsps,1.0,1i9oky5
comment,m94pq14,DanBGG,,2,2025-01-25 18:26:35,,,,Yeah theres absolutely no way gaming market share matters at all now compared to AI,m93jsps,1.0,1i9oky5
comment,m957leo,CrazyTillItHurts,,2,2025-01-25 19:52:50,,,,Nobody is mining with a GPU these days,m93jsps,1.0,1i9oky5
