type,id,author,title,score,created_utc,url,num_comments,subreddit,body,parent_id,depth,post_id
comment,m93zr36,cat_prophecy,,1,2025-01-25 16:22:38,,,,I dont know why people are surprised that Nvidia is following the money If they thought they could make more money but completely foregoing gaming cards altogether they would do that It makes more business sense for them to sell a million cards to a few AIcrypto businesses than it does for them to sell that same amount to individual users,m93jsps,1.0,1i9oky5
comment,m94sd1i,Zed_or_AFK,,1,2025-01-25 18:39:07,,,,Sure but physical limitations are plying a factor here too Cant really make transistors much smaller anymore So its impossible to be making big improvements without a bigger architecture overhaul And to some extent isnt thats whats nVidia has been doing with their AI stuff like pixel generation and frame generation,m93jsps,1.0,1i9oky5
comment,m94t495,redrumyliad,,1,2025-01-25 18:42:43,,,,Crypto mining isnt profitable as much with eth being proof of stake isnt it,m93jsps,1.0,1i9oky5
comment,m94ueup,Pezotecom,,1,2025-01-25 18:48:54,,,,what crypto uses graphics card,m93jsps,1.0,1i9oky5
comment,m95tj4i,kevihaa,,1,2025-01-25 21:44:08,,,,giving up on gamingin favor of crypto 1 Crypto mining is largely dead at the consumer level 2 Even amongst the handful of consumers still thinking mining crypto makes sense since Bitcoin is inevitably going to increase in value tenfold none of them are buying a 500 MW card to mine 3 There are purpose built cards for mining that make a ton more sense than buying a 5090 giving up on gamingin favor of AI NVIDIA is literally the only company that makes a GPU that can do 4k and ray tracing while hitting above 60 FPS AMD has literally said they arent trying to compete at this level anymore and Intel has no plans of even attempting it Does it suck that having zero competition means that NVIDIA can continue to test how high they can price their cards Absolutely But I have no idea where the theyve given up on gamers narrative is coming from,m93jsps,1.0,1i9oky5
comment,m963n06,AlternativeAward,,1,2025-01-25 22:37:30,,,,Crypto GPU mining is dead for years now The demand is all AI,m93jsps,1.0,1i9oky5
comment,m9872yd,TheMagicMrWaffle,,1,2025-01-26 06:26:44,,,,Still not matching the performance,m93jsps,1.0,1i9oky5
comment,m9aozil,kurotech,,1,2025-01-26 17:27:13,,,,Yea they just want to chase the profits and thats it Unless it effects their bottom line negatively then they will chase those fads like some hipster with diets,m93jsps,1.0,1i9oky5
comment,m944br8,FauxReal,,0,2025-01-25 16:44:19,,,,I agree and that gamble will probably pay off for them Would be nice if it also made it so gamers and game studios didnt feel pressure to upgrade this cycle as a result PS the word you want is affected effects cause affects,m93jsps,1.0,1i9oky5
comment,m94vkbt,Mixels,,0,2025-01-25 18:54:25,,,,So if both AMD and nVidia are abandoning gaming flagships to cater to AIcryptodatacenter does that means were finally going to get 10 years out of current and previous gen GPUs,m93jsps,1.0,1i9oky5
comment,m93jkks,CMDR_omnicognate,,299,2025-01-25 15:00:22,,,,If you look at its core numbers and clock speed its not significantly higher than the 4080 either The 50 generation is basically just TI versions of the 40 gen but with significantly higher power consumption,,0.0,1i9oky5
comment,m93nmgm,SolidOutcome,,149,2025-01-25 15:22:18,,,,Yea Per watt performance of 5090 is same as 4090and the extra 25 performance is due to an extra 25 watts made possible with a better cooler Its literally the same chip made larger uses more power and cooled better,m93jkks,1.0,1i9oky5
comment,m94u8pi,grumd,,44,2025-01-25 18:48:06,,,,If you power limit the 5090 to the same TDP as 4090 it still outperforms it by at least 1020 We need more reviews that test this so far Ive only seen der8auer do this test,m93nmgm,2.0,1i9oky5
comment,m93qwmw,sage-longhorn,,51,2025-01-25 15:39:20,,,,I mean they did warn us that Moores law is dead The ever increasing efficiency of chips is predicated on Moores law so how else are they supposed to give you more performance without more power consumption Not that I necessarily agree with them but the answer theyve come up with is AI,m93nmgm,2.0,1i9oky5
comment,m95grbl,Dracekidjr,,1,2025-01-25 20:39:26,,,,Every line of thinking has a natural conclusion At this point we need to create something fundamentally different to see the same gains,m93qwmw,3.0,1i9oky5
comment,m94bqe1,subtle_bullshit,,-3,2025-01-25 17:19:46,,,,Its not dead Clockspeed and power consumption have started to plateaued but transistor countdensity is still increasing,m93qwmw,3.0,1i9oky5
comment,m966nlt,Olde94,,8,2025-01-25 22:53:54,,,,Im not sure people knows mores law You get downvoted but its about transistor count and not performance The two have just been closely connected most of the time,m94bqe1,4.0,1i9oky5
comment,m96typb,jothrok,,1,2025-01-26 01:04:02,,,,I mean at this point in time we are quickly approaching a critical point where Moores law is going to hit its physical maximum based on how small were able to make transistors IIRC theyre currently working on a transistor that is 3 atoms of silicone Sure electrons are smaller than that but at a certain point the electron phases through the silicon as if it werent there There other solution potentially to that issue but the traditional transistor isnt answer Likely the next leap will be in quantum computing,m966nlt,5.0,1i9oky5
comment,m989hcz,Olde94,,1,2025-01-26 06:48:35,,,,Uff yeah i see Si atoms are 02nm,m96typb,6.0,1i9oky5
comment,m98vir6,CJKay93,,2,2025-01-26 10:28:42,,,,Transistor density is still increasing but now so is the cost It used to be cheaper to massproduce the next smaller node in the long run but it is so difficult to produce transistors of these sizes that each new node sees a significant increase in cost,m94bqe1,4.0,1i9oky5
comment,m93qjxu,TheLemmonade,,22,2025-01-25 15:37:32,,,,the funky AI features of course if youre into that Maybe I am weird but I always hesitate to enable frame gen and dlss in games I start with then off and see how I do for FPS For some reason they just feel like a compromise Idk Its like the reverse of the dopamine affect of cranking a game to ultra I cant imaging enabling 4x frame gen would feel particularly good to me Wonder if thats why some are underwhelmed,m93nmgm,2.0,1i9oky5
comment,m93uwll,CalumQuinn,,13,2025-01-25 15:59:01,,,,Thing is about DLSS you should compare it to the reality of TAA rather than to a theoretical perfect image DLSS quality can sometimes have better image quality than TAA on native res Its a tool not a compromise,m93qjxu,3.0,1i9oky5
comment,m93x49r,Kurrizma,,14,2025-01-25 16:09:50,,,,Gun to my head I could not tell the visual difference between DLSS 35 Performance and native 4K Ive pixel peeped real close Ive looked at it in motion on my 32 4K OLED I cannot tell the difference,m93uwll,4.0,1i9oky5
comment,m945amd,Peteskies,,7,2025-01-25 16:48:52,,,,Look at things in the distance stuff that normally wouldnt be clear at 1080p but is clear at 4k Performance mode struggles,m93x49r,5.0,1i9oky5
comment,m94bzlz,OramaBuffin,,1,2025-01-25 17:21:00,,,,Leaves swinging in the breeze on extremely distant trees is one thing I look for With DLSS in some games they become completely motionless,m93x49r,5.0,1i9oky5
comment,m94ybx2,opeth10657,,1,2025-01-25 19:07:37,,,,I play on a 5120x1440 monitor With DLSS in cyberpunk I can get a stable 60 fps with a 3090ti and nearly maxed settings and Id bet you couldnt tell visually if DLSS was on or not Would literally be unplayable with those settings without DLSS,m93x49r,5.0,1i9oky5
comment,m943jzq,thedoc90,,7,2025-01-25 16:40:40,,,,Multiframe gen will be beneficial on the 5090 to anyone running a 240480hz oled I cant see much use case outside of that because frankly when framegen is applied to games running below 60fps it feels really bad,m93qjxu,3.0,1i9oky5
comment,m95ag0s,TheLemmonade,,1,2025-01-25 20:07:15,,,,Interesting Wondering out loud Whats the use case for 3500 fps players Is it often competitive shooters Isnt lower input lag a priority over graphics power Dont they always just set the graphics to the lowest setting possible regardless,m943jzq,4.0,1i9oky5
comment,m96cvsm,thedoc90,,8,2025-01-25 23:28:23,,,,Frame generation in general is not going to ever be used in competetive shooter games Some support it like marvel rivals but if you were to say get 90 fps in Marvel rivals at 1440p on a 165 hz gsync monitor without framegen and activate framegen it would in the case of single framegen drop your rendered frames to 82 fps so youre losing 8 frames per second of input and frame data because input can only happen on rendered frames not on interpolated frames You also lose 8 frames of reaction time per second because lets say someone fires a projectile in your direction during and the timing coincides with an interpolated frame The actual information that the projectile was fired will only be communicatwd on the next real frame 3x framegen to 165hz will lock your fps to 54 and 4x will lock your fps to 40ish Below 60gps interpolated frame quality massively degrades even on 2x frame generation and the input lag becomes much more obvious This is a lower fps example but itd be much the same for high fps users If youre playing on a 480fps monitor and you can achieve 300 fps natively itll be a net loss to add framegen It also introduces rendering overhead so you will always lose some amount of real frames for fake ones Best usecase for multi framegen is say you hit 120fps in the witcher 3 and you 4x framegen to 480 Not a competitive game no advantage lost and a high starting framerate Its a sink or swim technology that massively favors the high end cards,m95ag0s,5.0,1i9oky5
comment,m96i96b,droppinkn0wledge,,1,2025-01-25 23:58:36,,,,The fact youre even looking for a dopamine dump in your GRAPHICS is part of the problem,m93qjxu,3.0,1i9oky5
comment,m97mti9,TheLemmonade,,1,2025-01-26 03:55:05,,,,Why is that a problem I love tinkering with my cool stuff,m96i96b,4.0,1i9oky5
comment,m93vpsx,Ok-Bar-8785,,1,2025-01-25 16:02:57,,,,Valid point especially for the top tier cards the my laptop rtx4060 its a bit of a savour to get the frames n be happy with what IV got Still feel a bit dirty that the new AI tech doesnt even go to the previous generation,m93qjxu,3.0,1i9oky5
comment,m9401z6,TheLemmonade,,2,2025-01-25 16:24:06,,,,Facts really good point Plus it would extend the life of the cards at any tier The gen lock I understand the features are generally enabled by hardwarearchitecture in these new cards,m93vpsx,4.0,1i9oky5
comment,m93sway,Vokasak,,-1,2025-01-25 15:49:14,,,,and the extra 25 performance is due to an extra 25 watts It doesnt work that way,m93nmgm,2.0,1i9oky5
comment,m93rlke,beleidigtewurst,,7,2025-01-25 15:42:53,,,,Yeah except 5090 got 33 beef on top of what 4090 had 5080 and below arent getting even that,m93jkks,1.0,1i9oky5
comment,m9u46y8,mennydrives,,1,2025-01-29 15:34:38,,,,3 days later Identical process node nearly identical transistor count identical cache identical GB of RAM 30 more bandwidth 28 more performance at 010 more power efficiency If you were waiting its not _worse_ than a 4080 Super but youre not staring down much better,m93jkks,1.0,1i9oky5
comment,m9ulnso,CMDR_omnicognate,,2,2025-01-29 16:56:40,,,,Yeah i was waiting out on these cards since i have a 3080 currently which would be find for most people but i have a monitor thats effectively 2 2k monitors bolted together so it has problems with some games im kinda disappointed with the 5080 and annoyed since i could have upgraded a lot earlier now im kinda wondering if i should just wait to see how the new AMD gpus fair i could get a 5090 with my current pc without having to upgrade anything else even my PSU would be fine but at like 2500 for the partner cards i just dont think its worth it plus im skeptical on the 12pin connector given they had problems with the 4090s catching on fire and these 5090s draw even more powe,m9u46y8,2.0,1i9oky5
comment,m9utnpg,mennydrives,,1,2025-01-29 17:33:06,,,,Definitely wait for the new AMD GPUs if you cant just walk in and grab a 5080 off shelves today or a 5090 at MSRP Theres a solid chance AMD could catch NVidia with their pants down resulting in a price adjustment across the lineup,m9ulnso,3.0,1i9oky5
comment,m93jc8k,hangender,,216,2025-01-25 14:59:05,,,,So 5080 is slower than 5070 he he he,,0.0,1i9oky5
comment,m940tph,Slay_Nation,,42,2025-01-25 16:27:48,,,,But the more you buy the more you save,m93jc8k,1.0,1i9oky5
comment,m9410a3,ThePreciseClimber,,4,2025-01-25 16:28:41,,,,The more you take the less you have,m940tph,2.0,1i9oky5
comment,m9447zl,lennyxiii,,0,2025-01-25 16:43:49,,,,The higher you get the lower you are,m9410a3,3.0,1i9oky5
comment,m94f0aj,_subgenius,,1,2025-01-25 17:35:33,,,,The more left you turn the more right you go,m9447zl,4.0,1i9oky5
comment,m94vb87,dagamer2042,,1,2025-01-25 18:53:12,,,,Turn right to go left iykyk,m94f0aj,5.0,1i9oky5
comment,m94gqka,Exostenza,,28,2025-01-25 17:43:44,,,,If the 5090 is roughly 2030 faster than the 4090 and the 5080 has half the cores of a 5090 is anyone surprised by this in any way whatsoever Im sure as hell not,,0.0,1i9oky5
comment,m9buxv4,CosmicCreeperz,,1,2025-01-26 20:42:31,,,,And the 4090 is almost twice the price of the 5080 An old 911 Turbo S is faster than a new Carrera S And much more expensive They are different ranges of graphics cards entirely why is this a surprise and who cares,m94gqka,1.0,1i9oky5
comment,m9gsous,Exostenza,,0,2025-01-27 15:37:06,,,,So happy I got my 4090 a year ago second hand for 1600 CAD,m9buxv4,2.0,1i9oky5
comment,m9h5msl,CosmicCreeperz,,1,2025-01-27 16:38:37,,,,Yeah and Id take a used 911 Turbo vs a new Carrera if they were the same price,m9gsous,3.0,1i9oky5
comment,m93j5g7,LobL,,95,2025-01-25 14:58:01,,,,Who would have thought otherwise Absolutely nothing in the specs pointed to the 5080 being faster,,0.0,1i9oky5
comment,m93k2ji,CMDR_omnicognate,,72,2025-01-25 15:03:07,,,,The 4080 was quite a lot better than the 3090 its not unreasonable to think people would assume the same would happen this generation Its just nvidia didnt really try very hard this generation compared to last theres hardly any improvement over the last one unfortunately,m93j5g7,1.0,1i9oky5
comment,m93odqx,Crowlands,,27,2025-01-25 15:26:15,,,,The 3090 was also criticised at the time for not having enough of a lead over the 3080 to justify the cost vs the 3080 though this changed with the 40 series where the 4090 had a much bigger gap to the 4080 and probably ensures that the old pattern of previous gen being equivalent to a tier lower in the new gen is broken for good on the higher end cards well have to wait and see if it still applies to lower end models such as 4070 to 5060 etc,m93k2ji,2.0,1i9oky5
comment,m93mhx6,cetch,,27,2025-01-25 15:16:17,,,,30 to 40 was a node jump This is not a node jump,m93k2ji,2.0,1i9oky5
comment,m93p29o,LobL,,9,2025-01-25 15:29:48,,,,Its just your lack of knowledge if thats what you think Nvidia is absolutely trying their best to advance atm but as others have pointed out there wasnt a node jump this time They are milking AI like crazy and have a lot to gain if they keep competitors far behind,m93k2ji,2.0,1i9oky5
comment,m93s084,richardizard,,2,2025-01-25 15:44:55,,,,Itll be time to buy a 4080 when the 50 series drops,m93k2ji,2.0,1i9oky5
comment,m93q5ki,mar504,,3,2025-01-25 15:35:30,,,,Actually it is completely unreasonable to make that assumption LobL already said this is clear to anyone who actually looked at the specs of these cards The 4080 had 93 as many CUDA cores as the 3090 but of a newer gen the 4080 had a base clock 58 higher than the 3090 Meanwhile the 5080 has only 65 of the CUDA cores compared to the 4090 and a measly 3 increase in base clock If the change in specs were similar to last gen then it would be reasonable but they arent even close,m93k2ji,2.0,1i9oky5
comment,m93u8ly,CMDR_omnicognate,,6,2025-01-25 15:55:48,,,,yeah i know that and you know that but my point is 90 of people dont know that even people who are pretty into tech dont often get into the details of these sorts of things to understand they just assume well get similar performance increases every generation hence it not being unreasonable that people would think that way,m93q5ki,3.0,1i9oky5
comment,m93wtdf,EnigmaSpore,,1,2025-01-25 16:08:20,,,,True but the 30803090 used the same gpu chip 3090 is always going to be an outlier due it not really being a typical 80ti90 class chip The 1080ti 2080ti 4090 5090 are all separate bigger chips than their xx80 counterparts,m93k2ji,2.0,1i9oky5
comment,m93lvpv,JerryLZ,,1,2025-01-25 15:13:00,,,,They are saying we knew this just from the specs they released already Barely anything changed and we already knew it wasnt a big enough bump to matter Normally once those specs come out you would get a good idea of how much better the new card is but its nearly identical on paper You would also be right about the assuming from the previous patterns but nobody should be assuming anymore since nvidia gave the specs,m93k2ji,2.0,1i9oky5
comment,m94yauy,namatt,,0,2025-01-25 19:07:29,,,,The 4080 was clocked much higher than the 3090 so that was expected,m93k2ji,2.0,1i9oky5
comment,m93tkqz,Asleeper135,,5,2025-01-25 15:52:34,,,,Specs dont always paint the whole picture The 900 series was a pretty big boost in both performance and efficiency over the 700 series despite the specs being a relatively modest boost and being made on the same node By the specs the 30 series should have been an astronomical leap over the 20 series but in reality it was a pretty normal generational leap for graphics performance That said they usually are pretty telling and based on the 5090 that is certainly the case with the 50 series,m93j5g7,1.0,1i9oky5
comment,m94yi7a,namatt,,1,2025-01-25 19:08:28,,,,No by the specs the 30 seriess performance was exactly where it should have been compared to the 20 series,m93tkqz,2.0,1i9oky5
comment,m95363q,Asleeper135,,1,2025-01-25 19:31:03,,,,The 3090 was only 55 faster the 2080 Ti referencing TechPowerUp despite have 253x the conpute performance That is not how most generations scale,m94yi7a,3.0,1i9oky5
comment,m95y0gs,namatt,,1,2025-01-25 22:07:28,,,,But if you had heard how they achieved that increase in compute ie if you looked at the specs you wouldnt be surprised about that,m95363q,4.0,1i9oky5
comment,m96187v,Asleeper135,,1,2025-01-25 22:24:35,,,,No looking at the specs leaves out the very important detail that they doubled CUDA core count per SM or whatever they call them Its a major architectural difference which is exactly the kind of thing left out by just checking the specs,m95y0gs,5.0,1i9oky5
comment,m979ajy,namatt,,1,2025-01-26 02:32:21,,,,If you looked at incomplete specs sure youd think that,m96187v,6.0,1i9oky5
comment,m95zs7o,zushiba,,1,2025-01-25 22:16:50,,,,No but Jenson saying that the 5070ti would be faster than a 4090 didnt exactly make the situation better,m93j5g7,1.0,1i9oky5
comment,m93k873,superpingu1n,,58,2025-01-25 15:04:00,,,,Kicking myself for not buying a used 4090 last week but this confirm i will honor my EVGA 3080ti FTW until death,,0.0,1i9oky5
comment,m93pe5e,TheGameboy,,28,2025-01-25 15:31:32,,,,One of the last great cards from the best GPU partner,m93k873,1.0,1i9oky5
comment,m94nhu2,Neathh,,9,2025-01-25 18:16:02,,,,Got an EVGA 3090ti Greatest card Ill ever own,m93pe5e,2.0,1i9oky5
comment,m96lqqr,Mental_Medium3988,,3,2025-01-26 00:18:08,,,,i got an EVGA 3070 id be fine with keeping it if it had more ram but its my bottleneck right now im not pushing the gpu otherwise i think when i do upgrade im gonna put it in a frame on display in my room or somewhere thanks EVGA and kingpin and everyone else there,m94nhu2,3.0,1i9oky5
comment,m940f4j,superpingu1n,,0,2025-01-25 16:25:51,,,,Love it till death,m93pe5e,2.0,1i9oky5
comment,m93ldrz,Fatigue-Error,,13,2025-01-25 15:10:21,,,,Deleted by User using PowerDeleteSuite,m93k873,1.0,1i9oky5
comment,m93ouno,supified,,11,2025-01-25 15:28:41,,,,Ive read somewhere that where graphic card makers are taking things the only time it is good to upgrade is when your current card no longer can support what you want to do with it I rocked a 1070 until just this year before moving to a 3070 and Im not actually noticing any difference So my needs didnt justify upgrading,m93ldrz,2.0,1i9oky5
comment,m96ipfv,a_moniker,,1,2025-01-26 00:01:08,,,,Im still sitting on my 1070,m93ouno,3.0,1i9oky5
comment,m96kjzn,supified,,1,2025-01-26 00:11:28,,,,Yeah dont rush off that thing unless you find an actual reason I thought the newer card would make my vr better or something and the end result was a dud,m96ipfv,4.0,1i9oky5
comment,m93nkqt,lightningbadger,,3,2025-01-25 15:22:03,,,,As a 3080 user this is almost best case scenario since if it sucks I can actually get one and itll still be a decent uplift after skipping the 40 series lol,m93ldrz,2.0,1i9oky5
comment,m967k80,Elrric,,2,2025-01-25 22:58:55,,,,Im in the same boat as you but if the 5080 performs worse than the 4090 maybe a secondhand 4090 is not a bad option as they are roughly the same price in my area Brand new they still go for 21002200 at least I was down for the 5090 but 3300 is just unreasonable imo,m93nkqt,3.0,1i9oky5
comment,m93mw6x,-FourOhFour-,,1,2025-01-25 15:18:26,,,,Good upgrade sure good value upgrade not really getting a 40 gen card would likely be better between the age and people still upgrading to the latest and greatest for the sake of it decent chance theyll go down in price and with comparable stats to the 50s cheaper card wins,m93ldrz,2.0,1i9oky5
comment,m93zb9b,superpingu1n,,-1,2025-01-25 16:20:31,,,,I play in 4k on a 120hz TV and my 3080TI undervolt is still rocking every game I will get killed for this but I hate playing DLSS I only play in native so upgrading for a 5080 would not be worth,m93ldrz,2.0,1i9oky5
comment,m942vjy,virtikle_two,,3,2025-01-25 16:37:30,,,,Literally me Im rocking my 4090 for my PC in my office and a 3080 Ti in my htpccouch setup The 3080 Ti still runs everything VERY well,m93zb9b,3.0,1i9oky5
comment,m94snva,SrGoodbar,,4,2025-01-25 18:40:33,,,,no chance in hell you play 4k at 120hz with 3080ti in native res,m93zb9b,3.0,1i9oky5
comment,m956ag5,superpingu1n,,-4,2025-01-25 19:46:20,,,,Dont even think a 5090 would play 120fps 4k lol Just saying im playing with 4k120hz Usually get 7080fps on every game nativeultra,m94snva,4.0,1i9oky5
comment,m945tsr,None,,2,2025-01-25 16:51:24,,,,I tried control last night and it barely hits 30 fps,m93zb9b,3.0,1i9oky5
comment,m946156,Peteskies,,1,2025-01-25 16:52:21,,,,Ray tracing off obviously I also am 3080ti on a 120hz TV and Indiana Jones is the first game I feel looks so much better with path tracing I want to wait until I upgrade,m93zb9b,3.0,1i9oky5
comment,m945min,Kiwi_In_Europe,,0,2025-01-25 16:50:27,,,,I mean you do you obviously but DLSS especially the new DLSS4 is just native visual quality with built in AA and performance boosts so its a slightly confusing stance,m93zb9b,3.0,1i9oky5
comment,m94nore,7IGiveUp7,,5,2025-01-25 18:16:58,,,,Ill believe it when I see it So far it is very easy to tell upscaled vs native in person,m945min,4.0,1i9oky5
comment,m94ok5t,Kiwi_In_Europe,,0,2025-01-25 18:21:05,,,,I mean I think it depends on the game and the implementation of DLSS But cyberpunk for example looks pretty identical in both video comparisons and playing on my 1440p monitor,m94nore,5.0,1i9oky5
comment,m94pm35,7IGiveUp7,,4,2025-01-25 18:26:04,,,,I agree but so far on my 4k monitor I have yet to see an upscaled game that matches native I think there are a lot of external factors outside the upscaler itself that come into play So again Ill believe when I see it,m94ok5t,6.0,1i9oky5
comment,m956rg0,superpingu1n,,1,2025-01-25 19:48:41,,,,Playing 4k does show the dlssnative distorsion I just cant unsee it Most of people play 10802160 and cant tell the difference,m94pm35,7.0,1i9oky5
comment,m94o4kq,superpingu1n,,1,2025-01-25 18:19:03,,,,The only game i had fun with DLSS was horizon forbidden west which was really well done compared to native Otherwise i see some artefacts and the camera motion always feels weird I just cant stand DLSS only if needed as an emergency,m945min,4.0,1i9oky5
comment,m94oyi1,Kiwi_In_Europe,,2,2025-01-25 18:22:57,,,,It might be worth trying again with DLSS4 it basically lets you use the NVIDIA app to override a games native implementation which can vary widely in quality RDR2 for example has famously shitty DLSS and run it direct from the app,m94o4kq,5.0,1i9oky5
comment,m93mp16,lucky_1979,,-2,2025-01-25 15:17:22,,,,My plan is to upgrade from my 3080 to 5070ti That should probably keep me going for another few years at least,m93ldrz,2.0,1i9oky5
comment,m93zz10,superpingu1n,,-5,2025-01-25 16:23:43,,,,Honestly for people playing with DLSS and no 4k theres no reason to get a 50XX Should stick to the 4080,m93mp16,3.0,1i9oky5
comment,m945cdm,lucky_1979,,0,2025-01-25 16:49:06,,,,If I wanted a 4080 Id buy one Not sure why people are getting upset by me buying a 5070ti to replace my 3080 Its my money,m93zz10,4.0,1i9oky5
comment,m94dyy3,Harflin,,1,2025-01-25 17:30:35,,,,I dont see the upset you see,m945cdm,5.0,1i9oky5
comment,m93sm3q,Boltrag,,7,2025-01-25 15:47:52,,,,Imagine being anywhere near current gen Brought to you by 1080ti,m93k873,1.0,1i9oky5
comment,m9577n2,superpingu1n,,5,2025-01-25 19:50:55,,,,1080ti is the best GPU ever made and can keep up pretty good if you dont push over 1080p,m93sm3q,2.0,1i9oky5
