type,id,author,title,score,created_utc,url,num_comments,subreddit,body,parent_id,depth,post_id
post,1i9oky5,chrisdh79,New Leak Reveals NVIDIA RTX 5080 Is Slower Than RTX 4090,2274,2025-01-25 14:53:36,https://www.reddit.com/r/gadgets/comments/1i9oky5/new_leak_reveals_nvidia_rtx_5080_is_slower_than/,442.0,gadgets,,,,
comment,m93ogjc,fantasybro,,682,2025-01-25 15:26:40,,,,Looks like Im skipping another generation,,0.0,1i9oky5
comment,m9403gv,MVPizzle_Redux,,324,2025-01-25 16:24:18,,,,This isnt going to get better Look at all the AI investments Meta just made I guarantee next year the performance gain year over year will be even more incremental,m93ogjc,1.0,1i9oky5
comment,m94676t,Mrstrawberry209,,110,2025-01-25 16:53:08,,,,Hopefully AMD might catch up and give Nvidia the reason to give us better upgrades,m9403gv,2.0,1i9oky5
comment,m94dz2n,FrootLoop23,,136,2025-01-25 17:30:36,,,,AMD is smartly focusing on the mid range Thats where the majority of buyers are,m94676t,3.0,1i9oky5
comment,m96o55p,ak-92,,6,2025-01-26 00:31:32,,,,Good as someone who has to buy highend GPUs for professional use as performance literally means money earned to live so no choice but to buy highest performance possible I see that NVDIA convincing gamers to buy pro grade hardware as somekind necessity is the biggest con any company has pulled in recent decades Having slightly lower game settings or few fos lower is not a tragedy and saving hundreds or thousands for it is definitely worth it For an average person paying 2k for a gpu to game is crazy,m94dz2n,4.0,1i9oky5
comment,m9emui1,saints21,,3,2025-01-27 05:19:55,,,,Yeah it always cracks me up when people act like a game is broken and unplayable because it barely gets over 80 fps Meanwhile millions of people manage to enjoy gaming as long as its stableish around 30,m96o55p,5.0,1i9oky5
comment,m94x9e6,wamj,,3,2025-01-25 19:02:27,,,,I do wonder what thisll mean on the low to mid range long term Between intel and AMD they might be able to build brand loyalty for people who arent in the high end market now but will be in the future,m94dz2n,4.0,1i9oky5
comment,m94yw8f,mexodus,,-4,2025-01-25 19:10:21,,,,Well brand loyalty doesnt really do anything when you do not provide the high end,m94x9e6,5.0,1i9oky5
comment,m954kiy,NotAComplete,,3,2025-01-25 19:37:53,,,,Why,m94yw8f,6.0,1i9oky5
comment,m956s7p,mexodus,,0,2025-01-25 19:48:48,,,,What do you mean why The statement above my comment says build brand loyalty for non high end in order to keep them when they move to the high end But they dont offer 5090 level high end this is not a judgement just a simple thing Unless they sell something like a 5090 which I would very much welcome the brand loyalty will just not do what the statement says You cannot convince people to buy products you dont have,m954kiy,7.0,1i9oky5
comment,m957tf2,NotAComplete,,4,2025-01-25 19:53:57,,,,Im having a really hard time interpreting what youre trying to say but it seems like youre saying theres no brand loyalty on midrange cards that give you more performance for your dollar only high range cards Is that accurate,m956s7p,8.0,1i9oky5
comment,m9592oj,mexodus,,2,2025-01-25 20:00:17,,,,No sorry if I did not describe correctly I am saying even if a customer is loyal to a mid range GPU brand this loyality will NOT drive his decision when heshe decides to buy a highend card because the midrange GPU brand simply does not offer one eg if intel doesnt produce a 5090 like GPU the intel loyal customer that wants a 5090 like GPU will still switch despite intel loyality,m957tf2,9.0,1i9oky5
comment,m95shok,half3clipse,,2,2025-01-25 21:38:52,,,,The high range GPU market your referring to basically does not exist Nvida chases it because they can divert a small fraction of their fab time that would otherwise go to high end server cards for a marketing opportunity And thats mostly brand recognition for the managers in charge of procurement who want the best Almost none of Nvidas sales were consumers buying 4090s Infact almost none of the 4090s sales were consumers either they were not ai models bought by people using it as an alternative to the export restricted server cards Globally the number of consumers with 4090s maybe a couple hundered thousand Theres about as many 4090s in consumers hands as there are 1660s still in use Theres far less than there are 1050s still being used Almost all 4000 series cards in consumer use are the 4060 the 4060TI and the 4070 customer is loyal to a mid range GPU brand this loyality will NOT drive his decision when heshe decides to buy a highend card This isnt a thing that happens The conversion rate is so low its irrelevant The vast bulk of consumer sales is in the mid range and they tend to not replace cards every generation,m9592oj,10.0,1i9oky5
comment,m95bqz9,NotAComplete,,1,2025-01-25 20:13:54,,,,There is a high end market and a mid range budget value and Im sure more Its seems like youre saying brand loyalty only exists in the high end market,m9592oj,10.0,1i9oky5
comment,m95i8kg,mexodus,,0,2025-01-25 20:46:55,,,,Nah I will give up since I cannot convey my thoughts in an understandable way I am saying if you are buying mid range cards and are loyal to one brand that only offers mid range cards you are required to break that loyality if you want a high end card and you will be star you simply cannot get it from the brand you are loyal to So I very much believe that brand loyalty exist in every budget category Just saying I dont believe people despite desiring high end will stay with mid range just for loyality reasons,m95bqz9,11.0,1i9oky5
comment,m967wk5,FrootLoop23,,1,2025-01-25 23:00:47,,,,Im glad that AMD doesnt offer a GPU that starts at 2k because in the real world it will be much higher I hope they never do,m956s7p,8.0,1i9oky5
comment,m9pz3du,wamj,,1,2025-01-28 22:42:20,,,,Unless intel and amd eventually get competitive in the high end market,m94yw8f,6.0,1i9oky5
comment,m954oi8,Numerlor,,71,2025-01-25 19:38:25,,,,amd is not doing anything smartly they completely fucked up their current launch presumably because of nvidias pricing,m94dz2n,4.0,1i9oky5
comment,m9674d7,FrootLoop23,,42,2025-01-25 22:56:29,,,,The launch hasnt even happened yet Nothing has been fucked up yet,m954oi8,5.0,1i9oky5
comment,m9685r9,Numerlor,,3,2025-01-25 23:02:11,,,,Stores already have stock while basically nothing has been revealed about the GPUs and the first release date mention was in a tweet it has been obviously pushed back as a reaction to nvidias roundup,m9674d7,6.0,1i9oky5
comment,m96bk80,FrootLoop23,,21,2025-01-25 23:20:59,,,,Considering Nvidia hasnt released the 5070 models yet its probably smart that AMD decided to wait Get it right on price and have the support for FSR4 day one Let Nvidia go first with their competing product Personally I dont want an Nvidia monopoly like they currently have AMD doing well can only benefit us,m9685r9,7.0,1i9oky5
comment,m97gq1e,QuickQuirk,,9,2025-01-26 03:16:42,,,,yeap AMD keeps rushing products to launch just because nvidia is launching thats hurt them in the past Release a good product well priced when its ready,m96bk80,8.0,1i9oky5
comment,m9fimaa,Numerlor,,0,2025-01-27 10:26:18,,,,lmao they were planning 899749,m96bk80,8.0,1i9oky5
comment,m9gvr1o,FrootLoop23,,2,2025-01-27 15:51:50,,,,Videocardz is your reputable source An anonymous retailer is Bulgaria lol,m9fimaa,9.0,1i9oky5
comment,m95q010,RockerXt,,31,2025-01-25 21:26:09,,,,Id rather they take their time and do it right even if debating pricing it apart of that,m954oi8,5.0,1i9oky5
comment,m95j25m,MajesticTop8223,,0,2025-01-25 20:51:05,,,,Do not talk down about savior amd on reddit,m954oi8,5.0,1i9oky5
comment,m9hme9z,ChefCurryYumYum,,1,2025-01-27 17:56:08,,,,We dont know that AMD fucked up their current launch They have delayed the launch presumably so reviewers will test the current 50x series against Nvidias last gen cards where AMD doesnt think they will look that impressive for gen over gen We already are hearing of massive shortages of the 5090 while AMD has been stockpiling units of their next gen GPUs since December Im reserving judgement until the AMD products launch,m954oi8,5.0,1i9oky5
comment,m9c34a8,themortalrealm,,0,2025-01-26 21:19:38,,,,Youd be better off buying a mid range nvidia card unless you enjoy your games having optimization issues,m94dz2n,4.0,1i9oky5
comment,m9cxath,FrootLoop23,,1,2025-01-26 23:41:21,,,,I have a 7900XT Dont know what optimization issues youre talking about unless you mean the sorry state PC games sometimes release in GPU brand cant save you from that,m9c34a8,5.0,1i9oky5
comment,ma7mit2,Thelongdong11,,1,2025-01-31 15:49:24,,,,Indiana Jones requires rtx to play The next doom game will also require rtx AMD is gonna fall further behind if they dont get rtx right,m9cxath,6.0,1i9oky5
comment,m948itc,juh4z,,30,2025-01-25 17:04:13,,,,AMD gave up lol,m94676t,3.0,1i9oky5
comment,m94ek4r,leberwrust,,12,2025-01-25 17:33:25,,,,They want to return to high end in 2026 I have no idea how well that will work tbh,m948itc,4.0,1i9oky5
comment,m958tun,juh4z,,12,2025-01-25 19:59:02,,,,I want the most competition possible be that AMD Intel or any other company fuck NVidia That said other companies just dont stand a chance they can make good options for those on a budget maybe even something mid range if you dont really care about ray tracing performance although you should cause we already have games that require ray tracing capable gpus to run but if you wanna play at 4k with ray tracing and all those shenanigans Intel or AMD will never get you what you need,m94ek4r,5.0,1i9oky5
comment,m963ezh,TheKappaOverlord,,4,2025-01-25 22:36:18,,,,Realistically theyll release like one high end card in 2026 assuming they dont nope out realizing its too far gone but they wont seriously return to high end card business If they give now theyll never reclaim what little foothold they had to begin with Instead their home will be midrange cards Its either Intel or bust And unfortunately the calls indicate its bust,m94ek4r,5.0,1i9oky5
comment,m95rh2a,ZaeBae22,,1,2025-01-25 21:33:39,,,,I have more faith in Intel AMD thinks 5070 undercuts are enough lmao,m94676t,3.0,1i9oky5
comment,m9bkzlt,icebeat,,1,2025-01-26 19:56:34,,,,Lol it is not going to happen they are family,m94676t,3.0,1i9oky5
comment,m95o625,epraider,,20,2025-01-25 21:17:00,,,,To a degree its kind of a good thing The technology is mature and your purchase holds its value longer and isnt rapidly outclassed by new hardware right around the corner which in turn means the performance requirements for new games or tools arent going advance past your purchases capabilities for longer,m9403gv,2.0,1i9oky5
comment,m94oeqd,Vosofy,,4,2025-01-25 18:20:22,,,,Good Means I have no reason to drop 800 My 3080 can carry me until 70 series at least,m9403gv,2.0,1i9oky5
comment,m96f8nx,Faranocks,,2,2025-01-25 23:41:36,,,,Kinda doubt it Nvidia is stuck on same node next Gen should be up a node or two Im sure it will cost too much but it might still at least be a decent uplift in performance,m9403gv,2.0,1i9oky5
comment,m949pd3,The_Deku_Nut,,12,2025-01-25 17:09:55,,,,Its almost like were reaching the limits of what can be accomplished using current materials,m9403gv,2.0,1i9oky5
comment,m94ffh3,sdwvit,,32,2025-01-25 17:37:32,,,,Or there is no competition,m949pd3,3.0,1i9oky5
comment,m963sbz,TheKappaOverlord,,4,2025-01-25 22:38:18,,,,Nah We really are reading the Limit as far as what can technically be done with current materials The most we can do as far as genuinely improving computing now is either make the already crazy big cards even bigger or we start figuring out how to shove quantum computing cores into our computers There being no competition means theres no reason for Nvidia to give a shit about quality control So they can shit out the biggest turds imaginable now and theres no recourse until people either beg AMD to come back wont happen or Intel produces a competent alternative wont happen,m94ffh3,4.0,1i9oky5
comment,m999qbu,V1pArzZz,,1,2025-01-26 12:41:55,,,,AMD or Intel could come back eventually happened on cpu market where AMD was far behind and suddenly outperformed Intel 7900xtx is pretty much a 4080 equivalent with bad RT so its not that hugely behind either,m963sbz,5.0,1i9oky5
comment,m99d6sj,btown1987,,1,2025-01-26 13:08:31,,,,Tell me you dont know anything about quantum computing without telling me you dont know anything about quantum computing,m963sbz,5.0,1i9oky5
comment,m95pvnb,CompromisedToolchain,,-3,2025-01-25 21:25:32,,,,Ding ding,m94ffh3,4.0,1i9oky5
comment,m95srgj,bearybrown,,5,2025-01-25 21:40:15,,,,I doubt it with how small the performance increased I think they pull an Intel,m949pd3,3.0,1i9oky5
comment,m949yuf,MVPizzle_Redux,,6,2025-01-25 17:11:10,,,,Or were just figuring it out and are scaling up to meet goals that are still being developed,m949pd3,3.0,1i9oky5
comment,m961k80,bonesnaps,,2,2025-01-25 22:26:23,,,,Scalping up to meet goals,m949yuf,4.0,1i9oky5
comment,m95lgy2,IntrinsicGiraffe,,1,2025-01-25 21:03:19,,,,Hoping AI would help with tech advancements like they are in other fields but Ive been using this 1080 for too long I need a VR capable GPU,m9403gv,2.0,1i9oky5
comment,m95sxac,illathon,,1,2025-01-25 21:41:04,,,,Good reason why AMD and Intel need more support,m9403gv,2.0,1i9oky5
comment,m972a2v,DonArgueWithMe,,1,2025-01-26 01:51:35,,,,Do you really think that companies like Facebook or Google are investing in AI for the difference it makes in gaming,m9403gv,2.0,1i9oky5
comment,m97420l,MVPizzle_Redux,,1,2025-01-26 02:01:45,,,,No thats not what Im saying What Im saying is theyre all investing in AI so the hardware will be geared less towards gaming from Nvidias end since thats where the profit is coming from,m972a2v,3.0,1i9oky5
comment,m977kkj,DonArgueWithMe,,2,2025-01-26 02:22:18,,,,Do you think major AI farms are running 4090s5090s Sure somebody running a home ai project might but anybody making an actual investment would be running professional hardware Look up the nvidia h100 for an example its tens of thousands per chip with entire stacks costing up to nearly half a million example,m97420l,4.0,1i9oky5
comment,m93y94z,SteveThePurpleCat,,36,2025-01-25 16:15:21,,,,1060 rides out another generation,m93ogjc,1.0,1i9oky5
comment,m96z30v,Osmodius,,3,2025-01-26 01:33:13,,,,Only replaced mine this year What a hero of a card,m93y94z,2.0,1i9oky5
comment,m941he9,Lost_Knight12,,8,2025-01-25 16:30:56,,,,What a beast of a card Sadly I had to upgrade from my EVGA 1060 6GB to a 4070 Ti Super once I bought a 1440p 240hz monitor I would have spent another year on the 1060 if I stayed with my 1080p monitor,m93y94z,2.0,1i9oky5
comment,m95mm65,microwavedave27,,3,2025-01-25 21:09:08,,,,I still use mine for 1080p 60Hz cant really play every game anymore but theres still plenty of stuff it can play 8 years and going strong,m941he9,3.0,1i9oky5
comment,m95pxpb,Hoagiewave,,1,2025-01-25 21:25:49,,,,I was using an Intel Quadro2000M on a 2011 laptop until 3 months ago Most new games I turned down to like 480p or sometimes lower lmao but it ran not horrible DX12 only games becoming more and more common forced my hand They didnt run at all they didnt even open,m95mm65,4.0,1i9oky5
comment,m95pkm4,tramster,,1,2025-01-25 21:24:00,,,,Thats what Im still rolling with,m93y94z,2.0,1i9oky5
comment,m96rd29,kidmerc,,1,2025-01-26 00:49:26,,,,A lot of new games coming out are requiring RTX cards now 1060 rides another generation as long as you arent playing anything new,m93y94z,2.0,1i9oky5
comment,m967ffz,None,,9,2025-01-25 22:58:12,,,,Ive skipped 5 so far Still hanging on Though I do like the 4070s I might get one One day,m93ogjc,1.0,1i9oky5
comment,m97h75x,QuickQuirk,,13,2025-01-26 03:19:39,,,,Given that the 50 series so far seems to be both 1 Stagnant on performance per dollar 2 Performance per watt then the biggest competitor to the 50 series is the 40 series Getting a 4070 might be a very reasonable choice Well know more after the 5070 releases,m967ffz,2.0,1i9oky5
comment,m949pka,Spacepickle89,,17,2025-01-25 17:09:56,,,,Looks at 970 one more year,m93ogjc,1.0,1i9oky5
comment,m94ey56,S145D145,,24,2025-01-25 17:35:15,,,,Honest question wouldnt it be benefitial upgrading but to an older model at this point Like you can get a 3060ti for 300 usd which isnt free but is not that expensive either Of course this only makes sense if you have a reason to do so If you are not even interested on newish games then i guess no point,m949pka,2.0,1i9oky5
comment,m95qh2f,Abba_Fiskbullar,,6,2025-01-25 21:28:33,,,,Or even a 6650xt which can be had for 200ish is much much better than a 970,m94ey56,3.0,1i9oky5
comment,m96iba8,Holovox,,1,2025-01-25 23:58:56,,,,Thats what I did Pretty happy with it Most of the games I play run just fine at 1440p Medium to High settings Even Cyberpunk,m95qh2f,4.0,1i9oky5
comment,m94mk5b,PatNMahiney,,4,2025-01-25 18:11:39,,,,Is that a used price Theres not much stock left for previous generations so those dont really drop in price like one might expect,m94ey56,3.0,1i9oky5
comment,m94rugv,S145D145,,9,2025-01-25 18:36:39,,,,Not really I just looked up rtx 3060ti on amazoncom and looked at the first results lol E Ooh wait Im now realizing those were results for rtx 3060 not 3060ti The ti is at 479 Theres also a listing for the 4060 for 310 usd tho,m94mk5b,4.0,1i9oky5
comment,m94ty5m,PatNMahiney,,4,2025-01-25 18:46:42,,,,I just looked on Amazon and the first several results are 3060s not 3060TIs If I scroll far enough I can find 3060TIs for 400 but that means youre paying the MSRP for a 4 year old card Not a good deal Even 300 for a 3060 isnt great Thats only 30 less than MSRP for a 4 year old card,m94rugv,5.0,1i9oky5
comment,m96ai6k,Inayaarime,,0,2025-01-25 23:15:09,,,,well the 3060 is one of the most wanted cards i think in Priceperformance its one of the best from the last 3 gens I could be wrong But that would explain the price,m94ty5m,6.0,1i9oky5
comment,m96aqb5,1_Rose_ToRuleThemAll,,2,2025-01-25 23:16:23,,,,go to rhardwareswap people sell cards all the time Used 3080s for 370 isnt bad still not great price but its a great card still imo,m94mk5b,4.0,1i9oky5
comment,m95pyp9,Blue-Thunder,,1,2025-01-25 21:25:58,,,,These are ex mining cards I bought a 5600XT from them back in November No issues with the card at all,m94mk5b,4.0,1i9oky5
comment,m950lpm,hellowiththepudding,,2,2025-01-25 19:18:39,,,,Ive got a Vega 64 that was sub 300 5 years ago Upgrades in that price bracket are marginal at best still,m94ey56,3.0,1i9oky5
comment,m9j9nez,LGCJairen,,1,2025-01-27 22:33:03,,,,Can find a used 3080 for around 300350,m94ey56,3.0,1i9oky5
comment,m94wkta,Spacepickle89,,1,2025-01-25 18:59:13,,,,Fair question I just didnt have the time before and now o have a 1 year old so less time,m94ey56,3.0,1i9oky5
comment,m97om9t,THEROFLBOAT,,2,2025-01-26 04:06:48,,,,Looks at mine YOU CAN STILL PLAY DARKTIDE AT 480p MIN SETTINGS DAMMIT,m949pka,2.0,1i9oky5
comment,m98599x,PacketAuditor,,2,2025-01-26 06:11:13,,,,You good bro Said the same thing to my 3080,m949pka,2.0,1i9oky5
comment,m94xps2,Velocyra,,1,2025-01-25 19:04:39,,,,Lol I decided to finally upgrade fron the 970 last year to the 4090 Holding out def paid off,m949pka,2.0,1i9oky5
comment,m94m90v,Risley,,2,2025-01-25 18:10:09,,,,looks like I get to sayGOTTEM,m93ogjc,1.0,1i9oky5
comment,m95ep13,OsmerusMordax,,1,2025-01-25 20:28:56,,,,I just bought a 3060 last year I think Ill be good for awhile,m93ogjc,1.0,1i9oky5
comment,m962rbe,rebbsitor,,1,2025-01-25 22:32:46,,,,I bought an RTX 2080 6 years ago At this rate Ill never upgrade lol,m93ogjc,1.0,1i9oky5
comment,m9693tn,Fredasa,,1,2025-01-25 23:07:23,,,,Weve known it for months too Slower is a gobsmacking understatement Yeesh Its so little improved over the 4080 that you really do need a fps meter if you want to be concretely aware of a difference,m93ogjc,1.0,1i9oky5
comment,m99aguc,Aestroj,,1,2025-01-26 12:47:49,,,,Havent bought since the 20xx gen getting hard to skip,m93ogjc,1.0,1i9oky5
comment,m9btvyi,CosmicCreeperz,,1,2025-01-26 20:37:48,,,,Why The 4090 is 1800 the 5080 is 1000 Who cares what generation it is An old 911 Turbo S is still faster than a new Carerra If you have a 4090 keep it or upgrade to even more absurd 5090,m93ogjc,1.0,1i9oky5
comment,m9dr5ew,None,,1,2025-01-27 02:11:06,,,,Or buying a 4090 One of those is definitely more fun lol,m93ogjc,1.0,1i9oky5
comment,m9li8ut,None,,1,2025-01-28 06:31:38,,,,Skipping untill this AI performance focus dies off and they start making real GPUS again,m93ogjc,1.0,1i9oky5
comment,m94s4ji,Top_Rekt,,1,2025-01-25 18:38:00,,,,Thatd what Im planning on mostly because I want a nice 6090,m93ogjc,1.0,1i9oky5
comment,m93jsps,Gipetto,,896,2025-01-25 15:01:37,,,,It would not be at all surprising if theyre giving up gaming rendering performance in favor of crypto and ai performance NVIDIA is all in on riding those waves and I wouldnt be afraid to wager that itll start effecting their entire product line,,0.0,1i9oky5
comment,m93l5ba,Fatigue-Error,,226,2025-01-25 15:09:04,,,,Deleted by User using PowerDeleteSuite,m93jsps,1.0,1i9oky5
comment,m94enrf,DingleBerrieIcecream,,42,2025-01-25 17:33:54,,,,While this has been said before its also the case that 4K on a 27 monitor approaches a threshold where people see very little gain if they upgrade to 6k or 8k At least going beyond 4K will have very diminishing returns in terms of perceived visual fidelity Add to that that 120 or maybe 240hz refresh also begins to be a max speed that offers little if one goes beyond it So once flagship GPUs can handle 4K 240hz signal there becomes less room or need for improvement at some point,m93l5ba,2.0,1i9oky5
comment,m95df3v,zernoc56,,31,2025-01-25 20:22:24,,,,I honestly dont care about anything beyond 1440 8k is hilariously overkill I dont need a five hour game to take up the entirety of a 10 terabyte ssd by having grass textures that show pollen and whatnot on every blade like jesus christ If I want photorealistic graphics Ill watch a movie,m94enrf,3.0,1i9oky5
comment,m98qou5,missmuffin__,,7,2025-01-26 09:39:37,,,,I hear routside also has photorealistic graphics with grass and pollen and all that edittypo,m95df3v,4.0,1i9oky5
comment,m9ckp22,NobodyLikesMeAnymore,,3,2025-01-26 22:40:49,,,,tbh I tried outside once and the graphics are detailed yes but its like theres no art direction at all and everything just comes together as meh,m98qou5,5.0,1i9oky5
comment,m9f2foh,missmuffin__,,3,2025-01-27 07:38:26,,,,Yeah Theres no game designer so its kind of a mish mash of a variety of influences,m9ckp22,6.0,1i9oky5
comment,m9b7n0b,Exeftw,,1,2025-01-26 18:53:59,,,,So are you here or are you outside,m98qou5,5.0,1i9oky5
comment,m959qks,pattperin,,2,2025-01-25 20:03:40,,,,Yeah Im pretty close to being at a point where I just wont need a new GPU unless something crazy happens in game development techniques Ive got a 3080ti and I play in 4k it shows its warts at that resolution and Ive got to play most games with DLSS on for a steady framerate above 60 fps It gets me 120 typically but Id rather have the higher native frame rate and lower latency so Im going to upgrade when there are 4k cards that can do 4k 120 with DLSS off 5080 might be that card might not be We will see once the benchmarks get released Hoping this is the generation willing to wait if not But Ive got high hopes for a 5080ti or super coming out and giving me what I am waiting for Ive got medium high hopes that the 5080 is what Im looking for but wouldnt be surprised if its not quite where I want it to get to,m94enrf,3.0,1i9oky5
comment,m97wd66,Diedead666,,1,2025-01-26 05:00:53,,,,Im 4k 32inch Im sensitive to resolution and even at this size I can not see the pixels The issue with PC hardware is at high settings 4090 cant hold steady high frames Even 30 more ream performance can not hold steady 120 real frames and even more fake frames you will feel it,m94enrf,3.0,1i9oky5
comment,m95rfwx,PM_ME_OVERT_SIDEBOOB,,0,2025-01-25 21:33:29,,,,Its why I love how cheap TVs are nowadays Visual performance has diminishing returns and 800 and 2k dont look much different,m94enrf,3.0,1i9oky5
comment,m961mxa,GetFvckedHaha,,10,2025-01-25 22:26:47,,,,Huh There is a marked visual distinction between a 9001000 dollar SamsungLGSony 40ish inch OLED and a 20002300 dollar 70 inch of the same brand,m95rfwx,4.0,1i9oky5
comment,m93th4v,Juicyjackson,,68,2025-01-25 15:52:04,,,,Its also getting so much harder to improve on modern architecture Right now the 5090 is on 5nm the size of a silicon atom is 02nm We are quickly going to run into physical limitations of silicon,m93l5ba,2.0,1i9oky5
comment,m93xcp1,cspinasdf,,136,2025-01-25 16:10:57,,,,the whole 3 nm 5 nm chip size is mostly just marketing They dont actually have any feature of that size Like 5 nm chips have a gate pitch of 51nm and a metal pitch of 30nm 3 nm chips have a gate pitch of 48nm and a metal pitch of 24 nm So there is still quite a ways to go before we have to get smaller than individual atoms,m93th4v,3.0,1i9oky5
comment,m94p0pb,Lied-,,38,2025-01-25 18:23:15,,,,Just to add onto this the physical limitations of semiconductors are actually quantum tunneling phenomena which occurs at these sub 50nm gate sizes,m93xcp1,4.0,1i9oky5
comment,m9526pv,thecatdaddysupreme,,4,2025-01-25 19:26:19,,,,Can you explain please,m94p0pb,5.0,1i9oky5
comment,m953wbz,TheseusPankration,,30,2025-01-25 19:34:36,,,,When the gates get too thin electrons can pass through them like they are not there This makes them a poor switch The 5 nm thing is marketing The features are in the 10s of nm,m9526pv,6.0,1i9oky5
comment,m965vzz,thecatdaddysupreme,,5,2025-01-25 22:49:40,,,,Fascinating Thank you,m953wbz,7.0,1i9oky5
