type,id,author,title,score,created_utc,url,num_comments,subreddit,body,parent_id,depth,post_id
post,1io8lfg,chrisdh79,"A 3D-printed VHS cleaner is saving memories from mold | If you own analog tape covered in fuzzy gunk, this machine might make them playable again.",1235,2025-02-13 02:17:13,https://www.reddit.com/r/gadgets/comments/1io8lfg/a_3dprinted_vhs_cleaner_is_saving_memories_from/,33.0,gadgets,,,,
comment,mchdycz,ElectronRotoscope,,147,2025-02-13 02:25:20,,,,Mold on tapes is an absolute plague Moldy tape goes in the player spores get into it and now every tape that goes in there gets infested,,0.0,1io8lfg
comment,mckirc5,Alienhaslanded,,2,2025-02-13 16:13:06,,,,Why does that happen Are there organic compounds in tapes,mchdycz,1.0,1io8lfg
comment,mcks6c7,ElectronRotoscope,,3,2025-02-13 16:57:00,,,,Yeah looks like it UMatic aka ¾ tapes are the ones I heard about mold problems with the most and thats some info about their chemistry but I dont know the details I imagine thats what the mold is eating would be wild if it was getting something from the iron but who knows,mckirc5,2.0,1io8lfg
comment,mci4u19,zorbz23431,,44,2025-02-13 05:12:49,,,,I know two drunks in Milwaukee who need to get on this right away,,0.0,1io8lfg
comment,mcjjl9e,ButtmanAndRubbin,,-8,2025-02-13 13:00:33,,,,gifgiphy2fwaEnZSMbC3yo3Owt,mci4u19,1.0,1io8lfg
comment,mclnw32,HandsOfCobalt,,7,2025-02-13 19:26:06,,,,people seem to be missing that this is one of the drunks from Milwaukee,mcjjl9e,2.0,1io8lfg
comment,mcltunt,ButtmanAndRubbin,,3,2025-02-13 19:53:13,,,,9 redditors fail to see the reference thats too funny lol,mcjjl9e,2.0,1io8lfg
comment,mcrrhfa,zorbz23431,,3,2025-02-14 18:23:51,,,,I got it right away and tried to updoot twice for what its worth,mcltunt,3.0,1io8lfg
comment,mcjx7cc,graveybrains,,5,2025-02-13 14:23:18,,,,gifgiphy7cTTE2Z1OmrFm,mcjjl9e,2.0,1io8lfg
comment,mci1cqv,Justinfromthefuture,,22,2025-02-13 04:47:32,,,,Poppers,,0.0,1io8lfg
comment,mcka6oy,Jeffrey_C_Wheaties,,2,2025-02-13 15:31:42,,,,My first thought as well haha,mci1cqv,1.0,1io8lfg
comment,mchlpsf,faux_borg,,51,2025-02-13 03:09:27,,,,They can 3d print poppers now Wild,,0.0,1io8lfg
comment,mcjjo6r,BossMagnus,,3,2025-02-13 13:01:07,,,,Lololol oh man,mchlpsf,1.0,1io8lfg
comment,mchquj9,SlopTartWaffles,,10,2025-02-13 03:39:30,,,,VHS tapes start to degrade after 20 years Which is more of a problem Convert to digital,,0.0,1io8lfg
comment,mcj47p9,Dildosmoke69,,4,2025-02-13 10:55:35,,,,Fuzzy Gunk is a killer band name,,0.0,1io8lfg
comment,mcjl4xb,TexturedTeflon,,4,2025-02-13 13:10:54,,,,Now we just need a 3D printed 8mm player to get our old films converted,,0.0,1io8lfg
comment,mckd561,kevnadz,,5,2025-02-13 15:46:03,,,,I have one of these and they are amazing Your only other option other than building something yourself is a vintage Geneva tape cleaner which sell for 300 on eBay and they arent nearly as good as this VHS is Life mold cleaner,,0.0,1io8lfg
comment,mcieh25,Small-Palpitation310,,2,2025-02-13 06:32:17,,,,Replicators,,0.0,1io8lfg
comment,mcmdjdj,sargrvb,,2,2025-02-13 21:24:52,,,,I literally work with VHS tapes all day every day for a living Good to see people making stuff like this Will try and make one later for my office,,0.0,1io8lfg
comment,mcjbq3g,Luminaire_Ultima,,1,2025-02-13 12:02:59,,,,Very cool,,0.0,1io8lfg
comment,mcjprua,HL3confirm3d,,1,2025-02-13 13:40:01,,,,The real question is will this work on Betamax,,0.0,1io8lfg
comment,mckdkwv,kevnadz,,2,2025-02-13 15:48:11,,,,Yes He sells additional spindles to fit Betamax,mcjprua,1.0,1io8lfg
comment,mck7dup,nutmegtell,,1,2025-02-13 15:17:43,,,,Should post this over on rGenX,,0.0,1io8lfg
comment,mcllh4d,whenweriiide,,1,2025-02-13 19:15:00,,,,Someone needs to tell Gregg Turkington,,0.0,1io8lfg
comment,mck60ac,crescentrolls90,,0,2025-02-13 15:10:43,,,,Tell that to the VCR that ate my Little Mermaid tape,,0.0,1io8lfg
comment,mcjcbec,4kVHS,,-2,2025-02-13 12:07:45,,,,Looks too complicated for the average person,,0.0,1io8lfg
comment,mcin339,toooutofplace,,-11,2025-02-13 07:55:04,,,,i feel most people here dont know wtf is VHS lol,,0.0,1io8lfg
comment,mcivb3a,tholasko,,20,2025-02-13 09:22:59,,,,Youre on rgadgets Im willing to bet a decent number of people here are at least minimally technically proficient,mcin339,1.0,1io8lfg
comment,mckjpnf,Alienhaslanded,,2,2025-02-13 16:17:39,,,,Reddit its mostly people from the 80s and the early 00s yet everyone accuses each others of being children Most of us are in our 30s and 40s at this point and we all know what VHS tapes are,mcivb3a,2.0,1io8lfg
