type,id,author,title,score,created_utc,url,num_comments,subreddit,body,parent_id,depth,post_id
comment,me1iuv5,mudokin,,16,2025-02-21 19:31:40,,,,You may be right but look at that thing this is a remote control drone in car form They claim 110 miles flight range and 200 miles road range but if you look at the top view that this is a capsule that houses 2 people surrounded by nothing its just an empty grid with 4 propellers and 4 wheels There is zero space for batteries They have 4 people easily lift the thing so it cant be heavy Even the SMART EV car battery is 170kilos and only gives that car a rage if 160 kilometers this is smoke and mirrors Best thing is they are taking preorders,me0auf5,2.0,1iumsi7
comment,me1ka17,SedatedAndAmputated,,-1,2025-02-21 19:38:22,,,,Its more of a car than a helicopter is,me1iuv5,3.0,1iumsi7
comment,me23xui,Camerotus,,9,2025-02-21 21:14:06,,,,From what is shown in the video its driving capabilities match those of a helicopter zero,me1ka17,4.0,1iumsi7
comment,me2xxqi,OneBigBug,,4,2025-02-21 23:45:16,,,,Typically a flying car is thought of as a car that flies Ive never seen any helicopters driving down the road Is that actually what people think of when they think of flying cars Like I realize its pithy and all but thinking back to all the science fiction Ive ever seen that had flying cars many of them were not particularly suited to ground transport Flying car flying car hover car A flying car is a car that flies but the part of the thing that makes it a car is the fact that its got a passenger cabin and can be operated by members of the general public not that it can also be operated on the roads,me0auf5,2.0,1iumsi7
comment,me2yhu1,SedatedAndAmputated,,-1,2025-02-21 23:48:19,,,,A helicopter is not a car,me2xxqi,3.0,1iumsi7
comment,me17z8r,Elios000,,2,2025-02-21 18:40:40,,,,i have its called hover taxi you can just fly few inches off the ground you still have ALL the same issues ever seen 2 cars hit at 60mph ever seen whats left of light aircraft after it hits something do you want to be hit by a SUV in whats effectively a light aircraft,me0auf5,2.0,1iumsi7
comment,me1ducd,SedatedAndAmputated,,2,2025-02-21 19:08:03,,,,Yeah I dont think its a good idea I never said it was I was simply pointing out that a helicopter is not a car,me17z8r,3.0,1iumsi7
comment,me9ssx9,Username43201653,,1,2025-02-23 01:59:16,,,,Yeah I 100 want some ahole sandblasting my roof as he flies over me Totally cool The bonus being when he crash lands on my roof If you think cybertrucks are being vandalized,me0auf5,2.0,1iumsi7
comment,me0rb6n,imreallyfreakintired,,1,2025-02-21 17:24:02,,,,This thing looks so thin one fender bender will render it useless Hardly a car,me0auf5,2.0,1iumsi7
comment,me0wgnt,SedatedAndAmputated,,1,2025-02-21 17:47:35,,,,Im not advocating for this Just pointing out that a helicopter is not a car,me0rb6n,3.0,1iumsi7
comment,me1uii2,Dirty_Dragons,,1,2025-02-21 20:27:00,,,,Its crazy how many people miss that point If a vehicle cannot do what a car can drive on the road its not a flying car The other issue is size The smallest helicopters and airplanes are massive compared to cars If you cant land the vehicle then drive and park it in a normal garage its not a flying car,me0auf5,2.0,1iumsi7
comment,me1xu4b,SedatedAndAmputated,,-2,2025-02-21 20:44:34,,,,You would think the name flying car would be pretty self explanatory but I guess I forgot how uncommon common sense is,me1uii2,3.0,1iumsi7
comment,me47pty,Hendlton,,1,2025-02-22 05:18:21,,,,It costs much more energy to lift something up from the ground than to move it on wheels With the exceptions of rough terrain snow or water Yeah Im aware that flying cars are a terrible idea but something that floats slightly off the ground could still be useful We have hovercraft but those have been around for a long time Maybe something better can be made,mdytxqv,1.0,1iumsi7
comment,me4z5tp,Slick424,,1,2025-02-22 09:22:29,,,,something that floats slightly off the ground could still be useful Groundeffect vehicle already exist,me47pty,2.0,1iumsi7
comment,me05mhy,Dirty_Dragons,,0,2025-02-21 15:42:45,,,,Can you drive a helicopter down the street,mdytxqv,1.0,1iumsi7
comment,me14hij,chickyslay,,4,2025-02-21 18:24:32,,,,Can you drive a car in a helicopter,me05mhy,2.0,1iumsi7
comment,mekddgd,bigWeld33,,1,2025-02-24 19:02:25,,,,Can you drive a helicopter or fly a car,me14hij,3.0,1iumsi7
comment,me1bt5s,Dirty_Dragons,,0,2025-02-21 18:58:26,,,,What is that supposed to even mean,me14hij,3.0,1iumsi7
comment,me1cozn,mudokin,,0,2025-02-21 19:02:35,,,,No need to if the flying part would actually work properly and efficiently,me05mhy,2.0,1iumsi7
comment,me1tb5r,Dirty_Dragons,,2,2025-02-21 20:21:07,,,,What How is that a flying car then if it cant do a what a car can It would still need to be parked Do you expect people to pick up their children from school in a helicopter Why do you think that everybody doesnt have a heli now They are just as good as cars right,me1cozn,3.0,1iumsi7
comment,me1u7i2,SedatedAndAmputated,,1,2025-02-21 20:25:29,,,,Oh got it You just completely misunderstand the point,me1cozn,3.0,1iumsi7
comment,me22x79,mudokin,,3,2025-02-21 21:09:14,,,,You will never be able to use it like they show Imagine taking of in traffic to fly over an accident as they show in one of their videos You would send shit everywhere you would damage all the cars around you with stones and debris Well that will even happen if you take of anywhere within the city This thing will send all the loose stuff lying around on the streets and walkways flying around So IF that comes to reality we will still need a lot of landing places People will have to drive there to be allowed to lift of for flight and if these get mainstream you will have to wait in line to do so you know like in an airport because any accident within the air is potentially a catastrophic one This is a pipe dream of a grifter EDIT You arent even allowed to fly a drown everywhere Why would this thing be better,me1u7i2,4.0,1iumsi7
comment,me27asp,SedatedAndAmputated,,0,2025-02-21 21:29:55,,,,I never said its practical and I never said Im for it I dont know how I could dumb this down any further for you A helicopter is not a car Thats it That is literally all I was saying,me22x79,5.0,1iumsi7
comment,mgzz221,Human-Assumption-524,,0,2025-03-10 10:08:14,,,,Im so sick of this braindead gotcha talking point Yeah helicopters exist most evtols are intended to be a better helicopter This thing not included Unless you believe helicopters simply can never possibly be improved upon there is a market for a bettercheaperquietersafer helicopter,mdytxqv,1.0,1iumsi7
comment,me0f589,questionableco,,10,2025-02-21 16:27:45,,,,NBC news report on this was hilarious They wouldnt let them film the cockpit they had to stay really far away when filming and they never saw a pilot get in or out of it lol This looks like a giant scam and not even a competent one,,0.0,1iumsi7
comment,me16ypn,Elios000,,6,2025-02-21 18:35:59,,,,all flying cars any thing trying use multi rotor shit are we have helicopters already you dont see millions of them flying around take a guess why,me0f589,1.0,1iumsi7
comment,me2ljfl,Independent-Win-4187,,1,2025-02-21 22:39:16,,,,The CEO looks like the equivalent of bad guy ceo villian,me0f589,1.0,1iumsi7
comment,mdyo92y,BERND_HENNING,,40,2025-02-21 09:41:06,,,,An ultra light versionOK Add a single passenger of 70 kg and some safety measures to not make that thing straight up suicidal in real traffic a battery for the supposed range of 200 miles on the streets and then show a wobbly little hop like that again Its cool that someone keeps tinkering with flying cars but that just looks like nothing more than a few connected drones with some ultra light carbon Fiber hat,,0.0,1iumsi7
comment,mdzqqtp,veloace,,18,2025-02-21 14:27:49,,,,Not ultra light it says ultralight in the article which is different An ultralight is defined in 14 CFR Part 103 as an aircraft that is under certain weight and performance requirements and therefore does not require a pilots license to fly when flown in certain areas I havent done any research on this vehicle yet but I assume they built an ultralight version as a proofofconcept so they wouldnt have to go throw the certification process for their flying car to get an airworthiness certificate Edited to add Looked into it more and it looks like theyre flying under a Special Airworthiness Certificate Still it looks like theyre testing the software and related systems so a cheaper version is better to test with,mdyo92y,1.0,1iumsi7
comment,me2q107,haarschmuck,,2,2025-02-21 23:02:15,,,,No way they are making a FAA compliant ultralight as the max weight is 254lbs,mdzqqtp,2.0,1iumsi7
comment,me2yf75,veloace,,1,2025-02-21 23:47:54,,,,Agreed I went back and did some research and they are flying under a Special Airworthiness Certificate,me2q107,3.0,1iumsi7
comment,me07yhu,BERND_HENNING,,1,2025-02-21 15:53:48,,,,Oh thats interesting thank you for the insight Sounds like it would apply to something like drones I still wonder what concept they are trying to proof though since this seems to be vastly different from what theyre trying do Couldnt they just test an actual prototype given that they have one on private property like in a factory hall or something The only thing that this seems to proof is that a few interconnected drones with an extremely light load can take off vertically fly a few meters and land and i feel like ive seen that years ago But im no expert so im honestly curious how this is worth a message,mdzqqtp,2.0,1iumsi7
comment,me0em4m,veloace,,2,2025-02-21 16:25:16,,,,So in the US regardless if you are on private property or not youre on part of the National Airspace System so you have to abide by the FAA rules regardless whether it be drones manned aircraft rockets balloons etc so even if they wanted to make a fullsize version and test it on their property it would still require them to obtain an experimental airworthiness certificate That process is somewhat complicated but it isnt that bad as amateur homebuilders often go that route but it is a lot more work than just not getting an airworthiness certificate which is what you can do with an ultralight Furthermore if you certify an airplane as experimental you can do more with it BUT it must be flown as an ultralight So for this product the ultralight has two advantages 1 Its cheaper and quicker so they really can just throw it together real quick to see if it even works If the concept does then they can put the work towards building a fully operational larger aircraft 2 An ultralight does not require the operator to have a pilots license so in that aspect it is a much true flying car If it was any larger and NOT an ultralight it really wouldnt be a flying car anymore as the operator would need a pilots license So its just an airplane at that point Also if they are short on funding and a small company the ultralight prototype is a great way to show it can be done without going completely broke As for drones this is borrowing drone technology for the manned space which is great but a manned drone is no longer a drone And youre right its nothing particularly groundbreaking it just sounds like nerds having fun Which I dont know the size of the company but if it is just a few people getting together to build this and not something done by a large aerospace company it is a pretty impressive feat,me07yhu,3.0,1iumsi7
comment,mdys0ji,None,,13,2025-02-21 10:18:20,,,,gifgiphy3o7TKvFKwclJQDY30Adownsized,,0.0,1iumsi7
comment,mdymnsh,jcliment,,22,2025-02-21 09:25:07,,,,We dont have enough vehicle incidents in a twodimensional environment now we want drivers to become pilots Ok,,0.0,1iumsi7
comment,mdytp15,Tankerrex,,3,2025-02-21 10:34:50,,,,Every worker in aviation regulation bodies are gonna be on suicide watch after flying cars are mainstream,mdymnsh,1.0,1iumsi7
comment,mdyvluf,pafrac,,3,2025-02-21 10:53:05,,,,Dont worry about it we dont need em I mean its not as if all the sackings lately made any difference,mdytp15,2.0,1iumsi7
comment,me28jdh,Live_Ad_9019,,6,2025-02-21 21:35:43,,,,Alef Aeronautics builds drone shaped like a car There fixed your stupid headline,,0.0,1iumsi7
comment,me0dpql,edistthebestcat,,5,2025-02-21 16:21:03,,,,People have a hard time driving in two dimensions please dont give them another direction not to bother to look in,,0.0,1iumsi7
comment,me2jckz,Toisty,,3,2025-02-21 22:28:14,,,,Can we just have safe reliable and effective public transportation Wealthy elite peoples allergy to the normal human interaction is pathological at this point,,0.0,1iumsi7
comment,mdym8nv,depressedbananaslug,,10,2025-02-21 09:20:57,,,,Hey my boyfriend worked on that car back when it was armada aeronautics,,0.0,1iumsi7
comment,me16q25,BrothStapler,,1,2025-02-21 18:34:53,,,,Same here I was at their Santa Clara office We just did a lot of 3d printer mold processing for carbon fiber panels,mdym8nv,1.0,1iumsi7
comment,me25cbb,Camerotus,,3,2025-02-21 21:20:44,,,,Can we just stop trying to make 70s scifi movie ideas real things There is absolutely zero rationale behind making a vehicle that can both drive and fly car shaped aside from it looks cool in the movies Why would the optimal design just be a car with an oversized leaf lower attached to it,,0.0,1iumsi7
comment,mdymf99,Novemberai,,5,2025-02-21 09:22:46,,,,Only a matter of time before the battery dies or the car otherwise malfunctions while airborne and falls on someone What A flying squirrel hit your face and caused you to involuntarily commit manslaughter,,0.0,1iumsi7
comment,mdz723o,iwishihadnobones,,5,2025-02-21 12:27:45,,,,Mans laughter,mdymf99,1.0,1iumsi7
comment,mdym1x2,f8tel,,5,2025-02-21 09:19:06,,,,car,,0.0,1iumsi7
comment,mdzmoqr,Ste4mer,,5,2025-02-21 14:05:36,,,,gifgiphy3Z1b90nxAVj7C7YS5G,,0.0,1iumsi7
comment,mdyp8hf,Tywele,,2,2025-02-21 09:50:52,,,,The second clip in the video looks so much like CGI,,0.0,1iumsi7
comment,mdyqu5t,ottoIovechild,,2,2025-02-21 10:06:42,,,,There goes our insurance rates,,0.0,1iumsi7
comment,me24rvd,Jaymac720,,2,2025-02-21 21:18:02,,,,I dont trust people to operate cars in two dimensions I cant imagine whatll happen when we add the third plus the worse handling,,0.0,1iumsi7
comment,me2arnl,maazen,,2,2025-02-21 21:46:19,,,,its KITTs turbo boost in slow motion,,0.0,1iumsi7
comment,me2as14,InternalStriking574,,2,2025-02-21 21:46:21,,,,It looks so much like the Weasleys,,0.0,1iumsi7
comment,me2d6lp,Girthtanin,,2,2025-02-21 21:57:49,,,,The dukes did that much,,0.0,1iumsi7
comment,me2fjpa,TheRabidGoose,,2,2025-02-21 22:09:20,,,,I couldnt care about having flying cars when the world is about to implode,,0.0,1iumsi7
comment,me2fql8,TheFoxandTheSandor,,2,2025-02-21 22:10:17,,,,RONALD WEASLEY,,0.0,1iumsi7
comment,me2ph7o,haarschmuck,,2,2025-02-21 22:59:21,,,,No such thing as a flying car Moment it leaves the ground the FAA takes over and you need a pilots license except for ultralightparachutes Legally this is a plane that can drive on the roads not the other way around,,0.0,1iumsi7
comment,me2qjtz,Nervous_Team6362,,2,2025-02-21 23:05:00,,,,Imagine how much time you could save from traveling 3 miles an hour in the air,,0.0,1iumsi7
comment,me2sagu,nexusjuan,,2,2025-02-21 23:14:14,,,,You know people are all like wheres my flying car until someone makes a flying car and theyre like no nope uh uh Im not getting into that deathtrap,,0.0,1iumsi7
comment,me38emd,Lawls91,,2,2025-02-22 00:43:16,,,,If thats a car then Ive been driving since the age of 5,,0.0,1iumsi7
comment,me3v9f9,ishook,,2,2025-02-22 03:50:43,,,,5 drones in a trench coat,,0.0,1iumsi7
comment,me3yp57,ShiamondDamrock,,1,2025-02-22 04:13:57,,,,,me3v9f9,1.0,1iumsi7
comment,me4m58s,Professional-Eye-771,,2,2025-02-22 07:20:16,,,,Drives like a plane flys like a car tada,,0.0,1iumsi7
comment,me89rwx,AgainstMenzingers,,2,2025-02-22 20:57:38,,,,Harry and Ron are about to get in SO much trouble,,0.0,1iumsi7
comment,me8k6pw,None,,2,2025-02-22 21:51:09,,,,Looks like a scam to fraud investors so they can attempt to make real one,,0.0,1iumsi7
comment,mebfko4,DazzaTheComic,,2,2025-02-23 09:37:04,,,,The average fat American family will not get this off the ground,,0.0,1iumsi7
comment,mdylqif,Boop0p,,4,2025-02-21 09:15:57,,,,No thanks,,0.0,1iumsi7
comment,mdz5fky,None,,3,2025-02-21 12:15:56,,,,Thats fucking stupid,,0.0,1iumsi7
comment,mdyy2eu,kanabalizeHS,,2,2025-02-21 11:15:38,,,,I dont think flying cars thst uses any propeller is the answer It has to be a novel levitation mechanism,,0.0,1iumsi7
comment,mdyz3ui,igneus,,2,2025-02-21 11:24:49,,,,gifgiphyqGxSPzJtYXFhS,,0.0,1iumsi7
comment,me0wnkl,springsilver,,2,2025-02-21 17:48:28,,,,Skycutter,mdyz3ui,1.0,1iumsi7
comment,mdz2elj,pedsmursekc,,1,2025-02-21 11:52:29,,,,So what signal will we use for hopscotch mode and how do we prioritize who gets to hop whom and when,,0.0,1iumsi7
comment,mdz2hfo,Sassy-irish-lassy,,1,2025-02-21 11:53:08,,,,Can it even function as a normal car,,0.0,1iumsi7
comment,mdz3fbr,408wij,,1,2025-02-21 12:00:35,,,,Needs a musical horn that plays Dixie but slowly,,0.0,1iumsi7
comment,mdz4alq,CaveManta,,1,2025-02-21 12:07:19,,,,Its those flying cars we were supposed to have long ago,,0.0,1iumsi7
comment,mdz80ox,thisisfuxinghard,,1,2025-02-21 12:34:33,,,,Is the future here yet,,0.0,1iumsi7
comment,mdz927i,Madmandocv1,,1,2025-02-21 12:41:54,,,,Fake photo,,0.0,1iumsi7
comment,mdzau5v,Xenobsidian,,1,2025-02-21 12:53:50,,,,As Neil deGrasse Tyson said we already have two technologies who achieve what this is good for We call them bridges and tunnels,,0.0,1iumsi7
comment,mdzdb4i,amander823,,1,2025-02-21 13:09:48,,,,Ford Anglia if I ever saw one,,0.0,1iumsi7
comment,mdzg7cs,Baazar,,1,2025-02-21 13:27:47,,,,We got flying cars before we got GTA6,,0.0,1iumsi7
comment,mdziibh,zoedot,,1,2025-02-21 13:41:41,,,,Oh goody more midair collisions,,0.0,1iumsi7
comment,mdzlwtf,Infra-Man777,,1,2025-02-21 14:01:11,,,,gifgiphye2QYPpUe8WmpG Finally,,0.0,1iumsi7
comment,mdzoxjg,piratecheese13,,1,2025-02-21 14:18:03,,,,The FAA needs more employees,,0.0,1iumsi7
comment,mdzoy5w,Ok_Here-we-go,,1,2025-02-21 14:18:09,,,,A car that is worse than the Cybertruck Impossible,,0.0,1iumsi7
comment,mdzsx2j,None,,1,2025-02-21 14:39:26,,,,2nd time not 1st time The article forgot to mention the 1st time was by some good old boys who never meaning no harm,,0.0,1iumsi7
comment,mdzu9tr,Spare_Town6161,,1,2025-02-21 14:46:32,,,,This inferior car inferior plane,,0.0,1iumsi7
comment,mdzus8k,Unrelated_gringo,,1,2025-02-21 14:49:11,,,,Thats not really a car though,,0.0,1iumsi7
comment,mdzxtmg,DunedweIIer,,1,2025-02-21 15:04:51,,,,gifgiphyeppZg5SmXd5Na5QXZu,,0.0,1iumsi7
comment,mdzy0en,drewjsph02,,1,2025-02-21 15:05:48,,,,When I was a kid in the 80s flying cars were so cool and I could not wait Now that Im an Adult and know how most people drive NO THANK YOU I do not want the idiots I see on the highway flying cars over my home,,0.0,1iumsi7
comment,me03a6c,Dangerous-Coconut-49,,1,2025-02-21 15:31:34,,,,All the future neighborhoods are acoustically fckd We thought freeways were bad,,0.0,1iumsi7
comment,me04l09,SubstanceObjective42,,1,2025-02-21 15:37:49,,,,Thats a drone in a Jetsons Halloween costume,,0.0,1iumsi7
comment,me05ea4,Dirty_Dragons,,1,2025-02-21 15:41:40,,,,Now that is what a flying car should be a vehicle that can also drive on the ground No a helicopter is not a flying car because it cant drive Airplanes dont count because they are too big A flying car has to fit in a lane on the street Of course this is still an early prototype,,0.0,1iumsi7
comment,me0733y,dfgdfgadf4444,,1,2025-02-21 15:49:40,,,,LAME,,0.0,1iumsi7
comment,me07wvw,anagraminals,,1,2025-02-21 15:53:34,,,,Just some good ol boys,,0.0,1iumsi7
comment,me08d3f,Th3Batman86,,1,2025-02-21 15:55:42,,,,This is terrible People get into so many accidents just driving on a flat surface Give them all directions to ignore and we are fucked Also drones are loud AF No one wants this Give us fucking healthcare and clean water,,0.0,1iumsi7
comment,me0ah93,Mothra3,,1,2025-02-21 16:05:41,,,,Holy moly It works But how,,0.0,1iumsi7
comment,me0bp9o,Alseen_I,,1,2025-02-21 16:11:30,,,,Flying cars are out jetpacks are the new hotness,,0.0,1iumsi7
comment,me0em5n,whalebacon,,1,2025-02-21 16:25:16,,,,IDK about anyone else but I always figured we would figure out maglev or antigrav instead of Big Ass Fans for flying cars and stuff Oh well,,0.0,1iumsi7
comment,me0ihqm,Underwater_Karma,,1,2025-02-21 16:43:16,,,,this thing is less of a flying car and more of a quadracopter drone with a car shaped hat forget showing it fly lets see it drive and considering how well established drone tech is this thing looks very unstable,,0.0,1iumsi7
comment,me0kinx,linuxliaison,,1,2025-02-21 16:52:39,,,,This thing doesnt even have a proper transmission,,0.0,1iumsi7
comment,me0kvb4,iwellyess,,1,2025-02-21 16:54:17,,,,It looks like shit,,0.0,1iumsi7
comment,me0oy7p,rohowsky,,1,2025-02-21 17:13:11,,,,What a fucking scam LOL,,0.0,1iumsi7
comment,me0s0wq,TryingT0Wr1t3,,1,2025-02-21 17:27:17,,,,Is this using quadcopter approach to flying I thought it would need more runway to take flight but it looks more like a quadcopter and it has no wings or backup plan to power failure,,0.0,1iumsi7
comment,me0tbto,That-Makes-Sense,,1,2025-02-21 17:33:16,,,,I applaud their efforts but this just doesnt look practical at all Its going to be a lousy flying vehicle and a lousy car Just like the amphicar and the aerocar when you try to design a vehicle for two completely different environments theyre going to suck at both Notice how they dont show it driving around I would be very surprised if this vehicle could pass any NHTSA crash tests And if it was designed to pass the crash tests it would be too heavy to fly Look at small airplanes and how thin their structures and exteriors are And thats with winged aircraft which require much less power to fly than VTOLs This design is DOA,,0.0,1iumsi7
comment,me1nq36,wishod,,1,2025-02-21 19:54:25,,,,This design is just an investor cash grab its sole purpose is milking money as long as possible,me0tbto,1.0,1iumsi7
comment,me1w05v,That-Makes-Sense,,1,2025-02-21 20:34:46,,,,You might be right It just seems so obvious that its a bad design Full disclosure I have a small investment in Joby Theyre making an EVTOL without the car part I think they have a good design I think the EVTOLs could eventually replace many helicopters,me1nq36,2.0,1iumsi7
comment,me0u9os,Straight_Ace,,1,2025-02-21 17:37:35,,,,People already drive like shit on the ground doing it in the sky is gonna be incredibly dangerous,,0.0,1iumsi7
comment,me0vx35,Bender_2024,,1,2025-02-21 17:45:06,,,,The flying car will never be widespread for one simple reason Maintenance Think about some of the janky bodge job fixes you see on the road Better yet go over to rJustrolledintotheshop and see some of the stuff that people bring in An aircraft is an order of magnitude more complex with tolerances far less forgiving than any road car Still people will treat them like their lawnmowers and never change the oil until the engine siezes and it falls out of the sky like a brick,,0.0,1iumsi7
comment,me0yojk,c4ndyman31,,1,2025-02-21 17:57:43,,,,Worlds quietest passenger vehicle lmfao,,0.0,1iumsi7
comment,me0zbg6,kona_boy,,1,2025-02-21 18:00:36,,,,Americans will do everything but use a fucking train,,0.0,1iumsi7
comment,me1470a,feverfaucet,,1,2025-02-21 18:23:11,,,,Bruh read the room planes are going down left and right the FAA is practically shutting down whos gonna get into one of these things,,0.0,1iumsi7
comment,me14ask,MonkeySafari79,,1,2025-02-21 18:23:40,,,,Who wouldnt like to get all the dirt from the streets flying through his windows,,0.0,1iumsi7
comment,me15xzc,charles_yost,,1,2025-02-21 18:31:14,,,,Dat some Kitty Hawk shit right there,,0.0,1iumsi7
comment,me16jt8,Elios000,,1,2025-02-21 18:34:04,,,,now make it pass safety tests lol good luck,,0.0,1iumsi7
comment,me16y3b,L0neStarW0lf,,1,2025-02-21 18:35:55,,,,About 10 years late these were supposed to arrive in 2015,,0.0,1iumsi7
comment,me1720z,oxynaz,,1,2025-02-21 18:36:25,,,,I been saying for a long time that we should be hovering imagine all the savings on pavement,,0.0,1iumsi7
comment,me1e0cg,mexi_exe,,1,2025-02-21 19:08:50,,,,Ive been wondering for a while whether we could use metallic plates to achieve movement If it were possible I feel like it would drastically help improve battery life,,0.0,1iumsi7
comment,me1erxn,PositiveAd3624,,1,2025-02-21 19:12:28,,,,RONALD WEASLEY,,0.0,1iumsi7
comment,me1eu5o,doiwantacookie,,1,2025-02-21 19:12:46,,,,Before gta6,,0.0,1iumsi7
comment,me1goxq,Xephhpex,,1,2025-02-21 19:21:30,,,,Great way to clear a small traffic jam,,0.0,1iumsi7
comment,me1i6g7,txredgeek,,1,2025-02-21 19:28:28,,,,Anybody wanna buy a bridge,,0.0,1iumsi7
comment,me1jp4r,ghostdogs2,,1,2025-02-21 19:35:38,,,,I predict utter chaos if this becomes a reality I barely survive driving to and from work everyday,,0.0,1iumsi7
comment,me1jtzc,multisubcultural1,,1,2025-02-21 19:36:16,,,,Jet packs J E T Packs,,0.0,1iumsi7
comment,me1l32g,TimingAndBodyControl,,1,2025-02-21 19:42:07,,,,That thing is so stupid looking lol,,0.0,1iumsi7
comment,me1mx1c,Hoodi216,,1,2025-02-21 19:50:39,,,,My boss thinks self driving flying cars are like 2 years away from being the dominant form of travel Theres no way It would be sick if we had it like the Jetsons but look at this its unsteady slow looks pretty flimsy looks difficult to fly it 30 feet Gotta start somewhere but its not happening any time soon,,0.0,1iumsi7
comment,me1rqiw,beeniecal,,1,2025-02-21 20:13:36,,,,None of us will be able to afford it,,0.0,1iumsi7
