type,id,author,title,score,created_utc,url,num_comments,subreddit,body,parent_id,depth,post_id
comment,me1soio,Darkstool,,1,2025-02-21 20:18:08,,,,Oh ffs we cant even pilot vehicles without being assholes adding a 3rd dimension to be an asshole in is a terrible idea,,0.0,1iumsi7
comment,me1xhj2,talex365,,1,2025-02-21 20:42:45,,,,Every time I see something like this it has all of the worst traits of both a car and a drone without being able to competently do either of those jobs Is there evidence that this one is any different or is this another one of those silly 1000000 boondoggles that will never pan out,,0.0,1iumsi7
comment,me1zbo1,Bungle001,,1,2025-02-21 20:52:02,,,,Ive been seeing videos like this since the 80s This is a cash grab targeted at people dumb enough to invest,,0.0,1iumsi7
comment,me2094a,ovumtime,,1,2025-02-21 20:56:35,,,,Drunk driving is about to get crazy,,0.0,1iumsi7
comment,me23r7p,PresidentialCamacho,,1,2025-02-21 21:13:12,,,,A thousand orders will come from Ukraine to cross the Dnipro river,,0.0,1iumsi7
comment,me26nhv,None,,1,2025-02-21 21:26:54,,,,Oh great a drone with useless wheels on it Lets call it a flying car,,0.0,1iumsi7
comment,me27yc1,jrob321,,1,2025-02-21 21:32:57,,,,As shitty and selfishly and distractedly as people already drive on the road in their cars do we really want those idiots up in the sky Navigating powerlines alone will tally some pretty high death toll numbers no matter how safe they drive their we were promised these back in 2000 flying cars,,0.0,1iumsi7
comment,me2f2ez,CheezeLoueez08,,1,2025-02-21 22:07:00,,,,Ya Cool tech but this shouldnt become a norm Like you said people are horrible on the roads Were just not ready for this as a population I think in mostall countries,me27yc1,1.0,1iumsi7
comment,me2rdu1,Hydrogen_vs_Battery,,1,2025-02-21 23:09:26,,,,The inventor has some stiff competition This aircraft doesnt need s,,0.0,1iumsi7
comment,me2zcbd,The_Pandalorian,,1,2025-02-21 23:52:57,,,,Looks like a shitty 20 toy but just bigger,,0.0,1iumsi7
comment,me31m7l,Naive-Home6785,,1,2025-02-22 00:05:34,,,,What the flying fuck is this No thanks,,0.0,1iumsi7
comment,me3bowp,w3b_d3v,,1,2025-02-22 01:50:22,,,,Why does it have 4 wheels if its primary purpose is to fly Honestly could cut off about 25 on each end and have a much more efficient flying machine,,0.0,1iumsi7
comment,me3dw3k,chengstark,,1,2025-02-22 02:03:31,,,,Not interested It will always be worse than a car and worse than a plane and more expensive than two combined,,0.0,1iumsi7
comment,me3ge2d,waitingOnMyletter,,1,2025-02-22 02:18:39,,,,Ive always said this As poorly as people drive on the ground flying cars have always been and will always be nightmare fuel Like imagine youre just on a jog and a car lands on you or your in the park and a car just slams into the playground like a meteor wiping out a neighborhood of kids on the swing set Youre in your living room and your main floor windows just get harry pottered Like now multiply this into major metropolitan areas,,0.0,1iumsi7
comment,me3j527,bpmdrummerbpm,,1,2025-02-22 02:35:16,,,,As a child of the 90s I grew up believing wed be living in the futuristic world as portrayed in Blade Runner Star Wars Back to the Future and the Fifth Element when and only when we had flying cars,,0.0,1iumsi7
comment,me3oxtv,Amplith,,1,2025-02-22 03:10:33,,,,I thought the same thing with personal communicators on 70 and 80s sci fi showsmovies that had the tiny screens where you could see the personFaceTime kinda snuck up and took away the awe of all of that,me3j527,1.0,1iumsi7
comment,me3m6nv,drumonit,,1,2025-02-22 02:53:51,,,,Insurance will be a deal breaker,,0.0,1iumsi7
comment,me3nsac,None,,1,2025-02-22 03:03:32,,,,Oh so thats what the NJ drones were,,0.0,1iumsi7
comment,me3qmrw,Tonyy13,,1,2025-02-22 03:20:57,,,,Lemme guess Their testing facility is in New Jersey where the UFO craze and sightings were,,0.0,1iumsi7
comment,me3qn8g,Nomaddj-1964,,1,2025-02-22 03:21:02,,,,Investigators scam,,0.0,1iumsi7
comment,me3sgyp,DefectiveCorpus,,1,2025-02-22 03:32:42,,,,Yes because humans are so great at driving on one plane Definitely need flying cars,,0.0,1iumsi7
comment,me3x4xi,Suneo88,,1,2025-02-22 04:03:10,,,,Now we know what was flying over NJ,,0.0,1iumsi7
comment,me3zrsc,Enlightened_Doughnut,,1,2025-02-22 04:21:26,,,,Lets like feed and shelter people in need Maybe,,0.0,1iumsi7
comment,me47yln,Eccentric_Algorythm,,1,2025-02-22 05:20:11,,,,Lolololollll we can barely keep old people and drunks off the road as it is Now we might have drunk flyers and 90 yos who cant see FLYING no thanks Im staying inside,,0.0,1iumsi7
comment,me49s7w,halp_mi_understand,,1,2025-02-22 05:34:14,,,,Theres no rear end fender benders in this Youre a body in a paper envelope,,0.0,1iumsi7
comment,me4bzls,Historical_Animal_17,,1,2025-02-22 05:51:49,,,,Looks as silly and unstable as the Avrocar 60 years ago What a scientific advancement,,0.0,1iumsi7
comment,me4e3k2,Ornery_Day_6483,,1,2025-02-22 06:09:22,,,,I love the dust it kicks up when jumping the guy in front,,0.0,1iumsi7
comment,me4ecdz,WeDieYoung__,,1,2025-02-22 06:11:26,,,,flying cars they said,,0.0,1iumsi7
comment,me4g8w4,CuriousAndOutraged,,1,2025-02-22 06:27:43,,,,just stay far away if the driver somehow mimics how most drivers drive on solid land better stay far from these drivers,,0.0,1iumsi7
comment,me4jjl2,Brownstown75,,1,2025-02-22 06:56:49,,,,It flew about 30 feet,,0.0,1iumsi7
comment,me5gpgm,Spagman_Aus,,1,2025-02-22 12:05:20,,,,Theres 4 kids on a bmx each under that plastic cover,,0.0,1iumsi7
comment,me5j1aw,Jordan-Goat1158,,1,2025-02-22 12:23:43,,,,Tart,,0.0,1iumsi7
comment,me5jey5,Ulos,,1,2025-02-22 12:26:38,,,,Arthur Weasley approves,,0.0,1iumsi7
comment,me5rgw1,kfractal,,1,2025-02-22 13:22:00,,,,Good luck to them Looks goofy af,,0.0,1iumsi7
comment,me5ruee,Unfair_Bunch519,,1,2025-02-22 13:24:20,,,,Is this the one that does the flippy thing,,0.0,1iumsi7
comment,me5stja,35183518,,1,2025-02-22 13:30:23,,,,Someone will load it wrong and stall the machine,,0.0,1iumsi7
comment,me5td3y,35183518,,1,2025-02-22 13:33:43,,,,I guess youre not listening to music in that car or sitting on your porch while theyre flying by,,0.0,1iumsi7
comment,me5ztxv,cripblip,,1,2025-02-22 14:12:25,,,,Doing everything they can to avoid good mass transit,,0.0,1iumsi7
comment,me60cwv,Moist_Blueberry_5162,,1,2025-02-22 14:15:26,,,,For some reason I thought it would get me where Im going faster than if I had just walked,,0.0,1iumsi7
comment,me6bo8a,MediocreSupreme,,1,2025-02-22 15:16:39,,,,Old news Ron drove one into a tree like 20 years ago Edit a letter,,0.0,1iumsi7
comment,me6izn6,notoriously909,,1,2025-02-22 15:53:32,,,,Flying range of 110 miles and a driving range of 200 miles As an aerospace RD guy with 25 years of experience I have serious doubts about those numbers,,0.0,1iumsi7
comment,me6l2gr,VenusValkyrieJH,,1,2025-02-22 16:03:50,,,,I will say many times in my car sitting in traffic I have wished for this very thing That being said the actual prospect of flying cars is terrifying,,0.0,1iumsi7
comment,me6o93a,Aurelius5150,,1,2025-02-22 16:20:54,,,,Nope sorry This aint it,,0.0,1iumsi7
comment,me7kprs,Relaxmf2022,,1,2025-02-22 18:54:15,,,,Please No Texans are awful enough on the road Texans with side to side back and forth and up and down It will be raining Cletuses in no time,,0.0,1iumsi7
comment,me7ybws,eyelikeit40,,1,2025-02-22 19:59:58,,,,Be great in a traffic jam,,0.0,1iumsi7
comment,me89n5v,citizin-x,,1,2025-02-22 20:56:58,,,,We just dont have the technology for this yet And I literally mean that our technology cannot accomplish this Let alone the computing power necessary to run it all We would need a technological breakthrough in a much quieter safer and more efficient means of propulsion levitation Nothing gas powered or electric is going to get us flying cars But I appreciate that there are companies out there trying to push us forward on this Baby steps,,0.0,1iumsi7
comment,me8eyzb,None,,1,2025-02-22 21:24:21,,,,Can I please just travel on bus 2 miles and it not take 3 hours and 3 transfers Jfc,,0.0,1iumsi7
comment,me8fo1a,IanRevived94J,,1,2025-02-22 21:27:56,,,,This is from 3 years ago,,0.0,1iumsi7
comment,me985dz,drnemmo,,1,2025-02-23 00:00:57,,,,Thats just a drone painted as a car,,0.0,1iumsi7
comment,me99gnc,Alucardspapa,,1,2025-02-23 00:08:19,,,,gifgiphyMVU2q8gaqMDr6wE2x1downsized About damn time,,0.0,1iumsi7
comment,me9dkh4,Konstant_kurage,,1,2025-02-23 00:31:11,,,,Very dangerous you go first,,0.0,1iumsi7
comment,me9gc0w,SaintBrutus,,1,2025-02-23 00:46:40,,,,I bet its safer than a Tesla s lol,me9dkh4,1.0,1iumsi7
comment,me9ef55,CovidBorn,,1,2025-02-23 00:35:55,,,,This is just a grift to raise capital Thats not a car in even the loosest sense of the word,,0.0,1iumsi7
comment,me9le2j,johnwilkesbandwith,,1,2025-02-23 01:15:34,,,,Woof on the design but I support the effort,,0.0,1iumsi7
comment,me9nbbr,pauliewalnuts64,,1,2025-02-23 01:26:44,,,,Dweebmobile,,0.0,1iumsi7
comment,me9r7pd,Fun-Opportunity-8394,,1,2025-02-23 01:49:55,,,,Youre a car Harry,,0.0,1iumsi7
comment,mea10eq,HarryLewisPot,,1,2025-02-23 02:49:12,,,,If you think roads are congested imagine never being able to look at the sky again,,0.0,1iumsi7
comment,mea1ee4,Nfeatherstun,,1,2025-02-23 02:51:38,,,,This will never cease to be a bad idea,,0.0,1iumsi7
comment,meab5r3,OldWrangler9033,,1,2025-02-23 03:53:53,,,,Looks like wanna be car thats essentially a drone with token landing wheels Only way this thing a car if drives like one Quack like a duck Walk like duck and Fly like a Duck,,0.0,1iumsi7
comment,meajmzv,MrBahhum,,1,2025-02-23 04:51:39,,,,Look at all the dust it kicks up on the street That thing looks like it will crash in a good gust of wind What a terrible year for aviation,,0.0,1iumsi7
comment,meat67j,AndromedaFire,,1,2025-02-23 06:05:18,,,,This is like the tech bro version of the inflatable and fake tanks they used in ww2 to fool the nazis Some investor has probably threatened to pull out if the company doesnt show progress so they made this bullshit,,0.0,1iumsi7
comment,meat97l,BeebleBoxn,,1,2025-02-23 06:06:01,,,,I use to draw that when I was a kid,,0.0,1iumsi7
comment,meb27d0,raisingstorm,,1,2025-02-23 07:26:38,,,,Great Scott Incidents of sky rage have multiplied exponentially in the USA In other news the AutoFlug allows flying cars to drive up to Mach 4,,0.0,1iumsi7
comment,meb6z8u,No-Cupcake370,,1,2025-02-23 08:12:34,,,,At this point who cares about the flying cars anymore,,0.0,1iumsi7
comment,meb86vm,xMETRIIK,,1,2025-02-23 08:24:23,,,,Unless its antigravity alien technology I dont want it,,0.0,1iumsi7
comment,mecfn54,TheStockFatherDC,,1,2025-02-23 14:30:19,,,,I need one the size of a house than can float go under water and hover for days at a time,,0.0,1iumsi7
comment,mecg72i,None,,1,2025-02-23 14:33:32,,,,The airplanes arent even flying right anymore dont do this lol,,0.0,1iumsi7
comment,meeug0n,Aiku,,1,2025-02-23 21:40:28,,,,the cockpit only has enough room for one and a half people Which half wants to go,,0.0,1iumsi7
comment,mdz2vva,tree_washer,,1,2025-02-21 11:56:20,,,,Them Duke boys would like ta have a word with yall,,0.0,1iumsi7
comment,mdzoyc1,TheOmCollector,,1,2025-02-21 14:18:10,,,,gifgiphyeppZg5SmXd5Na5QXZu,,0.0,1iumsi7
comment,mdz08gh,OnboardG1,,-1,2025-02-21 11:34:30,,,,This should be in rupliftingnews,,0.0,1iumsi7
comment,mdz58vv,blinkrenking,,-1,2025-02-21 12:14:33,,,,Why doesnt it kick up any dust when flying over that dirt Im sceptical this is real not to mention its hardly a car,,0.0,1iumsi7
