type,id,author,title,score,created_utc,url,num_comments,subreddit,body,parent_id,depth,post_id
post,1iumsi7,diacewrb,Alef aeronautics’ drivable flying car takes flight for the first time,1925,2025-02-21 09:13:49,https://www.reddit.com/r/gadgets/comments/1iumsi7/alef_aeronautics_drivable_flying_car_takes_flight/,323.0,gadgets,,,,
comment,mdyn281,iwishihadnobones,,775,2025-02-21 09:29:06,,,,Is this not just a big drone in a car skin,,0.0,1iumsi7
comment,mdyow8i,le66669,,308,2025-02-21 09:47:28,,,,Looks like it With some super lightweight bicycle wheels,mdyn281,1.0,1iumsi7
comment,me2kwsq,Knut79,,29,2025-02-21 22:36:06,,,,Lol yeah Protecting our intellectual scsuh Property You have to be Nigeria mail cmvicti Level of naive to buy into this,mdyow8i,2.0,1iumsi7
comment,me00mao,PrestigiousEvent7933,,25,2025-02-21 15:18:40,,,,There was video somewhere on TikTok and it sounded like it too,mdyow8i,2.0,1iumsi7
comment,me1iaxp,azlan194,,21,2025-02-21 19:29:03,,,,Did you click the link of the post Theres video there as well No need to go to TikTok,me00mao,3.0,1iumsi7
comment,me3xq16,manga311,,1,2025-02-22 04:07:09,,,,Why would you need big wheels if you are flying,mdyow8i,2.0,1iumsi7
comment,mdzacm8,Xenobsidian,,70,2025-02-21 12:50:40,,,,Yes Technically its a multicopter since a drone would be unmanned But nonetheless nothing earthshaking here,mdyn281,1.0,1iumsi7
comment,me01mt2,JaggedMetalOs,,25,2025-02-21 15:23:35,,,,Are we actually sure someone is riding it in that video though It looks so flimsy and unstable Im not convinced it can actually carry a person,mdzacm8,2.0,1iumsi7
comment,me0vcmn,unfinishedtoast3,,50,2025-02-21 17:42:30,,,,Ya the founder dude is in there I watched an interview with him on BBC I want to say last week He wouldnt let them film the inside of the car wouldnt allow them close ups or even let them get within like 50 feet of it Then he jumped in it and flew like 15 feet above the ground while another car drove under him He said it could also be driven like a normal car but he didnt show that and I absolutely doubt it has a standard engine AND drone fans Its just a massive drone in a car shell,me01mt2,3.0,1iumsi7
comment,me2a2zp,TPlain940,,32,2025-02-21 21:43:03,,,,I watched an interview with him on BBC I want to say last week He wouldnt let them film the inside of the car wouldnt allow them close ups or even let them get within like 50 feet of it The ol Theranos strategy,me0vcmn,4.0,1iumsi7
comment,mgzyn2s,Human-Assumption-524,,1,2025-03-10 10:04:06,,,,I mean it is an actual vehicle Whether or not it meets the specifications they claim or actually makes it to production which neither will probably be the case is another thing In the case of Theranos they never even had a prototype just hype,me2a2zp,5.0,1iumsi7
comment,me21leq,psilent,,1,2025-02-21 21:02:55,,,,Yeah most likely they cant drive it yet from the other images there seems to be nothing near the wheels that might be a motor Id still take a giant single seater drone though that sounds fun,me0vcmn,4.0,1iumsi7
comment,me2lao4,Knut79,,1,2025-02-21 22:38:02,,,,Its fairly easy to fake all that Especially when the pilot of the drone inside the empty opaque shell is visible in the videos,me0vcmn,4.0,1iumsi7
comment,me2n3e4,Minimum-Web-6902,,1,2025-02-21 22:47:08,,,,Maybe its an electric car,me0vcmn,4.0,1iumsi7
comment,me80eju,antpile11,,1,2025-02-22 20:10:13,,,,Yes it says it is in the article,me2n3e4,5.0,1iumsi7
comment,me31d6p,bonafidebob,,1,2025-02-22 00:04:09,,,,Theres going to be a really long haul to get to crash protection while driving something like this on surface streets This looks like it would shatter with even a small frontsiderear impact test Maybe if they somehow register it as a motorcycle they can get around that,me0vcmn,4.0,1iumsi7
comment,me63iu8,Eleventy22,,1,2025-02-22 14:33:10,,,,Same with the spot I saw on the PBS News Hour It reeked of snake oil,me0vcmn,4.0,1iumsi7
comment,me8cs0d,selfishshishkabob,,1,2025-02-22 21:13:05,,,,This is every demo of these flying vehicles now Only a couple are even semiviable most just barely make it off the ground for 10 seconds on an ideal day flown by the one guy that can stay perfectly balanced,me0vcmn,4.0,1iumsi7
comment,me0uo0n,Xenobsidian,,8,2025-02-21 17:39:24,,,,Thats actually true Who knows It is supposed to carry one but the first Tesla models were supposed to drive for more than a few minutes but they couldnt It was all a scam and this might be too Jut to remind everyone that Elon was always full of shit,me01mt2,3.0,1iumsi7
comment,me1gci8,Meleesucks11,,8,2025-02-21 19:19:52,,,,Remember the trains that were funded and later scrapped Where the money go ELON,me0uo0n,4.0,1iumsi7
comment,me0ycoc,MarlonShakespeare2AD,,3,2025-02-21 17:56:13,,,,Well Not until it crashes,mdzacm8,2.0,1iumsi7
comment,me2l2uj,Knut79,,3,2025-02-21 22:36:56,,,,Oh this opaque thin plastic shell is very very much unmanned You can even see the pilot with the cl troller on the ground,mdzacm8,2.0,1iumsi7
comment,me4vjmm,ILikeCutePuppies,,1,2025-02-22 08:48:05,,,,The cool thing is that the car sides become wings so that it can actually have more than a few minutes of flight time Well that is the idea at least They are a long way off,mdzacm8,2.0,1iumsi7
comment,me4wdgk,Xenobsidian,,1,2025-02-22 08:56:03,,,,This will not take of pun not intended any when soon because it does not solve any problem better than stuff we already have It will be an expensive toy at best,me4vjmm,3.0,1iumsi7
comment,me6oxe3,ILikeCutePuppies,,1,2025-02-22 16:24:23,,,,You have a way of flying over the traffic congested city without switching vehicles,me4wdgk,4.0,1iumsi7
comment,me6uagz,Xenobsidian,,1,2025-02-22 16:49:39,,,,You dont want to fly you want to place the traffic in three dimensions This technology is called bridges and tunnels And for longer flights we have helicopters and airplanes The issue with this concept is its neither a good car since most of it is an empty plastic shell nor is it a good aircraft since it has to carry the extra weight of the empty plastic shell wheels and what else it needs to pretend to be a car Its like Swiss army knife yes you have many options but neither of them is nearly as good as the dedicated tools would be,me6oxe3,5.0,1iumsi7
comment,me6x02w,ILikeCutePuppies,,1,2025-02-22 17:02:02,,,,You cant walk outside to your helicopter unless you are mega rich Planes only fly to certain places at certain times and sometimes you are sitting at the airport longer than the flight takes I have literally driven to Vagas from the airport in LA and gotten to the hotel before the plane I was going to take landed Then you have to fly to dedicated ports and switch to a car thats not anything like being able to drive to a dedicated fly location and immediately take off then land and continue on your way There are significant amounts of downtime in between They will never be able to build enough bridges etc to solve traffic Bridgesroads require a huge amount of investment time and negotiations and often they are just cancelled Its never going to be a good solution I would consider this car closer to a motorbike You arent gonna be using it exactly like a car but it does take 2 passengers and has more protection than a motor bike with its protective dome Its still in very early concept phase and its probably not going to work well without using the most bleeding edge technology for motors and batteries I am not putting money on it but I could see a company succeeding in this area at some point,me6uagz,6.0,1iumsi7
comment,me6zful,Xenobsidian,,1,2025-02-22 17:13:19,,,,Let me rephrase that you dont want to fly over the traffic you want the traffic to work properly and there are plenty of ways to achieve this This thing will never be a commercial solution Just imagine you want to fly over the traffic jam and the guy three cars before you takes off at the same time Crash Or imagine you can fly for three minutes but the line is so long that you cant get a place to lend before you run out of energy Crash And we havent even started what licenses and legal requirements you need to operate the thing in the first place I am sure at one point it will be a a product you can buy but it will be a rich peoples toy with very little practical applications A dedicated multicopter that never tries to be a car or sufficiently developed autonomous cars with a coordinated system that avoids traffic jams will be soooooo much more useful for the general customer,me6x02w,7.0,1iumsi7
comment,me727tb,ILikeCutePuppies,,1,2025-02-22 17:26:20,,,,I dont think initially these cars will be used the way in the video Theyll drive to dedicated spots for taking off You might be able to get one at your home Youll also be able to land in dedicated spots I think it will be a long time until one is hopping over cars This is the same with other car planes that already are lisensed Licensing the owner of these things is not new There are phase and they work with the FAA Initally the vehicle requires a person have a pilot license I agree that initially the wealthy will have these but thats how things normally work with technology Initally only the wealth had cars I dont agree that it will never be able commerial solution We already have car planes that are purchasable see PALV There is always someone saying it wont work and then 20 years later it is common place I remember people laughing at the first delivery drones for example and now there are millions of drone deliveries a day,me6zful,8.0,1iumsi7
comment,me7hlpt,Xenobsidian,,1,2025-02-22 18:39:24,,,,I dont think initially these cars will be used the way in the video Theyll drive to dedicated spots for taking off You might be able to get one at your home Youll also be able to land in dedicated spots I think it will be a long time until one is hopping over cars This concept already exist for pure multicopter that does not waste recourses on the car part This is the same with other car planes that already are lisensed Licensing the owner of these things is not new There are phase and they work with the FAA Initally the vehicle requires a person have a pilot license Yes and all of this concepts are just expensive toys I agree that initially the wealthy will have these but thats how things normally work with technology Initally only the wealth had cars I dont agree that it will never be able commerial solution We already have car planes that are purchasable see PALV Before this will become commercially meaningful you already have commercials meaningful mylticopter services and autonomic cabs that solve the problem It will not make sense to combine them There is always someone saying it wont work and then 20 years later it is common place As you mentions there are flying car concepts since decades and they never worked But not because it is technically impossible it obviously is but because the actual problem it solves is solved easier another way and that will not change The only possibility is that tech billionaires take over and let the infrastructure of fall apart then you need a vehicle that individually overcomes the issue Under such circumstances it would start to make sense I remember people laughing at the first delivery drones for example and now there are millions of drone deliveries a day The delivery drones make sense under certain circumstances but in other areas where other forms of delivery work better drones still have a hard time,me727tb,9.0,1iumsi7
comment,me7lbm4,ILikeCutePuppies,,1,2025-02-22 18:57:06,,,,Divery drones really didnt exist 20 years ago Just because it doesnt exist now doesnt mean it wont in the future In the case of delivery drones sure they dont solve all cases but they are expanding fast into more cases There were 800 though drone deliveries in 2023 and there are going to be millions in 2025 By 2030 probably well probably be in the hundreds of millions of drone deliveries In the case of flying cars no the current technology being used did not exist and technology is a huge part of the hurdle Vtols and flying cars are much cheaper to develop today for example with better performance and safety characteristics which is needed for a technology to move towards increased adoption,me7hlpt,10.0,1iumsi7
comment,me7odcg,Xenobsidian,,1,2025-02-22 19:11:43,,,,You dont quite get the point The technology is secondary There have been flying cars since decades Just the demand for them is not there Maybe a desire sometimes but if you consider all the hurdles it comes with you suddenly think twice about it With drones it is completely different They are comparably cheep became reliable and improve a certain aspect of delivery cheeper than the alternatives could Thats why they seem to be successful The flying car however there will hardly ever be a demand that justifies the problems it has Is it possible to build Sure Does it make a lot of sense No,me7lbm4,11.0,1iumsi7
comment,me14y4m,GrynaiTaip,,1,2025-02-21 18:26:39,,,,Multicopter is a drone that uses more than one propeller for lift Regular typical ones are usually quadcopters,mdzacm8,2.0,1iumsi7
comment,me19tzo,Xenobsidian,,4,2025-02-21 18:49:13,,,,A drone is an unmanned vehicle but this is at least supposed to be manned Quadcopers are vehicles with four exactly four since quad means four propeller Mylticopter are vehicles with any nimble of propeller more than one I dont know exactly how many propeller this thing has but if memory serves it was at least two which is why I picked this term,me14y4m,3.0,1iumsi7
comment,me29z1t,cloud1445,,12,2025-02-21 21:42:32,,,,its a car in the same way that three kids stood on top of each other while wearing a trench coat are an adult,mdyn281,1.0,1iumsi7
comment,mdz7ulw,graesen,,12,2025-02-21 12:33:20,,,,Drone means unmanned Maybe quadcopter,mdyn281,1.0,1iumsi7
comment,me0irtj,BizzyM,,1,2025-02-21 16:44:35,,,,Drone should mean unmanned and autonomous These are Remote or Radio Controlled RC but RC seems to mean almost exclusively toy Quadcopter should just apply to the method of locomotion 4 rotors Quadcopter Drone vs RC quadcopter depending on method of control,mdz7ulw,2.0,1iumsi7
comment,me0ljsi,Scurro,,1,2025-02-21 16:57:25,,,,RC hobbyists tried correcting the usage of drone from the public years ago Drone is now just the go to word for anything small that flies without a human inside even if the drone requires a human 100 of the time to operate,me0irtj,3.0,1iumsi7
comment,me194cg,Elios000,,1,2025-02-21 18:45:56,,,,at this points its any thing thats mulit rotor with fixed pitch props still nothing but gadget bombs to scam people for money they do nothing you cant already do with helicopter,me0ljsi,4.0,1iumsi7
comment,me22ts3,Scurro,,1,2025-02-21 21:08:46,,,,Nowadays fixed wing RC aircraft are also being called drones,me194cg,5.0,1iumsi7
comment,me2m0r2,Knut79,,0,2025-02-21 22:41:41,,,,Thats not remotely true though Anyone whos been flying rc for decades will tell you how wrong that is,me194cg,5.0,1iumsi7
comment,me2lu0r,Knut79,,1,2025-02-21 22:40:45,,,,Except drone had mean rc craft for a couple of decades before that so w they were wrong The original use of drones where target practice rc planes And towed planes and ships behind kilometer long cables for life fire target practice and weapons tests,me0ljsi,4.0,1iumsi7
comment,me2lk0z,Knut79,,1,2025-02-21 22:39:22,,,,No drone doesnt mean autonomous Just unmanned Or rather remotely operated in some way,me0irtj,3.0,1iumsi7
comment,me2ndcz,BizzyM,,0,2025-02-21 22:48:32,,,,oh,me2lk0z,4.0,1iumsi7
comment,me4c9k6,Knut79,,0,2025-02-22 05:54:04,,,,Dictionaries are surprisingly not a good source for accurate information,me2ndcz,5.0,1iumsi7
comment,me1bonw,True-Bandicoot3880,,2,2025-02-21 18:57:51,,,,Right Annoying that this is even an article,mdyn281,1.0,1iumsi7
comment,me3mp6p,None,,2,2025-02-22 02:56:56,,,,But its got wheels Its a car,mdyn281,1.0,1iumsi7
comment,me5zk12,Go_Nadds,,2,2025-02-22 14:10:49,,,,Its actually three children in a trench coat,mdyn281,1.0,1iumsi7
comment,mdz6na8,One_Olive_8933,,7,2025-02-21 12:24:47,,,,TBF looks better than a cyber truck,mdyn281,1.0,1iumsi7
comment,me3xnru,lemonade_eyescream,,5,2025-02-22 04:06:44,,,,thats a really low bar to clear lol,mdz6na8,2.0,1iumsi7
comment,me415fz,Treats,,1,2025-02-22 04:31:02,,,,Crazy how much publicity this BS is getting,mdyn281,1.0,1iumsi7
comment,me610oh,kurotech,,1,2025-02-22 14:19:12,,,,If I dont see it drive its not a car just a drone with wheels instead of feet lol,mdyn281,1.0,1iumsi7
comment,me6npxl,gomurifle,,1,2025-02-22 16:18:08,,,,And a drone is just a miniquadcopter So this is just a light weight quadcopter,mdyn281,1.0,1iumsi7
comment,me98dzw,asheraze,,1,2025-02-23 00:02:18,,,,Ive heard many saying this about this vehicle but when we do figure out functional flying cars wont they just be big drones that can also drive on land and fit people,mdyn281,1.0,1iumsi7
comment,me9y3ct,iwishihadnobones,,1,2025-02-23 02:31:21,,,,I mean wed be better off making a driving helicopter than a flying car,me98dzw,2.0,1iumsi7
comment,mgzyehx,Human-Assumption-524,,1,2025-03-10 10:01:45,,,,What exactly would a flying car be if not essentially a drone that is rideable and also able to drive along the ground When it comes to evtols people weirdly seem to fall into a sort of no true scotsman argument,mdyn281,1.0,1iumsi7
comment,mgzyncd,iwishihadnobones,,1,2025-03-10 10:04:10,,,,Whats evtols,mgzyehx,2.0,1iumsi7
comment,mh00s6v,Human-Assumption-524,,1,2025-03-10 10:25:11,,,,Electric Take of and Landing vehicles Basically electric helicopterstiltrotors and flying cars A huge push in the modern aerospace industry is trying to replace existing fleets of aircraft with electric or low emission alternatives For short duration flights theyve found that vehicles that combine the vertical take off and landing capabilities of helicopters with the lifting body configuration of airplanes for horizontal flight allows for some of the best energy efficiency Also because electric motors use fewer moving parts and maintenance some companies having been exploring them for use as air taxis or emergency vehicles which is where the comparison to flying cars comes in Since they would be small short trip vehicles that would be used within city limits but travel through the air,mgzyncd,3.0,1iumsi7
comment,mdzmk7s,NoTourist5,,1,2025-02-21 14:04:53,,,,flying by propeller driven dc batteries,mdyn281,1.0,1iumsi7
comment,mdyt7z1,JaggedMetalOs,,214,2025-02-21 10:30:13,,,,Uh huh so its a drone that can barely hover and looks about as sturdy as wet toilet paper in a road air accident This is just investorbait,,0.0,1iumsi7
comment,mdzxry9,Patagonia202020,,44,2025-02-21 15:04:36,,,,Anyone who watches this video and invest a single dime deserves to lose everything That was so scary looking like something a school science project in seventh grade would amount to,mdyt7z1,1.0,1iumsi7
comment,me2jsm8,Corgiboom2,,5,2025-02-21 22:30:26,,,,Most prototypes are investorbait,mdyt7z1,1.0,1iumsi7
comment,me3dl3s,JaggedMetalOs,,4,2025-02-22 02:01:41,,,,Yeah but some prototypes have a much more plausible path to a real product than others,me2jsm8,2.0,1iumsi7
comment,me18byu,Elios000,,17,2025-02-21 18:42:18,,,,Sturdy as wet toilet paper in a road air accident welcome to any thing that flys this the big part why will never have flying cars or mulit rotors that will carry people,mdyt7z1,1.0,1iumsi7
comment,me3y0ue,lemonade_eyescream,,6,2025-02-22 04:09:14,,,,Yup Sturdy materials more weight Until a better propulsion system is invented that also doesnt require a fuckton of fuel I doubt these will ever be more than flimsy ultralight craft,me18byu,2.0,1iumsi7
comment,me3ec7e,JaggedMetalOs,,1,2025-02-22 02:06:13,,,,welcome to any thing that flys That CRJ900 that flipped over in Toronto recently did pretty well were taking at least toilet paper tube here,me18byu,2.0,1iumsi7
comment,me3p71b,TheGreatKonaKing,,4,2025-02-22 03:12:04,,,,Good thing most current drivers are extremely safe reliable,mdyt7z1,1.0,1iumsi7
comment,me3c5xc,noodlesalad_,,3,2025-02-22 01:53:16,,,,It looks like a school project,mdyt7z1,1.0,1iumsi7
comment,me87jaj,sigridsnow,,2,2025-02-22 20:46:12,,,,Who even wants this kinda thing any more I literally just want to have a home a garden and a vehicle to get groceries or a walkable shop and even that seems far fetched These kind of projects are so unhelpful right now in my opinion when basic shit is unattainable for so many,mdyt7z1,1.0,1iumsi7
comment,me1ilkr,azlan194,,1,2025-02-21 19:30:26,,,,Not to mention with those flimsy bicycle wheels it also fails as a regular car lol,mdyt7z1,1.0,1iumsi7
comment,mdymu1y,igby1,,105,2025-02-21 09:26:51,,,,Can we just skip ahead to teleportation,,0.0,1iumsi7
comment,mdynjm2,passwordstolen,,50,2025-02-21 09:33:59,,,,Those transportation tubes in Futurama look pretty cool,mdymu1y,1.0,1iumsi7
comment,mdzm6gl,None,,20,2025-02-21 14:02:43,,,,And the suicide booths,mdynjm2,2.0,1iumsi7
comment,me0puxi,MVPizzle_Redux,,12,2025-02-21 17:17:22,,,,Anywhere is a suicide booth if you try hard enough,mdzm6gl,3.0,1iumsi7
comment,me0tc8l,jacwub,,-3,2025-02-21 17:33:19,,,,especially a certain political rally,me0puxi,4.0,1iumsi7
comment,me0ftq2,FairlySuspicious,,3,2025-02-21 16:30:54,,,,We already got those just gotta set them up in public spaces,mdzm6gl,3.0,1iumsi7
comment,me3r7nf,Captainwumbombo,,2,2025-02-22 03:24:39,,,,25 cents is a hell of a deal I think that was a pretty innacurate prediction They would definitely upcharge it to at least 5,mdzm6gl,3.0,1iumsi7
comment,me70sx2,CoeurdAssassin,,2,2025-02-22 17:19:41,,,,Switzerlands one step ahead of ya,mdzm6gl,3.0,1iumsi7
comment,mdz7d9c,NoseMuReup,,3,2025-02-21 12:29:57,,,,Unless you dont know how to get off like a ski lift,mdynjm2,2.0,1iumsi7
comment,mdzeqtn,rkcth,,21,2025-02-21 13:18:46,,,,I read a short science fiction piece once and the premise was that teleporters worked by creating a clone of you that thinks its the original and then is supposed to destroy the original since its no longer a legal entity but that instead they use the originals as slaves so you would walk into a teleporter and you would then be whisked off to a slave colony Even just the idea of me being destroyed so a copy can live sounds awful and Im convinced thats how any teleporter would work in actuality,mdymu1y,1.0,1iumsi7
comment,me10ml8,DadJokeBadJoke,,5,2025-02-21 18:06:44,,,,Ill pass Ive seen what happens when the copier gets jammed,mdzeqtn,2.0,1iumsi7
comment,mdzzryi,igby1,,4,2025-02-21 15:14:31,,,,Sounds like the movie The Prestige,mdzeqtn,2.0,1iumsi7
comment,me0ldka,Alkyan,,5,2025-02-21 16:56:38,,,,Also pretty much how transporters in star trek work Your completely disintegrated and then a new you is built from the scanned data like how the replicator makes food,mdzzryi,3.0,1iumsi7
comment,me3xpcv,money_loo,,1,2025-02-22 04:07:01,,,,Except that one time they accidentally left the real Riker behind on some planet and it cloned him on the enterprise,me0ldka,4.0,1iumsi7
comment,me0f9xy,Jota769,,5,2025-02-21 16:28:21,,,,Nah I read Stephen Kings The Jaunt Im good,mdymu1y,1.0,1iumsi7
comment,mdz9320,AtariAtari,,5,2025-02-21 12:42:04,,,,No you have to live through the bad drivers to bad flyers stage first gifgiphyP1PemPnyp4g1i,mdymu1y,1.0,1iumsi7
comment,me2uln2,None,,2,2025-02-21 23:26:48,,,,So long as it doesnt kill us each time,mdymu1y,1.0,1iumsi7
comment,me4fra0,Upstairs_Onion5104,,1,2025-02-22 06:23:30,,,,cx4 density shift moscovium299,mdymu1y,1.0,1iumsi7
comment,me6nvkr,gomurifle,,1,2025-02-22 16:18:58,,,,You try the machine first,mdymu1y,1.0,1iumsi7
comment,mdynpdz,zandadoum,,84,2025-02-21 09:35:37,,,,Airplanes are falling outta the sky all over USA and now we wanna add millions of cars to that xD,,0.0,1iumsi7
comment,me1jm3l,ExoSierra,,7,2025-02-21 19:35:14,,,,People cant even be trusted in cars on the ground Mfers gonna be drunk flying into buildings and shit,mdynpdz,1.0,1iumsi7
comment,me22iht,ISLAndBreezESTeve10,,3,2025-02-21 21:07:18,,,,Nope Just hit the autopilot Hey siri take me home Out,me1jm3l,2.0,1iumsi7
comment,me2sozn,a_latvian_potato,,2,2025-02-21 23:16:25,,,,Sir a second car has hit the tower,me1jm3l,2.0,1iumsi7
comment,mdyopxj,dandeeago,,27,2025-02-21 09:45:44,,,,But cars have airbags planes do not so cars in the sky should be a lot safer,mdynpdz,1.0,1iumsi7
comment,mdyrj3l,MadK9TheReal1,,3,2025-02-21 10:13:36,,,,,mdyopxj,2.0,1iumsi7
comment,mdzgc6g,blackop,,8,2025-02-21 13:28:36,,,,gifgiphygKfyusl0PRPdTNmwnD,mdynpdz,1.0,1iumsi7
comment,mdytxqv,mudokin,,60,2025-02-21 10:37:11,,,,We already have flying cars They are called helicopters They have been engineered to be as safe and efficient as possible Flying cars are undesirable until we fix the noise they make and the power they use It costs much more energy to lift something up from the ground than to move it on wheels At least when itd only a couple passengers I dint want these thing flying around unless we find a way to make them as silent and save as a normal car Imagine the noise pollution from all that no thanks the normal traffic is already utterly annoying,,0.0,1iumsi7
comment,me0auf5,SedatedAndAmputated,,15,2025-02-21 16:07:25,,,,Typically a flying car is thought of as a car that flies Its pretty self explanatory Ive never seen any helicopters driving down the road Have you,mdytxqv,1.0,1iumsi7
