type,id,author,title,score,created_utc,url,num_comments,subreddit,body,parent_id,depth,post_id
post,1j3c6go,snakkerdudaniel,Best Buy CEO warns price increases are 'highly likely' after Trump tariffs,24083,2025-03-04 14:37:30,https://www.reddit.com/r/gadgets/comments/1j3c6go/best_buy_ceo_warns_price_increases_are_highly/,1247.0,gadgets,,,,
comment,mfyspqy,internetlad,,5624,2025-03-04 14:39:22,,,,and they will not go back down after the tarrifs end,,0.0,1j3c6go
comment,mfyt7py,Trollet87,,1329,2025-03-04 14:42:04,,,,But the profit will get bigger when the tarrifs end so they can give more money to the ppl who need its,mfyspqy,1.0,1j3c6go
comment,mfywsfq,kurotech,,259,2025-03-04 15:00:57,,,,This guy gets it give him an office on the c floor stat,mfyt7py,2.0,1j3c6go
comment,mfznnkj,afterworld2772,,142,2025-03-04 17:06:42,,,,Oh we would love to but my nephew just graduated and needs a job so we are setting him up on 200k a year full benefits Hey do you mind staying late and covering his work Hes not quite got the hang of it yet Dont worry though heres 5 for a pizza go wild,mfywsfq,3.0,1j3c6go
comment,mg435cc,fairlyoblivious,,5,2025-03-05 07:47:10,,,,This guy DEIs,mfznnkj,4.0,1j3c6go
comment,mfzw2kp,GreyTigerFox,,2,2025-03-04 17:45:30,,,,She is an evil soulless witch She will take another series of stock buybacks and give herself a several million dollar salary while gutting the workforce more like she did last year Best Buy is nothing more than an Amazon showroom these days anyway,mfywsfq,3.0,1j3c6go
comment,mg0npcf,ARAR1,,13,2025-03-04 19:53:22,,,,You are saying that trickle down will not work,mfyt7py,2.0,1j3c6go
comment,mg3p9ti,ATShields934,,2,2025-03-05 05:44:03,,,,Who wouldve guessed s gifgiphy6nWhy3ulBL7GSCvKw6,mg0npcf,3.0,1j3c6go
comment,mg18oso,ikilledtupac,,1,2025-03-04 21:30:21,,,,it will trickle down,mfyt7py,2.0,1j3c6go
comment,mg1hywz,rotsono,,1,2025-03-04 22:13:29,,,,The upper management really needs the money so they glad you help out by paying the higher prices s,mfyt7py,2.0,1j3c6go
comment,mg7hrh9,Miragui,,1,2025-03-05 20:20:16,,,,The good old trickle down economics,mfyt7py,2.0,1j3c6go
comment,mfzz8s9,RaunchyMuffin,,0,2025-03-04 18:00:05,,,,Thats because people keep buying from them If you dont buy then theyll have to respond to the market,mfyt7py,2.0,1j3c6go
comment,mfytmxs,ThatGuyFromTheM0vie,,220,2025-03-04 14:44:22,,,,Historically this has never happened lol Prices always stay up,mfyspqy,1.0,1j3c6go
comment,mfytylv,MagixTouch,,224,2025-03-04 14:46:08,,,,The tariffs have endedbut prices are staying here is why it is a good thing for the economy,mfytmxs,2.0,1j3c6go
comment,mfz2nyr,anthonyg1500,,103,2025-03-04 15:29:54,,,,Can we have raises You can have a pizza party,mfytylv,3.0,1j3c6go
comment,mfz3as1,ThatGuyFromTheM0vie,,50,2025-03-04 15:32:56,,,,Waffle Party,mfz2nyr,4.0,1j3c6go
comment,mfz4r1l,fairykingz,,29,2025-03-04 15:39:49,,,,Just sever all of us at this point The world is dystopian enough already,mfz3as1,5.0,1j3c6go
comment,mfznmyq,BonkerHonkers,,26,2025-03-04 17:06:38,,,,Waffle parties are coveted as fuck,mfz3as1,5.0,1j3c6go
comment,mfzqcjh,ThatGuyFromTheM0vie,,17,2025-03-04 17:19:06,,,,gifgiphy36Z4fGs0uHIOMeKxeEdownsized,mfznmyq,6.0,1j3c6go
comment,mfz4k9o,Gregus1032,,-1,2025-03-04 15:38:56,,,,I call dibs on the blue ones,mfz3as1,5.0,1j3c6go
comment,mfzgj25,Krojack76,,20,2025-03-04 16:34:19,,,,You can have a pizza party Everyone put a few dollars into this jar to pay for the pizza Upper management,mfz2nyr,4.0,1j3c6go
comment,mfzmll6,Eteel,,15,2025-03-04 17:01:49,,,,Its insane just how realistic this all sounds And its always the cheapest pizza place they get it from,mfzgj25,5.0,1j3c6go
comment,mg3n6d8,djb2589,,3,2025-03-05 05:28:11,,,,Yeah total paid in by everyone 70 Pizza recieved 3 Little Ceasar 5 hot n ready pizzas to feed 15 people No change seems to exist,mfzmll6,6.0,1j3c6go
comment,mg1hri6,Nixxuz,,2,2025-03-04 22:12:29,,,,Pizza by Alfredos,mfzmll6,6.0,1j3c6go
comment,mg5tsxt,EzeakioDarmey,,1,2025-03-05 15:39:49,,,,Last year on March 14th 314 my job celebrated Pi Day by getting Pizza and asking us to pay per slice To make things worse they only ordered once so second shift had to pick from pizza that had sat on a cart in the hallway for 7 hours,mfzmll6,6.0,1j3c6go
comment,mg09p8p,emiliabow,,3,2025-03-04 18:48:42,,,,Lets celebrate Thanksgiving with a potluck,mfzgj25,5.0,1j3c6go
comment,mg2n5nx,Bundt-lover,,1,2025-03-05 01:50:18,,,,I dont know if it makes anyone feel any better but they do actually give out decent swag at least at corporate Amazon is the one with the two slices per person limit on their corporate pizza,mfzgj25,5.0,1j3c6go
comment,mg4s181,Revenge_of_the_User,,1,2025-03-05 11:53:39,,,,I worked for a well known charity that uses volunteers for at least 50 of the workload This was in 2016 or so mind you Head office canceled their annual volunteer appreciation dinner Usually they reserve a hotel or restaurant and all the volunteers are invited Were talking an annual thank you for the literally thousands of free work hours given Nope cant afford that this year But they COULD afford a manager retreat two months earlier that saw manager level staff go to a winery for a weekend I was comanager he and I didnt go out of protest because talks about budget were constant Insult to injury was one of the managers saying hey well just do a byob to which i saidthanks for all the free labor come to a park and bring your own foodyeah Thats gonna make them feel appreciated I had a pizza party every week because no one could stop me,mfzgj25,5.0,1j3c6go
comment,mfznnzh,Darklord_Bravo,,3,2025-03-04 17:06:46,,,,Yeah but we have to buy the pizza and only Ellios,mfz2nyr,4.0,1j3c6go
comment,mg0foui,Crack4kids31,,1,2025-03-04 19:16:25,,,,You will all have to share the 1 slice,mfz2nyr,4.0,1j3c6go
comment,mg12c4a,None,,1,2025-03-04 21:00:52,,,,Our company gave us fanny packs last year,mfz2nyr,4.0,1j3c6go
comment,mg2068j,Powerfader1,,1,2025-03-04 23:46:18,,,,Gotta get a job first,mfz2nyr,4.0,1j3c6go
comment,mg21qdu,anthonyg1500,,1,2025-03-04 23:54:48,,,,Seems as though you didnt understand the premise of the comment,mg2068j,5.0,1j3c6go
comment,mg2k8tf,Powerfader1,,1,2025-03-05 01:34:23,,,,Seems you are a reddit troll,mg21qdu,6.0,1j3c6go
comment,mg3zo3g,Sleepyguylol,,1,2025-03-05 07:13:37,,,,Only one pizza though,mfz2nyr,4.0,1j3c6go
comment,mfzrl5a,disposableaccountass,,3,2025-03-04 17:24:50,,,,He said while just out of frame his PR rep kept frantically signaling to him to stop rubbing his hands together like a greedy cartoon villain,mfytylv,3.0,1j3c6go
comment,mfzsar6,PM_ME_DIRTY_COMICS,,3,2025-03-04 17:28:07,,,,This is such an accurate OpEd headline for the Times or the Journal,mfytylv,3.0,1j3c6go
comment,mg08t77,nemothorx,,2,2025-03-04 18:44:36,,,,Its good for the economy but if you dont like it then its ObamaBidens fault,mfytylv,3.0,1j3c6go
comment,mg0c87o,NEIGHBORHOOD_DAD_ORG,,1,2025-03-04 19:00:19,,,,Eating grass not just for famines anymore,mfytylv,3.0,1j3c6go
comment,mg0bd22,Personal-Invite-1497,,10,2025-03-04 18:56:21,,,,Even with no tariffs shit still find it way to climb and wont back down lol,mfytmxs,2.0,1j3c6go
comment,mg1j4bp,nicuramar,,0,2025-03-04 22:19:03,,,,Inflation is a thing,mg0bd22,3.0,1j3c6go
comment,mg1gq2o,None,,2,2025-03-04 22:07:31,,,,Prices from inflation will always stay up which seems to confuse a lot of people Tariffs can be different especially if there is competition once the tariffs are removed,mfytmxs,2.0,1j3c6go
comment,mg1szkf,noeydoesreddit,,2,2025-03-04 23:08:04,,,,Its insane to me that people still havent realized that prices almost never go down The only thing that will help is if our wages go up,mfytmxs,2.0,1j3c6go
comment,mg1i6y9,probablyaspambot,,1,2025-03-04 22:14:34,,,,Possibly but that would probably be more due to the brands making the products rather than best buy themselves Best Buy has meaningful competition if they keep prices up after tariffs end another retailer will easily undercut their prices If the brands keep prices up across all retailers than thats another story,mfytmxs,2.0,1j3c6go
comment,mg39c7p,CaptainPeppa,,1,2025-03-05 03:55:05,,,,Electronics have plummeted in price in recent decades,mfytmxs,2.0,1j3c6go
comment,mfzl9eq,None,,1,2025-03-04 16:55:47,,,,This is not really true The Australian chicken tax on light trucks back in 2016 was lifted they did actually get cheaper But then corporations were hot to raise prices anyways so it quickly disappeared But that isnt tariffrelated and is simply a result of inflationary printing I can provide other examples though some even related to trump lifting tariffs by exception on steel and it brought prices down Canada removed tariffs on PPE during covid and it drastically brought down PPE costs in Canada,mfytmxs,2.0,1j3c6go
comment,mfzmmxc,ThatGuyFromTheM0vie,,2,2025-03-04 17:02:00,,,,Im being hyperbolicIm sure there are some instances But by and large as far as I have seenthey usually almost never recede,mfzl9eq,3.0,1j3c6go
comment,mfznwqp,None,,1,2025-03-04 17:07:53,,,,Name a single time you can recall from your memory where a tariff was lifted and prices stayed the same or went up You simply conflate general inflation with your concept of tariffs What you likely meant is that tariffs dont bring down prices if the industry has to relocate to the import country to avoid the tariff This specific action does indeed cause prices to stay up because it simply now costs more to produce in the import country,mfzmmxc,4.0,1j3c6go
comment,mfzx4g0,Mlabonte21,,-1,2025-03-04 17:50:21,,,,In all fairness tv prices are like the only thing that goes down year after year,mfytmxs,2.0,1j3c6go
comment,mfzz7hw,RedditIsShittay,,-1,2025-03-04 17:59:55,,,,Like computer prices TVs video games and technology in general Products also improve all of the time without the price changing,mfytmxs,2.0,1j3c6go
comment,mfytnn4,DystopianAdvocate,,80,2025-03-04 14:44:28,,,,Wait you think the tarrifs are going to end,mfyspqy,1.0,1j3c6go
comment,mfyudwb,Protean_Protein,,53,2025-03-04 14:48:23,,,,They did the last time And its unclear what will happen in four years doomsaying prognostication aside,mfytnn4,2.0,1j3c6go
comment,mfz2md3,BrewtusMaximus1,,60,2025-03-04 15:29:41,,,,The tariffs levied on Chinese goods in 2018 are still in place,mfyudwb,3.0,1j3c6go
comment,mg1y1m7,Kessarean,,27,2025-03-04 23:34:42,,,,Chicken tax from 1964 is also still in place Tariffs on light trucks from Germany 60 years and counting Once tariffs are set they are extremely difficult to get rid of A lot of people think you can just set then remove but it really is a detrimental blow that has massive ramifications all down the supply chain Once theyre set there isnt really a quick undo button Youre a bit locked in The people are the ones who will foot the bill at the end of the day In general they just hurt everyone,mfz2md3,4.0,1j3c6go
comment,mg1yxmn,BrewtusMaximus1,,10,2025-03-04 23:39:32,,,,Its always fun explaining that tariffs just set a price floor,mg1y1m7,5.0,1j3c6go
comment,mg2wkbc,altiuscitiusfortius,,6,2025-03-05 02:42:39,,,,Thats if the tariffs are set the proper legal way Trump is declaring a national emergency due to fentanyl smuggling which allows him to executive order the tariffs The next administration can declare them unlawful and strike them down with another executive order,mg1y1m7,5.0,1j3c6go
comment,mg4j2em,ResolverOshawott,,0,2025-03-05 10:31:09,,,,Assuming America gets a next administration at all,mg2wkbc,6.0,1j3c6go
comment,mg5v3dz,altiuscitiusfortius,,1,2025-03-05 15:46:03,,,,Pretty doubtful with the way the democrat party has been responding to this absolute travesty of a first 6 weeks,mg4j2em,7.0,1j3c6go
comment,mfz73rl,Protean_Protein,,-18,2025-03-04 15:50:53,,,,Yeah but those were put in place specifically to target Chinese goods and protect American goods There are legitimate uses for tariffs,mfz2md3,4.0,1j3c6go
comment,mg0ea19,munche,,18,2025-03-04 19:09:52,,,,Yeah it was sweet when the price of washing machines went up 40 6 years ago and never went back down And now 6 years later clearly the US washing machine manufacturing industry is booming and prices have come down lol jk everything just costs more,mfz73rl,5.0,1j3c6go
comment,mg0k521,Protean_Protein,,-9,2025-03-04 19:36:54,,,,How often are you buying a washing machine No but seriously I admit I forgot how sweeping they were,mg0ea19,6.0,1j3c6go
comment,mg1u3xz,LordBiscuits,,5,2025-03-04 23:13:51,,,,How often are you buying a washing machine Well considering they seem to self destruct every 23 years now more often than I frigging want to,mg0k521,7.0,1j3c6go
comment,mg1zom4,Protean_Protein,,-2,2025-03-04 23:43:37,,,,Ive had the same one for over 10 years Dishwashers on the other hand But you also get what you pay for,mg1u3xz,8.0,1j3c6go
comment,mg21drc,LordBiscuits,,2,2025-03-04 23:52:55,,,,Weirdly not had trouble with dishwashers Of course now I have said that itll explode tomorrow,mg1zom4,9.0,1j3c6go
comment,mfzxwz1,Trendiggity,,8,2025-03-04 17:54:00,,,,What American goods Did I miss the consumer micro electronics industry that popped up domestically since then Cause everything in and attached to my PC and phone certainly dont say made in the USA on them,mfz73rl,5.0,1j3c6go
comment,mg0agnq,Protean_Protein,,1,2025-03-04 18:52:12,,,,I didnt say it was coherent,mfzxwz1,6.0,1j3c6go
comment,mfz7zs5,BrewtusMaximus1,,20,2025-03-04 15:55:02,,,,Im an engineer that worked at a large manufacturer Fortune 100 large when the Trump tariffs came out The tariffs hit hard on raw stock steel etc and finished goods that were sub components castings etc What the tariffs did was move more sourcing of those from China to India,mfz73rl,5.0,1j3c6go
comment,mfz9lks,Protean_Protein,,1,2025-03-04 16:02:25,,,,Oh man never mind I was thinking of the ones on BYD,mfz7zs5,6.0,1j3c6go
comment,mg2reds,i8noodles,,3,2025-03-05 02:13:56,,,,basically all economists agreed tariffs are a terrible choice there are better options to promote goods productions in a country subsidies are the most obvious ones which is what alot of agricultural goods get investment into an industry to make it more efficient and cheaper even if tariffs are implemented a blanket ban is highly inefficient it just raises the prices of goods with no substitute the reality is when businesses can increase prices they do tariff would increase imports but it will also more then likely increase goods locally the steel in washing machines is increasing from tariffs so it makes sense the end product also goes up tariffs need to be highly specific and target end products not blanket tariffs and raw goods because that spirals out into all end goods too,mfz73rl,5.0,1j3c6go
comment,mg2uojt,Protean_Protein,,1,2025-03-05 02:32:15,,,,I am not disagreeing with any of this Im not protariff,mg2reds,6.0,1j3c6go
comment,mfzt9b0,angrybirdseller,,0,2025-03-04 17:32:34,,,,Idiot ordinary people pay higher prices,mfz73rl,5.0,1j3c6go
comment,mfzzf3y,RedditIsShittay,,-9,2025-03-04 18:00:53,,,,Biden even added more but you wont see that on Reddit,mfz2md3,4.0,1j3c6go
comment,mg0bro0,Humid-Afternoon727,,9,2025-03-04 18:58:13,,,,I am not a big tariff guy but I can understand one against say China compared to fucking Canada,mfzzf3y,5.0,1j3c6go
comment,mg0gp4b,BrewtusMaximus1,,2,2025-03-04 19:21:05,,,,As I stated in another post I was an engineer working for a large US manufacturer when the 2018 China tariffs took effect While most of the result was sourcing to other low cost countries like India some of the result was still sourcing from China but by way of Canada Because of how ineptly the tariffs were targeted if any value add work like say painting was done after a part had left China but before it entered the US the tariff didnt apply This meant that we would work with a Canadian supplier who would source 95 of the value added work in China so the remaining 5 in Canada and call it good,mg0bro0,6.0,1j3c6go
comment,mg1v5dk,LordBiscuits,,2,2025-03-04 23:19:16,,,,Its similar to the light truck tariff you guys have Its meant to encourage manufacturers to build them locally but what actually happens is theyre imported with extra seats so they class as a minivan or something and the seats are removed before the thing is sold Pointless makework People WILL find a way around this shit,mg0gp4b,7.0,1j3c6go
comment,mg1xdi8,BrewtusMaximus1,,2,2025-03-04 23:31:03,,,,Ford paid a 365M fine last year to settle a DOJ lawsuit about exactly that practice,mg1v5dk,8.0,1j3c6go
comment,mg0cgwe,NEIGHBORHOOD_DAD_ORG,,1,2025-03-04 19:01:26,,,,Well it worked like gangbusters Dont you notice all the new factories pumping out cheap plastic garbage,mfzzf3y,5.0,1j3c6go
comment,mfz2g45,enjoyinc,,34,2025-03-04 15:28:51,,,,What tariffs ended Biden kept most of the original Trump tariffs in place and added more This isnt a slight against Biden tariffs are notoriously difficult to undo once theyre implemented and often stay around for decades This is because entire industries adapt to changes caused by tariffs including opening new plants and facilities hiring new workforces etc and theres very little reason for the government to upset the economic responses to the original tariffs So they get left in place None of that is accounting for the downstream damage affiliated industries that are not the protected ones that is caused by them though and in 2025 the fallout will be extreme because all the above means that these tariffs will likely be around for a long time,mfyudwb,3.0,1j3c6go
comment,mfzsrk8,KaitRaven,,28,2025-03-04 17:30:16,,,,Yep Tariffs have a huge impact on the economy Thats why they normally arent just enacted willy nilly by executive order,mfz2g45,4.0,1j3c6go
comment,mg0qduq,MC_chrome,,10,2025-03-04 20:05:48,,,,Thats why they normally arent just enacted willy nilly by executive order My pie in the sky hope is that Congress steps up and severely reigns in the power of the executive branchall of the shit Trump has done by executive decree since January 20 he should have never been able to do in the first place,mfzsrk8,5.0,1j3c6go
comment,mg1w2or,LordBiscuits,,3,2025-03-04 23:24:08,,,,He signed 220 EOs during his first term So far since Jan 20th this time 76 Hes gonna need some new sharpies before long,mg0qduq,6.0,1j3c6go
comment,mg43gs9,fairlyoblivious,,5,2025-03-05 07:50:17,,,,The strategy is to piss everyone off and I mean EVERYONE and then when someone actually tries to do ANYTHING about it boom martial law and no more need for pesky elections And MAGA will go along with it because if theres one thing they definitely love its winning Even if it means the Constitution is only good for toilet paper,mg1w2or,7.0,1j3c6go
comment,mg47uzg,ButtFucksRUs,,2,2025-03-05 08:34:27,,,,Maybe thats what all of those drone sightings were about testing them just to see if they can use them to enforce martial law,mg43gs9,8.0,1j3c6go
comment,mg43ckt,fairlyoblivious,,1,2025-03-05 07:49:08,,,,Hope and change is what got us here,mg0qduq,6.0,1j3c6go
comment,mfz4cac,Cluelesswolfkin,,17,2025-03-04 15:37:53,,,,Might be difficult to do I guess but Canadas PM said they will undo their tariffs if we undid ours so it isnt that hard Id imagine if hes saying that,mfz2g45,4.0,1j3c6go
comment,mfz6cmu,enjoyinc,,9,2025-03-04 15:47:22,,,,Thats more of an agreement to share the shock to the system if amicable terms are reached though and itll be easier to undo them early on than it would be years down the line,mfz4cac,5.0,1j3c6go
comment,mg1b43h,BardaArmy,,4,2025-03-04 21:41:35,,,,Depends on how long they are there for usually you have a deal on mind if you push tarrifs as a short term threatwar Trump doesnt seem to really have an idea what he wants and hes targeting everyone across a ton of areas,mfz4cac,5.0,1j3c6go
comment,mg3rynu,Higira,,1,2025-03-05 06:05:34,,,,Our pm wants to undo it earlier than later Once new supply chains are set its going to be hard to change them So hes basically offering an olive branch,mfz4cac,5.0,1j3c6go
comment,mg91b9h,BurlyJohnBrown,,1,2025-03-06 01:02:44,,,,I think it can be a little slight against Biden,mfz2g45,4.0,1j3c6go
comment,mg97841,enjoyinc,,1,2025-03-06 01:36:48,,,,Its really not All of those industries adapted to the tarrifs Trump had put in place and by that I mean invested millions if not billions of dollars into infrastructure and facilities to produce materials and goods for a domestic market The damage had already been done in terms of downstream industries and employment being decimated and the rest had already adapted Undoing the tariff policies all at once would have caused significantly more damage to those very same industries that had just a couple years prior spent enormous sums of money and resources to adapt and make the domestic market even more unreliable to put roots into This is of course not universally true when Biden removed Trumps washing machine tariffs prices dropped domestically because it was a dumb tariff and caused dryer prices which werent even affected to go up And business leaders in many industries did pressure Biden to remove the tariffs on China but the administration found that the tariffs having already been in place for so long would be too difficult to dismantle unilaterally So he dismantled them piece by piece like with aluminum and steel sanctions etc,mg91b9h,5.0,1j3c6go
comment,mg1k8l8,ToMorrowsEnd,,2,2025-03-04 22:24:32,,,,Im hoping for an extinction level asteroid in under 2 The whole world needs a fucking reset,mfyudwb,3.0,1j3c6go
comment,mfz69pj,Evening-Fail5076,,2,2025-03-04 15:46:59,,,,That was what I was thinking Tariffs and the threats of tariffs wont end until a government change and we as a country aint ready for that discussion some are happy to go down a path of no return,mfytnn4,2.0,1j3c6go
comment,mfztjfx,angrybirdseller,,1,2025-03-04 17:33:52,,,,Supreme Court can strike tariffs down,mfz69pj,3.0,1j3c6go
comment,mfzu25o,Evening-Fail5076,,3,2025-03-04 17:36:18,,,,This trump aligned Supreme Court,mfztjfx,4.0,1j3c6go
comment,mg2t1bm,kelkulus,,1,2025-03-05 02:23:05,,,,Probably tomorrow,mfytnn4,2.0,1j3c6go
comment,mg1j5fk,Candle1ight,,1,2025-03-04 22:19:13,,,,Frankly Im not convinced this isnt his plan Add tariffs let everyone raise their prices remove tariffs His rich friends make a bunch of money and he looks like a good guy for removing the tariffs Sure he put them there in the first place but his voters have goldfish brains,mfytnn4,2.0,1j3c6go
comment,mfz39gh,jibbyjackjoe,,31,2025-03-04 15:32:45,,,,Yep Prices never go the other direction So everything just got 25percent more expensive in a month Gotta be a record right Are we great yet,mfyspqy,1.0,1j3c6go
comment,mfzzn2j,titomb345,,4,2025-03-04 18:01:55,,,,You mean they just got 50 more expensive Companies arent just going to add 25 they have to maintain their margins,mfz39gh,2.0,1j3c6go
comment,mg0csoe,NEIGHBORHOOD_DAD_ORG,,2,2025-03-04 19:02:58,,,,Honestly there is an administrative cost to now having to reevaluate pricing get setup so youre paying the tariffs etc Not a lot but its not nothing either When my company updated its prices last year jesus christ I sat through probably 20 hours of meetings on it And I was barely involved,mfzzn2j,3.0,1j3c6go
comment,mg20yxt,Mr_Belch,,2,2025-03-04 23:50:40,,,,Yep During Covid we were constantly having to tediously update our pricing formulas over and over again Hours upon countless hours of meaningless economically inefficient man hours So glad we are great again and get to do this shit all over again,mg0csoe,4.0,1j3c6go
comment,mg0ej2x,Iohet,,-5,2025-03-04 19:11:03,,,,High quality TVs are significantly cheaper now or before today than at any point in the last 20 years,mfz39gh,2.0,1j3c6go
comment,mg24nan,tigeratemybaby,,3,2025-03-05 00:10:33,,,,Thats a really dumb statement to make You can easily spend 10k on a high end TV The most expensive TV currently at best buy is 150k,mg0ej2x,3.0,1j3c6go
comment,mg2aa3l,Iohet,,1,2025-03-05 00:40:39,,,,You can get a good 65 TV for a few hundred bucks and a baseline 55 for about 200 which was not the case 10 years ago Plenty of consumertech partsappliances are comparatively cheaper now than they have been,mg24nan,4.0,1j3c6go
comment,mg32fvj,tigeratemybaby,,1,2025-03-05 03:15:01,,,,Average TV price is about the same as a decade ago according to statistica High end TVs have increased in price because they are getting larger and better,mg2aa3l,5.0,1j3c6go
comment,mg32tbb,Iohet,,1,2025-03-05 03:17:10,,,,The average spec is higher too The technology has allowed what was formerly expensive screen sizes and technologies like HDR to become cheap and commoditized,mg32fvj,6.0,1j3c6go
comment,mfzeadx,AramFingalInterface,,-8,2025-03-04 16:24:01,,,,The right people are great,mfz39gh,2.0,1j3c6go
comment,mfz0k3b,xRockTripodx,,22,2025-03-04 15:19:47,,,,Youre not wrong but lets not lose sight of who is doing this to us and it isnt Best Buy,mfyspqy,1.0,1j3c6go
comment,mg1a4n8,mr_ji,,0,2025-03-04 21:37:02,,,,Its also Best Buy and every business that takes advantage,mfz0k3b,2.0,1j3c6go
comment,mg1jdf6,nicuramar,,3,2025-03-04 22:20:18,,,,They have to raise their prices if tariffs makes it more expensive for them to buy goods,mg1a4n8,3.0,1j3c6go
comment,mg1qtf0,xRockTripodx,,0,2025-03-04 22:56:56,,,,And whos the orange idiot giving them yet another wonderful excuse to jack prices up,mg1a4n8,3.0,1j3c6go
comment,mfz0ulm,superx89,,3,2025-03-04 15:21:10,,,,nope because they all greedy,mfyspqy,1.0,1j3c6go
comment,mg2i2vu,ohiocodernumerouno,,2,2025-03-05 01:22:39,,,,And the wages will not go up either,mfyspqy,1.0,1j3c6go
comment,mg41y39,None,,2,2025-03-05 07:35:33,,,,Jump starting recession Love it,mfyspqy,1.0,1j3c6go
comment,mg4df70,Black_Magic_M-66,,2,2025-03-05 09:33:04,,,,Its ok Republicans have assured us were all ok with higher prices and I for one am glad of the guidance s,mfyspqy,1.0,1j3c6go
