type,id,author,title,score,created_utc,url,num_comments,subreddit,body,parent_id,depth,post_id
comment,mfzf48d,soulwolf1,,1,2025-03-04 16:27:52,,,,Isnt best buy already financially in trouble Raising prices for items you can already get cheaper now is not exactly a smart solid plan,,0.0,1j3c6go
comment,mfzf5wq,suprememau,,1,2025-03-04 16:28:05,,,,Highly Likely Top kek,,0.0,1j3c6go
comment,mfzffbm,Sm3llMyFing3r,,1,2025-03-04 16:29:16,,,,Making America Great Again Das ist faschismus,,0.0,1j3c6go
comment,mfzfh8r,Front_Oven5016,,1,2025-03-04 16:29:31,,,,This is why I bought my new laptop and new phone in January,,0.0,1j3c6go
comment,mfzfhe2,None,,1,2025-03-04 16:29:32,,,,You know what else will be highly likely Less spending,,0.0,1j3c6go
comment,mfzh4lq,FrozenHatsets,,1,2025-03-04 16:37:05,,,,Maybe I should pick up that new monitor Ive been meaning to buy sooner rather than later,,0.0,1j3c6go
comment,mfzh9ux,Davoswannab,,1,2025-03-04 16:37:46,,,,I went crazy at Christmas time New phone tv and AirPods I inspired my girlfriend and her mom to get new phones too Probably just got suckered but I got new toys,,0.0,1j3c6go
comment,mfzhgw0,beachbummeddd,,1,2025-03-04 16:38:39,,,,They will go out of business Almost happened once already,,0.0,1j3c6go
comment,mfzhxc0,ladesidude,,1,2025-03-04 16:40:43,,,,The end of Pest Buy More layoffs folks Buckle up buttercup,,0.0,1j3c6go
comment,mfzjhve,Majukun,,1,2025-03-04 16:47:48,,,,No shit,,0.0,1j3c6go
comment,mfzjjmp,Simple-Reception4262,,1,2025-03-04 16:48:01,,,,This is why we bought our new phones back in November,,0.0,1j3c6go
comment,mfzjqrt,tcacct,,1,2025-03-04 16:48:56,,,,winning,,0.0,1j3c6go
comment,mfzjynv,erebus7813,,1,2025-03-04 16:49:55,,,,Best buy has been obsolete for a decade,,0.0,1j3c6go
comment,mfzkihp,supmaster3,,1,2025-03-04 16:52:24,,,,What an orange piece of shit I guess the ps6 will be over 1k,,0.0,1j3c6go
comment,mfzkx57,Richard_Longxoxo,,1,2025-03-04 16:54:15,,,,Pirate every game from AAA companies,,0.0,1j3c6go
comment,mfzlb7p,kungfungus,,1,2025-03-04 16:56:01,,,,gifgiphyaVtdz7iNVPI1W,,0.0,1j3c6go
comment,mfzldx3,benstonianjones,,1,2025-03-04 16:56:21,,,,Yeah no shit everything from Best Buy comes from China,,0.0,1j3c6go
comment,mfzlrhl,atx620,,1,2025-03-04 16:58:03,,,,Cool I just wont buy stuff Problem solved,,0.0,1j3c6go
comment,mfzlrwo,Gas-Town,,1,2025-03-04 16:58:06,,,,Dont worry Ill be there to buy your floor models when the full collapse comes,,0.0,1j3c6go
comment,mfzlu1s,None,,1,2025-03-04 16:58:23,,,,Im out on electronics and common media Ive been reading more hiking more getting my mountain bike fixed been learning how to wood carve We shop for food from local farms and buy more durable and sustained clothes so I hopefully wont need to replace them as often Im participating in this fucked up economy as little as possible for the rest of my life I dont care what party is in charge Im out man This is too fucked up,,0.0,1j3c6go
comment,mfzmb0t,None,,1,2025-03-04 17:00:29,,,,This is because of the American obsession with bringing jobs back Its not gonna happen The economy changes Were not all farmers anymore either,,0.0,1j3c6go
comment,mfznasy,Impossible_Smoke1783,,1,2025-03-04 17:05:03,,,,Best Buy still exists,,0.0,1j3c6go
comment,mfznnr2,Siguard_,,1,2025-03-04 17:06:44,,,,I bought a tv in November that was listed at 3600 on sale for 2700 Its now listed at 4400 as of yesterday Its already up,,0.0,1j3c6go
comment,mfznpgf,Rsolis39,,1,2025-03-04 17:06:57,,,,Do people still shop at Best Buy,,0.0,1j3c6go
comment,mfzoamu,Starwarsnerd08,,1,2025-03-04 17:09:42,,,,Does anyone even go to best buy anymore genuinely curious ever since they decide to go off of physical media i havent been to a best buy in a couple years no offense to anyone who still shops there just curious,,0.0,1j3c6go
comment,mfzotlg,Ok_Internal9295,,1,2025-03-04 17:12:07,,,,Best Buy was usually more expensive than everywhere else anyway so I guess Ill continue not to shop here lol,,0.0,1j3c6go
comment,mfzqjzh,kiriyaaoi,,2,2025-03-04 17:20:04,,,,Yeah except literally everyone is going to raise prices you wont be able to escape by boycotting best buy,mfzotlg,1.0,1j3c6go
comment,mfzovub,weissmanhyperion,,1,2025-03-04 17:12:24,,,,Hopefully everyone in the USA knows that the tariffs are paid from the US company to the US government The companies will pass the cost down to the consumers China Taiwan Canada and Mexico dont pay a single dollar of these tariffs If Canada wanted to cripple our economy they would have retaliated with a 100 export tax to the US By the time we are done building that wall well be the ones trying to get out,,0.0,1j3c6go
comment,mfzp44l,WinstonEagleson,,1,2025-03-04 17:13:26,,,,Just another excuse to raise prices taking advantage of the situation just like the pandemic,,0.0,1j3c6go
comment,mfzpel4,ispeektroof,,1,2025-03-04 17:14:46,,,,rnoshitsherlock,,0.0,1j3c6go
comment,mfzpgho,Itsnotrealitsevil,,1,2025-03-04 17:15:01,,,,Great Ive been wanting the dji pocket for ages but its been out of stock,,0.0,1j3c6go
comment,mfzqjwt,cojiro_blue,,1,2025-03-04 17:20:03,,,,Bye bye best buy,,0.0,1j3c6go
comment,mfzqva1,human_in_the_mist,,1,2025-03-04 17:21:31,,,,I suspect interest rates will be going up fairly soon,,0.0,1j3c6go
comment,mfzrs2s,Low_Control_623,,1,2025-03-04 17:25:44,,,,I had no idea Best Buy still existed,,0.0,1j3c6go
comment,mfzs2ng,reedshipper,,1,2025-03-04 17:27:05,,,,Well good thing I got my gadgets back in December Hopefully I dont need anymore anytime soon,,0.0,1j3c6go
comment,mfzsk7r,Lux-xxv,,1,2025-03-04 17:29:20,,,,Used goods are going to become highly coveted,,0.0,1j3c6go
comment,mfzsusi,baker8491,,1,2025-03-04 17:30:41,,,,thank you mr ceo for stating the obvious,,0.0,1j3c6go
comment,mfzswtz,TotalProfessional158,,1,2025-03-04 17:30:56,,,,Dont get my wrong The tarrifs are extremely bad news for everyone But Best Buy was already declining regardless,,0.0,1j3c6go
comment,mfzt1e6,blueblurspeedspin,,1,2025-03-04 17:31:32,,,,Glad Im getting my new video card and then I can ignore the inflation that wont get addressed for 4 years,,0.0,1j3c6go
comment,mfztc0r,xMusclexMikex,,1,2025-03-04 17:32:54,,,,Any excuse to raise prices,,0.0,1j3c6go
comment,mfztwub,Jaexa-3,,1,2025-03-04 17:35:36,,,,High likely just say it is fucking cowards,,0.0,1j3c6go
comment,mfzuaqw,ProfessionalWaltz784,,1,2025-03-04 17:37:23,,,,News Flash bears discovered shitting in the woods,,0.0,1j3c6go
comment,mfzusc5,akgiant,,1,2025-03-04 17:39:38,,,,Im shocked Shocked I tell you,,0.0,1j3c6go
comment,mfzv4o2,pirateninja303,,1,2025-03-04 17:41:12,,,,How did Best Buy survive but Circuit City which is basically the same thing but red went out of business,,0.0,1j3c6go
comment,mfzveb8,Draguss,,1,2025-03-04 17:42:25,,,,Blue is prettier,mfzv4o2,1.0,1j3c6go
comment,mfzv5aj,Playingwithmyrod,,1,2025-03-04 17:41:16,,,,I bought a new phone in December for this exact reason,,0.0,1j3c6go
comment,mfzvyg8,CrenshawMafia99,,1,2025-03-04 17:44:58,,,,Its a good thing I dont shop there anyways,,0.0,1j3c6go
comment,mfzw1rb,Primary_Alarm_3066,,1,2025-03-04 17:45:23,,,,Best Buy will go bankrupt soon mmw,,0.0,1j3c6go
comment,mfzwm5m,greggo39,,2,2025-03-04 17:48:01,,,,That was going to happen either way I went best boy for the first time I a decade after Christmas to buy some cables that were forgotten about in the holiday shopping Took 20 minutes to check out and they kept pushing me to sign up for something Wont go back,mfzw1rb,1.0,1j3c6go
comment,mfzw6hc,Chimp3h,,1,2025-03-04 17:46:01,,,,Might as well replace highly likely with already baked in,,0.0,1j3c6go
comment,mfzwa0k,thecannawhisperer,,1,2025-03-04 17:46:28,,,,Exactly why I bought my gaming laptop from them within a day of Mango Mussolini being sworn in,,0.0,1j3c6go
comment,mfzxdsd,Pleasant_Book_9624,,1,2025-03-04 17:51:33,,,,Definitely regretting not selling my bestbuy stock 2 weeks ago Hoping the threat of tariffs encouraged people to buy out all the stock of pc parts I personally bought a computer a headset and a mouse because I didnt want to pay 20 more because of trump Maybe the next earnings report will be okay,,0.0,1j3c6go
comment,mfzxnyw,3MATX,,1,2025-03-04 17:52:51,,,,Bought my already ridiculously expensive game computer Black Friday for this exact reason If it even went up 25 itd be unaffordable to me,,0.0,1j3c6go
comment,mfzxo3c,vaporking23,,1,2025-03-04 17:52:52,,,,Man I really wish these CEOs and corporations stood up and rallied against trump when he was running for office Theyd bite their nose to spite their face When prices are so expensive that people cant afford anything what then We wont weather four years of this,,0.0,1j3c6go
comment,mfzyspf,Lots42,,1,2025-03-04 17:58:03,,,,Best Buy still exists,,0.0,1j3c6go
comment,mfzz6ax,crashbandyh,,1,2025-03-04 17:59:46,,,,A lot of the products in best buy have been sitting there for months How would the tariffs impact any of their inventory lol,,0.0,1j3c6go
comment,mfzz93c,None,,1,2025-03-04 18:00:07,,,,People still shop at that hell hole,,0.0,1j3c6go
comment,mg01i64,JaneksLittleBlackBox,,1,2025-03-04 18:10:33,,,,rNoShitSherlock But of course a retail CEO is gonna use the tariffs as a convenient excuse to jack up prices thatll never lower,,0.0,1j3c6go
comment,mg01p2i,Adventurous-Depth984,,1,2025-03-04 18:11:26,,,,Dear CEO if you pass the tariffs along to us consumers Ill never shop with you ever again even after the tariff nonsense ends,,0.0,1j3c6go
comment,mg01rip,Home_Assistantt,,1,2025-03-04 18:11:45,,,,But the Chinese government will pay for these right So dont worry,,0.0,1j3c6go
comment,mg024k3,None,,1,2025-03-04 18:13:23,,,,The trump regime was designed to crash the US economy so that rich donors and lobbyists can privatize and buy sectors of our economy at rock bottom prices Copy and paste my comment on every thread Never stop saying this,,0.0,1j3c6go
comment,mg02bcp,computersplus,,1,2025-03-04 18:14:15,,,,great timing i was wanting to replace my decade old 1070 build but ig not anytime soon lol,,0.0,1j3c6go
comment,mg02c9w,ScenicPineapple,,1,2025-03-04 18:14:21,,,,Duh he refused to tell you this part but you know all our electronics arent made in the US I would bet anyone to find a electronic in their home that is 100 made in the US they simply do not exist for most working americans So of course these tariffs are causing prices to go up I told everyone to buy what they could last year i bought my new TVs and 4k players before the hike,,0.0,1j3c6go
comment,mg02txh,dazzzzzzle,,1,2025-03-04 18:16:36,,,,I hope supermarkets add the tariffs and take advantage of the situation to raise prices even more maybe even put an Elon or Bannon there are plenty of magats to choose from because they all seem to love this gesture roman prices up salute sticker on their price tags,,0.0,1j3c6go
comment,mg0473m,The_Arch_Heretic,,1,2025-03-04 18:22:54,,,,Who actually buys anything from Best Buy,,0.0,1j3c6go
comment,mg05z57,Apprehensive_Winter,,1,2025-03-04 18:31:54,,,,Glad I made all my gaming system upgrades in January We all saw this coming a mile away,,0.0,1j3c6go
comment,mg06pjy,Virtual_Machine7266,,1,2025-03-04 18:34:50,,,,How is best buy still around,,0.0,1j3c6go
comment,mg06r6v,None,,1,2025-03-04 18:35:02,,,,People still shop at BestBuy,,0.0,1j3c6go
comment,mg08e9z,helluvastorm,,1,2025-03-04 18:42:41,,,,And I wont be buying a thing My wallet is closed till the idiot is gone,,0.0,1j3c6go
comment,mg08hla,QiarroFaber,,1,2025-03-04 18:43:06,,,,Cant wait for angry customers to come in and complain about prices like its the cashiers fault I,,0.0,1j3c6go
comment,mg08pma,LunarMoon2001,,1,2025-03-04 18:44:08,,,,Man I wonder who the incel tech boys that went hard right this election will blame,,0.0,1j3c6go
comment,mg0eegy,_Jack_Back_,,2,2025-03-04 19:10:26,,,,gifgiphy26FLfI8Ts3AsDpp84,mg08pma,1.0,1j3c6go
comment,mg0984j,Visible_Goose_4116,,1,2025-03-04 18:46:31,,,,you deserve this,,0.0,1j3c6go
comment,mg0996m,powerslave-1,,1,2025-03-04 18:46:39,,,,Oh come on now Best buy has got to be lying Every conservative says this is not how tariffs work I hope these idiot Trump supporters are happy now,,0.0,1j3c6go
comment,mg099d5,Screamline,,1,2025-03-04 18:46:40,,,,No shit You dont say People have been explaining this outcome for months Hell our CEO canadian company sent an email about these sense less tarrifs,,0.0,1j3c6go
comment,mg09ihn,cb4u2015,,1,2025-03-04 18:47:50,,,,Best Buy warns Heading to the realm of Circuit City FTFY,,0.0,1j3c6go
comment,mg09ua2,oksowhatsthedeal,,1,2025-03-04 18:49:20,,,,More record profits incoming,,0.0,1j3c6go
comment,mg09xpz,ShakesbeerMe,,1,2025-03-04 18:49:46,,,,Cool I wont be spending a single unneeded dime in Trumps economy until hes gone,,0.0,1j3c6go
comment,mg0ab0e,noeagle77,,1,2025-03-04 18:51:29,,,,I used to work at Best Buy from 20102014 and the store was always PACKED with people buying stuff and looking at all the new stuff we had We had 5 or 6 registers at all times and there was always a ton of people working every department because of how many people we needed for covering all the customers I went back for the first time a few weeks ago to get some AirPods for my brother in laws birthday and it was absolutely terrifying how empty the place was in the middle of the day on a Saturday with pretty decent weather which was our busiest day Not a single other person in the place just the security guy at the front that directed us to the customer service desk to get what we want since they dont have other associates in store It was sad and depressing to see the state the store is in The prices cannot compete with online stores at all so them increasing prices will make it even more barren than it already is post pandemic,,0.0,1j3c6go
comment,mg0amml,CoffeeDetail,,1,2025-03-04 18:52:58,,,,Maybe Maybe not,,0.0,1j3c6go
comment,mg0bhzf,Working_Original_200,,1,2025-03-04 18:56:58,,,,Goodbye Best Buy,,0.0,1j3c6go
comment,mg0budm,donny42o,,1,2025-03-04 18:58:33,,,,I wont be buying then,,0.0,1j3c6go
comment,mg0c3jn,BlitzBadg3r,,1,2025-03-04 18:59:44,,,,Hey everyone Whats the Best Buy CEOs home address so that I can mail them a Thank you letter for letting me know about this,,0.0,1j3c6go
comment,mg0dk4e,ruisen2,,1,2025-03-04 19:06:31,,,,My R5 3600 Im tired boss Not yet R5 I still need you for 4 more years,,0.0,1j3c6go
comment,mg0dm6z,None,,1,2025-03-04 19:06:48,,,,Highly likely is not the correct word Its impossible not to increase the prices,,0.0,1j3c6go
comment,mg0dy63,Frequent_Read_7636,,1,2025-03-04 19:08:20,,,,Jokes on Best Buy I havent bought anything from them in years,,0.0,1j3c6go
comment,mg0e7ri,Brilliant-Hamster345,,1,2025-03-04 19:09:34,,,,i should probably buy some comp stuff before its still late sitting on late 2020 hardware and peripherals,,0.0,1j3c6go
comment,mg0f1dk,VegasGamer75,,1,2025-03-04 19:13:23,,,,Get your RTX 5090 with a 38 performance increase for just 2500 now,,0.0,1j3c6go
comment,mg0fitp,DaDibbel,,1,2025-03-04 19:15:38,,,,And unlikely to go down if and when tariffs are removed,,0.0,1j3c6go
comment,mg0h6ex,C64128,,1,2025-03-04 19:23:18,,,,Does that mean that they wont charge increased prices for items that are already in stock at their stores You know the items they didnt pay more for,,0.0,1j3c6go
comment,mg0hbnj,None,,1,2025-03-04 19:23:57,,,,I was told other countries are paying the tariffs,,0.0,1j3c6go
comment,mg0ihhj,Stepahknee1985,,1,2025-03-04 19:29:15,,,,And consumers will not buy Most electronics are luxury items,,0.0,1j3c6go
comment,mg0iu2i,None,,1,2025-03-04 19:30:51,,,,Best Buy is still kicking,,0.0,1j3c6go
comment,mg0iw6f,DeltaFlyer0525,,1,2025-03-04 19:31:07,,,,I am more surprised people are still shopping at Best Buy Last time I went there was for a HDMI cable in 2014,,0.0,1j3c6go
comment,mg0iy0d,Matinloc,,1,2025-03-04 19:31:22,,,,does anyone wonder why,,0.0,1j3c6go
comment,mg0jqpz,OliverClothesov87,,1,2025-03-04 19:35:02,,,,Thank a trump voter,,0.0,1j3c6go
comment,mg0jy8g,OSHA_Decertified,,1,2025-03-04 19:36:01,,,,I made it a point to build my new system before he took office expressly because I knew this shot was coming,,0.0,1j3c6go
comment,mg0jzl2,buck_turgedson,,1,2025-03-04 19:36:11,,,,people still shop at Best Buy,,0.0,1j3c6go
comment,mg0k3nd,Obnoxious-TRex,,1,2025-03-04 19:36:43,,,,Whether the tariffs increase prices or not they will increase their prices and blame the tariffs Watch they will post record profits after the tariff induced price hikes Which couldnt actually happen if the tariffs actually increased costs,,0.0,1j3c6go
comment,mg0kanh,SynnyZ,,1,2025-03-04 19:37:37,,,,my shopping at best buy is highly unlikely anyways,,0.0,1j3c6go
comment,mg0luje,sm753,,1,2025-03-04 19:44:49,,,,Wait are you telling me that companies pass these costs onto the customer,,0.0,1j3c6go
comment,mg0lwem,darsvedder,,1,2025-03-04 19:45:04,,,,Just like we all knew they would,,0.0,1j3c6go
comment,mg0m9ki,Far_Requirement_5802,,1,2025-03-04 19:46:46,,,,Good thing I already bought my new washer and dryer,,0.0,1j3c6go
comment,mg0rqnc,PragmaticBadGuy,,1,2025-03-04 20:12:06,,,,I bought all the stuff I needed after getting out of a bad place with a couple totes and my clothes Im good for pretty much everything for the next several years,,0.0,1j3c6go
comment,mg0sxfn,Single_Pilot_6170,,1,2025-03-04 20:17:37,,,,Less customers are highly likely after prices are jacked up Like the massive closures of Bed Bath and Beyond no doubt we will start seeing more to come,,0.0,1j3c6go
comment,mg0tlq7,AnEvilMrDel,,1,2025-03-04 20:20:44,,,,Find new suppliers,,0.0,1j3c6go
comment,mg0uavs,None,,1,2025-03-04 20:23:56,,,,I got a warning to Best Buy I dont plan on spending any money at your store or any others,,0.0,1j3c6go
comment,mg0uvps,AlienInUnderpants,,1,2025-03-04 20:26:36,,,,Time to learn the difference between need and want Not buying things affects companys bottom lines thus the leaderships stock performance,,0.0,1j3c6go
comment,mg0vb21,seancm32,,1,2025-03-04 20:28:33,,,,Cool i dont shop at best buy anyway,,0.0,1j3c6go
comment,mg0vc58,None,,1,2025-03-04 20:28:42,,,,Have yall been to a bestbuy in the last decade Theyve been charging posttariff prices this whole time,,0.0,1j3c6go
comment,mg0vk27,Mammoth-Garden-804,,1,2025-03-04 20:29:43,,,,Sweet just another reason to not shop at Bestbuy,,0.0,1j3c6go
comment,mg0vpfy,M1ck3yB1u,,1,2025-03-04 20:30:24,,,,Highly likely lmao,,0.0,1j3c6go
comment,mg0zeps,T0URlST,,1,2025-03-04 20:47:17,,,,hahaha Thanks for the heads up so a wired logitech mouse is going from 40 to 60 Get out of here,,0.0,1j3c6go
comment,mg10cu4,Mental_Garden,,1,2025-03-04 20:51:40,,,,who tf is still shoping at best buy,,0.0,1j3c6go
comment,mg14hfi,infowosecfurry,,1,2025-03-04 21:10:50,,,,So I can continue not going there Oh drat,,0.0,1j3c6go
comment,mg16eq3,thatdudedylan,,1,2025-03-04 21:19:45,,,,Meh any excuse will do to raise prices They wont come back down,,0.0,1j3c6go
comment,mg17a0c,JokinHghar,,1,2025-03-04 21:23:49,,,,Best Buy about to go the same route as Circuit City,,0.0,1j3c6go
comment,mg17ft2,Vaxus335,,1,2025-03-04 21:24:34,,,,I bought all of the electronics that I was planning to upgrade over the next couple of years because I have no idea whats about to happen at the market but I assume it will be terrible and quite likely terrible for years to come,,0.0,1j3c6go
comment,mg1b40o,nicasserole97,,1,2025-03-04 21:41:34,,,,Ahhh Late stage capitalism,,0.0,1j3c6go
comment,mg1c3j9,AweBeyCon,,1,2025-03-04 21:46:06,,,,I guess Ill have to continue not shopping at best buy,,0.0,1j3c6go
comment,mg1dl2v,BioTankBoy,,1,2025-03-04 21:52:52,,,,I hate her so much,,0.0,1j3c6go
comment,mg1egol,ArtistNRG,,1,2025-03-04 21:56:53,,,,Time to stop buying stuff,,0.0,1j3c6go
comment,mg1el8y,spellbreakerstudios,,1,2025-03-04 21:57:28,,,,Ya maybe prices in China will be higher since they have to pay the tariffs right,,0.0,1j3c6go
comment,mg1esw1,None,,1,2025-03-04 21:58:27,,,,Its why I bought my new tv right after trump won I knew hed start a trade war Black Friday was sweet,,0.0,1j3c6go
comment,mg1f70f,georgellino,,1,2025-03-04 22:00:16,,,,Best buy voted for the orange diarrhea They want the price hike Fuck best buy Ill look for another option,,0.0,1j3c6go
comment,mg1fakf,Freaiser,,1,2025-03-04 22:00:43,,,,Says an american compagny that chikened out and bough off a Canadian one future shop to get a monopoly Canadian should just boycut them use Canada computer and other outlets f em,,0.0,1j3c6go
comment,mg1ggh6,narwhal_breeder,,1,2025-03-04 22:06:14,,,,Yeah because best buy cant absorb their 900 markups on USBC cords,,0.0,1j3c6go
comment,mg1h1l9,oisfororgasm,,1,2025-03-04 22:09:02,,,,Sheesh they make it like Ill have a problem never buying anything from Best Buy again Like I was to begin with Frugality and consuming as little as possible are virtues,,0.0,1j3c6go
comment,mg1hi92,Much_Adhesiveness871,,1,2025-03-04 22:11:16,,,,Best Buy must really want to shut down operations with statements like this lol Theyre lucky to still be alive,,0.0,1j3c6go
comment,mg1i1vs,Heelgod,,1,2025-03-04 22:13:53,,,,Best Buy is irrelevant,,0.0,1j3c6go
comment,mg1iwkl,rudyattitudedee,,1,2025-03-04 22:18:01,,,,Every appliance brand foreign or domestic has also promised this by April at least a 6 increase,,0.0,1j3c6go
comment,mg1kc6q,LinoleumFulcrum,,1,2025-03-04 22:25:01,,,,Shit service from a shit company that lies obfuscates and runs cover for their even shittier third party vendors such as the amazingly shitty Zonic,,0.0,1j3c6go
comment,mg1lck4,Heinous_Aeinous,,1,2025-03-04 22:29:58,,,,gifgiphyQmJr6ewZqfQvC,,0.0,1j3c6go
comment,mg1lo0g,boomgoesthevegemite,,1,2025-03-04 22:31:32,,,,Shut up Best Buy Your name hasnt meant that in years,,0.0,1j3c6go
comment,mg1m2s1,syzygialchaos,,1,2025-03-04 22:33:32,,,,If you need something buy it now Ordered a Steam deck today and a freezer last weekend everything else should last the next 4 years Best Buy has great financing options on their credit card so if your fridge or washer or whatever appliance is questionable buy it now,,0.0,1j3c6go
comment,mg1mud7,GWsublime,,1,2025-03-04 22:37:15,,,,No shit,,0.0,1j3c6go
comment,mg1nql8,VinylmationDude,,1,2025-03-04 22:41:40,,,,Anybody know what I should buy before the prices get jacked,,0.0,1j3c6go
comment,mg1ozd0,GriswoldXmas,,1,2025-03-04 22:47:48,,,,Best Buys 65 customers will be so mad,,0.0,1j3c6go
comment,mg1p5qb,vp3d,,1,2025-03-04 22:48:40,,,,TIL Best Buy is still in business,,0.0,1j3c6go
comment,mg1q50o,Dakessian,,1,2025-03-04 22:53:32,,,,I dont even buy anything from this place,,0.0,1j3c6go
comment,mg1qbzl,WaftyTaynt,,1,2025-03-04 22:54:29,,,,Their stock dropped 13 today,,0.0,1j3c6go
comment,mg1qhl6,Bedroominc,,1,2025-03-04 22:55:16,,,,Thank fuck I got my graphics card second hand recently Not like I needed a 2060 I play Terraria,,0.0,1j3c6go
comment,mg1qxp6,D2G23,,1,2025-03-04 22:57:31,,,,Who the fuck still shops at Best Buy after 2001,,0.0,1j3c6go
comment,mg1rzkd,ekins1992,,1,2025-03-04 23:02:52,,,,No way they are still in business lol Havent seen one in years,,0.0,1j3c6go
comment,mg215d5,MourningMymn,,1,2025-03-04 23:51:39,,,,so should I buy a car now or wait until millions have their cars repoed and can get one presumably cheaper,,0.0,1j3c6go
comment,mg22d6r,KillerQueen145,,1,2025-03-04 23:58:15,,,,Whatever happened to egg prices lol,,0.0,1j3c6go
comment,mg23wpg,Bstngt,,1,2025-03-05 00:06:34,,,,What you truly dont know is their prices are super inflated already As a employee i used to get 80 dollar car speakers for 18 dollars my cost brand new Tariffs are stupid but companies inflation is worse,,0.0,1j3c6go
comment,mg25rr0,GreenChiliSweat,,1,2025-03-05 00:16:35,,,,And this is why I bought my new OLED in November,,0.0,1j3c6go
comment,mg262bb,SloWi-Fi,,1,2025-03-05 00:18:10,,,,Glad I upgraded my phone last month,,0.0,1j3c6go
comment,mg27f05,None,,1,2025-03-05 00:25:21,,,,Electronics will be one of the easiest things to not buy A lot of people upgrade their TV phone etc every year because its cheap When people start holding onto those things for years until they actually wear out these companies will hurt,,0.0,1j3c6go
comment,mg2b82p,bluenosesutherland,,1,2025-03-05 00:45:40,,,,Glad I bought my new laptop yesterday,,0.0,1j3c6go
comment,mg2ba0f,tablepennywad,,1,2025-03-05 00:45:57,,,,Any instance we find to increase our prices we will use them,,0.0,1j3c6go
comment,mg2be94,RapNVideoGames,,1,2025-03-05 00:46:34,,,,I cant wait to get all my tech from the closest Best Buy across the boarder,,0.0,1j3c6go
comment,mg2dact,xclame,,1,2025-03-05 00:56:45,,,,Come on now there is nothing highly likely about this prices are guaranteed to go up,,0.0,1j3c6go
comment,mg2drus,Firehawk-76,,1,2025-03-05 00:59:23,,,,I guess I can look forward to my total tech plan getting neutered even more,,0.0,1j3c6go
comment,mg2eh9j,physicsking,,1,2025-03-05 01:03:13,,,,Homie is foaming at the mouth for 80 ethernet cables,,0.0,1j3c6go
comment,mg2ehyo,this_knee,,1,2025-03-05 01:03:20,,,,Who says highly likely Is that even English Isnt it more professional to say a high likelihood,,0.0,1j3c6go
comment,mg2f5dz,gorillagargoyle,,1,2025-03-05 01:06:52,,,,TIL that Best Buy still exists,,0.0,1j3c6go
comment,mg2fjpz,Abject_Buyer_1678,,1,2025-03-05 01:09:01,,,,I mean who still shops there Every time I go in they never have what I need and its empty,,0.0,1j3c6go
comment,mg2gm75,lsd-man,,1,2025-03-05 01:14:43,,,,More like Best Bye,,0.0,1j3c6go
comment,mg2i6dy,getSome010,,1,2025-03-05 01:23:11,,,,So Best Buy going out of business by 202627 got it,,0.0,1j3c6go
comment,mg2icgn,PervyTurtle0,,1,2025-03-05 01:24:05,,,,People still shop at bestbuy,,0.0,1j3c6go
