type,id,author,title,score,created_utc,url,num_comments,subreddit,body,parent_id,depth,post_id
comment,mg0sbz5,None,,1,2025-03-04 20:14:49,,,,Haha I was hoping me Jensen Wong joke that was thrown in there was enough of a clue that I was clearly joking but I was very wrong,mfyyw4m,4.0,1j3c6go
comment,mfz5egs,NePa5,,5,2025-03-04 15:42:52,,,,You havent seen the reviews have you,mfyxj93,3.0,1j3c6go
comment,mfyzy3c,Tha_Watcher,,0,2025-03-04 15:16:47,,,,gifgiphyaT2u13BbIYU1c59zau,mfyxj93,3.0,1j3c6go
comment,mfyzsut,Horny4theEnvironment,,20,2025-03-04 15:16:05,,,,Bread and circus,mfytu2j,1.0,1j3c6go
comment,mfzi5p7,Levantine1978,,41,2025-03-04 16:41:47,,,,The whole bread and circus thing only works when people have access to both bread and circus Basic food staples are becoming prohibitively expensive for some families and the escapism is definitely edging out of folks price ranges The fallout from this will be incredibly predictable to anyone with a passing knowledge of history,mfytu2j,1.0,1j3c6go
comment,mg1zhur,MourningMymn,,10,2025-03-04 23:42:35,,,,I made the median US income and cannot afford to go on vacation anywhere Its not that I cant get the days off its that I LITERALLY cannot afford more than 23 nights in a hotel food and gas Let alone a plane ticket or themepark ticket,mfzi5p7,2.0,1j3c6go
comment,mgdpzrk,Admirable-Leopard272,,1,2025-03-06 19:22:43,,,,Its truly so obvious and predictable,mfzi5p7,2.0,1j3c6go
comment,mgfp7km,TransBrandi,,1,2025-03-07 01:34:03,,,,The techbros want to raze things to ground to rule over the ashes,mfzi5p7,2.0,1j3c6go
comment,mfywaay,joncornelius,,47,2025-03-04 14:58:23,,,,The can go from playing video games on line to playing counterinsurgent in real life,mfytu2j,1.0,1j3c6go
comment,mfz1zji,WolfOfAsgaard,,20,2025-03-04 15:26:39,,,,What if I told you pirating American content is only a crime if your country acknowledges American intellectual property,mfytu2j,1.0,1j3c6go
comment,mfz9i1k,405freeway,,4,2025-03-04 16:01:58,,,,Yarhar,mfytu2j,1.0,1j3c6go
comment,mfzx4dw,big_chungy_bunggy,,5,2025-03-04 17:50:21,,,,Yarr harr fideldy dee if youre looking to sail the limitless free entertainment sea find downloads you like and youll see you can be a pirate,mfytu2j,1.0,1j3c6go
comment,mgd09vt,wwwangels,,1,2025-03-06 17:22:35,,,,This is the way,mfzx4dw,2.0,1j3c6go
comment,mg0ont7,hates_stupid_people,,6,2025-03-04 19:57:47,,,,Losing easy access to food and entertainment has been the largest contributor to revolutions andor collapsing empires throughout history,mfytu2j,1.0,1j3c6go
comment,mfz6ak5,I_wish_I_was_a_robot,,2,2025-03-04 15:47:06,,,,Thats where our steam libraries with hundreds of unplayed games come in,mfytu2j,1.0,1j3c6go
comment,mfzhb24,febreez-steve,,2,2025-03-04 16:37:55,,,,Im sure this wont be used as an excuse to raise prices on digitally distributed games right Right,mfytu2j,1.0,1j3c6go
comment,mfzrnxo,No-Vast-8000,,2,2025-03-04 17:25:11,,,,Reading is cheap,mfytu2j,1.0,1j3c6go
comment,mfzsvos,Miningforwillpower,,2,2025-03-04 17:30:48,,,,I foresee more and more people sailing the seas for that escape,mfytu2j,1.0,1j3c6go
comment,mgd1acl,wwwangels,,1,2025-03-06 17:27:18,,,,The fact I understand this reference since recently getting my sea legs is immensely satisfying,mfzsvos,2.0,1j3c6go
comment,mg0ai4p,Sweet_Concept2211,,2,2025-03-04 18:52:24,,,,Good All these fucking epacifiers are partly responsible for why we are allowing things to go to shit,mfytu2j,1.0,1j3c6go
comment,mg0t4ma,Resolute_Pecan,,2,2025-03-04 20:18:34,,,,There is an incredible amount of media available from the last 20 or so years You dont always have to be on the newest thing,mfytu2j,1.0,1j3c6go
comment,mg17zqb,Flecca,,2,2025-03-04 21:27:07,,,,Good Maybe people will finally appreciate life,mfytu2j,1.0,1j3c6go
comment,mg18993,_-Smoke-_,,2,2025-03-04 21:28:20,,,,Pirate or buy second hand when possible studioscompaniesRIAAMPAAetc dont get money on secondary sales Stop playing their game when possible,mfytu2j,1.0,1j3c6go
comment,mg1xqdp,MovieGuyMike,,2,2025-03-04 23:33:00,,,,Dont you have microwaves and refrigerators Youre living like kings compared to 100 years ago s,mfytu2j,1.0,1j3c6go
comment,mg24i7v,WallacktheBear,,2,2025-03-05 00:09:46,,,,I unwind with Reddit and that has become impossible in the last six months Thankfully I built my computer in December fearing a price hike,mfytu2j,1.0,1j3c6go
comment,mfz4jto,alert592,,5,2025-03-04 15:38:52,,,,Theres always throwing rocks off the overpass,mfytu2j,1.0,1j3c6go
comment,mfzftak,Krojack76,,1,2025-03-04 16:31:01,,,,Theres always throwing rocks off the overpass I know youre joking I hope but this can literally kill people,mfz4jto,2.0,1j3c6go
comment,mg0t8wi,alert592,,1,2025-03-04 20:19:05,,,,Yes I was joking,mfzftak,3.0,1j3c6go
comment,mfz5ua6,Gregus1032,,2,2025-03-04 15:44:59,,,,Buy used and you dont need the latest and greatest to play games I used my 970 from 2016 to a couple months ago when I went up to a used 2070 super My kids now use my old 970 I upgraded my 4th gen I5 to a 5800x3d for christmas I can play the games I like on highultra settings at 1440 pretty smoothly,mfytu2j,1.0,1j3c6go
comment,mg0e40v,livinglitch,,1,2025-03-04 19:09:06,,,,Heres the thing With an increase in demand for used it will go up to the point of matching new prices Its like when gamestop gets a used copy of the latest COD game a week after release New copy with everything is 70 used copy is 60 because someone just wants to save an extra 10,mfz5ua6,2.0,1j3c6go
comment,mg0j4pz,Gregus1032,,1,2025-03-04 19:32:13,,,,Thats not a good comparison at all That would be like saying Buying a used 5090 after 1 week after release and I only saved 10 A used 2070 is going to be cheaper than a new 5090 and guess what you can play any game on the market Im pretty sure the most common GPU on steam is a 16 series Check the prices of those vs the new 50 series 16 series cards can play most games that dont require Ray tracing Its not a great experience for some games but it can be done,mg0e40v,3.0,1j3c6go
comment,mfzaht2,Call555JackChop,,2,2025-03-04 16:06:35,,,,Having fun isnt hard if you have a library card,mfytu2j,1.0,1j3c6go
comment,mfz4s14,Nobodygrotesque,,1,2025-03-04 15:39:57,,,,Thankfully Ive abused my wallet for the last 15 years and I have enough games to hold me down for a looooong time starts to download every game that starts with Atelier on PS4PS5,mfytu2j,1.0,1j3c6go
comment,mfz5xrp,kalirion,,1,2025-03-04 15:45:27,,,,My venerable i7920 w1050ti still has thousands of olderindie games in my SteamGOGEpicItchetc Backlogs to go through I hate that Windows 10 support drops in October,mfytu2j,1.0,1j3c6go
comment,mg1o362,roadrunnuh,,1,2025-03-04 22:43:23,,,,LTSC brother Im good until 2032,mfz5xrp,2.0,1j3c6go
comment,mg1oxec,kalirion,,1,2025-03-04 22:47:31,,,,Win 11 version Is there a legit way of acquiring that for reasonable price,mg1o362,3.0,1j3c6go
comment,mg3x87s,Indolent_Bard,,0,2025-03-05 06:51:17,,,,yeah softwares not gonna support Windows 10 in 2032,mg1o362,3.0,1j3c6go
comment,mg3x90r,Indolent_Bard,,1,2025-03-05 06:51:28,,,,Linux to the rescue,mfz5xrp,2.0,1j3c6go
comment,mg3yesk,kalirion,,1,2025-03-05 07:01:55,,,,Not for me lol,mg3x90r,3.0,1j3c6go
comment,mga687b,Indolent_Bard,,1,2025-03-06 05:17:24,,,,Shame,mg3yesk,4.0,1j3c6go
comment,mfz6wa9,Nordalin,,1,2025-03-04 15:49:54,,,,Theres always hard liquor Who needs a healthy and productive population anyway,mfytu2j,1.0,1j3c6go
comment,mfz9uz6,Rammsteinman,,1,2025-03-04 16:03:39,,,,I dont understand why Everything in Bestbuy is made in China or Korea If they are being shipped up from the US they need to just get it directly,mfytu2j,1.0,1j3c6go
comment,mfzbkko,None,,1,2025-03-04 16:11:31,,,,Guess Ill just need to work my way through all my unplayed steam games Maybe this will help wake people the fuck up though,mfytu2j,1.0,1j3c6go
comment,mfzdz7y,ckglle3lle,,1,2025-03-04 16:22:35,,,,Its cool theyll just make camps for us to play in,mfytu2j,1.0,1j3c6go
comment,mfze4q4,CreativeKeane,,1,2025-03-04 16:23:17,,,,No lie I nabbed a PS5 in month when I saw the writing on the wall with all the tariffs talk Im like the dumb MFer gonna go through with it I figured if the US shutdown for some reason Ill have something to do while lockdown or hunkering down,mfytu2j,1.0,1j3c6go
comment,mfzeqnr,Krojack76,,1,2025-03-04 16:26:07,,,,and watching TV My retired parents pay over 300 a month for cable TV I keep telling them to dump it but they wont,mfytu2j,1.0,1j3c6go
comment,mfzeyju,Additional_Cap72,,1,2025-03-04 16:27:08,,,,Youll be able to watch free ads at the gas pump,mfytu2j,1.0,1j3c6go
comment,mfzg5i5,Haunting_Ad_2059,,1,2025-03-04 16:32:34,,,,Books Ive started reading to get away from the constant ads we are fed Give it a try used books are cheap Stealing them is cheaper,mfytu2j,1.0,1j3c6go
comment,mfzg5pt,BoDaBasilisk,,1,2025-03-04 16:32:36,,,,More like everybody Streaming is definitely keeping lots of folks heads buried,mfytu2j,1.0,1j3c6go
comment,mfzh3ed,sekazi,,1,2025-03-04 16:36:55,,,,I have a backlog that probably could cover 10 years,mfytu2j,1.0,1j3c6go
comment,mfzi6vj,poppin-n-sailin,,1,2025-03-04 16:41:56,,,,That wont matter soon Trup and his oligarchy buddies will make sure no US citizen has time to unwind after work You wont have time to spend the money you dont have on all the stuff with jacked up prices soon enough,mfytu2j,1.0,1j3c6go
comment,mfzilga,Fit_Letterhead3483,,1,2025-03-04 16:43:45,,,,I dont know how people can even escape all this shit right now much less when the prices for bread and circuses go up The oligarchs are playing a dangerous game,mfytu2j,1.0,1j3c6go
comment,mfzol2q,IAmStuka,,1,2025-03-04 17:11:02,,,,And this is why I accelerated my plans and bought a new PC 2 weeks ago,mfytu2j,1.0,1j3c6go
comment,mfzvo43,Xabikur,,1,2025-03-04 17:43:39,,,,More and more I think this is unironically the only hope,mfytu2j,1.0,1j3c6go
comment,mg06bkt,SlapiMcTiklTaint,,1,2025-03-04 18:33:07,,,,Time to start reading books and making art even if not good at it I was the video games and TV person myself to unwind Started reading more and doing stuff that doesnt leave me staring at a screen If the expense of doing what you causes more stress then it is not worth it,mfytu2j,1.0,1j3c6go
comment,mg07ama,Delicious_Delilah,,1,2025-03-04 18:37:33,,,,Im so thankful I just got a new computer before this shit happened,mfytu2j,1.0,1j3c6go
comment,mg08ywi,Muweier2,,1,2025-03-04 18:45:19,,,,Just bought a new tv I was putting off of doing cause I assumed these would hit eventually,mfytu2j,1.0,1j3c6go
comment,mg0arrw,lizard81288,,1,2025-03-04 18:53:37,,,,The Switch 2 is going to be like 800,mfytu2j,1.0,1j3c6go
comment,mg2asr5,RapNVideoGames,,1,2025-03-05 00:43:23,,,,Thats why we have pay later and credit cards who needs to look at the full price anyways,mfytu2j,1.0,1j3c6go
comment,mg6a32j,ooO0I-_-X-_-I0Ooo,,1,2025-03-05 16:57:26,,,,I guess its a good time to tackle that mammoth of a backlog of mine,mfytu2j,1.0,1j3c6go
comment,mh0bjrr,a_f_s-29,,1,2025-03-10 11:59:51,,,,Theyll be in trouble then If you take away the bread AND the circuses youll get riots,mfytu2j,1.0,1j3c6go
comment,mfzl6ck,Admirable-Lecture255,,1,2025-03-04 16:55:24,,,,Great time to get hobbies like going outside or exercising,mfytu2j,1.0,1j3c6go
comment,mfzt9rb,Neuchacho,,1,2025-03-04 17:32:37,,,,Good Part of the reason were in this mess is because people can tune out so easily,mfytu2j,1.0,1j3c6go
comment,mg0giwi,Jrsaz404,,1,2025-03-04 19:20:18,,,,Why cant someone get a used tv from 3 years ago Youre so far off its wild lmao,mfytu2j,1.0,1j3c6go
comment,mfz6lzj,alpha-delta-echo,,0,2025-03-04 15:48:35,,,,Theyll just have to go outside more There are all sorts of fun outdoor activities hunting shooting archery making campfires,mfytu2j,1.0,1j3c6go
comment,mfzg0ch,TornadoQuakeX,,0,2025-03-04 16:31:55,,,,Yeah but who doesnt already own a TV Plus theres plenty of great handhelds and consoles that you can get secondhand Personally Im more worried about phone prices going up since planned obsolescence became a thing,mfytu2j,1.0,1j3c6go
comment,mfzjo5g,LickMyTicker,,0,2025-03-04 16:48:36,,,,Are you sure about that Most people dont have to upgrade their computers and consoles anymore The PC market was overrun by crypto and then AI Most games people play run on hardware that is a decade in the past I think escapism is going to continue to be huge Brainrot is going to get worse Has anyone been in a best buy recently They dont even fucking make sense Most of the shit in there has no reason to be bought Its a glorified cellphone kiosk that also sells some smart home trash and laptopstablets that people need to stop buying,mfytu2j,1.0,1j3c6go
comment,mfzloax,breinbanaan,,0,2025-03-04 16:57:39,,,,Maybe its about time Americans face reality,mfytu2j,1.0,1j3c6go
comment,mfzbhni,ELITE_JordanLove,,-10,2025-03-04 16:11:09,,,,Oh no people will have to find things other than electronics to amuse themselves God forbid,mfytu2j,1.0,1j3c6go
comment,mfzrm29,NumNumLobster,,4,2025-03-04 17:24:57,,,,Go stroll around a sporting goods store Everything from basketballs to hiking boots is imported too,mfzbhni,2.0,1j3c6go
comment,mg0gq27,ELITE_JordanLove,,0,2025-03-04 19:21:13,,,,Thats not the discussion here though,mfzrm29,3.0,1j3c6go
comment,mfzls1f,FrostyD7,,2,2025-03-04 16:58:07,,,,I think its more about not being able to afford rent and food Hard to unwind when you are homeless hungry or fighting paycheck to paycheck for any reason,mfzbhni,2.0,1j3c6go
comment,mfzndxx,ELITE_JordanLove,,-2,2025-03-04 17:05:27,,,,If you cant afford rent and food you shouldnt be buying electronics,mfzls1f,3.0,1j3c6go
comment,mfzo271,FrostyD7,,3,2025-03-04 17:08:36,,,,ok bud,mfzndxx,4.0,1j3c6go
comment,mfzju5z,None,,-1,2025-03-04 16:49:21,,,,What did you type this on,mfzbhni,2.0,1j3c6go
comment,mfzkfjf,ELITE_JordanLove,,1,2025-03-04 16:52:02,,,,I carrier pigeon my comments directly to spez,mfzju5z,3.0,1j3c6go
comment,mfyt1wf,hardy_83,,951,2025-03-04 14:41:11,,,,Cant wait to see what happens when youth start realizing they have no future AND cant afford to play videogames or pay for phones,,0.0,1j3c6go
comment,mfyua87,gleamydream,,315,2025-03-04 14:47:51,,,,Theyre all say that America is finally great again and feed their desire for the mines,mfyt1wf,1.0,1j3c6go
comment,mfywbmd,airduster_9000,,119,2025-03-04 14:58:34,,,,And blame everyone who they deem WOOOOOOOKE,mfyua87,2.0,1j3c6go
comment,mfyx4ya,gleamydream,,88,2025-03-04 15:02:44,,,,The year is 36754 The latest slave revolt has been squashed and the leaders have had their brains recycled into the AI mainframe The remnant survivors shout up at the sky and ask how could Biden do this to them,mfywbmd,3.0,1j3c6go
comment,mfyyt00,Bdr1983,,43,2025-03-04 15:11:09,,,,A lonely lady wearing a worn red hat whispers Thanks Obama under her breath while searching for her Emails,mfyx4ya,4.0,1j3c6go
comment,mg1dkz0,ki11bunny,,1,2025-03-04 21:52:51,,,,Thanks Obama,mfyx4ya,4.0,1j3c6go
comment,mfzmkhc,None,,19,2025-03-04 17:01:41,,,,How did the kids get so goddamn stupid,mfyua87,2.0,1j3c6go
comment,mfzttmp,Yvese,,35,2025-03-04 17:35:11,,,,Social media from a very young age and algos pushing them further right because thats what gets clicks,mfzmkhc,3.0,1j3c6go
comment,mg9ae8g,anonymousbopper767,,3,2025-03-06 01:55:01,,,,Dont forget parent indoctrination Buddy has an 18 year old DAUGHTER who voted Trump Oh cool so you like rapists huh The same guy who tells you youre worthless except as a fuck toy dishwasher,mfzttmp,4.0,1j3c6go
comment,mfzwcax,None,,6,2025-03-04 17:46:46,,,,Defending public education Rise of right wing influences like tate brothers Joe Roganetc,mfzmkhc,3.0,1j3c6go
comment,mg00ure,RedditIsShittay,,-3,2025-03-04 18:07:34,,,,And why is Europe shifting to the right,mfzwcax,4.0,1j3c6go
comment,mfzr5v8,gleamydream,,15,2025-03-04 17:22:53,,,,Honestly dont think theyre stupid Just misinformed Someone with a high level of education can still believe in wild shit,mfzmkhc,3.0,1j3c6go
comment,mg0076m,SrslyCmmon,,17,2025-03-04 18:04:32,,,,They have an amazing predisposition to believing total strangerscelebs on the internet We never used to trust unqualified people in such great numbers outside religion Guess something had to fill the gap,mfzr5v8,4.0,1j3c6go
comment,mg0cuhe,Fatdap,,3,2025-03-04 19:03:12,,,,Social media and screens along with absent or too busy parents Lot of the kids now are stupid as fuck can barely read can hardly comprehend what they can read and have no attention span for any tasks longer than 30s,mfzmkhc,3.0,1j3c6go
comment,mg13myl,Rektw,,2,2025-03-04 21:06:55,,,,Rage bait social media algorithms,mfzmkhc,3.0,1j3c6go
comment,mg2a8zq,None,,2,2025-03-05 00:40:29,,,,Their parents fucked with no regard or plans for their future They thought handing them a fucking tablet at age 2 was a good idea,mfzmkhc,3.0,1j3c6go
comment,mfywtgk,argama87,,2,2025-03-04 15:01:06,,,,Instead of Minecraft its the LeQuint Dickey Mining Company for work study,mfyua87,2.0,1j3c6go
comment,mfyy75m,santz007,,102,2025-03-04 15:08:08,,,,By then the ruined economy will be the Democrats problem and GOP will nonstop verbally blame liberals 247 with help of Russian bots,mfyt1wf,1.0,1j3c6go
comment,mfz6rem,Vocalic985,,73,2025-03-04 15:49:16,,,,Youre more optimistic than me if you think another party will have control at some point in the next 10 years,mfyy75m,2.0,1j3c6go
comment,mfz7blk,santz007,,18,2025-03-04 15:51:54,,,,you are most probably right although one can dream that the voters will get some sense in these 4 years but then whom am i kidding,mfz6rem,3.0,1j3c6go
comment,mfz7rp2,Nyoteng,,25,2025-03-04 15:54:01,,,,Didnt Trump say out loud that Musk was really good with computers and made sure the votes were right this time paraphrasing here to the highest degree,mfz7blk,4.0,1j3c6go
comment,mfzadxm,No-Situation-3426,,18,2025-03-04 16:06:05,,,,Its got nothing to do with voters getting some sense They wont be letting a fair election happen Thats how democracies fall and authoritarian regimes take over,mfz7blk,4.0,1j3c6go
comment,mg3vn0q,sf_cycle,,1,2025-03-05 06:37:02,,,,The Trump voters I know love everything thats happening Im sad to report They will sing his praises as they lose their jobs and take all the fentanyl that supposedly is driving the tariffs,mfz7blk,4.0,1j3c6go
comment,mfzk353,MontyAtWork,,17,2025-03-04 16:50:29,,,,Every system DOGE touched had a back door installed in it If there even were free and fair elections Musk would just start deleting databases and files and bring every digital government system down under Democratic leadership We dont go back from whats already happened,mfyy75m,2.0,1j3c6go
comment,mg07a8q,Gamiac,,7,2025-03-04 18:37:30,,,,Europe if youre listening,mfzk353,3.0,1j3c6go
comment,mg0uvao,Bigmethod,,2,2025-03-04 20:26:33,,,,This is just the natural cycle Dumbasses voted in Republicans who systematically try to destroy the country by either hopping into a new war andor mismanaging some kind of recessioncrisis and then a democrat comes in and sweeps up after them only to be voted out by the same dumbasses for the cycle to repeat anew Trump inherited an amazing economy and failed to manage it thanks to Covid and his overspending Biden came in and sweeped it all up and got us on track for a positive future Now Trump is back and reverting all the positive changes whilst also sabotaging our democracy and cozying up to foreign dictators for good measure,mfyy75m,2.0,1j3c6go
comment,mfyvmib,JediTrainer42,,9,2025-03-04 14:54:56,,,,Spoiler they cant afford it now,mfyt1wf,1.0,1j3c6go
comment,mfz33y5,Specialist_Brain841,,1,2025-03-04 15:32:01,,,,rent to own,mfyvmib,2.0,1j3c6go
comment,mg2v6yh,rr00xx,,1,2025-03-05 02:35:04,,,,Ya they just havent realized it yet is their point,mfyvmib,2.0,1j3c6go
comment,mfyupyr,TroyFerris13,,16,2025-03-04 14:50:10,,,,Subscriptions will always be relatively cheap We need to banish these aswell,mfyt1wf,1.0,1j3c6go
comment,mfyv4sn,Napoleons_Peen,,10,2025-03-04 14:52:21,,,,Yeah look how many buy now pay later options there are these days,mfyupyr,2.0,1j3c6go
comment,mfzblfo,Light_x_Truth,,0,2025-03-04 16:11:38,,,,BNPL is horrible It really fucks with you psychologically to make you think youre spending less than you are,mfyv4sn,3.0,1j3c6go
comment,mfyvvyd,Nobody_Important,,32,2025-03-04 14:56:19,,,,If history tells us anything they still wont be bothered to vote,mfyt1wf,1.0,1j3c6go
comment,mfyzu3e,sarhoshamiral,,30,2025-03-04 15:16:14,,,,You dont understand them They want the perfect candidate that will fix everything in a day and needs to make everyone happy If they compromise one bit to come up with a real solution then they clearly dont have ideals s,mfyvvyd,2.0,1j3c6go
comment,mg0jvcs,munche,,0,2025-03-04 19:35:38,,,,Young people protested for what they were passionate about all around the country and Democrats called them terrorists for it Why do people treat it like theres some purity test for perfection that people were looking for The Good party was actively hostile to those voters why the fuck would they show up You cant slap people in the face and then tell them its their fault when they dont make the effort to support you The Democrats are absolutely terrified of offending Republicans what if they moved that attitude to where they actually cared about the people who arent voting for Nazi shit instead of chasing Nazi votes while telling everyone else to fall in line or else,mfyzu3e,3.0,1j3c6go
comment,mg0nfxz,sarhoshamiral,,6,2025-03-04 19:52:11,,,,Young people protested for what they were passionate about all around the country and Democrats called them terrorists for it If you are talking about Gaza protests considering they shutdown the road to airport instead of legal protests yes they were terrorists by definition My problem with the protests were both how they were handled but also what they wanted disregarding realitynuance of the situation Unfortunately for Gaza protestors they refused to acknowledge that they were stuck in a hard place There was no option that gave them what they wanted They either got status quo or by not voting they got what they have now which is actual genocide for Gaza So please dont tell me they were passionate about the issue It was a game for them They didnt give a shit about Gaza in reality considering how they decided to vote Because if they were truly passionate they would have realized the reality above and still voted for Democrats while continuing to protest as that was the only option that got them closer to their goal Oh btw where are those protestors now If they were truly passionate why they are not protesting Trumps choice to erase Gaza off the map The Democrats are absolutely terrified of offending Republicans what if they moved that attitude to where they actually cared about the people who arent voting for Nazi shit instead of chasing Nazi votes while telling everyone else to fall in line or else Like what Democrats had decent proposals in place for economy to improve social services and to ensure America had long term growth for high skill jobs Just because media didnt report on them doesnt mean they didnt exist,mg0jvcs,4.0,1j3c6go
comment,mfz5wk5,WonderFerret,,3,2025-03-04 15:45:17,,,,No bread No circuses,mfyt1wf,1.0,1j3c6go
comment,mfyy4fn,ComplainAboutVidya,,6,2025-03-04 15:07:45,,,,Violence violence happens Thats what were barreling towards and it should terrify us all,mfyt1wf,1.0,1j3c6go
comment,mg03e2t,The_Splendid_Onion,,2,2025-03-04 18:19:10,,,,Were going to be left with no choice but to violently stop the violence with violence violently,mfyy4fn,2.0,1j3c6go
comment,mg34wpt,IIlIIlIIlIlIIlIIlIIl,,1,2025-03-05 03:29:12,,,,Eh Americans are not a violent bunch Democrats in particular like to complain and do stupid shit like glue themselves to trees or the road but not really anything effective January 6th is probably the most violent and closest thing to a coup thats happened in America in the last 50 years and it wasnt even for the right reason or by the right group of people relative to the problem The George Floyd protests would probably be second but that ended up as mostly an excuse for folks to burn down and loot shit which didnt get anywhere rather than as a coherent movement with specific goals that was anywhere near successful,mfyy4fn,2.0,1j3c6go
comment,mg44ndk,fairlyoblivious,,1,2025-03-05 08:01:57,,,,lol yeah January 6th was the most violent thing in America in 50 years spoken like a true ignorant American When you read this if you can even read go google oklahoma federal bombing and get back to us on that most violent This is not support of January 6th its merely laughing full chested about how just fucking ignorant as hell the average American is Most violent thing in 50 years HAHAHA fuck man my sides,mg34wpt,3.0,1j3c6go
comment,mg4p0c1,IIlIIlIIlIlIIlIIlIIl,,1,2025-03-05 11:27:48,,,,That bombing was perpetrated by two people January 6th was carried out by several thousand though only 20003000 actually got in,mg44ndk,4.0,1j3c6go
comment,mfyvtm0,joncornelius,,5,2025-03-04 14:55:59,,,,Some say its three missed meals that will cause I person to do some drastic shit For GenZ it will be three days of missed TikTok,mfyt1wf,1.0,1j3c6go
comment,mfyuxwi,notred369,,3,2025-03-04 14:51:20,,,,thats the point they want to take away ownership of media from the masses,mfyt1wf,1.0,1j3c6go
comment,mfyy6w3,PM_ME_CATS_OR_BOOBS,,5,2025-03-04 15:08:05,,,,Well okay but import tarrifs would be a weird way to do that,mfyuxwi,2.0,1j3c6go
comment,mfz4bv3,VetteMiata,,1,2025-03-04 15:37:49,,,,Guess sports are back on the menu,mfyt1wf,1.0,1j3c6go
comment,mfz8c6l,jsamuraij,,1,2025-03-04 15:56:38,,,,Sadly the answer is probably somewhere between nothing and get rounded up Trump on student protests,mfyt1wf,1.0,1j3c6go
