type,id,author,title,score,created_utc,url,num_comments,subreddit,body,parent_id,depth,post_id
comment,mfyy38r,lemoooonz,,67,2025-03-04 15:07:35,,,,Higher prices and federal government firing hundreds of thousands of people along with massive corporate firings ATL fed forecast GDP contraction of almost 3 in just ONE QUARTER hmmm this might be what we call STAGFLATION lmao I know MAGA is being dumb but GOP is a special kind of evil Use the dumb MAGA idiots to get project 2025 in effect and then try to cut food stamps social security and grants to red states LMAO I have a feeling all the red counties about to get decimated will find a way to blame Obama,,0.0,1j3c6go
comment,mfzngf5,paradoxpancake,,24,2025-03-04 17:05:47,,,,No Its going to sadly get violent in those states if they cut SNAP on top of this People are only a few missed meals away from doing something drastic The GOP is playing with fire out of blind fanatic loyalty when they know behind closed doors that what theyre doing is objectively stupid There are a few true believers whose theatrics and private self are oneinthesame and that has lead to a lot of stupidity plaguing the Legislative Source is that Ive worked with Congressional staffers The faces you see on TV are not the same behind closed doors unless theyre MTG or a dumb sort of true believer,mfyy38r,1.0,1j3c6go
comment,mg455qk,fairlyoblivious,,2,2025-03-05 08:07:01,,,,If you go look up the economic contraction of the great depression it was 6 a year were headed for twice as bad as that time,mfyy38r,1.0,1j3c6go
comment,mfz5tm5,lunchypoo222,,65,2025-03-04 15:44:54,,,,Prices will go up because of tariffs and then theyll be permanently inflated thanks to corporate opportunism Why lower them again if people are willing to pay more,,0.0,1j3c6go
comment,mfz6yzi,SuicidalChair,,18,2025-03-04 15:50:15,,,,The hopeful in me would like to think competition and free market Best buy is selling the same shit Wal Mart is selling so if I can save 50100 buying it at Walmart I obviously will So best buy would need to lower their prices to compete,mfz5tm5,1.0,1j3c6go
comment,mfz8p1l,HarbingerDe,,25,2025-03-04 15:58:16,,,,Wont happen The modern economy is dominated by pricefixing monopolies and quasimonopolies This exact thing happened after the pandemic when supply chain issues caused dramatic inflation Prices never came down You dont need to compete In fact any time a competitor raises their prices it just gives you justification to raise yours in lock step even if the increase is completely arbitrary,mfz6yzi,2.0,1j3c6go
comment,mg1jxgb,nicuramar,,1,2025-03-04 22:23:01,,,,This exact thing happened after the pandemic when supply chain issues caused dramatic inflation Prices never came down How would they The inflation happened That would require deflation which we dont have,mfz8p1l,3.0,1j3c6go
comment,mg26mxz,myburdentobear,,0,2025-03-05 00:21:12,,,,And you dont want deflation It is a very bad economic signal You want wages to increase,mg1jxgb,4.0,1j3c6go
comment,mg1lc60,magicwand148869,,2,2025-03-04 22:29:55,,,,The issue here is the profits will go to the manufacturers I think that companies will increase the prices of their core products like the 5090 to 2100 Once the tariffs are lifted Nvidia will reap the benefits while Walmart and Best Buy will continue to compete at the new base price This is already the case with the graphics card market after the cryptocurrency boom and is now being applied to AI Just a couple of years ago paying 2000 for a flagship graphics card was ridiculous,mfz6yzi,2.0,1j3c6go
comment,mg45lvk,fairlyoblivious,,1,2025-03-05 08:11:27,,,,They know nobody is going to Walmart and writing down prices and then checking them at another retailer thats silly to even think and just a sign that you dont have the first clue about how any of this actually works Think about the last time you actually did that for the items you want to buy What items did you do it for None Because youve never done that,mfz6yzi,2.0,1j3c6go
comment,mg5czak,SuicidalChair,,1,2025-03-05 14:12:14,,,,For electronics over 80 Pretty much every time I always try and find the lowest price for the quality items Im buying like VR headsets Robot vacuums and video game accessories I dont just shell out money at the first place I walk into If its a 5 can opener maybe I dont care but anything Im planning to sink a larger sum of money into I want the cheapest deal and always price match Maybe you dont do that but that means money either isnt an issue for you or youre terrible with it and dont care Either way congrats,mg45lvk,3.0,1j3c6go
comment,mfzaukc,FlatTopTonysCanoe,,64,2025-03-04 16:08:12,,,,Theyre already being raised Ive been looking at a coffee machine for over a year waiting for it to go on sale Last week it was the same price its been all of 2024 This week its 50 more expensive A number of other items I had in my cart also went up 1020 Its going to get really tricky for all these Trump supporters who make less than 50k a year to survive soon and they have nobody to blame but themselves,,0.0,1j3c6go
comment,mfzfteq,SecondOne2236,,27,2025-03-04 16:31:02,,,,They have bootstraps Theyll be fine,mfzaukc,1.0,1j3c6go
comment,mfzn6sz,FlatTopTonysCanoe,,12,2025-03-04 17:04:33,,,,Honestly just interested to see the mental gymnastics they need to go through to continue supporting this administration once their grandma stops getting her social security and theyre paying 2egg and 5gallon for gas and cars increase in price by 12000 Who could have possibly seen any of this coming,mfzfteq,2.0,1j3c6go
comment,mfztg82,rtangxps9,,5,2025-03-04 17:33:27,,,,Its fine old people that cant work and didnt pull themselves up dont deserve anything s if that wasnt clear,mfzn6sz,3.0,1j3c6go
comment,mg1u1gs,Mr_Goonman,,2,2025-03-04 23:13:29,,,,Its going to get really tricky for all these Trump supporters who make less than 50k a year to survive soon and they have nobody to blame but themselves Itll be easy for those dipshits to blame it on Biden for cooking the books and hiding that the economy is bad before hero Trump took over control,mfzaukc,1.0,1j3c6go
comment,mfyu1gm,sebrebc,,117,2025-03-04 14:46:33,,,,Tariffs effecting prices or not every business was going to use them as an excuse to raise prices regardless And even if tariffs go away prices will remain high Just the threat is enough for businesses to take advantage of it to increase profits The moment he opened his stupid fucking mouth price increases were planned,,0.0,1j3c6go
comment,mfz3srp,Mr_GigglesworthJr,,28,2025-03-04 15:35:19,,,,I highly doubt that Businesses do not have infinite pricing power There is no guarantee that price increases will offset demand destruction Theres a reason the market is selling off right now,mfyu1gm,1.0,1j3c6go
comment,mfzmah3,Sagonator,,18,2025-03-04 17:00:25,,,,They literally do that when there are inflation fears People can be pushed a fuck ton 100 inflation is coming,mfz3srp,2.0,1j3c6go
comment,mgg21yj,TransBrandi,,1,2025-03-07 02:49:08,,,,For things like basic goods people will pay because they _have_ to pay For electronics Businesses will have to continue to pay but people will eventually have to do without Should I eat or should I get a new GPU is a very simple answer,mfzmah3,3.0,1j3c6go
comment,mg0df4h,Successful-Train-259,,1,2025-03-04 19:05:53,,,,Tell me how they do not have infinite pricing power The bulk of business is consolidated into a few major corporations,mfz3srp,2.0,1j3c6go
comment,mg0hl9q,Mr_GigglesworthJr,,1,2025-03-04 19:25:10,,,,Because people do not have to buy things If businesses had unlimited pricing power then you would never see consumer spending decline,mg0df4h,3.0,1j3c6go
comment,mfzdazv,rammstoon,,1,2025-03-04 16:19:30,,,,Hey hey hey dont you dare challenge the reddit economics pedalling doom and gloom,mfz3srp,2.0,1j3c6go
comment,mfzt1uj,MontyAtWork,,0,2025-03-04 17:31:35,,,,The DJIA is 15 thats not much of a sell off If businesses really thought consumers couldnt weather a price hike wed be 20 Were literally at the same price we were at the start of November and at the start of January The COVID Crash saw the Dow at 20000 Were at 42000 rn Losing 1 is nothing lol,mfz3srp,2.0,1j3c6go
comment,mg069e7,Mr_GigglesworthJr,,0,2025-03-04 18:32:52,,,,15 is a lot for an index and 20 would be insane thats double the drop during the initial Covid lockdowns Also Best Buy is down 13 today driven by tariffs concerns They specifically highlighted how tariffs would negatively impact demand,mfzt1uj,3.0,1j3c6go
comment,mfzrhcx,bigbiboy96,,-1,2025-03-04 17:24:21,,,,When 50 of sales are being carried by the richest 10 of the population who seemingly dont care about price They have much more pricing power than you may think The American consumers who can still afford to shop at will are doormats and will pay whatever price for whatever the fuck they want to buy,mfz3srp,2.0,1j3c6go
comment,mg09yic,Mr_GigglesworthJr,,1,2025-03-04 18:49:52,,,,And what about the other 50 of consumer spending Do you think those consumers will absorb a 25 price increase on a large portion of goods with no impact to their total consumption Will the top 10 of earners increase consumption to offset declines for the other group Thats just the macro picture but many businesses have outsized exposure to middle and lower income households and will have to take that into when deciding how much cost to pass through to consumers,mfzrhcx,3.0,1j3c6go
comment,mg019t7,YouStupidAssholeFuck,,0,2025-03-04 18:09:30,,,,But the selloff isnt about business pricing power Not yet anyway Prices are going to go up because of what amounts to essentially a tax Purchasing power goes down when prices go up so naturally people are going to sell shares because there is going to be an instant if not temporary drop in purchasing as people buckle down The market selloff is because anyone with a brain knows the tariffs are going to hurt the economy so theyre getting out before their investments tank Otherwise they can keep their shares and the market stays relatively steady until the next quarterly earnings reports and then watch their shares tank But eventually people are going to start buying things again and theres going to be a balance companies figure out where they can raise prices and lose some consumers but still make massive profits off the difference Look at all these media streaming companies raising prices twice a year Yeah theyre pricing some people out but who is left is more than making up the difference There might not be a guarantee that prices increases will offset demand but theres no guarantee they wont Corporations will ensure increasing revenue and profits as well as they can though so if some people can no longer afford their products theyll make the difference up on the people that still can,mfz3srp,2.0,1j3c6go
comment,mg070zh,Mr_GigglesworthJr,,0,2025-03-04 18:36:17,,,,You need to think through your argument better Tariffs hurt the economy how consumer spending power declines What happens when consumers have less spending power Businesses with exposure to discretionary products lose pricing power,mg019t7,3.0,1j3c6go
comment,mg0f2p4,YouStupidAssholeFuck,,0,2025-03-04 19:13:33,,,,The stock prices of steel companies climbed sharply on Monday as investors assumed the tariffs would increase their profits ClevelandCliffs which wants to buy Pittsburghs US Steel surged upward by nearly 18 US Steel rose almost 5 Nucor increased almost 6 and Steel Dynamics rose about 5 Now why would anyone assume tariffs paid to the US Treasury would increase profits for a given company Its because investors know how businesses work If there is any reason the price of a product will go up a company will install an extra increase to drive profits Its happened since those tariffs went into effect in 2018 Its going to happen again now Time will tell Im sure there is going to be a dip in stock prices temporarily since the past couple days have been brutal for the markets Once that levels out and tariffs start to really hit consumer goods I can all but guarantee that well see companies who have products affected by the tariffs showing record profits and earnings But its like you stopped reading my post when you saw some buzzwords you wanted to see Go back and keep reading,mg070zh,4.0,1j3c6go
comment,mg0ifg1,Mr_GigglesworthJr,,0,2025-03-04 19:28:59,,,,Thats because steel buyers will shift toward domestic manufacturers Further downstream use of steel is not entirely discretionary If youre a retailer of discretionary goods that same logic doesnt necessarily apply in your favor,mg0f2p4,5.0,1j3c6go
comment,mg0nt0b,YouStupidAssholeFuck,,0,2025-03-04 19:53:50,,,,What evidence is there that buyers have shifted to domestic manufacturers Seems to me domestic steel manufacturers are closing plants more than opening them Yet profits remained high in the short term following the initial tariffs of 2018 and we see now that those figures are on the downturn showing that tariffs hurt consumers in the short term and ultimately domestic manufacturers in the long run,mg0ifg1,6.0,1j3c6go
comment,mg0spu4,Mr_GigglesworthJr,,0,2025-03-04 20:16:37,,,,Buyers will shift toward domestic manufacturers to avoid tariff costs Also profits can still increase without businesses passing through the entirety of the tariff burden to the consumer Your assertion that tariffs hurt domestic manufacturers in the long run is questionable Substitution effects become more pronounced in the long run and would benefit domestic producers Some producers would have negative effects from lower total growth,mg0nt0b,7.0,1j3c6go
comment,mg0t42q,YouStupidAssholeFuck,,0,2025-03-04 20:18:29,,,,Can you back any of this up Tariffs have been in place on steel for 7 years now Surely there is data by now showing how domestic manufacturers and consumers have benefited,mg0spu4,8.0,1j3c6go
comment,mg0x1xv,Mr_GigglesworthJr,,1,2025-03-04 20:36:38,,,,The 2018 steel and aluminum tariffs were only fully in effect for around a year before the quota system was negotiated and provided substantial relief to many nondomestic producers including the EU Canada and Mexico The new steel and aluminum tariffs will have no such relief at least for now,mg0t42q,9.0,1j3c6go
comment,mg131o5,YouStupidAssholeFuck,,0,2025-03-04 21:04:11,,,,I could be misunderstanding but it sounds like youre arguing against your own point here Regardless I think if you had the data to prove it you would have provided it,mg0x1xv,10.0,1j3c6go
comment,mg15q5o,Mr_GigglesworthJr,,1,2025-03-04 21:16:34,,,,Nope Totally consistent argument Domestic producers are not the same as retailers that rely on imports and will have different outcomes based on tariffs Nice double standard given you have provided no such data but have made claims that run against the economic consensus Youre free to believe my claims as a professional with experience in this matter or notmakes no difference to me,mg131o5,11.0,1j3c6go
comment,mg17yex,YouStupidAssholeFuck,,0,2025-03-04 21:26:56,,,,So retailers turned to domestic producers which didnt increase prices I think this sort of claim would be easy to prove But youll just trust me bro instead Yeah ok A professional with experience in this matter could back up these claims with data but here we are,mg15q5o,12.0,1j3c6go
comment,mg1agai,Mr_GigglesworthJr,,1,2025-03-04 21:38:32,,,,Its simple logic and is the pretense for tariffs in the first place Domestic steel producers are not subject to tariffs and become more competitive with imported goods Domestics would gain business assuming the new tariff is enough to overcome their higher relative cost to produce The net result for the consumer is still negative because the post tariff price is still higher even with domestic substitution Like what data are you expecting Think it through,mg17yex,13.0,1j3c6go
comment,mfzndrm,None,,13,2025-03-04 17:05:26,,,,Stop removing the blame from the tariffs,mfyu1gm,1.0,1j3c6go
comment,mg19bui,proudbakunkinman,,3,2025-03-04 21:33:21,,,,My first thought as well for those saying variations of this Its an easy out for Trump and Republicans their media and their base and those that see themselves more left are unknowingly helping them,mfzndrm,2.0,1j3c6go
comment,mfzp2ts,sebrebc,,0,2025-03-04 17:13:17,,,,What,mfzndrm,2.0,1j3c6go
comment,mfzps3n,None,,4,2025-03-04 17:16:30,,,,Youre excusing the tariffs and blaming corporate greed Tariff effecting prices or not There is no or not,mfzp2ts,3.0,1j3c6go
comment,mfzwkic,sebrebc,,1,2025-03-04 17:47:48,,,,Thats not what I was saying Tariffs will raise prices I never suggested that wont happen and I didnt shift blame away from the tariffs themselves I said that its even worse knowing that businesses will take advantage of the simple mention of a tariff and use them as an excuse to raise prices Its like when a hurricane threatens tne Gulf oil goes up gas goes up It doesnt even need to hit yet the prices start to increase just with the threat of a hurricane If it hits prices go even higher,mfzps3n,4.0,1j3c6go
comment,mfzv9lc,angrybirdseller,,2,2025-03-04 17:41:49,,,,The bag of Easter candy was 2600 the other day Its going to get worse MAGA are imbeciles The tarrifs are paid by consumer not the company or the other country,mfyu1gm,1.0,1j3c6go
comment,mg3ylq0,DO_NOT_AGREE_WITH_U,,1,2025-03-05 07:03:41,,,,I remember when a single oil rig in the Gulf of Mexico had issues once and gas prices shot up by like 10 fucking percent The corporate greed is absolutely fucking suffocating,mfyu1gm,1.0,1j3c6go
comment,mfzcuce,torgofjungle,,19,2025-03-04 16:17:23,,,,Duuuhh This is why I built a new PC after trump won I wasnt going to do that but I knew everything was going to be more expensive,,0.0,1j3c6go
comment,mfzvxpl,angrybirdseller,,14,2025-03-04 17:44:52,,,,Bought laptop for this reason too for 600 now it will cost 900 with tarriifs on everything,mfzcuce,1.0,1j3c6go
comment,mg1qwop,llama_marmalade,,3,2025-03-04 22:57:23,,,,Same Got a new one last month and a four year protection plan to last this shit show,mfzvxpl,2.0,1j3c6go
comment,mg0bb0l,noimeanitsalright,,1,2025-03-04 18:56:05,,,,Im regretting not doing this soooo much,mfzcuce,1.0,1j3c6go
comment,mg132oj,torgofjungle,,1,2025-03-04 21:04:19,,,,I wasnt going to do it right away I was just going to slowly buy the various parts as I found good deals and then assemble I still feel I got a decent deal but I wouldnt have moved as quickly as I did if trump hadnt won,mg0bb0l,2.0,1j3c6go
comment,mg4ea48,CrypticNeutron,,1,2025-03-05 09:41:59,,,,What a businessman Making sales happen before even taking office,mfzcuce,1.0,1j3c6go
comment,mg5bayk,torgofjungle,,2,2025-03-05 14:02:31,,,,And then no sales while hes in office Big brain moves,mg4ea48,2.0,1j3c6go
comment,mfzg7ru,Yimyorn,,20,2025-03-04 16:32:51,,,,To all the businesses that supported Trump Youre going to learn sales are about to drop Going to suck if you want to buy something in the near future,,0.0,1j3c6go
comment,mg0piul,ihazmaumeow,,18,2025-03-04 20:01:45,,,,Homie Best Buy will be out of business by the end of summer Aint nobody buying anything with money they dont have,,0.0,1j3c6go
comment,mg1owa5,GarbageTheCan,,3,2025-03-04 22:47:22,,,,If one saw some of their employee training videos theyd hate that overpriced electronics store and boycott it,mg0piul,1.0,1j3c6go
comment,mfyx0s9,cubanesis,,22,2025-03-04 15:02:08,,,,You had a good run Best Buy but Im pretty sure this is going to kill a bunch of retailers in the US They are already struggling against giants like Amazon,,0.0,1j3c6go
comment,mfzep78,RecentMoose3985,,6,2025-03-04 16:25:56,,,,Agreed I question whether Best Buy has a healthy enough balance sheet to weather revenue declines for multiple years,mfyx0s9,1.0,1j3c6go
comment,mfzj32r,FA-Cube-Itch,,1,2025-03-04 16:45:57,,,,They do not,mfzep78,2.0,1j3c6go
comment,mfzu4j8,cubanesis,,2,2025-03-04 17:36:36,,,,Lol yeah based on actually going into one of their stores recently I can say they definitely have a going out of business vibe to them these days,mfzj32r,3.0,1j3c6go
comment,mg0szfq,xHawk_T,,0,2025-03-04 20:17:53,,,,The Best Buy in my area sells 2 things smart phones and TVs All of the other shelves are barren,mfzu4j8,4.0,1j3c6go
comment,mg1vb38,Mr_Goonman,,1,2025-03-04 23:20:06,,,,Do you question because you dont think publicly traded companies are reporting that information or because at this point youre too lazy to look into their balance sheets but are content with making doomer predictions,mfzep78,2.0,1j3c6go
comment,mg24w6u,RecentMoose3985,,1,2025-03-05 00:11:52,,,,Too lazy being frank Many retail companies closed and gone bankrupt last few years as a result of ecommerce giants dominating The various Best Buys Ive been too are empty high merchandise inventory low margin industry As a small business owner that manages multiple businesses at a much smaller scale grossing 15M sales these things come to mind You dont have to see a companys book to see the signs on the wall Do people have a blast being around you You talk like a sour puss Sorry you give that off,mg1vb38,3.0,1j3c6go
comment,mg2fvej,Mr_Goonman,,1,2025-03-05 01:10:44,,,,As a small business owner that manages multiple businesses at a much smaller scale grossing 15M sales Do you use twitter,mg24w6u,4.0,1j3c6go
comment,mg2fxzq,RecentMoose3985,,1,2025-03-05 01:11:07,,,,Nope,mg2fvej,5.0,1j3c6go
comment,mg45yge,fairlyoblivious,,1,2025-03-05 08:14:55,,,,Do you ask this because you dont know that companies dont usually run a surplus by design and in fact rely on borrowing against their perceived value often calculated based on their stock price multiplied by outstanding shares and that when a recession hits that means companies mostly by definition of how they are run quickly run into MAJOR debt problems and go bankrupt Or are you too lazy to know this but still content with insulting other peoples intelligence,mg1vb38,3.0,1j3c6go
comment,mfz44vj,Kvothetheraven603,,12,2025-03-04 15:36:54,,,,That cant be The stable genius told me that tariffs are paid by the other country and wouldnt raise prices for Americans,,0.0,1j3c6go
comment,mg4jcz3,PhaseThreeProfit,,2,2025-03-05 10:34:06,,,,Also that trade wars are good and easy to win,mfz44vj,1.0,1j3c6go
comment,mg0q5jt,Otherwise_Hunt7296,,12,2025-03-04 20:04:43,,,,These guys dont get it The middle class just wont buy things My mom was like Why dont you get a new fridge Well mom that would cause me to miss a car payment Her hmmm,,0.0,1j3c6go
comment,mfyxvsd,Chewy009x,,5,2025-03-04 15:06:32,,,,Its funny when people claim to hate Amazon but than shit on a competitor,,0.0,1j3c6go
comment,mg0mqsd,Noonan-87,,6,2025-03-04 19:48:58,,,,Irrelevant of the tariffs prices will go up Prices will go up and not come back down Same thing happened during covid with supply chains,,0.0,1j3c6go
comment,mfyy65t,ryan8551226,,5,2025-03-04 15:07:59,,,,Good thing after you own a TV and washing machine there isnt much left to buy there,,0.0,1j3c6go
comment,mg0mmlg,Agitated-Ad-504,,5,2025-03-04 19:48:26,,,,I admire Best Buys last man standing position Honestly I havent been to a Best Buy physically since 2012 How are they still in business,,0.0,1j3c6go
comment,mg0riye,Hiccup,,5,2025-03-04 20:11:07,,,,Theres going to be a black Wednesday tomorrow These tarrifs are essentially a gut punch to economy causing it to keel over Its a shot across the bow Its basically the sign to freeze all spending Trump just initiated the first domino towards not a recession but a depression,,0.0,1j3c6go
comment,mg6mn8j,wildcardmidlaner,,2,2025-03-05 17:55:55,,,,Im sure this wont affect me here in Europe right Guys,mg0riye,1.0,1j3c6go
comment,mg435jp,Joan_sleepless,,5,2025-03-05 07:47:13,,,,who tf still shops at best buy,,0.0,1j3c6go
comment,mg7flc5,S4L7Y,,3,2025-03-05 20:10:12,,,,People who dont live near Microcenters,mg435jp,1.0,1j3c6go
comment,mg5doha,redbeardgenmeme,,5,2025-03-05 14:16:07,,,,Highly likely and we are so excited weve been waiting for a reason to rip you off even more than ever,,0.0,1j3c6go
comment,mfyub95,KingXeiros,,22,2025-03-04 14:48:00,,,,Best Buy Best we can do is only raise the price 15 due to the extra 10 tarrifs,,0.0,1j3c6go
comment,mfz6v1o,downtimeredditor,,3,2025-03-04 15:49:44,,,,Corporate Price Gouging incoming lol,,0.0,1j3c6go
comment,mfzh6l7,Underp0pulation,,2,2025-03-04 16:37:20,,,,Even on items wo tariffs,,0.0,1j3c6go
comment,mfzxprw,Brother_Clovis,,4,2025-03-04 17:53:05,,,,Which makes me purchasing anything from there highly unlikely,,0.0,1j3c6go
comment,mg0ms0l,Meandtheworld,,3,2025-03-04 19:49:08,,,,Best Buys are closing left and right They better hold tight and keep those prices low,,0.0,1j3c6go
comment,mg0oejb,broke_boi1,,3,2025-03-04 19:56:37,,,,Surely this means wages will increase to offset this right Right,,0.0,1j3c6go
comment,mg0s0ft,TAC1313,,3,2025-03-04 20:13:20,,,,why should I have to suffer says every ceo ever,,0.0,1j3c6go
comment,mg11glt,New_Ad_3010,,4,2025-03-04 20:56:47,,,,Yeahhhhhh sure CEOs are seeing an opportunity to screw the public and hide behind tariffs Get ready for a massive surge in profits,,0.0,1j3c6go
comment,mg3wi9h,InsomniaticWanderer,,4,2025-03-05 06:44:49,,,,Theyre gonna have to change the name to just Buy,,0.0,1j3c6go
comment,mg3wqew,Ill_Flow9331,,4,2025-03-05 06:46:51,,,,A couple weeks ago Sony TVs increased in price 15 Ive been looking at purchasing a Sony Bravia 8 at Best Buy and keep waiting for that one big sale In January a 65 Bravia 8 cost 199999 169999 with the 300 sale Then February the base price is now 229999 with a sale price of 199999 F that noise,,0.0,1j3c6go
comment,mg3y2kn,DO_NOT_AGREE_WITH_U,,4,2025-03-05 06:58:50,,,,And when the tariffs disappear the prices will stay up,,0.0,1j3c6go
