type,id,author,title,score,created_utc,url,num_comments,subreddit,body,parent_id,depth,post_id
post,1jqdioj,diacewrb,Tiny Pacemaker Dissolves When No Longer Needed: The new device is smaller than a grain of rice and can be injected by syringe,1731,2025-04-03 09:00:08,https://www.reddit.com/r/gadgets/comments/1jqdioj/tiny_pacemaker_dissolves_when_no_longer_needed/,58.0,gadgets,,,,
comment,ml6lsgf,graveyardspin,,431,2025-04-03 11:31:08,,,,Tiny Pacemaker dissolves when you miss an insurance payment,,0.0,1jqdioj
comment,ml6mw5f,None,,85,2025-04-03 11:39:28,,,,Damn now even the repo men are losing their jobs,ml6lsgf,1.0,1jqdioj
comment,ml7c4v0,FalxCarius,,28,2025-04-03 14:14:26,,,,Now Im picturing a repo man ripping someones heart out like an Aztec priest,ml6mw5f,2.0,1jqdioj
comment,ml7fx7h,trainbrain27,,36,2025-04-03 14:33:32,,,,Yes thats the Genetic Opera,ml7c4v0,3.0,1jqdioj
comment,ml8h274,Dysfunxn,,11,2025-04-03 17:35:40,,,,Incredible movie,ml7fx7h,4.0,1jqdioj
comment,ml8ti75,McMatey_Pirate,,7,2025-04-03 18:36:39,,,,Definitely for a niche audience but its also one of my favourites Legal assassin Is easily my favourite song in the movie and so intense watching him sing and devolve into his evil alter ego to do his job,ml8h274,5.0,1jqdioj
comment,ml9jc06,Majestc_electric,,4,2025-04-03 20:43:45,,,,Temple of Doom style gifgiphyyKyJYTW7HAYGSKyoEgdownsized,ml7c4v0,3.0,1jqdioj
comment,ml9wgw6,kevlarus80,,3,2025-04-03 21:52:20,,,,KALI MA,ml9jc06,4.0,1jqdioj
comment,mlcer3f,GrimeyJosh,,3,2025-04-04 08:52:35,,,,Lol theres actually a movie called Repo Men where they repo peoples body parts when they cant pay Repo Men 2010 trailer Its a pretty decent movie,ml7c4v0,3.0,1jqdioj
comment,mlbfg5b,GroundbreakingUse794,,1,2025-04-04 03:31:48,,,,Reaper man,ml6mw5f,2.0,1jqdioj
comment,ml6tgnc,ShosMoon,,14,2025-04-03 12:25:34,,,,Repo the genetic opera anyone,ml6lsgf,1.0,1jqdioj
comment,ml73rin,WolfMaggot,,11,2025-04-03 13:28:43,,,,Zydrate comes in a little glass vial available at a pharmacist nearby you soon,ml6tgnc,2.0,1jqdioj
comment,ml7uydb,TinanasaurusRex,,9,2025-04-03 15:47:20,,,,A little glass vial,ml73rin,3.0,1jqdioj
comment,ml8brn8,WolfMaggot,,8,2025-04-03 17:10:08,,,,A little glass vial And the little glass vial goes into the gun like a battery,ml7uydb,4.0,1jqdioj
comment,ml8igh5,TinanasaurusRex,,2,2025-04-03 17:42:24,,,,Does it press against my anatomy,ml8brn8,5.0,1jqdioj
comment,ml9w6f0,Aphroditesent,,2,2025-04-03 21:50:44,,,,Anatomy,ml8igh5,6.0,1jqdioj
comment,ml9ueue,kurotech,,1,2025-04-03 21:41:16,,,,Also just Repo men is a great movie where they do the same,ml6tgnc,2.0,1jqdioj
comment,ml6o6u1,Big_Pair_75,,4,2025-04-03 11:48:54,,,,That gave me a sensible chuckle Good one,ml6lsgf,1.0,1jqdioj
comment,ml8hywo,Vallereya,,1,2025-04-03 17:40:03,,,,Anyone remember the movie Repo Men,ml6lsgf,1.0,1jqdioj
comment,ml7comd,sonic10158,,1,2025-04-03 14:17:12,,,,Tiny Pacemaker dissolves when you upvote a reddit comment mentioning the name Luigi,ml6lsgf,1.0,1jqdioj
comment,ml7y0t4,Roseartcrantz,,63,2025-04-03 16:02:25,,,,gifgiphyAxVvk3UlCVPiPxtGLKdownsized,,0.0,1jqdioj
comment,ml8ulc2,MojoJojoSF,,14,2025-04-03 18:41:58,,,,I was reading in Bill Brysons book The Body that the first pacemaker was about the size of a deck of cards The first person who got it outlived the two developers I think he had something like twenty six different versions by the time he passed Last one being the size of a quarter,,0.0,1jqdioj
comment,ml6bw4z,LazarouDave,,105,2025-04-03 10:06:20,,,,This news is only gonna embolden the Antivaxxers isnt it Especially the THEYRE PUTTIN MICROCHIPS IN OUR BLOOD types,,0.0,1jqdioj
comment,ml6jtm9,AnalBloodTsunami,,72,2025-04-03 11:15:50,,,,Everything emboldens them Theyre delusional and live their entire lives through the lens of confirmation bias They dont have the critical thinking skills to realize that they lack critical thinking skills,ml6bw4z,1.0,1jqdioj
comment,ml9064p,Atomix117,,10,2025-04-03 19:09:51,,,,Everything is a conspiracy if you dont understand how anything works,ml6jtm9,2.0,1jqdioj
comment,mlacjai,asanti0,,2,2025-04-03 23:24:45,,,,Removed by Reddit,ml6bw4z,1.0,1jqdioj
comment,mladyct,LazarouDave,,2,2025-04-03 23:33:13,,,,Problem is by not vaccinating they risk diseases that have been long gone coming back the fact there are cases of the Black Death recently should be concerning enough we might well be fucked if that spreads again,mlacjai,2.0,1jqdioj
comment,mld6r5d,klef25,,1,2025-04-04 12:49:20,,,,Its curable with antibiotics now so not as big a deal,mladyct,3.0,1jqdioj
comment,ml71g23,Tasty-Traffic-680,,33,2025-04-03 13:15:18,,,,Sounds like the CIA heart attack gun except the opposite,,0.0,1jqdioj
comment,ml79rxh,SUPRVLLAN,,4,2025-04-03 14:02:06,,,,Mossad has entered the chat,ml71g23,1.0,1jqdioj
comment,ml91m81,Wiknetti,,5,2025-04-03 19:17:08,,,,gifgiphyKcPKR0SbNU7j25rJ6Ydownsized Youre telling me a shrimp fried my pacemaker,,0.0,1jqdioj
comment,ml7smj1,dtwhitecp,,9,2025-04-03 15:36:02,,,,I dont understand how this dissolves without creating some shit in your bloodstream that you do not want flowing around in there There must be some treatment where they can use an embolic catcher,,0.0,1jqdioj
comment,ml89vb0,cstar4004,,16,2025-04-03 17:00:44,,,,Article says its made of biodegradable materials which creates an electrical charge when contacting body fluids so no battery or power source is needed The material reacts to Infrared Light which triggers it to discharge the energy and generates a heart beat Being controlled by light means they dont need an antenna to receive signal The materials for the Battery and antenna definitely would have left something behind in the body It does not say WHAT the materials are however,ml7smj1,1.0,1jqdioj
comment,ml9bvvw,dtwhitecp,,1,2025-04-03 20:07:36,,,,yeah even if its biodegradable that doesnt mean 100 bioabsorbable,ml89vb0,2.0,1jqdioj
comment,ml9il79,SeventhSolar,,6,2025-04-03 20:40:07,,,,Doesnt matter if it breaks down into your bloodstream your liver will filter it into your waste,ml9bvvw,3.0,1jqdioj
comment,mla8w75,ufovalet,,8,2025-04-03 23:03:42,,,,Paper says A bioresorbable magnesium Mg alloy AZ31 Mg96Al3Zn1 foil or a zinc Zn composite 16 mm 16 mm serves as the anode and a more electropositive bioresorbable molybdenum trioxide MoO3 composite 16 mm 16 mm serves as the cathode In particular the anode and cathode connect to the emitter and the collector terminals of the phototransistor respectively using a biodegradable conductive paste Candelilla waxtungsten W powder A bioresorbable formulation of polyanhydride or wax encapsulates the entire structure,ml9il79,4.0,1jqdioj
comment,mlaqi0f,dtwhitecp,,-2,2025-04-04 00:50:02,,,,sure but it can do damage before that Small particles can catch on already restricted blood vessels not uncommon if you need a pacemaker Seems like theyre not concerned with this,ml9il79,4.0,1jqdioj
comment,ml74ofg,tylersixxfive,,7,2025-04-03 13:33:58,,,,Free in the rest of the world 8 million shillings in the US calling it now,,0.0,1jqdioj
comment,mlbcf7g,Okayesttt,,1,2025-04-04 03:10:31,,,,Yep My thought exactly Amazing device for the few able to drop a few hundred thousand without issue,ml74ofg,1.0,1jqdioj
comment,ml9jlxu,AloofCommencement,,2,2025-04-03 20:45:06,,,,Nanomachines son,,0.0,1jqdioj
comment,mm4zdxv,goldaxis,,1,2025-04-09 01:23:24,,,,That settles the question of paranoia,,0.0,1jqdioj
comment,mokaw71,itsyaboydarrell,,1,2025-04-23 05:43:54,,,,When no longer needed normally means dead right,,0.0,1jqdioj
comment,ml6a2v1,Next_Loan_1864,,1,2025-04-03 09:48:12,,,,Dont go breaking my heartbaby,,0.0,1jqdioj
comment,ml7ryq4,None,,0,2025-04-03 15:32:50,,,,Too bad no one will be able to afford it,,0.0,1jqdioj
comment,ml93yed,toddkaufmann,,0,2025-04-03 19:28:47,,,,Dammit I dropped my pacemaker somewhere in my rice,,0.0,1jqdioj
comment,ml766ez,None,,-6,2025-04-03 13:42:25,,,,For who Its all about the who getting it,,0.0,1jqdioj
