type,id,author,title,score,created_utc,url,num_comments,subreddit,body,parent_id,depth,post_id
post,1jtozpr,chrisdh79,"Switch 2 joysticks won’t use Hall effect sensors to avoid stick drift | But Nintendo promises ""redesigned"" Joy-Cons are ""smoother"" and ""more reliable.""",1627,2025-04-07 16:08:20,https://www.reddit.com/r/gadgets/comments/1jtozpr/switch_2_joysticks_wont_use_hall_effect_sensors/,282.0,gadgets,,,,
comment,mlw30yq,arthurdentstowels,,1205,2025-04-07 16:59:25,,,,Trust me bro this is driftless plastic,,0.0,1jtozpr
comment,mlw98sx,FewHorror1019,,15,2025-04-07 17:30:44,,,,The plastic wasnt even the issue,mlw30yq,1.0,1jtozpr
comment,mlw9zwh,PashaB,,6,2025-04-07 17:34:27,,,,Didnt the plastic gears wear down over time and cause drift I got drift on my pro controller and disassembled it I sprayed contact cleaner into the little joystick box with 2 plastic gears It worked but I imagine theyll wear down eventually,mlw98sx,2.0,1jtozpr
comment,mlwagch,Henry-What,,39,2025-04-07 17:36:40,,,,Nah theres a little graphene sensor in the joycon that gets completely rubbed away from friction no matter what Thats where the drift will come from,mlw9zwh,3.0,1jtozpr
comment,mm2uc88,PashaB,,1,2025-04-08 18:35:20,,,,Oh wow yeah that makes so much more sense Why am I cleaning plastic gears with contact cleaner anyway I see so it worked cuz it cleaned the graphene sensor I was following directions without really thinking I guess I would use isopropyl to clean the gears if needed,mlwagch,4.0,1jtozpr
comment,mm2uvxm,Henry-What,,3,2025-04-08 18:37:58,,,,Yeah the simplest fix for the graphene sensor is to stuff cardboard under it so the sensors touch again,mm2uc88,5.0,1jtozpr
comment,mlwahdb,FewHorror1019,,8,2025-04-07 17:36:49,,,,Its the contact between the circuit and the sticks wearing out Graphite and metal,mlw9zwh,3.0,1jtozpr
comment,mlwavfb,soulsoda,,-7,2025-04-07 17:38:43,,,,Yeah idk what they are on about plastic degrading and leaving bits behind is almost always the issue with drift,mlw9zwh,3.0,1jtozpr
comment,mlwhx07,Suckage,,1,2025-04-07 18:13:45,,,,Tell that to the turtles,mlw98sx,2.0,1jtozpr
comment,mlys6ve,prey169,,2,2025-04-08 01:51:06,,,,Now Money please,mlw30yq,1.0,1jtozpr
comment,mmpnbcq,MarlonShakespeare2AD,,1,2025-04-12 10:33:08,,,,So Good for submersibles or not good for submersibles,mlw30yq,1.0,1jtozpr
comment,mlwafdf,cat_prophecy,,147,2025-04-07 17:36:32,,,,Switch controllers are real pieces of shit for how much they cost Even replacing the sticks is a pain because if you look at one of the ribbon cables wrong it breaks inside,,0.0,1jtozpr
comment,mm7f41k,Dracekidjr,,1,2025-04-09 13:09:28,,,,I didnt mind the ribbon cables but the battery plug is designed to break They fucking skeletonized the thin plastic,mlwafdf,1.0,1jtozpr
comment,mlvvp3n,ghrayfahx,,439,2025-04-07 16:21:53,,,,Just when I thought I was out They push me further out,,0.0,1jtozpr
comment,mlw5hk9,DavidinCT,,28,2025-04-07 17:12:01,,,,I hear that,mlvvp3n,1.0,1jtozpr
comment,mlxnhjb,PornstarVirgin,,8,2025-04-07 21:50:47,,,,I used candycon for my switch they have hall and are customizable,mlvvp3n,1.0,1jtozpr
comment,mlylv4k,rabidsalvation,,2,2025-04-08 01:12:43,,,,Do they have gyro,mlxnhjb,2.0,1jtozpr
comment,mlyth5v,PornstarVirgin,,3,2025-04-08 01:58:50,,,,Yeah its basically designed as a switch controller but it also works on pc I made mine look like pikachu because all buttons and triggers can be customized,mlylv4k,3.0,1jtozpr
comment,mm3t8o4,akeean,,0,2025-04-08 21:24:48,,,,Flydigi Vader 4 Pro works on PC android Switch HAL sensors 4 back buttons triggers can be switched from analog to digital mode that have short travel shoulder and trigger digital buttons ABXY and DPad are microswitches plus you get 2 more buttons under your right thumb joint that you can remap to any other button ie press joystick in change deadzones I use 0 dead zone and change sensitivity response of the sticks individually profiles save on the gamepad so you only need to set it up once on a PC and the software supports custom profiles Even lets you change the joystick centering force per stick without tools twist the ring around the base of the stick and has gyro too They also sell a charging station for it to save life on the USBC port sticks with alternate stem length and a mount to attach your phone to it very nice for Gamepass remote play By far the best gamepad I ever used,mlxnhjb,2.0,1jtozpr
comment,mm16d7f,joostdemen,,2,2025-04-08 13:38:30,,,,OH MADONE,mlvvp3n,1.0,1jtozpr
comment,mlvtpt6,notred369,,174,2025-04-07 16:11:44,,,,hell yeah love ewaste,,0.0,1jtozpr
comment,mlvu4ms,scruffles87,,17,2025-04-07 16:13:48,,,,Its part of a balanced breakfast,mlvtpt6,1.0,1jtozpr
comment,mlxz2we,Melancholoholic,,0,2025-04-07 22:57:11,,,,Delicious and piping hot in only 3 microwave minutes,mlvu4ms,2.0,1jtozpr
comment,mlw4uqq,None,,60,2025-04-07 17:08:45,,,,gifgiphy6JB4v4xPTAQFidownsized,,0.0,1jtozpr
comment,mlwfl0p,Kamakaziturtle,,110,2025-04-07 18:01:54,,,,I mean if they actually do up the quality then its fine The drift issue isnt due to not using Hall Effect its due to how cheap hardware is these days That said I will believe it when I see it Not just against Nintendo either seems like all of em are cutting corners these days,,0.0,1jtozpr
comment,mlwmda3,DudesworthMannington,,39,2025-04-07 18:36:37,,,,Its not that theres no drift its just the drift its smoother and more reliable,mlwfl0p,1.0,1jtozpr
comment,mlwphhe,Qwirk,,31,2025-04-07 18:52:26,,,,Hall Effect controllers use magnets rather than mechanical parts Its literally the issue causing drift No matter how expensive the parts are they will be subject to wear,mlwfl0p,1.0,1jtozpr
comment,mlwrlrk,Kamakaziturtle,,31,2025-04-07 19:03:14,,,,Potentiameters are fine the issue is how cheap the hardware is A Joystick in general is prone to wear and tear theres a lot of moving parts and all of them will degrade over time The issue with drift is just due to overall lack of quality that is causing these parts to fail much faster than the rest of the joystick Its the current weakest link Hall effect removes said link altogether which can obviously help But improving the potentiameter hardware so it lasts as long as the rest of the joystick would have the same effect on the longevity of the joystick,mlwphhe,2.0,1jtozpr
comment,mlxyzx8,yogopig,,0,2025-04-07 22:56:42,,,,Then why are the pots in EVERY controller failing irrespective of manufacturer,mlwrlrk,3.0,1jtozpr
comment,mly223g,Kamakaziturtle,,9,2025-04-07 23:14:01,,,,They dont There are plenty of high quality manufactures out there that make good quality controllers that dont fail Unfortunately Sony Microsoft and Nintendo arent one of them Because Sony Microsoft and Nintendo dont make the pots The two big manufacturers are Favor Union and Alps Alpine Sony Microsoft and Nintendo all use both FU and ALPS in their controllers Both of these companies make pretty cheap pots The three console giants use them because they are dirt cheap Surprise surprise the answer for why manufacturers are doing something anticonsumer is Because Money,mlxyzx8,4.0,1jtozpr
comment,mlwt9f4,WhySpongebobWhy,,-9,2025-04-07 19:11:55,,,,Same effect at a significantly higher cost than just using established hall effect technology RD costs money,mlwrlrk,3.0,1jtozpr
comment,mlwub9f,Kamakaziturtle,,18,2025-04-07 19:17:23,,,,What RD Its not new technology controllers have been using potentiameters for decades The reason why its become such a big issue as of late is them cutting corners to cut costs,mlwt9f4,4.0,1jtozpr
comment,mlwuiki,WhySpongebobWhy,,-17,2025-04-07 19:18:27,,,,Bro YOU literally said improving the potentiameter hardware How in Gods greenest fuck do you propose improvements be made without RD Thats literally how you make improvements to existing hardware,mlwub9f,5.0,1jtozpr
comment,mlwvkk1,Kamakaziturtle,,12,2025-04-07 19:23:57,,,,By doing what they used to do Sometimes rolling back a design is an improvement especially in the modern era This isnt new technology it exists and has been implemented in the past They just made a decision to use cheaper materials,mlwuiki,6.0,1jtozpr
comment,mlxphhk,TotoCocoAndBeaks,,4,2025-04-07 22:01:55,,,,They just needed to not use such a cheap one No r and d necessary,mlwuiki,6.0,1jtozpr
comment,mlzg2qz,nero40,,1,2025-04-08 04:35:03,,,,The joysticks in the old JoyCons was a low quality one that they had to use in order to fit a joystick in such a small space that the JoyCons had Thats the problem it wasnt good joysticks to begin with By going back to established joystick designs that arent so easily prone to wear and tear we MIGHT see an improvement in joystick durability in the Switch 2s JoyCons We shall see how Nintendos claims of higher durability works in the future when we finally get the device in hand to test,mlwuiki,6.0,1jtozpr
comment,mlwshvx,popupsforever,,9,2025-04-07 19:07:54,,,,The vast majority of controllers going back to the dawn of the analog stick dont use hall effect sensors and dont have widespread problems with stick drift Its not a fundamental problem with mechanical analog sticks its a problem with Nintendos and Microsoft and Sony to a lesser extent shit design and part quality in the modern era,mlwphhe,2.0,1jtozpr
comment,mlxz39c,yogopig,,-2,2025-04-07 22:57:14,,,,Yes they do Its absolutely a fundamental design flaw,mlwshvx,3.0,1jtozpr
comment,mlwyk0p,eestionreddit,,2,2025-04-07 19:39:31,,,,Nintendo was using good pots back in the Gamecube and Wii days Ive heard very few cases of those drifting,mlwphhe,2.0,1jtozpr
comment,mlx2vxm,nullKomplex,,7,2025-04-07 20:01:52,,,,I had multiple gamecube controllers with drift I used to think it was fun sliding along super slowly in smash bros without my hands on the controller even,mlwyk0p,3.0,1jtozpr
comment,mlxky4r,rpkarma,,6,2025-04-07 21:36:53,,,,GameCube controllers absolutely drift haha,mlwyk0p,3.0,1jtozpr
comment,mlxywp4,yogopig,,0,2025-04-07 22:56:11,,,,This is just incorrect,mlwfl0p,1.0,1jtozpr
comment,mly2ng8,Kamakaziturtle,,2,2025-04-07 23:17:23,,,,Youre welcome to elaborate Do tell me how theres no difference between an ALPS potentiometer and one from CH Products,mlxywp4,2.0,1jtozpr
comment,mlyxv3d,yogopig,,0,2025-04-08 02:26:02,,,,I cant dont know anything about that I have seem every potentiometer controller I have ever had for the last 20 years get stick drift however and have not seen one example of a hall effect or TMR stick get drift,mly2ng8,3.0,1jtozpr
comment,mlw41ap,Kevo1110,,21,2025-04-07 17:04:36,,,,Yeah thats a no from me dawg,,0.0,1jtozpr
comment,mlvz5vt,vgiz,,30,2025-04-07 16:39:45,,,,Cant tariff that great news,,0.0,1jtozpr
comment,mlvzpj9,littlerelaxation,,3,2025-04-07 16:42:37,,,,yet,mlvz5vt,1.0,1jtozpr
comment,mlyhhdp,Lyin-Oh,,0,2025-04-08 00:45:56,,,,1 improvement is still improvement I guess,mlvz5vt,1.0,1jtozpr
comment,mlwe9l6,InspectorTroy,,11,2025-04-07 17:55:22,,,,Were still trying to catch up to the Dreamcast controller,,0.0,1jtozpr
comment,mlycb55,parentheticalme,,4,2025-04-08 00:14:23,,,,Were sill trying to catch up to the Dreamcast FIFY,mlwe9l6,1.0,1jtozpr
comment,mlw9s9x,Zachsjs,,13,2025-04-07 17:33:23,,,,This title isnt very clear if you dont know how Hall effect sensors work At first I interpreted it as meaning to avoid stick drift Nintendo wont use Hall effect sensors,,0.0,1jtozpr
comment,mly4m0d,Death2RNGesus,,9,2025-04-07 23:28:45,,,,Considering Nintendo should have done a recall on the switch 1s piece of crap sticks I have little faith that they will fix the issue,,0.0,1jtozpr
comment,mm1rykn,TheGreatGamer1389,,0,2025-04-08 15:29:55,,,,So another lawsuit then,mly4m0d,1.0,1jtozpr
comment,mlwsl9n,dos_user,,6,2025-04-07 19:08:23,,,,Im sure the JoyCons being magnetically attached prevented them from using Hall effect sticks Anyway if its anything like Xboxs sticks Ill be fine,,0.0,1jtozpr
comment,mlwf43w,Ouibeaux,,8,2025-04-07 17:59:33,,,,How about ergonomic,,0.0,1jtozpr
comment,mlwys33,Neo_Techni,,10,2025-04-07 19:40:40,,,,best we can do is not make it as sharp as a NES controller,mlwf43w,1.0,1jtozpr
comment,mlz4deb,trantaran,,6,2025-04-08 03:08:35,,,,I use my nes controller to cut meat,mlwys33,2.0,1jtozpr
comment,mly6rwp,Master_Bruce,,7,2025-04-07 23:41:18,,,,Didnt they also routinely say there was no stick drift in Switch 1s joy cons,,0.0,1jtozpr
comment,mly5nb9,SquinkyEXE,,4,2025-04-07 23:34:46,,,,90 by the way,,0.0,1jtozpr
comment,mlz4myq,trantaran,,0,2025-04-08 03:10:22,,,,The extra 10 goes to the free repair cost hypotheically when you send them in for repair,mly5nb9,1.0,1jtozpr
comment,mlwd6t6,ilikepugs,,5,2025-04-07 17:50:04,,,,more reliable ah yes the highest of bars,,0.0,1jtozpr
comment,mlyga63,None,,3,2025-04-08 00:38:39,,,,I dont get it Ppl used to joke about nintendium Hall effects cant be more expensive than when the damn Dreamcast used one Its already gonna cost 110 per pair I bet,,0.0,1jtozpr
comment,mlwcs6u,SensibleCircle,,7,2025-04-07 17:48:06,,,,Lets say theyre 100 more reliable Thats still shit,,0.0,1jtozpr
comment,mlwfm6h,KenshinDreamz5516,,2,2025-04-07 18:02:04,,,,Lets see how things look a few months into it,,0.0,1jtozpr
comment,mlxpzci,oureux,,2,2025-04-07 22:04:47,,,,I dont believe them Why not go the extra mile to save themselves future recalls and lawsuits I bet they also rose the prices for joycon pairs,,0.0,1jtozpr
comment,mlxvjh6,Dhegxkeicfns,,2,2025-04-07 22:36:55,,,,At least someone will make aftermarket good ones,,0.0,1jtozpr
comment,mm0p1wr,wintersdark,,2,2025-04-08 11:47:58,,,,I loved my switch but I went through so many joycons Not willing to do that again But at least the Switch was pretty cheap Replacement joycons certainly werent but at least the switch was If the Switch 2 was also inexpensive Id be les annoyed here but at that price tag its like 750cdn I expected better Maybe Im wrong and theyve got some magic way to prevent this problem AND not have wide deadzones and low sensitivity but Somehow I doubt it,,0.0,1jtozpr
comment,mm3752f,_Spastic_,,2,2025-04-08 19:38:54,,,,Former Nintendo employee The plural of Joycon is Joycon I still hate it 5 years later,,0.0,1jtozpr
comment,mm45fav,EnolaGayFallout,,2,2025-04-08 22:30:27,,,,So that it can sell you another pair of joy con every year Free 99,,0.0,1jtozpr
comment,mm51a7j,Immoracle,,2,2025-04-09 01:34:41,,,,Wow they are actually acknowledging their flawed design,,0.0,1jtozpr
comment,mm5kxra,rjksn,,2,2025-04-09 03:36:40,,,,Meh Games are loco pricey,,0.0,1jtozpr
comment,mm761q8,prick-in-the-wall,,2,2025-04-09 12:13:32,,,,Am I missing something Switch one had nonhall effect joysticks and has stick drift issues and now theyre saying switch2 will not have a hall effect joysticks to avoid drift issues,,0.0,1jtozpr
comment,mlw02w2,patinhat,,5,2025-04-07 16:44:32,,,,We wont be able to play it anyway,,0.0,1jtozpr
comment,mlw4pmt,tfinx,,3,2025-04-07 17:08:03,,,,Well thats disappointing Whose joycons didnt start eventually drifting Ive bought a few hall stick controllers a lot from 8bitdo and damn do they hold up well and are way more affordable than Nintendos controllers Even the switch pro controller had meh sticks Im doubting the quality of whatever they promise but I guess well see when its in our hands,,0.0,1jtozpr
comment,mlw5i1w,AlbiFoxtrot,,3,2025-04-07 17:12:05,,,,I hit the lottery with joycons One instance of drift in my two pairs and that was solved with a calibration Got my switch at launch too Maybe Im light fingered or something,mlw4pmt,1.0,1jtozpr
comment,mlw8h8f,Dt2_0,,3,2025-04-07 17:26:58,,,,I have 2 pairs that have never had drifting issues,mlw5i1w,2.0,1jtozpr
comment,mlwlo6f,LAMProductions99,,2,2025-04-07 18:32:57,,,,Ya Ive been lucky too Got my switch at launch and didnt use a different pair of joycons until I got the ACNH switch in 2020 The only other controller I had up to that point was the pro controller that I got alongside SSBU and even then I still played in handheld mode a lot I still have those original joycons and they havent drifted yet None of the joycons I have have done it,mlw5i1w,2.0,1jtozpr
comment,mlwks1a,whatnowwproductions,,2,2025-04-07 18:28:22,,,,The latest batch I purchased seem to have no issues,mlw4pmt,1.0,1jtozpr
comment,mlwa1uz,yhzh,,0,2025-04-07 17:34:43,,,,My launch joy cons are still fine but Ive hardly used them since I got a pro controller several years ago Ive never had a controller develop significant drift but Ive had a lot of controllers to spread my usage and keep I them pretty cleandust free,mlw4pmt,1.0,1jtozpr
comment,mlw622l,DavidinCT,,1,2025-04-07 17:14:53,,,,Nintendo being cheap and over charging remember in Japan they are getting an exclusive Switch 2 that will be 330 but everyplace else in the world has to pay 450 at least,,0.0,1jtozpr
comment,mlwad8n,PashaB,,4,2025-04-07 17:36:15,,,,Thats to combat scalpers and people abusing the yen currency,mlw622l,1.0,1jtozpr
comment,mlw953w,RegularVega,,4,2025-04-07 17:30:13,,,,And you conveniently choose to Ignore regionlocked part,mlw622l,1.0,1jtozpr
comment,mlw9yi1,joestaff,,-7,2025-04-07 17:34:15,,,,I imagine that doesnt really matter for folks who live in the region that its locked to Consoles have been region locked since even the NES days or earlier Never effected anyone then Granted Im old now and losing touch but I doubt a region lock would effect a gamer more than a 25 discount,mlw953w,2.0,1jtozpr
comment,mlwhz9f,sevenut,,3,2025-04-07 18:14:05,,,,It wasnt really a thing for regular consumers to import gamesconsoles back then unless you were rich There were also technological barriers that made region locking a thing,mlw9yi1,3.0,1jtozpr
comment,mlwdo8o,Akrevics,,3,2025-04-07 17:52:27,,,,Joycons were reliable too we could always rely on them getting stick drift sooner or later,,0.0,1jtozpr
comment,mlxwvep,ZachTheCommie,,2,2025-04-07 22:44:40,,,,If the new controllers drift anyway Im taping them to a brick and throwing it through Nintendos window,,0.0,1jtozpr
comment,mly8orf,Anxious_Breakfast_14,,1,2025-04-07 23:52:35,,,,If authorities question you just say you werent aiming for their windows the drift in the brick altered its course,mlxwvep,1.0,1jtozpr
comment,mlw0oig,kaishinovus,,1,2025-04-07 16:47:36,,,,Welp the tariffs didnt do that,,0.0,1jtozpr
comment,mlwqktv,er-day,,0,2025-04-07 18:57:58,,,,I mean theyre cutting corners in a down economy to save on cost and price for the end user It kinda did do that,mlw0oig,1.0,1jtozpr
comment,mlwuaew,kaishinovus,,0,2025-04-07 19:17:16,,,,The switch 2 has been in development for a while The decision to not use hall effect joysticks was made well before the last 6 months So no it kinda didnt do that,mlwqktv,2.0,1jtozpr
comment,mlwc153,Ticaticai,,1,2025-04-07 17:44:23,,,,Do not break one could cost you 400to replace,,0.0,1jtozpr
comment,mlw4myp,Ab47203,,-2,2025-04-07 17:07:40,,,,This was obvious to anyone paying attention The magnetic connection system makes it basically impossible without interference Were not just not getting them We cant put aftermarket ones in anymore Edit goddamn this is an echo chamber Magnets an inch or two from the thumbstick are going to be an issue if the magnets are strong enough to hold the ENTIRE CONSOLE up Thinking it wont be an issue is cope Theres a reason they didnt put hall effect sticks in the joycons In response Ive had one person start slinging insults and tons of people questioning the exact data which does NOT exist yet Its basic logic if magnets in that spot mess with my hall effect joycons then itll mess with the switch 2 if it had hall effect Guess what I just tested Thats right It drags my character to the right when I put a magnet on the side of the switch where the connectors on the switch 2 are Can I calibrate it away Yes When I remove the controller from the console it needs another recalibrating Almost like I KNEW WHAT I WAS TALKING ABOUT BECAUSE IVE BEEN USING HALL EFFECT AND TMR STICKS FOR YEARS,,0.0,1jtozpr
comment,mlwaxsk,Harflin,,8,2025-04-07 17:39:04,,,,Do you have any details that suggest the proximity of the magnets would interfere with said halleffect sensors,mlw4myp,1.0,1jtozpr
comment,mlwc0t9,Eric1180,,8,2025-04-07 17:44:21,,,,He doesnt because hes making shit up see my comment response to his original statement Hall sensors would have zero issues working near the magnetic rails Its a known interference which can easily be cancelled out Just like how we cancel out the earths magnetic field on other hall sensors,mlwaxsk,2.0,1jtozpr
comment,mlx1k7o,Ab47203,,1,2025-04-07 19:54:57,,,,If it was constant sure It means youll be recalibrating EVERY time you disconnect the controllers or reconnect them,mlwc0t9,3.0,1jtozpr
comment,mlx1pl4,Ab47203,,2,2025-04-07 19:55:43,,,,Either theyre strong enough to interfere or the weight of the console being supported entirely by the magnets is another big issue,mlwaxsk,2.0,1jtozpr
comment,mlx95rn,Harflin,,1,2025-04-07 20:34:05,,,,Im looking for something a bit more verifiable than just a statement of theyd interfere,mlx1pl4,3.0,1jtozpr
comment,mm0s0y7,Ab47203,,2,2025-04-08 12:09:02,,,,Unfortunately theres not exactly confirmation on the magnet strength Logic would lead almost anyone to believe that a magnet strong enough to hold the console up strong enough they only used them on one side then its strong enough at an inch or two away to interfere with the magnets in the hall effect stick Would likely mostly be an issue on the left controller Edit tested on my switch 1 and magnets an inch or two from the hall effect sticks I put in my joycons do indeed start interfering It needs recalibrating when removed from the console too,mlx95rn,4.0,1jtozpr
comment,mlwbf85,Eric1180,,20,2025-04-07 17:41:24,,,,Thats complete bullshit I am an electrical engineer Hall sensor avoids interference by simply normalizes outside influences Having a magnetic field next to a hall sensor doesnt make it IMPOSSIBLE to cancel out interference If that were true nothing would work due to the earths magnetic field Dont talk out of your ass,mlw4myp,1.0,1jtozpr
comment,mlwuqjh,TheBoBiZzLe,,2,2025-04-07 19:19:36,,,,Interesting Is that the same with say gamesirs mag res tmr sticks Always assumed that a strong magnet like the ones holding joycons on could pull on something somewhere Kinda reminds me of the new MacBook connections and those are pretty sturdy Also remember seeing a video of when gulikits first started on the switch and people had to use external magnets to calibrate them But guess those did go like right up on them,mlwbf85,2.0,1jtozpr
comment,mm2853o,Ab47203,,3,2025-04-08 16:50:05,,,,I tested it with my switch hall effect sticks The magnet the same distance as it would be on the switch 2 makes the left thumbstick start pulling to the right It would need recalibrating every time its disconnected or reconnected to avoid this especially if the magnets to hold the controllers on the console are so few Four in total and no matching magnet on the other side No hardware connection points Those magnets are going to be POTENT and I would be shocked if you couldnt just stick the switch 2 to a fridge Not exactly what I would call usable needing to recalibrate the controllers every time you connect or disconnect them from the console,mlwuqjh,3.0,1jtozpr
comment,mlx2buh,Ab47203,,4,2025-04-07 19:58:56,,,,It would change the magnetic field EVERY time you disconnect or reconnect the controllers If anyone is talking out of their ass its you A magnet near sensors that RELY on magnets to function not interfering is insane levels of cope If its not strong enough to interfere then how would FOUR of said magnets be all that holds the two controllers to the console It would fall off at the drop of a hat Maybe instead of slinging insults you could try talking next time As it is you opened the conversation with the equivalent of THIS DUDES A STUPID FUCKIN ASSHOLE MAKING SHIT UP and I dont care to continue talking to you,mlwbf85,2.0,1jtozpr
comment,mlw6kwy,yayitsdan,,6,2025-04-07 17:17:28,,,,I was wondering if the magnetic rail system might making it impossible but Id love to see a third party take a crack at it,mlw4myp,1.0,1jtozpr
comment,mlwjz87,lodemeup,,1,2025-04-07 18:24:18,,,,Will the sticks be as easy to replace as the Switch 1s were By the time drift starts happening Ill plan to replace them with Hall effect ones,,0.0,1jtozpr
comment,mlx4ie5,CaseyAnthonysMouth,,1,2025-04-07 20:10:22,,,,These mfers gonna cost 100 they should have a replacement program,,0.0,1jtozpr
comment,mlxf11p,No0oo0Ooo,,1,2025-04-07 21:04:40,,,,Fuck you Nintendo,,0.0,1jtozpr
comment,mlxfjbd,XuX24,,1,2025-04-07 21:07:23,,,,I have a controller that I got in November and is already drifting Im thinking of getting a third party controller with He just to avoid this I hate that none of the 3 companies that make consoles make hall effect sticks I still dont know how some dodgy law firm hasnt went at them for this,,0.0,1jtozpr
comment,mlxggx7,rasz_pl,,1,2025-04-07 21:12:26,,,,500 but you peons dont deserve two 1 sensors,,0.0,1jtozpr
comment,mlxlbq9,deadgirlrevvy,,1,2025-04-07 21:38:59,,,,Jesus Fucking Nintendo man The balls on them must be solid brass and the size of bowling balls Nonhall effect sticks in 2025at the pricepoint they are asking for it Thats beyond insulting Especially given how dogshit the swith 1s joysticks were You couldnt GIVE me a Switch 2 unless I could scalp it to some sucker willing to pay above retail,,0.0,1jtozpr
comment,mlxn1eh,humanman42,,1,2025-04-07 21:48:18,,,,I hope so every single joystick on every single Nintendo product from the switch has drifted first and 3rd party,,0.0,1jtozpr
comment,mlznvy1,Tttutter,,1,2025-04-08 05:44:00,,,,Im still mad about my 4 drifting joysticks Ill never buy the Switch2,,0.0,1jtozpr
