type,id,author,title,score,created_utc,url,num_comments,subreddit,body,parent_id,depth,post_id
comment,mlzurtd,BloodSteyn,,1,2025-04-08 06:48:30,,,,Cheaping out on parts to save a few cents Hall effect sticks cheap too so why not cut a teeny tiny part of profit to give the users what they want Do they really want users to keep on buying replacement controllersoh now I get it Its the Razor and Blade model,,0.0,1jtozpr
comment,mm0si5a,ColonelBeer,,1,2025-04-08 12:12:20,,,,Would hall effect sticks even be possible to add though Id imagine the magnets that connect the joycons to the console could cause problems with hall effect sticks no,,0.0,1jtozpr
comment,mm1cnn7,fire2day,,1,2025-04-08 14:12:50,,,,I wish they would just allow proper thirdparty controllers rather than having some kind of onlyinhandheldmode limitation The Hori split pad pro was awesome despite that one downside,,0.0,1jtozpr
comment,mm1dbdp,TheMasterSwordMaster,,1,2025-04-08 14:16:16,,,,Ive had like 4 sets of joycons and none of them drifted but it was the triggers and bumpers that broke,,0.0,1jtozpr
comment,mm2n3qv,bos-g,,1,2025-04-08 18:00:11,,,,Too bad we wont be able to afford it in America,,0.0,1jtozpr
comment,mm2pcju,egguw,,1,2025-04-08 18:10:52,,,,does this apply to the pro controllers too,,0.0,1jtozpr
comment,mm3rcrf,Faceliss,,1,2025-04-08 21:15:08,,,,I swapped my joycon sticks to Hall sensors this thing still drifts like a btch,,0.0,1jtozpr
comment,mmhen8t,ohiocodernumerouno,,1,2025-04-11 00:21:47,,,,I think Nintendo copyrighted stick drift,,0.0,1jtozpr
comment,mn0jmh0,TurboPikachu,,1,2025-04-14 05:05:23,,,,They chose not to use Hall Effect joysticks To avoid a lawsuit over the Switch 1 sticks,,0.0,1jtozpr
comment,mlwh7ky,ToMorrowsEnd,,1,2025-04-07 18:10:09,,,,Yep called it they are not going to improve squat,,0.0,1jtozpr
comment,mlw7ukj,SinkCat69,,1,2025-04-07 17:23:53,,,,More reliably bring in money for Nintendo,,0.0,1jtozpr
comment,mlwaecg,FireMaker125,,1,2025-04-07 17:36:24,,,,lmao it keeps getting worse,,0.0,1jtozpr
comment,mlwjjlf,beat-sweats,,1,2025-04-07 18:22:06,,,,New stick drift unlocked,,0.0,1jtozpr
comment,mlwkt13,thatguywithawatch,,1,2025-04-07 18:28:30,,,,Pinky promise,,0.0,1jtozpr
comment,mlwxsu7,ExoticMandibles,,1,2025-04-07 19:35:35,,,,Why not Are Hall sensors really that much more expensive Would they have to license patents or something,,0.0,1jtozpr
comment,mm0bnwq,trickman01,,3,2025-04-08 09:51:38,,,,For starters they would be right next to the magnets holding the joycons onto the switch 2,mlwxsu7,1.0,1jtozpr
comment,mly6f14,SquinkyEXE,,1,2025-04-07 23:39:14,,,,Because if they break you have to buy more Nintendo is nickel and diming everywhere they can with switch 2 80 games 10 for small updates to games you already paid full price for the tutorial game being paid Paid discord clone Theres just so many reasons to hate Nintendo right now I can hardly choose,mlwxsu7,1.0,1jtozpr
comment,mlxlxvs,None,,1,2025-04-07 21:42:18,,,,hall effect is a buzzword at this point anyway there are bad hall effect controllers with lots of drift and great potentiometer controllers with zero drift yall can watch this video that explains it,,0.0,1jtozpr
comment,mlxykjx,Recipe-Jaded,,-1,2025-04-07 22:54:16,,,,I prefer potentiometer based solely on the fact that hall effect joysticks are a buzzword as you said Unless you find quality hall effect sticks in the sea of shitty ones you can bet they will drift,mlxlxvs,1.0,1jtozpr
comment,mm1wdee,SaiyanRajat,,1,2025-04-08 15:51:37,,,,This is bullshit Nintendo shouldve used Hall effect joysticks given the steep 50 increase in base price,,0.0,1jtozpr
comment,mlw995l,OriolesMets,,1,2025-04-07 17:30:46,,,,For that price its the least they can do,,0.0,1jtozpr
comment,mlwdsni,AppalachanKommie,,1,2025-04-07 17:53:05,,,,For Nintendo to add hall effect joysticks games would need to be 120 dollars digital,,0.0,1jtozpr
comment,mlwhriq,MartyBellvue,,1,2025-04-07 18:12:58,,,,The new thing thats gonna be breaking is those mouse controls I dont see those lasting for more than a couple weeks,,0.0,1jtozpr
comment,mlwp7kz,GaiusMarcus,,1,2025-04-07 18:51:03,,,,Or maybe theyre just cheaper,,0.0,1jtozpr
comment,mlwxu9x,Jaambie,,1,2025-04-07 19:35:47,,,,gifgiphyjeXiz1RAvzX44,,0.0,1jtozpr
comment,mlxnhn3,PaulR79,,1,2025-04-07 21:50:48,,,,Good old Nintendoh Charging a fortune still and also refusing to make a real change when an incremental update will do for them What are you gaming people who like it gonna do not buy it Ive had very few Nintendo products Wii 3DS New 3DS XL but I try to keep up with tech and the way they scrimp on things like this or small product updates all Gameboys bar a few youd think they were looking for money down the back of a couch sofa to make ends meet,,0.0,1jtozpr
comment,mlxtibo,hihowubduin,,1,2025-04-07 22:25:04,,,,Given the track record I have with my switch joycons Yeah this smells like bs,,0.0,1jtozpr
comment,mlxwhht,Kageromero,,1,2025-04-07 22:42:26,,,,The people who used them at the tech event all praised how smooth and good they felt so I believe that Reliabilitythats a wait and see,,0.0,1jtozpr
comment,mlyw7y3,triadwarfare,,1,2025-04-08 02:15:42,,,,So they basically admitted the old joycons were bad,,0.0,1jtozpr
comment,mlz4ibd,Popular-Jello9539,,1,2025-04-08 03:09:30,,,,Its like they dont want it to sell at this point,,0.0,1jtozpr
comment,mlwjamd,Jarsky2,,-1,2025-04-07 18:20:50,,,,ITT People not considering the potential issues with putting magnetic sensors right next to a big fucking magnet Not defending Nintendo just pointing out theres a pretty fair reason for them not to use Hall Effects,,0.0,1jtozpr
comment,mlw0z6z,Grathmaul,,-11,2025-04-07 16:49:08,,,,Hall effect sticks arent objectively better Ive had a PS3 controller for over 12 years that started drifting but was easily fixed by cleaning it Its much more dependent on the materials used and the actual design of the controller,,0.0,1jtozpr
comment,mlw1tb8,Veranova,,6,2025-04-07 16:53:20,,,,Well they might be objectively better but its also true that a lot of consoles made in the 2000s came with controllers which still work fine I never remember stick drift being a concern on the GameCube or Wii sticks they were super robustly made,mlw0z6z,1.0,1jtozpr
comment,mlw2yic,Marketing_Helpful,,6,2025-04-07 16:59:04,,,,gamecube sticks get drift but mainly you get PODE which is another issue,mlw1tb8,2.0,1jtozpr
comment,mlw8rju,Dt2_0,,5,2025-04-07 17:28:23,,,,GameCube and Wii didnt have major issues with drift because the system recalibrated the center at startup Boot up a Gamecube while holding a stick one direction and the game will think that is the center point,mlw1tb8,2.0,1jtozpr
comment,mlwcdjb,Grathmaul,,2,2025-04-07 17:46:06,,,,I said they arent objectively better,mlw1tb8,2.0,1jtozpr
comment,mlwfsid,Veranova,,1,2025-04-07 18:02:57,,,,I know read my comment as if I understood that Im not a downvoter by the way but popular belief at least is they are technically better,mlwcdjb,3.0,1jtozpr
comment,mlwhvy5,Grathmaul,,1,2025-04-07 18:13:36,,,,Popular beliefs arent objective facts Im sure they are better in many if not most ways but theyre newer tech and more expensive and not necessarily worth it in most cases,mlwfsid,4.0,1jtozpr
comment,mlw5rqu,DavidinCT,,6,2025-04-07 17:13:27,,,,The Switch 1 was known for the drift issues PS3Xbox 360PS5Series X never had any drift issues My Switch does replaced the joycons like 3 times Hall effect would stop that are they better nah,mlw0z6z,1.0,1jtozpr
comment,mlwcnid,Grathmaul,,4,2025-04-07 17:47:28,,,,They sucked because of bad design and cheap materials Not because they werent hall effect,mlw5rqu,2.0,1jtozpr
comment,mlwb17s,forestman11,,2,2025-04-07 17:39:31,,,,If that PS3 controller had hall effect sensors it wouldnt have even needed that cleaning Yes you can make potentiometerbased sticks more reliable than Nintendo no ones arguing that but hall effect sensors are objectively better,mlw0z6z,1.0,1jtozpr
comment,mlwenyx,Grathmaul,,1,2025-04-07 17:57:22,,,,Sure and theyre new and more expensive Nintendo doesnt need any more excuses to jack up their prices though,mlwb17s,2.0,1jtozpr
comment,mlw9clm,None,,1,2025-04-07 17:31:15,,,,They are better lol Magnets as opposed to more components Reference how HE switches work,mlw0z6z,1.0,1jtozpr
comment,mlwed79,Grathmaul,,1,2025-04-07 17:55:53,,,,Okay maybe theres an argument to be made that they are better but theyre not necessary,mlw9clm,2.0,1jtozpr
comment,mlw7r76,EmeraldFox23,,-1,2025-04-07 17:23:24,,,,Seriously I grew up as a console player from PS1 to PS4 pro pc now and Ive never had a single controller suffer from stick drift I specifically chose a nonHall effect controller when buying one for my pc specifically to avoid the hassle,mlw0z6z,1.0,1jtozpr
comment,mlw85xb,Rid1_,,4,2025-04-07 17:25:26,,,,Whats the hassle with decent hall effect controller,mlw7r76,2.0,1jtozpr
comment,mlwopsp,EmeraldFox23,,0,2025-04-07 18:48:33,,,,When the sticks eventually start to drift Then I either need to change the sticks myself get it repaired or buy a new controller Id rather just buy one controller and use that for the foreseeable future,mlw85xb,3.0,1jtozpr
comment,mlws4ab,raxitron,,-1,2025-04-07 19:05:55,,,,Okay so I have to open it up and put paper between the contacts again the day I pick it up Premium prices for subpar products,,0.0,1jtozpr
comment,mlx6t3s,epidemica,,0,2025-04-07 20:22:04,,,,Another reason not to buy it,,0.0,1jtozpr
comment,mlz4lpq,None,,0,2025-04-08 03:10:08,,,,Been lucky never had stick drift on any console except for when I dropped my switch face down Some of you use enough pressure to turn coal into diamonds on them,,0.0,1jtozpr
comment,mlvwncf,mqwi,,-11,2025-04-07 16:26:41,,,,Am I the only one confused by the title Just from reading it I thought Hall effect sensors were causing the JoyCon drift and theyre not going to use them anymore to avoid it Or is my sense of English just off,,0.0,1jtozpr
comment,mlvyxtt,Melodic-Task,,12,2025-04-07 16:38:36,,,,Hall Effect are a newer top of the line technology that many consider the best joystick tech in controllers especially for fightersfps games This is not standard in any basic controller for any console as far as I am aware but you can get upgraded controllers for PS5 and XBox with Hall Effect sticks The old joycon drift was a mechanical problem According to the article the new joycons have been redesigned from the ground up but are still mechanical So people are worried about drift or other wear and tear issues,mlvwncf,1.0,1jtozpr
comment,mlw0wqt,Skitz-Scarekrow,,7,2025-04-07 16:48:47,,,,Not even that new either Just recently more affordable The Sega Saturn 3D1996 and Dreamcast1999 1998japan controllers are Hall Effect,mlvyxtt,2.0,1jtozpr
comment,mlw3kwx,Melodic-Task,,6,2025-04-07 17:02:16,,,,I did not realize it had been around that long Wow The ways consoles try to cut costs and where they do it is fascinating,mlw0wqt,3.0,1jtozpr
comment,mlx6x8a,_RADIANTSUN_,,3,2025-04-07 20:22:40,,,,Its not just cost cutting its QAsupport scaling Hall effect sensors are not some magic perfect failure proof technology The failure mode is just different Potentiometers degrade gradually whereas a failed HE sensor fully loses control all at once With millions of units being manufactured and an industry standard failure rate of like 25 you have the choice of like 25K people out of every million having zero control out of the box vs maybe never even noticing a slightly faulty potentiometer If you are a peripheral company this is the only RMA you have to do not even close to the situation of console manufacturer,mlw3kwx,4.0,1jtozpr
comment,mlw5b3t,Skitz-Scarekrow,,2,2025-04-07 17:11:06,,,,Thats the magic of capitalism baby Edit realistically I cant fault a business attempting to make the most profit with standard off the shelf parts that are good enough Ridiculous that hall effect isnt included in premium controllers Dualsense Edge but thats another rant,mlw3kwx,4.0,1jtozpr
comment,mlw71w3,yayitsdan,,2,2025-04-07 17:19:50,,,,I was so surprised when took apart my Dreamcast controller recently and saw that there was nothing connecting the joystick to the PCB Its just a magnet and a sensor,mlw0wqt,3.0,1jtozpr
comment,mlvy4xd,sideways_86,,6,2025-04-07 16:34:23,,,,hall effect sensors are the fix for stick drift its the cheaper analog sticks as used in the original switch that suffer from stick drift,mlvwncf,1.0,1jtozpr
comment,mlw72ae,mpworth,,1,2025-04-07 17:19:53,,,,I think you might be missing the force of the word but in the title But indicates that the idea coming after it is about to somehow opposecontrastcontradictmitigate the idea that came before it It seems like the impression you originally had would make more sense if the title had used and or because instead of but,mlvwncf,1.0,1jtozpr
comment,mlvxwoc,reality_boy,,-20,2025-04-07 16:33:10,,,,How would Hall effect sensors solve stick drift Its a mechanical issue with binding from the centering springs,,0.0,1jtozpr
comment,mlvyrmv,OnTheGoatBoat,,24,2025-04-07 16:37:43,,,,Look up the sensor It clearly circumvents the problem by having no physical contact points using magnets Thats the whole point,mlvxwoc,1.0,1jtozpr
comment,mlw54o4,Ab47203,,3,2025-04-07 17:10:11,,,,Stick drift is from wear on the graphite pads in a thumbstick Hall effect sticks measure magnetic fields from permanent magnets attached to the thumbstick It makes it near impossible to get drift with a decent quality calibrated hall effect stick In a normal thumbstick they measure the resistance on the graphite pad which changes with wear and causes drift No pad No drift,mlvxwoc,1.0,1jtozpr
comment,mlw5ugo,aircooledJenkins,,2,2025-04-07 17:13:50,,,,Nah its wear on the contacts Springs are fine,mlvxwoc,1.0,1jtozpr
comment,mlw2jrb,Toomanydamnfandoms,,0,2025-04-07 16:57:02,,,,I cant give you any kind of science based answer cause I simply dont know how any of this works but personally I have noticed my steam deck that uses Hall effect has had zero stick drift Ive probably put at least 2k hours into both switch and steam deck I had to replace my switch joycons twice in that time because of stick drift but knock on wood I havent had any issues at all with my deck sticks,mlvxwoc,1.0,1jtozpr
