type,id,author,title,score,created_utc,url,num_comments,subreddit,body,parent_id,depth,post_id
post,1k9tk7a,chrisdh79,Anker’s Tabletop UV Printer Will Make Your Prints Look Like Real Painted Art | The eufyMake E1 UV printer is bringing embossed prints directly into the home.,613,2025-04-28 11:48:07,https://www.reddit.com/r/gadgets/comments/1k9tk7a/ankers_tabletop_uv_printer_will_make_your_prints/,73.0,gadgets,,,,
comment,mphjznk,ToMorrowsEnd,,179,2025-04-28 14:23:44,,,,And it will do so at extremely expensive prices for the ink I know someone that is a beta tester for that machine that print cost them 100 in ink to do the relief it prints many layers over and over to build it up a small ink set is 250 and that print demoed uses about 12 the ink They are marking up standard UV ink hard and putting it in sealed cartridges at a massive premium Standard UV ink is about 4060 a liter this setup gets you about 100ml for that same price,,0.0,1k9tk7a
comment,mpi91zk,kermityfrog2,,98,2025-04-28 16:29:49,,,,Cheap printer expensive ink Where have I heard that strategy before,mphjznk,1.0,1k9tk7a
comment,mpj84nl,Emperor-Commodus,,18,2025-04-28 19:21:55,,,,Cheap printer Did you read the article The printer is almost 2000,mpi91zk,2.0,1k9tk7a
comment,mpj8ebv,kermityfrog2,,47,2025-04-28 19:23:16,,,,Do you know what a UV printer is Usually UV printers are in the 30000 to 50000 range,mpj84nl,3.0,1k9tk7a
comment,mploz7s,TheDailySpank,,12,2025-04-29 03:43:30,,,,50000 gets you a UV printer with a 6x10 bed and a 4section vacuum system,mpj8ebv,4.0,1k9tk7a
comment,mpnz3io,G_ntl_m_n,,3,2025-04-29 14:33:21,,,,Do you know what a UV printer premium is Thatll cost you about 150000,mpj8ebv,4.0,1k9tk7a
comment,mpoxrq0,kermityfrog2,,2,2025-04-29 17:21:14,,,,Oh yeah I guess thats the posttariff cost now LOL,mpnz3io,5.0,1k9tk7a
comment,mpjj6k1,Emperor-Commodus,,2,2025-04-28 20:17:44,,,,Another source says the ink cartridges are 299 A 2000 printer with 300 ink cartridges isnt cheap printer expensive ink its just expensive everything In the cheap printer expensive ink model the printers are extremely cheap sometimes even less expensive than the ink refill itself Theyre intentionally heavily subsidized to lock the consumer in This printer is far too expensive to make the model work Usually UV printers are in the 30000 to 50000 range Anker is marketing this printer to makers for home use Its not the same as a 50k machine aimed at manufacturers like the Casio mentioned in the article Again did you read the article It explicitly mentions this UV printing isnt a new technology The process uses UVcurable inks to apply layers of color onto a surface that can dry almost instantly when subjected to specific wavelengths of light This means it can coat practically any surface from paper to wood to acrylic You can find a fair number of desktopsized UV flatbed printers ranging from 2000 up to 7000 For something that offers 3D texture you normally have to shell out a lot more money Back in 2018 Casio showed off similar 3D printing features with a 50000 UV printer That sort of tech is now far more affordable Anker calls its latest eufyMake device the first 3D texture UV printer for home use,mpj8ebv,4.0,1k9tk7a
comment,mpwt40p,Call_Me_Mack,,3,2025-04-30 21:19:38,,,,Just wanted to point out the 300 for ink is for an entire replacement kit Otherwise I think the individual inks are around 42 for 100ml each Most reviews on YouTube so far say the ink usage isnt bad unless you are doing the embossing3d prints all the time or large prints at maximum heights Otherwise regular prints are fair it seems,mpjj6k1,5.0,1k9tk7a
comment,mpvonir,tankueray,,1,2025-04-30 18:02:21,,,,Okay let me clarify something here Most current UV printers are very large format sign printers like for billboards and they can even cost over 6 figures Flatbed printers of this type were initially dreamed up as DTG printers and they were quite expensive because tshirts are always a money maker it wasnt because the printer was cutting edge technology Casio was way late to the game btw Well before 2018 Direct Color Systems were selling units based off of the Epson dx5 printers that could go higher than 5mm Iirc they were around 25000 45000 and were made to withstand commercial production but no bigger than any nonKornit DTG printer or 40W RF laser system at the time I checked them out at every trade show I attended but there is limited ROI for commercial printing applications and bespoke items take too much human time to actually be profitable At the same time Roland was selling a 20 solvent printercutter using the dx7 printhead for under 10000 and a professional vinyl cutter or sublimation system was under 1000 The markup was only because of wanting to cash in on the folks that were coming from Cricut vinyl cutting into the professional market who didnt have the space or clientele to screen print or print billboards and who saw the DTG printers as their golden ticket Those first A3 sized UV flatbeds looked nearly identical to the DTGs as well I never saw those little phone case sized UV printers at a trade show that market was and still is dominated by sublimation which was not only faster and cheaper but the customer could send a photo from their phone to the queue while standing in line and it was ready when they got to the front That entire printerheat presssoftware system was less than 3000 and extremely portable What system do you think the Cricut moms bought into What is the marketing strategy of this printer again Sublimation was a cheap way to get into the business but it wasnt cheap to stay in because of proprietary printers ink software and specially coated blanks Guess what Cricut marketed to their makermoms after the big sublimation patent wars were sorted out To be fair most of the DTGUV printers like that at the time were assembled by hand in the US from off the shelf Epson printers without Epsons permission so some of the cost was actual smallscale labor fabrication and electronics And the high cost of all professional systems includes inperson training and human tech support from your regional reps at nearly any time of day or night,mpjj6k1,5.0,1k9tk7a
comment,mphn95j,fraseyboo,,31,2025-04-28 14:40:39,,,,Ooof thats a tough sell for now then Thankfully the 3D printing community are insanely good at open sourcing solutions so well probably see a much cheaper version soon Thatll inevitably be followed up by companies making their own versions too Give it maybe a year or so and this tech will be available from pretty much every major 3D printer manufacturer,mphjznk,1.0,1k9tk7a
comment,mphur3a,jjayzx,,26,2025-04-28 15:18:52,,,,Ink printers would have been done long ago but the ongoing issue is the print head No easy way to make one There needs to be a company willing to design and sell an open source print head,mphn95j,2.0,1k9tk7a
comment,mpi30g5,Gecko23,,19,2025-04-28 15:59:41,,,,It wouldnt be surprising if the print head for this machine is novel and covered by active patents Youll see the 3rd party innovation when those expire just like FDM exploded after a number of key patents went away,mphur3a,3.0,1k9tk7a
comment,mpiu9ow,NotAHost,,4,2025-04-28 18:12:38,,,,I know ink print heads more than Id like to admit due to grad school and some of my jobs While there are a lot of patents around ink print heads there are a lot of brands out there and with respect to printing something as simple as a UV ink ie not particle loaded normal viscosity range 1020cps you can pretty much use any branded print head Print heads are usually manufactured with a semiconductorMEMslike process so open source for print heads are much more difficult However finding the cheapest COTS printhead and building around it is likely you can find a variety of projects on hackaday for example A big challenge with any sort of ink print head is that they dry out and fail You can do things to keep them from drying out but from a consumer perspective we are spoiled by low maintenance devices and ink print heads always have some routine maintenance such as flushing with a solvent made for the ink or keeping it plugged in to occasionally jet and refilling the ink as an operating cost even when youre not using the printer I wouldnt put it past the open source community to find innovative ways to keep printheads from drying out I did my own sort of hacks at my job but IMO its a matter of scale and Im not sure if there will be a large enough community to maintain drive in open source UV printers,mpi30g5,4.0,1k9tk7a
comment,mpj09wt,ToMorrowsEnd,,3,2025-04-28 18:42:32,,,,Im betting 100 its the same Epson UV printhead used on all UV printers sold,mpi30g5,4.0,1k9tk7a
comment,mphxh36,fraseyboo,,4,2025-04-28 15:32:25,,,,A lot of the advancements weve seen in 3D printing have come from large projects like Voron and Klipper along with dedicated enthusiasts like CNCKitchen There are definitely challenges with building a printhead like this but theres a big enough enthusiast community out there thatll figure out most of the RD for free If you look at a project like Enraged Rabbit Carrot Feeder youll see how the open source community integrate with companies to regularise a specification and make kits that eventually leads to commercial implementations,mphur3a,3.0,1k9tk7a
comment,mpj8c7i,jjayzx,,3,2025-04-28 19:22:57,,,,Ive been in the 3d printing and multicopter community since inception Its one thing to machine basic parts and design PCBs and scrounge whatever is already available Theres no standard print head to rip from something or just available in mass Print heads use the same technology as chip manufacturing,mphxh36,4.0,1k9tk7a
comment,mpkqr5b,Sylanthra,,4,2025-04-29 00:17:30,,,,Can you use normal filament 3d printer for the shape and this to paint over it as a finishing step,mphjznk,1.0,1k9tk7a
comment,mpvqw10,tankueray,,1,2025-04-30 18:13:08,,,,Ive also wondered about this and given my experience with both technologies Im hypothesizing that you might be able to build up some base depth with FDM but it would have to be mostly flat so that the laser depth finders would still be able to focus enough to give the required print resolution Any more than about 1mm will probably leave those lower levels looking fuzzy or oversprayed An alternative would be to use the UV printer to print a background then 3D print on the substrate whatever element you really wanted to stand out a la hueforge,mpkqr5b,2.0,1k9tk7a
comment,mpr363v,joe_bibidi,,1,2025-04-29 23:48:15,,,,Not to defend it but it strikes me like this is going to be something for like small business hustler types It doesnt really make much sense to me for general enthusiast purposes or for real industrial applications it feels like some of those cheap read not that cheap embroidery machines that streetwear startups were using like crazy in the 2010s But in this case itll be like shitty art stalls at bad street fairs selling knockoff BasquiatsWarholsetc for 300 with 200 of production costs under their belt,mphjznk,1.0,1k9tk7a
comment,mpuqfwg,tankueray,,1,2025-04-30 15:17:44,,,,I agree No one with real commercial printer experience has reviewed it that Ive seen so far,mpr363v,2.0,1k9tk7a
comment,mpkuhb3,altarr,,-1,2025-04-29 00:39:15,,,,Your beta tester is making extreme prints at that cost This is designed to add depth and print on a wide variety of objects not replace 3d printer style relief,mphjznk,1.0,1k9tk7a
comment,mphd6gu,Underskysly,,59,2025-04-28 13:46:58,,,,This dose not look like real painted art it looks more like gimmicky raised prints,,0.0,1k9tk7a
comment,mphgjc8,Princess_Moon_Butt,,42,2025-04-28 14:05:21,,,,These kinds of printers _can_ be really cool for textured prints If youre trying to make it look like an oil painting youre gonna have a rough time but it can do some cool stuff That said this specific one looks like it can _only_ run through Ankers cloud service no desktop app or direct communications Which probably means that they not only steal all of your pictures via some buried line in their TOS but that if they ever decide to pull support for it youre left with a very expensive brick,mphd6gu,1.0,1k9tk7a
comment,mphk7jz,ToMorrowsEnd,,14,2025-04-28 14:24:53,,,,this is the biggest problem Its cloud connected and does not work at all when not on the internet,mphgjc8,2.0,1k9tk7a
comment,mphto1z,LogJamminWithTheBros,,6,2025-04-28 15:13:20,,,,What if it turns out they use the stuff people print to train ai models,mphgjc8,2.0,1k9tk7a
comment,mphvg4m,Princess_Moon_Butt,,5,2025-04-28 15:22:20,,,,Im sure thats 100 the game plan Andor selling the stored dataartworks as a bundle to some designers who will scour it for cool images and list the designs on redbubble or other instaprint shops,mphto1z,3.0,1k9tk7a
comment,mphvqnv,resil_update_bad,,1,2025-04-28 15:23:48,,,,I think thats implied,mphto1z,3.0,1k9tk7a
comment,mphw6rg,iMogal,,1,2025-04-28 15:26:03,,,,Agreed Would not buy,mphgjc8,2.0,1k9tk7a
comment,mpi0d8s,Great_Dismal,,3,2025-04-28 15:46:41,,,,But it can print on tapered mugs,mphw6rg,3.0,1k9tk7a
comment,mpi3snn,iMogal,,1,2025-04-28 16:03:35,,,,So Please see comment above,mpi0d8s,4.0,1k9tk7a
comment,mpie3k6,Great_Dismal,,2,2025-04-28 16:54:29,,,,I knew I should have added the s,mphw6rg,3.0,1k9tk7a
comment,mphdwot,Jacklebait,,2,2025-04-28 13:50:59,,,,The flat prints it does is pretty wild Make metal posters for 2 worth of ink The discord and FB group has a lot of the photos of the projects the beta guys did Not in my price range and they are targeting MakersSellers,mphd6gu,1.0,1k9tk7a
comment,mpjdhv0,ffxivdia,,1,2025-04-28 19:49:18,,,,Do u have a link to that discord server,mphdwot,2.0,1k9tk7a
comment,mpjeibk,Jacklebait,,2,2025-04-28 19:54:23,,,,,mpjdhv0,3.0,1k9tk7a
comment,mphryuu,AnRealDinosaur,,5,2025-04-28 15:04:44,,,,It looks like a gimmicky raised print of trashy Ai slop Is the real painted art in the room with you gizmodo,mphd6gu,1.0,1k9tk7a
comment,mphz2b2,ElvishLore,,10,2025-04-28 15:40:16,,,,And they use AI art to showcase this Ugh,,0.0,1k9tk7a
comment,mph41hv,butter4dippin,,74,2025-04-28 12:52:24,,,,That shit probably wont work without an Internet connection and it probably spies on you,,0.0,1k9tk7a
comment,mph5xzq,imakesawdust,,40,2025-04-28 13:04:11,,,,And given Ankers history theyll swear up and down that it doesnt spy on you until someone shows the network traffic indicating that it does,mph41hv,1.0,1k9tk7a
comment,mph8697,stockinheritance,,16,2025-04-28 13:17:45,,,,chief versed slap sable wrench unique bike capable full vegetable This post was mass deleted and anonymized with Redact,mph5xzq,2.0,1k9tk7a
comment,mph93im,imakesawdust,,39,2025-04-28 13:23:15,,,,Look up the Eufy an Anker subbrand controversy They doubleddown on their claims that their cameras only did local storage even after people published network traffic proving that the cameras were uploading unencrypted video streams to the cloud,mph8697,3.0,1k9tk7a
comment,mphgokn,Sawses,,22,2025-04-28 14:06:08,,,,As a general rule do not put your cameras on your main network You put them on a subnet that links them to each other and to a shared folder that serves as their storage They shouldnt ever be able to see anything except that shared folder and depending on the device each other,mph93im,4.0,1k9tk7a
comment,mpima3e,RustywantsYou,,5,2025-04-28 17:33:58,,,,Awesome and how do I do that Is there like a website I can learn about it or something,mphgokn,5.0,1k9tk7a
comment,mpj9bp1,beren12,,1,2025-04-28 19:27:59,,,,Find a managed switch cheap online and learn how to use it,mpima3e,6.0,1k9tk7a
comment,mpinlz6,Sawses,,-6,2025-04-28 17:40:19,,,,Honestly that is one area where I would say ChatGPT is an essential resource Tell it your experience level the operating system youre using and what exactly you want and ask it to guide you Thats how I taught myself Linux to set up my own homebased server There are just a ton of moving parts and considerations that a novice wont think of and thats where LLMs exceltheyre great at providing context and prompting you to ask the important questions Most guides assume way more competence than I had I constantly found myself using it to figure out the broad strokes of what I wanted to do Googling up some of the many wellwritten guides on those topics and then asking ChatGPT to explain any command or phrase that was used without explanation in the guide,mpima3e,6.0,1k9tk7a
comment,mptvf6f,IronPikachu,,0,2025-04-30 12:33:06,,,,funny how you got downvoted seemingly solely for the high crime of suggesting that someone use ai,mpinlz6,7.0,1k9tk7a
comment,mpv6f0p,tankueray,,0,2025-04-30 16:35:09,,,,Right Im old school and had to learn Linux by walking to school both ways uphill in the snow everyday but I think this might be an actual useful thing that AI could do And it was a respectful well written answer Again crusty old Gen X here so thats usually not my style but Id like to compliment the writer for it,mptvf6f,8.0,1k9tk7a
comment,mphd54o,ArchusKanzaki,,8,2025-04-28 13:46:46,,,,The charger and cable are fine Its the internetconnected one that can be a problem and need to take abit more caution,mph8697,3.0,1k9tk7a
comment,mphgri6,szotsaki,,-10,2025-04-28 14:06:34,,,,Youd think so Features Easy WiFi Control Full control with your web browser Desktop or mobile Keystroke Injection Instant DuckyScript payloads No recompiling or reprogramming just click run And with industryleading 890keyssec speeds Lots of Payload slots Basic model comes with 8 slots Elite has extra storage allowing up to 200 slots Global Keymaps With 192 keymaps already built in you can target machines across the world Built in IDE The WebUI not only provides 100 of the controls but also gives you helpful feedback to catch syntax errors while rapidly building payloads Mobile Payloads Cables with a USBC active end or Directional C to C can automatically transmit to mobile devices with a USBC connector Connect just the active end Stealth The implant stays dormant until a payload is deployed No logs No detections The cable behaves just like a normal USB 20 cable 5v charging 480mps data transfer Spoof any USB identifer VIDPID extended USB Identifier and network MAC address Hardware Keylogger Elite models contain a passive hardware keylogger designed for FullSpeed USB keyboards with detachable cables Store up to 650000 keystrokes For tested keyboards more info go here HIDX StealthLink Elite models setup a bidirectional tunnel from Target Host OMG Control Machine Encrypted Network C2 Elite models Use an encrypted connection to access control your OMG from anywhere Then disable the onboard WebUI to hide and protect your OMG on untrusted networks Compatible with any server that runs python SelfDestruct Make your legal team happy by ensuring sensitive payloads loot are gone and the OMG Cable is fully inert recoverable with OMG Programmer GeoFencing Trigger payloads or other actions based on location Keep your tool from falling out of scope Ex selfdestruct if someone takes the OMG Cable home WiFi Triggers Trigger payloads at long range with a single beacon,mphd54o,4.0,1k9tk7a
comment,mphh54c,ArchusKanzaki,,16,2025-04-28 14:08:36,,,,And are you really suggesting Anker stealthily ship you hacked cable REALLY Yes I know they exist but I do not believe Anker is shipping those I know ppl were up in arms for the Eufy thing but dont be that stupid,mphgri6,5.0,1k9tk7a
comment,mpjf0bd,szotsaki,,1,2025-04-28 19:56:52,,,,Just because I linked a cable for general education to show that it takes virtually no space to embed a remote keylogger within youre suddenly calling me stupid and shouting in your comment Its just an interesting fact thats all Why do you need to get personal over a cable,mphh54c,6.0,1k9tk7a
comment,mplg3c6,ArchusKanzaki,,1,2025-04-29 02:46:56,,,,because its not even related to the topic I told the other guy that Ankers cable and charger are fine but the internetconnected devices Anker selling may need to be careful And you are the one who jump with totally unrelated product What Im supposed to infer from that,mpjf0bd,7.0,1k9tk7a
comment,mph4y17,Mooseymax,,3,2025-04-28 12:58:01,,,,But I can make my own custom embossed Pokemon cards right,mph41hv,1.0,1k9tk7a
comment,mphdkkq,Jacklebait,,1,2025-04-28 13:49:08,,,,It works offline but the AI features are connection dependent,mph41hv,1.0,1k9tk7a
comment,ms0752r,aphaits,,1,2025-05-13 00:00:41,,,,Man there should be a global regulation where hardware components should work offline and cloud features is not mandatory,mph41hv,1.0,1k9tk7a
comment,mph6kyn,FreezaSama,,7,2025-04-28 13:08:06,,,,Big nope from me dog,,0.0,1k9tk7a
comment,mph7677,historicartist,,5,2025-04-28 13:11:42,,,,go stuff your printer,,0.0,1k9tk7a
comment,mphjdo9,GentlemenHODL,,2,2025-04-28 14:20:30,,,,This is going to make those making giclees a lost easier I dont know if thats good or bad though,,0.0,1k9tk7a
comment,mphpy7j,Specialist-Bee-9406,,2,2025-04-28 14:54:26,,,,This is perfect for making tacky religious art to sell to evangelicals,,0.0,1k9tk7a
comment,mpny0w5,seanrm92,,1,2025-04-29 14:27:59,,,,Cant wait to crank out AI slop to sell at my local arts market,,0.0,1k9tk7a
comment,mpouw4u,HotHamBoy,,1,2025-04-29 17:07:41,,,,Of course they printed an AI dragon,,0.0,1k9tk7a
comment,mqicwk4,BusyNoise315,,1,2025-05-04 09:18:30,,,,What about longterm support This machine has proprietary parts like a Glowforge so when it breaks youll likely have to pay to ship it to China for repairs covering shipping and tariffs both ways which could get pricey fast The ink is already overpriced at 299 for 600ml and with tariffs it jumps to 477 to ship to youthats 12502350 for just 100 small prints compared to the 3060UVV2s 024 eufyMakes lack of transparency on ink usage and support is a red flag and theyve already abandoned their 3D printer backers in the past leaving them with nothing Theyre promising free shipping on 6437 units but thats 79 million in shipping and tariffs they might not handle risking delays or hidden fees Youll have to raise your prices much higher than expected to recoup costs on this tossaway machine Save your money,,0.0,1k9tk7a
comment,mrmir32,redcomp12,,1,2025-05-10 18:12:37,,,,Do you think will be other manufacturers of the ink Sth cheaper,,0.0,1k9tk7a
comment,mphvja1,Mister-Bohemian,,0,2025-04-28 15:22:46,,,,I ran away from eufy when I learned how prohibitive their ui is and how cheap and irreplaceable their parts are,,0.0,1k9tk7a
comment,mpkfl5x,AccomplishedIgit,,0,2025-04-28 23:13:28,,,,Cant wait for all the terrible art this is going to enable,,0.0,1k9tk7a
comment,mpl3cwj,mishyfuckface,,0,2025-04-29 01:31:40,,,,Thats a picture alright,,0.0,1k9tk7a
comment,mpidpij,RainOfAshes,,-1,2025-04-28 16:52:38,,,,Look guys you can only connect to it with your phone How hip,,0.0,1k9tk7a
comment,mpja5dd,teedeeguantru,,-1,2025-04-28 19:32:12,,,,Thats cool I was worried that the tariffs were going to put the price of hideous crap out of my reach,,0.0,1k9tk7a
