type,id,author,title,score,created_utc,url,num_comments,subreddit,body,parent_id,depth,post_id
comment,mpxhogj,sarhoshamiral,,2,2025-04-30 23:33:39,,,,The GPU would have the power connection on the back of the card instead of where it is right now That way you can have a dedicated power supply just for the GPU not having to worry about ATX specs connectors etc This may be a necessity if power consumption goes higher then 600w anyway At this rate in 2 generations power consumption of a single PC will exceed 15A capacity of 110v circuits in US,mpwzs2n,4.0,1kbey37
comment,mpy4z1g,The_JSQuareD,,2,2025-05-01 01:47:49,,,,FYI your original comment says that PSUs not GPUs should have an external power connection which makes it a bit confusing,mpxhogj,5.0,1kbey37
comment,mpya1df,sarhoshamiral,,2,2025-05-01 02:17:08,,,,You are right I mistyped,mpy4z1g,6.0,1kbey37
comment,mpu1xes,ForesakenJolly,,9,2025-04-30 13:11:24,,,,This connection and its specs are clearly unsafe At least to the degree where there is a very large minority of cases that we are all witnessing,,0.0,1kbey37
comment,mpwytkf,ABetterKamahl1234,,7,2025-04-30 21:49:10,,,,Id argue that the specs could be fine if people actually cared to not just shift blame and follow some goddamn specs Nvidia is being shitty for not load balancing But PSU manufacturers for some reason dont load balance either Why the fuck not their whole reputation is providing to spec power reliably it makes no sense that a PSU would even permit such an imbalanced load The fact its taking this kind of crap to highlight it is maddening to me Thats not OK and actually might explain a bunch of fires over the years that get posted in PC gaming communities No pinout should be allowing any pin to feed 600W alone Thats stupid as fuck From what I see this flaw PSU side exists in other pinouts too Theyve always relied on the enddevices to selfregulate power inputs Thats dumb from any electrical standpoint Theres a reason my breaker is in my feed panel and not in my lightswitch,mpu1xes,1.0,1kbey37
comment,mq49w5y,pyroserenus,,1,2025-05-02 00:53:34,,,,PSUs can only really load balance by shutting everything off like a breaker A breaker doesnt load balance it JUST disconnects when amps are exceeded Load balancing needs to be on the gpu side the psu cant force certain amps on certain wires it can at best just disconnect the gpu if there is an anomaly Volts are pushed and amps are pulled Of course GPUs absolutely SHOULD shut down for anomalous amperage being drawn but it cant actually fix the problem at hand,mpwytkf,2.0,1kbey37
comment,mpxkefa,mytransthrow,,3,2025-04-30 23:48:54,,,,Here is a fool proof soultion Stop cheaping out on cables Corpos its corpos fault,,0.0,1kbey37
comment,mpxwhec,Stevecaboose,,2,2025-05-01 00:58:16,,,,Due to the design on the video card you literally cant foolproof this issue,,0.0,1kbey37
comment,mpurk5i,None,,3,2025-04-30 15:23:08,,,,I think RTX4070 is the last modern card with 8pin pcie power plug,,0.0,1kbey37
comment,mpvwp2a,akeean,,11,2025-04-30 18:41:24,,,,AMD RX 9070 XT uses 2x 8pin and released in 2025,mpurk5i,1.0,1kbey37
comment,mpxd2mu,reign27,,5,2025-04-30 23:07:50,,,,OC models use 3x 8pin havent seen any with vhpwr,mpvwp2a,2.0,1kbey37
comment,mpxjmsx,ChrisFhey,,5,2025-04-30 23:44:36,,,,The Sapphire 9070XT Nitro Plus cards use a 12V2X6 connector,mpxd2mu,3.0,1kbey37
comment,mpxwaqs,Asberinfi,,2,2025-05-01 00:57:13,,,,Also the Asrock Taichi ones,mpxjmsx,4.0,1kbey37
comment,mpzpghl,ChrisFhey,,2,2025-05-01 09:38:31,,,,Ah yeah I thought there was another one but I didnt remember which,mpxwaqs,5.0,1kbey37
comment,mpu9fo6,runed_golem,,2,2025-04-30 13:52:46,,,,Are you surprised Using 12vhpwr just seems like a bad idea,,0.0,1kbey37
comment,mpuvxhw,ukhaus,,1,2025-04-30 15:44:07,,,,60 series gpus need to come with a fire suppression system and a liability waiver at this point,,0.0,1kbey37
comment,mpvqyd7,Tobias---Funke,,1,2025-04-30 18:13:27,,,,Why does it only happen at the GPU end and not at the power supply end Im no electrician,,0.0,1kbey37
comment,mpvxl06,akeean,,7,2025-04-30 18:45:47,,,,The cable comes with the PSU so the PSU side has been tested and guaranteed by the manufacturer The GPU side often has a 90degree bend and fittingcontact issues of the pins can cause more resistance in the cable wich leads to more heat But I think damage on the PSU side has been reported as well GPU side usually is worse since a 1500w PSU is a 400 part with high availability and a 90 tier card is a fucking nightmare to acquire or replace an usually holds the lions share of value in a gaming PC,mpvqyd7,1.0,1kbey37
comment,mpxjzgy,ChrisFhey,,3,2025-04-30 23:46:34,,,,It doesnt There have been cases where the PSU side is melted as well The most recent case I can think of was a Corsair SFX PSU that had damage on the PSU side Its in the megathread on the Nvidia subreddit,mpvqyd7,1.0,1kbey37
comment,mpwqd1v,JuicySmalss,,1,2025-04-30 21:05:49,,,,Ugh this honestly brings back memories of when I first built my PC last year and had similar issues with my graphics card I went allin with an RTX 4080 and when I first plugged it in everything seemed fine But after a couple of weeks I started noticing this weird yellowish tint showing up on the edges of the GPUs fan It wasnt quite as bad as what this guy is describing but it definitely had me freaking out Im not exactly the most techsavvy person so I figured I probably just got a bad card or something and started stressing about potential overheating issues or worse I ended up reaching out to the manufacturer and after a few emails and backandforth they ended up sending me a replacement It was a huge relief when the new card didnt have any of those weird marks but it made me so much more cautious about these highend components With tech getting so advanced you kind of expect them to just work perfectly out of the box but Ive learned that its not always the case From my experience if youre ever in a situation like this its worth reaching out to customer support sooner rather than later because companies seem pretty good at addressing these issues especially if its a known defect It still blows my mind how much we rely on these gadgets and even a small issue can be so stressful when youve invested that much money into them Has anyone else had a similar experience with their highend GPUs or was it just me being unlucky,,0.0,1kbey37
comment,mpzwr8b,ChrisFhey,,1,2025-05-01 10:48:06,,,,Tried to share this on the nvidia subreddit as well but the post got removed of course That sub is really something,,0.0,1kbey37
comment,mq5v1gk,vcarriere,,1,2025-05-02 08:12:08,,,,If they can make a connector for 150amps continuous they can certainly make a video card connector right Wtf,,0.0,1kbey37
comment,mpwuamg,pizoisoned,,1,2025-04-30 21:25:42,,,,Even if you were to make the argument that the 12vpwr is safe its not its clearly not safe in practical implementation Not only is there no load balancing on the wires but the cables are often bent at angles into the card because of the connector position sometimes at high angles It doesnt take a genius to realize that high energy moving through the cheapest tiny connector that has stress on it is going to likely cause problems The issue is Nvidia and others are trying to play the user error card but the reality is the connector is a bad design,,0.0,1kbey37
comment,mpx0b19,ABetterKamahl1234,,7,2025-04-30 21:56:53,,,,The cable itself is fine Like its fully electrically sound of a design and absolutely can run this level of power without any problems or risk Its the load balancing thats throwing all of that out the window PSU manufacturers are at fault too as in no way shape or form should a PSU be allowing a full 600W to be pulled on a single connector in a cable that is bundled to be rated for that A single connector rated to handle that load is pretty fuckin thick and might actually classify as an actual risk to most users even experienced builders Theyre pretty scary things in hobbies that use them and often have some pretty big safetyoriented connectors,mpwuamg,1.0,1kbey37
comment,mpv79a0,JakesInSpace,,0,2025-04-30 16:39:16,,,,Just give us a DC connector on the back of the card I have no problem using a separate power brick,,0.0,1kbey37
comment,mpuqsrd,Zealousideal_Pay7176,,0,2025-04-30 15:19:27,,,,Guess the RTX 5090 is trying to add a little extra flare to the experience huh,,0.0,1kbey37
comment,mpuc7bg,None,,-8,2025-04-30 14:07:17,,,,I had no idea this was PEBKAC People its got a fastener that CLICKS how do people do this,,0.0,1kbey37
comment,mpwmqj3,Neriya,,2,2025-04-30 20:48:21,,,,Its not always PEBKAC Sometimes fully seated cables can still have issues Plus if you design a connector that is difficult to seat correctly easy to seat incorrectly then the problem is the connector not the people plugging it in These things have to be designed around the capabilities of the people using them and the baseline of someone installing a GPU has to be someone completely unqualified and doing it for the first time,mpuc7bg,1.0,1kbey37
comment,mpwz0qz,kog,,3,2025-04-30 21:50:13,,,,Neither of you is wrong here My first thought on reading this is that I want a pic of the cable before the problem because I suspect PEBCAK Not saying this is definitely PEBCAK but Ive seen a lot of wacky shit with cabling done by people who claim they know what theyre doing But it could have also just failed,mpwmqj3,2.0,1kbey37
comment,mpz2mhz,danny12beje,,-1,2025-05-01 05:41:18,,,,How do you not correctly plug a cable thats coloured so you know when its correctly plugged,,0.0,1kbey37
comment,mq01hhk,Mastasmoker,,-1,2025-05-01 11:26:27,,,,Yet ppl still buy this shitty nvidia product,,0.0,1kbey37
comment,mpxaxv3,SuppleDude,,-4,2025-04-30 22:55:54,,,,This is why I stick to Founders Editions cards,,0.0,1kbey37
comment,mpxkfn7,ChrisFhey,,3,2025-04-30 23:49:05,,,,Founders edition cards arent safe either They use the same connector without any form of load balancing If Im not mistaken the first reported case of a 5090 melting on the Nvidia subreddit was a founders edition card,mpxaxv3,1.0,1kbey37
comment,mpxmg4g,SuppleDude,,-4,2025-05-01 00:00:23,,,,It was proven by Gamers Nexus to be user error,mpxkfn7,2.0,1kbey37
comment,mq0fro4,redbluemmoomin,,1,2025-05-01 13:02:36,,,,a lot of it is user errorBUT there is no over engineered protection mechanism Rule of thumb for me is undervolt the card reduce settings slightlyuse DLSSFG to reduce power consumption to avoid the card pulling 550W and killing itself My 5090 doesnt get much over 480W mostly its quite a bit lower Dont run at native 4K unless I know the game doesnt max out the power limit,mpxmg4g,3.0,1kbey37
