type,id,author,title,score,created_utc,url,num_comments,subreddit,body,parent_id,depth,post_id
post,1kbey37,chrisdh79,"Nvidia RTX 5090 owner reports MSI's yellow-tipped 12V-2×6 power cable melted despite foolproof design | ""Almost"" foolproof",769,2025-04-30 12:14:35,https://www.reddit.com/r/gadgets/comments/1kbey37/nvidia_rtx_5090_owner_reports_msis_yellowtipped/,120.0,gadgets,,,,
comment,mpu2kgc,bielgio,,126,2025-04-30 13:15:02,,,,A couple of years ago we got a new proposal for PC power supply standard it would use 24v for high power application like GPU and CPU instead we got high efficiency standby power and connectors melting,,0.0,1kbey37
comment,mpua3v5,ChoMar05,,47,2025-04-30 13:56:18,,,,The problem is that PCs are a very legacy market Everything is supported very long And while you can get cheap adapters for other old things like PCI and IDE even more so when those technologies where used parallel to what we have now building a PSU with 12 and 24v and maintaining high efficiency while staying in the form factor will probably be very expensive So youll have to switch GPU CPU PSU and probably fans unless the Mainboard transforms that voltage which probably will hurt efficiency and additional stuff like drives or RGB I mean its still not a bad idea but every time someone tried to implement a completely incompatible standard in the PC Market they failed so I can see why no one is doing it,mpu2kgc,1.0,1kbey37
comment,mpug6cd,bielgio,,36,2025-04-30 14:27:29,,,,The proposed standard were fully compatible Today we could fit two 1kw units in the same form factor for the same price as 1kw consumer unit server standard shows that,mpua3v5,2.0,1kbey37
comment,mpvvmkk,akeean,,24,2025-04-30 18:36:14,,,,Have you seen prices for server standard hardware,mpug6cd,3.0,1kbey37
comment,mpw6ymp,LordOverThis,,36,2025-04-30 19:31:59,,,,That isnt much of a counterpoint in a thread discussing RTX 5090s lol,mpvvmkk,4.0,1kbey37
comment,mpyf028,re_carn,,6,2025-05-01 02:47:06,,,,Legacy in PCs is pretty oneway you could connect for example an old motherboard to a new power supply but the other way around wont work theres no extra power connector for the CPU And that was fine with everyone Adding new connectors for connecting highconsumption devices would not create any problem if you want a new video card buy a new power supply unit this is relevant even without the new standard,mpua3v5,2.0,1kbey37
comment,mpumxup,xroche,,8,2025-04-30 15:00:41,,,,A couple of years ago we got a new proposal for PC power supply standard it would use 24v for high power application like GPU and CPU Very naïve question we do have 12V along with 12V so technically we should already have 24V available,mpu2kgc,1.0,1kbey37
comment,mpuqcd0,masteryoda34,,21,2025-04-30 15:17:16,,,,The 12V rail on PSUs can typically only handle a few Watts,mpumxup,2.0,1kbey37
comment,mpuw8wp,bielgio,,11,2025-04-30 15:45:40,,,,The 12v rail dont have to handle a lot of amps per the standard and is only available for the motherboard,mpumxup,2.0,1kbey37
comment,mpx8k00,TooStrangeForWeird,,-2,2025-04-30 22:42:27,,,,They all have a connection Whether its a 5v drives and such or 12v PCIe connector CPU 48 pin they still have a So not just the motherboard,mpuw8wp,3.0,1kbey37
comment,mpxqfo5,redittr,,6,2025-05-01 00:23:20,,,,You are thinking of negative as 0 volts being the only possibility The difference between 0v and 12v is 12volts The difference between 12v and 0v is 12volts The difference between 12v and 12v is 24volts As mentioned currently this rail only can provide a small amount of power,mpx8k00,4.0,1kbey37
comment,mpycgog,TooStrangeForWeird,,-5,2025-05-01 02:31:33,,,,It provides no power at all Do you know how electricity works Not trying to be mean but you seem to be under the impression that the negative or neutral wire provides power It doesnt There isnt positive and negative electricity Positive is where the electrons are flowing from and negative is where they flow to Its easier to think of it as a loop where your device like a processor just uses some of that electricity The rest of it just flows back down the loop Its a simplified explanation but AC power like for your house is pretty much exactly that DC currents like computers use are slightly more complicated its the same idea overall though,mpxqfo5,5.0,1kbey37
comment,mpz4wec,hi_there_im_nicole,,7,2025-05-01 06:02:25,,,,This whole comment is very inaccurate What matters is the voltage potential between two conductors It doesnt have to be a positive wire and a ground wire it can be any wires at different voltages You could even use a 12v and a 5v wire and youd get 7 volts across them Any electrical device connected across this circuit cant even tell the lower voltage wire isnt at ground potential without a ground reference It doesnt matter at all This principle is how North American houses get 240v for large appliances like electric stoves dryers and water heaters There is no 240v line running to the house Instead the appliance is connected across two splitphase 120v conductors Being 180 out of phase with each other at a point in time one is at 120 volt potential while the other is at 120 volts giving the appliance a total of 240 volts RMS Its a neat way to make higher voltages and powers available in a circuit while simplifying the power supply and in the case of residential AC power maintaining a lower safer maximum differential from ground,mpycgog,6.0,1kbey37
comment,mq0fm6t,suicidaleggroll,,1,2025-05-01 13:01:41,,,,What matters is the voltage potential between two conductors It doesnt have to be a positive wire and a ground wire it can be any wires at different voltages You could even use a 12v and a 5v wire and youd get 7 volts across them While true you would get 7V across them that doesnt mean you could use that 7V to power something In order to do that the 5V rail would need to be able to sink current Many DC supplies can only source current they cant sink so if you tried to use it as the return for your 7V supply youd just end up pulling that 5V rail up to 12V and most likely damaging something,mpz4wec,7.0,1kbey37
comment,mpypi40,redittr,,4,2025-05-01 03:57:38,,,,Do you know how electricity works It has been a while since I was at school but I have a good enough idea Firstly this is wrong There isnt positive and negative electricity Positive is where the electrons are flowing from and negative is where they flow to Electrons flow from negative to positive Electrons are negative charged Protons are positively charged Neutrons are not charged either way Protons and electrons want to balance each other out so the loose electrons flow from negative to positive but you seem to be under the impression that the negative or neutral wire provides power It doesnt Negative and neutral are different things Negative doesnt provide power Neither does positive either really Its the difference between the two which is the power,mpycgog,6.0,1kbey37
comment,mq0f41j,suicidaleggroll,,1,2025-05-01 12:58:41,,,,He got his terminology a little off but the result is the same The 12v rail in a computer PSU can only sink a small amount of current so it cant be used to maintain a 24V differential with the 12v rail at high current If you try to push more than an amp or so into the 12v rail it will collapse and potentially damage the regulator thats generating it,mpycgog,6.0,1kbey37
comment,mpttk8s,lunas2525,,301,2025-04-30 12:21:25,,,,Color me shocked a fundamentally flawed connector melts under normal use 12vpwr needs a class action and a ban,,0.0,1kbey37
comment,mpu8qnw,hungry4pie,,62,2025-04-30 13:49:04,,,,Its fucking wild to me that theyre still clinging to 12VDC especially since PC power supplies have been pulling more than 10A at 110VAC for like 10 years now the more high end ones at least This isnt as big a problem in Australia and Europe since we use 240V but its going to become a problem eventually But by then gaming PCs and graphics cards will become so expensive that only the 9 richest kings of Europe will afford them,mpttk8s,1.0,1kbey37
comment,mpualng,lunas2525,,23,2025-04-30 13:58:53,,,,Yeah imho nvidia and amd are both going in the wrong direction the power requirements should not be pushing the limits of household wiring And if a gpu is going to need 600w they either have to do something about the amperage thicker wires or more of them and current balanced which is part of the issue here or they could go to a 24v or 48v standard Or gpu can have their own dedicated power brick and isolate from system power Imagine a laptop barrel jack on the back of the card and a 12v48v power brick Apparently the main reasons not to go over 12v is increased emi and the size of components Still they either need to stop throwing more wattage at the issue and work within a envelope that does not meltdown when at full use Or they need to figure out how to safely do it,mpu8qnw,2.0,1kbey37
comment,mpx76xl,hungry4pie,,5,2025-04-30 22:34:44,,,,EM Interferance sounds like the sort of problem youd be worried about on an overclocked Athlon CPU in 2001 not a 2000 graphics card in 2025,mpualng,3.0,1kbey37
comment,mpx8uth,TooStrangeForWeird,,5,2025-04-30 22:44:09,,,,The raw power going through them is the problem Sure we got better at filtering interference but an overclocked 2001 Athlon cant pull 600 fuckin watts lol,mpx76xl,4.0,1kbey37
comment,mpzvbxs,reisstc,,7,2025-05-01 10:35:31,,,,15 years ago I had a reasonably powerful PC a Phenom II X4 940 BE coupled with a GTX280 At the wall I recall the whole system pulled about 450w or so under load Bit nuts a single GPU can exceed that now,mpx8uth,5.0,1kbey37
comment,mq7alft,danielv123,,2,2025-05-02 14:29:06,,,,To be fair I run power monitoring from the wall on my system with a 1080 4080s 9950x and havent seen it exceed 500w yet 450 back then was a lot,mpzvbxs,6.0,1kbey37
comment,mpx8n0k,lunas2525,,1,2025-04-30 22:42:56,,,,It is a concern and is why 12v and less it still used on most things computer,mpx76xl,4.0,1kbey37
comment,mpvvwxv,akeean,,1,2025-04-30 18:37:37,,,,current balanced if only they were,mpualng,3.0,1kbey37
comment,mpvx2us,lunas2525,,2,2025-04-30 18:43:18,,,,If they were this would not be an issue But apparently nvidia had 2 channels of regulation on the 30 series and now only 1 on the 40 series and have been trying to push the problem off on psu manufacturers,mpvvwxv,4.0,1kbey37
comment,mpwo8k9,QuaternionsRoll,,3,2025-04-30 20:55:32,,,,3 shunts in the 4090 1 in the 5090,mpvx2us,5.0,1kbey37
comment,mq0mn6v,Ab47203,,1,2025-05-01 13:41:48,,,,The literal highest end AMD card right now uses 304w with peaks likely below 400wthis is a lot more of an Nvidia issue than an AMD one AMD is the one that made Ryzen idle at crazy low power levels,mpualng,3.0,1kbey37
comment,mq0nfc4,lunas2525,,1,2025-05-01 13:46:04,,,,Yeah i have not heard of any amd cards bur ing these connectors but still i dont like them being used,mq0mn6v,4.0,1kbey37
comment,mq0noqw,Ab47203,,1,2025-05-01 13:47:29,,,,I also dont like the connectors but AMD has been throttling back power demands lately and theyre doing good work with that,mq0nfc4,5.0,1kbey37
comment,mpuaq0a,DJKGinHD,,2,2025-04-30 13:59:31,,,,Coming summer 2027 dual outlet power supplys Dem games need more powaaaaa gifgiphyMEeFCX0YH0NzuqpIUk s,mpu8qnw,2.0,1kbey37
comment,mpubsyj,Throwaway-tan,,3,2025-04-30 14:05:12,,,,I mean dual power supplies are already a thing My case has a slot which can be used either for a second power supply or alternatively as hard drive storage which is what I use it for,mpuaq0a,3.0,1kbey37
comment,mpueg29,DJKGinHD,,6,2025-04-30 14:18:49,,,,Not dual power supplys Dual outlet power supplys 1 PSU plugs in to 2 wall outlets,mpubsyj,4.0,1kbey37
comment,mpugiou,modix,,4,2025-04-30 14:29:11,,,,Start running 220s to the office soon while were at it,mpueg29,5.0,1kbey37
comment,mpvcrks,Hugh_Jass_Clouds,,1,2025-04-30 17:05:56,,,,That would not fix anything at all As that one dual socket outlet is still on the same wire and same breaker,mpueg29,5.0,1kbey37
comment,mpve5bx,DJKGinHD,,7,2025-04-30 17:12:37,,,,The instructions will be clear that they need to be plugged in to 2 different circuits Electricians are going to LOVE gamers,mpvcrks,6.0,1kbey37
comment,mpvs1sn,Proud_Tie,,2,2025-04-30 18:18:47,,,,add a long ass 3 prong to the Ethernet cables running around our apartment because we have the dumbest circuit layout ever,mpve5bx,7.0,1kbey37
comment,mpx83ho,hungry4pie,,0,2025-04-30 22:39:50,,,,Servers already have that buts its two independent PSUs that connect to two separate PDUs on different circuits,mpve5bx,7.0,1kbey37
comment,mpx8fuw,DJKGinHD,,3,2025-04-30 22:41:47,,,,already have that but its different Thank you,mpx83ho,8.0,1kbey37
comment,mpxk88f,Christopher135MPS,,1,2025-04-30 23:47:56,,,,Dedicated 3phase power line straight from the network to the PC Bypass the household power completely,mpvcrks,6.0,1kbey37
comment,mpu66jj,MysticalHero709,,34,2025-04-30 13:35:11,,,,Is your colour of shock yellow,mpttk8s,1.0,1kbey37
comment,mpu97ik,Xero_id,,14,2025-04-30 13:51:33,,,,No but the flames inside the case are,mpu66jj,2.0,1kbey37
comment,mpucr4l,TheRageDragon,,2,2025-04-30 14:10:09,,,,Like a Pikachu,mpu66jj,2.0,1kbey37
comment,mpu8ppy,lunas2525,,-3,2025-04-30 13:48:56,,,,Red,mpu66jj,2.0,1kbey37
comment,mpuvruw,Moscato359,,10,2025-04-30 15:43:22,,,,12vpwr is perfectly fine for 350w work loads 600w is way too much,mpttk8s,1.0,1kbey37
comment,mpuxf2a,lunas2525,,12,2025-04-30 15:51:17,,,,It was designed for 450w and 600w Cards that have 350w loads are still melting because for some odd reason the card and psu decide all 300w need to come over 1 or 2 18 gauge wire,mpuvruw,2.0,1kbey37
comment,mpuz1h6,Moscato359,,7,2025-04-30 15:59:02,,,,So that is a card side defect and not an issue with the connector If all 4 corners had pins that were power balanced then that would not be a problem,mpuxf2a,3.0,1kbey37
comment,mpv15vc,lunas2525,,7,2025-04-30 16:09:26,,,,Yes in theory if the card had proper seperation and current limiting so each of the 6 pairs only provided 100w at max these connectors would not be melting But nvidia decided to force psu manufacturers to work that out According to the current card side specification the 12v and ground are tied together as 1 on the card Any and all load balancing is to be done psu side Each pair should be current limited to 834 Amps,mpuz1h6,4.0,1kbey37
comment,mpv2byp,Moscato359,,4,2025-04-30 16:15:07,,,,Technically you dont need power balancing on all 6 pins pairs you need them on the corners If all corners check resistance then it guarantees a solid connection from a geometric standpoint Too much resistance Stop,mpv15vc,5.0,1kbey37
comment,mpv4yx0,lunas2525,,4,2025-04-30 16:28:04,,,,That is only going to cause pairs in the center to melt This is not an issue if the plug being partially in or in crooked the cards or psu are in the cases it melts are providing as much as the card wants over 1 2 or 3 wires instead of current limiting and balancing over all 12 wires This can be fixed 3 ways make each pair an individual seperate rail that is current limited psu side change the whole thing to be 6 gauge wire and use a xt120 connector rated for 60 amps at 12v linus did this or load balance on the card So 1st option everyone needs a new psu and psu makers need to have a expensive new circuit for high amperage in it 2nd option thick cables with a different connector 3rd make more complicated power management on the card increasing card cost Imho dumping this shit connector and doing option 2 probably best Each pair not just the corners needs to be limited to only be able to provide 8333 amps,mpv2byp,6.0,1kbey37
comment,mpwuvnc,Moscato359,,1,2025-04-30 21:28:41,,,,I was under the impression that the failures were due to insufficient contact In the image above it looks like they clicked the connector but the connector got bent which is why EVERY pair had one pin melted on one side The side which doesnt click got loose likely due to a bend Why did the non clicky side of this connector in the OP melt Every single pair had one bad connection,mpv4yx0,7.0,1kbey37
comment,mpxaf26,lunas2525,,2,2025-04-30 22:52:57,,,,It is happening in situations that isnt the case either besides it should not be so fragile that it cant be tweaked less than 3 mm or the wires anything but straight But that is the reason nvidia gave in their investigation As for the op hard to say we only have what the op has said to go by My guess is the cable was bent more than 179 degrees All 6 12v pins burned And the reason is it yellow is if you see color it is not fully seated so it not being fully seated is unlikely The article in the op said it was drawing 400w for 2 hours So it cant deliver the rated current to all pins without melting Humm yeah not gonna buy anything using 12vpwr,mpwuvnc,8.0,1kbey37
comment,mpwxmkp,ABetterKamahl1234,,2,2025-04-30 21:42:53,,,,But nvidia decided to force psu manufacturers to work that out TBF blaming nvidia here isnt unwarranted But why the fuck are PSU manufacturers allowing their pinouts to go above ratings per pin They literally have a single job stable power delivery Blowing out a pinouts ratings isnt that Having them do it too means that fuckups are kind of guarded against and its way easier to blame a card manufacturer They have power ratings on connectors for a reason it shouldnt be open season for me to pull an obscene amount of power on these things Cant say that this continued news is exciting me on PSU companies Spec should never be well give until something fails regardless of where in the line of power you are Fixing this monumental oversight would actually solve a bunch of smaller problems mostly fires,mpv15vc,5.0,1kbey37
comment,mpx73zk,lunas2525,,3,2025-04-30 22:34:17,,,,Never said nvidia was alone in the blame Anyone who supports the 12vpwr connectorstandard shares blame Psu yes coming out of the psu should be limited And card side there should be some sort of limiting on what it can draw not just open the flood gate and as much power as you can dump into it I think linus managed to dump over 1000w into a 40 or 50 series after modding the connector with some 4 or 6 gauge wire Amd makes me sad and upset they picked up the 12vpwr connector When this shit first started i thought nvidia might back track and drop the thing Nope full send,mpwxmkp,6.0,1kbey37
comment,mpy1ygf,Mental_Medium3988,,2,2025-05-01 01:30:11,,,,just put a real connector on there that can handle the power like linus did with an xt60 cable sure it might cost a little more per card but itll save a lot of terrible pr,mpttk8s,1.0,1kbey37
comment,mpy3u0z,lunas2525,,2,2025-05-01 01:41:08,,,,Those xt120 connectors linus used have been around for years and years have been proven safe and are available in bulk i gurentee they would not increase the bom cost more than the negative pr,mpy1ygf,2.0,1kbey37
comment,mpxut9m,HKChad,,0,2025-05-01 00:48:37,,,,The issue is the the gpu expects more watts than a single connector can supply if one of the pins isnt fully seated or comes loose the gpu will pull all the power from the other pins overloading and melting the ones connected So the fault is shared amongst power supplies gpu and the connector standard as any of them could avoid this,mpttk8s,1.0,1kbey37
comment,mpy0n29,lunas2525,,2,2025-05-01 01:22:24,,,,The gpu only has 2 connectors at least on the 50 Series The gpu doesnt expect anything it pulls whatever it can regardless of if it should Where the gpu should hit a current limiting wall it doesnt,mpxut9m,2.0,1kbey37
comment,mptwiic,kazuviking,,103,2025-04-30 12:39:44,,,,You cannot fix something that is fucked from the beginning,,0.0,1kbey37
comment,mpuka23,NootHawg,,30,2025-04-30 14:47:46,,,,This exactly I hope my 3090 lasts long enough for them to finally scrap this abysmal 12vpwr connector The 3090 has 3 pcie molex connectors I think anyone in their right mind would accept 4 connectors over 1 sleeker and smaller connector that has a 5050 chance of melting and then possibly burning your house down The fact they doubled down with the 50 series after the shitshow from the 40s just tells me they dont give a single shit about the consumer,mptwiic,1.0,1kbey37
comment,mq1nn6s,BlackSecurity,,1,2025-05-01 16:46:47,,,,Of course they dont GAF Just look how much they are charging for the cards and people still buy them The consumers are just as dumb as them but they make their money so who cares,mpuka23,2.0,1kbey37
comment,mq47okd,mister2forme,,1,2025-05-02 00:40:23,,,,The 30 series had proper voltage regulation IIRC They removed it from the 40 series and thats when connectors surprisingly started melting,mpuka23,2.0,1kbey37
comment,mpuxuem,iDontRagequit,,-30,2025-04-30 15:53:19,,,,My 1070 is still crushing 1440p I have zero plans to ever upgrade it Ill run it till it kicks the bucket and then Ill see if its repairable before I finally move on I hope you can manage to squeeze another year out of that 3090 though bud,mpuka23,2.0,1kbey37
comment,mpv9sg2,TwoPrecisionDrivers,,57,2025-04-30 16:51:33,,,,No need to lie your 1070 is not crushing 1440p on any current gen game lol,mpuxuem,3.0,1kbey37
comment,mpvejsn,PM_ME_STEAM_KEY_PLZ,,11,2025-04-30 17:14:31,,,,Playing starseige tribes,mpuxuem,3.0,1kbey37
comment,mpwodav,aleramz,,15,2025-04-30 20:56:09,,,,Its OK to maximize your PC components but dont lie to yourself or even say that The 1070 is is still kicking fine Whats a good card for its price but its almost a 10 year old card And not even the one that eas Its top of the line I have a 3090 and its already struggling in some games at 1440p and 4K and that shit has 24 GB of vram,mpuxuem,3.0,1kbey37
comment,mpx9sze,TooStrangeForWeird,,-8,2025-04-30 22:49:28,,,,Im running an OG Titan as my daily driver lol Some of us dont care much about fancy graphics I have a 1660 Super sitting around but just havent gotten around to installing it lol,mpwodav,4.0,1kbey37
comment,mq2z7f6,monstrinhotron,,1,2025-05-01 20:36:29,,,,I finally upgraded my Titan the other week When I bought it 78 years ago that thing was the bees knees the wasps nipples But alas it was conceived long before the AI experiments I want to do existed and could not compete,mpx9sze,5.0,1kbey37
comment,mq6n3ee,TooStrangeForWeird,,1,2025-05-02 12:18:24,,,,Yeah Im finally starting to get limited on it lol There are a few models that can deal with only 6GB RAM but not many,mq2z7f6,6.0,1kbey37
comment,mpvrlx1,nondescripthumanoid,,5,2025-04-30 18:16:38,,,,My desktop is running a 4070 but my travel laptop is still running a 1050 Honestly the 1070 will cruise into the future for any game released before 2018 at 60fps1080p,mpuxuem,3.0,1kbey37
comment,mpu7wn6,ledow,,21,2025-04-30 13:44:36,,,,And I can see now that well end up starting down the route of new PSU standards including power negotiation and if your PSU motherboard GPU and cable arent compatible it wont power up your devices at all Honestly getting a few hundred watts of 12V power down a cable in a sensible manner isnt difficult We do it all the time in cars trucks boats solar install setups etc even UPS with FAR MORE power and do so pretty safely But if your PSU devices arent playing the game and just making assumptions how the cable will handle it resulting in these kinds of issues someones just going to make a safer type of PSU protocol so they dont have liability for setting your curtains on fire when you plug in a new GPU Get ready for Error Insufficient power to enter gaming mode messages,,0.0,1kbey37
comment,mpuwdxu,tastyratz,,12,2025-04-30 15:46:20,,,,This whole situation blows me away Electrical standards and requirements are pretty well known and documented They are also taken VERY seriously HOW a standard like this was developed when its obviously not going to be enough is beyond me,,0.0,1kbey37
comment,mpua55s,sarhoshamiral,,28,2025-04-30 13:56:29,,,,Because the cable wasnt the issue It is the fact that nothing is ensuring load on a single wire doesnt exist that wires capacity Sure cable is rated for 600w but individual wires arent If neither GPU or PSU ensures load is balanced then you will always have some cases where load becomes unbalanced and boom,,0.0,1kbey37
comment,mpuqa27,karatekid430,,9,2025-04-30 15:16:57,,,,I wonder why the dumbarses did not just use a single pair of thick conductors Seriously,mpua55s,1.0,1kbey37
comment,mputfze,sarhoshamiral,,14,2025-04-30 15:32:14,,,,Because you need a 7 or 9 gauge wire which would not be flexible at all At this point what we need is GPUs not PSUs to have an external power connector Put a 12v DC adapter plug on the back and have an external brick All problems solved and it would cost maybe 20 extra,mpuqa27,2.0,1kbey37
comment,mputwh1,karatekid430,,2,2025-04-30 15:34:26,,,,Increasing the run length of the low voltage segment is a truly inspired idea,mputfze,3.0,1kbey37
comment,mpuxzk4,sarhoshamiral,,5,2025-04-30 15:54:00,,,,You dont have to increase the 12v run length Most 12vhpwr cables are usually 2ft today Thats more than enough length to have a brick with 12v and 120v wires on both end and where 12v run can be limited 2ft If you search Amazon for 12v 600w adapter you get plenty of options to get an idea You can even make the external brick smaller since most people wouldnt be opposed to the idea of using a single PCIE plug providing some of the power that way Cost of these circuity would be far below what the GPU itself costs anyway,mputwh1,4.0,1kbey37
comment,mpwzs2n,jeffsterlive,,1,2025-04-30 21:54:08,,,,The idea is to not run a wire from the PSU to the GPU but an external transformer plugged into another outlet The case would have a hole for the power connection,mputfze,3.0,1kbey37
