type,id,author,title,score,created_utc,url,num_comments,subreddit,body,parent_id,depth,post_id
comment,mq06pad,cpufreak101,,6,2025-05-01 12:04:00,,,,Iirc they were the company that invented the first 35mm film camera name still has prestige to this day as a result,mq05j1p,2.0,1kc6fjo
comment,mq092ic,BartHarleyJarvis-,,11,2025-05-01 12:20:00,,,,They have a hand in semiconductor fab industry Dont write them off so easily,mq06pad,3.0,1kc6fjo
comment,mq18i8z,Front-Cantaloupe6080,,1,2025-05-01 15:32:06,,,,Ive said it before and Ill say it again there has NEVER been a better time for both Americans AND Canadians to support Canadian companies Shop canadian brands at canadian retailers if you can Baby Quark Baby baby bottles and feeding Clek car seats Food Mid Day Squares chocolate treats GoBio organic foods RetailD2C Monos luggage and accessories Vessi shoes Clothing Duer athletic forward Aritzia fashion forward You can support many Canadian retailers who are doing the hard job of navigating this hardship for all of us Wellca London Drugs,,0.0,1kc6fjo
comment,mq22wcd,mtl_jim2,,2,2025-05-01 17:59:26,,,,So basically they dont want Americans to order from Canadian retailers to cannibalize sales from US retailers Canadians get shafted,,0.0,1kc6fjo
comment,mq2bbxx,nsomnac,,0,2025-05-01 18:40:56,,,,RTFA Not the reason whatsoever They ship all products intended for Canada via US distribution which makes them subject to tariffs Yes they could recoup the tariff paid however it probably costs more to do that than to just pass on the cost of the tariff Long term solution is to establish or move North American distribution to Canada from US which would just be another slap on the face to US as they not only lose access to international products not available in US but also the US based jobs for people that were responsible for handling distribution Are we winning yet,mq22wcd,1.0,1kc6fjo
comment,mq09hzy,waloshin,,0,2025-05-01 12:22:51,,,,Screw Leica and their overpriced rich mans junk cameras anyway,,0.0,1kc6fjo
comment,mq43d2k,ariukidding,,1,2025-05-02 00:14:37,,,,This is another element of the Tariffs Manufacturers can also put a blanket price increase globally to offset tanking saleshigher costs on a heavily tariffed country Personally id stay away from companies that would do this If i had no business against US and China why the fuck would i the consumer share their pain,,0.0,1kc6fjo
comment,mq12iis,Masrim,,-1,2025-05-01 15:02:50,,,,Never even heard of Leica wont be hard to boycott,,0.0,1kc6fjo
comment,mq1n6h7,Finwolven,,2,2025-05-01 16:44:33,,,,Youve never spent over 3000 on a single handactuated camera lens Or 30 000 on a lens for a professional movie camera What are you poor Do you not _crave_ the highest quality of optical products s,mq12iis,1.0,1kc6fjo
comment,mq29zo2,nsomnac,,2,2025-05-01 18:34:23,,,,They do manufacture more things than just cameras They manufacture all kinds of products involving optics that are used throughout multiple industries like medical space defense and manufacturing,mq1n6h7,2.0,1kc6fjo
comment,mq1qsg7,Masrim,,0,2025-05-01 17:01:57,,,,I have a nokia,mq1n6h7,2.0,1kc6fjo
comment,mq13rr2,FallenAngel7334,,-3,2025-05-01 15:09:02,,,,I can confirm that the tariff price adjustment will impact the Canadian market similarly to the US as Leica Camera North America operates out of the US with all imports managed through its US headquarters before reaching Canada Nathan KellumPathe Trade Marketing Product Communications Manager at Leica Camera explains to PetaPixel Why is nobody reading the article,,0.0,1kc6fjo
comment,mq1m4uv,bianary,,3,2025-05-01 16:39:27,,,,They can request their tariffs be refunded if theyre immediately exporting to Canada,mq13rr2,1.0,1kc6fjo
comment,mq1mq3u,Finwolven,,6,2025-05-01 16:42:20,,,,And they will but also will add to the price Because they can,mq1m4uv,2.0,1kc6fjo
comment,mq1t5wc,bianary,,2,2025-05-01 17:13:22,,,,Im just answering why the defense of its shipped through the US fails not addressing the reality of corporate greed,mq1mq3u,3.0,1kc6fjo
comment,mq29fbd,nsomnac,,1,2025-05-01 18:31:34,,,,Sure But thats not a zero cost activity Leica has to pay people to file and monitor all that paperwork Its not just one person either Its likely one person doing the main paperwork but then any number of finance and lawyers involved in the process That cost isnt nonzero Its not unreasonable to believe that task alone adds significant cost to recoup those payments and pass through of the tariff may be the cheaper option at this time,mq1m4uv,2.0,1kc6fjo
comment,mq2kkrz,bianary,,1,2025-05-01 19:26:26,,,,The way to get companies to figure out how to efficiently do things is to not just shrug and pay them to gouge you,mq29fbd,3.0,1kc6fjo
comment,mq2uzdk,nsomnac,,1,2025-05-01 20:16:18,,,,Thats all fine and dandy for a keyboard warrior who has zero insight into Leicas internal business costs and financial position Im not claiming to know any but using simple critical thinking skills Leica sales into Canada is likely a very small fraction of sales in comparison to other regions globally Moving or establishing a new Canadian port of entry may not just make sense if the historical sales in Canada dont create enough revenue or profit to cover the operational costs for selling into Canada alone I dont claim to know what 7 increase means in total revenue from Canadian sales but given the population I cant imagine its a giant number overall Buildings people insurance etc are expensive unless the tariffs adds many millions of dollars annually that could be circumvented by moving or recouping it likely doesnt make sense But Im only making SWAGs without knowing the real numbers Realistically since we know baseline tariff is 10 using algebra one can probably deduce what that markup on Leica imports actually are since the tariff is applied to the wholesale price not the retail price If you know the old retail price and the current retail price changed by 7 you know that should be equal to some base price 10 some amount of retail markup If theres any published insight into historical sales in Canada one might be able to figure out if this is price gouging or not Until then my assumption is it doesnt make financial sense to move operations to Canada or recoup the tariffs paid or maybe the 7 does factor in the cost to recoup tariffs,mq2kkrz,4.0,1kc6fjo
comment,mq2wb6h,bianary,,2,2025-05-01 20:22:39,,,,So its not fine and dandy to assume they can recover their financial losses through known mechanisms but it is fine and dandy to assume that a business And businesses are just _known_ for their honesty and transparency to customers about their costs is being truthful about how they have to just have to pass the costs on Right Pull the other one,mq2uzdk,5.0,1kc6fjo
comment,mq2qps1,fakint,,-1,2025-05-01 19:55:47,,,,Lol as someone could ever afford a Leica,,0.0,1kc6fjo
comment,mq3optf,ajyahzee,,-1,2025-05-01 22:51:00,,,,51st state indeed,,0.0,1kc6fjo
comment,mq2xu6p,NewDad907,,-4,2025-05-01 20:29:54,,,,Kind of like how big pharma jacks up prices in the USA to compensate for regulated pricing the rest of the worlds governments impose Youre welcome world The USA is happy to subsidize big pharmas profits so yall can have low costfree healthcare,,0.0,1kc6fjo
comment,mq3rrcq,DylanRahl,,6,2025-05-01 23:08:19,,,,Koolaid has a toxic effect wean yourself,mq2xu6p,1.0,1kc6fjo
comment,mq4kin7,NewDad907,,-2,2025-05-02 01:56:53,,,,lol as if I voted for a MAGA Republican piece of authoritarianism trash You dont know me so your opinion is less than worthless smh GTFO of here youre intentionally being an obtuse contrarian with no intention of discussing the issue in good faith Dont bother replying notifications for this post have been disabled,mq3rrcq,2.0,1kc6fjo
comment,mq051mw,NouXouS,,-16,2025-05-01 11:52:25,,,,Never heard of it Raise away,,0.0,1kc6fjo
comment,mq0mulk,SuicidalChair,,1,2025-05-01 13:42:54,,,,Never watched Eurotrip I see,mq051mw,1.0,1kc6fjo
comment,mq0n3ja,NouXouS,,-2,2025-05-01 13:44:16,,,,Prices of everything are rising in Canada Buy local,mq0mulk,2.0,1kc6fjo
comment,mq0npkt,SuicidalChair,,4,2025-05-01 13:47:37,,,,Im not buying professional grade cameras or microscopes regardless of where they are made but thank you for the tip lol,mq0n3ja,3.0,1kc6fjo
