type,id,author,title,score,created_utc,url,num_comments,subreddit,body,parent_id,depth,post_id
post,1kc6fjo,diacewrb,Leica Raises Prices in Canada Because of US Tariffs,1263,2025-05-01 11:30:33,https://www.reddit.com/r/gadgets/comments/1kc6fjo/leica_raises_prices_in_canada_because_of_us/,133.0,gadgets,,,,
comment,mq0252h,diacewrb,,780,2025-05-01 11:31:23,,,,They said they wanted price parity between Canada and the US which makes no sense If an American purchased a Leica product anywhere in the world and brought it back to the US they would still be subject to the tariff If they purchased in Canada they would effectively end up paying the tariff twice As bad as sony,,0.0,1kc6fjo
comment,mq02qn7,4-3-4,,100,2025-05-01 11:35:49,,,,Illegal Parallel imports risks,mq0252h,1.0,1kc6fjo
comment,mq0edww,etzel1200,,30,2025-05-01 12:54:17,,,,But who cares If its a genuine product being bought wont their profit be the same,mq02qn7,2.0,1kc6fjo
comment,mq7xxw0,sioux612,,2,2025-05-02 16:19:54,,,,Dont worry there will be a lobbyists for some monopoly camera dealer Just like it was the US auto dealers who caused the 25 year import ban,mq0edww,3.0,1kc6fjo
comment,mq0aq66,wsippel,,126,2025-05-01 12:31:00,,,,Its a bit more complicated Leica USA handles imports and distribution in North America The way they explain it they have to pay US import tariffs on cameras that end up in Canada so what are they supposed to do The obvious solution is to ship from the EU to Canada directly but that has to be set up and nobody knows how long the tariffs will stick around Once again the main issue is the uncertainty,mq0252h,1.0,1kc6fjo
comment,mq0eokw,etzel1200,,63,2025-05-01 12:56:05,,,,They should get any tariffs back when they export the cameras again to Canada Or they can go from a FTZ in the US directly to Canada Are they just lazy unaware lying Am I missing something,mq0aq66,2.0,1kc6fjo
comment,mq0s4lp,peacefulhectarez,,82,2025-05-01 14:10:59,,,,Nope youre not missing anything They or their customs broker and freight people are lazy The duty rate on a lot of lab equipment was zero or nearly zero so it was cheaper and easier just to import a bunch of stuff to the US and then reexport it as needed That gives you the freedom to sell it in the US if you want With higher duty rates youd want to put it in an FTZ pending reexport ship directly to Canada or as a last resort file for drawback for reexports This is Leica saying they dont give enough of a fuck about Canadian customers to set up a Canadian distrbution channel so theyre going to keep supplying dutypaid stuff out of the US Smart buyers in Canada will find suppliers in Europe willing to ship directly which will piss Leica off but hopefully theyre also too lazy to play games like cancelling warranties on greymarket equipment,mq0eokw,3.0,1kc6fjo
comment,mq14byk,adjudicator,,15,2025-05-01 15:11:47,,,,Canceling warranties on grey market stuff odd illegal in much of Canada anyway which they should care about if they want to continue doing business here,mq0s4lp,4.0,1kc6fjo
comment,mq57jfi,peacefulhectarez,,3,2025-05-02 04:30:50,,,,It can be worked around where the Canadian distributor is the manufacturer and wont warranty anything they didnt sell Car and motorcycle manufacturers did a lot of it 15 years ago during dollar parity when no one would work on Americanspec vehicles I had to threaten to complain to Germany when BMW wouldnt even sell me parts for my bike and they only backed off because I l lived in California and was on a road trip,mq14byk,5.0,1kc6fjo
comment,mq2gpzl,JSteigs,,7,2025-05-01 19:07:26,,,,Further more cameras probably arent a big part of their business Their survey gear is spendy A single gps setup can run 40k Thats a lot of cameras Large construction companies are moving to having one or two gps units per machine on big jobs Sounds like they make medical stuff too Seems like they might just lose market share in Canada to companies with a direct distributor setup,mq0s4lp,4.0,1kc6fjo
comment,mq49op9,creimer52,,3,2025-05-02 00:52:20,,,,Their LiDar scanners such as the RTC360 run at 100k,mq2gpzl,5.0,1kc6fjo
comment,mq1sren,Pikeman212a6c,,10,2025-05-01 17:11:25,,,,Shifting to a FTZ isnt nothing But not being willing to do the paperwork to file for drawback is just being too lazy to give a fuck about Canada,mq0s4lp,4.0,1kc6fjo
comment,mq5gppo,quotidianwoe,,0,2025-05-02 05:48:48,,,,Or American authorized distributors whined to them how smarter customers would just go to Canada and buy one,mq0s4lp,4.0,1kc6fjo
comment,mq0n60i,0xF00DBABE,,-5,2025-05-01 13:44:39,,,,Thats not how it works AFAIK Reexport doesnt mean you get tariffs back,mq0eokw,3.0,1kc6fjo
comment,mq0nk85,etzel1200,,15,2025-05-01 13:46:48,,,,,mq0n60i,4.0,1kc6fjo
comment,mq0sv1e,r0th3rj,,16,2025-05-01 14:14:43,,,,Not automatically But as long as the product is not substantially transformed prior to export you can certainly engage the duty drawback process to recoup that spend,mq0n60i,4.0,1kc6fjo
comment,mq1t7f5,Pikeman212a6c,,9,2025-05-01 17:13:34,,,,CBP Officer here You can get the money back You need to do a bit of paperwork and keep track of everything But this is a large company assumedly represented by a brokerage or 3PL Its really not that hard,mq0n60i,4.0,1kc6fjo
comment,mq354g1,Shiva-,,-1,2025-05-01 21:05:12,,,,FTZ arent exactly free and I am certain the pricesdemand for them have been going up To the point it might not even available,mq0eokw,3.0,1kc6fjo
comment,mq24qa3,a_cute_epic_axis,,2,2025-05-01 18:08:21,,,,so what are they supposed to do Not pay the tariff or get a refund which is the legal correct and long standing way for such goods,mq0aq66,2.0,1kc6fjo
comment,mq2avc8,bamboob,,5,2025-05-01 18:38:41,,,,This is one of the things that I was expecting Once companies realize that they have a greenlight to just start upping prices they will do it and I suspect those prices are never going to come down to the level that they were even if the tariffs completely go away,mq0252h,1.0,1kc6fjo
comment,mq5tg8s,jeff_the_weatherman,,1,2025-05-02 07:55:30,,,,Right If people are willing to pay the higher price for your item why would you ever drop it Just becomes an excuse to squeeze out some more profit,mq2avc8,2.0,1kc6fjo
comment,mqbd1n8,Nope_______,,1,2025-05-03 03:30:28,,,,Why didnt they raise their prices six months ago then They dont need an excuse Youre saying they didnt want to make more money back then,mq2avc8,2.0,1kc6fjo
comment,mq0b6gt,aztec0000,,5,2025-05-01 12:33:59,,,,If they want price parity why not canadian at par Worst is you buy something in canada and they charge you usd,mq0252h,1.0,1kc6fjo
comment,mq05ike,justyannicc,,14,2025-05-01 11:55:45,,,,Somebody asked that exact question for the flipper zero and I explained why in Europe the prices shouldnt increase this is pure greed and got down voted to all hell Here is the link,mq0252h,1.0,1kc6fjo
comment,mq0906e,SniperTeamTango,,27,2025-05-01 12:19:34,,,,The actual point you made had nothing to do with you getting downvoted into the ground,mq05ike,2.0,1kc6fjo
comment,mq09ev3,ElephantElmer,,3,2025-05-01 12:22:16,,,,What do you mean Tourists bringing back stuff they buy abroad for personal use get taxed on it,mq0252h,1.0,1kc6fjo
comment,mq0c35n,orangejuicerooster,,16,2025-05-01 12:39:52,,,,Yes Customs asks if you have anything to declare for exactly this purpose They determine what if any import taxesfees are to be collected and collect them before you enter the country,mq09ev3,2.0,1kc6fjo
comment,mq0fywz,b1gwheel,,6,2025-05-01 13:03:48,,,,Yes there are exemptions and depending on how long abroad you can bring back higher values but everything coming into the country is subject to examination duties and taxes sales excise tariffs etc,mq09ev3,2.0,1kc6fjo
comment,mq2byi3,j4nkyst4nky,,3,2025-05-01 18:43:59,,,,Its important to note you are allowed to bring back up to 800 in value without paying taxes on it,mq09ev3,2.0,1kc6fjo
comment,mq3d38n,No-Setting764,,2,2025-05-01 21:46:27,,,,In Canada they make you declare what youve purchased You are allowed to bring 2 cartons of cigarettes any more you get charged the tariff Its harder to prove with electronics and stuff theyd have to go through your bags and be able to prove you bought it abroad Next time you come home from another country pay attention to the forms you sign at customs,mq09ev3,2.0,1kc6fjo
comment,mq0oaj6,Silk_the_Absent1,,1,2025-05-01 13:50:47,,,,I guess its part of the entry point,mq0252h,1.0,1kc6fjo
comment,mq2pyx5,Infarad,,1,2025-05-01 19:52:12,,,,Mind elaborating on the Sony thing Im thinking about buying a pretty pricey camera from Sony,mq0252h,1.0,1kc6fjo
comment,mq3x9gq,jimmyfknchoo,,1,2025-05-01 23:39:27,,,,Maybe this,mq2pyx5,2.0,1kc6fjo
comment,mq46hdc,Infarad,,1,2025-05-02 00:33:16,,,,Ahhh I see Greedy corpo being greedy,mq3x9gq,3.0,1kc6fjo
comment,mq08g5p,Edward_TH,,120,2025-05-01 12:15:50,,,,The delusion of all these non US corporations suits that think theyre gonna get the red carpet from now on instead of the projectile diarrhea they got till now and that theyve been warned theyre gonna get again in the future for some reason is really telling how detached they are from the world most people live in Trying to save your largest market by announcing that your strategy is to fuck over all the other costumers or potential ones especially in the light of said market being now openly manipulated by your competitors and getting poorer is really being blindly delusional,,0.0,1kc6fjo
comment,mq100kt,IronVader501,,34,2025-05-01 14:50:30,,,,Thats not why they are doing it As Leica explains their entire distribution in North America runs over the US Even if a Product is intended to be sold in Canada or Mexico at the end of the day its still being shipped to their USSubsidiary first and then distributed from there So they have to pay the Tarriffs on them even if it isnt intended to be sold in the US The better solution here would be to set up seperate distributionchannels for Canada but Leica evidently so far doesnt think thats worth it,mq08g5p,1.0,1kc6fjo
comment,mq136sd,Edward_TH,,23,2025-05-01 15:06:10,,,,And thats my point Recent events have clearly demonstrated that following this pathway as a foreign company isnt a smart idea at best whatever you save by not investing into a safer distribution chain gets wiped by tariffs and poorer sales at worst political instability and outright rigged rules made by your competitors straight up destroy you because you lose other markets just by having your supply chain crippled Its just delusional of them to think the US is still a fair market for foreign companies It was manipulated before now its straight up openly rigged against fair competition,mq100kt,2.0,1kc6fjo
comment,mq1mfgu,bianary,,7,2025-05-01 16:40:54,,,,They can request a refund of their tariffs if theyre immediately exporting again,mq100kt,2.0,1kc6fjo
comment,mq03x2k,sonicyouth99,,263,2025-05-01 11:44:25,,,,Simple Stop buying Leica,,0.0,1kc6fjo
comment,mq06pr1,Skippypal,,103,2025-05-01 12:04:06,,,,Serious working photographers not just rich people cosplaying one havent been buying Leica for a while,mq03x2k,1.0,1kc6fjo
comment,mq0acz3,Helmdacil,,50,2025-05-01 12:28:36,,,,Leica makes the most user friendly lab microscopes Nikon Zeiss Olympus Echo vwr in house brand All are great but Leica is the easiest I can get undergrads to take publication quality images on a Leica with almost no training The Nikon is not like that at all This is a poor move by Leica but they are the best game in town in general Imo For biology scopes,mq06pr1,2.0,1kc6fjo
comment,mq0n4qg,S_A_N_D_,,2,2025-05-01 13:44:27,,,,Its funny because I found Nikon to be the most user friendly at least for high end confocal and super resolution systems actually abberior was leagues more user friendly but theyre less versatile unless all you want is peak resolution at which point theyre better The downfall with Nikon IMO is their reliance on ai processing which is a black box and I feel like it just shows you what you want to see The Stellaris systems had much better super res nearly on the level of the abberior and adding FLIM to STED was just black magic With all that said we dont know if the research commercial side uses the same import chain as the consumer camera division They could easily be separate divisions using different supply chains given the lower volume and higher dollar value,mq0acz3,3.0,1kc6fjo
comment,mq0ckgg,GangHou,,-7,2025-05-01 12:42:54,,,,Their cellphone cameras slap too Im an absolute idiot when it comes to photography understand less than nothing about it but have been taking great picture with my Xiaomi 14 since I got it in April of last year,mq0acz3,3.0,1kc6fjo
comment,mq0gj5n,baggos12345,,20,2025-05-01 13:07:08,,,,Literally nothing in a xiaomi 14 camera is associated with Leica Its a Sony sensor like almost all phones with xiaomi software The only thing Leica does is tweak the processing algorithm a bit and most importantly slap their name on the back of the phone for advertisement recognition,mq0ckgg,4.0,1kc6fjo
comment,mq0tn3v,IntoxicatingVapors,,2,2025-05-01 14:18:40,,,,Who is making the glass,mq0gj5n,5.0,1kc6fjo
comment,mq1z2ga,darkapao,,1,2025-05-01 17:41:16,,,,Probably Panasonic Since they have lots of Leica dupes This is just speculation from me since they have Leica dupes,mq0tn3v,6.0,1kc6fjo
comment,mq2070c,IntoxicatingVapors,,5,2025-05-01 17:46:36,,,,So youre not going to admit that Leica actually makes the lenses youre just going to double down on talking out of your ass,mq1z2ga,7.0,1kc6fjo
comment,mq20ua1,darkapao,,2,2025-05-01 17:49:40,,,,Im just saying i owned a Panasonic LX100 which is the same as a Leica DLux 7 Soooo Im basing it on that If you have a source that Leica makes the lenses then i would appreciate that,mq2070c,8.0,1kc6fjo
comment,mq217o4,IntoxicatingVapors,,3,2025-05-01 17:51:26,,,,I have a DMCLX5 Leica made the lenses for both its not a dupe or a conspiracy Leica has a partnership to manufacture lenses for Panasonic in return they sell a badge engineered variant of a Panasonic camera,mq20ua1,9.0,1kc6fjo
comment,mq5cd85,GangHou,,1,2025-05-02 05:10:08,,,,Again I know fuck all about photography and by extension the details of who makes what I didnt even know what Leica meant before I got this phone I thought it was some form of tech All I know is the camera says Leica and that it slaps,mq0gj5n,5.0,1kc6fjo
comment,mq0crav,StaysAwakeAllWeek,,10,2025-05-01 12:44:08,,,,Serious working photographers actually in the market for the experience Leica sell are buying Fujifilm and Hasselblad You actually get something extra that the mainstream brands cant provide with those two,mq06pr1,2.0,1kc6fjo
comment,mq6b410,Capt-ChurchHouse,,2,2025-05-02 10:51:47,,,,Ive never worked with a Leica camera but Ive worked with a ton of their survey gear they have some niche markets they have a good hold on,mq06pr1,2.0,1kc6fjo
comment,mqpz1aq,parisidiot,,0,2025-05-05 15:25:20,,,,this isnt true at all there are plenty of photojournalists who use Leica,mq06pr1,2.0,1kc6fjo
comment,mq07fkx,JadedFault702,,21,2025-05-01 12:08:59,,,,Theyre a major microscope producer the majority of scientific images that get published were captured with some sort of Leica brand imaging tool The admin will absolutely not give a shit about this because it will mostly hurt academic labs,mq03x2k,1.0,1kc6fjo
comment,mq08pfa,vaska00762,,10,2025-05-01 12:17:34,,,,Not just microscopes for laboratories but also surgical microscopes for which their biggest competitor is fellow German optics company Karl Zeiss also famous for camera lenses The other alternative is Olympus but theyre much more into laparoscopic and endoscopic surgical equipment Olympus used to be in the camera business until they sold that business to the same company that took over Vaio laptops as Olympus made way more money out of medical optics Theyre also one of the biggest suppliers of Laser Levels used for land surveying a required vital aspect of infrastructure maintenance and construction planning Leica is the odd one out in terms of them being the only optics company in the area but theyre dominant,mq07fkx,2.0,1kc6fjo
comment,mq0to2i,JadedFault702,,2,2025-05-01 14:18:48,,,,Well since were all just going to eat clean food not FDA tested and exercise by working multiple jobs we wont ever need medical care much less surgical microscopes Thanks RFK Jr But totally spot on and thanks for the further information Id wondered what happened to Olympus,mq08pfa,3.0,1kc6fjo
comment,mq0x5ie,vaska00762,,1,2025-05-01 14:36:19,,,,If you ever see pictures of operating theatres in hospitals theres a very strong chance youll see loads of Olympus branded equipment The medical imaging industry is big money and the other big player with a photography heritage is Fujifilm who are quite big on making digital XRay devices which are basically just really large XRay image sensors Fujifilm also makes XRay film still which is largely still in use in dental settings as you can usually fit film inside someones mouth but not a digital image sensor Fujifilm is also rapidly expanding into the pharmaceutical market though thats mostly from their background of photochemical industry which has a niche but isnt popular Even Sony is big into the medical field For a long time Sony specifically made monitors which could be sterilised easily for operating rooms as well as also making Blu Ray and Peter Solid State recording drives which could record 1080p and later 4k medical footage taken from a microscope endoscope laparoscope or other such equipment All the medical device stuff makes way way more money than consumer products ever could,mq0to2i,4.0,1kc6fjo
comment,mqpzaga,parisidiot,,1,2025-05-05 15:26:36,,,,Fujifilm also makes XRay film still which is largely still in use in dental settings as you can usually fit film inside someones mouth but not a digital image sensor I havent seen film used in dental settings since I was a kid like 20 30 years ago,mq0x5ie,5.0,1kc6fjo
comment,mqq0teh,vaska00762,,1,2025-05-05 15:34:07,,,,Its still regularly in use at my local dental clinic The film isnt very large usually only about a couple of square centimetres wide placed next to a molar that a dentist wants to look into then the Xray emitter is positioned appropriately and the exposure taken The film selfdevelops similar to Instax film and can be placed onto a lightbox to see if theres a cavity Large digital dental xray machines exist but largely only see use in orthodontic settings usually due to concerns around Xray exposure,mqpzaga,6.0,1kc6fjo
comment,mq1rzhf,Shadow647,,1,2025-05-01 17:07:42,,,,Coincidentally neither Zeiss nor Olympus are USbased too,mq08pfa,3.0,1kc6fjo
comment,mq0sxe7,UltraCynar,,6,2025-05-01 14:15:03,,,,Or import directly from Europe and boycott the USNorth America operations Time to move to their Canadian operations to Canada,mq03x2k,1.0,1kc6fjo
comment,mq1l6le,Str0nglyW0rded,,1,2025-05-01 16:34:49,,,,Used one once loved it but still cant justify the cost To have less and be told its more Long live Fuji,mq03x2k,1.0,1kc6fjo
comment,mq06sio,remiieddit,,-1,2025-05-01 12:04:38,,,,More simple dont vote for trump,mq03x2k,1.0,1kc6fjo
comment,mq089eu,evmcdev,,26,2025-05-01 12:14:35,,,,Canada didnt unfortunately still being charged extra by greedy profiteers,mq06sio,2.0,1kc6fjo
comment,mq9dvvb,remiieddit,,1,2025-05-02 20:30:57,,,,Whole world does in one or other way unfortunately,mq089eu,3.0,1kc6fjo
comment,mq08hzz,w1n5t0nM1k3y,,23,2025-05-01 12:16:10,,,,People outside the US had no vote Yet still have to pay higher prices Sounds like taxation without representation,mq06sio,2.0,1kc6fjo
comment,mq0984o,Rance_Mulliniks,,62,2025-05-01 12:21:03,,,,That Canadian store should discontinue them Its simple,,0.0,1kc6fjo
comment,mq03d1i,3dsplinter,,14,2025-05-01 11:40:24,,,,So what happens if you order their products from Europe or Asia and get it shipped to Canada,,0.0,1kc6fjo
comment,mq08rxs,w1n5t0nM1k3y,,11,2025-05-01 12:18:02,,,,I have to do this all the time with cycling products anyway because they eiyher dont have a presence in Canada or they charge twice as much bim Canada for unknown reasons This isnjust the way it has always been in the cycling industry in Canada,mq03d1i,1.0,1kc6fjo
comment,mq05tc9,dustofdeath,,41,2025-05-01 11:57:53,,,,Profiteering,,0.0,1kc6fjo
comment,mq093o6,Pure_System9801,,-15,2025-05-01 12:20:13,,,,Id suggest this means and can spread the cost of tariffs over a wider net she therefore reduce the impact of tariffs in the US for their products resulting in higher revenue,mq05tc9,1.0,1kc6fjo
comment,mq0lc7v,hkvincentlee,,11,2025-05-01 13:34:35,,,,wtf lol,,0.0,1kc6fjo
comment,mq05ue3,ShinNL,,17,2025-05-01 11:58:05,,,,I think something similar is happening to Keychron but worse Ive been waiting for the M5 so Ive been hawkeyeing the full release What I saw was pretty interesting US store priced stayed the same 69 dollars Black was sold out white wasnt initially Now it is DE store price was 69 euro Everything was sold out Check out today its 85 euro What Are you kidding me,,0.0,1kc6fjo
comment,mq1k0mx,RiderLibertas,,9,2025-05-01 16:29:02,,,,They figure if Americans will pay more so will Canadians Many companies will use this as an excuse to raise prices Once they go up the wont go back down,,0.0,1kc6fjo
comment,mq7p9u3,god_peepee,,1,2025-05-02 15:38:58,,,,The boycotts are just getting started,mq1k0mx,1.0,1kc6fjo
comment,mq06y0m,kingofwale,,14,2025-05-01 12:05:40,,,,US tariff Canadians will pay for it,,0.0,1kc6fjo
comment,mq2u1bl,essaysmith,,6,2025-05-01 20:11:46,,,,Seems relatively simple dont buy their products until they change their policy,,0.0,1kc6fjo
comment,mqigb1v,Slacker_75,,4,2025-05-04 09:54:30,,,,Tariffs have become the latest excuse for greed Just like how companies used Covid for an excuse to raise prices and also profits These temporary price increases never come back down Pure Greed,,0.0,1kc6fjo
comment,mq0lbw6,NameCorrect,,11,2025-05-01 13:34:33,,,,Enjoy the death of your company in North America,,0.0,1kc6fjo
comment,mq0w88h,Warlord68,,5,2025-05-01 14:31:41,,,,Headline should be Leica makes mistake and refuses to admit it,,0.0,1kc6fjo
comment,mq2ur2d,None,,4,2025-05-01 20:15:12,,,,I have started bringing stuff directly into Canada to avoid US tariffs when I can,,0.0,1kc6fjo
comment,mq2iawr,TulippeMTL,,5,2025-05-01 19:15:14,,,,Aaaaaamerica blo,,0.0,1kc6fjo
comment,mq27mpj,Aggravating-Loss3145,,2,2025-05-01 18:22:33,,,,WTF Leica,,0.0,1kc6fjo
comment,mq0q6is,nhh,,4,2025-05-01 14:00:48,,,,Its Leica If you care about the price you are looking at the wrong company,,0.0,1kc6fjo
comment,mq3b3zb,yulDD,,2,2025-05-01 21:36:02,,,,How many can be sold in Canada in a year it cant that much Those are high end cameras no,,0.0,1kc6fjo
comment,mq4zlyh,acdameli,,2,2025-05-02 03:32:39,,,,Sounds like someone needs to ship their stock into Canada to supply their North American market to make it make sense And in the meantime I recommend Canada simply boycott Canadians are not citizens of the United States and they should make it clear that they are not,,0.0,1kc6fjo
comment,mq2sfzu,astropolka,,1,2025-05-01 20:04:05,,,,So raising prices from astronomical to even more astronomical Makes sense,,0.0,1kc6fjo
comment,mq56huc,Nom_De_Plumber,,1,2025-05-02 04:22:44,,,,I never thought Id be saying fuck Leica but here we are,,0.0,1kc6fjo
comment,mq5ltyd,odebruku,,1,2025-05-02 06:37:44,,,,If you can affront buy a Leica you wouldnt blink an eye at the price increase,,0.0,1kc6fjo
comment,mq5p2k6,aluminumnek,,1,2025-05-02 07:09:49,,,,Just buy a Panasonic LUMIX as they make the digital Leicas anyways The only difference is the software and UI My LUMIX can utilize Leica series M and R lens with an adapter,mq5ltyd,1.0,1kc6fjo
comment,mq5qflr,odebruku,,2,2025-05-02 07:23:52,,,,You really cant compare VW Porsche and Audi same company so are you saying a VW Golf is the same as a 911 Turbo,mq5p2k6,2.0,1kc6fjo
comment,mq5r5y8,aluminumnek,,1,2025-05-02 07:31:35,,,,If they are both same under the hood like these cameras then yeah,mq5qflr,3.0,1kc6fjo
comment,mq8b92n,Electrical_Height743,,1,2025-05-02 17:22:40,,,,So basically now everyone is raising prices because of tariffs Doesnt matter if they actually effect the specific product Awesome Capitalist oligarchs really want the giliotins to come back,,0.0,1kc6fjo
comment,mqbtk2o,bamboob,,1,2025-05-03 05:46:03,,,,Nope,,0.0,1kc6fjo
comment,mr7m92r,johnryan433,,1,2025-05-08 08:16:50,,,,This is something people dont usually understand American is responsible for 30 of all global consumer spending If the price of a product goes up 3x in America most companies will do exactly what Leica has done to maintain price parity Otherwise there entire supply chain would collapse within the US as no one would buy in the US and just go on vacation to buy things in Canada or Mexico and bring it back in illegally undeclared So if the tariffs remain most western brands will charge a similar amount everywhere at least for small items that can easily be brought back in that is,,0.0,1kc6fjo
comment,mq04k0l,Reesespeanuts,,-3,2025-05-01 11:48:56,,,,Who,,0.0,1kc6fjo
comment,mq05j1p,Spideryote,,1,2025-05-01 11:55:51,,,,Google tells me theyre a camera and optical lens company Never heard of them myself,mq04k0l,1.0,1kc6fjo
comment,mq08vkj,madcatzplayer5,,9,2025-05-01 12:18:42,,,,You two have obviously never seen Eurotrip 2004 before,mq05j1p,2.0,1kc6fjo
comment,mq2ng6b,bonesnaps,,1,2025-05-01 19:40:16,,,,I recently watched it and I still never heard of Leica Heard of many other photography brands but not them,mq08vkj,3.0,1kc6fjo
comment,mq09jys,Spideryote,,-16,2025-05-01 12:23:13,,,,I dont watch movies sorry Not stimulating enough,mq08vkj,3.0,1kc6fjo
