type,id,author,title,score,created_utc,url,num_comments,subreddit,body,parent_id,depth,post_id
comment,ms2szhb,justthisones,,3,2025-05-13 12:06:25,,,,Theres no reason for me to buy a new flagship anymore The upgrades arent that significant and you can find the previous versions for like half the price Its interesting to see how long people keep buying these things Even the old rule of theres always someone with a 4 year old phone ready to upgrade shouldnt be as valid anymore when these few year old phones feel less and less dated compared to the newest one Theyll probably still sell though cause people love the new,,0.0,1kl3lxz
comment,ms4a045,nikolapc,,2,2025-05-13 16:46:09,,,,Honestly fuck the 1000 phones Its a tax on fools I am rocking 500 xiaomi and its amazing I have a Samsung in reserve if something happens to it but they generally last me around 5 yrs Americans are now conditioned to rent their phones ie pay for them in installments that get added to their bill then trade in their old one that Apple scraps anyway or has it for spare parts The ticket price thats the fools tax so they can keep you hooked and think youre getting something of great value But I still see people pay for them outright which is crazy lol I barely use the phone anyway as a computer use laptop tablet and then phone in that order but people seem to be addicted to them,,0.0,1kl3lxz
comment,mrzsquh,Xtreeam,,3,2025-05-12 22:40:34,,,,So Apples raising prices in the US only while keeping them the same elsewhere where Trumpera tariffs dont apply,,0.0,1kl3lxz
comment,msgl1ib,recurrence,,2,2025-05-15 15:06:13,,,,Historically apple raises them some everywhere so the world can cover the US tariffs,mrzsquh,1.0,1kl3lxz
comment,ms0y2oj,_RADIANTSUN_,,3,2025-05-13 02:37:24,,,,Yeah no shit,,0.0,1kl3lxz
comment,ms09mef,TheDigitalPoint,,2,2025-05-13 00:14:48,,,,Its been 8 years of Pro phones being the same price 2017 the iPhone X was introduced at 999 Do I want them to go up No But iPhones are one of the few things that are probably overdue for a price increase,,0.0,1kl3lxz
comment,ms2d1e3,Hot_Cheese650,,2,2025-05-13 10:00:03,,,,This iPhone keyboard gets worse with each update Im seriously considering switching to a different brand next phone,,0.0,1kl3lxz
comment,ms01b09,iDontRagequit,,2,2025-05-12 23:28:56,,,,Thats fine Im not buying any more iphones,,0.0,1kl3lxz
comment,mrzfge3,sunbeatsfog,,1,2025-05-12 21:28:10,,,,I did make the right decision to replace my phone I guess it doesnt matter,,0.0,1kl3lxz
comment,mrzydxb,bearsharkbear3,,1,2025-05-12 23:13:09,,,,Ive made so much money off that stock that Ill pay them whatever they want,,0.0,1kl3lxz
comment,ms00m00,Whit3boy316,,1,2025-05-12 23:25:24,,,,At this point in my life 35 Im willing to go to the cheapest nonshitty phone whether it be GoogleSamsung Apple,,0.0,1kl3lxz
comment,ms14f4r,_RADIANTSUN_,,1,2025-05-13 03:18:16,,,,Moto G Power,ms00m00,1.0,1kl3lxz
comment,ms0dhc0,ZZ9ZA,,0,2025-05-13 00:37:13,,,,So Apple it is then,ms00m00,1.0,1kl3lxz
comment,ms0k9d2,Whit3boy316,,1,2025-05-13 01:17:23,,,,Im currently on Apple but man this phone is so heavy,ms0dhc0,2.0,1kl3lxz
comment,ms07e0y,Soft_Internal_6775,,1,2025-05-13 00:02:05,,,,Prices only ever go one way and its not down,,0.0,1kl3lxz
comment,ms0c1i7,Forsaken-I-Await,,1,2025-05-13 00:28:48,,,,Yeah but tbh who isnt considering raising prices though,,0.0,1kl3lxz
comment,ms0hp9c,None,,1,2025-05-13 01:02:11,,,,Great Here I am happy with the iPhone 15 Absolutely no reason to upgrade and yet yall going to go buy them and validate their price hikes,,0.0,1kl3lxz
comment,ms0nm9r,Hi_Im_Ken_Adams,,1,2025-05-13 01:37:01,,,,There has been little innovation on iPhones other than cpu and camera upgrades why havent they come out with a foldable model yet,,0.0,1kl3lxz
comment,ms0npfb,Redline65,,1,2025-05-13 01:37:31,,,,Still gonna be free every 34 years with a contract,,0.0,1kl3lxz
comment,ms0rjj8,snwns26,,1,2025-05-13 01:59:43,,,,Saw that coming Ive gone from the 6 to the 11 and now to the 16E as of last week Im content for a long long while,,0.0,1kl3lxz
comment,ms1ew3z,The_NiNTARi,,1,2025-05-13 04:33:11,,,,If prices go up then so should trade in values,,0.0,1kl3lxz
comment,ms1w6ek,O667,,1,2025-05-13 07:06:23,,,,If they do so help me God I will Pay the higher price like the Apple simp that I am,,0.0,1kl3lxz
comment,ms1wnz0,NuttFellas,,1,2025-05-13 07:11:19,,,,And the Pope considers being catholic,,0.0,1kl3lxz
comment,ms1xue9,yksvaan,,1,2025-05-13 07:23:19,,,,Well why nof if when idiots pay it regardless,,0.0,1kl3lxz
comment,ms1y8ai,Luckylefttit,,1,2025-05-13 07:27:21,,,,Do it well all get flip phones,,0.0,1kl3lxz
comment,ms2b9nj,Muddgutts,,1,2025-05-13 09:42:56,,,,I mean they are so cheap right now So why not right,,0.0,1kl3lxz
comment,ms2bz43,JayAlexanderBee,,1,2025-05-13 09:49:54,,,,Still wont make me buy one,,0.0,1kl3lxz
comment,ms2w5ok,Dry_Yam_8049,,1,2025-05-13 12:27:13,,,,Ah good does that come with better battery life,,0.0,1kl3lxz
comment,ms31oim,DylanRahl,,1,2025-05-13 13:00:52,,,,apple considers if current economical climate can be used as sufficient motive to further fleece customers Ftfy,,0.0,1kl3lxz
comment,ms3f8uq,jakgal04,,1,2025-05-13 14:15:22,,,,Ah yes the annual pre announcement Apple considers raising iPhone prices article that weve been receiving every year for over a decade,,0.0,1kl3lxz
comment,ms627fg,shawn_kprince72,,1,2025-05-13 21:59:05,,,,Apple Continue to finesse these idiots pockets,,0.0,1kl3lxz
comment,msgkr9b,recurrence,,1,2025-05-15 15:04:50,,,,Im not paying for American tariffs They better not be the same worldwide,,0.0,1kl3lxz
comment,msrmb9w,TheBigGoat44,,1,2025-05-17 09:10:07,,,,The sky is blue,,0.0,1kl3lxz
comment,ms00j3b,bleaucheaunx,,0,2025-05-12 23:25:02,,,,Profitieren Macht Frei Go slaves consume consume consume,,0.0,1kl3lxz
comment,mrzslcy,MerlinCa81,,2,2025-05-12 22:39:41,,,,I barely bought a 14 because they are still overpriced,,0.0,1kl3lxz
comment,ms09zlg,callmebatman14,,3,2025-05-13 00:16:56,,,,They sell 60 million iPhones every quarter so I dont think theyre overpriced,mrzslcy,1.0,1kl3lxz
comment,ms0foij,NotTheCraftyVeteran,,0,2025-05-13 00:50:06,,,,Entirely possible that they mightve done raised prices now without Trumps idiocy but between this and Xboxs cowardly market conditions babble I guess all the big time consumer tech companies will just avoid blaming tariffs ever lest they incur the White Houses wrath,,0.0,1kl3lxz
comment,ms0l1ck,I_will_take_that,,1,2025-05-13 01:21:56,,,,Meh I will do what I always did Never buy a Iphone,,0.0,1kl3lxz
comment,ms00g3e,THCv3,,1,2025-05-12 23:24:36,,,,They should try innovating it in literally any way possible before doing that,,0.0,1kl3lxz
comment,ms0bohu,miuyao,,-1,2025-05-13 00:26:43,,,,I recently switched from Android to Apple and really wish I didnt It sucks The camera is nice but everything else is terrible,,0.0,1kl3lxz
comment,ms0gwib,alc4pwned,,4,2025-05-13 00:57:22,,,,In all likelihood youre just not used to it People say that when they switch the other way too,ms0bohu,1.0,1kl3lxz
comment,ms0l3b9,miuyao,,1,2025-05-13 01:22:16,,,,Ive had it for a few months now and most of it just boils down to poor design For example literally zero option to enable a location onoff button I have to constantly go into my settings to flip it,ms0gwib,2.0,1kl3lxz
comment,ms0v5uh,SplitEndsSuck,,1,2025-05-13 02:19:55,,,,Come back to the dark side,ms0l3b9,3.0,1kl3lxz
comment,ms2tnri,alc4pwned,,0,2025-05-13 12:10:54,,,,I strongly disagree I actually also switched from iOS back to Android around 6 months ago and have a long list of annoyances There are absolutely things that long time iOS users got used to that are missing from many Android phones as well For example there is no option to adjust volume without using physical buttons on my Adnroid phone without using 3rd party software There is no physical mute switch Face unlock is much worse than on an iPhone Lock screen shortcuts dont work as well,ms0l3b9,3.0,1kl3lxz
comment,ms44eq4,miuyao,,1,2025-05-13 16:18:49,,,,I never had an issue with lockscreen shortcuts and actually prefer physical buttons Especially a power button for ifwhen the phone acts up and needs to be turned off Iphones off button is on screen so if it freezes I cant access the button On iPhone there is no option to raiselower media volume separately from the ringtone So if I want to watch a video my ringtone is automatically on blast as well And I absolutely will never use face ID so that is lost on me,ms2tnri,4.0,1kl3lxz
comment,ms4t2kf,alc4pwned,,1,2025-05-13 18:17:04,,,,But surely you see how much of this comes down to what you were used to before switching right You never had access to good face unlock so its not even something youre thinking about Whereas thats very much something Im thinking about coming from an iPhone Similarly I never got used to adjusting mediaringtone volume separately so its not something I care about,ms44eq4,5.0,1kl3lxz
comment,ms55o2f,miuyao,,1,2025-05-13 19:17:36,,,,I never wanted face lock in the first place even when available I do not use it I dont get why this is such a controversial topic for you I think iPhone interface is less intuitive than Android I have had apple products and I just dont care for how they use,ms4t2kf,6.0,1kl3lxz
comment,ms0vcgx,CHAINSAW__CHARLIE,,1,2025-05-13 02:20:59,,,,im in the same boat its slowly growing on me,ms0bohu,1.0,1kl3lxz
comment,mrzwhn8,BuckZero,,-1,2025-05-12 23:02:00,,,,Havent upgraded since 2023 and have no plans to until Apple does something truly innovative Ill keep my fully paid off phone for now,,0.0,1kl3lxz
comment,ms0p0ci,infectedtoe,,11,2025-05-13 01:45:04,,,,Man 15 or 2 years without an upgrade thats rough Lol,mrzwhn8,1.0,1kl3lxz
comment,ms0beet,MadMike991,,0,2025-05-13 00:25:05,,,,iPhone user considers not buying new iPhone,,0.0,1kl3lxz
comment,ms00fkf,DakPara,,-2,2025-05-12 23:24:31,,,,I am shocked,,0.0,1kl3lxz
comment,ms23rsj,adinis78,,-3,2025-05-13 08:24:42,,,,Every year they get more expensive so this is nothing new,,0.0,1kl3lxz
comment,ms26cpi,Skiingislife42069,,-3,2025-05-13 08:52:01,,,,They are raised every single year Big whoop,,0.0,1kl3lxz
comment,ms07x2e,d_e_l_u_x_e,,-7,2025-05-13 00:05:11,,,,Apple has 53 billion dollars in cash on hand according to reports as of Dec 2024 But yea totally get it its a tough time to make record profits EVERY year,,0.0,1kl3lxz
comment,mrzwolw,ChillAMinute,,-6,2025-05-12 23:03:08,,,,lol Apple just keep thwapping that profit injection point right above the tourniquet Pretty soon your shareholders are going to need more and more of that sweet sweet green to chase that buzz Word of advice from a schmuck who was around during the John Sculley days coming out with a hundred different models and flavors of everything Apple is only going to dilute everything Apple is about Maybe step aside and let someone like Jony Ive take over and bring the company back to those early Steve Jobs days,,0.0,1kl3lxz
comment,ms0dn0d,bzzking,,-6,2025-05-13 00:38:09,,,,Apple heads will still buy it with a price increase Its already a luxury phone,,0.0,1kl3lxz
