type,id,author,title,score,created_utc,url,num_comments,subreddit,body,parent_id,depth,post_id
post,1kl3lxz,a_Ninja_b0y,"Apple considers raising iPhone prices, WSJ reports",791,2025-05-12 20:49:52,https://www.reddit.com/r/gadgets/comments/1kl3lxz/apple_considers_raising_iphone_prices_wsj_reports/,187.0,gadgets,,,,
comment,mrzg89c,-Wicked-,,599,2025-05-12 21:32:13,,,,Were like they ever going to consider lowering them,,0.0,1kl3lxz
comment,mrzrdcr,kytheon,,162,2025-05-12 22:32:41,,,,Apple is famous for the fact theyd rather scrap their devices than to lower the prices New iPhone Screw the old one Buy the new one at a high price,mrzg89c,1.0,1kl3lxz
comment,ms68ae7,SpeshellED,,3,2025-05-13 22:32:39,,,,When 120 markup is just not enough,mrzrdcr,2.0,1kl3lxz
comment,mt8bxfv,motohaas,,1,2025-05-20 02:26:15,,,,The markup is well beyond 120 You are missing a 0 or two,ms68ae7,3.0,1kl3lxz
comment,ms0b1zq,alc4pwned,,-51,2025-05-13 00:23:08,,,,I mean to be fair they also havent really raised iPhone prices in years despite the massive inflation thats happened over that time Edit The downvotes are interesting considering this is objectively true The iPhone X released in 2017 at 1000 and the equivalent today the 16 Pro also costs 1000 Same situation with the base model,mrzrdcr,2.0,1kl3lxz
comment,ms0o6nu,GreenBasterd69,,66,2025-05-13 01:40:16,,,,Havent added any new features in years too,ms0b1zq,3.0,1kl3lxz
comment,ms26e2a,Lester822,,13,2025-05-13 08:52:23,,,,While year over year changes have gotten small thats become true of most smartphone manufacturers as the tech matures if you take the iPhone 16 Pro and compare it to the 12 or 13 Pro the updates add up and they start to feel really different If you compare it to the last time they raised prices on their flagship iPhone X theres a TON new,ms0o6nu,4.0,1kl3lxz
comment,ms2k0ej,thejaga,,12,2025-05-13 11:01:20,,,,They also dont raise prices because year over year they find ways to reduce costs to increase profit So 16 probably costs less to make than 10 did at that time,ms26e2a,5.0,1kl3lxz
comment,ms1qksh,pelirodri,,3,2025-05-13 06:12:33,,,,Literally a lie,ms0o6nu,4.0,1kl3lxz
comment,ms3p9ku,kr4ckenm3fortune,,1,2025-05-13 15:05:25,,,,Actually youre half correct and half wrong The features added were taken from jailbreaking Still waiting on a good antispam filter Samsung already got that handdown,ms0o6nu,4.0,1kl3lxz
comment,ms2t1w1,alc4pwned,,1,2025-05-13 12:06:52,,,,Most phones havent added any more features than iPhone has Phones are a mature technology,ms0o6nu,4.0,1kl3lxz
comment,ms0soxv,CharlesP2009,,-16,2025-05-13 02:06:02,,,,What would you like them to add,ms0o6nu,4.0,1kl3lxz
comment,ms0vqjm,GreenBasterd69,,22,2025-05-13 02:23:16,,,,The ability to stop all apps from showing reels,ms0soxv,5.0,1kl3lxz
comment,ms0t1o3,Sharticus123,,28,2025-05-13 02:07:58,,,,Longer lasting battery,ms0soxv,5.0,1kl3lxz
comment,ms1qjoa,pelirodri,,6,2025-05-13 06:12:16,,,,And they very obviously have,ms0t1o3,6.0,1kl3lxz
comment,ms1ne0g,ITCoder,,-3,2025-05-13 05:43:34,,,,THIS,ms0t1o3,6.0,1kl3lxz
comment,ms10jrm,ultimatefreeboy,,7,2025-05-13 02:52:56,,,,Bigger battery would make this the perfect phone Imagine a 2 day long battery life with heavy use,ms0soxv,5.0,1kl3lxz
comment,ms1ff1d,penguins_are_mean,,5,2025-05-13 04:37:12,,,,Im ignorant but are there phones that can already do that Battery technology is no easy feat,ms10jrm,6.0,1kl3lxz
comment,ms1x6mv,dandroid126,,3,2025-05-13 07:16:33,,,,Just make them thicker You could double the thickness and fill that with battery and it would still be too thin imo,ms1ff1d,7.0,1kl3lxz
comment,ms2qbxe,penguins_are_mean,,-5,2025-05-13 11:48:24,,,,lol no one would buy an iPhone that was twice the thickness including you,ms1x6mv,8.0,1kl3lxz
comment,ms32vs7,dandroid126,,3,2025-05-13 13:07:58,,,,Why not I have been complaining that phones are too thin since like 2012,ms2qbxe,9.0,1kl3lxz
comment,ms8rnpq,Malodoror,,0,2025-05-14 09:49:00,,,,People buy what Apple tell them to buy,ms2qbxe,9.0,1kl3lxz
comment,ms2ae7k,ultimatefreeboy,,1,2025-05-13 09:34:12,,,,Not an iPhone I want the base model to last 2 days,ms1ff1d,7.0,1kl3lxz
comment,ms30bti,RSGator,,3,2025-05-13 12:52:56,,,,I havent had a battery issue on an iPhone in like half a decade I dont need my phone to last 2 weeks without charging 23 days is more than adequate outside of like survival situations,ms10jrm,6.0,1kl3lxz
comment,ms1g26z,AgencyBasic3003,,0,2025-05-13 04:42:06,,,,The iPhone 16 Pro Max has already a 2 day battery The device easily beats other flagship devices when it comes to battery performance,ms10jrm,6.0,1kl3lxz
comment,ms1vx2z,gmotelet,,3,2025-05-13 07:03:51,,,,You sure about that,ms1g26z,7.0,1kl3lxz
comment,ms2hw7r,Smooth-Accountant,,5,2025-05-13 10:44:15,,,,Thats constant use 17 hours of constant use is easily 2 days of charge for most people,ms1vx2z,8.0,1kl3lxz
comment,ms2lmja,ultimatefreeboy,,0,2025-05-13 11:13:51,,,,Moto g still lasts longer,ms2hw7r,9.0,1kl3lxz
comment,ms31nva,alc4pwned,,3,2025-05-13 13:00:46,,,,Budget phones sometimes have better battery life than flagships because they have lower end components that draw less power,ms2lmja,10.0,1kl3lxz
comment,ms5viaq,ultimatefreeboy,,1,2025-05-13 21:23:56,,,,Fair enough,ms31nva,11.0,1kl3lxz
comment,ms2632h,Mushcube,,1,2025-05-13 08:49:13,,,,My Motorola Edge 50 Ultra lasts 2 days easy,ms10jrm,6.0,1kl3lxz
comment,ms2a9pf,ultimatefreeboy,,1,2025-05-13 09:32:56,,,,I miss my moto g I meant an iPhone that lasts 2 days with heavy use My iphone 14 is disappointing compared to my moto g and that was a 300 dollar phone,ms2632h,7.0,1kl3lxz
comment,ms47bwd,Mushcube,,2,2025-05-13 16:33:04,,,,I had iPhone 12 Pro as a work phone when it was brand new never had iphone before and I made a promise to my self to never get Apple product again Truly godly awful experience after the freedom of AndroidWindowsLinux Horrible value for the money imo Im flabbergasted what people see in Apple,ms2a9pf,8.0,1kl3lxz
comment,ms0zwgm,UnoMaxican,,8,2025-05-13 02:48:45,,,,Universal adblock,ms0soxv,5.0,1kl3lxz
comment,ms11v6t,Slug35,,13,2025-05-13 03:01:26,,,,Headphone jack,ms0soxv,5.0,1kl3lxz
comment,ms752zj,gbeezy007,,2,2025-05-14 01:43:14,,,,Apples top flagship phone X was 1000 today its 1200 Tech historically has almost been anti inflationary Look at TVs computers and so on Its not like they havent raised prices 20 is fair in that time span but its also not like they havent And the cheaper phones would be much more subjective to the fact tech gets cheaper as they really push much cheaper dated screens and such in them where cost savings is probably better then leading tech flagships,ms0b1zq,3.0,1kl3lxz
comment,ms9bcqo,alc4pwned,,0,2025-05-14 12:23:33,,,,Apples top flagship phone X was 1000 today its 1200 The top flagship back then was the equivalent of todays Pro There was no bigger version back then The X was a smaller phone and it wasnt until the following XS model that they released a bigger XS Max phone that is equivalent to todays top Pro Max flagship Todays Pro is a continuation of the X todays Pro Max is a continuation of the XS Max So yes Ill concede that the Pro Max phone has gotten a 100 price increase compared to the 2018 XS Max But the regular Pro has stayed the same Tech historically has almost been anti inflationary That really depends on whether its stagnant tech or something that is quickly advancing I think Obviously phones are pretty stagnate now But the price staying more or less the same over the last 78 years does mean that prices have gone down in real terms ie after considering inflation,ms752zj,4.0,1kl3lxz
comment,ms2vnv3,Shadow647,,25,2025-05-13 12:24:01,,,,M3 MacBook Air was 1099 M4 MacBook Air is 999,mrzg89c,1.0,1kl3lxz
comment,ms4gogz,rudimentary-north,,6,2025-05-13 17:18:07,,,,Same thing with the M3 and M4 Mac mini,ms2vnv3,2.0,1kl3lxz
comment,ms5ndmj,CanEnvironmental4252,,2,2025-05-13 20:43:05,,,,Well when accounting for inflation new release phones at the same nominal price have effectively been getting cheaper with each release Older phones get cheaper every time the new model comes out,mrzg89c,1.0,1kl3lxz
comment,ms7ax4o,pattymcfly,,2,2025-05-14 02:17:33,,,,The original iPhone debuted at 599 and they almost immediately cut it to 399 iirc They refunded anyone that had already bought one Also the latest MacBook airs lowered prices for similar spec previous generation I believe They do lower prices sometimes,mrzg89c,1.0,1kl3lxz
comment,ms02v5i,Opetyr,,3,2025-05-12 23:37:23,,,,They did when their slogan was cheaper than a PC Dont worry apple makes things that are revolutionary and magical so are worth their price,mrzg89c,1.0,1kl3lxz
comment,ms2lexa,IIlIIlIIlIlIIlIIlIIl,,2,2025-05-13 11:12:15,,,,Inflation generally only grows up and compounds on itself Tariffs go up and down so we may see a 20 increase and then decrease of 18 once theyre gone but itll never go back to say 2020 prices,mrzg89c,1.0,1kl3lxz
comment,ms30gkn,TehOwn,,7,2025-05-13 12:53:43,,,,Tariffs go up and down so we may see a 20 increase and then decrease of 18 once theyre gone Theres no way itll decrease that much These tariffs are costing the global economy trillions Well be lucky to see it go down at all let alone by 90 of the increase Trust is eroded Supply chains are being dismantled Decades of investment commitments are being cancelled You cant simply undo that I get that it was a hypothetical but I want it to be very clear about the damage these tariffs are doing,ms2lexa,2.0,1kl3lxz
comment,ms1phmu,subdep,,-6,2025-05-13 06:02:20,,,,Theyve been raising prices every year since they started selling iPhones Why is this news,mrzg89c,1.0,1kl3lxz
comment,ms261r1,Lester822,,10,2025-05-13 08:48:50,,,,They havent raised the price on their flagship phone since the iPhone X like 8 years ago,ms1phmu,2.0,1kl3lxz
comment,ms2h9b9,matyX6,,4,2025-05-13 10:38:47,,,,Iphone 14 Pro was 1100 instead of previous 1000 Wasnt it,ms261r1,3.0,1kl3lxz
comment,ms4gxez,rudimentary-north,,3,2025-05-13 17:19:19,,,,the 16 pro is 1000 so if youre right they do lower prices,ms2h9b9,4.0,1kl3lxz
comment,ms5ia5x,matyX6,,1,2025-05-13 20:18:46,,,,Here we go I live in Croatia and the price went up in Europe in 2022 remembered this since this was last phone I have bought Thought it was the same in US Source,ms4gxez,5.0,1kl3lxz
comment,ms8znye,Shadow22441,,1,2025-05-14 11:00:39,,,,So you mean to tell me they charged 1000 for a phone 8 years ago Equivalent to around 1300 today,ms261r1,3.0,1kl3lxz
comment,ms2bvdk,Crittsy,,-4,2025-05-13 09:48:55,,,,Only because theyve always found ways of cutting production costs,ms261r1,3.0,1kl3lxz
comment,ms3ejtt,Olaf4586,,3,2025-05-13 14:11:49,,,,Generally price is not determined by production costs but is rather chosen to maximize revenue and maintain acceptance profit margins,ms2bvdk,4.0,1kl3lxz
comment,ms8zvts,Lester822,,1,2025-05-14 11:02:23,,,,Ok And,ms2bvdk,4.0,1kl3lxz
comment,mrzn3ja,Jorgen_Pakieto,,119,2025-05-12 22:08:46,,,,Luckily I dont need to buy a new phone for six good years,,0.0,1kl3lxz
comment,mrzu4u3,pagerunner-j,,39,2025-05-12 22:48:27,,,,I finally bought a new one last month after using my previous iPhone for seven years It was about to slide off the support matrix anyway and all the economic nonsense were going through right now made the whole thing feel even more pressing Now to hope this one lasts me as long,mrzn3ja,1.0,1kl3lxz
comment,ms08k1u,UBC145,,12,2025-05-13 00:08:51,,,,Yep I bought a refurbished 15 pro max with a battery still in good condition and almost no wear apart from a tiny almost unnoticeable scratch on the screen It was a massive upgrade from my previous phone a refurbished iPhone XR with a terrible battery and performance Im very happy with its performance and battery life so far and I think Ill replace the battery once or twice before I upgrade to the iPhone 21 or something,mrzn3ja,1.0,1kl3lxz
comment,ms136ra,splinter6,,7,2025-05-13 03:10:00,,,,13 Pro Max going strong No need to update Battery lasts a full day into the night and theres not a hint of lag Only thing falling behind is the camera tech but I think its still pretty cutting edge for video,ms08k1u,2.0,1kl3lxz
comment,ms1krfr,None,,2,2025-05-13 05:20:31,,,,Bought a refurbished iPhone SE last week If it lasts for four more years Ill have more than got my moneys worth out of it,ms08k1u,2.0,1kl3lxz
comment,ms108wj,IWantToPlayGame,,3,2025-05-13 02:51:00,,,,Same Have the 16 Pro Max that Ive religiously been careful with always in a case charging from 2080 I do not want to buy a phone for a long time,mrzn3ja,1.0,1kl3lxz
comment,ms0arda,Tierst,,2,2025-05-13 00:21:26,,,,At this rate they will probably raise the prices a few times by then,mrzn3ja,1.0,1kl3lxz
comment,ms1xe6z,redditclm,,1,2025-05-13 07:18:40,,,,You dont NEED to buy an iPhone ever There are plenty of other phones to choose from for a fraction of a cost of the overpriced Apple stuff,mrzn3ja,1.0,1kl3lxz
comment,ms2uc9o,happy_chappie,,1,2025-05-13 12:15:24,,,,Yup I upgraded mine and my Wifes phone back in February She was still using the iPhone X so I know shell be good for a while Since I really dont see the need to upgrade as much anymore same,mrzn3ja,1.0,1kl3lxz
comment,ms46loe,None,,1,2025-05-13 16:29:31,,,,I got a 14 a few years ago I switched for the longevity of the apple devices and boy did I pick a good time lol,mrzn3ja,1.0,1kl3lxz
comment,mrzjf7b,crimxxx,,52,2025-05-12 21:48:56,,,,Dont be suprised to see companies play with pricing outside of the US generally to try and not have a huge impact in one place by have an increase across the board Companies keep profit margins globally by decreasing in the US and increasing it elsewhere were Want this not to happen make a big deal where companies are scared of worst outcomes Dont buy there stuff and watch magically the price goes back down,,0.0,1kl3lxz
comment,ms2hvdc,DarkSonGwyndolin,,15,2025-05-13 10:44:03,,,,Noticed this with the PS5 They raised the price everywhere except in the US Of course the rest of the world has to pay for the USs stupidity,mrzjf7b,1.0,1kl3lxz
comment,ms2lz11,Fractal_Tomato,,2,2025-05-13 11:16:28,,,,Just look at the EU pricing of Apple products Theyve been doing that for decades,mrzjf7b,1.0,1kl3lxz
comment,ms89ivm,Legendacb,,1,2025-05-14 06:40:39,,,,The iPhone couta outside of the US wont be probably enough to compensate,mrzjf7b,1.0,1kl3lxz
comment,mrzafbx,Really_McNamington,,173,2025-05-12 21:02:18,,,,Globally so we all get to share in Trumps stupid Tariffs and subsidise American shoppers Marvellous,,0.0,1kl3lxz
comment,ms2zpgh,InsaneNinja,,1,2025-05-13 12:49:12,,,,Well they havent raised US prices in like a decade despite inflation so honestly I dont even know what to think,mrzafbx,1.0,1kl3lxz
comment,mrzauqx,GameEtiquette,,-100,2025-05-12 21:04:28,,,,Put your money where your mouth is,mrzafbx,1.0,1kl3lxz
comment,mrzc8f3,IBJON,,20,2025-05-12 21:11:35,,,,They probably cant because they willingly bought their way into the Apple ecosystem and cant just replace a phone or laptop without also needing to replace every other device they own Apple knows itll cost their users even more to try to switch Thats the whole point of the ecosystem,mrzauqx,2.0,1kl3lxz
comment,mrzg59x,Large_Principle6163,,36,2025-05-12 21:31:48,,,,You dont have to switch you could just hold on to your older device Whats new anyway the Siri animation Pop in a new battery and ride out the storm,mrzc8f3,3.0,1kl3lxz
comment,mrzgll5,IBJON,,-35,2025-05-12 21:34:09,,,,That device wont last forever and even if it does youd still be giving money to Apple via subscriptions and the app store,mrzg59x,4.0,1kl3lxz
comment,mrzpvfw,Arrasor,,18,2025-05-12 22:24:11,,,,Phones last longer than the orange presidency Your shits aint gonna break in 23 years unless you rough handle them I uses my phones for 4 years before buying new then buy a new one but 2 years later than newest model I still get a sealed brand new phone and its 500 cheaper BEFORE factoring in sales and whatnot,mrzgll5,5.0,1kl3lxz
comment,ms0f3ec,IBJON,,-13,2025-05-13 00:46:42,,,,Ah So the so you wait a while then give Apple your money The point is unless people move away from Apple completely theyre not voting with their wallet It doesnt matter if you keep a phone longer or buy an older model Apple is still getting your money,mrzpvfw,6.0,1kl3lxz
comment,ms0frlv,blindguywhostaresatu,,5,2025-05-13 00:50:36,,,,Not if you buy it second hand,ms0f3ec,7.0,1kl3lxz
comment,ms0kp72,IBJON,,0,2025-05-13 01:19:56,,,,Are you buying new phones secondhand And even then are you not using Apple services like iCloud or the app store Are you the only iPhone user who doesnt use accessories,ms0frlv,8.0,1kl3lxz
comment,ms0i2jh,alc4pwned,,3,2025-05-13 01:04:26,,,,NonAmericans should be avoiding giving American companies money because of Trump tariffs is that the point you are making The only real alternative to iOS also involves giving an American company Google money though,ms0f3ec,7.0,1kl3lxz
comment,ms0kwk6,IBJON,,1,2025-05-13 01:21:08,,,,My point is that people arent going to be willing to vote with their wallets because its too inconvenient or expensive to break out of the Apple ecosystem Either you go with android and as you pointed out give Google money anyways and replace all of your Apple devices and peripherals with an equivalent nonapple product or you stick with Apple and keep giving them money,ms0i2jh,8.0,1kl3lxz
comment,ms0y3xv,chadhindsley,,2,2025-05-13 02:37:36,,,,Its not that hard I made the switch to Samsung,mrzc8f3,3.0,1kl3lxz
comment,ms89o4j,Legendacb,,1,2025-05-14 06:42:06,,,,I wonder how people feel when they realize they have gotten no choice,mrzc8f3,3.0,1kl3lxz
comment,ms76pt8,Benzy2,,-1,2025-05-14 01:52:30,,,,We subsidize your drug costs so its just part of that free health care,mrzafbx,1.0,1kl3lxz
comment,ms85wlb,Really_McNamington,,4,2025-05-14 06:05:42,,,,Only because your government lets big pharma repeatedly soak your population,ms76pt8,2.0,1kl3lxz
comment,ms8wbhu,Benzy2,,1,2025-05-14 10:32:52,,,,A simple thank you would suffice you ungrateful twat,ms85wlb,3.0,1kl3lxz
comment,ms0qubd,Diplo_Advisor,,-18,2025-05-13 01:55:41,,,,Well yeah the US is a very important market They make less from America so they have to compensate elsewhere Furthermore they have increased cost due to moving production from a more efficient China to India The world economy loses as a whole due to trade distortion caused by tariffs,mrzafbx,1.0,1kl3lxz
comment,ms2k19d,bony7x,,2,2025-05-13 11:01:32,,,,Definitely isnt important to me at all as an European,ms0qubd,2.0,1kl3lxz
comment,mrzcb7b,fordman84,,27,2025-05-12 21:12:00,,,,Better deliver something on the Pro other than microscopically thinner extra minutes of battery and a new color then Because the last few new iPhones are not improvements over the previous model I think the 16pro is my phone for the foreseeable future,,0.0,1kl3lxz
comment,mrzforu,_Lucille_,,32,2025-05-12 21:29:23,,,,best i can do is offer enhanced AI performance and 100 mentions of AI in a 30 minute product launch presentation,mrzcb7b,1.0,1kl3lxz
comment,mrzntrx,HatefulSpittle,,0,2025-05-12 22:12:48,,,,It stands for Apple Intelligence btw,mrzforu,2.0,1kl3lxz
comment,mrzdayc,Mashm4n,,9,2025-05-12 21:17:06,,,,Still got my 14 Pro and honestly havent felt the need to upgrade just yet,mrzcb7b,1.0,1kl3lxz
comment,mrzgoo6,Large_Principle6163,,3,2025-05-12 21:34:36,,,,Same I put in a new battery almost 9 months ago still 100 battery health to this day,mrzdayc,2.0,1kl3lxz
comment,ms34yq7,d3gaia,,2,2025-05-13 13:19:56,,,,Two months ago I replaced the battery in my 12 mini for the first time Thats five years on a phone whose battery the internet said didnt last a full day which is completely untrue This new battery should get my to the end of its official support lifetime If all goes well I wont be buying anything until the iPhone 21 or 23 lol,mrzgoo6,3.0,1kl3lxz
comment,mrzmhht,Portocala69,,-9,2025-05-12 22:05:24,,,,So in a 2y old product you already changed battery 9 months ago Sounds like a great product s,mrzgoo6,3.0,1kl3lxz
comment,mrzubq9,pagerunner-j,,3,2025-05-12 22:49:32,,,,You should be fine for a while I finally bought a 16 after years with an 8 and even that was a less dramatic change than youd think,mrzdayc,2.0,1kl3lxz
comment,mrzdr1d,mkvii1989,,3,2025-05-12 21:19:23,,,,15 Pro and same Itll be what I use until the battery life starts to suffer since that invariably happens before its too slow to use,mrzdayc,2.0,1kl3lxz
comment,mrzl7jr,emmagrace2000,,2,2025-05-12 21:58:26,,,,Does your battery overheat frequently Im on one year with the 15 Pro and my phone gets so warm on a regular basis I havent gotten the warning on my screen but it does go dim when its especially hot I usually shut down apps and put it down for an hour or so Thats also when I notice my battery percent has gone way down Im debating what I need to do at this point,mrzdr1d,3.0,1kl3lxz
comment,mrzlde8,mkvii1989,,3,2025-05-12 21:59:19,,,,I have never had an overheating issue,mrzl7jr,4.0,1kl3lxz
comment,mrzllsf,emmagrace2000,,1,2025-05-12 22:00:34,,,,Thats really good to know actually I know its a sample of one so far but I dont have anyone around me with the same phone to tell me if mine is an anomaly,mrzlde8,5.0,1kl3lxz
comment,mrzpvca,fordman84,,1,2025-05-12 22:24:10,,,,I get that when its in my car and running Waze,mrzl7jr,4.0,1kl3lxz
comment,mrzsbst,emmagrace2000,,1,2025-05-12 22:38:10,,,,I definitely get it when navigation is running even with car play in my car But this is overheating when Im sitting on my couch reading a book or scrolling social media My screen dimmed when I was reading just over the weekend,mrzpvca,5.0,1kl3lxz
comment,ms219t8,crashbandyh,,1,2025-05-13 07:58:33,,,,My 15 pro max feels really hot when not using a case Unless Im in an air conditioned room itll be too hot to touch without a case especially when charging lol,mrzl7jr,4.0,1kl3lxz
comment,mrzfpk6,okeleydokelyneighbor,,1,2025-05-12 21:29:30,,,,Upgraded to a 15 pro from an Max I could wait another 5 years for my next upgrade,mrzdr1d,3.0,1kl3lxz
comment,mrzdlkg,Kachda,,3,2025-05-12 21:18:37,,,,Heck Im still rocking my 13 mini and dont feel the need to upgrade either,mrzdayc,2.0,1kl3lxz
comment,mrzdr1c,melancious,,3,2025-05-12 21:19:23,,,,iPhone 12 going strong,mrzdlkg,3.0,1kl3lxz
comment,mrzf0vl,vonneguts_anus,,5,2025-05-12 21:25:57,,,,Tmobile sidekick gang for life,mrzdr1c,4.0,1kl3lxz
comment,ms1h0ty,Suse-,,2,2025-05-13 04:49:35,,,,Still love my 12 mini Its a shame they dont offer this size any longer,mrzdr1c,4.0,1kl3lxz
comment,mrzfd2u,Elektguitarz,,1,2025-05-12 21:27:41,,,,Hows your battery doing Or have you replaced it Mine is in the shitter,mrzdr1c,4.0,1kl3lxz
comment,mrzryq2,rararagidesu,,2,2025-05-12 22:36:06,,,,Get a new battery totally worth it if youre okay with phone otherwise Did so 6 months ago,mrzfd2u,5.0,1kl3lxz
comment,mrzspq2,melancious,,2,2025-05-12 22:40:23,,,,Mine is fine No issues Its worse but totally usable,mrzfd2u,5.0,1kl3lxz
comment,ms5oa7e,SkullDump,,1,2025-05-13 20:47:28,,,,Amateurs Im still using an 8 lol,mrzdr1c,4.0,1kl3lxz
comment,mrznngo,dotsdavid,,23,2025-05-12 22:11:50,,,,Lets face with or without tariffs they were going to do it anyways,,0.0,1kl3lxz
comment,mrzqt22,Djghost1133,,-7,2025-05-12 22:29:31,,,,100 Theyve been doing it for years,mrznngo,1.0,1kl3lxz
comment,mrzym05,Prince_Uncharming,,22,2025-05-12 23:14:28,,,,Doing it for years I get its popular to hate on Apple but thats simply not true Base Pros have been 1000 for like a decade they literally havent raised the price since the original X came out The standard size nonPro models have been 7800 for the same amount of time Base iPad and MacBook Air models are also a great value and also have not had base price increases in forever,mrzqt22,2.0,1kl3lxz
comment,ms20yh6,akashi10,,-3,2025-05-13 07:55:20,,,,busy steep compare cake recognise party imagine roll light plants This post was mass deleted and anonymized with Redact,mrzym05,3.0,1kl3lxz
comment,ms0hadz,dezumondo,,4,2025-05-13 00:59:41,,,,Surprised they havent already Everything else has gone up 2030,,0.0,1kl3lxz
comment,ms015l4,None,,7,2025-05-12 23:28:08,,,,Im still rocking my iPhone 11 PM Once that stops getting iOS upgrades Ill move to the next iPhone iPhone 12 PM baby,,0.0,1kl3lxz
comment,ms2hu2m,supboy1,,0,2025-05-13 10:43:44,,,,So you plan to upgrade to a different phone every year Are iOS cutoffs staggered by generation If iPhone 11 gets cut off wouldnt iPhone 12 not be supported the following year,ms015l4,1.0,1kl3lxz
comment,ms30frr,InsaneNinja,,2,2025-05-13 12:53:35,,,,Even if he was serious I think he can decide what to update to after they announced compatibility,ms2hu2m,2.0,1kl3lxz
comment,mrzbjco,krectus,,31,2025-05-12 21:07:59,,,,As of March 29 2025 Apple Inc reported holding approximately 2816 billion in cash cash equivalents and restricted cash In addition the company held 2034 billion in current marketable securities and 8442 billion in noncurrent marketable securities bringing its total liquid assets to about 1329 billion,,0.0,1kl3lxz
comment,mrzpe4m,flirtmcdudes,,14,2025-05-12 22:21:30,,,,Yeah but how else are they going to get even more billions if they dont raise prices Profits must never stop increasing,mrzbjco,1.0,1kl3lxz
comment,mrzx133,xxdjreddxx,,5,2025-05-12 23:05:10,,,,Big green bar gotta go bigger green bar,mrzpe4m,2.0,1kl3lxz
comment,mrzrhkz,obelix_dogmatix,,29,2025-05-12 22:33:21,,,,Love when people throw out random numbers without context Apples annual operating expenses are twice its liquid assets I am the last person to defend Apple but throwing out random numbers and acting as if that company could operate on peanuts is a new level of absurd,mrzbjco,1.0,1kl3lxz
