type,id,author,title,score,created_utc,url,num_comments,subreddit,body,parent_id,depth,post_id
post,1klq2qq,a_Ninja_b0y,Apple Is Developing a Brain-Computer Interface,114,2025-05-13 16:16:23,https://www.reddit.com/r/gadgets/comments/1klq2qq/apple_is_developing_a_braincomputer_interface/,81.0,gadgets,,,,
comment,ms44ej4,cedande,,101,2025-05-13 16:18:48,,,,Its probably harder to name a monolithic tech company that is not developing one,,0.0,1klq2qq
comment,ms47tf1,appleburger17,,32,2025-05-13 16:35:27,,,,Yeah if youre a huge tech company you pretty much have to be working on things like this even if you never develop a product,ms44ej4,1.0,1klq2qq
comment,ms5cjwu,kurotech,,11,2025-05-13 19:51:22,,,,Patents alone make it worth it for them development of a product is only half the value,ms47tf1,2.0,1klq2qq
comment,ms4lsnx,cedande,,7,2025-05-13 17:42:32,,,,Even Gabe N of Valve started a company to develop this tech back in 2019,ms47tf1,2.0,1klq2qq
comment,msskg3z,focus_puffer,,1,2025-05-17 13:52:03,,,,youre maybe thinking of valve x openbci x tobii collab,ms4lsnx,3.0,1klq2qq
comment,msstcre,cedande,,1,2025-05-17 14:43:45,,,,This is the company that he cofounded,msskg3z,4.0,1klq2qq
comment,mstc09j,focus_puffer,,1,2025-05-17 16:24:52,,,,interesting this went under my radar,msstcre,5.0,1klq2qq
comment,mstsew2,cedande,,1,2025-05-17 17:51:56,,,,They dont really seem to have many if any major announcements Not that Ive been looking though I was just told about the company a week or so ago,mstc09j,6.0,1klq2qq
comment,ms4wl2u,WinglyBap,,3,2025-05-13 18:33:47,,,,Why though,ms47tf1,2.0,1klq2qq
comment,ms65r72,sans-delilah,,8,2025-05-13 22:18:27,,,,A brain to computer interface for gaming makes total sense for the VALVE founder,ms4wl2u,3.0,1klq2qq
comment,ms6a3wc,Stompedyourhousewith,,7,2025-05-13 22:42:57,,,,Paradigm If youre not part of the future youre part of the past Things tech ceos said in the late 90s,ms4wl2u,3.0,1klq2qq
comment,ms4xyne,appleburger17,,11,2025-05-13 18:40:18,,,,Tons of reasons They dont want to get caught years behind on a technology that could pop Or they might discover something that leads the way Or they might develop patents that others license,ms4wl2u,3.0,1klq2qq
comment,ms766od,Oddyssis,,3,2025-05-14 01:49:24,,,,Its very hard to do and the company that breaks the code is going to be a kajillionaire and the ones who were at least working on it will have enough experience and technology to catch up quickly and not be totally dusted,ms4wl2u,3.0,1klq2qq
comment,ms7ag9q,ElJanitorFrank,,2,2025-05-14 02:14:44,,,,Nobody said the overarching reason,ms4wl2u,3.0,1klq2qq
comment,mvaxr0x,GuardianDom,,1,2025-05-31 20:31:57,,,,Gabe Newell initially started researching it to suppress motion sickness in VR going to incorporate it into the headset straps,ms4wl2u,3.0,1klq2qq
comment,ms5nu6w,andynator1000,,4,2025-05-13 20:45:20,,,,Amazon Meta Microsoft IBM Oracle etc,ms44ej4,1.0,1klq2qq
comment,ms9dj5h,Seeteuf3l,,1,2025-05-14 12:37:19,,,,Your brain runs with Java now,ms5nu6w,2.0,1klq2qq
comment,ms9bpnn,val_tuesday,,-1,2025-05-14 12:25:49,,,,How do you know Any one person cant possibly know about all secret projects in all those companies Also at least Meta has public projects at least close to this tech its not a stretch to imagine they have secret ones working on this directly,ms5nu6w,2.0,1klq2qq
comment,ms8tjvb,NorysStorys,,3,2025-05-14 10:07:22,,,,ARM easy,ms44ej4,1.0,1klq2qq
comment,ms8fsug,Spara-Extreme,,1,2025-05-14 07:44:30,,,,Alphabet,ms44ej4,1.0,1klq2qq
comment,ms4f0n4,firedmyass,,18,2025-05-13 17:09:58,,,,CIA licking its chops,,0.0,1klq2qq
comment,ms4i8df,Jamie00003,,16,2025-05-13 17:25:39,,,,Imagine Siristuck in your brain Revolutionary,,0.0,1klq2qq
comment,ms5eqo5,zffjk,,8,2025-05-13 20:01:53,,,,Id be quickly leaving my brain in that case,ms4i8df,1.0,1klq2qq
comment,ms5xb18,ABucin,,7,2025-05-13 21:33:34,,,,with ads,ms4i8df,1.0,1klq2qq
comment,ms95pxu,Confident-Pop-9256,,2,2025-05-14 11:45:51,,,,Unskippable ads,ms5xb18,2.0,1klq2qq
comment,ms4rh4v,ambermage,,21,2025-05-13 18:09:22,,,,This is just going to turn into disabled people shouldnt get benefits because they can get a brain implant and get a job,,0.0,1klq2qq
comment,ms6i51u,TehOwn,,14,2025-05-13 23:28:49,,,,Honestly if this enabled me to work a fulltime job without destroying my health then Id be all for it I have no doubt that I could find a job in a field that I would enjoy if I was fully capable This is highly unlikely to do that for me but if it was possible for others then great Just dont take away their support until they can actually achieve it,ms4rh4v,1.0,1klq2qq
comment,ms4sv3s,bonesnaps,,11,2025-05-13 18:16:04,,,,You do not have the permissions required to repair your own braincomputer as you do not reside in the EU Please upgrade to the iCloud subscription and visit an Apple authorized iFixit Store to recover your memories,,0.0,1klq2qq
comment,ms4qxhx,Jodelbert,,6,2025-05-13 18:06:46,,,,Doubt itll work on some people since theyre lacking a critical component for this to function Me included lol,,0.0,1klq2qq
comment,ms6ih9k,TehOwn,,3,2025-05-13 23:30:44,,,,At least youve got a computer,ms4qxhx,1.0,1klq2qq
comment,msbh93r,trickman01,,2,2025-05-14 18:54:25,,,,Whats a computer,ms6ih9k,2.0,1klq2qq
comment,ms4dwni,vfdfnfgmfvsege,,12,2025-05-13 17:04:39,,,,please dont,,0.0,1klq2qq
comment,ms46l6e,nemuro87,,5,2025-05-13 16:29:27,,,,iMe X Pro,,0.0,1klq2qq
comment,ms4irik,EdCenter,,3,2025-05-13 17:28:11,,,,I want the Apple Brain 5 imho iPhone 5 was the best iphone fight me,,0.0,1klq2qq
comment,ms8ilug,Fiveby21,,1,2025-05-14 08:13:58,,,,They need to give Siri a brain before they go messing with ours,ms4irik,1.0,1klq2qq
comment,ms6o206,half-baked_axx,,4,2025-05-14 00:02:25,,,,Sorry this nonApple device is not compatible with your auditory canal,,0.0,1klq2qq
comment,ms6b526,dB_Manipulator,,2,2025-05-13 22:48:47,,,,iThink,,0.0,1klq2qq
comment,ms68ug3,TheStupendusMan,,4,2025-05-13 22:35:50,,,,They announce the iBrain 2 Pro Max and suddenly you have brain fog They push an update and suddenly all you can hear is U2 They change ports on the new version and now you cant see your kids The jokes just write themselves gifgiphyZ9cRCMdAMzXi25dwhE,,0.0,1klq2qq
comment,ms4r2h5,ChainLC,,2,2025-05-13 18:07:26,,,,a 2 button mouse,,0.0,1klq2qq
comment,ms5qvza,crispyfrybits,,2,2025-05-13 21:00:09,,,,Failed augmented vision release Still doesnt have any skin in the AI game and had to rollback their AI news titles for being hilariously inaccurate Thinks they can manage to implement a brain to computer interface,,0.0,1klq2qq
comment,ms6qnz2,Dolatron,,1,2025-05-14 00:17:48,,,,Will it be compatible with Apple VR,,0.0,1klq2qq
comment,ms6w7rd,tkhan456,,1,2025-05-14 00:51:05,,,,Which will be abruptly canceled in 5 years after they spend 100bn on it,,0.0,1klq2qq
comment,ms70o57,Difficult_Ad2864,,1,2025-05-14 01:17:29,,,,Only 100k for a limited time,,0.0,1klq2qq
comment,ms72gye,emilio8x,,1,2025-05-14 01:28:13,,,,It was bound to happen All tech companies want this ultimately This last decade the whole point of portable tech was to make technology an extension of us Smartphones we cant live without it almost part of us Same with apple watch Already wearing it the whole day technically part of us too All of this is a slow preparation for the brain interface Public isnt ready yet so they go step by step End goal is trans humanism or the moment we become real slaves to the authorities May be a stretch but i think theres a reason why hollywood has been pushing superhero movies this last decade or so They are all augmented beings with super powers They want to make it seem cool but its an unconscious preparation for trans humanism If mass population think its cool to be augmented then it will be easier for them to sell the brain interface Even Klaus Schwab founder of World Economic Forum said in an interview that this is the next step for the human species You can find it easily on YouTube,,0.0,1klq2qq
comment,ms7617s,artpile,,1,2025-05-14 01:48:32,,,,So the mortgage on the house as a downpayment on the preorder,,0.0,1klq2qq
comment,ms7gqhp,PaulSarlo,,1,2025-05-14 02:53:34,,,,Are they doing a Pantheon Because this super feels like theyre doing a Pantheon Are we gonna find out they fucking cloned Jobs,,0.0,1klq2qq
comment,ms95l3b,Spagman_Aus,,1,2025-05-14 11:44:54,,,,Apple always seems to be playing catchup these days,,0.0,1klq2qq
comment,msobvyt,evilbarron2,,1,2025-05-16 19:13:10,,,,Apple has never been first with a product since the Mac Thats not their strategy,ms95l3b,1.0,1klq2qq
comment,ms99ijl,Sndr666,,1,2025-05-14 12:11:37,,,,vr not taking off is prob a sign well have none of that future malarkey anymore,,0.0,1klq2qq
comment,mshrn4p,DontWreckYosef,,1,2025-05-15 18:32:53,,,,They cant even fix a glitchy Siri after 10 years You are telling me that brain interface is next,,0.0,1klq2qq
comment,mshxvo2,__Loot__,,2,2025-05-15 19:04:06,,,,Its low bandwidth so you cant play complex games with it at least for now,mshrn4p,1.0,1klq2qq
comment,msjct3j,NotJimIrsay,,1,2025-05-15 23:29:32,,,,Isnt that what Neuralink is also doing,,0.0,1klq2qq
comment,mskyum9,-Ricky-Stanicky-,,1,2025-05-16 06:12:25,,,,So not only will they sell your data theyll sell your thoughts,,0.0,1klq2qq
comment,msobbk8,evilbarron2,,0,2025-05-16 19:10:17,,,,Apple doesnt sell data They will leverage every bit of data they get to customize their services and content but they absolutely dont sell data They even sanitize the search requests they send to Google they wont even share data with partners,mskyum9,1.0,1klq2qq
comment,msq30kv,-Ricky-Stanicky-,,1,2025-05-17 01:21:31,,,,Sell leak handle unsafely Its all the same,msobbk8,2.0,1klq2qq
comment,msqjyho,evilbarron2,,0,2025-05-17 03:13:07,,,,It really really isnt,msq30kv,3.0,1klq2qq
comment,msou7dx,dtitov,,1,2025-05-16 20:46:38,,,,It will cost you an arm and a leg and will give you seizures but you will get to unlock your Iphone with your brain,,0.0,1klq2qq
comment,ms5kbnv,None,,1,2025-05-13 20:28:21,,,,gifgiphyfi1OSRrXEBeW47K5Ke Some should tell Tim Apple that we already have a BrainComputer interface and it works just fine,,0.0,1klq2qq
comment,ms55kzf,slothtolotopus,,1,2025-05-13 19:17:11,,,,Imagine your brain and body as a smartphone All that comes with it and more The future is fucking abysmal We are become borg,,0.0,1klq2qq
comment,ms57qe1,707Guy,,1,2025-05-13 19:27:39,,,,EyePhone,,0.0,1klq2qq
comment,ms6ja55,VincentNacon,,1,2025-05-13 23:35:16,,,,Trying really hard to get ready to brainwash people in the far future arent they,,0.0,1klq2qq
comment,ms4vexd,SaiyanRajat,,0,2025-05-13 18:28:13,,,,But they still cant fix their crap mouse and keyboard,,0.0,1klq2qq
comment,ms5oejg,codeyman2,,2,2025-05-13 20:48:03,,,,That is why they are working on brain computer interface so they can make you like their keyboards and mice,ms4vexd,1.0,1klq2qq
comment,msrhroe,akeean,,1,2025-05-17 08:20:45,,,,Itll come with a proprietary port so you can plug and keep your magic mouse on the top of your head and use your brain to click that one button and charge the device at the same time,ms5oejg,2.0,1klq2qq
comment,ms4fhz4,PKblaze,,0,2025-05-13 17:12:19,,,,And everyone will jump on board because they have to keep up with whatever Apple is doing,,0.0,1klq2qq
comment,ms5af78,stedun,,0,2025-05-13 19:41:04,,,,Im sure theyll just use it to pump advertisements directly into my cranium,,0.0,1klq2qq
comment,ms630wo,Mando_calrissian423,,0,2025-05-13 22:03:27,,,,I cant wait to pay for a subscription to access my memories,,0.0,1klq2qq
comment,ms4p7os,Dulse_eater,,-1,2025-05-13 17:58:32,,,,Stop it,,0.0,1klq2qq
comment,ms4oufj,dreamer_Neet,,0,2025-05-13 17:56:48,,,,Siri let me out Sorry I cant do that,,0.0,1klq2qq
comment,ms4s53w,Heuli77,,0,2025-05-13 18:12:34,,,,At least I wont need an iCloud Upgrade,,0.0,1klq2qq
comment,ms4tk03,coolpapa2282,,0,2025-05-13 18:19:23,,,,Wel we can at least hope this will slow down their RD on the Torment Nexus,,0.0,1klq2qq
comment,ms5ypl2,pxr555,,0,2025-05-13 21:40:47,,,,Also an electric car Well not anymore,,0.0,1klq2qq
comment,ms73fbx,Wilsongav,,0,2025-05-14 01:33:47,,,,Revolutionary How do they come up with these ideas,,0.0,1klq2qq
