type,id,author,title,score,created_utc,url,num_comments,subreddit,body,parent_id,depth,post_id
comment,n07ax12,SteeveJoobs,,1,2025-06-28 06:52:43,,,,Its not just that but the handheld mode would be 999 used in a casual environment and many switch customers dont even use handheld mode But its still an odd decision for the worlds premier 5050 device especially when the handheld industry is trending toward high quality OLED as the expectation not the exception with Nintendo themselves being a reason for that,mzwoxxo,1.0,1ll4eiv
comment,n07s6tg,Haru17,,1,2025-06-28 09:41:27,,,,Yeah even if someone put a gun to my head and said spend 500 the Switch 2 would still be a bad deal because they dont have an option for an OLED screen We all know theyre going to come out with one in a couple years like with the Switch,mzwoxxo,1.0,1ll4eiv
comment,n0l1aj0,BigBossHaas,,1,2025-06-30 14:36:52,,,,I mean you could argue it doesnt matter for enthusiasts either since its not noticeable until you put it under a microscope Im a stickler for performance and visual smoothness I will drop money and go out of my way for these things I had no idea about it until Digital Foundry told me it was a thing The only context where this would really truly matter is esports and we know thats not going to be taking place on a handheld console anyways,mzwoxxo,1.0,1ll4eiv
comment,n017zlt,BoxOfDemons,,0,2025-06-27 09:00:03,,,,Curious how they will handle an OLED model Even the high end OLED monitors today still have flickering issues with VRR enabled So either they wait until thats solved remove VRR or let their screens have flickering issues,mzwoxxo,1.0,1ll4eiv
comment,mzz2kak,quasirun,,-3,2025-06-26 23:30:14,,,,Yeah its no different than offering a base model car and then tagging on the upsells Want a better screen refresh Wait and buy the more expensive and better profit margin display version in 8 months Hell they can just wait 8 months drop a bigger battery in this model and crank voltages for higher refresh and market it as a Switch 2 or whatever and milk an extra 100 out the customer Then drop an OLED or some new tech display 8 months after that And Id bet they have usage stats for Switch OG showing them 99 of play time is on an external TV or monitor anyways for 90 of their customer base,mzwoxxo,1.0,1ll4eiv
comment,n02pvya,edvek,,1,2025-06-27 14:56:24,,,,Ya but that higher trim is available at the same time so you get to choose what you want Sure you can choose still by choosing to not buy but who knows when or if they will even release an OLED model In my opinion because the OLED switch is so much better the switch 2 should have been OLED by default There is absolutely no reports of an OLED version coming so saying 8 months is straight from your ass,mzz2kak,2.0,1ll4eiv
comment,mzwqb7c,DukeFlipside,,459,2025-06-26 16:31:49,,,,Literally havent noticed this problem even after being told about it,,0.0,1ll4eiv
comment,mzwt666,TingleyStorm,,60,2025-06-26 16:45:30,,,,Im wondering the method they used to test Other people ran tests too and found that the display was closer to 17ms response time as low as 9ms I cant say I noticed a difference other than the screen isnt as nice as my OLED tv but thats like complaining that a salisbury steak isnt as tasty as New York strip Its not nearly enough to distract from the gaming experience though,mzwqb7c,1.0,1ll4eiv
comment,n01c2mm,DenormalHuman,,4,2025-06-27 09:39:41,,,,it would need to be 83ms to hit a clean 120hz refresh rate,mzwt666,2.0,1ll4eiv
comment,mzwuxtc,SystemofCells,,11,2025-06-26 16:53:54,,,,I saw a comment somewhere else that suggested theres a significant difference depending on whether motion is vertical or horizontal The screen refreshes faster in one direction No idea whether thats true though,mzwt666,2.0,1ll4eiv
comment,mzwwu9z,neoblufalcon,,14,2025-06-26 17:02:40,,,,The problem is much more noticeable when playing 2D games,mzwuxtc,3.0,1ll4eiv
comment,n00asne,BlobTheOriginal,,-2,2025-06-27 04:05:10,,,,How does that make any sense Pixels have no concept of motion they just change from one intensity to the other and in this case slowly Maybe its more noticeable on some games,mzwuxtc,3.0,1ll4eiv
comment,n017ga8,SystemofCells,,2,2025-06-27 08:54:55,,,,When someone says a screen is 1080p the p stands for progressive scan It means that the pixels dont refresh all at once or in interlacing lines but start from one end and work their way down Generally this is setup to start refreshing at the top of the screen then work down for each frame But there is I think speculation that the Switch 2 screen refreshed from the side instead because its a flipped mobile screen that would normally be held in vertical orientation,n00asne,4.0,1ll4eiv
comment,n0cv921,BlobTheOriginal,,1,2025-06-29 04:27:52,,,,Of course but the switch screen refreshes every 83 ms a fraction of the time it takes for the pixels to actually change Not saying youre wrong just curious where that information is from if you can remember,n017ga8,5.0,1ll4eiv
comment,n00e4rh,M3wThr33,,1,2025-06-27 04:30:23,,,,The screen isnt perfectly square They dont refresh in a uniform fashion,n00asne,4.0,1ll4eiv
comment,n00ejfc,BlobTheOriginal,,-1,2025-06-27 04:33:34,,,,I realised the screen wasnt perfectly square Your point,n00e4rh,5.0,1ll4eiv
comment,n00oatk,Dangerous_Olive_4082,,2,2025-06-27 05:52:59,,,,All gaming monitors have a response time of 1 ms now Used to be 5 ms like in 2010 17 ms in 2025 is just terrible if its true,mzwt666,2.0,1ll4eiv
comment,mzwqso2,rustyphish,,181,2025-06-26 16:34:07,,,,Careful that means youre a shill for Nintendo who is clearly blind and a terrible human being apparently,mzwqb7c,1.0,1ll4eiv
comment,mzwv8x8,elspotto,,34,2025-06-26 16:55:21,,,,No no no Thats when you say you like the road course nature of Mario Kart World,mzwqso2,2.0,1ll4eiv
comment,n01wzq0,TheKingsPride,,2,2025-06-27 12:21:38,,,,They RUINED Mario Kart World meanwhile Im just laughing and having fun with my friends,mzwv8x8,3.0,1ll4eiv
comment,mzwtstx,dragonblade_94,,18,2025-06-26 16:48:32,,,,Well no thats when you shout down people having legitimate issues and discussing them because you dont like the product you bought being criticized People are allowed to enjoy the things they buy but filling the air with I dont have a problem stop talking about it is just advocating against yourself as a consumer,mzwqso2,2.0,1ll4eiv
comment,mzztieq,gsmumbo,,14,2025-06-27 02:10:24,,,,I saw this put really well in another comment the other day people feel empowered via bandwagon outrage Pretty much every one of these discussing legitimate issues posts ends up devolving into people trying to outdo each others hyperbole,mzwtstx,3.0,1ll4eiv
comment,mzwvusn,rustyphish,,24,2025-06-26 16:58:09,,,,Im not telling anyone to stop talking about it literally havent done that once There are PLENTY of people saying you shouldnt enjoy it My first comment was about how I still think it looks great without a single word telling people how to feel and I immediately got a wave of lol cope,mzwtstx,3.0,1ll4eiv
comment,mzx41sh,Chad_Broski_2,,25,2025-06-26 17:35:19,,,,Yeah seriously its like the entirety of reddit has collectively decided that the console was a failure and everyone who bought it should be ashamed You constantly see any criticism of it getting upvoted to the moon ignoring the fact that its the best selling console release of all time Im honestly not sure what people expected No one buys Nintendo consoles for the hardware so trying to and shit all over the hardware isnt gonna stop people from buying it Its got no games now but a shit ton of awesome exclusives down the road The price is high but not a dealbreaker for most people Is it that controversial to just say its a great if overpriced console with a few serious issues none of which are dealbreakers,mzwvusn,4.0,1ll4eiv
comment,mzx6xlr,rustyphish,,-3,2025-06-26 17:48:25,,,,Apparently You must consider it a piece of garbage and call anyone that buys it a shill who is ruining the industry by not voting with their wallets according to some people,mzx41sh,5.0,1ll4eiv
comment,mzzldci,Med_Jed,,5,2025-06-27 01:21:25,,,,Unfortunately its like that with every iteration of nintendo consoles since they came to be Stop having fun with the thing youre having fun with Im fully aware of its flaws but im probably not going to buy an oled and stick with this one as its serviceable probably till the near end of the switch 2s cycle Ghosting be damned its there but if I want to play a high fidelity game Ill do so on my pc,mzwvusn,4.0,1ll4eiv
comment,mzz4uzg,24bitNoColor,,-6,2025-06-26 23:43:24,,,,Im not telling anyone to stop talking about it literally havent done that once No you just discourage them from speaking up by taking the victim role wo having been victimized,mzwvusn,4.0,1ll4eiv
comment,mzzcit9,rustyphish,,4,2025-06-27 00:28:46,,,,Lol the irony,mzz4uzg,5.0,1ll4eiv
comment,mzy8he0,bschumm1,,-2,2025-06-26 20:50:16,,,,I disagree Im apparently a rare breed but I much prefer the intermission between tracks and not just doing 3 laps I think its been an awesome change for MKW and now Im sure due to the loud outrage online from people that Nintendo will eventually cave and Ill be forced to do the 3 laps every time again like we have for 8 straight Mario Karts,mzwtstx,3.0,1ll4eiv
comment,mzydnuj,dragonblade_94,,4,2025-06-26 21:16:02,,,,I think you may be replying to the wrong person or the wrong post altogether,mzy8he0,4.0,1ll4eiv
comment,n04ln0a,Realistic_Condition7,,1,2025-06-27 20:20:04,,,,Its also just one of those things that some people are going to be sensitive to and others arent Its only relevant if it falls within the range that people would notice and this level of ghosting is definitely within that range Will most people notice Probably not Will a chunk of people notice Definitely Its not really the end of the world because such a cheap console has to give somewhere and clearly with the Switch it has been the screen but thats just something people should be aware of not a be all end all in deciding to buy it or not Im loving my Switch 2 so far,mzwqso2,2.0,1ll4eiv
comment,mzybts0,None,,0,2025-06-26 21:06:48,,,,I havent noticed it so clearly its not a problem Ive found especially with things like screens that different people have way different tolerances for certain properties IE I personally cant even really notice a difference between 60hz and 120hz and couldnt care less for that feature but if the white balance of a screen is even ever so slightly off it drives me crazy Whereas ive heard other people say that anything less than 240hz is unplayable which is crazy to me but hey its ok we just dont see the same,mzwqso2,2.0,1ll4eiv
comment,mzx3lye,CoolGuyBabz,,-7,2025-06-26 17:33:17,,,,Nobody is saying that shit I just prefer people wouldve voted with their wallet and did not get the switch 2 to shoot down the idea of overpricing every game at 80 with 100 for the physical copies mind you Am I disappointed that it didnt happen and it went sold out on release Yes Is everyone obligated to vote with their wallet No but I encourage it Its something that just doesnt happen nowadays even though its so effective,mzwqso2,2.0,1ll4eiv
comment,mzx6jzw,rustyphish,,6,2025-06-26 17:46:43,,,,Except they are have had multiple people say it to me just today,mzx3lye,3.0,1ll4eiv
comment,mzx6ons,CoolGuyBabz,,-7,2025-06-26 17:47:17,,,,Proof,mzx6jzw,4.0,1ll4eiv
comment,mzx8kpw,rustyphish,,9,2025-06-26 17:55:52,,,,Sure Here was someone I was talking with that was claiming Nintendo games arent even good and that all the hype is some type of astroturfing operation where people are gaming the algorithm to make it seem like theyre better than they are heres a good and simple cope like Im lying about my enjoyment of it here are some more that I wasnt involved in just for fun No one actually likes it theyre just lying to themselves and its all sunken cost Anyone who enjoys it is wrong for liking trash Nintendo fans will crucify you for being critical theres certainly more but you get the picture Gamers love to bully other gamers over tiny perceived differences instead of just letting people enjoy things,mzx6ons,5.0,1ll4eiv
comment,n03m04t,rustyphish,,2,2025-06-27 17:27:17,,,,pRoOf,mzx6ons,5.0,1ll4eiv
comment,n03ttls,CoolGuyBabz,,-1,2025-06-27 18:03:18,,,,Lmao did you come back a whole day after this disagreement Was this on your mind for the whole day,n03m04t,6.0,1ll4eiv
comment,n047agf,rustyphish,,2,2025-06-27 19:08:09,,,,pRoOf,n03ttls,7.0,1ll4eiv
comment,mzy81z7,MalevolentFerret,,15,2025-06-26 20:48:10,,,,Its a good console when you dont have a Redditor in your ear telling you youre LITERALLY KILLING GAMING,mzwqb7c,1.0,1ll4eiv
comment,mzyzqh9,veryrandomo,,14,2025-06-26 23:14:26,,,,Ive seen so many posts on Reddits popular page and articles complaining about the Switch 2s response times and act like its unusable yet the steam deck lcd has a similar response time and Ive not seen anyone complain about that The response times arent good but its getting blown out of proportion because people hate Nintendo,mzwqb7c,1.0,1ll4eiv
comment,mzz9uk8,flatroundworm,,14,2025-06-27 00:12:32,,,,Loads of people complained about the lcd steam deck screen The OLED is miles and miles and miles ahead,mzyzqh9,2.0,1ll4eiv
comment,n0khtw1,Dependent-Mode-3119,,1,2025-06-30 12:50:13,,,,It was never the response time people had an issue with though,mzz9uk8,3.0,1ll4eiv
comment,n0khzod,flatroundworm,,1,2025-06-30 12:51:12,,,,It was my main issue with it when I had one,n0khtw1,4.0,1ll4eiv
comment,n0kijdu,Dependent-Mode-3119,,1,2025-06-30 12:54:35,,,,The main issue everybody had with it was that it just had terrible colors and I believe that the screen wasnt even laminated to the device so you had black levels akin to the OG nintendo switch,n0khzod,5.0,1ll4eiv
comment,n0185k7,BoxOfDemons,,6,2025-06-27 09:01:42,,,,Huh There were tons of complaints about the steam deck screen on release,mzyzqh9,2.0,1ll4eiv
comment,n019muu,veryrandomo,,0,2025-06-27 09:16:13,,,,The only complaints I saw about the Steam Deck LCDs screen was color gamut coverage and refresh rate and even then I couldnt find any articles like this one about it just a couple reddit threads with 100 upvotes at best Even specifically searching for the Steam Deck response time I cant even find anyone complaining about it,n0185k7,3.0,1ll4eiv
comment,mzz963q,generalthunder,,7,2025-06-27 00:08:28,,,,There was definitely a huge comotion about the Deck screen when it released especially because it had really poor contrast and awful color reproduction The OLED model improved the experience massively,mzyzqh9,2.0,1ll4eiv
comment,n02i3yh,3WayIntersection,,1,2025-06-27 14:18:39,,,,I heard that it might have to do with different distributors of the screens themselves Give it time and i think nintendo will weed out the bad ones,mzwqb7c,1.0,1ll4eiv
comment,n03kqrw,kclongest,,1,2025-06-27 17:21:27,,,,People are just piling on Nintendo hate because of their Switch 2 game pricing and legal actions against emulation This is typical Reddit,mzwqb7c,1.0,1ll4eiv
comment,mzwrxpe,brondonschwab,,-13,2025-06-26 16:39:36,,,,You can put scare quotes if you like but it is a problem Just because youre not attuned to that type of thing doesnt make it fine for a 400 handheld to have such a low quality display,mzwqb7c,1.0,1ll4eiv
comment,mzwvof2,Old-Rhubarb-97,,19,2025-06-26 16:57:20,,,,Isnt that par for the course for that form factor and price point Look at the ipad mini,mzwrxpe,2.0,1ll4eiv
comment,mzza1sv,flatroundworm,,0,2025-06-27 00:13:44,,,,The iPad mini gets shot on for being 60hz but the response time is much better than the switch 2,mzwvof2,3.0,1ll4eiv
comment,mzwtbuc,Muggaraffin,,17,2025-06-26 16:46:16,,,,Screens have more factors than input time If its sufficient then they likely put the cost where its necessary You wouldnt buy a Ferrari and complain that its bad at offroading,mzwrxpe,2.0,1ll4eiv
comment,mzyozqd,xD3I,,-2,2025-06-26 22:14:54,,,,What a shit analogy mate no one buys a Ferrari to go off roading so its expected not to have off roading features The switch 2 is meant for handheld GAMING and response time is an integral part of a screens GAMING performance response time and refresh rates dont matter when watching movies but you dont buy a switch to watch movies,mzwtbuc,3.0,1ll4eiv
comment,n00u88n,brondonschwab,,-2,2025-06-27 06:46:27,,,,Exactly lol Its failing to fulfill its intended purpose,mzyozqd,4.0,1ll4eiv
comment,mzwuyt2,brondonschwab,,-14,2025-06-26 16:54:02,,,,And yet it also has terrible contrast and fake HDR Crazy that is considered sufficient,mzwtbuc,3.0,1ll4eiv
comment,mzyj46s,bnlf,,1,2025-06-26 21:43:52,,,,Ive noticed some ghosting in Zelda when moving the camera Not a big deal but I confess I havent played for long hours in handheld mode yet so cant tell if its a problem,mzwqb7c,1.0,1ll4eiv
comment,mzyk79p,cloud12348,,-2,2025-06-26 21:49:27,,,,I swear some of you could have someone pissing in your water and you dont care because you think it tastes the same,mzwqb7c,1.0,1ll4eiv
comment,n0125pz,nicman24,,0,2025-06-27 08:02:20,,,,then you should not care enough about it to comment,mzwqb7c,1.0,1ll4eiv
comment,n00ykm0,tecedu,,0,2025-06-27 07:27:06,,,,Apparently there are two variants of the switch 2 going around You might have gotten the other one,mzwqb7c,1.0,1ll4eiv
comment,n0f0qpi,WearerofConverse,,0,2025-06-29 14:59:27,,,,Lol so defensive,mzwqb7c,1.0,1ll4eiv
comment,mzz2yvi,mooselantern,,26,2025-06-26 23:32:32,,,,Me who owned one of those gray brick gameboys with the green unlit screen that drew a frame roughly once a week,,0.0,1ll4eiv
comment,n001h3i,MapleMonstera,,6,2025-06-27 03:00:31,,,,I played through Pokémon red using one of those OG gameboys Even had the light with a magnifying glass thing Some games just look better in that green,mzz2yvi,1.0,1ll4eiv
comment,n00co0i,P4_Brotagonist,,0,2025-06-27 04:19:10,,,,Oh come on thats some wild nostalgia I had an OG green GameBoy but god it looked awful Having to dial up and down the contrast depending on light conditions was wild especially when the gameboy pocket looked 10 times more clear I jumped from the OG to a color and not once would I say that Pokemon looked better at that odd green,n001h3i,2.0,1ll4eiv
comment,n0dm3hm,Corbotron_5,,1,2025-06-29 08:33:36,,,,Same here The Gameboy was my first gaming device I never owned a NES but I did have an Amiga before getting my SNES I find it funny that I can now decide Ive had enough of lapping the Nurburgring take off my VR headset pull a tiny supercomputer out of my pocket and hop on Reddit to read about how underwhelming modern hardware is,mzz2yvi,1.0,1ll4eiv
comment,n03pj6r,TheLost2ndLt,,13,2025-06-27 17:43:32,,,,The more I see about the switch 2 the less I want one,,0.0,1ll4eiv
comment,mzws6lp,Gniphe,,56,2025-06-26 16:40:47,,,,33 ms is bad but the average player wont notice Im holding out for the OLED with better battery and smaller bezels in 2 years,,0.0,1ll4eiv
comment,mzwuqh2,firewire_9000,,19,2025-06-26 16:52:56,,,,Probably nothing like the original PSP Ive never seen so much ghosting in my life Playing GTA 3 with it was a nightmare,mzws6lp,1.0,1ll4eiv
comment,mzwzgx4,Mullet2000,,19,2025-06-26 17:14:39,,,,The black to white response time on the Switch 2 screen is actually in the ballpark of the original PSP according to hardware unboxeds tests The PSP was also in the 30ms range IIRC,mzwuqh2,2.0,1ll4eiv
comment,mzxcrfz,firewire_9000,,0,2025-06-26 18:15:13,,,,Damn thats wild Im extremely sensitive to ghosting,mzwzgx4,3.0,1ll4eiv
comment,mzxcs6d,Aramis444,,3,2025-06-26 18:15:19,,,,I remember that The PSP was especially bad with the colour red,mzwuqh2,2.0,1ll4eiv
comment,n00crgl,Chezni19,,1,2025-06-27 04:19:53,,,,IIRC the Game Boy had some pretty serious ghosting,mzwuqh2,2.0,1ll4eiv
comment,n00ce2f,P4_Brotagonist,,1,2025-06-27 04:17:04,,,,Lol I remember the smearing even on games like FFT War of the Lions Just a massive smear fest and I could never figure out what the hell was happening since I was still in high school but god it looked bad,mzwuqh2,2.0,1ll4eiv
comment,mzz5cvz,gerbilos,,0,2025-06-26 23:46:14,,,,Yeah probably not Id assume theyd do at least somewhat better than a portable console released 20 years ago,mzwuqh2,2.0,1ll4eiv
comment,mzx0i1z,bezzlege,,5,2025-06-26 17:19:18,,,,it took FOUR years for them to make a Switch 1 OLED which is actually insane I want a Switch 2 OLED in 2026 fuck waiting No clue why it wasnt an option at launch even at an inflated price,mzws6lp,1.0,1ll4eiv
comment,mzyf2vk,ThatBants,,16,2025-06-26 21:23:08,,,,Initially the OLED was meant to be a Pro model with upgraded hardware but they couldnt meet their targets for the project so they reused some aspects to make an OLED edition such as the screen and the kickstand design Thats according to internal rumours of course but it would definitely explain why it took them so damn long,mzx0i1z,2.0,1ll4eiv
comment,n007wnz,porkyminch,,1,2025-06-27 03:44:33,,,,The thing that kinda drives me nuts about the Switch 2 personally is that its pretty blatant that they pushed this thing back multiple times but the software support at launch is honestly pretty bad I mean anemic launch lineups are nothing new but the backwards compatibility really should be in a better spot A lot of these games could use a resolution bump andor framerate bump It sucks that there are like 5 games with real switch 2 updates,mzyf2vk,3.0,1ll4eiv
comment,n03d0ky,Edmundyoulittle,,1,2025-06-27 16:45:19,,,,Well as of right now there are handheld gaming 0 devices with a 120hz VRR OLED ROG said its too expensive right now If its too costly for themfor a device thats 800 its definitely too costly to put in a switch 2 at 450,mzx0i1z,2.0,1ll4eiv
comment,n07sdz9,Haru17,,1,2025-06-28 09:43:25,,,,Im alright waiting Its not like the thing even has any games you need it for yet,mzx0i1z,2.0,1ll4eiv
comment,mzxupnl,AreYouOKAni,,0,2025-06-26 19:41:23,,,,Because they want people to doubledip,mzx0i1z,2.0,1ll4eiv
comment,mzyjpw0,bran_the_man93,,1,2025-06-26 21:46:58,,,,If people cant not spend money to get a thing with a nicer screen thats their problem,mzxupnl,3.0,1ll4eiv
comment,mzy6ys4,Level_Forger,,0,2025-06-26 20:42:50,,,,Because theyll get more people to buy two Switch 2s by spacing them out,mzx0i1z,2.0,1ll4eiv
comment,mzx5zdg,TheSupremeDictator,,0,2025-06-26 17:44:08,,,,Because nintendo,mzx0i1z,2.0,1ll4eiv
comment,mzwr38r,sicker_combos,,19,2025-06-26 16:35:33,,,,TLDR its likely done to save on battery life Switch 2 already doesnt last very long playing new games handheld so I cant imagine how bad the battery life would be with overdrive Still it would be nice if this was an option we could choose to enable to avoid response times worse than 20ms or so 33ms does feel pretty egregious but I only notice on newer games so far,,0.0,1ll4eiv
comment,mzxuzbl,AreYouOKAni,,10,2025-06-26 19:42:47,,,,Yeah no Overdrive doesnt meaningfully increase battery consumption even on a 14 screen Tested of my Zephyrus G14 60Hz vs 165 Hz Overdrive is maybe a 10 difference They just cheaped out on the screen And gave the owners an incentive to upgrade to Switch 2 OLED in 2028,mzwr38r,1.0,1ll4eiv
comment,n02hjp0,vgamedude,,1,2025-06-27 14:15:53,,,,I hate all the coping about battery life too even WITHOUT overdrive this screen shouldnt be this bad and slow,mzxuzbl,2.0,1ll4eiv
comment,n145unn,VenZoah,,1,2025-07-03 12:26:24,,,,Not having overdrive enabled and then undervolting it will slow down the display even further It isnt just a simple on offtwo mode option,mzxuzbl,2.0,1ll4eiv
comment,mzz0nyu,kungfungus,,-2,2025-06-26 23:19:34,,,,I read in some other post that switch 2 wont be doable with OLED have you any thoughts about that First I was going to wait for OLED version too Than buy the LCD since no OLED will be done Now I dont fucking know anymore lol,mzxuzbl,2.0,1ll4eiv
comment,n00zv2h,HerrPiink,,8,2025-06-27 07:39:44,,,,Thats nonsense of course it will be doable no idea why the other user would say such a thing but its basically just a monitor integrated in the console Its more expensive to manufacture it like that but thats true for every OLED screen and the console might cost a lot more because its a 4k VRR screen but there is nothing technical that prevents that,mzz0nyu,3.0,1ll4eiv
comment,n00ovr0,AreYouOKAni,,2,2025-06-27 05:58:01,,,,It absolutely would be Nintendo just wants people to doubledip in a couple of years,mzz0nyu,3.0,1ll4eiv
comment,mzyj0w1,soul-regret,,-4,2025-06-26 21:43:24,,,,battery life is already bad so doesnt seem like its working they just cheaped out,mzwr38r,1.0,1ll4eiv
comment,mzws922,Gnome_0,,57,2025-06-26 16:41:06,,,,gifgiphyZL2iRxhnDwtSE Nintendo Haters looking at the switch 2 screen,,0.0,1ll4eiv
comment,n0d0gjp,Alienblob1,,1,2025-06-29 05:09:15,,,,I hate that I can hear this gif,mzws922,1.0,1ll4eiv
comment,n018yvb,Grummm_Didley,,3,2025-06-27 09:09:41,,,,Which is why it sits in its dock behind the tv,,0.0,1ll4eiv
comment,n03iq48,Kurigohan-Kamehameha,,3,2025-06-27 17:12:05,,,,I wonder how the Vita 1000 fares in comparison,,0.0,1ll4eiv
comment,n03phlq,SirCanealot,,3,2025-06-27 17:43:20,,,,Its oled which these days is quoted as 01ms so even if its a bit worse than that it will still be under 05ms Its old oled tech so it does have some issues but still a great screen,n03iq48,1.0,1ll4eiv
comment,n053rbp,rabel10,,3,2025-06-27 21:54:14,,,,Yea I noticed this on Mario Kart almost immediately Played it mostly on my LG OLED tv then went on a trip It can be jarring if you are playing faster games like that or Hades or something That being said most of the time Im on an RPG or something while on the go The slower panel doesnt really impact me that much The color and resolution bump are much nicer than people are giving Nintendo credit for,,0.0,1ll4eiv
