type,id,author,title,score,created_utc,url,num_comments,subreddit,body,parent_id,depth,post_id
post,1ll4eiv,a_Ninja_b0y,The Switch 2's super sluggish LCD screen is 10 times slower than a typical gaming monitor and 100 times slower than an OLED panel according to independent testing,7836,2025-06-26 16:20:34,https://www.reddit.com/r/gadgets/comments/1ll4eiv/the_switch_2s_super_sluggish_lcd_screen_is_10/,849.0,gadgets,,,,
comment,mzwvgy9,ednerjn,,1239,2025-06-26 16:56:22,,,,i found this article talking about the same thing and I liked the way they explained Our best guess is that Nintendo has not implemented overdrive to conserve power Overdrive applies a higher voltage to the LCD layer to force it to transition faster higher voltage equals higher power consumption Thats fine on a desktop monitor plugged into the wall but not fine on a handheld device with a tiny 193 Wh battery,,0.0,1ll4eiv
comment,mzynurw,Daigonik,,589,2025-06-26 22:08:43,,,,The Switch 2 is already super power constrained as it is I understand why they made that decision if thats the case they likely thought not many of their consumers would notice or care I would love it if they enabled the option for those who wanna trade a bit of battery life for more motion clarity if possible I dont know how these things work,mzwvgy9,1.0,1ll4eiv
comment,mzysmj3,GUMBYtheOG,,177,2025-06-26 22:34:55,,,,Im a 34 yo gaming nerd and usually get ever console on release I avoided switch 2 1 because not many adult friendly exclusives when I got switch 1 and 2 they usually port down the road I doubt most kids will care about screen load times If youre that technical about screen shit you likely would not be using a switch very much unless youre into Nintendo style games not knocking if u are,mzynurw,2.0,1ll4eiv
comment,mzz3s9b,24bitNoColor,,116,2025-06-26 23:37:13,,,,I doubt most kids will care about screen load times If youre that technical about screen shit you likely would not be using a switch very much unless youre into Nintendo style games not knocking if u are Back when I was a young kid the difference in smearing between the bad Game Boy screen and the for the time better Game Gear was already something understood let alone later on when the first LCD screens came known for that very problem They might not understand it but they will see especially in scrolling 2D titles the difference compared to ALL other screens they are used to,mzysmj3,3.0,1ll4eiv
comment,n022tgw,NuclearLunchDectcted,,57,2025-06-27 12:57:02,,,,Counterpoint I had both and my dad refused to buy more batteries for the Game Gear after a certain point It would eat up 6 or 8 I forget AA batteries in something like 5 hours I had the car adapter and the wall adapter but portable was in massive quotes when it required hundreds of dollars in batteries My Game Boy originalnoncolor would last weeks on a set of AAs,mzz3s9b,4.0,1ll4eiv
comment,n02vbrb,tha_dank,,27,2025-06-27 15:22:18,,,,Dude game gear had to be like 25 of battery sales in those few years it was poppin It got to a point where mine just wouldnt buy me batteries for it and I was either playing with it plugged in with our super funny 4 prong charging cable or nothing at all How the fuck will I direct the lemmings off the cliff if I got no batteries Thats the point of that game right,n022tgw,5.0,1ll4eiv
comment,n05ahib,3dforlife,,2,2025-06-27 22:31:51,,,,I had the Game Gear too and it needed 6 batteries Needless to say I used it with batteries exactly one time and for the rest of its life it remained plugged to the wall,n022tgw,5.0,1ll4eiv
comment,n07gx19,vewfndr,,1,2025-06-28 07:49:43,,,,I didnt know a single kid who wasnt attached to a wall to play their Game Gear,n022tgw,5.0,1ll4eiv
comment,n01d63n,diacewrb,,5,2025-06-27 09:49:56,,,,The game gear also had a colour screen that would have been the bigger difference between it and the gameboy Although it chewed up 6 AA batteries in less than 4 hours which wasnt ideal for a handheld vs the 10 to 12 hours on 4 AA batteries in the gameboy,mzz3s9b,4.0,1ll4eiv
comment,n05nmqf,Cerebral_Balzy,,3,2025-06-27 23:47:22,,,,Yeah they did I went and got the rechargeable chonk packs that replaced the rear battery cage Worth it 100,n01d63n,5.0,1ll4eiv
comment,mzz4ns0,GUMBYtheOG,,23,2025-06-26 23:42:16,,,,True but also as a kid not like I had a choice Either that or nothing Especially now since literally there is no alternative if u want to play a switch 2 game Can cry all u want either play it or dont are parentskids going to complain their 5 yos switch loads to slow for their liking,mzz3s9b,4.0,1ll4eiv
comment,n0225lb,Trick2056,,1,2025-06-27 12:53:10,,,,same heck I was happy that I could play on a gameboy even with only 3 games,mzz4ns0,5.0,1ll4eiv
comment,n02334b,NuclearLunchDectcted,,0,2025-06-27 12:58:37,,,,There will be an emulator soon enough There is always a choice Even if Nintendo doesnt want to get paid for it,mzz4ns0,5.0,1ll4eiv
comment,n0058zz,FlyingBishop,,13,2025-06-27 03:25:58,,,,The thing is that Nintendo is all about the firstparty titles where they do the art with the hardware in mind A lot of game design firms just chase raw poly count and raw refresh rate which has some value but Nintendo isnt going for photorealism And photorealism has stopped being that good a target to shoot for anyway,mzz3s9b,4.0,1ll4eiv
comment,n0206ws,SirBogart,,3,2025-06-27 12:41:35,,,,Jesus you guys are insufferable Bragging about nitpicking screen quality of a gaming console as a child Youre so cool bro tell me more about that,mzz3s9b,4.0,1ll4eiv
comment,mzzmxna,-neti-neti-,,2,2025-06-27 01:30:52,,,,Your comparison isnt really fair though tbh,mzz3s9b,4.0,1ll4eiv
comment,n020bmq,MrChip53,,1,2025-06-27 12:42:23,,,,Also kids arent buying the switch 2 Parents are And Im passing because the screen is shit,mzz3s9b,4.0,1ll4eiv
comment,n03lxii,GrimSlayer,,1,2025-06-27 17:26:56,,,,Maybe but as a 35 year old I didnt notice any issues personally when playing through and beating New Super Mario Bros U Deluxe all the way through on my switch primarily in handheld mode Just started the Luigi U DLC and same thing Obviously the screen issues are there on paper but if I hadnt seen these article Id be none the wiser,mzz3s9b,4.0,1ll4eiv
comment,n00oi71,celebrar,,1,2025-06-27 05:54:46,,,,Yeah and Gameboy still sold tons more though,mzz3s9b,4.0,1ll4eiv
comment,n0169cy,BoxOfDemons,,0,2025-06-27 08:43:15,,,,Well considering the Game Gear was about 70 more expensive thats not very surprising Its the same reason the ps3 got its ass handed to it by the 360 especially near launch despite the fact that it had free online play,n00oi71,5.0,1ll4eiv
comment,n018xh1,celebrar,,2,2025-06-27 09:09:19,,,,Yes so most kids didnt care about the screen quality as much as other factor eg price I mean not kids obv they werent making the purchase decisions but you get my point,n0169cy,6.0,1ll4eiv
comment,n026acj,walrusdoom,,1,2025-06-27 13:16:48,,,,I never wanted a Game Boy because of the weird screen lag,mzz3s9b,4.0,1ll4eiv
comment,n00el3q,Azuretruth,,0,2025-06-27 04:33:54,,,,And that is why the Game Gear was dominant in the handheld space and the Gameboy was relegated to the annals of history,mzz3s9b,4.0,1ll4eiv
comment,n01z9km,LoudAndCuddly,,0,2025-06-27 12:35:55,,,,You cant be serious Youre missing s,n00el3q,5.0,1ll4eiv
comment,n024cis,Azuretruth,,2,2025-06-27 13:05:53,,,,To be honest I figured the statement was ridiculous enough to speak for itself,n01z9km,6.0,1ll4eiv
comment,n010vcd,clearlynotmee,,4,2025-06-27 07:49:45,,,,Screen load times lol Screens are not loading,mzysmj3,3.0,1ll4eiv
comment,n01grpd,nomjs,,1,2025-06-27 10:22:08,,,,Loading fresh vegetables Amiright,n010vcd,4.0,1ll4eiv
comment,n02b1lt,officer897177,,1,2025-06-27 13:42:41,,,,I got the OLED a couple years ago and paying another 400 plus accessories for a screen downgrade and barely noticeable performance bump just isnt doing it for me,mzysmj3,3.0,1ll4eiv
comment,n038sqc,AgentCarbine,,1,2025-06-27 16:25:25,,,,Same age range as you It has been known for years in the gaming world at least I thought it was that you never get consoles at launch Always have problems flaws you name it I always wait 12 years so not only is it a flawless console after all the defects have been sorted out but also cheaper and a larger selection of games,mzysmj3,3.0,1ll4eiv
comment,n08y7rg,msondo,,1,2025-06-28 14:44:03,,,,What exactly is an adult friendly game I am an adult probably older than you my first console was the 2600 and unless its specifically a game made for young children I find myself able to play just about anything and find most of Nintendos first party games fun and challenging I tend to have all of the consoles including a gaming PC and dont really distinguish between games as being adult friendly though some are definitely not child friendly,mzysmj3,3.0,1ll4eiv
comment,n0ci96p,akamu24,,1,2025-06-29 02:51:55,,,,Whats an adult friendly exclusive Guns and blood,mzysmj3,3.0,1ll4eiv
comment,n00kpux,PeanutButterChicken,,2,2025-06-27 05:22:40,,,,What is adult friendly Im older than you I cant enjoy Mario Kart Donkey Kong or Cyberpunk So weird Gatekeeping is such a fucking weird hobby,mzysmj3,3.0,1ll4eiv
comment,n01h019,nomjs,,2,2025-06-27 10:24:09,,,,Getting so worked about a strangers comment is also a weird hobby,n00kpux,4.0,1ll4eiv
comment,n0093g4,rudyattitudedee,,-1,2025-06-27 03:52:57,,,,Switch is cool for kids but as an adult I cant get over the crap graphics and poor game choices Its cool to play Skyrim on switch and I also have La noire but seriously the PSP 20 years ago performed just as well as the switch,mzysmj3,3.0,1ll4eiv
comment,n01govk,Eruannster,,-1,2025-06-27 10:21:27,,,,This is kind of a weird take Just because they have a pretty young audience its okay to skimp on quality Its one thing to overlook if the devices you sell are pretty cheap but the Switch 2 is still a pretty expensive device People give Nintendo way too much leeway to do a halfassed job because they make games they like and they have good memories of playing MarioZeldaMetroid growing up If Sony or Microsoft had made similar oversights that Nintendo are making right now with a Playstation or Xbox device they would have been dragged through the mud and made a laughing stock by the entire internet,mzysmj3,3.0,1ll4eiv
comment,mzyvvyk,XInsomniacX06,,-6,2025-06-26 22:53:10,,,,If anyone is that concerned then plug it into a TV or your monitor,mzysmj3,3.0,1ll4eiv
comment,mzyw4yr,Mr_Ectomy,,6,2025-06-26 22:54:31,,,,Because theyre so convenient to carry around,mzyvvyk,4.0,1ll4eiv
comment,n00n6jf,Naud1993,,17,2025-06-27 05:43:20,,,,Even then this screen is one of the slowest LCD screens of the last 20 years No overdrive is needed to make it easily 45 times faster Just buy a different screen,mzynurw,2.0,1ll4eiv
comment,n02fakl,vgamedude,,7,2025-06-27 14:04:35,,,,This People are missing the forest through the trees Even without overdrive this is literally beyond abysmal,n00n6jf,3.0,1ll4eiv
comment,n0coly2,0neHumanPeolple,,1,2025-06-29 03:37:50,,,,They will just wonder why theyre getting more migraines,mzynurw,2.0,1ll4eiv
comment,mzz3egq,24bitNoColor,,1,2025-06-26 23:35:01,,,,The Switch 2 is already super power constrained as it is I understand why they made that decision if thats the case they likely thought not many of their consumers would notice or care How do you agree with the decision when you dont even know how much per not running overdrive is costing Because driving the LCD panel isnt that big of a power cost to begin with the back panel brightness is,mzynurw,2.0,1ll4eiv
comment,n04iqp4,SmoogzZ,,1,2025-06-27 20:05:30,,,,Nah stop with the cope Theres 0 0 reason in 2025 they cant produce a handheld with semi up to date hardware Its genuinely noticeable how constrained everything is that Nintendo does Start being honest with how nintendo stacks up with the industry standard,mzynurw,2.0,1ll4eiv
comment,n04p6n2,Daigonik,,1,2025-06-27 20:37:53,,,,There is nothing in the handheld that isnt up to industry standards but the screen and even then it has good specs except for the response times If it had better specs than it has it would one over 500 dollars you think people would be willing to pay that,n04iqp4,3.0,1ll4eiv
comment,mzz34ae,24bitNoColor,,85,2025-06-26 23:33:25,,,,Our best guess is that Nintendo has not implemented overdrive to conserve power Overdrive applies a higher voltage to the LCD layer to force it to transition faster higher voltage equals higher power consumption Thats fine on a desktop monitor plugged into the wall but not fine on a handheld device with a tiny 193 Wh battery I would call that explanation accurate but the conclusion that this is a good thing nonsense Better LCD Smartphones before they switched to OLED didnt even have that much of a late 90s era amount of blur nor are other LCD handhelds close to this bad If you cant even show a 60hz signal wo tons of smearing let alone the 120hz you advertise than you are saving at the wrong end,mzwvgy9,1.0,1ll4eiv
comment,n00nnw2,Naud1993,,25,2025-06-27 05:47:28,,,,Nobody will ever see a finished frame to unless they are standing still By the time the next frame is loaded at 60 fps the current frame is only half done with updating pixels At 120 fps its only a quarter done Screens should always be fast enough to change all the pixels by at least the end of the frame Not literally multiple frames later,mzz34ae,2.0,1ll4eiv
comment,n016tf7,KMFN,,26,2025-06-27 08:48:44,,,,This is an excellent point as well that I think most people dont appreciate The response time itself is a problem but the most important is really refresh compliance which i believe techspotHUB calls it The ability of the screen to even refresh within the given 8ms which is required if you even want to call it 120hz I guess its no different than them advertising HDR in spite of the fact that there is no local dimming to speak off and a lack of any meaningful brightness as well And their testing show very unremarkable contrast unsurprisingly Its just back to back false marketing They took a shitty at that 60hz display and turned it into a 120HDR one for marketing purposes,n00nnw2,3.0,1ll4eiv
comment,n019706,Naud1993,,1,2025-06-27 09:11:54,,,,Doee it even have 10001 contrast Manufacturers love to use that number even if the contrast is lower just liks how they use 1 ms response time regardless of the actual response time Although its not like 10001 contrast is that rare or good to begin with My monitor has only a 4001 contrast ratio when it was tested Absolutely horrible I cant watch a dark scene without constantly noticing it,n016tf7,4.0,1ll4eiv
comment,n01aiib,KMFN,,4,2025-06-27 09:24:45,,,,It just about clears 10001 in testing Has no local dimming ofc and 430 nits peak brightness 2 window In other words no theres not a single specification here that would warrant HDR marketing,n019706,5.0,1ll4eiv
comment,n03214l,Lyreganem,,2,2025-06-27 15:53:38,,,,They made sure it does 98 P3 colour And thats basically the ONLY spec that complies with the HDR requirements It fails on EVERY other level,n01aiib,6.0,1ll4eiv
comment,mzzgahl,seaQueue,,8,2025-06-27 00:51:25,,,,Theyre constrained in a couple of ways Both handheld power budget and display cost are at play here I can totally understand why they made this choice even if I dont like the result At a guess it probably would have cost them significantly more money for a power efficient fast display in their bespoke size than what they went with That or they couldnt find anyone to make a bespoke part with better specs in the quantity they needed,mzz34ae,2.0,1ll4eiv
comment,n00weju,IchVerliereImmer,,20,2025-06-27 07:06:29,,,,Its Nintendo every Display manufacturer knows they can and will sell millions of devices And that argument also seems weird considering OLED Screens like one the switch 1 pull more power than VA IPS TN Id guess the thought was This costs 2 usd per unit more lets get the shit one and make even more money selling an oled Version later Nintendo already is the only company making profits selling their Hardware compared to PS and Xbox Imo theyre just greedy,mzzgahl,3.0,1ll4eiv
comment,n027v8w,MiaowaraShiro,,2,2025-06-27 13:25:30,,,,Why does every other handheld manufacturer not have to make this tradeoff though,mzzgahl,3.0,1ll4eiv
comment,n0124uh,favorite_time_of_day,,1,2025-06-27 08:02:07,,,,Have you used a Switch 2 The super sluggish LCD is news to me it looks gorgeous I remember actual super sluggish screens the original Gameboy was like that And we played it anyway The Switch 2 is nothing like that,mzz34ae,2.0,1ll4eiv
comment,n017czt,BoxOfDemons,,2,2025-06-27 08:54:02,,,,Its as slow as 33ms pixel response That means at 60fps by the time youre on the second frame the first frame isnt even halfway done being displayed Its convenient for you that it doesnt bother you but its very very noticeable for many people and not just something they are imagining,n0124uh,3.0,1ll4eiv
comment,n02ylpf,favorite_time_of_day,,1,2025-06-27 15:37:46,,,,The point is not whether it bothers me the point is whether this is another one of those Im an audiophile and my speakers are unacceptably plush Even if it doesnt bother me I should be able to at least detect it I started up Mario Kart to try and figure out what you could possibly be talking about and I realized that I have absolutely no way of telling the difference between this and the artificial motion blurring that every game does now as a special effect Certainly there is nothing there which seems at all off Mario Kart is fast enough with enough full screen movement that this should be a problem if it is indeed a problem at all Albeit Mario Kart is also a bright and colorful game and bright bright transitions are going to be faster than bright dark transitions The grey transitions that youre talking about in that artificial testing are a worst case scenario the actual transition time will be faster Maybe if they port Mad World to the Switch 2 then it could be an issue Perhaps But its going to take something like that a moody black and white game which also has a lot of action,n017czt,4.0,1ll4eiv
comment,n032peb,Lyreganem,,3,2025-06-27 15:56:45,,,,It primarily affects LATERAL movement Which isnt huge in Mario Kart But play any sidescroller or move the viewpoint quickly in a FPS TPS game and you would be blind not to notice it Heck just page through your installed games in the menu fast enough and it is BLINDINGLY obvious,n02ylpf,5.0,1ll4eiv
comment,n04ioix,BoxOfDemons,,2,2025-06-27 20:05:11,,,,Its odd that you cant detect it but count yourself lucky I havent even bought one yet because Im waiting for more exclusives My friend bought one on launch day and showed me He just handed me it on the main menu and said scroll the tiles and tell me what you notice and it was blindingly obvious to me He told me it was the first thing he noticed as well This was before there were YouTube videos and articles talking about it so I can assure you its something we could both immediately notice,n02ylpf,5.0,1ll4eiv
comment,n012rk1,Trzlog,,18,2025-06-27 08:08:21,,,,The article ends up being fair towards the Switch 2 display As someone who largely analyzes PC gaming monitors what do I think of the Switch 2s display overall Well its not the best display weve ever seen but we are talking about a handheld gaming device so comparisons to desktop monitors are only fair up to a certain point Compared to the original Switch 1 LCD the Switch 2 is generally an upgrade Its larger and higher resolution which makes it more enjoyable to use Its brighter and has a wider color gamut which gives it additional vibrance and it subjectively produces betterlooking images because of this It also has better reflection handling so while the contrast ratio isnt improved in actual usage conditions it has better apparent black depth And it supports more advanced technologies like variable refresh and a 120Hz refresh rate Honestly I think its weird to compare a screen like this to full PC monitors that are permanently plugged in with few power use limitations Reviews of other handheld devices show results that are far more comparable to the Switch 2s display Its clear the display is undervolted and has no overdrive to maintain halfway decent battery life and that it was necessary to maintain the overall display quality in the face of the Switch 2s much more powerful SoC and its comparatively small battery Like the S2 display is brighter has a higher resolution and its larger compared to the S1 LCD All of this has a big impact on battery life,mzwvgy9,1.0,1ll4eiv
comment,n02hm6f,PancAshAsh,,9,2025-06-27 14:16:14,,,,No no you misunderstand I am only here to be big mad at Nintendo,n012rk1,2.0,1ll4eiv
comment,n0pptci,Its_Broken,,3,2025-07-01 06:05:17,,,,like most of reddit you fit right in adding to this playing handheld on my bed or on the train i have literally never noticed the screen being slow and Ive played on 1ms 165hz displays for luke 3 years now the screen looks better handheld than the switch 1 did and most adults that care treat it more like a traditional console kept in the dock 247 anyways,n02hm6f,3.0,1ll4eiv
comment,n03adv2,ZappySnap,,2,2025-06-27 16:32:55,,,,How does a 120Hz display matter when the pixel response cant change that fast 31ms is roughly refreshing at 30Hz You need an 83ms response time to get clean 120Hz,n012rk1,2.0,1ll4eiv
comment,n03dkcn,Trzlog,,1,2025-06-27 16:47:55,,,,So youre just gonna ignore everything else Okay,n03adv2,3.0,1ll4eiv
comment,n019p32,gay_manta_ray,,0,2025-06-27 09:16:51,,,,absolutely none of that matters if motion looks like shit,n012rk1,2.0,1ll4eiv
comment,n01g503,Trzlog,,5,2025-06-27 10:16:37,,,,Whatever you say dude Youre clearly not interested in a nuanced discussion Dont let me get in the way of your mindless outrage,n019p32,3.0,1ll4eiv
comment,n008b0r,lawrence1024,,4,2025-06-27 03:47:21,,,,Does the switch 2 really only have 193 Wh Thats less than a lot of phones these days For comparisons sake a phone with that capacity would be advertised as about 5000 mAh Although its really silly to me that batteries are advertised in amp hours when a consumer might unknowingly be comparing devices with different battery voltages Not typically with phones but in general I mean,mzwvgy9,1.0,1ll4eiv
comment,n033m3b,whilst,,3,2025-06-27 16:00:59,,,,Which for anyone who doesnt know would mean a battery size of 185 Wh since lithium ion batteries have a nominal voltage of 37V 5Ah 37V 185Wh EDIT Sidenote theres an actual unit for energy and its bizarre to me we dont use it and keep trying to invent new ways to label batteries like mAh and Wh Why is it we dont measure battery size in Joules,n008b0r,2.0,1ll4eiv
comment,n037cn3,lawrence1024,,5,2025-06-27 16:18:35,,,,My problem with joules is that theyre a very small unit Its hard for me to quantify 1 joule but a watt hour makes sense intuitively,n033m3b,3.0,1ll4eiv
comment,n047xu6,whilst,,2,2025-06-27 19:11:18,,,,But it makes sense intuitively because of the two weve made Watts the one everyone knows about Which again of the two Watts is by far the less intuitive The idea that Watts are a rate is confusing every other rate we see frames per second miles per gallon has the word per in it and that explains to us what it is That watts is synonymous with joules per second is very nonobvious and walls energy use off from intuitive understanding And then saying watts is synonymous with watthours per hour is even more confusing Its a shame we dont trade in kilojoules and kilojoules per hour in common parlance That has a direct analogy to gallons of gas which were familiar with,n037cn3,4.0,1ll4eiv
comment,n04a3d4,lawrence1024,,3,2025-06-27 19:21:52,,,,I think that the only reason watts exists is because joules per second is kind of a mouthful I feel like if we had a different name for watthour that took away the hour it would be less confusing for people because they see the time unit and assume its a rate Eg power is measured watts and energy is measured in spouls super joules where 1 spoul 36 kilojoules 1 watthour Then wed measure large amounts of energy in kilospouls and megaspouls,n047xu6,5.0,1ll4eiv
comment,n04gf2q,whilst,,1,2025-06-27 19:53:45,,,,I think that the only reason watts exists is because joules per second is kind of a mouthful I mean no more so than miles per hour I think its handy to have a short form if its something you find yourself saying all day if youre a scientist or an engineer but for most people joules per hour is both easy enough and easy to understand Not to mention watthours is nearly as much of a mouthful as joules per hour while also not having nearly as clear of a meaning to the layperson I feel like if we had a different name for watthour that took away the hour it would be less confusing for people because they see the time unit and assume its a rate Im not suggesting that we rename watthours Im suggesting that we delete that unit fully from the public lexicon The resulting discussion of adding yet another new unit spouls goes even further away from my suggestion of just we already have a unit lets just use it as is,n04a3d4,6.0,1ll4eiv
comment,n04nwjh,lawrence1024,,2,2025-06-27 20:31:24,,,,I definitely see the merit to your point Keep in mind that since joules are so small people would likely need to say kilojoules per hour or megajoules per hour which makes it an even bigger mouthful Where Im from people often say clicks instead of kilometers per hour but I guess there isnt really a shorthand for miles per hour I feel like if the standard unit of energy had been a larger easier to understand amount like a calorie kilocalorie we might have ended up saying unit per hour just like we say liters per minute hour for the flow rate of liquids,n04gf2q,7.0,1ll4eiv
