type,id,author,title,score,created_utc,url,num_comments,subreddit,body,parent_id,depth,post_id
comment,mzwq93v,Hans_H0rst,,10,2025-06-26 16:31:32,,,,They reference monitors unboxed Who use in the first direct comparison ufo blur example an unreleased highend 4k gaming monitor and another 850 monitor for comparison Against a allin 450 console Its all technically correct but its a pretty dang stupid way to present the issue Theyre talking about monitor overdrive which results in lower durability a deadly issue for a device with 15 million units produced and state values from multiplayer refreshrate focussed TN panels with horrible viewing angles Its like complaining that a tractor isnt as fast as the old one Being fast is not its main job yall,,0.0,1ll4eiv
comment,mzwrwzk,Thorusss,,40,2025-06-26 16:39:30,,,,but they also compare it to the Switch 1 Which already had bad latency with 21ms but the Switch 2 is worse with 31ms But Nintendo advertises a 120Hz which requires switch time under 8ms The switch 2 with 31msliterally shows 4 Frames overlapping in this mode 4 Ghost images The 120Hz mode of the display is useless,mzwq93v,1.0,1ll4eiv
comment,mzwr71r,theAkke,,43,2025-06-26 16:36:03,,,,This screen is slower than og switch had years ago,mzwq93v,1.0,1ll4eiv
comment,mzyaino,shalol,,7,2025-06-26 21:00:14,,,,Monitor overdrive does not reduce durability Its a setting related to ghosting on how fast colors transition not a single setting on your monitor reduces or increases lifespan other than some pixel cleanup things on OLED panels youre just making shit up,mzwq93v,1.0,1ll4eiv
comment,n04h0ad,Hans_H0rst,,1,2025-06-27 19:56:43,,,,Its literally basic electronics knowledge Overdrive higher voltage more switching cycles faster arrival at the MTBF amongst other results Overdrive increases the voltage thats why its called overdrive which puts additional strain on your hardware which will basically always reduce the lifespan,mzyaino,2.0,1ll4eiv
comment,n059xow,shalol,,1,2025-06-27 22:28:41,,,,That extra voltage is not in design to reduce panel lifespan why would they even offer damaging your monitor and its warranty as an option in a the menu its not like overclocking a CPU in BIOS,n04h0ad,3.0,1ll4eiv
comment,n07xwdx,Hans_H0rst,,1,2025-06-28 10:36:10,,,,Because its a feature and a choice Selling longevity is hard selling raw performance is easy Your cpu also goes into turbe mode if you select game mode on certain devices and manufacturers Depending on the power targetstemp targets it uses higherlower clocks and voltages Its actually quite a good comparison thanks for bringing it up,n059xow,4.0,1ll4eiv
comment,mzws6ny,brondonschwab,,19,2025-06-26 16:40:47,,,,Its literally slower than the original Switch display yall,mzwq93v,1.0,1ll4eiv
comment,mzwsrro,Sevinki,,4,2025-06-26 16:43:35,,,,Compare it to a 400 phone then or the steam deck or literally anything There is no excuse for shipping ANY device that costs more than 100 with such a screen in 2025 EDIT Looks like the original steam deck with original firmware was similarly slow Still that device is a few years old at this point,mzwq93v,1.0,1ll4eiv
comment,mzzdc2c,Resh_IX,,3,2025-06-27 00:33:42,,,,Wow Steam Deck releases a shitty screen and then rereleases with a better one to get people to double dip Sounds like a shitty company,mzwsrro,2.0,1ll4eiv
comment,mzwvxu4,Old-Rhubarb-97,,5,2025-06-26 16:58:32,,,,You mean like the ipad mini,mzwsrro,2.0,1ll4eiv
comment,mzwzg0b,Sevinki,,2,2025-06-26 17:14:32,,,,Well the iPads at least have some decent color volume and accuracy and are not primarily gaming devices but yes the LCD based iPads including the Pros have terrible response time as well,mzwvxu4,3.0,1ll4eiv
comment,mzxu8qa,AreYouOKAni,,1,2025-06-26 19:39:01,,,,I mean yeah MacBooks and iPads have terrible response rates too and it has been talked about for years,mzwvxu4,3.0,1ll4eiv
comment,mzyg7e8,Old-Rhubarb-97,,3,2025-06-26 21:28:51,,,,I brought up the mini because it is in roughly the same price range and has a bad screen Peoples expectations for a device at that price are way off,mzxu8qa,4.0,1ll4eiv
comment,mzyi9bs,whatnowwproductions,,2,2025-06-26 21:39:27,,,,It was not similarly slow It was bad but not to this level,mzwsrro,2.0,1ll4eiv
comment,mzwwdap,ZarafFaraz,,-5,2025-06-26 17:00:29,,,,Yeah its like comparing the 0 to 60 between a Lambo and a Corolla,mzwq93v,1.0,1ll4eiv
comment,mzwuzuj,blazingquackattack,,9,2025-06-26 16:54:10,,,,How long is this Switch 2 screen outrage cycle going to last Nobody that actually uses it cares,,0.0,1ll4eiv
comment,n04ockv,Realistic_Condition7,,1,2025-06-27 20:33:40,,,,Reddit really likes to squeeze people into one of two boxes when it comes to Nintendoeither you hate it and call for a boycott or you blindly love it and dont care about its specs Some of us can be more in the middle ya know I like my Switch 2 so far but the LCD screen is definitely a bit underwhelming Not unplayable but its one of the less impressive LCD screens on the market and its selling points are not very legit Its nowhere near being HDR capable and has pretty cool color temperatures even for an LCD on top of almost perplexingly slow levels of response time that are instantly noticeable to anyone who is a videophile So yes there can be nuance,mzwuzuj,1.0,1ll4eiv
comment,mzy8b5c,Particular-Diet-5147,,7,2025-06-26 20:49:25,,,,Huh I have 60 hours on my switch 2 and I havent noticed or realized anything that makes it look slow Whatever Doesnt make a difference to me,,0.0,1ll4eiv
comment,n01fac7,DenormalHuman,,2,2025-06-27 10:09:03,,,,try this move around in a game and look at the details on anything as the screen moves about Youll see the details turning to mush and ghostingsmearing trails left behind anything moving quickly,mzy8b5c,1.0,1ll4eiv
comment,mzyl72f,Stef904,,4,2025-06-26 21:54:35,,,,So they upgraded the Switch 1 to OLED and saw a MASSIVE improvement and then thought Switch 2 back to LCD,,0.0,1ll4eiv
comment,mzyref8,diagonali,,4,2025-06-26 22:28:07,,,,Oled burns in Still In 2025,mzyl72f,1.0,1ll4eiv
comment,n01jmkv,Tobi97l,,3,2025-06-27 10:46:18,,,,Do you know someone who suffers from burn in on their switch 1,mzyref8,2.0,1ll4eiv
comment,n01x98g,Stef904,,1,2025-06-27 12:23:18,,,,Its never happened to me but then again I play multiple games I dont just burn in the Fortnite HUD into my devices,n01jmkv,3.0,1ll4eiv
comment,n05b5m9,diagonali,,1,2025-06-27 22:35:44,,,,Not a single person Oled burns in though its inherent in the panel tech Significant issue with oled monitors,n01jmkv,3.0,1ll4eiv
comment,mzyxt3p,Kalpy97,,2,2025-06-26 23:03:49,,,,The lcd is still 120hz VRR and has gsync so in some respects its better than the oled,mzyl72f,1.0,1ll4eiv
comment,mzzepgj,BrendonBootyUrie,,1,2025-06-27 00:41:58,,,,People complained about the switch 2 launch price already If it was OLED screen itd be another 50 and lots of people would just not bother Ive got the switch 2 and the handheld performance wasnt a factor at all,mzyl72f,1.0,1ll4eiv
comment,mzwy9l7,cmasontaylor,,5,2025-06-26 17:09:13,,,,I havent read anything by PC Gamer before but man this is not an article This is a blog post and not even one that does any actual reporting They didnt even reach out to Nintendo for information or comment Its an opinion piece full of unevidenced speculation that reads like marketing for gaming displays The headline is so opinionated I was shocked when I realized OP wasnt paraphrasing or editorializing their own All that being said if the conjecture about undervolting is true Im glad this is the default but I agree that an option would be nice The people I know who play portably with the Switch regularly care far more about battery life and wouldnt even notice things like judder unless they were pointed out to them by a videophile nerd like me I almost never play portably but I wouldnt mind being able to take mine on a trip plug into power or a power bank and be able to overvolt for better input latency just in case,,0.0,1ll4eiv
comment,mzwzsy7,gbroon,,4,2025-06-26 17:16:09,,,,PC gamer used to be decent years ago but its been shite for a while now,mzwy9l7,1.0,1ll4eiv
comment,mzws5if,Glimmhilde,,3,2025-06-26 16:40:38,,,,idgaf genuinely,,0.0,1ll4eiv
comment,mzzpzra,nico_el_chico,,2,2025-06-27 01:49:17,,,,This might be a dumb question but doesnt this negate the point of a 120hz screen If theyre trying to save power why not just use a 60hz screen,,0.0,1ll4eiv
comment,n01dgrt,john_2099,,3,2025-06-27 09:52:40,,,,Eh havent noticed,,0.0,1ll4eiv
comment,mzwruvg,TheSlightDiscomfort,,3,2025-06-26 16:39:13,,,,Looks great to me,,0.0,1ll4eiv
comment,mzwtl2m,MidnightWorried6992,,3,2025-06-26 16:47:30,,,,Been playing since launch day Looks beautiful to me and Im having a blast with cyberpunk and Mario kart,,0.0,1ll4eiv
comment,mzwrr4k,DrBhu,,2,2025-06-26 16:38:44,,,,Nintendo never really cared about good displays,,0.0,1ll4eiv
comment,mzy7ec1,Who_am_ey3,,2,2025-06-26 20:44:58,,,,who are these articles for,,0.0,1ll4eiv
comment,mzyf3dx,Campsters2803,,4,2025-06-26 21:23:12,,,,People who play video games who else,mzy7ec1,1.0,1ll4eiv
comment,mzyj4xq,Who_am_ey3,,1,2025-06-26 21:43:59,,,,no theyre articles for people who want to shit on the Switch 2,mzyf3dx,2.0,1ll4eiv
comment,mzyjnr0,Campsters2803,,-2,2025-06-26 21:46:41,,,,Shoulda made a better handheld,mzyj4xq,3.0,1ll4eiv
comment,mzz87bb,Who_am_ey3,,5,2025-06-27 00:02:44,,,,there isnt a single system that doesnt have flaws my point is that the Switch 2 is a decent system with some expected flaws that sites like PCgamer then hyperfocus on because shitting on Nintendo is the current thing to do any other system and they wouldve let it slide but because its the Switch 2 they really hammer in on every little thing thats wrong with it,mzyjnr0,4.0,1ll4eiv
comment,n01fy1d,ElDoRado1239,,1,2025-06-27 10:14:54,,,,Palworld fans will have a blast with this article,mzz87bb,5.0,1ll4eiv
comment,n01b4sy,gay_manta_ray,,0,2025-06-27 09:30:43,,,,lol the shitty display is a dealbreaker for me you cant buy a brand new monitor at any price that is worse than the display on the switch 2,mzyj4xq,3.0,1ll4eiv
comment,n001ago,bassnasher,,1,2025-06-27 02:59:19,,,,Redditors whose favorite activity is to act superior to others because they bought different hardware,mzy7ec1,1.0,1ll4eiv
comment,n01fuwx,ElDoRado1239,,1,2025-06-27 10:14:07,,,,Technically Redditors who bought the same hardware and secretly love it can still participate Also Redditors who dream of buying the same hardware or any hardware beyond their lastresort Reddit terminal,n001ago,2.0,1ll4eiv
comment,mzy8ioz,SidOfBee,,2,2025-06-26 20:50:27,,,,People expect a 1000 handheld for 450,,0.0,1ll4eiv
comment,n02jnvk,TwanToni,,1,2025-06-27 14:26:10,,,,Steam did it on a better screen and better tsmc 76nm node,mzy8ioz,1.0,1ll4eiv
comment,mzwy56l,puglife82,,3,2025-06-26 17:08:40,,,,Ok,,0.0,1ll4eiv
comment,mzwyt94,Shattia,,2,2025-06-26 17:11:42,,,,Tbh I dont see any issue with the switch 2 screen aside from not having the same contrast or HDR capabilities of an OLED screen,,0.0,1ll4eiv
comment,mzwyy0n,obvious-but-profound,,2,2025-06-26 17:12:18,,,,Switch 2 OLED Edition coming soon gifgiphy44b1ABtsG7VTy,,0.0,1ll4eiv
comment,n00g8d2,XuX24,,2,2025-06-27 04:46:39,,,,To be honest not having oled in 2025 is just dumb,,0.0,1ll4eiv
comment,n00mtsp,Barzobius,,2,2025-06-27 05:40:18,,,,They have to release the cheapest components first so the next time they release The great Switch 2 OLED a great improvement over the first one so you have people upgrading to a slightly better cheap ass version Scumbag Nintendo doing scammy business,n00g8d2,1.0,1ll4eiv
comment,n00qf5d,XuX24,,2,2025-06-27 06:11:43,,,,And people will celebrate it,n00mtsp,2.0,1ll4eiv
comment,mzyqhiv,Jesta23,,3,2025-06-26 22:23:04,,,,Steve give you 10 of rope While Joe gives you 1000 of rope You can only use it to climb this specific wall You need 8 of rope to climb this wall The headline Steve is ripping you off He gives you 100 times less rope than Joe,,0.0,1ll4eiv
comment,n01gl2n,Tobi97l,,2,2025-06-27 10:20:34,,,,You have no idea what you are talking about The Switch 2 is advertised with a 120hz screen For an image refresh at 120hz to look proper it needs to have a maximum pixel response time of 833ms Anything higher will produce ghosting 60hz would need a maximum of 1666ms Lower is always better Bad monitors 10 years ago had a pixel response time of 510ms Good ones were between 15ms One really has to wonder in which dumpster nintendo found the screens for the Switch 2,mzyqhiv,1.0,1ll4eiv
comment,n045vbz,Jesta23,,1,2025-06-27 19:01:09,,,,The dumpster that has screens that look perfectly fine to 9999 of people Its funny that during the initial play testing by all the reviewers it came back extremely positive It wasnt until they got back with ultra slow motion cameras did they start to say something was wrong,n01gl2n,2.0,1ll4eiv
comment,mzwvl77,Stryker218,,1,2025-06-26 16:56:55,,,,Havent noticed anything bad about the screenusing it myself,,0.0,1ll4eiv
comment,mzwoxlv,rustyphish,,-9,2025-06-26 16:25:16,,,,And yet it looks great for a handheld console,,0.0,1ll4eiv
comment,mzwrfyh,brondonschwab,,5,2025-06-26 16:37:15,,,,Define great Steam Deck OLED exists and theres hundreds of android gaming handhelds with OLED displays Hell even the ROG ALLYs LCD is better,mzwoxlv,1.0,1ll4eiv
comment,mzwrqg7,rustyphish,,0,2025-06-26 16:38:39,,,,Theres also hundreds that are worse some that I very much enjoy using as well I think people are just fully corksniffers about a lot of these things If they didnt have these numbers in front of them the subtleties would be nearly impossible to tell in practice,mzwrfyh,2.0,1ll4eiv
comment,mzwsv2k,brondonschwab,,0,2025-06-26 16:44:01,,,,Its just one of many issues with the cheap display theyve put on this 400 handheld Fake HDR poor contrast and now this,mzwrqg7,3.0,1ll4eiv
comment,mzwwfui,contingencysloth,,-1,2025-06-26 17:00:49,,,,Its just a bad product Imagine Nintendo saying Its not the worst Sure any handheld made over 150 will undoubtedly have a better display but we guarantee there are worse displays found on sub 150 cheap emulation station handhelds,mzwrqg7,3.0,1ll4eiv
comment,mzwxlhm,rustyphish,,5,2025-06-26 17:06:09,,,,Thats your opinion Ive been loving it People have different perspectives,mzwwfui,4.0,1ll4eiv
comment,mzwrxqi,Recluse1729,,-1,2025-06-26 16:39:36,,,,Yes as long as you only look at individual frames Im sure youll find someone who will agree with you,mzwoxlv,1.0,1ll4eiv
comment,mzya449,No-Summer-9591,,1,2025-06-26 20:58:14,,,,Something cheaper than the actual thing isnt better Wow what a breakthrough,,0.0,1ll4eiv
comment,mzyhabq,None,,1,2025-06-26 21:34:25,,,,But the stock keeps going up,,0.0,1ll4eiv
comment,mzyhx9o,ComputerSong,,1,2025-06-26 21:37:42,,,,So hook it up to a gaming monitor then,,0.0,1ll4eiv
comment,mzz0ty9,wingspantt,,1,2025-06-26 23:20:29,,,,Is this bad in Street Fighter Since its very frame sensitive,,0.0,1ll4eiv
comment,mzz2377,SuicidalChair,,-4,2025-06-26 23:27:32,,,,If you are a competitive street fighter player why would you be on Nintendo,mzz0ty9,1.0,1ll4eiv
comment,mzz2up0,wingspantt,,2,2025-06-26 23:31:51,,,,I mean if you already own one it feels no brainer to consider buying SF6 for it if the port is good,mzz2377,2.0,1ll4eiv
comment,mzzke3c,nifterific,,2,2025-06-27 01:15:38,,,,If its not a competitive platform why did capcom announce the Switch 2 version as tournament legal,mzz2377,2.0,1ll4eiv
comment,mzzmo73,SuicidalChair,,-1,2025-06-27 01:29:17,,,,So people would buy it Its still obviously inferior hardware compared to the other platforms though so being shocked its not as good seems pretty funny,mzzke3c,3.0,1ll4eiv
comment,mzzmsw4,nifterific,,1,2025-06-27 01:30:04,,,,It performs better than the Series S version but okay dude,mzzmo73,4.0,1ll4eiv
comment,mzzolwb,SuicidalChair,,1,2025-06-27 01:41:02,,,,Do they host tournaments on series s,mzzmsw4,5.0,1ll4eiv
comment,mzzprp1,nifterific,,1,2025-06-27 01:47:57,,,,I couldnt tell you its not a game I closely follow The Series S is tournament legal though If I had to make an educated guess I would assume most are in PS5 just as a matter of console sales statistics That doesnt mean there are never any on Xbox I just dont know for sure I couldnt even tell you if they run them on Series X or PC,mzzolwb,6.0,1ll4eiv
comment,n0087vt,Extra_Lab_2150,,1,2025-06-27 03:46:43,,,,Well Thats what you get forchecks price450 Wtf,,0.0,1ll4eiv
comment,n00ewak,Joe60420,,1,2025-06-27 04:36:19,,,,should compare it to other handhelds and see,,0.0,1ll4eiv
comment,n00oeev,DeepInTheSheep,,1,2025-06-27 05:53:51,,,,Cool,,0.0,1ll4eiv
comment,n0167a4,prettybluefoxes,,1,2025-06-27 08:42:40,,,,How has a pcgamer link become news Ffs,,0.0,1ll4eiv
comment,n01ol87,Werewolf_Capable,,1,2025-06-27 11:24:27,,,,Well you need a definitive reason to put the next 600 for an upgrade up Nintendos ass Boo me all you want we all know its true,,0.0,1ll4eiv
comment,n01v4p4,None,,1,2025-06-27 12:09:44,,,,OMG FINE Ill throw my switch 2 away,,0.0,1ll4eiv
comment,n01yyqu,Kuli24,,1,2025-06-27 12:34:03,,,,Well now the wait until the OLED one Thats unfortunate,,0.0,1ll4eiv
comment,n02fpno,Firestorm8908,,1,2025-06-27 14:06:45,,,,Love my switch 2 Havent noticed anything Its a great device,,0.0,1ll4eiv
comment,n02gbtc,tswaves,,1,2025-06-27 14:09:50,,,,I doubt this is true Nintendo haters are so obvious now I get you dont like Nintendo but just no,,0.0,1ll4eiv
comment,n03r5fm,SirCanealot,,1,2025-06-27 17:50:56,,,,Unfortunately it is true Lots of people have compared the motion handling to psp 1000 Its still usable just it should have been a bit better but its Nintendo What you gonna do,n02gbtc,1.0,1ll4eiv
comment,n02pbf5,epidemica,,1,2025-06-27 14:53:41,,,,Nintendo sales of copium are sky rocketing Its okay to be critical of Nintendo especially when the hardware is an objective downgrade in performance over the last generation and includes a price increase,,0.0,1ll4eiv
comment,n02rgev,Usual_Store_3365,,1,2025-06-27 15:03:54,,,,No games,,0.0,1ll4eiv
comment,n02s9af,Chickenbrik,,1,2025-06-27 15:07:44,,,,Nobody noticed or commented about the screen until this article Show me three people on here who commented on it and how much problems it was caused them and Ill eat my words,,0.0,1ll4eiv
comment,n03qvs0,SirCanealot,,1,2025-06-27 17:49:42,,,,Why Certain people are sensitive to motion issues and especially if its a solvable issue overdrive and you have a platform of course you are going to speak out about it No I didnt know it was 40ms when I got it but I still knew the motion was bad,n02s9af,1.0,1ll4eiv
comment,n02slo4,That1RebelGuy,,1,2025-06-27 15:09:19,,,,Thats what happens when you get overly excited and expect it to be loads better than the OG gifgiphy3oEjHAUOqG3lSS0f1C,,0.0,1ll4eiv
comment,n02smvi,Its_Syxx,,1,2025-06-27 15:09:29,,,,Im an frames snob and I dont notice anything This is being blown out of proportion Also its very similar to Steam decks numbers,,0.0,1ll4eiv
comment,n02u891,GameDragon,,1,2025-06-27 15:17:05,,,,This is so strange to me because the screen was praised quite well before prior to these findings despite not being an OLED Ive almost never heard anyone complain about the screen And yet after these articles and DF video suddenly people are saying its the worst screen ever Ive been playing on this thing for weeks and I have not noticed any ghosting at all I would say my eyes are quite susceptible to ghosting as well,,0.0,1ll4eiv
comment,n03qgfp,SirCanealot,,1,2025-06-27 17:47:44,,,,Thats because not everyone can see motion issues and other than that the screen is pretty good Nobody is saying its the worst screen ever it has like one serious issue and a few minor issues It should be better but its Nintendo What you gonna do lol,n02u891,1.0,1ll4eiv
comment,n037pzb,neronga,,1,2025-06-27 16:20:19,,,,I used it in handheld mode for the first time yesterday and honestly didnt notice much latency and on a twitchy game too Still not great news ima keep mine docked the rest of its life prolly,,0.0,1ll4eiv
comment,n038t67,letschat66,,1,2025-06-27 16:25:28,,,,Okay but its not meant to be the same speed as a gaming monitor so Im not getting their point,,0.0,1ll4eiv
comment,n03gdyt,superdudeman64,,1,2025-06-27 17:01:09,,,,I dont understand the comparison to something ment to to plugged in and stationary How does the screen compare to other handhelds,,0.0,1ll4eiv
comment,n03q4no,SirCanealot,,1,2025-06-27 17:46:15,,,,No other handheld since the PSP 1000 had a screen with a 40ms pixel response The panel technology is basically the same,n03gdyt,1.0,1ll4eiv
comment,n03i4oc,cultistkiller98,,1,2025-06-27 17:09:19,,,,Is this an issue I dont notice any input delay issues on my switch oled How does it compare,,0.0,1ll4eiv
comment,n03px4k,SirCanealot,,2,2025-06-27 17:45:18,,,,Its not input lag its pixel response So the pixels from the last 23 frames stay in the screen and slowly fade out looks like ghosting or smearing If you cant see it good for you lol dont try and see the issue Its not worth it Just pretend it doesnt exist,n03i4oc,1.0,1ll4eiv
comment,n03taa0,cultistkiller98,,1,2025-06-27 18:00:48,,,,Ohhhh I know what yall mean now Yea I guess I have seen that for a couple switch games I dont think I have,n03px4k,2.0,1ll4eiv
comment,n03wwsu,SirCanealot,,1,2025-06-27 18:17:58,,,,You havent Good Dont worry about it as it just puts you down an annoying and painful path of seeking motion clarity lol D,n03taa0,3.0,1ll4eiv
comment,n03rz5b,fwoompf,,1,2025-06-27 17:54:44,,,,Looks fine to me op,,0.0,1ll4eiv
comment,n053nui,Moominsean,,1,2025-06-27 21:53:42,,,,Super sluggish invisible to the human eye,,0.0,1ll4eiv
comment,n05e6hh,Endreeemtsu,,1,2025-06-27 22:53:09,,,,But they Nintendo fans told me it was basically a steam deck I feel betrayed and heart broken,,0.0,1ll4eiv
comment,n05l98r,ThatsSomeBullshirt,,1,2025-06-27 23:33:42,,,,Funny It doesnt look sluggish,,0.0,1ll4eiv
comment,n08ccqm,None,,1,2025-06-28 12:31:24,,,,Still fun games though,,0.0,1ll4eiv
comment,n08duab,DaddysFriend,,1,2025-06-28 12:41:40,,,,I havent played any games where this would be an issue but I play on an OLED and play a lot of PC games at high refresh rates but I dont notice anything,,0.0,1ll4eiv
comment,n08fhol,jucasthelucas,,1,2025-06-28 12:52:40,,,,Ok noted but does it make games unplayable Or are they just comparing it to a PC monitor,,0.0,1ll4eiv
comment,n0bt5w5,dargonmike1,,1,2025-06-29 00:07:07,,,,Ive heard only bad things about the switch two its hard to keep a smile on when friends say they love their new switch 2 lol pc master race,,0.0,1ll4eiv
comment,n0cvxt0,DigitalGumby,,1,2025-06-29 04:33:14,,,,The switch 2 is awesome I keep seeing this but it seems online is only concerned with being negative Its a great handheld and tabletop mode is an incredible way to play,,0.0,1ll4eiv
comment,n0dohh2,Butch_Meat_Hook,,1,2025-06-29 08:58:11,,,,To the surprise of no one really Nintendo is definitely not known for having the best hardware At least since the Wii theyve produced consoles that are cheaper to manufacture than the RRP whereas Sony and Microsoft have often had loss leading consoles where the systems are more expensive to produce than they sell them for usually because they are trying to jam in features whether it be Bluray SSD etc and then they attempt to make the money back in game sales If youre after a top quality hardware device for gaming its never going to have a Nintendo logo on it because thats just not what they do and its not their strength Their reputation is for the quality of their games,,0.0,1ll4eiv
comment,n0du24x,Ill-Ad3311,,1,2025-06-29 09:55:28,,,,Looks great to me no complaints,,0.0,1ll4eiv
comment,n0l05gk,ivarin,,1,2025-06-30 14:31:08,,,,yeah so much better to look at 20 fps zelda game on my superfast OLED screen than 60 fps on this garbage of an LCD switch 2 smearing slideshow what were they thinking,,0.0,1ll4eiv
comment,n0l1xq8,Daslicey,,1,2025-06-30 14:40:04,,,,The Great thing is i havent heard anyone complain about it I also got the switch 2 since Friday and I really dont see anything wrong with the screen except it isnt OLED,,0.0,1ll4eiv
comment,n0lfdzb,BeefBurritoBoy,,1,2025-06-30 15:45:42,,,,Does this mean it has a worse display than the switch oled that came out 4 years ago Thats crazy,,0.0,1ll4eiv
comment,n0u6ea3,_cocopuff92,,1,2025-07-01 22:00:11,,,,Soooo should I not upgrade to the switch 2 and keep my OLED Id keep my OLED anyway if I upgrade I really wanted it for the games its capable of playing that the switch I have now cant play like windwaker cyberpunk 2077 and others But Im also seriously considering a ps5 for obvious reasons,,0.0,1ll4eiv
comment,n10q09s,CannonBeetle,,1,2025-07-02 21:53:48,,,,Weird oversight but I havent noticed tbh,,0.0,1ll4eiv
comment,n12oq3w,BenefitOfTheDoubt_01,,1,2025-07-03 04:50:11,,,,And this isnt even the interesting thing The real interesting thing is despite the drawbacks and all of Nintendos anticonsumer behavior the Switch 2 will still break sales records because at the end of the day squeaky wheels dont mean shit if the money is still rolling in I wont give Nintendo my money but for every one of me there are 1000 that will and thats why it costs 80 to lease the rights to play the game you bought Nintendo isnt the only one You will own nothing and like it,,0.0,1ll4eiv
comment,n1wpbqu,HammerCurls,,1,2025-07-08 01:18:15,,,,I own a Switch OLED Switch Lite Switch 2 and Steamdeck in real word use I cant tell the difference besides the OLED having deeper black and better HDR There needs to be transparency in who funds articles like this,,0.0,1ll4eiv
comment,mzyab3q,TCsnowdream,,1,2025-06-26 20:59:11,,,,Obvious rage bait title The authors need to be more subtle lol Also Im still having a blast on my Switch 2 so nyaa,,0.0,1ll4eiv
