type,id,author,title,score,created_utc,url,num_comments,subreddit,body,parent_id,depth,post_id
comment,n0553rw,gblandro,,3,2025-06-27 22:01:39,,,,No worries the OLED version will sell again like hot cakes,,0.0,1ll4eiv
comment,n05eit3,lloydsmith28,,3,2025-06-27 22:55:06,,,,Ill wait for the switch 22 that improves upon it and is possibly cheaper,,0.0,1ll4eiv
comment,n06aem3,Cubanitto,,3,2025-06-28 02:08:22,,,,You cheap out you get this kind of results,,0.0,1ll4eiv
comment,mzwq1r9,slothson,,38,2025-06-26 16:30:33,,,,Unpopular opinion But imo a handheld console should be pocket sized portable Like the ds or psp I love the 3ds and am still bummed nintendo combined wii and ds It prob saves the company money But i loved it when nintendo did both Gameboy and n64 Gamecube and gba sp Wii and ds,,0.0,1ll4eiv
comment,mzwqqox,BuddyBlueBomber,,103,2025-06-26 16:33:51,,,,With the advent of mobile gaming on phones i dont see pocket sized portables coming back any time soon if at all,mzwq1r9,1.0,1ll4eiv
comment,mzwrohi,None,,15,2025-06-26 16:38:23,,,,Yup Thats why we have the switch and steam deck Not much further room for these devices to go Id rather have a nice gaming laptop than either if I have to carry a large portable device around Gaming on phone has sucked since they figured out microtransactions,mzwqqox,2.0,1ll4eiv
comment,mzyqpw0,Programmdude,,6,2025-06-26 22:24:20,,,,Eh gaming on the phone has always sucked IMO I got a gbads emulator where the games are good and it was still a subpar experience When your fingers take up a good portion of the screen it makes playing rather annoying That said some genres of games designed for phones can be okay such as puzzle games But then you run into the microtransaction bullshit Yes Id pay 10 for your game No I wont pay 30 per month for a bunch of gold that unlocks levels that let me play your game without adslivestimeetc,mzwrohi,3.0,1ll4eiv
comment,n001gqm,Vinnie_Vegas,,3,2025-06-27 03:00:27,,,,When your fingers take up a good portion of the screen it makes playing rather annoying This problem is completely solved by telescoping controller like the Razer Kishi or the Gamesir X5 which are both smaller and cheaper than a separate pocket sized portable would be and a phone is likely to be able to play more impressive stuff than a portable console could The convenience of the mobile phone considering that everyone is always carrying one anyway is just impossible for a portable console to overcome Its a nonstarter in the same way that a separate music player was instantly a nonstarter once you could play music from your phone No one will carry two devices when you can carry one that does both,mzyqpw0,4.0,1ll4eiv
comment,n00gkia,Programmdude,,1,2025-06-27 04:49:16,,,,Sure and I did look at one of those But then Im carrying two devices or one oversized device just to play a game for 1020 minutes while waiting for something If the games on phones were decent enough then the tradeoff would be worth it but I didnt find playing emulated games a big enough draw to buy one Now if I got a steam deck or similar Id also be carrying a second oversized device but then I could play real games rather than microtransaction filled garbage or emulated old games If native phone games came out that were as good as switchsteam deck and they supported bluetooth controllers the situation would be a lot different of course One controller is a lot smaller than the steam deck after all,n001gqm,5.0,1ll4eiv
comment,n00xxsj,Vinnie_Vegas,,1,2025-06-27 07:20:58,,,,Sure and I did look at one of those But then Im carrying two devices But the original premise of the discussion was originally that one might want a separate gaming device thats smaller than a Steam Deck or a Switch If youre not willing to carry a second device even smaller than that then that proves the idea is DOA,n00gkia,6.0,1ll4eiv
comment,mzws37i,Gloriathewitch,,2,2025-06-26 16:40:19,,,,it wont be novel anymore because its been done a thousand times now but that doesnt mean it wont be popular theres a market for handhelds today already and its quite considerable people are modding old ones and making custom homebrew OSes with 100s of their old games,mzwqqox,2.0,1ll4eiv
comment,n01ft29,TotoCocoAndBeaks,,2,2025-06-27 10:13:39,,,,DS3DS games were an entirely different category of games that is now basically no longer being made Low graphics high functionality games Complex RPGs with great looking but low power consuming graphics Fun sports games eg the great RPG golftennis games Fun puzzle games These things are not being made for mobilethey were made almost exclusively for Nintendo handheld consoles Considering the amount of double ownership of Nintendo homehandheld it might turn out that Nintendo have kicked themselves in the feet by switching to a single device,mzws37i,3.0,1ll4eiv
comment,mzz3aoe,quasirun,,1,2025-06-26 23:34:26,,,,Can get Bluetooth controller frames for mobile now too Just that developers and studios keep making micro transaction slot machine style junk games instead of something good,mzwqqox,2.0,1ll4eiv
comment,mzwr9gf,feartheoldblood90,,26,2025-06-26 16:36:22,,,,Normal opinion both pocketable handhelds and larger ones like the Switch have their value I wouldnt want to play modern firstparty Nintendo games on a screen the size of a 3DS And before someone comes in and goes UM AHKTCHUALLY the 3DS had first party Nintendo games Im talking about the big budget AAA output not their smaller titles Breath of the Wild would be absolutely terrible on a tiny screen,mzwq1r9,1.0,1ll4eiv
comment,mzwqke4,ExoShaman,,8,2025-06-26 16:33:02,,,,Anbernic and RetroidPocket handhelds are really great in the portability category I love my Steam Deck but Id rather have something pocket sized sometimes especially just to play some pokemon,mzwq1r9,1.0,1ll4eiv
comment,mzwrw21,Downtown_Samurai,,1,2025-06-26 16:39:23,,,,Like a smart phone,mzwqke4,2.0,1ll4eiv
comment,mzxbjmk,slothson,,5,2025-06-26 18:09:32,,,,The problem with phone is that i need to use it as a phone and if i eat up the battery playing games im screwed Also You ever get like 10 texts back to back in the middle of playing a mobile game Its kinda annoying I also understand that the smartphone might have been a factor in nintendo stopping handhelds,mzwrw21,3.0,1ll4eiv
comment,mzwt74f,ExoShaman,,1,2025-06-26 16:45:38,,,,You can totally get an emulator on your phone I just like the traditional gameboy form factor and buttons with the emulator functionality,mzwrw21,3.0,1ll4eiv
comment,mzwryfz,the_batman24,,4,2025-06-26 16:39:42,,,,It saves the consumer money too Now we only have to buy one console I cant complain tbh,mzwq1r9,1.0,1ll4eiv
comment,mzxcfwp,slothson,,1,2025-06-26 18:13:43,,,,I get it Thats prob why its an unpopular opinion I always bought the handhelds I had a gamecube and gba and sp And i never got a wii but i had ds and 3ds I dont have a switch nor switch2 I like em though and i played em But the only console i buy nowadays is the PS or pc I still play on ps4 and didnt get ps5 cause i joined the pcmasterace I play my 3ds though I learned about homebrew and got some movies and games on my 3ds Hshop is GOAT,mzwryfz,2.0,1ll4eiv
comment,mzwtnhk,Shapes_in_Clouds,,5,2025-06-26 16:47:49,,,,3DS is my favorite handheld ever I loved the 3D screen and the whole thing was so nice and powerful enough to deliver some great games New Leaf New Horizons,mzwq1r9,1.0,1ll4eiv
comment,mzxcmw0,slothson,,1,2025-06-26 18:14:37,,,,Me too I still havent gotten a street pass in forever I use my n3ds for movies more than games nowadays,mzwtnhk,2.0,1ll4eiv
comment,mzx1k89,spooooork,,1,2025-06-26 17:24:04,,,,But imo a handheld console should be pocket sized portable Simple get bigger pockets,mzwq1r9,1.0,1ll4eiv
comment,mzx4pih,None,,1,2025-06-26 17:38:20,,,,Jnco all the way,mzx1k89,2.0,1ll4eiv
comment,mzxcq5v,slothson,,1,2025-06-26 18:15:03,,,,True Modern problems require modern solutions,mzx1k89,2.0,1ll4eiv
comment,mzx8ny6,MrNegativ1ty,,1,2025-06-26 17:56:16,,,,This is my biggest complaint with stuff like the steam deck its fucking massive If you want it with you when youre out and about you have to carry a bag around with you and I dont like carrying bags around If it was something I could fold up and shove into my pocket I would use it all the time The GBA SPDS3DS were absolutely brilliant in that respect Fold it up it protects the screen and takes up half the size,mzwq1r9,1.0,1ll4eiv
comment,mzxd606,slothson,,1,2025-06-26 18:17:09,,,,Yea The smartphone is the best pocketsized console unfortunately Its like a pocket pc Just like how pc is the best console The other consoles are cool but objectively speaking the pc is the best console,mzx8ny6,2.0,1ll4eiv
comment,n04mgte,Realistic_Condition7,,1,2025-06-27 20:24:12,,,,I do miss the pocket sized consoles and the creativity developing for such underpowered devices brought HOWEVER Something like a SwitchAllySteam Deck are fantastic for people who travel a lot or play in hotels a lot The ability to experience more console level on the go,mzwq1r9,1.0,1ll4eiv
comment,mzwqtx3,lolheyaj,,35,2025-06-26 16:34:18,,,,Yall keep toiling over that Im gonna keep playing Pokemon and Mario kart,,0.0,1ll4eiv
comment,mzwu40h,LegendaryCabooseClap,,5,2025-06-26 16:50:00,,,,Basically me,mzwqtx3,1.0,1ll4eiv
comment,mzykkhu,cloud12348,,-1,2025-06-26 21:51:20,,,,Yet here you are,mzwqtx3,1.0,1ll4eiv
comment,mzx2b04,blueB0wser,,-7,2025-06-26 17:27:25,,,,Okay,mzwqtx3,1.0,1ll4eiv
comment,n010i2k,KillerFugu,,-1,2025-06-27 07:46:05,,,,I will once they make a half decent screen until then pokemon and Mario Kart on Switch oled,mzwqtx3,1.0,1ll4eiv
comment,mzzebkv,GeneralTreesap,,-4,2025-06-27 00:39:40,,,,Gamers rise up,mzwqtx3,1.0,1ll4eiv
comment,mzzlfrv,That_Xenomorph_Guy,,7,2025-06-27 01:21:50,,,,Idk why they dont just release a screenless version Not everyone wants a handheld,,0.0,1ll4eiv
comment,mzwt089,rsox5000,,27,2025-06-26 16:44:42,,,,Quick compare it to the SteamDeck and ROG Ally I prefer my SteakDeck to my Switch but this ragebait around the Switch 2 is insane,,0.0,1ll4eiv
comment,mzwvrfe,baskura,,15,2025-06-26 16:57:43,,,,Mmmmmm Steak,mzwt089,1.0,1ll4eiv
comment,mzz2uhx,soulsoda,,8,2025-06-26 23:31:50,,,,Steam deck and switch 2 are basically the same screen with the same issues The only difference is that steam deck came out with it 3 years ago and it was 400 The LCD steam deck also got shit for its crappy screen,mzwt089,1.0,1ll4eiv
comment,n04n22l,Realistic_Condition7,,1,2025-06-27 20:27:07,,,,The comparison is that Switch 2 is a lot worse than the Ally and a bit worse than the cheap and old and somewhat maligned screen of the Steam Deck I love my Switch 2 but the response times on the Switch 2 are pretty impressively slow on an LCD screen in 2025 The screen is probably literally the worst aspect about a pretty impressive 450 machine so I think people deserve to know what theyre getting if theyre going to be big time handheld gamers,mzwt089,1.0,1ll4eiv
comment,mzwxe93,Xin_shill,,-4,2025-06-26 17:05:14,,,,Why is truth rage bait Do you not want this information going out to potential customers,mzwt089,1.0,1ll4eiv
comment,mzwypze,puglife82,,2,2025-06-26 17:11:18,,,,Lmao what dishonest loaded questions,mzwxe93,2.0,1ll4eiv
comment,n02mvh7,hungryhusky,,-2,2025-06-27 14:41:53,,,,Its not gamebreaking though Its not even an issue or a defect Its just people nitpicking and expecting more,mzwxe93,2.0,1ll4eiv
comment,mzwzu4r,TheGrayBox,,-3,2025-06-26 17:16:19,,,,I read the article the best results for Switch 2s LCD is 17ms worst is 30ms A quick search shows Ally X and Ally they share the same screen at 57ms Black to White or 97ms Grey to Grey,mzwt089,1.0,1ll4eiv
comment,mzx1rgo,stoneymcstone420,,8,2025-06-26 17:24:58,,,,lol so uhh I did actually read the article and the only comparison they make to any other portable is comparing battery life to the SteamDeck They also specify that one of their sources measured 33ms and another measured 17ms for Switch 2 So what were you lying about again Edit lmfao oh no not the sneaky edit to change literally your entire comment Who could have predicted such masterful deception,mzwzu4r,2.0,1ll4eiv
comment,mzx2xe7,TheGrayBox,,-8,2025-06-26 17:30:11,,,,I guess youre confused The comment clearly says they read the article and then googled the specs for the other two,mzx1rgo,3.0,1ll4eiv
comment,mzx37y0,stoneymcstone420,,4,2025-06-26 17:31:31,,,,Forget to switch accounts,mzx2xe7,4.0,1ll4eiv
comment,n007qhv,Creative-Duty397,,2,2025-06-27 03:43:21,,,,I expected this problem but really didnt notice any issues with mine Its my first switch though so maybe I just dont have first hand experience to compare it to,,0.0,1ll4eiv
comment,n012zhj,UndeadFlowerWall,,2,2025-06-27 08:10:33,,,,Yes they want to give you a reason to buy the Pro Elite Deluxe OLED edition next year,,0.0,1ll4eiv
comment,n059dry,Soultab,,2,2025-06-27 22:25:32,,,,gifgiphyGCvktC0KFy9l6downsized,,0.0,1ll4eiv
comment,n05csov,jonjawnjahnsss,,2,2025-06-27 22:45:12,,,,As someone who just got a Retroid 5 Pro I find this wild Even that has an OLED screen,,0.0,1ll4eiv
comment,mzx4unt,60hzcherryMXram,,7,2025-06-26 17:39:00,,,,Obligatory response time is not the same as input lag A high response time does not mean that the screen has a long delay to the video it is displaying Response time is just the time it takes for a completely black pixel to become a bright white without under or over shooting its target brightness Way too much response time can cause scenes with interactions between bright and dark scenes to appear motion blurred but it is not nearly as important as input lag,,0.0,1ll4eiv
comment,n01clby,MegaDonkeyKong666,,4,2025-06-27 09:44:33,,,,Honestly I think theyre latching on the the screen refresh because something has been found to criticise its performance Its a nice console In handheld its just not something to care or even notice I dont even play Fortnite anymore but I tested it just to see how it feels in handheld Felt smooth and completely playable handheld which the let down is that the joysticks are still not completely comfortable to be playing competitive shooters in handheld Far better than S1 That being said when docked in my LG C3 I get to see how smooth this console is If anything a little bit of ghosting on the minuscule level probably helps making 30fps not feel so jarring lol Seriously wtf are games getting released at 30fps anymore Its painful Give me less graphics and a minimum 60fps and Ill still be happy,,0.0,1ll4eiv
comment,n03re0x,SirCanealot,,1,2025-06-27 17:52:03,,,,Thats actually a fun point xenoblade 3 looks okay on the panel since its a solid 30fps now and theres plenty of motion blur,n01clby,1.0,1ll4eiv
comment,mzwpk07,1leggeddog,,20,2025-06-26 16:28:13,,,,Par for the course with Nintendo hardware really Cheap parts big price tag exclusive games,,0.0,1ll4eiv
comment,n08ort3,SteeleHeller,,3,2025-06-28 13:51:16,,,,And ravenous stans that will gobble it all up,mzwpk07,1.0,1ll4eiv
comment,mzydt9d,cooldaniel6,,6,2025-06-26 21:16:47,,,,Doesnt matter still selling like hotcakes,,0.0,1ll4eiv
comment,mzzvtpx,Neat-Contact7509,,5,2025-06-27 02:24:34,,,,Cool I still have fun with it,,0.0,1ll4eiv
comment,n016bfq,KittenDecomposer96,,2,2025-06-27 08:43:50,,,,My tinfoil conspiracy is that they are making this screen worse to sell a OLED revision down the line,,0.0,1ll4eiv
comment,n06aszj,orbitur,,1,2025-06-28 02:10:54,,,,Youre right to say tinfoil Its just bad marketing and bad user experience to offer a noticeably bad experience for a year or two This was oversight or more likely they thought it was a reasonable tradeoff and people wouldnt notice And the latter is probably right Most Switch players arent breaking out high speed cameras and measuring screen refresh rates they are either 5 years old or 50 years old and playing Mario Kart,n016bfq,1.0,1ll4eiv
comment,mzws8fq,zshort7272,,7,2025-06-26 16:41:01,,,,I dont even know what any of that means Looks great to me,,0.0,1ll4eiv
comment,n00ahzk,BlobTheOriginal,,1,2025-06-27 04:03:01,,,,Sweet comment,mzws8fq,1.0,1ll4eiv
comment,mzwoncq,sherbodude,,18,2025-06-26 16:23:56,,,,Oh its far slower than high performance gaming monitors Im shocked,,0.0,1ll4eiv
comment,mzwpn4w,brondonschwab,,82,2025-06-26 16:28:38,,,,Its slower than the original Switch screen,mzwoncq,1.0,1ll4eiv
comment,mzwp434,_seysant,,85,2025-06-26 16:26:07,,,,Take a moment to read the article Its slower than many average consumer monitors and even the first Switchs,mzwoncq,1.0,1ll4eiv
comment,mzwpjqz,Mat_alThor,,49,2025-06-26 16:28:11,,,,33ms response time thats slower than a lot of projectors which arent known for their quick response time,mzwp434,2.0,1ll4eiv
comment,mzwr7mq,NestyHowk,,17,2025-06-26 16:36:07,,,,Yep 33ms is slower than a 10yo monitor slower than a CRT or a plasma tv the switch 2 screen response time is about the same as the Wii U which is pretty pretty bad,mzwpjqz,3.0,1ll4eiv
comment,mzzlf9q,mans51,,6,2025-06-27 01:21:45,,,,slower than a CRT or a plasma tv But those technologies have astounding motion clarity,mzwr7mq,4.0,1ll4eiv
comment,n01awv1,gay_manta_ray,,1,2025-06-27 09:28:34,,,,slower than a CRT yes 33ms is just a bit slower than the 10 microseconds it takes the electron beam to excite a phosphor and make a tiny glowy ball of light,mzwr7mq,4.0,1ll4eiv
comment,mzwqdce,IsRude,,5,2025-06-26 16:32:06,,,,Yeah thats disgusting If youve ever tried Super Smash on a projector you know this terrible People defend Nintendo way too damn much,mzwpjqz,3.0,1ll4eiv
comment,mzwwc06,AuryGlenz,,0,2025-06-26 17:00:19,,,,If youve ever tried Super Smash on a projector you know this terrible As an FYI there are plenty of projectors that have low input lag and plenty of TVs with high input lag,mzwqdce,4.0,1ll4eiv
comment,mzwwqmm,IsRude,,2,2025-06-26 17:02:12,,,,Thats great but 33ms is a lot,mzwwc06,5.0,1ll4eiv
comment,mzwshlr,Immersi0nn,,0,2025-06-26 16:42:14,,,,Thatis 30fps right If the panel minimum response time of the pixels is 33ms it cant do 60fps then if I understand this correctly,mzwpjqz,3.0,1ll4eiv
comment,mzxtrd2,AreYouOKAni,,3,2025-06-26 19:36:36,,,,It is a 60120 FPS with a fuckton of blur everywhere The movement feels responsive its just that it leaves trails behind,mzwshlr,4.0,1ll4eiv
comment,mzxuxe8,Immersi0nn,,1,2025-06-26 19:42:30,,,,Ahhhhh yep so its got ghosting the pixels cannot switch fast enough to display every frame and can only do so at 30fps Love ittttt,mzxtrd2,5.0,1ll4eiv
comment,mzy9z0l,AreYouOKAni,,1,2025-06-26 20:57:31,,,,I mean according to all the Ninties in the thread 30 fps is all they can perceive so it is clearly fine LMAO,mzxuxe8,6.0,1ll4eiv
comment,mzz7wzl,Immersi0nn,,1,2025-06-27 00:01:02,,,,Thats fine though if theyre happy with it right Honestly it might be better staying ignorant of high refresh low latency screens Once I saw a 240hz benq for the first time I was never again able to ignore the difference,mzy9z0l,7.0,1ll4eiv
comment,mzws872,sherbodude,,4,2025-06-26 16:40:59,,,,I think its fine to compare it to the first switch and similar devices where it definitely is worse But PC monitors use way more energy than the Switch 2s display I dont think its a fair comparison,mzwp434,2.0,1ll4eiv
comment,mzwp5b5,MultiMarcus,,42,2025-06-26 16:26:16,,,,Well it is a gaming device so expecting it to have a screen that isnt worse than its seven year old predecessor and its four year old refresh,mzwoncq,1.0,1ll4eiv
comment,mzwpcxv,stew9703,,34,2025-06-26 16:27:17,,,,No way dude A 120 bestbuy monitor shouldnt be 10x better but it is so I dont get why you desire to defend nintendo,mzwoncq,1.0,1ll4eiv
comment,mzwqk43,sherbodude,,-9,2025-06-26 16:33:00,,,,Im not defending them I just think its not a big deal as people are making it out to be But Im sure they will release more revisions in the future with better response times,mzwpcxv,2.0,1ll4eiv
comment,mzwrm5t,harmonicrain,,5,2025-06-26 16:38:05,,,,And youll buy those too Why upgrade the current model when they can sell you a better version in a few years Of course,mzwqk43,3.0,1ll4eiv
comment,mzzdvj8,Resh_IX,,2,2025-06-27 00:36:59,,,,Didnt Valve do that with the Steam Deck In the big 2022 no less,mzwrm5t,4.0,1ll4eiv
comment,mzwska0,sherbodude,,5,2025-06-26 16:42:35,,,,nobodys making you buy anything dude Reddit is a vocal minority Most consumers arent going to notice this Hating on something gains you nothing Why you so mad that Im enjoying a product,mzwrm5t,4.0,1ll4eiv
comment,mzwxv31,Mullet2000,,7,2025-06-26 17:07:23,,,,I love when people tell on themselves about not reading the article being discussed lol,mzwoncq,1.0,1ll4eiv
comment,mzwyy7k,sherbodude,,-3,2025-06-26 17:12:19,,,,Thats a direct quote from the article The second paragraph,mzwxv31,2.0,1ll4eiv
comment,mzwzy1b,Mullet2000,,5,2025-06-26 17:16:49,,,,That paragraph literally says the Switch 2 display is slower than the slowest monitor theyve ever tested which was 19ms and as such it is also significantly slower than high end PC monitors as well,mzwyy7k,3.0,1ll4eiv
comment,mzx668d,sherbodude,,3,2025-06-26 17:44:59,,,,Why are we comparing it to PC monitors Makes no sense They arent powered by a battery,mzwzy1b,4.0,1ll4eiv
comment,mzxu0qp,AreYouOKAni,,1,2025-06-26 19:37:55,,,,It doesnt matter how the monitor is powered the screen response time is not related to voltage What matters is the panels quality FFS the original Steam Deck known for its terrible screen had a better reponse time,mzx668d,5.0,1ll4eiv
comment,mzy8jy3,sherbodude,,2,2025-06-26 20:50:38,,,,So lets compare it to that not PC monitors,mzxu0qp,6.0,1ll4eiv
comment,mzya9df,AreYouOKAni,,1,2025-06-26 20:58:57,,,,IIRC it is 30 ms on the OG Steam Deck 20ish on OLED 11 ms on ROG Ally,mzy8jy3,7.0,1ll4eiv
comment,mzz52ns,sherbodude,,1,2025-06-26 23:44:37,,,,But we cant use those numbers because thats not as clickbaity as 10x slower and 100x slower,mzya9df,8.0,1ll4eiv
comment,mzwqj1q,akeean,,8,2025-06-26 16:32:51,,,,Its so slow and smeary that there is no point running anything higher than 60hz in portable mode since the screen will literally refresh too slowly to show the differences between the frames Probably not a huge deal in portable mode but anything online competitive ie Switch 2 Call of Duty will have a significant advantage to people playing in docked mode on an OLED recent NeoQLED or even a nonancient LED TV,mzwoncq,1.0,1ll4eiv
comment,mzwsa8g,Thorusss,,7,2025-06-26 16:41:16,,,,The 30ms response time are actually even too slow for 60FPS 1000ms60FPS166ms which the switch cannot deliver,mzwqj1q,2.0,1ll4eiv
comment,mzww6wg,Dependent-Mode-3119,,4,2025-06-26 16:59:41,,,,Response time is not refresh rate and its not input delay,mzwsa8g,3.0,1ll4eiv
comment,n01jcuf,Tobi97l,,2,2025-06-27 10:44:07,,,,Response time is how long pixels need to switch from one color to the next If the response time is higher than the refresh rate the pixels never get to the actual color they are supposed to be at For example if the screen switches between black and white at 120hz the individual pixels would be stuck at grey since the pixels dont have enough time to reach full black or full white At 33ms they are 4 times slower than the refresh rate of 120hz At that point its not a 120hz screen anymore even if it refreshes at 120hz,mzww6wg,4.0,1ll4eiv
comment,n0kh0tz,Dependent-Mode-3119,,1,2025-06-30 12:45:11,,,,You have it backwards Response time is not refresh rate The screen is able to refresh at the 120hz as advertised its the pixels from before that dont change in time which means you still get the 120hz smoothness but you get a trail of the last few frames still behind it as the screen updates By your logic a 33ms response time is too slow to even see the difference between 30 and 60 on that screen but you obviously can Thats how ghosting works and is why the whole conversation is about ghosting Why speak so confidently on something you clearly dont understand,n01jcuf,5.0,1ll4eiv
comment,n0ki5er,Tobi97l,,1,2025-06-30 12:52:12,,,,Yes but you dont see 120 individual frames anymore With a pixel response time of 33ms 4 frames are getting blended together which results in ghosting I wouldnt call that 120hz anymore even though it technically still is 120hz Its smoother but visually not comparable to a true 120hz refresh rate with an 833ms response time,n0kh0tz,6.0,1ll4eiv
comment,n0kivaq,Dependent-Mode-3119,,1,2025-06-30 12:56:36,,,,It looks like 120 with motion blur I had an iPad pro that had this type of ghosting and Id still much preferred that over the 60hz screens Even then they can overdrive the display to get the times down a bit,n0ki5er,7.0,1ll4eiv
comment,n0kmfs9,Tobi97l,,1,2025-06-30 13:17:41,,,,Yes it would be nice if nintendo added an optional overdrive I doubt the extra battery drain would be even noticeable But i guess for a true switch 2 we need to wait for the oled version anyway,n0kivaq,8.0,1ll4eiv
comment,mzwqwi6,GameZard,,1,2025-06-26 16:34:38,,,,Nintendo fans cant read,mzwoncq,1.0,1ll4eiv
comment,n01aek6,gay_manta_ray,,1,2025-06-27 09:23:42,,,,its slower than any monitor you can buy brand new today,mzwoncq,1.0,1ll4eiv
comment,mzyhy8w,AFKABluePrince,,4,2025-06-26 21:37:51,,,,Super sluggish Yeah so sluggish i dont even notice it,,0.0,1ll4eiv
comment,n01emgb,ElDoRado1239,,4,2025-06-27 10:03:07,,,,You dont have a big enough Nintendo hateboner to notice,mzyhy8w,1.0,1ll4eiv
comment,n01jhyo,Tobi97l,,0,2025-06-27 10:45:16,,,,Average nintendo player i guess,mzyhy8w,1.0,1ll4eiv
