type,id,author,title,score,created_utc,url,num_comments,subreddit,body,parent_id,depth,post_id
post,1lrgi7x,diacewrb,Nintendo is restricting the Switch 2's USB-C port — most third-party docks and accessories won't work thanks to proprietary protocols,6852,2025-07-04 11:32:30,https://www.reddit.com/r/gadgets/comments/1lrgi7x/nintendo_is_restricting_the_switch_2s_usbc_port/,911.0,gadgets,,,,
comment,n1ajv77,kazuviking,,4107,2025-07-04 12:00:14,,,,The EU will have a field day with this,,0.0,1lrgi7x
comment,n1bjfhn,wolfgang784,,895,2025-07-04 15:22:56,,,,The EU website says the USBC thing is only for charging and the Switch 2 can indeed charge off of any old USBC It just cant do anything else at all besides charge with them,n1ajv77,1.0,1lrgi7x
comment,n1byluw,trojanguy,,473,2025-07-04 16:39:26,,,,Yeah when I got my son a S2 for his birthday I figured that instead of climbing behind the TV and switching the original Switch cables for the S2 cables Id just unplug the Switch dock and use the same cables on the S2 dock Nope no output to the TV unless I used the cables that came with the S2 Laaaaame,n1bjfhn,2.0,1lrgi7x
comment,n1c7187,Dashi-,,232,2025-07-04 17:21:39,,,,the hdmi is fine its just that the power adapter uses 20 more watts than the old one for docked use,n1byluw,3.0,1lrgi7x
comment,n1fwv7u,eh_steve_420,,19,2025-07-05 08:43:33,,,,Nintendo actually recommends you use the new HDMI cable Its newer and supports more bandwidth than The one that came with the switch 1 The old one may not support all video resolutions and refresh rates I believe it maxes out at 30 FPS in 4K resolution More info here And,n1c7187,4.0,1lrgi7x
comment,n1d7o4j,pastelfemby,,52,2025-07-04 20:36:40,,,,20 more watts no Switch 2 dock also has a fan to keep things cool which is an important note Theres several 3rd party docks that work just fine This whole post is just nintendo bad though they could def be doing better Pretty sure though you dont want to be sticking a hot and toasty switch 2 into some fanless old switch1 dock that ends up letting it get cooked,n1c7187,4.0,1lrgi7x
comment,n1dhd26,Dashi-,,12,2025-07-04 21:30:21,,,,Was a typo on my end haha meant to write 20,n1d7o4j,5.0,1lrgi7x
comment,n1dtrne,TristheHolyBlade,,18,2025-07-04 22:45:33,,,,The fans dont really cool the switch at all Too much plastic between them and no heatsink or anything to transfer heat They are for the dock itself plus the heat the switch adds to it Not sure if you thought that since the pronouns are a bit vague in your final sentence but just fyi,n1d7o4j,5.0,1lrgi7x
comment,n1jr4zd,Puzzleheaded-Bar9577,,3,2025-07-05 23:11:17,,,,Switch 1 dock is incompatible due to its usbc to hdmi interface using MyDP which is some archaic protocol for mid 2010s android phones The switch 2 is incompatible as it implements some weird hand shake for the dock if you look at the chips it should eventually use a standard DP 14 video alt mode but there is an stm32 which I assume controls the proprietary component of the switch 2 usbc interface and likely also the fan,n1d7o4j,5.0,1lrgi7x
comment,n1h70fq,npcrespecter,,-1,2025-07-05 14:46:48,,,,You dont get paid to suck Nintendo off like this right Relax,n1d7o4j,5.0,1lrgi7x
comment,n1fdbdo,Ok-Elk-1615,,-2,2025-07-05 05:33:08,,,,Nintendo is bad tho,n1d7o4j,5.0,1lrgi7x
comment,n1f7q49,Eurynom0s,,1,2025-07-05 04:43:39,,,,Does the new one use a standard USBC power profile now It was a massive pain in the ass with the OG that the dock required some specific power profile that only some chargers hadhave Got burned on this traveling across the country to visit a friend and he asked me to bring my Switch brought the dock but figured Id save space and just use my MacBook charger that I needed to also bring anyhow that had more than enough wattage but nope nogo with the dock because of the weird power profile thing,n1c7187,4.0,1lrgi7x
comment,n1f9hjp,Dashi-,,3,2025-07-05 04:58:51,,,,Ye its standard now the only thing that aint standard is the docks video output,n1f7q49,5.0,1lrgi7x
comment,n1fbkes,Eurynom0s,,1,2025-07-05 05:17:18,,,,the only thing that aint standard is the docks video output I thought its that its an actual standardDP Alt Mode to HDMIbut a shittier standard than normal HDMI,n1f9hjp,6.0,1lrgi7x
comment,n1c1t74,who_is_with_me,,67,2025-07-04 16:55:39,,,,At least the HDMI of the original switch is working for me with no problems Maybe the old power supply doesnt have enough power,n1byluw,3.0,1lrgi7x
comment,n1c61yw,primordialpickle,,50,2025-07-04 17:16:46,,,,Believe it requires 20V input Iirc the switch 1 has a 19V,n1c1t74,4.0,1lrgi7x
comment,n1d0ywv,theLuminescentlion,,22,2025-07-04 20:00:27,,,,As an EE 19V vs 20V normally wouldnt break anything the main voltage rarely gets used without a regulator and even when it is the device is fine within a range usually more than a volt They would have to go specifically out of their way to sense the voltage and disable at 19V which is insane,n1c61yw,5.0,1lrgi7x
comment,n1d2mrk,primordialpickle,,28,2025-07-04 20:09:24,,,,A slight correction but the switch power adapter nominally supplies 15v at 26A docked so roughly 39 watts The switch 2 adapter is 20v 3amps 60W,n1d0ywv,6.0,1lrgi7x
comment,n1d3f88,theLuminescentlion,,1,2025-07-04 20:13:40,,,,yeah a 15V vs 20V with an increase in draw could definitely do it without fuckery hell Id probably design a supply expecting 20V not to turn on under 18V without any Ill intent,n1d2mrk,7.0,1lrgi7x
comment,n1cdr6i,thdudedude,,1,2025-07-04 17:55:24,,,,But I have to outrage,n1c61yw,5.0,1lrgi7x
comment,n1corqu,Equivalent-Basis-145,,0,2025-07-04 18:53:42,,,,water air workable wipe decide payment school tub gray memory This post was mass deleted and anonymized with Redact,n1cdr6i,6.0,1lrgi7x
comment,n1f8lx6,BugblatterBeastTrall,,2,2025-07-05 04:51:12,,,,And thats exactly what Ive done many times as a cabling expert,n1corqu,7.0,1lrgi7x
comment,n1fugfs,Equivalent-Basis-145,,1,2025-07-05 08:18:47,,,,plants oatmeal steep existence divide smile imminent follow unpack hungry This post was mass deleted and anonymized with Redact,n1f8lx6,8.0,1lrgi7x
comment,n1cyba6,FlyingBishop,,-5,2025-07-04 19:46:16,,,,Switching from 19V to 20V seems pretty fucked up the only reason you would do that is to deliberately cause incompatability,n1cdr6i,6.0,1lrgi7x
comment,n1d3t90,whyizjay,,9,2025-07-04 20:15:46,,,,Its more than that The switch 1 power supply is 39 watt but the switch 2 one is 60 watt,n1cyba6,7.0,1lrgi7x
comment,n1dt1w6,Buttersaucewac,,5,2025-07-04 22:41:02,,,,It didnt go from 19v to 20v it went from 15v to 20v and 26 amps to 3 amps The console uses more power and the dock also now includes a fan to cool it so it uses 35 more power in total and needs a bigger power supply,n1cyba6,7.0,1lrgi7x
comment,n1cz8jw,ToYeetIsHuman,,1,2025-07-04 19:51:16,,,,Its worth noting that there are several different versions of HDMI with only the newer ones supporting 4K If you are trying to run 4K I cant imagine a 10 year old switch 1 hdmi would output at that resolution if not then nvm,n1c1t74,4.0,1lrgi7x
comment,n1fade3,who_is_with_me,,1,2025-07-05 05:06:42,,,,Good point I am actually not sure if I am still using the original HDMI cable I got from the first switch the one that came with the OLED version or most likely just a random third part one I bought somewhere before or inbetween At least I can definitely say that it doesnt have to be the one that is in the box with the switch 2,n1cz8jw,5.0,1lrgi7x
comment,n1egucb,Twitch84,,1,2025-07-05 01:19:06,,,,Is 4K60HDR working correctly You might hit a HDMI bottleneck when 120fps games release but maybe not My old TV was only HDMI 20 and I recall playing 120fps120hz but I believe it was at 1080p,n1c1t74,4.0,1lrgi7x
comment,n1fwwos,eh_steve_420,,1,2025-07-05 08:43:59,,,,Nintendo actually recommends you use the new HDMI cable which is HDMI Its newer and supports more bandwidth than The one that came with the switch 1 The old one may not support all video resolutions and refresh rates I believe it maxes at 30fps in 4k More info And,n1c1t74,4.0,1lrgi7x
comment,n1ioq67,who_is_with_me,,1,2025-07-05 19:31:49,,,,Thanks for the info My TV is a bit older so maybe thats why everything worked as expected for me I actually dont know what fps its running on right now,n1fwwos,5.0,1lrgi7x
comment,n1iqrv9,eh_steve_420,,1,2025-07-05 19:43:20,,,,What resolution is your TV,n1ioq67,6.0,1lrgi7x
comment,n1cs5wv,GooginTheBirdsFan,,1,2025-07-04 19:12:04,,,,Its not HDMI locked its usb c locked And the power req arent the same,n1c1t74,4.0,1lrgi7x
comment,n1c85n8,Varonth,,33,2025-07-04 17:27:17,,,,Because the original Switch did use a custom amount of voltage at that time chargers did not need to be universal So in your case the issue isnt that the Switch 2 is not complient with the requirement it is that the Switch 1 charger is not complient with the requirement and hadnt have to at the time of its release,n1byluw,3.0,1lrgi7x
comment,n1chxvc,japzone,,10,2025-07-04 18:17:13,,,,Yeah the Switch 1 charger isnt powerful enough for the Switch 2,n1byluw,3.0,1lrgi7x
comment,n1f3ebl,Banksov,,1,2025-07-05 04:07:30,,,,You can use 3rd party hdmi they just need to be good that can carry the appropriate signal Likewise with the power adapter it just needs to be able to deliver the power being demanded by the dock,n1byluw,3.0,1lrgi7x
comment,n1hee45,Physicist_Gamer,,1,2025-07-05 15:25:55,,,,This just isnt true You do not need to use the HdMI that came with it Theres nothing special about out it,n1byluw,3.0,1lrgi7x
comment,n1cj4vz,MrWilliamus,,-4,2025-07-04 18:23:34,,,,Eat shit loyal customer Nintendo,n1byluw,3.0,1lrgi7x
comment,n1ds8ez,Fit-Garbage-2259,,-1,2025-07-04 22:35:52,,,,Man me too I have all my cords done with wire management which looks nice but is a pain to run so I like no problem Ill just swap out the dock let out a long sigh when I turned it on and it didnt pop up on the tv,n1byluw,3.0,1lrgi7x
comment,n1fc90v,KazzieMono,,9,2025-07-05 05:23:24,,,,Ahhh They probably did that because launch switch 1s could be modded with an rcm jig and a usbc cord and nothing else Lord Nintendo I get it console modding is kind of a huge taboo but come on Its not hurting anybody Let people own the shit they buy,n1bjfhn,2.0,1lrgi7x
comment,n1bnbl6,MinecraftW06,,42,2025-07-04 15:42:19,,,,But its still anticompetitive behavior which is not allowed under the DMA,n1bjfhn,2.0,1lrgi7x
comment,n1eq7aj,PSIwind,,6,2025-07-05 02:27:16,,,,This is a Gadgets subreddit so Im surprised people in here arent aware that the dock is using a DisplayPort to USBC to HDMI protocol Its not anticompetitive its a different protocol that USBC to HDMIs dont use but IS easily possible to replicate Its not patented,n1bnbl6,3.0,1lrgi7x
comment,n1dtozu,ShadowMajestic,,13,2025-07-04 22:45:05,,,,But its Nintendo did we really expect any other kind of behavior,n1bnbl6,3.0,1lrgi7x
comment,n1dua3x,MinecraftW06,,4,2025-07-04 22:48:46,,,,Nah its very much expected from them,n1dtozu,4.0,1lrgi7x
comment,n1bsozi,suentendo,,18,2025-07-04 16:09:15,,,,No difference from PS5 only working with PSVR It doesnt fall under any EU rulings,n1bnbl6,3.0,1lrgi7x
comment,n1buhq4,Nick182128,,33,2025-07-04 16:18:21,,,,You can use PSVR on pc,n1bsozi,4.0,1lrgi7x
comment,n1c2oon,ItsAMeUsernamio,,-12,2025-07-04 16:59:58,,,,Only because its a commercial failure They wouldnt have brought support otherwise EU cant force Sony to support my USBC hall effect controller For all the downvotes PSVR2 launched 2023 They announced PC support in 2024 which requires an additional adapter to purchase They did not do it out of goodwill or EU pressure The Switch in comparison supports many third party controllers and Xbox gives out licenses for some of them PS5 pretty much only supports Dualsense and Dualsense Edge,n1buhq4,5.0,1lrgi7x
comment,n1cz2lt,thelonesomeguy,,2,2025-07-04 19:50:23,,,,They literally announced that they were working on PC support when they released it,n1c2oon,6.0,1lrgi7x
comment,n1fvq38,vgf89,,5,2025-07-05 08:31:46,,,,They did not There were a few people who were trying to figure out if they could get it to work given how similar it looked to the VirtualLink standard at first glance The farthest people got back then was display output with some custom hardware invetween the PC and PSVR2 and I think you needed a VirtualLink GPU to even get that far The official pc support box was practically a shadow drop,n1cz2lt,7.0,1lrgi7x
comment,n1ixf2x,thelonesomeguy,,1,2025-07-05 20:20:15,,,,I didnt have the timeline right but they mentioned it around the 1 year anniversary around half a year or so before they released the support,n1fvq38,8.0,1lrgi7x
comment,n1d160r,ItsAMeUsernamio,,1,2025-07-04 20:01:31,,,,They absolutely did not do that Even today the PSVR2 page does not mention PC Even back in 2024 it was just rumours when I bought my Quest 3,n1cz2lt,7.0,1lrgi7x
comment,n1bwq67,CosmicCreeperz,,10,2025-07-04 16:29:45,,,,What does that even mean No one is required to write software to support any device Blocking someone else from making something that uses a standard USB port is different from supporting your device on some elses hardware or vice versa,n1bsozi,4.0,1lrgi7x
comment,n1bzjuv,suentendo,,7,2025-07-04 16:44:17,,,,PSVR2 uses a completely nonstandard USB protocol which is why it needs an adapter to work on PC The port it connects to on PS5 has proprietary hardware to make it work even though of course it still supports some USB standards Its a entirely similar situation,n1bwq67,5.0,1lrgi7x
comment,n1d33ec,CatProgrammer,,4,2025-07-04 20:11:53,,,,VirtualLink is an official standard A bunch of companies supported it while the PS5 was being designed but dropped support for later GPU releases,n1bzjuv,6.0,1lrgi7x
comment,n1depmx,FlintStoneOran,,1,2025-07-04 21:15:09,,,,Yep my sister has my older 2080 ti and she only has to plug in the PSVR2 into her gpu no adapter required,n1d33ec,7.0,1lrgi7x
comment,n1d6bnm,Melodic-Theme-6840,,4,2025-07-04 20:29:20,,,,No it does not It uses VIrtual Link which is a standard protocol and if you have a GPU that supports virtual link you can use psvr2 on PC without the adapter It is not Sonys fault that both GPU vendors decided to drop Virtual Link later on,n1bzjuv,6.0,1lrgi7x
comment,n1c6w92,CosmicCreeperz,,-2,2025-07-04 17:20:57,,,,They didnt do it to intentionally make it harder for anyone or block use the connector is property because it contains some of the hardwarechips that the breakout box used to have and they wanted to simplify connectivity to the console Go look at some PCVR systems They are a mess of USB DP and power connections to plug in Sony literally planned a PC adapter from the start and released it to work with their HMD and its property cable filled with chips to support VR use They even allow by not encrypting connection messages 3rd party PCVR connectors What more do you want,n1bzjuv,6.0,1lrgi7x
comment,n1d2tsk,CatProgrammer,,1,2025-07-04 20:10:27,,,,VirtualLink is a standard protocol for USBC not Sonys problem other companies decided to drop it,n1bsozi,4.0,1lrgi7x
comment,n1by3jj,kodman7,,-1,2025-07-04 16:36:49,,,,It is insanely different they are locking out a feature that should work by default whereas PS5 would require major effort to support other VR platforms,n1bsozi,4.0,1lrgi7x
comment,n1c1xvn,Jonaldys,,0,2025-07-04 16:56:18,,,,Lol like PC That it supports with an adaptor,n1by3jj,5.0,1lrgi7x
comment,n1cdyss,kodman7,,-4,2025-07-04 17:56:28,,,,Now imagine if Playstation sent out an update that made the headset no longer compatible with PC that is what Nintendo is doing,n1c1xvn,6.0,1lrgi7x
comment,n1cgjy2,Jonaldys,,0,2025-07-04 18:09:51,,,,I dont agree that something being the case from release is the same as patching out features after release but whatever you believe It would be more like PlayStation not allowing third party dongles for PC from release Not really egregious but annoying They are not removing any functionality unless you bought third party accessories that were developed pre release,n1cdyss,7.0,1lrgi7x
comment,n1ckgaz,kodman7,,-2,2025-07-04 18:30:34,,,,If they are using universal protocols which is the default then yes it should work by defaultrelease They are creating their own protocols ie going out of their way to make sure their customers cant use 3rd party docks There is no other reason to do so Enabling it within their protocols would be a line switch They choose not to,n1cgjy2,8.0,1lrgi7x
comment,n1cpv3s,Jonaldys,,0,2025-07-04 18:59:35,,,,Of course But it isnt take away an existing feature Not nearly as egregious as patching out third party capabilities You can move the goalposts but Im not going to change the point I actually argued,n1ckgaz,9.0,1lrgi7x
comment,n1da4qr,KimNyar,,0,2025-07-04 20:50:02,,,,The point is not about charging ports its about nintendos anti competitiveness and the eu has measures in place to combat them but idk if it wouldcan apply to shutting out 3rd party manufacturers,n1bjfhn,2.0,1lrgi7x
comment,n1dib50,TucamonParrot,,0,2025-07-04 21:35:53,,,,Welp Im not buying one Problem solved,n1bjfhn,2.0,1lrgi7x
comment,n1eoewj,Mental_Tea_4084,,0,2025-07-05 02:14:12,,,,Sounds like its time for EU to expand the standard,n1bjfhn,2.0,1lrgi7x
comment,n1dux5m,thegreedyturtle,,-1,2025-07-04 22:52:47,,,,How can Nintendo call this a USB port,n1bjfhn,2.0,1lrgi7x
comment,n1dvohe,wolfgang784,,1,2025-07-04 22:57:30,,,,Yknow what I suppose it teeeeechnically isnt But it has the form factor of USBC and can charge off of it so afaik thats all that specific EU law covered They wanted to cut down on charging cables but they didnt cover other uses or cables,n1dux5m,3.0,1lrgi7x
comment,n1gckzr,thegreedyturtle,,1,2025-07-05 11:20:12,,,,Im not talking EU USB is copyrighted by the trade group who created the standard,n1dvohe,4.0,1lrgi7x
comment,n1als2k,The_One_Who_Slays,,456,2025-07-04 12:13:33,,,,Literally my first thought lmao Oh its gonna be fun to watch,n1ajv77,1.0,1lrgi7x
comment,n1bketp,prmntnrmns,,145,2025-07-04 15:27:51,,,,Man they won so much good will with the OG switch and to watch them fumble the 2 this hard is just sad,n1als2k,2.0,1lrgi7x
comment,n1bymre,OtterishDreams,,62,2025-07-04 16:39:34,,,,they aint fumbling a thing sales gangbusters Stuff like this is background noise,n1bketp,3.0,1lrgi7x
comment,n1dsf45,Bloxxerstudios2,,17,2025-07-04 22:37:02,,,,Im gonna be honestI swear people were kind of talking the same way about the OG Switch when it came out insofar as it being a fumble and a technical failure and stuff,n1bymre,4.0,1lrgi7x
comment,n1dy38w,OtterishDreams,,12,2025-07-04 23:12:41,,,,the percentage of people mad about this is well below 1,n1dsf45,5.0,1lrgi7x
comment,n1dyf5s,Bloxxerstudios2,,1,2025-07-04 23:14:43,,,,I agree I think its just the same case where people overhate and then with time they cool off and stop harping on every little technical issue,n1dy38w,6.0,1lrgi7x
comment,n1dz98t,OtterishDreams,,2,2025-07-04 23:19:56,,,,The modders are always super vocal Everyone else is off enjoying their ecosystem,n1dyf5s,7.0,1lrgi7x
comment,n1fb33r,cesclaveria,,1,2025-07-05 05:13:02,,,,the first month or so with the docks that were maybe scratching screens the articles were already dooming the switch also endless articles about it being underpowered until they got drown out by BOTW reviews and videos praising it not long after no one was really caring about any of the launch issues,n1dsf45,5.0,1lrgi7x
comment,n1f7qkj,DrTankHead,,-4,2025-07-05 04:43:46,,,,If you dont think Nintendo is fumbling this you arent paying attention to the industry,n1bymre,4.0,1lrgi7x
comment,n1bo6mj,SpacebarIsTaken-YT,,120,2025-07-04 15:46:34,,,,nothing will make a Nintendo fan think Nintendo did something wrong unfortunately see rnintendo EDIT lol they have a post flair not bricked banned from online,n1bketp,3.0,1lrgi7x
comment,n1bshiu,ProfessorPetrus,,57,2025-07-04 16:08:12,,,,Been back and forth about the omission of oled folks say its fine then admit they are going to buy the oled model Like just fine with being double dipped on tech that came out awhile ago Fandom is cultish,n1bo6mj,4.0,1lrgi7x
comment,n1bt8sh,SpacebarIsTaken-YT,,32,2025-07-04 16:12:01,,,,Theyll try to make a logical argument every time like the technology just isnt there yet but itll be ready within the next few years Like bro Nintendo WANTS you to buy both,n1bshiu,5.0,1lrgi7x
comment,n1cad0z,Erisian23,,5,2025-07-04 17:38:19,,,,Thats been how theyve operated all my life Og Gameboy Og Gameboy but different colors Game boy pocket Its what nintendoes,n1bt8sh,6.0,1lrgi7x
comment,n1eohti,Ok-Beautiful4821,,1,2025-07-05 02:14:46,,,,This isnt really the same at all but circlerjerk away I guess OG Gameboy is late 80s tech and we saw a ton of miniaturizing of electronics in the 90s that meant they could shrink the Gameboy into the pockets size and run it off 2 AAA batteries instead of the OGs 4 AAs which they literally could not have done in the late 80s They technically couldve done color with the OG Gameboy but certainly not twice the clockspeed the GBC had and certainly not with the battery life that the original GB had Thats not double triple dipping thats the natural progression of technology during a rapidly changing decade Whereas a nonOLED Switch is blatant attempt to doubledip because the technology for an OLD Switch 2 is here now and has been for years,n1cad0z,7.0,1lrgi7x
comment,n1ce56s,seanl1991,,0,2025-07-04 17:57:22,,,,Pokemon also released the same game two or three times for decades,n1cad0z,7.0,1lrgi7x
comment,n1dzk3n,kylekillzone,,1,2025-07-04 23:21:52,,,,I think this is grossly overused They had XD They had Legends They had Ranger If you dont want a mainline game dont get the mainline game There are people to this day still dedicating their lives to the broken mess of red green blue People still want a mainline pokemon game Theres proof in the sales,n1ce56s,8.0,1lrgi7x
comment,n1ly5q2,seanl1991,,1,2025-07-06 09:37:18,,,,I didnt say I didnt want a mainline game I said I dont get why there needs to be 3 of them that cost the same and are almost identical I enjoyed Pokémon as a kidteenager I did play legends on the switch too Im glad that the series has survived and were now at the point where adults are showing their kids what Pokémon they grew up with etc Maybe its actually a good thing since you can get what you dont have in each game through trading I think instead of having to pay for some DLC to complete things At least you could in the Gameboy DS Versions not sure if they have all continued to work that way on the Switch,n1dzk3n,9.0,1lrgi7x
comment,n1xaoil,Cenryk13,,2,2025-07-08 03:25:46,,,,That was literally the entire point of pokemon from the beginning to encourage people to interact with others to complete the dex It was basically a way to sell the link cable They never intended people to buy every version of a generation until recently when they started bundling them because people were buying every version anyway,n1ly5q2,10.0,1lrgi7x
comment,n1butse,digno2,,4,2025-07-04 16:20:04,,,,Nintendos Shuntaro took some good look at Tim and went all in on the Apple way of doing hardware,n1bshiu,5.0,1lrgi7x
comment,n1c6l0a,nimbusnacho,,2,2025-07-04 17:19:23,,,,Theres realistic shades of gray that done have to do with a fandom cult Im fine with LED considering that the costs for the system are so high I dont think I could stomach an even higher expense for an OLED model off the bat But I dont think itd be bad at all for there to have been an OLED variant on launch,n1bshiu,5.0,1lrgi7x
comment,n1crt99,laughland,,1,2025-07-04 19:10:08,,,,I meanIm one of these people I have the Switch 2 but I will get the midgeneration refresh if it has OLEDother improvements I always get the midgen refreshes Now youre probably asking why I didnt just wait simple I still want to play the latest games Im not sure whats so controversial about that I dont believe Nintendo did this as a thing of planned obsolescence I just dont think theres an OLED panel available that checks off all the boxes they want it to check off Thats why none of the gaming handhelds have one including more expensive handhelds Even the ROG XBOX Ally wont have an OLED,n1bshiu,5.0,1lrgi7x
comment,n1d0zqm,NagyBiscuits,,1,2025-07-04 20:00:35,,,,Where are they gonna source a VRR OLED screen of that size without ballooning the cost of the device Does one even exist,n1bshiu,5.0,1lrgi7x
comment,n1dglf8,Mental_Medium3988,,1,2025-07-04 21:25:56,,,,not buying a switch 2 regardless but the lack of oled wouldnt be so bad if they just used a decent panel,n1bshiu,5.0,1lrgi7x
comment,n1bw76n,VagueSomething,,0,2025-07-04 16:27:01,,,,Not using OLED is a sensible choice by Nintendo but then Im also saying that as someone who wouldnt buy OLED version,n1bshiu,5.0,1lrgi7x
comment,n1c2j78,WTWIV,,6,2025-07-04 16:59:14,,,,Im curious of your reasoning Ive heard some people have had issues with burnin on OLED but Ive had an OLED TV for over 5 years now and love it and also had the OLED Switch 1 and loved it so Im curious what your objections to it are,n1bw76n,6.0,1lrgi7x
comment,n1dqsqb,Kanhir,,-1,2025-07-04 22:26:49,,,,Not OP but one of the selling points is VRR and that causes flickering on OLED screens,n1c2j78,7.0,1lrgi7x
comment,n1c1m1g,ProfessorPetrus,,9,2025-07-04 16:54:40,,,,If the version they released was 50 bucks more and oled youd buy it and get greater utility out of it Nintendo games lack graphical fidelity often but their colors pop The best version of the swirch 1 by far is the oled,n1bw76n,6.0,1lrgi7x
comment,n1c6yu4,nimbusnacho,,3,2025-07-04 17:21:19,,,,Yeah 50 bucks is an easy sell itd likely not just be 50 bucks tho if it was a launch variant so its a weird argument An OLED model would definitely be better I truly would find it shocking to find anyone making an argument that it wouldnt be aside from a simple costbenefit standpoint,n1c1m1g,7.0,1lrgi7x
