type,id,author,title,score,created_utc,url,num_comments,subreddit,body,parent_id,depth,post_id
comment,n1clvwg,Nextil,,9,2025-07-04 18:38:14,,,,Huh This new restriction is Appleesque sure if its even significant since there are already thirdparty docks that work fine but the Switch is literally the only console of the past few generations to allow unlicensed thirdparty controllers Sony and Microsoft do all sorts of encryption to prevent it but you can buy any random Chinese controller and it usually works perfectly with Switch 1 or 2 Some people even program their own microcontrollers to use for inputting art in games like Splatoon AFAIK they all still work fine with Switch 2 I also have USBC dongles for connecting my wireless headphones using AptX Adaptive and those work perfectly with the Switch2 also,n1agt88,1.0,1lrgi7x
comment,n1at11e,favorite_time_of_day,,15,2025-07-04 13:00:11,,,,Every console is a walled garden Every console restricts third party accessories Ive been particularly annoyed by Microsoft in this respect but everyone does it I dont see how Nintendo is more like Apple when theyre all like Apple,n1agt88,1.0,1lrgi7x
comment,n1b6yaj,Supposably,,-3,2025-07-04 14:19:32,,,,My Steam Deck disagrees,n1at11e,2.0,1lrgi7x
comment,n1ba3y1,favorite_time_of_day,,10,2025-07-04 14:35:59,,,,Your Steam Deck is just a handheld PC Were talking about consoles The fact that consoles are walled gardens is practically their defining characteristic Without that a number of them have basically been PCs The Xbox one not to be confused with the Xbox One was made with offtheshelf PC parts,n1b6yaj,3.0,1lrgi7x
comment,n1csc9k,ImDonaldDunn,,5,2025-07-04 19:13:02,,,,The Steam Deck is very consoleesque If you want to use it like a console they make it very easy to You never have to leave the console interface to get Steam Deck compatible games to work But they also make it incredibly easy to tinker around and mod Its not locked down Best of both worlds,n1ba3y1,4.0,1lrgi7x
comment,n1c4hqs,DuckSword15,,1,2025-07-04 17:08:57,,,,Are you unaware of the hardware that current gen consoles run They are just x86 computers So how is that any different from a steam deck,n1ba3y1,4.0,1lrgi7x
comment,n1ciyxk,favorite_time_of_day,,-2,2025-07-04 18:22:41,,,,I did say right up above there The Xbox one not to be confused with the Xbox One was made with offtheshelf PC parts,n1c4hqs,5.0,1lrgi7x
comment,n1d94ud,Dom1252,,1,2025-07-04 20:44:38,,,,It wasnt But its same architecture just like PS45 are,n1ciyxk,6.0,1lrgi7x
comment,n1d9vjb,favorite_time_of_day,,1,2025-07-04 20:48:38,,,,It was That was a big issue with the Xbox one they couldnt costreduce effectively over the life of the console Starting with the Xbox 360 they shifted to a proprietary model which is more standard for consoles but which did still share a lot of similarities with PC architecture,n1d94ud,7.0,1lrgi7x
comment,n1dfnu9,DuckSword15,,1,2025-07-04 21:20:35,,,,The new Xbox and Playstation both run x86 processors from amd This functionally makes it no different than any other x86 computer,n1ciyxk,6.0,1lrgi7x
comment,n1dgc9h,favorite_time_of_day,,1,2025-07-04 21:24:28,,,,I am fully aware of the hardware Thats why I said above The Xbox one not to be confused with the Xbox One was made with offtheshelf PC parts As for functionality they are different in this way specifically The fact that consoles are walled gardens is practically their defining characteristic Without that a number of them have basically been PCs Maybe just read through the thread again and youll understand where all of this is going,n1dfnu9,7.0,1lrgi7x
comment,n1diq78,DuckSword15,,0,2025-07-04 21:38:21,,,,Your Steam Deck is just a handheld PC Were talking about consoles Crazy that you already forgot what you said,n1dgc9h,8.0,1lrgi7x
comment,n1doqfs,favorite_time_of_day,,1,2025-07-04 22:14:02,,,,Youre going to have to use more words than that because I did not forget what I said and your point has not been made,n1diq78,9.0,1lrgi7x
comment,n1bjazj,Supposably,,-5,2025-07-04 15:22:19,,,,I mean now were just arguing about definitions Technically they are all PCs The steam deck is just a more open platform than the rest of them,n1ba3y1,4.0,1lrgi7x
comment,n1canjn,DarkDuskBlade,,4,2025-07-04 17:39:48,,,,Thats the point A console has a mostly closed ecosystem Thats the tradeoff for a stronger guarantee and support that games will run on it ie the cert process PCs dont necessarily have that Of course its good business for developers to make it work but even so And if people dont think the games in those closed systems are worth it they wont buy All the failed VR ecosystems are a testament to that Meta is the exception I think but pretty sure thats propped up by other stuff Edit Thats not to say I support Nintendos bullshit here Its 2025 theres no reason for proprietary USB stuff like this even to keep a walled system and fight piracy At this point just void warranty for jailbroken system and start tackling the piracy issue through access not control,n1bjazj,5.0,1lrgi7x
comment,n1ckcmo,CreativeCthulhu,,4,2025-07-04 18:30:01,,,,I think youre taking the wrong perspective on this The Steam Decks INTENT is to be a walledgarden platform specifically for their storerepository or whatever The fact that there are so very many alternative uses was a choice on their part that the other consoles made an active choice to prohibit Steam already has a Verified for Steam Deck system in place which kinda puts them on the same footing as the others regarding a guarantee to work Im not arguing or trying to be overly pedantic just sharing how I view it,n1canjn,6.0,1lrgi7x
comment,n1d28v0,favorite_time_of_day,,2,2025-07-04 20:07:19,,,,Yeah thats a point Valve is trying to play both sides They want the PR benefits of appearing to be open while still maintaining a mostlycaptive audience that they know will be getting virtually everything through Steam For the purposes of the above conversation this doesnt really change anything The grandparent was saying that Nintendo was the Apple of the industry and the counterpoint was that the unique characteristic of all consoles is that theyre closed The fact that the Steamdeck walks a line of sorta console and sorta notconsole doesnt change this,n1ckcmo,7.0,1lrgi7x
comment,n1h86iz,CreativeCthulhu,,2,2025-07-05 14:53:07,,,,Thats a good point at the end there I appreciate your understanding that I wasnt trying to be purposefully obtuse or argue over nothing Thanks,n1d28v0,8.0,1lrgi7x
comment,n1c54r2,Interestingcathouse,,0,2025-07-04 17:12:09,,,,lol what else would a tech gadget be made of Playdoh,n1ba3y1,4.0,1lrgi7x
comment,n1ba0v4,ZolTheTroll413,,2,2025-07-04 14:35:31,,,,Steam deck is amazing been using it for my main computer for a while now tbh I wish they would make phones too lol,n1b6yaj,3.0,1lrgi7x
comment,n1ajtg0,cedric1997,,3,2025-07-04 11:59:54,,,,Id say theyre worst Apple actually helped develop USB C and implement it fully MacBooks were some of the first mainstream devices with it most iPads have had it for years they just stuck with Lightning on the iPhone specifically for dumb reasons Nintendo goes and use a standard connector and block third party docks Thats literally against new European legislations,n1agt88,1.0,1lrgi7x
comment,n1aks2s,weekendpostcards,,18,2025-07-04 12:06:39,,,,ELI5 if all I want to do is charge my switch2 can I use any usbc cable and adaptercharger,n1ajtg0,2.0,1lrgi7x
comment,n1ameyw,staatsclaas,,17,2025-07-04 12:17:53,,,,You should be fine,n1aks2s,3.0,1lrgi7x
comment,n1ap9z3,crom3ll,,14,2025-07-04 12:36:52,,,,Yes I tried multiple chargers cables and power banks and they all work,n1aks2s,3.0,1lrgi7x
comment,n1ambl4,Luigi_loves_Mario,,7,2025-07-04 12:17:15,,,,Yes absolutely you can,n1aks2s,3.0,1lrgi7x
comment,n1b92eo,SidFarkus47,,-7,2025-07-04 14:30:34,,,,Everyone is saying yes but there is nuance You cannot use any cable to charge the dock even though that is also a usb c shaped hole,n1aks2s,3.0,1lrgi7x
comment,n1cx17r,BlobBro,,0,2025-07-04 19:39:07,,,,Yes it is impossible to use any cable to charge the dock including nintendo branded ones Mainly because that isnt a thing As for powering the dock any cable that has enough output will do,n1b92eo,4.0,1lrgi7x
comment,n1epoxa,SidFarkus47,,0,2025-07-05 02:23:28,,,,To power the dock then Thats also a usb c shaped port but you cannot just use any usb cord and power supply to power it,n1cx17r,5.0,1lrgi7x
comment,n1fab19,ShankyBaybee,,1,2025-07-05 05:06:07,,,,You can use any usb cable You just need the correct adapter,n1epoxa,6.0,1lrgi7x
comment,n1viz1v,SidFarkus47,,1,2025-07-07 21:26:32,,,,I feel like theyve successfully muddied the waters and made me who spends way too much time thinking about video games only trust their own products Does Nintendo even sell a power adapter that accepts a usb cord to power the dock I dont think they do The ones that came with my switch 1 and 2 are both big and the wire is stuck onto the power adapter,n1fab19,7.0,1lrgi7x
comment,n1xoq23,ShankyBaybee,,1,2025-07-08 05:07:37,,,,My switch 2s power adapter is a brick with a usbc connector Ive used different cords with it and it works perfectly Switch 1 is connected for sure,n1viz1v,8.0,1lrgi7x
comment,n1ctg3q,ImDonaldDunn,,1,2025-07-04 19:19:08,,,,Idk if Id call the reasons dumb Apple caught a lot of heat when they switched from 30 pin to Lightning over accessories that were no longer compatible with the iPhoneiPod They were rightfully hesitant to go through that transition again,n1ajtg0,2.0,1lrgi7x
comment,n1dh0y7,cedric1997,,1,2025-07-04 21:28:25,,,,Technically they said that Lightning was gonna be their new connector for the next ten years and thats what they did to the exact year no they werent forced by the EU they implemented it one year earlier than required,n1ctg3q,3.0,1lrgi7x
comment,n1b24tv,kenman345,,2,2025-07-04 13:53:31,,,,Well yea Nintendo knows how to make fun games and games in general work on their platform,n1agt88,1.0,1lrgi7x
comment,n1bpr6g,Bostonterrierpug,,1,2025-07-04 15:54:28,,,,Sony tried this in the early 2000s and it failed miserably,n1agt88,1.0,1lrgi7x
comment,n1c8567,SilverBr4in,,1,2025-07-04 17:27:13,,,,And its true But unfortunately buy their hw is the only way to enjoy their awesome games,n1agt88,1.0,1lrgi7x
comment,n1cgl25,melancholanie,,1,2025-07-04 18:10:00,,,,its a bit of a cycle for them huge innovation big fun in their respective games next gen milked all to hell past the point of it being fun then they create the wheel all over again,n1agt88,1.0,1lrgi7x
comment,n1d0ty2,gracilenta,,1,2025-07-04 19:59:44,,,,i dont think so Nintendo is far worse,n1agt88,1.0,1lrgi7x
comment,n1dtvru,Dhegxkeicfns,,1,2025-07-04 22:46:16,,,,Yeah I enjoy my Switch but no way Im moving to Switch 2,n1agt88,1.0,1lrgi7x
comment,n1ic616,MaxPres24,,1,2025-07-05 18:22:36,,,,Apple has gotten much better lately Nintendo keeps leaning more into it Theyve been going in total opposite directions I feel like,n1agt88,1.0,1lrgi7x
comment,n1x9gzk,Electrical_Pause_860,,1,2025-07-08 03:17:47,,,,The Apple USBC stuff is all standards compliant though,n1agt88,1.0,1lrgi7x
comment,n1aiye4,ttubehtnitahwtahw1,,1,2025-07-04 11:53:41,,,,Thats because just like the companies are comparable so are the customers,n1agt88,1.0,1lrgi7x
comment,n1b3yz0,MobileVortex,,1,2025-07-04 14:03:31,,,,Because thats Sony Nintendo is Disney,n1agt88,1.0,1lrgi7x
comment,n1bx0kn,ToLuxPls,,1,2025-07-04 16:31:15,,,,Nintendo is out appleing Apple at this point,n1agt88,1.0,1lrgi7x
comment,n1ashbr,NeverNotOnceEver,,-2,2025-07-04 12:56:51,,,,Apple is overpriced but quality hardware with good software Nintendo is just overpriced bad hardware with overpriced but good software games,n1agt88,1.0,1lrgi7x
comment,n1ahhv7,MFKelevra,,-14,2025-07-04 11:43:10,,,,Except i can understand why people buy apple products as for nintendo i have no fucking clue,n1agt88,1.0,1lrgi7x
comment,n1aicqq,Cry_Wolff,,12,2025-07-04 11:49:22,,,,Switch 1 had no competition period And their games are fun accessible and well made so I really dont get why youre surprised,n1ahhv7,2.0,1lrgi7x
comment,n1aj5tf,MFKelevra,,-21,2025-07-04 11:55:10,,,,I am not the target audience obviously I see all nintendo games stupid and pointless And switch 1 has a great competitor xbox oneseries I stood in the store once in the end of 2020 with a shitload of extra cash and an urge to buy soooomething And i spent 20 minutes trying to find ONE reason to buy an xbox or switch or both I couldnt,n1aicqq,3.0,1lrgi7x
comment,n1am3qx,DarthWeezy,,7,2025-07-04 12:15:47,,,,They had and still have no competitor Nintendo first parties are Nintendo first parties duh theyre not on Xbox or anything else your anecdotal example of preference in gaming isnt shared by the actual gaming world,n1aj5tf,4.0,1lrgi7x
comment,n1ao6ne,MFKelevra,,-9,2025-07-04 12:29:45,,,,It was a joke about their competition in complete uselessness And as i said in the first sentence im aware that im not a member of the target audience Im playing sp games only with a story that includes writing acting and directing not clowning moaning and giggling So yeah nintendo has nothing to offer to me,n1am3qx,5.0,1lrgi7x
comment,n1b2ty4,ladyrift,,1,2025-07-04 13:57:19,,,,i didnt know that the xbox oneseries was portable Do you have any info on the specs of the screen and where I could get one,n1aj5tf,4.0,1lrgi7x
comment,n1b3mni,MFKelevra,,1,2025-07-04 14:01:39,,,,They compete not in portability They compete in uselessness,n1b2ty4,5.0,1lrgi7x
comment,n1aj4t7,Ipokeyoumuch,,4,2025-07-04 11:54:59,,,,Because Nintendo offers a unique experience compared to other gaming companies a console on the go With the Switch 2 being the equivalent of a PS4 in specs this is more than sufficient for many people Additionally Nintendo has exclusives which their competitors are struggling to meet Nintendo is incredibly protective of their IP and often stop collabs with them from reaching other consoles or PC to maintain the exclusivity Their exclusives are also generally high quality fun and quirky Note how many people with a PC chose to supplement their gaming experience with a Nintendo console rather than a Sony or Microsoft console,n1ahhv7,2.0,1lrgi7x
comment,n1ahqfy,98Kane,,7,2025-07-04 11:44:54,,,,Mario and Pokémon basically The equivalent of Apple having their ecosystem and Americans fascination with little blue bubbles,n1ahhv7,2.0,1lrgi7x
comment,n1auxfs,UnsorryCanadian,,6,2025-07-04 13:11:42,,,,And zelda And metroid And splatoon And pikmin And all their other exclusives,n1ahqfy,3.0,1lrgi7x
comment,n1ajys6,Joshawott27,,4,2025-07-04 12:00:56,,,,Yup Ill freely admit that Nintendo has been my preferred console manufacturer since I was a kid and their published games are basically why I know that since the GameCube theyve lagged in specs and thirdparty support and I also own other systems like a PS5 and Steam Deck However I play the Switch and now Switch 2 the most because they have Pokémon Fire Emblem etc the games that I personally want to play Similarly Apple has a great ecosystem that works within itself but doesnt play too well if you dare venture outside Ive typically zigzagged between iPhone and Android with subsequent upgrades but my current job has allowed me to go deeper into the ecosystem with AirTags a MacBook etc They all work so well together that it would take a lot for an android phone to convince me to move again At least Im in the UK and noone cares about the blue bubbles here lol It is worth noting that this kind of behaviour isnt exclusive to Nintendo though For example Sony doesnt allow bluetooth headphones to connect to PS5 and instead require you to buy their own ones,n1ahqfy,3.0,1lrgi7x
comment,n1amu7x,peainsea,,0,2025-07-04 12:20:44,,,,Yep 100 Both companies love their walled gardens and making you pay premium for official accessories This proprietary USBC nonsense is peak NintendoApple behavior,n1agt88,1.0,1lrgi7x
comment,n1ansj5,mschuster91,,-3,2025-07-04 12:27:08,,,,Nintendo is worse than Apple if you ask me Even with the old Lightning connection for iOS devices hell even with the old 30 pin connector yes Im old enough to member that there was a vibrant thirdparty ecosystem of everything And despite Apple having had the chance to lock down the Mseries devices down to the iOS level they didnt and the result is that a bunch of extremely godlevel talented hackers were able to get the SoC GPU to better OpenGL compliance than Apple managed In contrast try the same for Nintendo lol,n1agt88,1.0,1lrgi7x
comment,n1bwj03,tuenmuntherapist,,0,2025-07-04 16:28:43,,,,Even Apple have usbc that works like usbc now Damn it Nintendo,n1agt88,1.0,1lrgi7x
comment,n1c8g6w,distung,,1,2025-07-04 17:28:45,,,,Theyre not the only ones that suck Pixels couldnt do video out through USBC until the Pixel 8 My pixels 4 6 and 7 did not have it But Nexus phones had it before the Pixels existed and Android software supports it out of the box so Google very much likely went out of their way to disable it,n1bwj03,2.0,1lrgi7x
comment,n1b9v39,ZolTheTroll413,,-1,2025-07-04 14:34:42,,,,Nintendo seems worse ngl does Apple brick ur device if you jailbreak it I thought they just dont repair it,n1agt88,1.0,1lrgi7x
comment,n1fado2,walmrttt,,0,2025-07-05 05:06:46,,,,Thats sony,n1agt88,1.0,1lrgi7x
comment,n1aisav,Rayzee14,,-6,2025-07-04 11:52:28,,,,Exactly right I am always surprised Apple and Nintendo havent properly partnered,n1agt88,1.0,1lrgi7x
comment,n1an7m2,staleferrari,,10,2025-07-04 12:23:14,,,,Because neither of them have anything to gain from that,n1aisav,2.0,1lrgi7x
comment,n1azmum,Rayzee14,,-2,2025-07-04 13:39:29,,,,Nintendo get M chips Apple get exclusive cross platform games,n1an7m2,3.0,1lrgi7x
comment,n1b285d,staleferrari,,5,2025-07-04 13:54:01,,,,Ok sure Apple has something to gain if they get Nintendo games But theres no benefit for Nintendo to have those M series chips They sold 150 million Switch 1s despite being underpowered Switch 2 broke sales records despite being underpowered They dont need Apples chips You know what would happen if they use Apple Silicon It would make a Nintendo console much more expensive than it already is greatly reducing the accessibility of their console Besides Nvidia knows gaming,n1azmum,4.0,1lrgi7x
comment,n1byife,suentendo,,1,2025-07-04 16:38:58,,,,Nintendo Switch 2 is not particularly underpowered for its size and price Its pretty impressive how CDPR was able to throw CP2077 at and it runs smoothly something that was choking on home consoles a few years back The only disappointing part of Switch 2s hardware is its LCD,n1b285d,5.0,1lrgi7x
comment,n1e29kd,staleferrari,,1,2025-07-04 23:38:57,,,,Even more reason they dont need the M series chips,n1byife,6.0,1lrgi7x
comment,n1bmu5r,SoCalThrowAway7,,-2,2025-07-04 15:39:54,,,,No apple still does mass layoffs Nintendo treats their devs pretty well with all the money they make,n1agt88,1.0,1lrgi7x
comment,n1c656c,Aristo_Cat,,1,2025-07-04 17:17:12,,,,Lmao what are you even talking about Apple is one of the few companies that hasnt done mass layoffs in the aftermath of COVID,n1bmu5r,2.0,1lrgi7x
comment,n1cd0x4,SoCalThrowAway7,,0,2025-07-04 17:51:42,,,,Apple had 4 rounds of layoffs in 2024 Layoffs in January of this year too,n1c656c,3.0,1lrgi7x
comment,n1cwqt5,Aristo_Cat,,0,2025-07-04 19:37:29,,,,Every company has layoffs The comment specified mass layoffs Apple didnt layoff nearly as many people as almost every other major tech company did Meta cut 13 percent of its total workforce in 2022 and then turned around and did it again in 2023 Amazon cut 19000 jobs in that same time span Google cut 12000 in 23 alone Microsoft cut 10000 Apple has cut a total of less than 1000 jobs over the past 5 years Theyre not even in the same ballpark,n1cd0x4,4.0,1lrgi7x
comment,n1d10ff,SoCalThrowAway7,,1,2025-07-04 20:00:41,,,,So rarer than others but still more than Nintendo,n1cwqt5,5.0,1lrgi7x
comment,n1d29w1,Aristo_Cat,,1,2025-07-04 20:07:28,,,,Correct but at least they let you use the usbc ports on your computer,n1d10ff,6.0,1lrgi7x
comment,n1d3x5l,SoCalThrowAway7,,1,2025-07-04 20:16:21,,,,Okay lol,n1d29w1,7.0,1lrgi7x
comment,n1axkc7,Complete_Item9216,,-3,2025-07-04 13:27:25,,,,Much worse than Apple Its possibly the worst offended in the hardware tech,n1agt88,1.0,1lrgi7x
comment,n1buvt4,hikeit233,,-1,2025-07-04 16:20:20,,,,Its sad to say but apple is actually better than Nintendo in this regard Its pretty damn hard to be worse than apple when it comes to locked down ecosystems,n1agt88,1.0,1lrgi7x
comment,n1bvsq0,PsyJak,,-1,2025-07-04 16:24:57,,,,Yeah theyre even making us use a special SD card And thanks to their stupid virtual cards system I cant use my games across the 3 Switches that I own Dont know why I bothered getting Switch 2,n1agt88,1.0,1lrgi7x
comment,n1c0qof,Fearless-Edge714,,0,2025-07-04 16:50:19,,,,MicroSD express is a storage standard that any company can manufacture cards for its not some special sd card its just not something most devices need the performance of so wasnt popularly known before this console New games are designed to run off ssd class storage and the older forms of SD cards do not fit that bill,n1bvsq0,2.0,1lrgi7x
comment,n1bwoi7,CountlessStories,,-1,2025-07-04 16:29:30,,,,I personally had been calling them the Disney of Gaming but Apple works too honestly,n1agt88,1.0,1lrgi7x
comment,n1byam0,PMs_You_Stuff,,-1,2025-07-04 16:37:50,,,,And people absolutely LOVE apple People are stupid and nothing will change their mind,n1agt88,1.0,1lrgi7x
comment,n1blpkh,tubbis9001,,-2,2025-07-04 15:34:20,,,,Ive said that for years and no one believed me,n1agt88,1.0,1lrgi7x
comment,n1amfxz,kurotech,,-9,2025-07-04 12:18:04,,,,Same shit in a new shell with a little spit and polish I literally have no reason to buy a new switch not that I could afford it these days anyway,n1agt88,1.0,1lrgi7x
comment,n1b0uip,JordanDoesTV,,-5,2025-07-04 13:46:25,,,,What they didare doing to the planet is so fucked up and needs to be talked about daily,n1agt88,1.0,1lrgi7x
comment,n1am0sq,shadowCloudrift,,-9,2025-07-04 12:15:13,,,,Im fully onboard with you actually have discussed this with a friend a long time ago hes a diehard Sega fan with how rabid Nintendo fans are much like Apple I bought the Switch 2 but havent done much with it honestly felt more like a purchase from tariff fears There are barely any Switch 2 exclusives yet this thing sold like hot cakes,n1agt88,1.0,1lrgi7x
comment,n1ap0l8,mschuster91,,4,2025-07-04 12:35:11,,,,Even older titles seem to massively profit from running on better hardware,n1am0sq,2.0,1lrgi7x
comment,n1ex7co,fargerich,,36,2025-07-05 03:19:26,,,,Hey heres a wild idea STOP BUYING THEIR SHIT,,0.0,1lrgi7x
comment,n1hd58a,Nemyosel,,7,2025-07-05 15:19:20,,,,For real Why the fuck would I pay real money for a worse service,n1ex7co,1.0,1lrgi7x
comment,n1fenfu,w1ck3djoker,,5,2025-07-05 05:45:16,,,,Yep I refuse pure trash,n1ex7co,1.0,1lrgi7x
comment,n1fbevg,BringBackBoshi,,1,2025-07-05 05:15:56,,,,Similar tomfoolery with proprietary overpriced memory cards quickly murdered my beloved Vita but Nintendo fans are a different breed so rip them off any way you like theyll never stop buying,n1ex7co,1.0,1lrgi7x
comment,n1iurzm,Dolatron,,1,2025-07-05 20:05:41,,,,Your Switch has been bricked,n1ex7co,1.0,1lrgi7x
comment,n1akv6y,KnifeFightAcademy,,172,2025-07-04 12:07:16,,,,Nintendo all about dat gifgiphyGNvWw0pDL6QRW,,0.0,1lrgi7x
comment,n1ds4wn,Expensive_Tie206,,8,2025-07-04 22:35:15,,,,gifgiphy82EFxN2hzi2DZo4JTz,n1akv6y,1.0,1lrgi7x
comment,n1e0q33,serpentechnoir,,56,2025-07-04 23:29:14,,,,Theyre really giving me excuse after excuse not to buy it considering how excited I was for it,,0.0,1lrgi7x
comment,n1gbx8l,ACanadianNoob,,3,2025-07-05 11:14:23,,,,Ive got my Ally X and thats good enough for me I can repair the controller parts if needed I can replace the battery when it eventually wears out I can install any software I want on it And it emulates Switch 1 well if I get an itch for Nintendo games I have cloud saves that sync up to my main gaming desktop And if the APU inside it becomes obsolete it can still play older games and remote play bigger games from either my main desktop or a cloud service like GeForce Now The era of handheld PC gaming is here and its going to take off once they get a little more affordable or peformant Just look at the Steam Deck outselling all the more powerful PC handhelds because of its affordability,n1e0q33,1.0,1lrgi7x
comment,n1fmyz1,Fadedloko,,1,2025-07-05 07:03:56,,,,I agree This is the first Nintendo system I did not buy Day 1 and at this point I probably will never buy one,n1e0q33,1.0,1lrgi7x
comment,n1hl1kj,winelover08816,,7,2025-07-05 16:00:40,,,,Wasnt USBC and the whole pantiesinabunch European regulatory convulsion about making something universal so people had better access and didnt need to buy a panoply of connectors Doesnt this fly in the face of that or did companies once again get away with anticonsumer nonsense,,0.0,1lrgi7x
comment,n1cf07v,shanelard123,,11,2025-07-04 18:01:46,,,,If I recall correctly didnt they say something similar when the OG switch launched something to the effect of using nonofficial chargers could fry your system due to some wattage issue Ive been charging my OG switch on phone chargers and regular cables so its probably a nothing threat like last time,,0.0,1lrgi7x
comment,n1fxseg,Thewonderboy94,,2,2025-07-05 08:53:00,,,,The issue wasnt exactly with chargers IIRC but it was with how a third party dock would initiate the charge with the console If you just used a standard wall charger directly into the console then I dont think there were any weird issues at all,n1cf07v,1.0,1lrgi7x
comment,n1y02cs,nigerianoilprince69,,1,2025-07-08 06:45:43,,,,tori,n1cf07v,1.0,1lrgi7x
