type,id,author,title,score,created_utc,url,num_comments,subreddit,body,parent_id,depth,post_id
comment,n1c0i49,chronoswing,,-6,2025-07-04 16:49:07,,,,So 4 docks out of the 1000s of docks and hubs that exist on the market have the luxury of being able to have their software updated This isnt the win you think it is The point is Nintendo should be following USBC universal protocols just like the original did Thats the argument people are making Its walled garden bullshit and we shouldnt be defending it,n1bop62,8.0,1lrgi7x
comment,n1b6ucr,pieter1234569,,-6,2025-07-04 14:18:57,,,,Which it clearly isnt here Its not compliant with the normal protocol with extra protection that blocks all others to protect Nintendos interest Thats the worst way in which you can violate this law and as they sold a lot of them already thats going to be a very fun billion dollar fine,n1ane3r,2.0,1lrgi7x
comment,n1bfoec,72kdieuwjwbfuei626,,6,2025-07-04 15:04:09,,,,What law do you think they violated,n1b6ucr,3.0,1lrgi7x
comment,n1bkwd8,DanTheMan827,,2,2025-07-04 15:30:18,,,,Any appropriate cable works here but it needs to be a suitable cable capable of fast charging as well as outputting video Standard power adapters work they just need to be the proper specs Proprietary protocols dont violate the EU law as long as the device supports standard USBPD without artificially limiting the charging speed beyond what is officially supported by a first party option,n1b6ucr,3.0,1lrgi7x
comment,n1ba74e,N0x1mus,,-2,2025-07-04 14:36:25,,,,If its a 3rd party dock thats not being allowed to charge isnt that against it,n1ane3r,2.0,1lrgi7x
comment,n1c03qb,Rudy69,,1,2025-07-04 16:47:06,,,,They actually have a valid reason though When in docked mode it expects a dock with a fan to cool the Switch so it can boost higher to support the better resolution it offers in docked mode,n1ajv77,1.0,1lrgi7x
comment,n1c1ff4,Akrevics,,1,2025-07-04 16:53:45,,,,nah too busy picking on apple,n1ajv77,1.0,1lrgi7x
comment,n1c884y,ThaShitPostAccount,,1,2025-07-04 17:27:38,,,,Id like to think so but Im guessing as long as it can still charge theyll be fine with it This is no doubt in response to me having purchased an HDMI adapter for my switch off Ali Express for 6,n1ajv77,1.0,1lrgi7x
comment,n1c99of,interruptingmoocow,,1,2025-07-04 17:32:52,,,,Nope they only require that it charges with USBC which it does That is the end of the requirement,n1ajv77,1.0,1lrgi7x
comment,n1h7sqx,offinthewoods10,,1,2025-07-05 14:51:03,,,,No this is actually pretty normal for Nintendo they have been doing this thing on their consoles for years,n1ajv77,1.0,1lrgi7x
comment,n1f2w0x,420_69_Fake_Account,,1,2025-07-05 04:03:28,,,,You dont know what your talking about,n1ajv77,1.0,1lrgi7x
comment,n1b94m7,OutlyingPlasma,,-3,2025-07-04 14:30:54,,,,The EU version will just have it patched out and any other versions will brick themselves if anyone attempts to install the EU version Or Just buy a steamdeck,n1ajv77,1.0,1lrgi7x
comment,n1cx3op,chubky,,0,2025-07-04 19:39:30,,,,I thank the EU for their service,n1ajv77,1.0,1lrgi7x
comment,n1ak1km,Chill_Roller,,781,2025-07-04 12:01:28,,,,Keeping the Universal out of USB,,0.0,1lrgi7x
comment,n1brdpg,Xarov,,132,2025-07-04 16:02:37,,,,No no its Unique Serial Bus them probably,n1ak1km,1.0,1lrgi7x
comment,n1hgpse,aykay55,,1,2025-07-05 15:38:08,,,,Undercapable Serial Bus,n1brdpg,2.0,1lrgi7x
comment,n1blubx,International_Cow_17,,24,2025-07-04 15:34:58,,,,Serial Bus,n1ak1km,1.0,1lrgi7x
comment,n1corih,Electronic-Fish-7576,,9,2025-07-04 18:53:40,,,,A bs usb,n1blubx,2.0,1lrgi7x
comment,n1hgtbw,aykay55,,3,2025-07-05 15:38:40,,,,Oh no Im late for the Serial Bus,n1blubx,2.0,1lrgi7x
comment,n1c7z6g,BeepBoopRobo,,3,2025-07-04 17:26:23,,,,You do know that USBC is just an adapter type and not a protocol right right,n1ak1km,1.0,1lrgi7x
comment,n1c9yzt,Chill_Roller,,6,2025-07-04 17:36:22,,,,Yes but thats not a good joke,n1c7z6g,2.0,1lrgi7x
comment,n1c7ajj,nimbusnacho,,1,2025-07-04 17:22:57,,,,Well its still universal in the sense that it Uh Fits lol,n1ak1km,1.0,1lrgi7x
comment,n1c83sx,BeepBoopRobo,,5,2025-07-04 17:27:01,,,,Yes thats absolutely what USBC is a port type Youve nailed it,n1c7ajj,2.0,1lrgi7x
comment,n1di9wn,nimbusnacho,,1,2025-07-04 21:35:41,,,,Yep kinda a misnomer that the connector type doesnt necessarily mean that the signal or user of the cable is actually universal I guess it becomes more of an issue the more actually ubiquitous the connector has become People just expect it to work perfectly for every scenario because it fits,n1c83sx,3.0,1lrgi7x
comment,n1cdxdo,Ajreil,,1,2025-07-04 17:56:16,,,,Undermined Serial Bus,n1ak1km,1.0,1lrgi7x
comment,n1dmvn1,CooCooClocksClan,,1,2025-07-04 22:02:41,,,,Ununiversal Serial Bus,n1ak1km,1.0,1lrgi7x
comment,n1aqtt8,Sonikku_a,,147,2025-07-04 12:46:34,,,,Which third party docks do work Would love to play upstairs on my monitor sometimes but 110 for an official second Switch 2 dock is crazy town,,0.0,1lrgi7x
comment,n1arrfa,Jaws12,,34,2025-07-04 12:52:23,,,,,n1aqtt8,1.0,1lrgi7x
comment,n1arvwo,Sonikku_a,,42,2025-07-04 12:53:11,,,,See now 36 is far more reasonable,n1arrfa,2.0,1lrgi7x
comment,n1diepq,LucifishEX,,-4,2025-07-04 21:36:28,,,,But it wont work without another Nintendo charger because of their proprietary shit And I think they charge what like 50 for a charger or something,n1arvwo,3.0,1lrgi7x
comment,n1din7a,Sonikku_a,,-2,2025-07-04 21:37:51,,,,Ugh theres always a catch,n1diepq,4.0,1lrgi7x
comment,n1djcm9,LucifishEX,,1,2025-07-04 21:41:55,,,,I actually could be mistaken It seems like the proprietary PDstyle protocols are between the dock and the switch and as long as you have a USBC charger output 60w 20v it should work That said Nintendos docking systems are on the line between janky and selfdestructive engineering Not even sure its intentional its just a complex thing You assume the risk of frying your system like early days Switch 1 if trying to do video output with a different charger,n1din7a,5.0,1lrgi7x
comment,n1dji9v,Sonikku_a,,3,2025-07-04 21:42:49,,,,Yeah was just thinking Id been using my MacBook Air charger to charge the Switch 2 sometimes and that works for charging anyway,n1djcm9,6.0,1lrgi7x
comment,n1dqs7x,LucifishEX,,-2,2025-07-04 22:26:44,,,,For charging probably not at risk I believe docking involves overclocking some things adn some other power jankiness,n1dji9v,7.0,1lrgi7x
comment,n1ifnm0,2580374,,3,2025-07-05 18:41:41,,,,When it says it supports 4k at 120hz does the dock that comes with the s2 not support that,n1arrfa,2.0,1lrgi7x
comment,n1j4ga9,Jaws12,,1,2025-07-05 20:58:16,,,,Correct the dock that comes with the S2 doesnt report to support those specs either Not sure why this dock does potentially just marketing BS but 4k60Hz seems fine so far,n1ifnm0,3.0,1lrgi7x
comment,n1jkzff,2580374,,1,2025-07-05 22:33:42,,,,That is incredibly weird I dont think my tv even does 120 but this dock is pretty cheap so im considering just getting it anyways And I think it looks dope,n1j4ga9,4.0,1lrgi7x
comment,n1e32sw,Manaphy2007_67,,2,2025-07-04 23:44:09,,,,Thanks Ill be looking at this at a later date,n1arrfa,2.0,1lrgi7x
comment,n1e4l4o,Jedi_Pacman,,5,2025-07-04 23:53:54,,,,Is that one actually good I saw it on Amazon and reviews were super mixed and couldnt tell if it was recommended or not lol,n1arrfa,2.0,1lrgi7x
comment,n1hks1c,Jaws12,,4,2025-07-05 15:59:17,,,,Reviews are mixed probably because people tried it out before the most recent firmware update which resolved some issues With the most recent firmware the Antank dock I got has worked fine without issue for me thus far,n1e4l4o,3.0,1lrgi7x
comment,n1bnxn0,MillieChliette,,-3,2025-07-04 15:45:21,,,,It doesnt appear to have a fan to cool the console That cant be a good idea,n1arrfa,2.0,1lrgi7x
comment,n1bs6fu,Jaron780,,13,2025-07-04 16:06:39,,,,The fan in the dock does nothing to cool the console the fan only cools the dock itself,n1bnxn0,3.0,1lrgi7x
comment,n1cg1as,vidjagames72,,1,2025-07-04 18:07:08,,,,This is true but Ive also seen that this aftermarket dock does not have vent holes on the bottom going to the switch 2 air inlets like the factory dock You just get whatever makes it around the gaps in that U shaped cavity it sits in It might honestly be fine dont own a Switch 2 or the dock so I couldnt tell you If I did own one and got this dock Id see about adding some vent holes,n1bs6fu,4.0,1lrgi7x
comment,n1d7b58,Jaws12,,1,2025-07-04 20:34:42,,,,Or if you dont plan to have it docked for long periods of time it will likely be fine I only plan to use it sparingly as a travel dock so Im not too worried,n1cg1as,5.0,1lrgi7x
comment,n1bsrqz,epicjakman,,-2,2025-07-04 16:09:38,,,,why would it need to cool the dock the dock is essentially just a usb hub,n1bs6fu,4.0,1lrgi7x
comment,n1btc09,Jaron780,,13,2025-07-04 16:12:29,,,,Because thats how Nintendo designed it Watch any tear down or google it The fan has no connection or air path to the switch console,n1bsrqz,5.0,1lrgi7x
comment,n1bus9a,epicjakman,,9,2025-07-04 16:19:51,,,,oh dang youre right though im still not sure why the s2 needs a fan on its dock while the s1 didnt edit i did some googling and someone said its likely because of the 4k output as well as faster usb connections those can run pretty hot that math checks out I think,n1btc09,6.0,1lrgi7x
comment,n1bvanr,Jaron780,,6,2025-07-04 16:22:25,,,,Probably Nintendo just playing it safe because the Switch 2 does use higher voltage charging which passes through the dock Which is why you cant use the switch 1 power cord for the Switch 2 dock,n1bus9a,7.0,1lrgi7x
comment,n1bvq66,epicjakman,,2,2025-07-04 16:24:36,,,,oh that also makes sense i remember my dad complaining about that when his s2 arrived the power cable thing but now it makes sense,n1bvanr,8.0,1lrgi7x
comment,n1bashb,SidFarkus47,,6,2025-07-04 14:39:28,,,,Im wondering if someone could make a dock that would display switch 1 and 2 Same size port no,n1aqtt8,1.0,1lrgi7x
comment,n1bywxr,KnuxFive,,3,2025-07-04 16:41:01,,,,GC515 from Avermedia covers both and Deck and Ally and iPhone,n1bashb,2.0,1lrgi7x
comment,n1byogz,KnuxFive,,1,2025-07-04 16:39:48,,,,I use the GC515 from Avermedia to capture but Im in a backandforth with them about a tiny screen shake that reoccurs every ten seconds or so Cant get anyone else to confirm or deny it exists,n1aqtt8,1.0,1lrgi7x
comment,n1ec0uv,FuzzCuds,,1,2025-07-05 00:44:45,,,,I saw a comment where what looked to be a generic dock cord for Switch 1whatever else got a firmware update to work with Switch 2 I figured it was some whitelabel hardware so I used the cheapest I could find on Amazon that claimed 4k 60Hz for 14 JEMDO 4K60Hz USB C to HDMI Dock I installed the firmware and works great This is the install firmware and video,n1aqtt8,1.0,1lrgi7x
comment,n1boxtu,LivingOof,,-1,2025-07-04 15:50:23,,,,Honestly just take the dock from room to room when you want to play somewhere else its small enough and just have the necessary cables set up for each TV HDMI 21 and I believe a 60 W USBC Charger,n1aqtt8,1.0,1lrgi7x
comment,n1bubhs,RupeThereItIs,,3,2025-07-04 16:17:29,,,,Its a REAL PITA to carry that dock on a business trip,n1boxtu,2.0,1lrgi7x
comment,n1bpkym,chronicherb,,1,2025-07-04 15:53:36,,,,But its 2025 I should just be able to want it s,n1boxtu,2.0,1lrgi7x
comment,n1ccp3u,Carvj94,,0,2025-07-04 17:50:03,,,,Im guessing theyll open it up at some point but its pretty clear the Switch 2 relies heavily on the fan in the dock so I imagine they want to make it so not just anyone can make a Switch 2 dock,n1aqtt8,1.0,1lrgi7x
comment,n1cjfbp,Sonikku_a,,2,2025-07-04 18:25:06,,,,The fan on the dock is for keeping the dock cool not the Switch There is literally no venting connection holes that go from the fan to the Switch itself,n1ccp3u,2.0,1lrgi7x
comment,n1agt88,StressfulRiceball,,1180,2025-07-04 11:38:09,,,,I keep saying Nintendo is the Apple of the industry and people still arent convinced lmfao,,0.0,1lrgi7x
comment,n1ak5w6,mr_bots,,580,2025-07-04 12:02:19,,,,Id say Nintendo is worse at this point My iPad works surprisingly well with the usb c docks Ive tried with it Picks up power mouse and keyboard external monitor and even Ethernet,n1agt88,1.0,1lrgi7x
comment,n1aw6ny,yellowspaces,,164,2025-07-04 13:19:14,,,,Apple currently looking at Nintendo Write that down WRITE THAT DOWN,n1ak5w6,2.0,1lrgi7x
comment,n1b0qsr,6r1n3i19,,29,2025-07-04 13:45:51,,,,Nah nah what about even more TITANIUM,n1aw6ny,3.0,1lrgi7x
comment,n1d4o6q,LeadershipSweaty3104,,6,2025-07-04 20:20:24,,,,No wait wait wait liquid titanium,n1b0qsr,4.0,1lrgi7x
comment,n1dftam,starcracker11,,2,2025-07-04 21:21:27,,,,at an additional price of 169,n1b0qsr,4.0,1lrgi7x
comment,n1dpim5,kat1795,,1,2025-07-04 22:18:53,,,,,n1aw6ny,3.0,1lrgi7x
comment,n1bvi1m,Scurro,,32,2025-07-04 16:23:27,,,,Wasnt Apple forced to switch to USB C by the EU,n1ak5w6,2.0,1lrgi7x
comment,n1c6mkx,Major_T_Pain,,32,2025-07-04 17:19:36,,,,Correct Apple only plays nice today with third parties bc theyve been sued so many times,n1bvi1m,3.0,1lrgi7x
comment,n1l3tqe,rammo123,,3,2025-07-06 04:47:25,,,,No the EU legislation was coincidental It took them awhile to switch iPhones because theyd pledged to support Lightning for 10 years which they did and then switched the next year,n1bvi1m,3.0,1lrgi7x
comment,n1cqe7x,Skipped64,,8,2025-07-04 19:02:27,,,,they switched to usb c on the ipad before that iirc,n1bvi1m,3.0,1lrgi7x
comment,n1csaxs,miko3456789,,-3,2025-07-04 19:12:50,,,,yes but not on the iPhone yknow the main apple device that people have that they made the most royalty money off of,n1cqe7x,4.0,1lrgi7x
comment,n1csvm4,Skipped64,,9,2025-07-04 19:16:00,,,,comment he replied to was about an ipad though,n1csaxs,5.0,1lrgi7x
comment,n1dted8,Because0789,,-2,2025-07-04 22:43:13,,,,Because they knew they were going to lose and have to switch anyway,n1cqe7x,4.0,1lrgi7x
comment,n1e6l5g,Skipped64,,5,2025-07-05 00:07:17,,,,fact check The iPad Pro 1st gen got USB C in 2018 already while the EU commission references the earliest study as source for the regulation being 2019 It just made sense to move the iPad Pro to USB C given its market and capabilities the timeline does not line up with EU regulations and the changes to the other lineups,n1dted8,5.0,1lrgi7x
comment,n1u2236,Because0789,,1,2025-07-07 16:44:53,,,,Oh yeah there was no way people were discussing it before this single study that happened to be officially used Quick question how long did that study take and why did they feel a need to do the study Someone obviously felt the need to do the study which would have been before the study finished some might say before the study even started,n1e6l5g,6.0,1lrgi7x
comment,n1u4v8j,Skipped64,,1,2025-07-07 16:58:03,,,,okay and then why did they ONLY do it with the ipad and not the iphone if they already knew and did it to the ipad because of that lmao,n1u2236,7.0,1lrgi7x
comment,n2ryce2,Because0789,,1,2025-07-12 19:20:53,,,,Because lots of people without iPhones buy iPads and have USBC,n1u4v8j,8.0,1lrgi7x
comment,n2s0pxe,Skipped64,,1,2025-07-12 19:33:51,,,,,n2ryce2,9.0,1lrgi7x
comment,n3i1hbe,Because0789,,1,2025-07-16 19:39:56,,,,For a lot of people Android is a valid alternative phone That isnt true for tablets there are no comparable Android tablets so even someone that owns an Android phone would likely buy an iPad,n2s0pxe,10.0,1lrgi7x
comment,n3i9ffe,Skipped64,,0,2025-07-16 20:17:41,,,,so hold on youre saying that they put usb C on it because of that so contradicting your own argument,n3i1hbe,11.0,1lrgi7x
comment,n3v41xi,Because0789,,1,2025-07-18 18:40:52,,,,Im saying that because of that it makes the most sense to switch the iPad over to USBC first,n3i9ffe,12.0,1lrgi7x
comment,n1crs4w,mr_bots,,7,2025-07-04 19:09:57,,,,iPads started switching to usb C prior to the EU ruling,n1bvi1m,3.0,1lrgi7x
comment,n1dtheb,Because0789,,-3,2025-07-04 22:43:45,,,,Because they knew the ruling was coming and would have to switch anyway,n1crs4w,4.0,1lrgi7x
comment,n1dy8yu,mr_bots,,7,2025-07-04 23:13:39,,,,The iPad started switching 2018 the EU ruling wasnt until 2022 and wouldnt be in effect until 2024,n1dtheb,5.0,1lrgi7x
comment,n1b9ttw,ProfPeanut,,3,2025-07-04 14:34:31,,,,Wasnt Apple the one who tried to push their own personal USB port that no one else used for ages and ages,n1ak5w6,2.0,1lrgi7x
comment,n1c4t4p,Mister_Brevity,,19,2025-07-04 17:10:31,,,,Lightning came before usbc it was an alternative to micro usb and was much more durable than micro usb was,n1b9ttw,3.0,1lrgi7x
comment,n1blb0e,ShrimpToothpaste,,12,2025-07-04 15:32:20,,,,They pushed usb c on laptops while keeping the damn lightning port on iOS for way too long,n1b9ttw,3.0,1lrgi7x
comment,n1bum74,SueDisco,,0,2025-07-04 16:18:59,,,,Iirc the only reason lighting was kept around so long was because of a promised they made to support it for X amount of years They swapped to usb c as soon as that agreement was over,n1blb0e,4.0,1lrgi7x
comment,n1c6b3j,Lamaradallday,,5,2025-07-04 17:18:01,,,,They swapped to USB C because the EU forced them,n1bum74,5.0,1lrgi7x
comment,n1cc9o2,Eic17H,,4,2025-07-04 17:47:53,,,,Both can be true at once,n1c6b3j,6.0,1lrgi7x
comment,n1cnx9y,quajeraz-got-banned,,1,2025-07-04 18:49:10,,,,Yeah thats bullshit They kept it around because it made them money,n1bum74,5.0,1lrgi7x
comment,n1bz9mf,Floaaf,,1,2025-07-04 16:42:50,,,,FireWire,n1b9ttw,3.0,1lrgi7x
comment,n1cq338,ImDonaldDunn,,1,2025-07-04 19:00:47,,,,Apple was heavily involved in the creation of USB C The only reason they went with Lightning over USB C when phasing out 30 pin connectors was because USB C was not a completed standard,n1b9ttw,3.0,1lrgi7x
comment,n1cpsst,fvck_u_spez,,1,2025-07-04 18:59:14,,,,Nintendo does with hardware what Apple does with software,n1ak5w6,2.0,1lrgi7x
comment,n1dc4oa,-PonderBot-,,1,2025-07-04 21:00:48,,,,I think its more because Apple insisted on keeping lightning for a while then when they finally switch the iPhone to USBC they hardware limited the nonPro models to USB20 speeds Its not the end of the world but imo its kind of a messed up thing to do,n1ak5w6,2.0,1lrgi7x
comment,n1dlbrr,sagebrushrepair,,1,2025-07-04 21:53:28,,,,As a current apple tech I love how easy it is to get a switch charging when compared to a MacBook not negotiating 20V Apple jumps through hoops a sane person could barely imagine to make their stuff hard to repair,n1ak5w6,2.0,1lrgi7x
comment,n1chszj,Additional_Baker7311,,1,2025-07-04 18:16:30,,,,The only reason Apple hasnt done it though is because they would lose sales of iPads instead of selling more of their other things Apple would certainly be worse if they could,n1ak5w6,2.0,1lrgi7x
comment,n1b9e92,LurkinNamor,,-6,2025-07-04 14:32:18,,,,And I think that iPad is working only thanks the EU kept them Apple in check,n1ak5w6,2.0,1lrgi7x
comment,n1bh8kt,stdfan,,19,2025-07-04 15:12:00,,,,Im pretty sure they supported usb video out way before the EU got involved,n1b9e92,3.0,1lrgi7x
comment,n1aoduu,lost_send_berries,,-53,2025-07-04 12:31:04,,,,Apple Watch Airpods and Apple phones tablets and computers are all tied together massively,n1ak5w6,2.0,1lrgi7x
comment,n1aolsm,MoirasPurpleOrb,,67,2025-07-04 12:32:29,,,,There is a massive difference between them working better with their own products as opposed to not working at all with 3rd party products,n1aoduu,3.0,1lrgi7x
comment,n1aqcc5,lost_send_berries,,-34,2025-07-04 12:43:32,,,,The EU is looking into it There is no 3rd party product that can do what an Apple Watch or Airpods does with an iPhone Also the dock is part of the Nintendo Switch 2 it comes free in the box Thats different from when a company tries to cross sell accessories,n1aolsm,4.0,1lrgi7x
comment,n1az2v7,A2ndRedditAccount,,8,2025-07-04 13:36:17,,,,There is no 3rd party product that can do what an Apple Watch or Airpods does with an iPhone There are plenty of 3rd party AirPods you can purchase,n1aqcc5,5.0,1lrgi7x
comment,n1aib7f,Mr_Piddles,,66,2025-07-04 11:49:04,,,,Every time they find a winning formula they find a way to make it extremely onerous to do anything with it,n1agt88,1.0,1lrgi7x
comment,n1ahd4n,Bob_The_Bandit,,188,2025-07-04 11:42:13,,,,Have you met Nintendo fans All they have to do is release another game with cute animals and theyll sell out any garbage hardware they put out,n1agt88,1.0,1lrgi7x
comment,n1ai2jf,EpidemicRage,,86,2025-07-04 11:47:19,,,,And you almost just described Apple fans save for a few words,n1ahd4n,2.0,1lrgi7x
comment,n1aoog7,MoirasPurpleOrb,,53,2025-07-04 12:32:59,,,,Apple continues to make quality products though Overpriced but quality,n1ai2jf,3.0,1lrgi7x
comment,n1cyos2,FlyingBishop,,9,2025-07-04 19:48:20,,,,Nintendo continues to make quality games,n1aoog7,4.0,1lrgi7x
comment,n1e0hj7,MoirasPurpleOrb,,2,2025-07-04 23:27:43,,,,Their hardware has been pretty sub par for awhile though,n1cyos2,5.0,1lrgi7x
comment,n1ezffo,FlyingBishop,,4,2025-07-05 03:36:33,,,,Yeah but I am paying a premium for the games not the hardware You can have the best hardware in the world but it wont run BOTW as well as the switch And I tend to say thats in spite of the hardware but to a certain extent Nintendos vertical integration for their firstparty titles requires them to use shitty hardware They literally are designing the hardware around interesting some might say gimmicky game mechanics and this is all part of a cohesive whole If they had the same approach toward cuttingedge hardware as the competition they would spend more time working on better hardware and less time making the games more fun,n1e0hj7,6.0,1lrgi7x
comment,n1fuer1,funforgiven,,1,2025-07-05 08:18:18,,,,Highend PCs run BOTW much better than the Switch Not sure about Switch 2,n1ezffo,7.0,1lrgi7x
comment,n1fr32d,primalbluewolf,,1,2025-07-05 07:44:51,,,,Do they though Like sure TotK was pretty great but the Zelda franchise aside what else do they have going for them,n1cyos2,5.0,1lrgi7x
comment,n1iguo1,FlyingBishop,,2,2025-07-05 18:48:14,,,,I mean I bought the Switch to play BOTW also bought TOTK and I got a few other games but between BOTWTOTK I was happy with my purchase,n1fr32d,6.0,1lrgi7x
comment,n1asmvc,FortLoolz,,9,2025-07-04 12:57:48,,,,Except for AirPods Max So heavy they make a lot of peoples jaws hurt,n1aoog7,4.0,1lrgi7x
comment,n1d5e76,JoJosMagicJumper,,1,2025-07-04 20:24:18,,,,Really I have them and theyre fine Not at all any kind of discomfort at all Had them for around 4 years now no problems at all,n1asmvc,5.0,1lrgi7x
comment,n4f53ga,JC_Hammer22,,1,2025-07-21 22:03:25,,,,The APM are some of the best headphones ever had I use them every day for hrs and ive had them all including a pair of 2500 Senheissers ive been an unashamed Apple Shill since 2008 when Apple makes something whether its a new device or make their own version of something they become the Standard,n1asmvc,5.0,1lrgi7x
comment,n1ay9mg,MrPinguv,,3,2025-07-04 13:31:32,,,,Got a pair and I must say I love them Now Im used to them but at the start I was amazed at how comfortable they were,n1asmvc,5.0,1lrgi7x
comment,n1c05tz,MoirasPurpleOrb,,1,2025-07-04 16:47:24,,,,Have you tried Bose QC headphones They are so much better than any other over the ear headphone,n1ay9mg,6.0,1lrgi7x
comment,n1b0xj9,FortLoolz,,-1,2025-07-04 13:46:54,,,,I still have an unpleasant experience with them I can use them while lying so they dont push on my head and on my jaw but I have to take them off while sitting or standing,n1ay9mg,6.0,1lrgi7x
comment,n1audtf,UnsorryCanadian,,-4,2025-07-04 13:08:25,,,,Ive seen a lot of reviews for all the airpods theyre not that quality either compared to 50 buds,n1asmvc,5.0,1lrgi7x
comment,n1azb0i,ccai,,6,2025-07-04 13:37:36,,,,Sound wise theyre not that great for the money Their biggest advantage is their ecosystem lockin and the easy sync between multiple devices Thats the main differentiator which works great for those deep in the Apple ecosystem For everyone else grab another cheaper brand,n1audtf,6.0,1lrgi7x
comment,n1be1x1,takethispie,,2,2025-07-04 14:55:58,,,,50 wont have positional dolby atmos nor ANC they dont sound great but if you put together all the features they are at a perfectly fine price point at least the airpods airpods pro and airpods max are another story entirely,n1audtf,6.0,1lrgi7x
comment,n1c5msa,UnsorryCanadian,,0,2025-07-04 17:14:39,,,,You can definitely get ANC for 50 not sure about Dolby though,n1be1x1,7.0,1lrgi7x
comment,n1dwxj2,takethispie,,1,2025-07-04 23:05:25,,,,yeah for 50 you get shit ANC as for dolby head tracking theres only one other I know of sure there is more and that is the oppo x3i which is not a lot less expensive than airpods 4 ANC,n1c5msa,8.0,1lrgi7x
comment,n1ek2hu,BlobTheOriginal,,1,2025-07-05 01:42:43,,,,Nintendo makes quality games Maybe not hardware though,n1aoog7,4.0,1lrgi7x
comment,n1fcw09,hushpuppi3,,1,2025-07-05 05:29:14,,,,Same thing people say about Nintendo games Quality means different things to different people and people are fully capable of bending it to mean whatever they want,n1aoog7,4.0,1lrgi7x
comment,n1fqzdb,primalbluewolf,,1,2025-07-05 07:43:48,,,,Quality hardware Same BS restrictions though There is no technical reason for the iPad mini to not work with any Apple Pencil other than the Pro Its purely a product segmentation reason you can afford a mini therefore you can afford to spend on a Pro Pencil Its a shame Google is busy trying to kill off developer innovation in Android because at this point I dont see the EFB monopoly Apply enjoys changing any time soon,n1aoog7,4.0,1lrgi7x
comment,n1bp2sa,kkeut,,-1,2025-07-04 15:51:04,,,,yeah i absolutely hate apple but i had a highend macbook pro for work and it was a tank,n1aoog7,4.0,1lrgi7x
comment,n1bxfn7,D-S-S-R,,7,2025-07-04 16:33:24,,,,Say what you want about Apple but their shit at least isnt underpowered,n1ai2jf,3.0,1lrgi7x
