type,id,author,title,score,created_utc,url,num_comments,subreddit,body,parent_id,depth,post_id
comment,n1dbhx8,Dom1252,,2,2025-07-04 20:57:22,,,,Bruh almost every single laptop on the market changes clocks and power profiles when you plug in a charger or dock thats normal behavior for the past 20 years or so nothing new to switch It was a thing with dumb chargers with no communication it never was a problem This is literally the most common behavior in handheld electronics including phones tablets And for sure it wouldnt be a problem with USB pd that is now mandatory in EU so Nintendo cant even say theyre too inexperienced to implement it,n1c92tg,6.0,1lrgi7x
comment,n1dcf5z,Edmundyoulittle,,-1,2025-07-04 21:02:24,,,,Phones definitely do not do that and none of the handheld PCs the switch actually competes with do it,n1dbhx8,7.0,1lrgi7x
comment,n1fdau5,Rakn,,1,2025-07-05 05:33:00,,,,None except the ROG Ally for example,n1dcf5z,8.0,1lrgi7x
comment,n1df7wc,DuckSword15,,2,2025-07-04 21:18:03,,,,USB pd contains a handshake thats how it works USB contains a spec for display out Nintendo choosing not to use those makes them anticonsumer All consumer electronics have variable clock rates This is not handled by the dock at all It is all software controlled on the switch Nothing about the switch is unique You could build your own minus the software with off the shelf parts,n1c92tg,6.0,1lrgi7x
comment,n1cfs44,CoffeeSafteyTraining,,-1,2025-07-04 18:05:46,,,,Bro dont think for one second that this wasnt a decision based off of making money,n1c3i1m,4.0,1lrgi7x
comment,n1ci36i,Edmundyoulittle,,4,2025-07-04 18:18:00,,,,I agree its about making money Literally every corporate decision is about making money,n1cfs44,5.0,1lrgi7x
comment,n1b9767,SidFarkus47,,13,2025-07-04 14:31:17,,,,Which ones,n1al98v,1.0,1lrgi7x
comment,n1bf5j2,EvadesBans4,,-13,2025-07-04 15:01:32,,,,Nintendo weirdos are quick to call it misinformation and slow to actually provide any contradicting information If they had any to bring why wouldnt they add it to their comments,n1b9767,2.0,1lrgi7x
comment,n1d6k0r,_Ev4n_,,1,2025-07-04 20:30:37,,,,We dont have links saved to our clipboard to help the misinformed at all hours of the day Do your own research instead of just reading headlines,n1bf5j2,3.0,1lrgi7x
comment,n1am9p6,Kalpy97,,41,2025-07-04 12:16:53,,,,Just another misinformation nintendo switch 2 article,n1al98v,1.0,1lrgi7x
comment,n1av8li,UnsorryCanadian,,20,2025-07-04 13:13:34,,,,Reddit needs to do all it can to spread misinformation about the Switch 2 Did you know if you dont pray to Mr Iwata they brick your Wii and steal your Nintendog I read it on the internet,n1am9p6,2.0,1lrgi7x
comment,n1c32g1,Ace-of-Spxdes,,3,2025-07-04 17:01:52,,,,My Nintendog has been dead since 2011 Mr Iwata can have it,n1av8li,3.0,1lrgi7x
comment,n1c6fy8,UnsorryCanadian,,3,2025-07-04 17:18:41,,,,I have some news about Mr Iwata you may want to hear,n1c32g1,4.0,1lrgi7x
comment,n1ea7ss,Ace-of-Spxdes,,5,2025-07-05 00:32:07,,,,Thats my point theyre both in a better place,n1c6fy8,5.0,1lrgi7x
comment,n1bfdl8,EvadesBans4,,-11,2025-07-04 15:02:39,,,,Why couldnt any of you manage to provide even a shred of contradictory information then If its out there and exists and you care about combating misinformation then you should bring the information Yall are making the claim so bring the information E We know they fucked up deliberately or otherwise USBC on the original Switch so unless theres testing to prove they didnt do it on this one too Im not sure why Id assume they didnt Nintendo has literally already done this exact thing before,n1av8li,3.0,1lrgi7x
comment,n1c63je,UnsorryCanadian,,11,2025-07-04 17:16:58,,,,Why couldnt any of you manage to provide even a shred of contradictory information then We do When someone says Nintendo will brick your system everyone says No they fucking dont they ban you from online bricking is an entirely different thing read the TOS,n1bfdl8,4.0,1lrgi7x
comment,n1bkaw5,None,,10,2025-07-04 15:27:19,,,,Because theres a nintendo hate boner going on and I have bigger fish to fry than entertain you Look up Bleem Lawsuit from Sony and PS5 drift stick refund policy then compare it to Nintendo action and report back to tell me the outrage online about it,n1bfdl8,4.0,1lrgi7x
comment,n1jc2kk,shewy92,,1,2025-07-05 21:41:22,,,,,n1al98v,1.0,1lrgi7x
comment,n1cxl52,chubky,,0,2025-07-04 19:42:12,,,,Which dock did you find Ive only seen one available with mixed reviews about it blocking fans,n1al98v,1.0,1lrgi7x
comment,n1bwqod,fffan9391,,-2,2025-07-04 16:29:49,,,,I know I couldnt use the charging cable I used with my Switch 1 an unofficial one So they changed something,n1al98v,1.0,1lrgi7x
comment,n1cw2yu,darkmacgf,,3,2025-07-04 19:33:46,,,,The Switch 2 needs more power Kinda like how you cant use the PS4 power cable with the PS5,n1bwqod,2.0,1lrgi7x
comment,n1akjr7,Shas_Erra,,35,2025-07-04 12:05:02,,,,3rd party docks were a really good way of killing an S1 when they first came out Some precaution is probably a good thing,,0.0,1lrgi7x
comment,n1aqaey,atomic1fire,,25,2025-07-04 12:43:12,,,,Also people love going for the cheapest possible object Ensuring that they dont buy the cheap dock that has no ventilation is probably a good thing Also the headline says most which implies that some third party docks do work,n1akjr7,1.0,1lrgi7x
comment,n1arj2r,Jaws12,,10,2025-07-04 12:50:57,,,,There are some that work like this one for example,n1aqaey,2.0,1lrgi7x
comment,n1bezo1,theHip,,2,2025-07-04 15:00:43,,,,Anyone bought this from Canada Will I get hit with tariffs,n1arj2r,3.0,1lrgi7x
comment,n1butdl,Jaws12,,2,2025-07-04 16:20:00,,,,It shipped to me directly from China and I didnt get any tariffs so Im sure youll be fine ordering to Canada,n1bezo1,4.0,1lrgi7x
comment,n1bfw6n,EvadesBans4,,2,2025-07-04 15:05:14,,,,My S1 third party dock is just a replacement shell for the official docks guts Safest and cheapest option by a longshot,n1arj2r,3.0,1lrgi7x
comment,n1auz92,Small_Editor_3693,,6,2025-07-04 13:12:00,,,,Theres also a fan in the dock and people have been saying its over heating Not surprised they are pushing people to use their dock with their fan,n1aqaey,2.0,1lrgi7x
comment,n1irhal,OnePeg,,1,2025-07-05 19:47:13,,,,Precaution on the users end is warranted yeah But beyond just people using cheap sketchy docks the Switch 1 did use a different power delivery protocol too Bad docks technically delivered the final bullet but people used them because Nintendo did so many weird things to push people toward their 90 dock that normal USBC docks wouldnt work,n1akjr7,1.0,1lrgi7x
comment,n1cp6v9,quajeraz-got-banned,,-3,2025-07-04 18:55:57,,,,That just means the switch 1 was shit hardware A dock would not be able to kill properly built and protected devices,n1akjr7,1.0,1lrgi7x
comment,n1asmas,N2-Ainz,,-8,2025-07-04 12:57:42,,,,Not happening with the Switch 2 because Nintendo is legally required to use an universal charging protocol,n1akjr7,1.0,1lrgi7x
comment,n1e3gkx,Kdiman,,8,2025-07-04 23:46:35,,,,F Nintendo really,,0.0,1lrgi7x
comment,n1gdb5n,Wladim8_Lenin,,3,2025-07-05 11:26:30,,,,Why are we buying the Switch 2 again Mario Kart,,0.0,1lrgi7x
comment,n1gj6l8,None,,3,2025-07-05 12:14:11,,,,Nintendo can get fucked,,0.0,1lrgi7x
comment,n1hhivu,gidanbo,,3,2025-07-05 15:42:21,,,,Dont buy it,,0.0,1lrgi7x
comment,n1kpk4u,sparkinx,,3,2025-07-06 02:58:35,,,,Nintendo fans will defend this lol,,0.0,1lrgi7x
comment,n1n07ys,Zyphriss,,3,2025-07-06 14:23:40,,,,I can live without a Switch 2 until this sorts itself out,,0.0,1lrgi7x
comment,n1altvw,PalpyTime,,16,2025-07-04 12:13:53,,,,I bought a 3rd party power supply for an Xbox recently and it fried the motherboard beyond repair so I can see possible benefits to such restrictions,,0.0,1lrgi7x
comment,n1bv70q,Edmundyoulittle,,7,2025-07-04 16:21:54,,,,This is exactly what happened with 3rd party docks on the switch 1,n1altvw,1.0,1lrgi7x
comment,n1ann7j,Omnizoom,,16,2025-07-04 12:26:09,,,,This is the thing everyone forgets when it comes to third party stuff It just may not work properly with the hardware,n1altvw,1.0,1lrgi7x
comment,n1apdm6,PalpyTime,,12,2025-07-04 12:37:29,,,,Yeah and there are even worse scenarios That dodgy power supply could have started a house fire with prolonged use so its almost a blessing that I found out immediately that it was no good,n1ann7j,2.0,1lrgi7x
comment,n1axu1k,Thejadedone_1,,5,2025-07-04 13:29:00,,,,I remember reading about thirdparty docs that bricked the OG switch few years back,n1ann7j,2.0,1lrgi7x
comment,n1dbwy5,Dom1252,,-1,2025-07-04 20:59:38,,,,Which was Nintendo fault not the dock manufacturers Either Nintendo is a tiny indie company that cant hire a single competent person for this Or they are doing this on purpose,n1axu1k,3.0,1lrgi7x
comment,n1dc7pm,Thejadedone_1,,0,2025-07-04 21:01:15,,,,I dont see how this is Nintendos fault when third parties are making cheaply made docks that can fuck up the system,n1dbwy5,4.0,1lrgi7x
comment,n1dcryn,Dom1252,,-2,2025-07-04 21:04:22,,,,The devices worked to specs and wouldnt fry anything else switch tried getting more power from them than it could handle and fried itself It was a problem even with expensive devices because Nintendo didnt follow any common protocol or security measures they just yolod it,n1dc7pm,5.0,1lrgi7x
comment,n1ddmrq,Thejadedone_1,,1,2025-07-04 21:09:06,,,,Did you not read my comment These are thirdparty docs doing this not Nintendo lmao Edit they blocked me lmao Well I guess I might as well say what Im going to say You keep saying Nintendo didnt follow any common protocol or security measures but I wasnt able to find anything to support that online Ignore this Im wrong lmao I did find something that supports your claim but its a bit more complicated and nuanced than that To quote somebody from the famiboards The only 3rd party docks that exhibited problems were those that did not adhere to USBC and PD specifications It was not a Switch problem per se these docks could fry any USBC device phone etc that was connected The Switch console itself followed the specifications correctly That said the official Switch dock has a USBC connector that is slightly smaller than spec making it easier to connectdisconnect Third party manufacturers like Nyko attempted to do the same but botched it by not properly spacing the pins and cutting corners with safety circuitry Basically Nintendo had to make the pins a bit smaller than industry standard so that the switch could slide in and out of the dock easily Third parties try to replicate with their docks that but fucked it up because they were basically taking shots in the dark So ultimately it is on third parties for bricking the switch,n1dcryn,6.0,1lrgi7x
comment,n1ddtqm,Dom1252,,1,2025-07-04 21:10:10,,,,Yeah exactly Nintendo didnt follow any specifications for USB and made their own so when you plugged something that works with every8else fine switch fries itself,n1ddmrq,7.0,1lrgi7x
comment,n1dnipn,urrpurr,,0,2025-07-04 22:06:37,,,,I do not think you understand what he is saying Nintendo implementing a USBC dock incorrectly according to standards And then designing the Switch around said faulty dock Therefore switch works with the nintendo dock even if it is incorrectly designed The third party dock that FOLLOWS industry standard of USBC is not the problem of switch being bricked using the third party dock The problem would be on Nintendos side for faulty design of their own Switch and dock not following industry standards in relations to USBC and charging,n1ddmrq,7.0,1lrgi7x
comment,n1elqqi,SkullOfOdin,,6,2025-07-05 01:54:53,,,,Now you cant even use the ports of your own console Crazy times,,0.0,1lrgi7x
comment,n1ap182,skip-all,,8,2025-07-04 12:35:18,,,,That sounds more like Nintendo Serial Bus,,0.0,1lrgi7x
comment,n1e5dqc,_WickedAverage,,4,2025-07-04 23:59:09,,,,I have a Surface Dock 2 and it works really well as a USBC dock not just for my Surface laptop but my Steam Deck and other devices too Its total BS that Nintendo has prevented the Switch 2 from working with docks like this This is just corporate greed I wonder if these proprietary protocols can be adjustedbypassed eventually as jailbreaks become available,,0.0,1lrgi7x
comment,n1c0zsl,Zetra3,,7,2025-07-04 16:51:35,,,,The first switch was similar This isnt new The original switch has voltage issues cause Nintendos USBC isnt the same as traditionally made USBC so if you used third party docks you legit could kill your switch,,0.0,1lrgi7x
comment,n1czk5a,Ironmike11B,,2,2025-07-04 19:52:57,,,,Is there anything that Nintendo DIDNT do to fleece the fuck out of their customers this time around,,0.0,1lrgi7x
comment,n1dof1f,soundssarcastic,,2,2025-07-04 22:12:04,,,,Anyone who bought it deserves this,,0.0,1lrgi7x
comment,n1ds2u1,vegetto712,,2,2025-07-04 22:34:53,,,,I noticed this when I was trying to transfer save data I couldnt use my fucking switch 1 power cord on the switch 2 it refused to recognize it How fucking idiotic,,0.0,1lrgi7x
comment,n1dt2qr,Jupiter_Rainz,,2,2025-07-04 22:41:11,,,,And just when I finally came round to buying this for the kid eugh,,0.0,1lrgi7x
comment,n1dvep3,Mibutastic,,2,2025-07-04 22:55:48,,,,I wanted to buy one for my daughter but Nintendo keeps doing shit that makes it very unappealing,,0.0,1lrgi7x
comment,n1e6hib,StonerTogepi,,2,2025-07-05 00:06:35,,,,I just realized this the other day when I was trying to charge my Switch with my new headphones cable and it wasnt working Funnily enough though my PS5 controller charger cable does work Extremely annoying and scummy,,0.0,1lrgi7x
comment,n1f5lnz,doodoometoo,,2,2025-07-05 04:25:39,,,,Real enshittification going on,,0.0,1lrgi7x
comment,n1fsmea,GimmickMusik1,,2,2025-07-05 08:00:14,,,,Nintendo already did this on the Switch 1 I know people are worried about the fact that they can update the port encryption key but if Nintendo did that theyd also be bricking every first party dock that had already been sold and it would be a lawsuit,,0.0,1lrgi7x
comment,n1g4ms7,yksvaan,,2,2025-07-05 10:04:42,,,,Just dont buy it Theres tens of thousands of games to play already,,0.0,1lrgi7x
comment,n1iqp0l,Jonnyflash80,,2,2025-07-05 19:42:53,,,,I guess thats another reason to not buy one,,0.0,1lrgi7x
comment,n1khwre,rjksn,,2,2025-07-06 02:05:29,,,,Its sad learning you wont play the newnext Zelda game Its happy knowing you can watch someone else grind it for free on youtube,,0.0,1lrgi7x
comment,n27vkzb,TheEternalFlux,,2,2025-07-09 18:06:58,,,,Yet fools still give money to Nintendo just to play the same games with a new coat of paint,,0.0,1lrgi7x
comment,n1efjtu,LtLethal1,,6,2025-07-05 01:09:53,,,,Defeats the fucking purpose of standardizing on the usbc dontchya think eh Nintendo,,0.0,1lrgi7x
comment,n1fsopi,HawkinsT,,1,2025-07-05 08:00:51,,,,I think this makes it just an SB port,n1efjtu,1.0,1lrgi7x
comment,n1dymjv,ThatGuyMike4891,,5,2025-07-04 23:16:00,,,,Continually reinforcing the idea that the Switch 2 is a hard pass,,0.0,1lrgi7x
comment,n1egdvf,Dielectric-Boogaloo,,5,2025-07-05 01:15:50,,,,But by all means Nintendo fanboys keep defending the billion dollar company screwing you over,,0.0,1lrgi7x
comment,n1fbjop,BringBackBoshi,,1,2025-07-05 05:17:07,,,,Oh they will theyll defend anything they do Theyre incredibly oblivious to many many things,n1egdvf,1.0,1lrgi7x
comment,n1cv9xh,vrekais,,3,2025-07-04 19:29:16,,,,Oh fuck right off Why even use USBC if youre going to do that,,0.0,1lrgi7x
comment,n1d33ki,tehaiks,,-3,2025-07-04 20:11:54,,,,So you can charge the device universally you uneducated ham sandwich,n1cv9xh,1.0,1lrgi7x
comment,n1d3zqc,vrekais,,2,2025-07-04 20:16:45,,,,Wow nice reply Its the only display out on the device for what is meant to be a home and portable console Locking it down to one company youre allowed to buy cables and docks from is asinine Sure lets pretend its not an issue because we can use other chargers Not all chargers though as its a 60W input it needs anyway itll take a lower wattage but wont be able to charge and run,n1d33ki,2.0,1lrgi7x
comment,n1db29y,fixxer_s,,1,2025-07-04 20:55:01,,,,Did you read the article My 65W Anker charger would brick a switch This is Apple with extra salt to the wound,n1d33ki,2.0,1lrgi7x
comment,n1fkkpa,vrekais,,2,2025-07-05 06:40:50,,,,Wait what Theyve not implemented proper power delivery handshaking,n1db29y,3.0,1lrgi7x
comment,n1e9vu8,PB4UGeaux2Bed,,3,2025-07-05 00:29:48,,,,Boooooo Nintendo,,0.0,1lrgi7x
comment,n1anecu,ultrabeast666,,8,2025-07-04 12:24:29,,,,Thats just an SB not a USB,,0.0,1lrgi7x
comment,n1ar0s1,Hitohira,,-5,2025-07-04 12:47:47,,,,Underrated comment,n1anecu,1.0,1lrgi7x
comment,n1e8j65,Krymnarok,,3,2025-07-05 00:20:27,,,,Its gotta just be Nintendo fans and people out of the loop parents grand parents breaking these record sales Every time I see something about the Switch 2 it makes me happier about not wanting one,,0.0,1lrgi7x
comment,n1bjfs6,Dassaric,,3,2025-07-04 15:22:59,,,,Doesnt the switch 2 dock also have a cooling solution in it to help with the uplift in performance So it would make sense that third party docks dont work right out the gate,,0.0,1lrgi7x
comment,n1ai9vq,Daniel2305,,7,2025-07-04 11:48:47,,,,They had third party docks brick Switches I am not surprised they did this It isnt like third party docks would affect them otherwise as you cant buy a Switch 2 without on anyway,,0.0,1lrgi7x
comment,n1ajiol,jekpopulous2,,30,2025-07-04 11:57:45,,,,The issue with the OG Switch was that Nintendo designed their own faulty USBC charging implementation rather than using the reference design It wasnt a failure of the spec it was that Nintendo didnt adhere to the spec It wasnt even like cheap 3rd party docks were specifically the issue people were bricking their Switches with regular old phone laptop chargers and USB outlets that work just fine for any other device,n1ai9vq,1.0,1lrgi7x
comment,n1btl95,Bob_A_Feets,,5,2025-07-04 16:13:47,,,,Yep the fact the S1 did not properly support USBPD correctly is absolutely insane And this isnt just a Nintendo issue there are plenty of other devices butchering the USBC spec and causing issues All they have to do is just follow the fucking specs,n1ajiol,2.0,1lrgi7x
comment,n1c2p3p,TheBraveGallade,,4,2025-07-04 17:00:02,,,,Switch came out the year USB PD 2 came out and was designed for years before that consoles take longer so PD wasnt exactly an established standard in the mid 2010s yet,n1btl95,3.0,1lrgi7x
comment,n1dciqi,Dom1252,,2,2025-07-04 21:02:57,,,,Thats ok there were other standards ensuring your device doesnt get fried thats why you can plug old phones into new chargers just fine Nintendo didnt take any security measures,n1c2p3p,4.0,1lrgi7x
comment,n1dlr9k,lazyzefiris,,2,2025-07-04 21:56:02,,,,Its almost if docked Nintento Switch consumes more power than charging phone,n1dciqi,5.0,1lrgi7x
comment,n1dwygx,Dom1252,,-1,2025-07-04 23:05:35,,,,Depends what phone but it doesnt matter every phone has a protection circuit for this even those that charge at double the speed of switch 2 yes there are phones that use twice as much power no phone kills itself because you use different charger even the cheapest Chinese shitbrands Nintendo purposefully or you can claim theyre too inexperienced to hire semi decent people made it so it kills itself,n1dlr9k,6.0,1lrgi7x
comment,n1e7c1j,lazyzefiris,,2,2025-07-05 00:12:19,,,,EDIT eh whatever We live in diferent realities In mine phones used to explode and set on fire a lot in late 2010s I envy you,n1dwygx,7.0,1lrgi7x
comment,n1el26s,Dom1252,,-1,2025-07-05 01:50:00,,,,yeah we do there wasnt a phone that exploded due to charging protocol it was usuallyy faulty batteries samsung was known for this faulty charger usually just fries itself because phones actually do have protective circuits unlike switch 1 nintendo is the only company incompetent enough to not be able to make USB port work or evil enough to knowingly make a device that kills itself I mean I can charge my lenovo laptop my iphone my macbook my xiaomi phone my sony cameras my sony headphones my jbl speaker my valve steamdeck my rollei LED light my godox lights with the same chargers but I cant plug it to switch because it could fry it and in your reality that somehow is the fault of the charger manufacturer just because nintendo couldnt be bothered to either follow already existing specs or at least put in some measures to prevent it from frying itself like a proper handshake for higher voltage instead of requesting higher voltage from the charger than it can handle like WTF those chargers wont supply more than 5V if you just plug in and there needs to be either specific circuit on data pins or handshake depending on protocol but no other device just kills itself,n1e7c1j,8.0,1lrgi7x
comment,n1fpcf7,lazyzefiris,,1,2025-07-05 07:27:16,,,,Just to make sure we are on the same page and you did not list anything irrelevant to discussion and you did fact check the things you are writing All the things you have listed use at least 20W especially sony headphones and jbl speaker have been developed before USBPD 20 protocol was finalized in late 2016 especially 2022 steamdeck and had no USBC faults that made them fry especially lenovo laptops that had USBC charging dying even with OEM power adapter right but I cant plug it to switch because it could fry it You can charge it just fine you cant power the higher power docked setup with it,n1el26s,9.0,1lrgi7x
comment,n1ddkr5,--sheogorath--,,1,2025-07-04 21:08:48,,,,Almost like the pointofsale having standardized connectors is gor shit to be standardized,n1ajiol,2.0,1lrgi7x
comment,n1badoz,SidFarkus47,,0,2025-07-04 14:37:22,,,,I said for years that I didnt get how the EU went after Apple but was fine with this Ninty is the kid friendly console its a usb c shaped hole Of course some kidspeople are going to stick another cord in,n1ajiol,2.0,1lrgi7x
comment,n1ch8r9,YourBobsUncle,,4,2025-07-04 18:13:31,,,,Because the EU regulation was just about the connector,n1badoz,3.0,1lrgi7x
comment,n1bvcjt,Edmundyoulittle,,3,2025-07-04 16:22:41,,,,The switch 1 wasnt bricking due to random cords They were bricking specifically because of 3rd party docks,n1badoz,3.0,1lrgi7x
comment,n1akccx,kytheon,,6,2025-07-04 12:03:35,,,,I saw a video by that Wolf YouTuber about how the port has a small deviation that causes a regular USB C charger to potentially fry it,n1ai9vq,1.0,1lrgi7x
comment,n1ajt00,Seraphem666,,0,2025-07-04 11:59:48,,,,This is my thinking they want to avoid the issue the switch had at launch Since it required more power then the standard usbc stuff at the time Alot of them werent supplying enough power causing the bricking issues People would brick them using their cell chargers,n1ai9vq,1.0,1lrgi7x
comment,n1bjeee,Daniel2305,,1,2025-07-04 15:22:47,,,,I think it might be worse with the Switch 2 Their dock has built in cooling etc If 3rd party ones are not as good and they damage consoles it causes hassle for Nintendo Easier to just make them incompatible,n1ajt00,2.0,1lrgi7x
comment,n1cv21u,EthanBradb3rry,,2,2025-07-04 19:28:03,,,,Nintendo cant help but be some little cucks about everything,,0.0,1lrgi7x
comment,n1dqm9s,Luncheon_Lord,,2,2025-07-04 22:25:43,,,,Whats the point of standardizing the usbc,,0.0,1lrgi7x
comment,n1ehh2s,KinshasaPR,,2,2025-07-05 01:23:38,,,,Nintendo youve changed You used to be cool,,0.0,1lrgi7x
comment,n1enou3,Valiantay,,2,2025-07-05 02:08:58,,,,Such an easy solution to this stop supporting shitty Nintendo,,0.0,1lrgi7x
comment,n1g47h9,Waltu4,,2,2025-07-05 10:00:20,,,,lol And Nintendo fanboys call me nuts and wrong for saying theyre the Apple of gaming Checkmate dorks,,0.0,1lrgi7x
comment,n1dvoth,Complex_Study_3174,,2,2025-07-04 22:57:34,,,,Why yall keep buying this horseshit durr hurr mario zelda Really,,0.0,1lrgi7x
comment,n1bw6ns,tuenmuntherapist,,3,2025-07-04 16:26:57,,,,Why even have usb c then May as well go back to that weird NDS proprietary connector Sigh,,0.0,1lrgi7x
comment,n1c7f3c,Darth_Korn,,8,2025-07-04 17:23:35,,,,So you can charge it with a USB C cable,n1bw6ns,1.0,1lrgi7x
comment,n1dc57t,Dom1252,,1,2025-07-04 21:00:53,,,,Because they wanna sell in EU but they will only do the bare minimum Its like why phones have USB c when they often only support USB 20 and in past many didnt even support fast charging like at that point you can just use a barrel plug,n1bw6ns,1.0,1lrgi7x
comment,n1aiu1t,Rayzee14,,1,2025-07-04 11:52:49,,,,Nintendo about to anger the EU gods,,0.0,1lrgi7x
comment,n1cyc06,Rubadupped,,1,2025-07-04 19:46:23,,,,Ah is this why my usbc earphones dont produce any sound when I connect them to the switch God I hate that they removed 9mm from phones too Cant even charge and have earphones in at the same time anymore and I hate wireless earphones,,0.0,1lrgi7x
comment,n1d2f9c,SillySundae,,1,2025-07-04 20:08:16,,,,Yep fuck Nintendo I considered getting a Switch for party games Not happening ever,,0.0,1lrgi7x
comment,n1d3u3w,None,,1,2025-07-04 20:15:54,,,,To be fair no other Type C power cable works on my Switch 1 dock So this isnt really new,,0.0,1lrgi7x
comment,n1d445j,DapperMarsupial,,1,2025-07-04 20:17:24,,,,Very out of character,,0.0,1lrgi7x
comment,n1d5edq,TheGreatWalrusBily,,1,2025-07-04 20:24:20,,,,Apple japan,,0.0,1lrgi7x
comment,n1d7xau,None,,1,2025-07-04 20:38:02,,,,Lol it keeps getting better s,,0.0,1lrgi7x
comment,n1d9bru,purpldevl,,1,2025-07-04 20:45:41,,,,I think Im done supporting Nintendo Theres no innovation its just building walls around their own garden and angrily attacking the people who love them,,0.0,1lrgi7x
comment,n1da15i,kindrudekid,,1,2025-07-04 20:49:29,,,,I want a dock that can work with switch and steam deck Additional requirements work with CEC have minimum 4 usbc ports I really like the genki style dock its in the charging brick and perfect for travel,,0.0,1lrgi7x
