type,id,author,title,score,created_utc,url,num_comments,subreddit,body,parent_id,depth,post_id
comment,n2pz0lr,Jankyfumunda,,1,2025-07-12 12:58:29,,,,Kind of a travesty they are slowly getting rid of the S Pen across all phones now Its one of those things that made them unique I get its a niche thing and I am one of those avid users of the spen and its Bluetooth functionality In fact i am writing this with my spen Its the main reason I went with an S24U over the S25U but in the same breath if you are paying a premium price for a device they shouldnt be removing useful hardware and support and if they do it should be replaced with something more useful and powerful I cant imagine the bluetooth spen costs all that much to manufacture and implement either Especially since they have been doing it for over 10 years,,0.0,1lwcq92
comment,n2qg49x,enlightened84,,1,2025-07-12 14:39:14,,,,How are people surprised by this The Fold SE was literally the test bed for the Fold 7 It was launched in only two markets but it didnt launch in a vacuum As soon as it sold like hot cakes with no S Pen support it was game over for support on the Fold 7,,0.0,1lwcq92
comment,n2r0ev5,AnyAir5340,,1,2025-07-12 16:25:12,,,,With this approach Samsung will lose its USP All will migrate to Apple,,0.0,1lwcq92
comment,n2t3dzy,Hellguin,,1,2025-07-12 23:08:26,,,,Guess I am not changing phones till this one breaks,,0.0,1lwcq92
comment,n33e1ee,maj0rSyN,,1,2025-07-14 15:44:57,,,,Looks like I wont be upgrading from my S24U to the Z Fold 7 after all What a shame,,0.0,1lwcq92
comment,n39an5t,prismcomputing,,1,2025-07-15 13:29:28,,,,The only reason Im still with Samsung is the spen sucks to be me I guess,,0.0,1lwcq92
comment,n2fmte9,D_Anger_Dan,,1,2025-07-10 21:00:04,,,,Should be Samsang,,0.0,1lwcq92
comment,n2fel94,terribilus,,0,2025-07-10 20:21:06,,,,Itll still work fine with a capacitive stylus of the kind that has existed for 20 years,,0.0,1lwcq92
comment,n2i6zg9,KEVLAR60442,,6,2025-07-11 06:28:00,,,,Capacitive styli lack the precision pressure sensitivity or air command functionality of an active stylus like the Spen,n2fel94,1.0,1lwcq92
comment,n2i7q7b,terribilus,,-2,2025-07-11 06:34:35,,,,And yet they still work fine,n2i6zg9,2.0,1lwcq92
comment,n2i7xas,KEVLAR60442,,6,2025-07-11 06:36:18,,,,Except for in all of the ways that they lack the functionality of an active stylus,n2i7q7b,3.0,1lwcq92
comment,n2idepl,terribilus,,-1,2025-07-11 07:26:08,,,,Yep The active stylus that doesnt work anymore Hence the best stylus is the stylus that works,n2i7xas,4.0,1lwcq92
