type,id,author,title,score,created_utc,url,num_comments,subreddit,body,parent_id,depth,post_id
post,1lwcq92,diacewrb,Samsung Kills S Pen Support for the New Galaxy Z Fold 7,573,2025-07-10 13:28:07,https://www.reddit.com/r/gadgets/comments/1lwcq92/samsung_kills_s_pen_support_for_the_new_galaxy_z/,115.0,gadgets,,,,
comment,n2czbnl,AutoModerator,,1,2025-07-10 13:28:08,,,,We have a giveaway running be sure to enter in the post linked below for your chance to win a Luckeep X1 ebike I am a bot and this action was performed automatically Please contact the moderators of this subredditmessagecomposetorgadgets if you have any questions or concerns,,0.0,1lwcq92
comment,n2de0vw,d-wjr,,143,2025-07-10 14:41:30,,,,The S pen will be gone next year in all their phones I think Sucks for those who like and use it frequently,,0.0,1lwcq92
comment,n2dfnwe,cosmos7,,122,2025-07-10 14:49:18,,,,Price goes up features go down,n2de0vw,1.0,1lwcq92
comment,n2ianxw,GregTheMad,,32,2025-07-11 07:00:43,,,,The enshitification continuous,n2dfnwe,2.0,1lwcq92
comment,n2id4w0,___Snoobler___,,1,2025-07-11 07:23:29,,,,Chinese phones seem glorious but software may be behind I may take a chance on the honor V5,n2ianxw,3.0,1lwcq92
comment,n2ig9uo,DeusSpaghetti,,4,2025-07-11 07:53:13,,,,Battery technology they use might be less safe None of the biggest phone companies use it yet and Samsung wont risk it until its bulletproof,n2id4w0,4.0,1lwcq92
comment,n2igj1y,___Snoobler___,,2,2025-07-11 07:55:35,,,,I had to get rid of my Note 7 while on vacation because the airline wouldnt have allowed me to fly home with it Samsung loves the power,n2ig9uo,5.0,1lwcq92
comment,n2iknvc,NotanAlt23,,-6,2025-07-11 08:35:17,,,,This is one feature that needs to go Its completely useless for like 90 of users,n2dfnwe,2.0,1lwcq92
comment,n2sqbxv,ognarMOR,,1,2025-07-12 21:52:41,,,,Yet many people buy the phone specifically because it has that on feature if you want a phone without it just buy one of the millions that does not have it,n2iknvc,3.0,1lwcq92
comment,n2tw2en,NotanAlt23,,0,2025-07-13 02:04:23,,,,Yes 10 of millions is many people Its still very clearly an insignificant amount or they wouldnt be getting rid of it,n2sqbxv,4.0,1lwcq92
comment,n2df5kq,ab_90,,44,2025-07-10 14:46:54,,,,Itll come back if somehow Apple supports their Pencil on iPhone,n2de0vw,1.0,1lwcq92
comment,n2gq1i6,WolverinesThyroid,,20,2025-07-11 00:30:39,,,,S pen goes away next year The following year they release a new S pen that you buy separately,n2df5kq,2.0,1lwcq92
comment,n2hiidg,ab_90,,13,2025-07-11 03:21:03,,,,And its gonna be called S Pen Pro isnt it,n2gq1i6,3.0,1lwcq92
comment,n2hmgqp,Shiinoya,,11,2025-07-11 03:47:52,,,,Followed by S Pen Pro,n2hiidg,4.0,1lwcq92
comment,n2hqjx5,WolverinesThyroid,,5,2025-07-11 04:16:24,,,,Itll probably be 129,n2hiidg,4.0,1lwcq92
comment,n2i7yer,XTornado,,3,2025-07-11 06:36:34,,,,No it will be S Pen Moire,n2hiidg,4.0,1lwcq92
comment,n2s9t3m,starcube,,2,2025-07-12 20:22:38,,,,It will be called the SPenIS for the way theyll be shafting you,n2hiidg,4.0,1lwcq92
comment,n2id8ys,cjax2,,3,2025-07-11 07:24:36,,,,lol I already had to buy my S Pen separately with my Fold 6 so they already started doing that,n2gq1i6,3.0,1lwcq92
comment,n2dsr6h,DaoFerret,,5,2025-07-10 15:50:21,,,,Feels like the iPhones are big enough to dock the pencil on the side of them now the same as the iPads,n2df5kq,2.0,1lwcq92
comment,n2di7r2,RyuzkN,,1,2025-07-10 15:01:15,,,,Itll most likely never happen since theres neither a reason or a market for it ence why Samsung is also killing it I can understand them supporting stylus on the iPads since they have big screens which are good for both notes and drawing but thats really not the case on the iPhones That would also be a big Fuck you from Apple to Steve Jobs who really disliked them After all one of the main selling points of the first iPhone was not requiring a pen to use its screen,n2df5kq,2.0,1lwcq92
comment,n2f59nc,the_wyandotte,,20,2025-07-10 19:36:10,,,,SPen is legit the main reason I switched back again from Apple I use it constantly all day on both my phone 24 Ultra Not the newest but almost newest and Tab 8 Ultra Its an amazing input tool for things like quick notes,n2de0vw,1.0,1lwcq92
comment,n2id69k,___Snoobler___,,2,2025-07-11 07:23:52,,,,Likewise,n2f59nc,2.0,1lwcq92
comment,n2ge1si,Zoe_Bulbs,,7,2025-07-10 23:22:07,,,,I dont want to hear this I use my pen all the time Translating taking photos drawing etc No no no Lol,n2de0vw,1.0,1lwcq92
comment,n2sho95,NeuroXc,,3,2025-07-12 21:04:38,,,,The S Pen is literally the only reason I would ever consider buying a Samsung phone after all the antiprivacy and overreaching advertising shit theyve been pulling Is this company trying to drive itself into the ground for short term profits,n2de0vw,1.0,1lwcq92
comment,n2i17a8,dyrwlvs,,4,2025-07-11 05:38:42,,,,The S Pen is the only reason I keep coming back to Samsung moment thats gone is the moment I start looking at other brands But maybe thatll be a good thing Ive been wanting a smaller phone,n2de0vw,1.0,1lwcq92
comment,n2d1wu4,joestaff,,267,2025-07-10 13:41:54,,,,Its worth noting that the Fold 7s Main Screen uses the same materials as previous models leaving no technical reason to render pentoscreen input moot I dont know anything but what the screen is made out of isnt the same as what sensors are beneath the screen right,,0.0,1lwcq92
comment,n2d3jlx,gosukhaos,,213,2025-07-10 13:50:09,,,,Idk what the article is on about Samsung phones with stylus support have a Wacom layer underneath the digitizer which they removed in the new Fold,n2d1wu4,1.0,1lwcq92
comment,n2d4dec,None,,55,2025-07-10 13:54:14,,,,Yeah I was gonna say seems odd if they kept the digitizer layer but removed support for it,n2d3jlx,2.0,1lwcq92
comment,n2dojmu,ShinyGrezz,,44,2025-07-10 15:30:28,,,,The new Fold is a lot thinner right So they probably removed it in pursuit of that,n2d3jlx,2.0,1lwcq92
comment,n2ei19g,gosukhaos,,29,2025-07-10 17:46:43,,,,That is what theyre claiming though theres other foldables with Wacom layers that are as thin as the Fold 7,n2dojmu,3.0,1lwcq92
comment,n2jf3u5,gpolk,,2,2025-07-11 12:36:17,,,,Which phones,n2ei19g,4.0,1lwcq92
comment,n2jljpl,DilSilver,,5,2025-07-11 13:12:51,,,,I too would like to know lol to my knowledge no other brand pushes stylus support in the way Samsung does I mean theres no V pen or H pen so most likely he pulled that out if thin air,n2jf3u5,5.0,1lwcq92
comment,n2jnkd0,gosukhaos,,-1,2025-07-11 13:23:47,,,,Oppo Find N5 but its only available in China,n2jf3u5,5.0,1lwcq92
comment,n2sqqmp,ognarMOR,,4,2025-07-12 21:54:59,,,,That phone does not have a stylus though,n2jnkd0,6.0,1lwcq92
comment,n2ig2hx,DeusSpaghetti,,0,2025-07-11 07:51:17,,,,The glass itself is also much thicker and stronger,n2d3jlx,2.0,1lwcq92
comment,n2fs3o1,Naterade804,,16,2025-07-10 21:26:16,,,,Same materials 50 thicker glass for better durability Selective reporting strikes again Its described on Samsungs website,n2d1wu4,1.0,1lwcq92
comment,n2d36ty,_turmoil,,10,2025-07-10 13:48:22,,,,They probably mean the entire display stack What theyre saying is that if the new one is componentwise the same as previous Folds then it probably has the same digitizer that recognizes SPen input and so removal of the actual SPen was made for commercial physical form factor reasons,n2d1wu4,1.0,1lwcq92
comment,n2h7u0n,gtedvgt,,5,2025-07-11 02:14:05,,,,Its not though the digitizer has been removed the ultra thin glass is thicker the internal are probably redesigned theres no reason for them to software lock this,n2d36ty,2.0,1lwcq92
comment,n2dbgq5,tubbis9001,,67,2025-07-10 14:29:13,,,,An S pen enabled Fold would have been my next phone after my S22 Ultra kicks the bucketbut I guess thats not going to happen now,,0.0,1lwcq92
comment,n2dfwfo,cosmos7,,24,2025-07-10 14:50:24,,,,Just requested a S25 Ultra as I suspect it will be one of the last Samsung phones released to have the pen,n2dbgq5,1.0,1lwcq92
comment,n2ei9kb,InsightfulLemon,,13,2025-07-10 17:47:45,,,,Its a nerfed pen at that No Bluetooth features on it anymore,n2dfwfo,2.0,1lwcq92
comment,n2el1f5,cosmos7,,4,2025-07-10 18:00:09,,,,Never used the BT stuff to begin with pen is plenty useful even without BT,n2ei9kb,3.0,1lwcq92
comment,n322h6k,GreggAlan,,1,2025-07-14 11:20:16,,,,The S25 still has the pen charging coil in it but its not used and the hole was changed so the S24 pen wont lock in,n2ei9kb,3.0,1lwcq92
comment,n2dqj2p,Discorhy,,11,2025-07-10 15:39:53,,,,Question What use is the pen really Maybe Im not on my phone enough but I cant think of anything Id need it for Maybe if you draw on your phone or something,n2dfwfo,2.0,1lwcq92
comment,n2drnwi,cosmos7,,53,2025-07-10 15:45:15,,,,Sign documents Draw annotate a document or image Use phone while wearing gloves Use phone when hands are dirty greasy oily Need finer detail than a big finger,n2dqj2p,3.0,1lwcq92
comment,n2emakp,WisestAirBender,,-30,2025-07-10 18:05:56,,,,I very rarely digitally need to sign something And for that I use ilovepdf and an image of my signature Never tried annotating using a pen on my phone so cant say But now that Im not studying formally i dont think Ive had the need to digitally annotate something I live in a hot climate So gloves have never been an issue with any phone If my hands are greasy how is a pen going to help How do i hold the phone How do I get the pen out And wont I need to hold the pen too making that greasy Finer detail for what exactly Most apps are made with fingers in mind And if I mis touch i go back and touch again Im not trying to argue Im just listing down how your points dont really apply to me or I would assume many people The last phone I had was the Note 4 that had an s pen I really like the pen but to be honest I dont think its very useful for the vast majority of people,n2drnwi,4.0,1lwcq92
comment,n2emydh,cosmos7,,30,2025-07-10 18:09:01,,,,Finer detail for what exactly Most apps are made with fingers in mind On this one in particular there are plenty of IT emergencies where Im not near a computer and need to use my phone to remote into something to fix a problem Pen makes it much easier to use shrunkdown controls that arent designed with touch in mind,n2emakp,5.0,1lwcq92
comment,n2jb6gb,Cleb323,,-14,2025-07-11 12:12:20,,,,What are you remoting into from your cell phone Seems like a security concern right there,n2emydh,6.0,1lwcq92
comment,n2kyrp4,cosmos7,,10,2025-07-11 17:10:26,,,,Legitimate question or just snarky assholery If legitimate there are plenty of ways to accomplish it securely no different than using a company laptop with a VPN connection,n2jb6gb,7.0,1lwcq92
comment,n2iwh8t,Spaghetti-Sauce,,8,2025-07-11 10:25:03,,,,You literally asked,n2emakp,5.0,1lwcq92
comment,n2h5wrr,MinistryOfCoup-th,,5,2025-07-11 02:02:51,,,,My biggest use is talking notes or writing down a phone number or job numbers real quick All I do is pull my phone out of my pocket pull the pen out and start writing on the screen Once or twice a year I still get iPhone users who look at me like Im a wizard before they ask about my phone,n2emakp,5.0,1lwcq92
comment,n2dv59e,tubbis9001,,18,2025-07-10 16:01:28,,,,Drawing cropping and annotating are obvious But its also got amazing practical uses too such as a remote camera shutter clicking tiny links on non mobile optimized websites using the phone with gloves on and many many more,n2dqj2p,3.0,1lwcq92
comment,n2ej5fe,gosukhaos,,14,2025-07-10 17:51:41,,,,It doesnt work as remote shutter anymore after they removed BT in the S25U,n2dv59e,4.0,1lwcq92
comment,n2kmyfe,caoshaos,,1,2025-07-11 16:15:01,,,,It does with the S Pen Pro,n2ej5fe,5.0,1lwcq92
comment,n2e8bdx,RandsFlute,,-16,2025-07-10 17:03:15,,,,clicking tiny links on non mobile optimized websites If you ever think you have more money than sense come back to this comment,n2dv59e,4.0,1lwcq92
comment,n2e8qtb,tubbis9001,,16,2025-07-10 17:05:11,,,,I honestly have no idea what you are trying to say here Youve never had a mobile site not function properly and need to force the desktop site to get the link you want,n2e8bdx,5.0,1lwcq92
comment,n2eac0w,RandsFlute,,-13,2025-07-10 17:12:20,,,,Come on man if a website has not taken mobile devices into account you can just zoom in with your fingers if you cant zoom in then the links should be plenty of big because they did take mobile into account Like the only real reason you would want a pen is to draw stuff if you got one without that need then you are just coping for reasons I guess the other guy saying that using it with dirty hands may be applicable but honestly a dedicated rugged tablet would be a better device for that kind of environment,n2e8qtb,6.0,1lwcq92
comment,n2eavx1,tubbis9001,,15,2025-07-10 17:14:46,,,,An S pen is not for everyone and thats okay You dont NEED a pen but its a very nice quality of life feature for those of us that use it If you want a truly unique example you cant get with just a fingerit acts like a mouse cursor when hovered over the screen allowing mouseover functionality like drop down menus,n2eac0w,7.0,1lwcq92
comment,n33g2oi,Droidlivesmatter,,1,2025-07-14 15:54:21,,,,Its the same as headphone jacks and SD cards When more people moved away from them they stopped supporting it Samsung likely listened to the majority of their audience who haad Fold devices They wanted it thinner more durable screen Most people likely didnt use the S Pen on the fold anyway Like I have the S23U and I barely use the S Pen I use it here and there but honestly its faster to use voice to text other parts of the phone and hell Even a literal notepad with a pen because notes tend to be longer than what you can write on a little screen,n2eavx1,8.0,1lwcq92
comment,n2esnr9,Oniryuu,,4,2025-07-10 18:35:53,,,,I was eyeing the fold 7 to draw while on the bus to and from work bus is faster than driving and I would have to pay a lot of money to park downtown as there a waiting list for the company parking lot I have a S23 Ultra and while its okay for some doodles theres a long personal project I am working on thats detailed and finding it difficult with the screen size to get those details I was trying to avoid lugging my S9 Ultra tablet around but it looks like this is what I will have to do,n2dqj2p,3.0,1lwcq92
comment,n2fczdt,TryingT0Wr1t3,,2,2025-07-10 20:13:29,,,,It can also be used to take pictures as a remote,n2dqj2p,3.0,1lwcq92
comment,n2fgcx6,Dartister,,4,2025-07-10 20:29:25,,,,Not on the 25,n2fczdt,4.0,1lwcq92
comment,n2fehcs,Discorhy,,2,2025-07-10 20:20:35,,,,Crazy Seems very useful then,n2fczdt,4.0,1lwcq92
comment,n2drt93,Luxferrae,,3,2025-07-10 15:45:56,,,,I take certain notes on it Easier to keep track separately And sometimes writing can be easier than typing with certain types of notes,n2dqj2p,3.0,1lwcq92
comment,n2gnbhn,None,,1,2025-07-11 00:14:33,,,,I use it to jot down notes constantly at work If I need a gate code or someone wants to give me a phone number its faster to pop out the pen and start writing on the locked screen than to unlock the phone and get to the dial pad or notes app to start typing Also super useful for DS and 3DS emulation Its not a feature I was looking for when I picked up the phone Hell I forgot it was even a thing while looking at phones in the store I noticed it when I got home and was looking it over I went with the S25U because of the sharper lines and smaller pinhole over the pixel series In the end I use it every day though,n2drt93,4.0,1lwcq92
comment,n2gf8mj,Zoe_Bulbs,,0,2025-07-10 23:28:46,,,,I use it a lot for translating copying text from photos drawing and taking photos Its very useful I dont think I will be able to live without It,n2dqj2p,3.0,1lwcq92
comment,n2duo24,jayk82,,9,2025-07-10 15:59:14,,,,As a daily S pen user on a Fold for the last 4 years its pretty unforgivable to remove it,n2dbgq5,1.0,1lwcq92
comment,n2dplcm,titeywitey,,43,2025-07-10 15:35:26,,,,I genuinely wonder how many people used the S Pen regularly on their FoldUltra Judging by the comments youd think a huge percentage I used a fold4 and loved the phone I used the pen once to try it out and never touched it again that I can recall,,0.0,1lwcq92
comment,n2e2yj7,GameBoiye,,27,2025-07-10 16:38:21,,,,Pretty sure thats why they got rid of it They can see in the data they get exactly how many people use it or use it once and never again When it was included in the phone it probably gets more use but when you have to buy it separateand get a bulky case to carry it Im sure the numbers are abysmal You could say they should keep it because the thought of it being there helps sell the phone but Im sure they looked at the numbers and saw 96 of people never used it,n2dplcm,1.0,1lwcq92
comment,n2ep2o3,ogpotato,,17,2025-07-10 18:18:54,,,,the problem is that the reason why the majority of users dont use the spen is because the fold did not come with a dedicated slot for the spen like the note series so youd have to carry that separately or buy a bulky case for the already bulky phone to carry that around So its kind of a selfinduced problem On the other hand adding a slot itself also adds to the size of the phone so I can see why Samsung did not add that to begin with I got the spen for my fold5 and after the first two weeks I forgot that I even had it because it was just sitting in a drawer But back when I had a note Id always use it because it was readily available to me,n2e2yj7,2.0,1lwcq92
comment,n2h8jnd,gtedvgt,,3,2025-07-11 02:18:18,,,,Leaks are aaying they might phase out the s pen on their non foldable phones soon too and the note series got canned and merged into the s series before that While I would love for it to stay its sadly clear that the number of people who use it is so low that samsung is willing to ditch it without fear of too much backlash,n2ep2o3,3.0,1lwcq92
comment,n2l0pcf,foreign_malakologos,,1,2025-07-11 17:19:18,,,,There should be relatively compact cases for the Fold5 that store the pen without getting too bulky I managed to find a thirdparty case for my Fold 4 that allows me to store the Fold5 pen which is much more compact than the Spen they sold with the Fold4 My phone felt like new that way highly recommend it Now I really hope it holds out for at least another year,n2ep2o3,3.0,1lwcq92
comment,n2exsq9,psychocopter,,2,2025-07-10 19:00:17,,,,When I had a note I used the s pen a bunch for mock ups of projects or quick notes I wanted to write down Almost daily I would use it to just record a small note whether that was a shopping list lyrics to a song on the radio in a store to look up later or plansappointments so I didnt forget them I still occasionally miss it now that I have a different phone but its not as much of a deal breaker as removing the audio jack and expandable storage,n2e2yj7,2.0,1lwcq92
comment,n2t6pog,TherapyPsychonaut,,1,2025-07-12 23:27:42,,,,I bought one and once the novelty wore off I never used it,n2e2yj7,2.0,1lwcq92
comment,n2f68vh,the_wyandotte,,9,2025-07-10 19:40:59,,,,On the Fold I almost never used it because it didnt have a slot to fit right into and the pen was rather bulky besides On the 24 Ultra I use it constantly I imagine its like most other tech things the people that dont use a feature are the majority and never have and never will the people that do use it are vocal and its a necessary or critical part of their workflow Im not even upgrading to the 25 Ultra because I use the Bluetooth part of my Spen approximately 250x a day controlling camera,n2dplcm,1.0,1lwcq92
comment,n2eoplb,theninal,,5,2025-07-10 18:17:12,,,,Its going to be a bummer moving forward for me since I use the pen every day Using an Ultra as a work phone so Im constantly taking notes and annotating photos for changes my crews need to make in the field Having a phablet in the future was something I looked forward to because the workflow has been great but now I have no desire to get a Fold,n2dplcm,1.0,1lwcq92
comment,n2e1nl2,AverageInternetUser,,1,2025-07-10 16:32:08,,,,Same got the case too and it was just so bulky,n2dplcm,1.0,1lwcq92
comment,n2i71dy,sioux612,,1,2025-07-11 06:28:28,,,,Have been a User of the phones with pens ever since they came to the normal Samsung phones not a note I think Ive used it like once on my current phone other than that its mainly a fidget toy What I did use religiously in the past was an IR blaster that was awesome and Id trade the silly pen for one of those in a heartbeat,n2dplcm,1.0,1lwcq92
comment,n2kjcna,brokenmessiah,,1,2025-07-11 15:57:53,,,,I used mine like twice and then forgot it existed,n2dplcm,1.0,1lwcq92
comment,n2kzeg0,foreign_malakologos,,1,2025-07-11 17:13:20,,,,Im using the pen to take notes on pdfs and sometimes when following presentations lectures etc Also for shopping lists although for that it would be more comfortable if they activated the front screen for pen input as well Ive got the Galaxy Fold 4 I find the original spen for that one a but bulky so was happy around the end of last year to find out that the Fold 5 pen also works on it and I also found a thirdparty case to actually have it on me all the time Not using it daily but I see no reason to buy a folding phone without pen input So I guess for now its bye bye Samsung unless they come to their senses next year The Honor V5 supposedly supports pen input on the front screen so that might be a decent option to consider Unfortunately it appears to be hardexpensive to get the pen for Honors folding phones,n2dplcm,1.0,1lwcq92
comment,n2ql6uh,The8Darkness,,1,2025-07-12 15:06:12,,,,Its actually quite convenient when you have a galaxy book with pen support The book pen is quite big so you either have extra prockets ti put it or leave it at home Here you can just take the smartphone spen,n2dplcm,1.0,1lwcq92
comment,n2g35k0,Bradcst3r,,6,2025-07-10 22:23:26,,,,Guess Ill keep my fold 6 for a few more years _ツ_,,0.0,1lwcq92
comment,n2dv4zb,diabloman8890,,18,2025-07-10 16:01:26,,,,Counterpoint I havent touched the S Pen for either of my last two Samsung devices Im sure lots of people will tell me what Im missing out on but for me it never stuck,,0.0,1lwcq92
comment,n2g19cq,bart007345,,3,2025-07-10 22:13:19,,,,Same,n2dv4zb,1.0,1lwcq92
comment,n2kjgw0,brokenmessiah,,4,2025-07-11 15:58:27,,,,A situation never came up where it was ideal to use,n2dv4zb,1.0,1lwcq92
comment,n2ww495,Lionheartcs,,2,2025-07-13 15:36:43,,,,I can think of exactly one use case when I had to sign some PDFs the S Pen was handy instead of using my finger to sign,n2kjgw0,2.0,1lwcq92
comment,n2dlu8g,Divingcat9,,11,2025-07-10 15:18:03,,,,This makes me kinda worried about the S Pen situation in the S26 ULtra but lets see what happens,,0.0,1lwcq92
comment,n2dpm9u,fermcr,,12,2025-07-10 15:35:34,,,,Besides the absurd price tag heres another reason not to purchase a Fold 7,,0.0,1lwcq92
comment,n2dvtp1,Leetter,,10,2025-07-10 16:04:42,,,,if you were never going to buy it why should they care what you think,n2dpm9u,1.0,1lwcq92
comment,n2egghm,fermcr,,-4,2025-07-10 17:39:39,,,,Thats the smart thing to do in a company dont care what their clients think s You should be Samsungs CEO,n2dvtp1,2.0,1lwcq92
comment,n2ejnei,Leetter,,8,2025-07-10 17:53:56,,,,You are never going to buy it how could you be there client,n2egghm,3.0,1lwcq92
comment,n2g8lhe,fermcr,,0,2025-07-10 22:52:42,,,,I am their client I have a Samsung but according to your brilliance they shouldnt listen to their clients,n2ejnei,4.0,1lwcq92
comment,n2g1e1a,bart007345,,5,2025-07-10 22:14:01,,,,You definitely shouldnt go into business with that logic,n2egghm,3.0,1lwcq92
comment,n2g8w0w,fermcr,,1,2025-07-10 22:54:17,,,,Im sure your business logic makes way more sense by ignoring your clients s,n2g1e1a,4.0,1lwcq92
comment,n2hrpgb,bart007345,,7,2025-07-11 04:24:45,,,,Do you really need it explained Do you like pink shirts Lets say no Does that mean NO ONE likes pink shirts You dont like stylus with your phone does that mean NO ONE likes a stylus with their phone Believe it or not you are not the only person in the world,n2g8w0w,5.0,1lwcq92
comment,n2erhch,Nabusco,,5,2025-07-10 18:30:12,,,,Ig my S23U will be my last samsung phone for the forseeable future I love the S pen features,,0.0,1lwcq92
comment,n2icqgn,notfromchicago,,2,2025-07-11 07:19:39,,,,The only thing I use my s pen for is to sniff every few weeks to see if it still smells like that,,0.0,1lwcq92
comment,n2x5zh3,Pretend-Tennis8528,,2,2025-07-13 16:26:21,,,,I dont understand the people that are glad its gone and mad at the people that use it Like heated seats in a Texas vehicle They look and feel the same but they have an option you will never use Didnt change the cost any In Minnesota its really nice to have that option Yet its the Texas driver thats happy Minnesota drivers wont have the option of warm assets,,0.0,1lwcq92
comment,n2huzgi,ozymandiez,,3,2025-07-11 04:49:05,,,,Just tested this in the store and it throttles real quick when you push it Seems about 3040 slower than my S25 Ultra,,0.0,1lwcq92
comment,n2kg8r5,EnvironmentalRun1671,,3,2025-07-11 15:43:23,,,,They sacrificed cooling for thinner body,n2huzgi,1.0,1lwcq92
comment,n2hf72m,ProphetPenguin,,2,2025-07-11 02:59:26,,,,Most likely the reason they removed it is because hardly anyone actually uses Its very niche I have an S22 Ultra and have never used the SPen,,0.0,1lwcq92
comment,n2mkg8k,Party_Ad2052,,1,2025-07-11 21:52:54,,,,I was waiting for the release and what a disappointment Ive been with Apple for many years and was about to go back to Samsung Not anymore Im happy Ill save 2K What a turn off no pen support Im waiting for the new IPhone later this month,,0.0,1lwcq92
