type,id,author,title,score,created_utc,url,num_comments,subreddit,body,parent_id,depth,post_id
post,1lx4m18,diacewrb,Robot coyotes protect US military airfields with adorable cyber-ferocity,182,2025-07-11 11:38:27,https://www.reddit.com/r/gadgets/comments/1lx4m18/robot_coyotes_protect_us_military_airfields_with/,77.0,gadgets,,,,
comment,n2j620k,AutoModerator,,1,2025-07-11 11:38:28,,,,We have a giveaway running be sure to enter in the post linked below for your chance to win a Luckeep X1 ebike I am a bot and this action was performed automatically Please contact the moderators of this subredditmessagecomposetorgadgets if you have any questions or concerns,,0.0,1lx4m18
comment,n2jlu1d,padmapadu,,108,2025-07-11 13:14:27,,,,Adorable cyberferocity Wtf,,0.0,1lx4m18
comment,n2jmmn0,blackscales18,,37,2025-07-11 13:18:46,,,,Youll go aww as this cute robot dog rips out your throat for trespassing,n2jlu1d,1.0,1lx4m18
comment,n2jw5be,annonymous_bosch,,13,2025-07-11 14:08:12,,,,You boop its snoot and then it takes your arm off Aww indeed,n2jmmn0,2.0,1lx4m18
comment,n2juxay,Leafan101,,2,2025-07-11 14:02:02,,,,It is just meant to be a silly headline I believe,n2jlu1d,1.0,1lx4m18
comment,n2m4ylz,coolrnt1,,1,2025-07-11 20:34:04,,,,Ai,n2juxay,2.0,1lx4m18
comment,n2l5klm,TheRageDragon,,1,2025-07-11 17:41:33,,,,rbrandnewsentence,n2jlu1d,1.0,1lx4m18
comment,n2j9p7k,Dangerous-Parking973,,59,2025-07-11 12:02:51,,,,However how the robot coyotes will take on robot roadrunners has yet to be determined since that will require advanced capabilities to use catapults giant magnets rocket packs high explosives and painting realistic tunnels on rock faces We must equip our coyotes with the finest in ACME gadgets,,0.0,1lx4m18
comment,n2jhpt7,Sentmoraap,,7,2025-07-11 12:51:24,,,,Robot roadrunners must run much faster than 20 mph 32 kmh,n2j9p7k,1.0,1lx4m18
comment,n2jts40,Dangerous-Parking973,,3,2025-07-11 13:56:13,,,,Thus why we must paint fake tunnels to confuse and disorient the simple minded birds,n2jhpt7,2.0,1lx4m18
comment,n2kxext,try2bcool69,,3,2025-07-11 17:04:10,,,,Time to strap an ACME rocket on their backs,n2jhpt7,2.0,1lx4m18
comment,n2jkkye,TheOriginalJBones,,8,2025-07-11 13:07:31,,,,We cannot afford a roadrunner gap,n2j9p7k,1.0,1lx4m18
comment,n2jtwi5,Dangerous-Parking973,,3,2025-07-11 13:56:49,,,,Agreed we can nigh afford to be caught holding the anvil on this one,n2jkkye,2.0,1lx4m18
comment,n2jwtb3,smurfsundermybed,,3,2025-07-11 14:11:30,,,,First order of business should be an update to the AI depth perception and ability to distinguish between paint on a rock and a tunnel,n2j9p7k,1.0,1lx4m18
comment,n2kb3xs,Dangerous-Parking973,,2,2025-07-11 15:19:40,,,,We are decades away from that Or theyll just make us do captcha to see porn,n2jwtb3,2.0,1lx4m18
comment,n2jw2l7,sirenzarts,,17,2025-07-11 14:07:49,,,,Is anybody reading the article or even looking at the picture This isnt some Boston Dynamics thing its an RC car with a plastic animal on it,,0.0,1lx4m18
comment,n2j77qw,Filtermann,,37,2025-07-11 11:46:26,,,,Does it say ACME on the back,,0.0,1lx4m18
comment,n2jjjea,Wouldwoodchuck,,9,2025-07-11 13:01:41,,,,Hold my t n t,n2j77qw,1.0,1lx4m18
comment,n2ju40k,gadfly1999,,4,2025-07-11 13:57:53,,,,Wile E Coyote just lost his job to AI,n2j77qw,1.0,1lx4m18
comment,n2jlnrf,Miguel-odon,,0,2025-07-11 13:13:29,,,,Peak humor,n2j77qw,1.0,1lx4m18
comment,n2jo2y0,suicidaleggroll,,18,2025-07-11 13:26:32,,,,Robot coyote Its an RC car with a plastic model glued on top What is this propaganda BS,,0.0,1lx4m18
comment,n2js7w9,3-DMan,,7,2025-07-11 13:48:20,,,,The result of five years of development the Coyote Rovers as they are officially called began life as a Boston Dynamics Spot quadruped robot but this turned out to be too slow to intimidate the local wildlife so they were replaced with fourwheeled Traxxas XMaxx motorized cars capable of reaching 20 mph 32 kmh,n2jo2y0,1.0,1lx4m18
comment,n2p2dyc,MagmaHotsguy,,5,2025-07-12 08:16:44,,,,Five years,n2js7w9,2.0,1lx4m18
comment,n2q1kwb,3-DMan,,3,2025-07-12 13:14:43,,,,Probably 4 12 years of fun testing,n2p2dyc,3.0,1lx4m18
comment,n2jr6v4,cmyk_life,,1,2025-07-11 13:43:05,,,,Agreed When this hits the streets of LA and NY it wont headline as adorable,n2jo2y0,1.0,1lx4m18
comment,n2jhebv,parisidiot,,26,2025-07-11 12:49:37,,,,really gross propaganda,,0.0,1lx4m18
comment,n2lcmuj,Imtherealwaffle,,7,2025-07-11 18:14:37,,,,its just a dog on top of an rc car to keep birds and other animals from getting hit by planes Probably the least nefarious thing the us military does,n2jhebv,1.0,1lx4m18
comment,n2juhit,None,,16,2025-07-11 13:59:48,,,,Fwiw its literally just a wolf statue tacked onto an RC car chassis and its only purpose is to scare off animals I still wouldnt call it adorable but were not quite at skynet yet with that one,n2jhebv,1.0,1lx4m18
comment,n2l1d8o,fantasmoofrcc,,6,2025-07-11 17:22:19,,,,Considering what Boston Dynamics has on the go these seem adorable,n2juhit,2.0,1lx4m18
comment,n2mglmw,TheArmadilloAmarillo,,4,2025-07-11 21:32:39,,,,This honestly makes me feel better Basically a roomba,n2juhit,2.0,1lx4m18
comment,n2jixjj,elquanto,,12,2025-07-11 12:58:14,,,,I hate these kinds of posts so much,n2jhebv,1.0,1lx4m18
comment,n2kh1co,parisidiot,,4,2025-07-11 15:47:04,,,,this HECKIN ROBOTIC PUPPER is helping ICE secure the border,n2jixjj,2.0,1lx4m18
comment,n2jlral,EternalBlueNeon,,13,2025-07-11 13:14:01,,,,But theyre adorable,n2jixjj,2.0,1lx4m18
comment,n2kfzyh,victus28,,1,2025-07-11 15:42:15,,,,Nah this is like the least gross propaganda,n2jhebv,1.0,1lx4m18
comment,n2kh7wa,parisidiot,,5,2025-07-11 15:47:55,,,,eh I think propaganda that hides behind quirkiness or cutesyness is really insidious but I see your point they do this shit with the boston dynamics robot dogs too,n2kfzyh,2.0,1lx4m18
comment,n2king1,victus28,,5,2025-07-11 15:54:37,,,,I see your point as well I was thinking about something like an orphan crushing machine but it gives you candy that they say is quirky Though I can see how glazing the military for robot coyotes can be disturbing,n2kh7wa,3.0,1lx4m18
comment,n2ja8pl,doyletyree,,3,2025-07-11 12:06:20,,,,Dont forget the signs with sounds and thoughts Oh no,,0.0,1lx4m18
comment,n2jzgxm,manzanita2,,3,2025-07-11 14:24:30,,,,I was seriously disappointed when I saw the picture,,0.0,1lx4m18
comment,n2jilz7,SweetKenny,,5,2025-07-11 12:56:26,,,,Lets be careful throwing around words like adorable when talking about coyotes You know the meth head of the animal kingdom,,0.0,1lx4m18
comment,n2jnxpk,theHoopty,,13,2025-07-11 13:25:46,,,,Nope I wont stand for the coyote slander Coyotes are brilliant Theyre survivors Theyre adaptable Theyre as different as one human to the next I know they can be dangerous to pets but theyre still spectacular,n2jilz7,1.0,1lx4m18
comment,n2jokgo,2dawgsfkng,,8,2025-07-11 13:29:10,,,,Sounds like what a State operated robotic coyote would say,n2jnxpk,2.0,1lx4m18
comment,n2jpunk,theHoopty,,7,2025-07-11 13:36:05,,,,Yelp yelp Dont fear me Im just a glorified scarecrow Unlike those Boston Dynamics snitchingass copdog robots,n2jokgo,3.0,1lx4m18
comment,n2jmr9p,blackscales18,,2,2025-07-11 13:19:28,,,,Even moreso when theyre military robots,n2jilz7,1.0,1lx4m18
comment,n2jofk1,Snarky_McSnarkleton,,2,2025-07-11 13:28:26,,,,Just keep them away from tunnels painted on a solid wall,,0.0,1lx4m18
comment,n2jvnhd,MaverickDago,,2,2025-07-11 14:05:42,,,,Fuck they attach those to AI and half my coworkers are out of jobs,,0.0,1lx4m18
comment,n2jzu7f,RosettaPotato,,2,2025-07-11 14:26:17,,,,The military has now left itself vulnerable to robot roadrunners,,0.0,1lx4m18
comment,n2kdy36,hallofgamer,,2,2025-07-11 15:32:50,,,,A RC car with a coyote decoy taped to it isnt a robot coyote,,0.0,1lx4m18
comment,n2o2a7z,OldWrangler9033,,1,2025-07-12 03:14:26,,,,Totally agree with that Started out as Spot and down graded to computer driven RC car with Coyote statue on it isnt a robot,n2kdy36,1.0,1lx4m18
comment,n2lr06i,devicehigh,,2,2025-07-11 19:24:37,,,,The word adorable does not go with US military,,0.0,1lx4m18
comment,n2ly1gj,hotlavatube,,2,2025-07-11 20:00:04,,,,RoboCoyotes eh looks up predator list Deploy the robocougars The arms race of robocritters has begun,,0.0,1lx4m18
comment,n2o2dmh,OldWrangler9033,,1,2025-07-12 03:15:04,,,,No no no wait wait wait robocougars would endanger young men in the US Army,n2ly1gj,1.0,1lx4m18
comment,n2o2jmh,OldWrangler9033,,2,2025-07-12 03:16:12,,,,Why bother with statues on top of the RC Just RC cars running after critters would be enough Their not even robots nothing moves in statue This is bad comedy of piece,,0.0,1lx4m18
comment,n2pqzw8,AccessMaterial5203,,2,2025-07-12 12:03:46,,,,When I was in the military part of my job was to fund the annual coyote kill contract Wed hire pest professionals to trap and kill them on the flight line and around base,,0.0,1lx4m18
comment,n2kgf4h,BakaWolfy,,1,2025-07-11 15:44:12,,,,they were replaced with fourwheeled Traxxas XMaxx motorized cars capable of reaching 20 mph 32 kmh Adding plastic coyote dummies to ride on the platforms provided them with the right balance of cute and alarming at a total cost of about US3000 each Damn how does gluing a plastic coyote add 2000 of value to an XMaxx And only 20mph Traxxas advertises 50 mph for the XMaxx,,0.0,1lx4m18
comment,n2kgfuh,_dactor_,,1,2025-07-11 15:44:18,,,,Hey I remember this episode of Black Mirror,,0.0,1lx4m18
comment,n2kupxg,BullFishMother,,1,2025-07-11 16:51:51,,,,Way to normalize our overlords attempts at surveillance,,0.0,1lx4m18
comment,n2kvwyd,drjesus616,,1,2025-07-11 16:57:20,,,,Those are Traxxas XMaxx Maxxes with a tray such a cute body option for them But robot thats a stretch I just noticed 2 have the widemaxx kit see the coyote on the right Has a narrower wheelbase he was the prototype,,0.0,1lx4m18
comment,n2l0oha,Possible_Stick8405,,1,2025-07-11 17:19:12,,,,Its wild how they skipped right over autonomous green laser emitters birds perceive the green light as a solid object But its cool that some kid gets the GI Bill for driving a 3000 remote controlled coyote mannequin around an airfield Thank you for your service future Goose War veteran,,0.0,1lx4m18
comment,n2nv6cf,Dememon,,1,2025-07-12 02:27:59,,,,Traxxas XMaxx with dog body,,0.0,1lx4m18
comment,n2ojcvt,humble-bragging,,1,2025-07-12 05:20:19,,,,Now I want to see an action video of those pneumatic chicken guns mentioned in the article,,0.0,1lx4m18
comment,n2qxp44,oz81dog,,1,2025-07-12 16:11:04,,,,Hey not just get real coyotes and set up an invisible fence around the runway seems a lot cheaper and easier those shock collar things work great,,0.0,1lx4m18
comment,n2rtw4v,Illustrious-Cookie73,,1,2025-07-12 18:56:55,,,,You will never get a job with a military contractor in the US with that attitude,n2qxp44,1.0,1lx4m18
comment,n2kmzbi,Abystract-ism,,0,2025-07-11 16:15:08,,,,Im sure NOTHING will go wrong with thisthe military will DEFINITELY keep this out of the wrong hands Its like the premise to so many movies,,0.0,1lx4m18
comment,n2ldxnv,Imtherealwaffle,,3,2025-07-11 18:20:56,,,,yea i hope a traxxas rc car with a plastic coyote glued to the top of it doesnt fall into the wrong hands,n2kmzbi,1.0,1lx4m18
comment,n2mghx9,Abystract-ism,,0,2025-07-11 21:32:06,,,,I misread it as them making them like the Boston robotic dogs,n2ldxnv,2.0,1lx4m18
comment,n2mgks3,Imtherealwaffle,,1,2025-07-11 21:32:32,,,,my bad,n2mghx9,3.0,1lx4m18
