type,id,author,title,score,created_utc,url,num_comments,subreddit,body,parent_id,depth,post_id
comment,n2ur2wc,Davoserinio,,3,2025-07-13 05:51:20,,,,Why he say fuck me for Amiga 600,n2uax2z,2.0,1lyhrx3
comment,n2vbjjn,OzBurger,,3,2025-07-13 09:05:08,,,,1200 with 030 equivalent please,n2uax2z,2.0,1lyhrx3
comment,n2ufa65,Snipedzoi,,4,2025-07-13 04:16:12,,,,Its fpga you can do that,n2u5odc,1.0,1lyhrx3
comment,n2u3j1c,rdcpro,,34,2025-07-13 02:53:01,,,,The Commodore VIC 20 was my first computer I learned Forth programming on that computer,,0.0,1lyhrx3
comment,n2ub1bv,the_quark,,5,2025-07-13 03:45:28,,,,Mine too Though my Grandad had worked out a deal with the local computer store where we got a VIC20 until the C64 came out a few months later so I only had it for a few months My C64 had a serial number under 10000 and had the jiffy clock update bug so that the clock ran twice as fast as it should,n2u3j1c,1.0,1lyhrx3
comment,n2udeae,rdcpro,,4,2025-07-13 04:02:31,,,,I still have a box of S100 boards I dont know what to do with Those old systems were a big part of my formative years I cant throw them away,n2ub1bv,2.0,1lyhrx3
comment,n2udn4a,the_quark,,3,2025-07-13 04:04:17,,,,Sadly my original C64 gave up the ghost so long ago that I replaced it with another C64 However I do have the serial number sticker from the bottom of it mounted on a card in a frame in my home office,n2udeae,3.0,1lyhrx3
comment,n2ue4se,rdcpro,,6,2025-07-13 04:07:49,,,,Back in the 80s I did a lot of work for a guy that made theatrical lighting systems that were based on the C64 He bought every used one he could get his hands on pulled the board and put it in his enclosure I think for a time he essentially owned the market for those things EditIn Southern California,n2udn4a,4.0,1lyhrx3
comment,n2ulasc,_scyllinice_,,19,2025-07-13 05:02:34,,,,In case anyone doesnt know the main board is the Ultimate 64 EliteII made by Gideon the same guy that made the UltimateII the best cartridge and tape drive emulator for the original hardware This is effectively a ready built machine that is plug and play so you dont have to source a case and keyboard I believe its actually cheaper this way than buying and building yourself I have a Commodore 128 and an UltimateII so I dont need one of these but its still tempting,,0.0,1lyhrx3
comment,n3273pb,H3llR4iser790,,2,2025-07-14 11:53:35,,,,It is cheaper at 299 A couple years ago I briefly had this crazy idea where I wanted to build a C64 completely new I considered two avenues using an Ultimate64 board or a replica board that accepts original chips or better modern rebuildsalternatives All considering IIRC the bill of materials came at around 400 EURUSD for the build,n2ulasc,1.0,1lyhrx3
comment,n2u0m4q,ZorakOfThatMagnitude,,28,2025-07-13 02:33:47,,,,Im not normally one for gadget nostalgia but this one has got me putting stuff in the shopping cart,,0.0,1lyhrx3
comment,n2u6b89,burhop,,20,2025-07-13 03:12:01,,,,Everyone knows the Radio Shack Color Computer was better I havent got to say in over 40 years,,0.0,1lyhrx3
comment,n2vauaj,PythagorasJones,,8,2025-07-13 08:58:14,,,,The TRS80 was something that was always referenced in computer magazines back in the 80s but I think I only saw one or two in my life In Ireland wed get most of our magazines in from the UK Theyre always be sample BASIC snippets but usually a full programme included that youd type in Because wed have the different dialects of BASIC there would be a listing for C64 the Amstrad CPCs the Sinclair Spectrum and then the TandyDragon which was the European version of the TRS80 While Id generally be referring to the C64 and Amstrad portions depending on whose house we were in I was always fascinated to read the different versions and try to make sense of them I was most interested when the code was printed once but youd have a small section noting a few lines of difference for a particular computer My brain would spool trying to figure out why those differences were needed,n2u6b89,1.0,1lyhrx3
comment,n2vrd55,cataath,,2,2025-07-13 11:32:39,,,,Never had much love for the Trash80 but I did way more coding on it that on my C64 There C64 games were just too enticing,n2vauaj,2.0,1lyhrx3
comment,n42w5f6,Adventurous_Meal1979,,1,2025-07-19 23:40:44,,,,Agreed Not everything from the past was great and the TRS80 and Dragon computers prove that Using a CoCo core on the Mister and that awful green graphics mode made my head spin,n2vrd55,3.0,1lyhrx3
comment,n2un5e7,The_Tony_Iommi,,3,2025-07-13 05:17:44,,,,You mean the Atari,n2u6b89,1.0,1lyhrx3
comment,n2u856t,PapalocoCO,,1,2025-07-13 03:24:57,,,,Im so happy for you,n2u6b89,1.0,1lyhrx3
comment,n2ute76,Simonic,,9,2025-07-13 06:11:43,,,,Cant see Commodore 64 without the line You think your Commodore 64 is really neato going through my head,,0.0,1lyhrx3
comment,n2whc7o,Hydra_Master,,4,2025-07-13 14:21:36,,,,What kind of chip you got in there a Dorito,n2ute76,1.0,1lyhrx3
comment,n2u8haz,Junglegymboy,,8,2025-07-13 03:27:19,,,,I may be too young to remember the commodore but Im not too young to appreciate it,,0.0,1lyhrx3
comment,n2u8y0h,jam3s2001,,5,2025-07-13 03:30:38,,,,They going to start up production some new 1702s to go with it Because I actually need one of those A new 64 is nice and all but CRTs are overinflated and commodore made a decent screen,,0.0,1lyhrx3
comment,n2xdbqo,MrFartyBottom,,3,2025-07-13 17:03:09,,,,Use a modern OLED with a CRT screen filter and HDR colour compensation,n2u8y0h,1.0,1lyhrx3
comment,n2ukv1i,ImmoralityPet,,3,2025-07-13 04:59:04,,,,If they did it would cost well more than the inflated old ones Almost any CRT is way cheaper than what it originally went for even moreso when you adjust for inflation CRTs havent gotten any cheaper to manufacture,n2u8y0h,1.0,1lyhrx3
comment,n6bm40l,Important-Antelope-7,,1,2025-08-01 09:50:27,,,,No the FPGA RGB Commodore wont get real CRTs,n2u8y0h,1.0,1lyhrx3
comment,n2u0urk,joevinci,,22,2025-07-13 02:35:21,,,,Dont need it My original C64 still runs,,0.0,1lyhrx3
comment,n2u8id9,SidFarkus47,,5,2025-07-13 03:27:32,,,,Damn thats incredible I hope a lot of people who have lost theirs in whatever way get this,n2u0urk,1.0,1lyhrx3
comment,n2z0ll9,DeadOnToilet,,1,2025-07-13 21:57:39,,,,Might want to recap it if you havent already,n2u0urk,1.0,1lyhrx3
comment,n2z3gsc,joevinci,,1,2025-07-13 22:13:28,,,,Nah but thanks for the tip The last time Ive had to replace a cap was when I fried my xbox 20 years ago while doing some mods and ended up damaging a pad in the process Besides I have a job and a family now and no time to replace otherwise working PCB components for fun,n2z0ll9,2.0,1lyhrx3
comment,n2ue4bw,OatmealSunshine,,5,2025-07-13 04:07:44,,,,Id love to get one just to play with my 5 year old son so he can so he can have that same experience I had,,0.0,1lyhrx3
comment,n2xdypn,MrFartyBottom,,4,2025-07-13 17:06:17,,,,Tried it with my nephew they are not interested as they have been spoiled by Fortnite and Minecraft,n2ue4bw,1.0,1lyhrx3
comment,n33m2y9,OatmealSunshine,,1,2025-07-14 16:22:40,,,,I understand this completely My son is 4 and hasnt been exposed to many modern games He still really appreciates Atari games and loves ms PacMan so maybe theres hope,n2xdypn,2.0,1lyhrx3
comment,n4d69lt,ExeCuteUK,,1,2025-07-21 16:27:17,,,,Have you got access to a 2nd hand one,n2ue4bw,1.0,1lyhrx3
comment,n4dak1c,OatmealSunshine,,1,2025-07-21 16:47:18,,,,I do not,n4d69lt,2.0,1lyhrx3
comment,n2w42k3,cpnfantstk,,6,2025-07-13 13:03:34,,,,Now to find those old Compute magazines that included games or applications that youd have to type in the code Took hours At times it was worth it God forbid there was a typo though Youd have to wait for the next issue for the fix TurboTape was revolutionary,,0.0,1lyhrx3
comment,n2wq1i8,ItHurtsWhenIP404,,3,2025-07-13 15:06:13,,,,Internet archive gotta have something to find that,n2w42k3,1.0,1lyhrx3
comment,n2wes7x,jnmjnmjnm,,2,2025-07-13 14:07:42,,,,You could probably OCR them,n2w42k3,1.0,1lyhrx3
comment,n2wyi10,Darnocpdx,,2,2025-07-13 15:48:40,,,,Hours to type forever to double check for typos in number strings,n2w42k3,1.0,1lyhrx3
comment,n2yo2g4,RaelaltRael,,1,2025-07-13 20:53:21,,,,I blame my severe myopia on all those PEEKS POKES,n2wyi10,2.0,1lyhrx3
comment,n2xcrl5,djshadesuk,,4,2025-07-13 17:00:26,,,,All hail Peri Fractic,,0.0,1lyhrx3
comment,n42wxb4,Adventurous_Meal1979,,1,2025-07-19 23:45:20,,,,Im sure hes a great guy but his style is just so cringe,n2xcrl5,1.0,1lyhrx3
comment,n2xdnfp,Vaestmannaeyjar,,8,2025-07-13 17:04:45,,,,Im the target audience 52 C64 as my first computer disposable income for toys but I probably still wont get it I have enough junk in my place as it is,,0.0,1lyhrx3
comment,n2u6oms,RestAndVest,,17,2025-07-13 03:14:37,,,,Dont get the nostalgia for old video game systems I had the Atari 2600 growing up and have no desire to play Pole Position ever again What exactly are you going to do with a c64,,0.0,1lyhrx3
comment,n2u8j0k,TAU_equals_2PI,,4,2025-07-13 03:27:39,,,,The ones where they included dozenshundreds of the old popular games with the unit I get This I dont get not for 300 In fact I predict theyll never get enough preorders to justify going ahead with production The few people who want a Commodore 64 can go on Ebay and buy an original one for less than 300 Then theyll have to figure out how to acquire the games and how to load them onto it Hint You cant connect a Commodore 64 to the internet,n2u6oms,1.0,1lyhrx3
comment,n2u99qq,xXgreeneyesXx,,11,2025-07-13 03:33:01,,,,Thats one reason to buy this one you can use flash drives to connect to it Now will I buy one Probably not But the rise in hardwareemulation is neat The C64 isnt exactly a game console either it was a full computer That means its homebrew library is less homebrew and just programs people have spent the past 50 odd years on Much easier to program for than say an NES,n2u8j0k,2.0,1lyhrx3
comment,n2uuui5,RekHek,,7,2025-07-13 06:24:45,,,,Why cant you The C64 had modems and you can still dial in to the internet,n2u8j0k,2.0,1lyhrx3
comment,n2yctvt,Xerxero,,1,2025-07-13 19:58:04,,,,Does it even support tcp or any modern protocol And where do you find a dial up these days,n2uuui5,3.0,1lyhrx3
comment,n2uxwav,rebbsitor,,11,2025-07-13 06:53:57,,,,Hint You cant connect a Commodore 64 to the internet You can actually there have been network adapters for the C64 for years But you could also just download whatever and put it on an SD card Thereve also been SD card readers for it since at least the mid 2000s It has an active community continuously developing new hardware and software for it Theres probably very little someone can think of that it cant do with some already existing add on or other,n2u8j0k,2.0,1lyhrx3
comment,n2x3b8j,FrozenLogger,,3,2025-07-13 16:12:46,,,,We used to trade video games for the C64 over the phone useing its modem back in 1984 Full commercial games too I am pretty sure we could come up with something today,n2u8j0k,2.0,1lyhrx3
comment,n337hl8,makingnoise,,1,2025-07-14 15:13:29,,,,As someone whose first computer was a ToysRUs firesale metalclad TI 994A where I quickly shifted to PC I encountered a Commodore once in the wild just once and I remember how freaking long Spy vs Spy took to load and by the early 90s it seemed like quaint old tech Hell for that matter I only ever saw an Atari home computer in the wild once as well an Atari ST that by that time was a relic I had NO nostalgia for the C64 in my mind it was barely a step above the Atari 2600 It wasnt until COVID and I started getting into repairing old consoles and watching Adrians Digital Basement that I realized what an amazing piece of tech the C64 was nor that development for it was still very much alive and well I just picked up my first C64 the other day an NTSC C64C I wish I had known that the VIC2Kawari only works on the breadbin I was hoping to switch between NTSC and PAL Just wired up a dogchewed NES controller tested my Phoenix CPS10 power supply and now am looking into SVideo options for videoout and trying to figure out if I want to go cheap PI1541 RAD expansion or expensive Ultimate IIL for my expansion cart,n2u6oms,1.0,1lyhrx3
comment,n2u6pye,One-Man-Wolf-Pack,,3,2025-07-13 03:14:53,,,,So do you still have to contend with 20 minute loading times,,0.0,1lyhrx3
comment,n2vw6c0,coani,,2,2025-07-13 12:09:46,,,,Just use the cracked turboloader versions,n2u6pye,1.0,1lyhrx3
comment,n2x2qfi,FrozenLogger,,2,2025-07-13 16:09:54,,,,Was it ever 20 minute load times Carts were near instant rips to the floppy were not too bad and an SD card today is really quick,n2u6pye,1.0,1lyhrx3
comment,n2x723o,One-Man-Wolf-Pack,,2,2025-07-13 16:31:51,,,,Oh god yes I had one Im old That was the tape load time Discs were faster I never tried a cart my unit didnt have a cart port,n2x2qfi,2.0,1lyhrx3
comment,n2xdl35,FrozenLogger,,1,2025-07-13 17:04:26,,,,All commodore 64s came with a cartridge slot You have to be thinking of something else That was one of their major selling points games as fast a console but also a computer That was were you plugged in the isepick cart and ripped the games to a floppy I never had a tape drive Edit what DID take a long time in 1984 was downloading entire games from underground sites using the commodore 64 modem 300 baud to pull in a cart rip would take all night,n2x723o,3.0,1lyhrx3
comment,n2xhtvf,One-Man-Wolf-Pack,,3,2025-07-13 17:25:00,,,,Well I was playing my dads C64 in the late 80s I dont think I ever saw a cart slot Most games were sold on disc or tape in the shops I went to I was young and probably didnt realise I could run carts In 1991 or so I got a Genesis and never looked back,n2xdl35,4.0,1lyhrx3
comment,n2xujay,shokalion,,2,2025-07-13 18:26:40,,,,The cartridge slot on the C64 was on the back of the computer on the right side as you look from the front I have a breadbin c64 and the c64c and they both have one,n2xhtvf,5.0,1lyhrx3
comment,n2xqf1l,FrozenLogger,,1,2025-07-13 18:06:11,,,,I got an Amiga in 1988 such a great machine at the time,n2xhtvf,5.0,1lyhrx3
comment,n2xcvq8,MrFartyBottom,,2,2025-07-13 17:00:59,,,,The MiSTer FPGA loads C64 disk cart and tape images instantly,n2u6pye,1.0,1lyhrx3
comment,n2umdt7,VividSchedule2791,,3,2025-07-13 05:11:27,,,,Does it come with Strip Poker,,0.0,1lyhrx3
comment,n2uoi01,Xephhpex,,2,2025-07-13 05:29:05,,,,With Sam Fox Not sure that was on C64 but could be wrong,n2umdt7,1.0,1lyhrx3
comment,n2vmwkn,BowsersMuskyBallsack,,1,2025-07-13 10:54:40,,,,It most certainly was on the C64 I remember it well since I discovered greyscale boobs did as little for me as color ones in magazines,n2uoi01,2.0,1lyhrx3
comment,n2uwbhr,krnrmusic,,3,2025-07-13 06:38:21,,,,Was wondering why they went with an Artix instead of a Spartan but they definitely utilized the transceivers for optical audio and ethernet Still I think this could have been cheaper 299 is a pretty penny imo,,0.0,1lyhrx3
comment,n2v8nw7,Neo_Techni,,2,2025-07-13 08:37:00,,,,The super station one cost less and its MiSTer compatible and looks similar to a PSone,n2uwbhr,1.0,1lyhrx3
comment,n2u2j8g,charlemange77,,2,2025-07-13 02:46:22,,,,this sounds fun,,0.0,1lyhrx3
comment,n2xqisv,notquite20characters,,2,2025-07-13 18:06:43,,,,The C64 was the reason that my mother always thought that keyboards were computers and towers were disk drives,,0.0,1lyhrx3
comment,n42v2l1,Adventurous_Meal1979,,2,2025-07-19 23:34:21,,,,Ive been enjoying following the retro computing scene over the last 10 years or so I remember those days when people couldnt give old computers away and you could pick up an Amiga and tons of gear for like 30 But I kind of get the feeling that this current retro wave is on the wane and wonder whether this machine is a bit too late to the party The youngest youd have to be to have used a C64 in its heyday is about 45 and while Im sure there are younger fans my nephew is 19 and loves old computers its going to be a vanishingly small percentage of the potential market Also its joining a crowded market with the mini emulation devices at the bottom end to the FPGA at the top I have a Spectrum Next great machine but I hardly use it my MiSTer does it all Good luck to the backers of this project but I think it missed the retro boat,,0.0,1lyhrx3
comment,n2uaimn,mash3d,,2,2025-07-13 03:41:45,,,,Good first step now bring back the Amiga,,0.0,1lyhrx3
comment,n2ukm3b,v0id0007,,0,2025-07-13 04:57:06,,,,Or the Tandy,n2uaimn,1.0,1lyhrx3
comment,n2xboxn,MrFartyBottom,,2,2025-07-13 16:55:09,,,,Just get a MiSTer FPGA Not only do you get a very accurate C64 core that is close to 100 compatible you also get an accelerated Amiga that supports RTG graphics nearly every computer and console from the beginning of computing history upto the mid 90s and a ton of arcade cores Put it inside a modern C64 or Amiga replacement case and you can relive every nostalgic stage of your computing journey from a Tandy TRS80 up to a 486 PC,,0.0,1lyhrx3
comment,n2u9j48,Bay_Visions,,1,2025-07-13 03:34:50,,,,This thread is an ad,,0.0,1lyhrx3
comment,n2vae5j,Alexij,,5,2025-07-13 08:53:52,,,,Everything is,n2u9j48,1.0,1lyhrx3
comment,n2vaii9,Bay_Visions,,0,2025-07-13 08:55:02,,,,My comment wasnt an ad,n2vae5j,2.0,1lyhrx3
comment,n2vd9ju,SatansFriendlyCat,,4,2025-07-13 09:22:21,,,,It was an ad for your personal branding to demonstrate perspicacity,n2vaii9,3.0,1lyhrx3
comment,n2vau9r,Alexij,,2,2025-07-13 08:58:13,,,,Youre an engagement bot Sorry,n2vaii9,3.0,1lyhrx3
comment,n2vb2bi,Bay_Visions,,-1,2025-07-13 09:00:27,,,,Proof,n2vau9r,4.0,1lyhrx3
comment,n2u15hw,Fallen_Jalter,,1,2025-07-13 02:37:19,,,,Dare I ask how reasonable it is to GET the old games nowadays,,0.0,1lyhrx3
comment,n2u1hzd,theglassishalf,,11,2025-07-13 02:39:33,,,,You can get them all for free easily,n2u15hw,1.0,1lyhrx3
comment,n2u2wns,mcdithers,,2,2025-07-13 02:48:52,,,,Im lucky Theres a store called Game Changers about a mile from me They have hundreds of games for every console generation they repair old systems accept trades and buy games from you Last time I was in they had a C64 Atari 2600 NES SNES N64 Game Cube Genesis Master System and OG Gameboys new in box,n2u15hw,1.0,1lyhrx3
comment,n2u3u4e,panic_the_digital,,1,2025-07-13 02:55:05,,,,So 55 floppies a thing now,,0.0,1lyhrx3
comment,n2u8fr4,mezolithico,,2,2025-07-13 03:27:01,,,,525,n2u3u4e,1.0,1lyhrx3
comment,n2u9b64,panic_the_digital,,1,2025-07-13 03:33:18,,,,Touche,n2u8fr4,2.0,1lyhrx3
comment,n30smfy,przemo-c,,2,2025-07-14 04:28:29,,,,Cassettes or bust,n2u3u4e,1.0,1lyhrx3
comment,n2u57yx,okram2k,,1,2025-07-13 03:04:34,,,,first hardware release in 30 years what has the company been doing for the last three decades,,0.0,1lyhrx3
comment,n2u5wzf,dertechie,,6,2025-07-13 03:09:17,,,,Being defunct mostly,n2u57yx,1.0,1lyhrx3
comment,n2uo7m9,None,,1,2025-07-13 05:26:37,,,,It seems cool but those are some big price tags with an acknowledgement of them possibly going up with tariffs C64 is a cool period of retro gaming but it seems like another very very very niche FPGA product for people with deep pockets,,0.0,1lyhrx3
comment,n2v2l6r,PickleJuiceMartini,,1,2025-07-13 07:38:11,,,,What do I do I had a Commodore 128 with a 1571 disk drive Just kidding I dont care because I used the C64 mode 999 of the time,,0.0,1lyhrx3
comment,n2vr81m,wpmason,,1,2025-07-13 11:31:28,,,,Have the old cartridges not degraded in 30 years,,0.0,1lyhrx3
comment,n2wz045,Darnocpdx,,1,2025-07-13 15:51:11,,,,Cartridges There were cassette drives and floppies Cant recall if they went to a hard disc or not,n2vr81m,1.0,1lyhrx3
comment,n2wzenu,wpmason,,1,2025-07-13 15:53:11,,,,Yeah I read the word cartridge in the article and just repeated it but i was picturing the 525 floppies,n2wz045,2.0,1lyhrx3
comment,n2xerjy,MrFartyBottom,,1,2025-07-13 17:10:12,,,,C64 had a cartridge port and there were plenty of games released on cartridge but they were all simple arcade ports as they only supported 16KB Disk and tape programs could access the whole 64KB of the system including the system space ROM,n2wz045,2.0,1lyhrx3
comment,n2vssay,regcrusher,,1,2025-07-13 11:44:04,,,,LOAD 81,,0.0,1lyhrx3
comment,n2vwdka,coani,,6,2025-07-13 12:11:16,,,,LOAD 81 to be correct,n2vssay,1.0,1lyhrx3
comment,n2vwpep,regcrusher,,2,2025-07-13 12:13:39,,,,Thank you Its been decades,n2vwdka,2.0,1lyhrx3
comment,n2vtc5y,billhughes1960,,1,2025-07-13 11:48:25,,,,Ugh I wish I still had my Z80 cartridge Id love to edit some docs in Wordstar,,0.0,1lyhrx3
comment,n2w7axj,Masterofunlocking1,,1,2025-07-13 13:23:51,,,,I started with an Apple 2e and always wanted to try a commodore I might have to get this I love how to my knowledge Stranger Things started this huge resurgence of retro throwbacks,,0.0,1lyhrx3
comment,n2wb7kq,FATICEMAN,,1,2025-07-13 13:47:20,,,,Sword of Fargoal,,0.0,1lyhrx3
comment,n2woyn2,DreadPirateGriswold,,1,2025-07-13 15:00:44,,,,Cool Now do the Radio Shack TRS80 Tandy Color Computer,,0.0,1lyhrx3
comment,n2wzx2l,BeneficialTrash6,,1,2025-07-13 15:55:44,,,,Cool But what we all really need is a new IBM 5100,,0.0,1lyhrx3
comment,n2x48be,gishbot1,,1,2025-07-13 16:17:25,,,,If I can get a floppy drive Im all over it,,0.0,1lyhrx3
comment,n2ynrcv,RaelaltRael,,1,2025-07-13 20:51:49,,,,Naw man you need the tape drive to be authentic,n2x48be,1.0,1lyhrx3
comment,n307thy,3eep-,,1,2025-07-14 02:08:09,,,,I had a tape drive on my VIC20 but I didnt know the C64 had one,n2ynrcv,2.0,1lyhrx3
comment,n3084kk,RaelaltRael,,1,2025-07-14 02:10:01,,,,It was an external drive that was purchased separately,n307thy,3.0,1lyhrx3
comment,n2ybh3n,SpandauBalletGold,,1,2025-07-13 19:51:28,,,,Lol,,0.0,1lyhrx3
comment,n2ycdsh,Xerxero,,1,2025-07-13 19:55:53,,,,For who is this Seems more a thing for the people growing up with it and want to play with it a bit But other than them,,0.0,1lyhrx3
comment,n2yf11d,Rabidsenses,,1,2025-07-13 20:08:57,,,,This is tempting How I wish the C64 could be the foundation to make me king of the skies again in Choplifter as the POWsaving hero Okay maybe there were the occasional examples of collateral damage but I swear those were just some excited misfires,,0.0,1lyhrx3
comment,n2ymgfx,Xendrus,,1,2025-07-13 20:45:24,,,,If this goes well I wonder if we will ever see rereleases of other consoles The mini nintendo stuff went well Id buy a brand spanking new no emulation super nintendo made with modern parts Those old parts wont last forever in 50 years all the controllers will be toast if they dont do something official like that theyll be lost one day,,0.0,1lyhrx3
comment,n2yrvyp,drmyk,,1,2025-07-13 21:12:17,,,,MULE time,,0.0,1lyhrx3
comment,n2yt26g,CatboyInAMaidOutfit,,1,2025-07-13 21:18:07,,,,I bought a few imitations and emulators I wont pass on this,,0.0,1lyhrx3
comment,n2z42xm,PunkAssKidz,,1,2025-07-13 22:16:53,,,,As long as the Ultimate Amiga runs on an FPGA with Workbench I will be buying one,,0.0,1lyhrx3
comment,n2zg8bf,7thpixel,,1,2025-07-13 23:25:06,,,,I still listen to C64 remix music the tracks are so good,,0.0,1lyhrx3
comment,n2zhrdw,slapfunk79,,1,2025-07-13 23:33:49,,,,Are you keeping up with the Commodore Cause the Commodore is keeping up with you,,0.0,1lyhrx3
comment,n2zpfm7,redditdoggnight,,1,2025-07-14 00:18:19,,,,Line 10 Print Awesome Line 20 Goto 10 Run,,0.0,1lyhrx3
comment,n2zt5j6,PeriapsisStudios,,1,2025-07-14 00:40:38,,,,So does this mean theyre making new 6581s,,0.0,1lyhrx3
comment,n2zuuhy,CollateralSandwich,,1,2025-07-14 00:50:38,,,,Man now I have to go dig out that floppy that had like 50 crap games on it,,0.0,1lyhrx3
comment,n305kgy,Important-Ability-56,,1,2025-07-14 01:54:31,,,,I remember never being good at QBert and spending a whole afternoon coding a French flag,,0.0,1lyhrx3
comment,n30jdq7,WeepingAgnello,,1,2025-07-14 03:21:48,,,,I love my C64 sys64738 I love my Jumpman Jumpman Jr Wizard Ghosts n Goblins Gauntlet Forbidden Forest and Impossible Mission But that transparent plastic is ugly and I want my Commodore 64 colors And a telephone And Fastload,,0.0,1lyhrx3
comment,n31tihx,noAnimalsWereHarmed,,1,2025-07-14 10:05:24,,,,You can get a classic looking version and its cheaper,n30jdq7,1.0,1lyhrx3
comment,n30mguz,PracticalDaikon169,,1,2025-07-14 03:43:28,,,,Marble Madness please,,0.0,1lyhrx3
comment,n30u4yk,CrunchingTackle3000,,1,2025-07-14 04:40:05,,,,Blue Max forever,,0.0,1lyhrx3
comment,n32tgv4,bl-nero,,1,2025-07-14 14:05:07,,,,Whats up with the memory specs 128MB DDR2 RAM,,0.0,1lyhrx3
comment,n37oeqs,ChodaRagu,,1,2025-07-15 05:38:28,,,,Maybe I can finally finish Aliens on the new C64,,0.0,1lyhrx3
comment,n2uwrb0,bullcitytarheel,,-1,2025-07-13 06:42:54,,,,300 for a decades old system that doesnt come packaged with any decades old games This feels like either a scam or a soon to be examined flop,,0.0,1lyhrx3
comment,n2v8zjx,NaCl-more,,6,2025-07-13 08:40:14,,,,Its expensive but lowvolume product combined with FPGA which are quite expensive,n2uwrb0,1.0,1lyhrx3
