type,id,author,title,score,created_utc,url,num_comments,subreddit,body,parent_id,depth,post_id
comment,n2y03i5,omega884,,5,2025-07-13 18:54:24,,,,According to the listing it ships with 50 full games including licensed classics But beyond that is it really all that expensive relative to what it is Lets say you were going to put this together yourself A new C64 bread bin style case will set you back 150 US Assume youre up for using software emulation instead of an FPGA so you pick up a raspberry pi a 64GB sd card and the power adapter and cables Based on Cana Kits pricing lets call it 100 Now you also need a 75 mechanical keyboard from somewhere Lets assume youre going to hack it up and so dont care much for build quality and call it 50 Just in that youre at the 300 price point but rather than a complete system you have a collection of parts that you still need to hack apart and reassemble into a completed product and said completed product still wouldnt be compatible with original cartridges disk drives or joysticks if you had any you wanted to use So lets say you instead just want to go the buy an original route A tested C64 with disk drive on ebay can be had for about 175 and another 10 for the composite to HDMI adapter from Amazon The C64 power supplies are notorious for going bad and theres a thriving industry of after market ones so 50 if you floppy drive has an internal supply and doesnt need one or 100 if you need one for that too So 235 285 for the OG experience Of course now you have the opposite problem of the emulated one you have compatibility with all the old hardware but no ability to use modern creature comforts like USB SD cards or modern networking Hardware is expensive it always has been 300 isnt impulse purchase money but its also hardly a crazy amount of money to spend on even low end computer hardware these days,n2uwrb0,1.0,1lyhrx3
comment,n2y4qzy,bullcitytarheel,,-2,2025-07-13 19:17:41,,,,Yes its incredibly overpriced,n2y03i5,2.0,1lyhrx3
comment,n2y6d7m,omega884,,2,2025-07-13 19:25:55,,,,How so How much should it be What would the hardware be for that price,n2y4qzy,3.0,1lyhrx3
comment,n2y7kxj,bullcitytarheel,,-1,2025-07-13 19:32:04,,,,0,n2y6d7m,4.0,1lyhrx3
comment,n2yb6tb,day2013,,1,2025-07-13 19:50:03,,,,Well dont buy it then,n2y4qzy,3.0,1lyhrx3
comment,n2yd98s,bullcitytarheel,,-2,2025-07-13 20:00:13,,,,Holy shit Youre a genius thanks for the advice cant believe I didnt think of that,n2yb6tb,4.0,1lyhrx3
comment,n2w0kxd,zomboscott,,1,2025-07-13 12:40:52,,,,Its just nestalga baiting No matter how many toys you buy from your childhood or wish you had from then you cant actually buy back your childhood,n2uwrb0,1.0,1lyhrx3
comment,n2wcnvs,bullcitytarheel,,2,2025-07-13 13:55:44,,,,100 Well said,n2w0kxd,2.0,1lyhrx3
comment,n2v8k3x,Neo_Techni,,-17,2025-07-13 08:35:56,,,,Also nothing pre NES is even worth playing,n2uwrb0,1.0,1lyhrx3
comment,n2vdtu4,jarojajan,,16,2025-07-13 09:27:55,,,,you werent born when the original Commodore came out I assume,n2v8k3x,2.0,1lyhrx3
comment,n2u7jw9,ramriot,,1,2025-07-13 03:20:46,,,,I wonder if that includes the bugs workarounds that meant certain slightly out if spec RAM chips would not work on it,,0.0,1lyhrx3
