type,id,author,title,score,created_utc,url,num_comments,subreddit,body,parent_id,depth,post_id
post,1lyhrx3,chrisdh79,"The Commodore 64 Ultimate computer is the company's first hardware release in over 30 years | No software emulation, this 'faithful recreation of the original motherboard' runs on an AMD Artix 7 FPGA.",2385,2025-07-13 02:29:05,https://www.reddit.com/r/gadgets/comments/1lyhrx3/the_commodore_64_ultimate_computer_is_the/,273.0,gadgets,,,,
comment,n2tzvxp,AutoModerator,,1,2025-07-13 02:29:06,,,,We have a giveaway running be sure to enter in the post linked below for your chance to win a Luckeep X1 ebike I am a bot and this action was performed automatically Please contact the moderators of this subredditmessagecomposetorgadgets if you have any questions or concerns,,0.0,1lyhrx3
comment,n2u1d98,critical2210,,183,2025-07-13 02:38:41,,,,I already own an original C64 alongside its 1541 disk drive in box but super stoked for this project anyways Always best to have more new hardware for people to get into,,0.0,1lyhrx3
comment,n2udx05,Shikatanai,,89,2025-07-13 04:06:15,,,,You have a disk drive Your parents must be rich,n2u1d98,1.0,1lyhrx3
comment,n2v7o71,Vaestmannaeyjar,,44,2025-07-13 08:27:04,,,,Yes but we save on heating in winter thanks to the superhot transformer,n2udx05,2.0,1lyhrx3
comment,n2wa5yi,10fingers6strings,,16,2025-07-13 13:41:09,,,,The Commodore cassette drive was the oppositea sign of abject computing poverty,n2udx05,2.0,1lyhrx3
comment,n2xwc23,glitchymario,,22,2025-07-13 18:35:40,,,,As was the Vic 20neighbor friend had a maxed out C64 setup while I was rocking the flea market find Vic and cassette drive I think I had more fun learning to program by typing in those long BASIC programs printed in the back of the magazines Definitely taught me a lot about debugging,n2wa5yi,3.0,1lyhrx3
comment,n2znen5,wedgieinhumanform,,9,2025-07-14 00:06:17,,,,The only programming that ever stuck as a kid Load 81,n2xwc23,4.0,1lyhrx3
comment,n2zqzm4,AngryMcMurder,,2,2025-07-14 00:27:39,,,,I remember occasionally hitting 91 by accident and feeling confused that it still worked,n2znen5,5.0,1lyhrx3
comment,n30tv0f,CrunchingTackle3000,,2,2025-07-14 04:38:00,,,,Praise be,n2znen5,5.0,1lyhrx3
comment,n2yhg62,Dawlin42,,4,2025-07-13 20:20:48,,,,The Vic 20 had plenty of good games Spent a lot of time on one of those at my friends house in the earlymid80s,n2xwc23,4.0,1lyhrx3
comment,n2zgz5l,slapfunk79,,4,2025-07-13 23:29:22,,,,I had a Commodore Plus4 with the tape drive Try living with that shame,n2wa5yi,3.0,1lyhrx3
comment,n2z9ef4,hoodedrobin1,,1,2025-07-13 22:46:50,,,,I feel like the cassette drive wasnt even released in the US I never see one,n2wa5yi,3.0,1lyhrx3
comment,n2zbqtm,10fingers6strings,,1,2025-07-13 22:59:53,,,,I had one in the early 80s like 8384 ish,n2z9ef4,4.0,1lyhrx3
comment,n30wu7c,Total_Actuator649,,1,2025-07-14 05:01:19,,,,I bet most of the cassette drives were used with the Vic and very early years of the C64 until the 1541 took off really quickly i may add,n2z9ef4,4.0,1lyhrx3
comment,n301lwj,Terribleturtleharm,,1,2025-07-14 01:30:47,,,,Man I have my floppy drive and get thisfast loader cartridge Ultima II forever,n2udx05,2.0,1lyhrx3
comment,n30tt7t,CrunchingTackle3000,,1,2025-07-14 04:37:37,,,,Accelerator Plus checking in,n2udx05,2.0,1lyhrx3
comment,n2uvukq,gachunt,,15,2025-07-13 06:33:55,,,,I have mine in a box along with two 1581 drives a 1541 a super CPU jiffy dos a 40 mb CMD hard drive and a 2400 bps modem,n2u1d98,1.0,1lyhrx3
comment,n2vvpdx,itastesok,,3,2025-07-13 12:06:18,,,,Also had a Lt Kernal hard drive for my BBS Damn that thing was crazy expensive What 500 for 20MB,n2uvukq,2.0,1lyhrx3
comment,n2w6von,TheAspiringFarmer,,1,2025-07-13 13:21:14,,,,Yep sounds right I had a 40MB and seems to me it was over 1000 at the timewish I still had the ticket lol,n2vvpdx,3.0,1lyhrx3
comment,n30mp0h,PracticalDaikon169,,1,2025-07-14 03:45:04,,,,I ran a BBS for a minute The Shelter,n2vvpdx,3.0,1lyhrx3
comment,n2watim,FATICEMAN,,3,2025-07-13 13:45:01,,,,Epson dot matrix printer,n2uvukq,2.0,1lyhrx3
comment,n2x6miu,gachunt,,2,2025-07-13 16:29:37,,,,I dont have it anymore but I did have a canon BJ20 ink jet hooked up to mine,n2watim,3.0,1lyhrx3
comment,n2vpyvj,cataath,,3,2025-07-13 11:20:58,,,,I have a 1541 stored in a box having lost the C64 in a move about 25 years ago Id be flabbergasted if the thing still worked being around 40 years old Is there an actual marketplace for replacing plasticrubber internal components When my son was around 7 or 8 I gave him a box of my old GI Joe action figures every single one had their legs separated from there torso but I found a place online that sold the rubber orings to put them back together,n2uvukq,2.0,1lyhrx3
comment,n2vbb5n,SatansFriendlyCat,,1,2025-07-13 09:02:50,,,,Hardcore,n2uvukq,2.0,1lyhrx3
comment,n2u21mn,bigwetducky,,2,2025-07-13 02:43:06,,,,what is it,n2u1d98,1.0,1lyhrx3
comment,n2u2iup,critical2210,,44,2025-07-13 02:46:18,,,,Commodore 64 Its a 1980s computer that was immensely popular in the European and US home computer markets Was immensely affordable compared to its business peers had very good graphics for the time The 1541 is a floppy disk drive basically think of it as how we now use modern USB drives or CDs for storage,n2u21mn,2.0,1lyhrx3
comment,n2wrxxg,reliks84,,7,2025-07-13 15:15:42,,,,floppy And by floppy disk drive were talking 525 floppy disks,n2u2iup,3.0,1lyhrx3
comment,n2wb0f8,FATICEMAN,,2,2025-07-13 13:46:09,,,,Gonna go and surf compuserve,n2u2iup,3.0,1lyhrx3
comment,n2u484x,bigwetducky,,3,2025-07-13 02:57:44,,,,what did people play on it,n2u2iup,3.0,1lyhrx3
comment,n2u7nhg,dicjones,,27,2025-07-13 03:21:28,,,,Bards Tale 2 the original Madden game caveman uglympics track and field with cavemen maniac mansionthose are ones I remember off the top of my head,n2u484x,4.0,1lyhrx3
comment,n2uvgor,gachunt,,12,2025-07-13 06:30:22,,,,Impossible Mission I learned how to complete it without losing a single life Bubble Bobble,n2u7nhg,5.0,1lyhrx3
comment,n2v7czl,FragrantKnobCheese,,10,2025-07-13 08:24:00,,,,Another visitor stay awhile stay FOREVER Man that takes me back,n2uvgor,6.0,1lyhrx3
comment,n2v6g0b,snorkelvretervreter,,8,2025-07-13 08:15:00,,,,Bubble bobble I still love the theme music Quite the earworm,n2uvgor,6.0,1lyhrx3
comment,n2wc6tg,Muslim_Wookie,,2,2025-07-13 13:53:00,,,,,n2v6g0b,7.0,1lyhrx3
comment,n2wesut,snorkelvretervreter,,1,2025-07-13 14:07:47,,,,,n2wc6tg,8.0,1lyhrx3
comment,n2wfdy2,Muslim_Wookie,,1,2025-07-13 14:11:00,,,,Amazing Lost for words,n2wesut,9.0,1lyhrx3
comment,n386gdu,Digifiend84,,2,2025-07-15 08:24:49,,,,I didnt have that but I did have the sequel Rainbow Islands,n2v6g0b,7.0,1lyhrx3
comment,n38gp1j,snorkelvretervreter,,1,2025-07-15 10:04:00,,,,I dont think Ive ever played that looks really good It reminded me a bit of New Zealand Story although looking back on it now it doesnt look quite as good as I remember it D,n386gdu,8.0,1lyhrx3
comment,n2v6yfe,bazza_ryder,,9,2025-07-13 08:20:02,,,,Raid Over Moscow Which took six forevers to load from cassette and then youd forget how to open the hangar doors at the start,n2u7nhg,5.0,1lyhrx3
comment,n2visyt,dicjones,,5,2025-07-13 10:16:38,,,,I remembered another one that I played the crap out of It was a Gauntlet clone called Demon Stalkers,n2v6yfe,6.0,1lyhrx3
comment,n2wb4t1,FATICEMAN,,4,2025-07-13 13:46:51,,,,Jumpman and beach jead,n2u7nhg,5.0,1lyhrx3
comment,n2uy701,kronosdev,,1,2025-07-13 06:56:41,,,,Number Munchers,n2u7nhg,5.0,1lyhrx3
comment,n2ua0ou,WeakTransportation37,,1,2025-07-13 03:38:13,,,,Ive heard of manic miner all bc of this catchy little song,n2u7nhg,5.0,1lyhrx3
comment,n2uizez,_scyllinice_,,1,2025-07-13 04:44:15,,,,I didnt know it had a C64 port Ive only seen the ZX Spectrum version,n2ua0ou,6.0,1lyhrx3
comment,n2umc3c,Drix22,,20,2025-07-13 05:11:04,,,,Let me introduce you to Boulderdash Theres a special place in my heart for little Rockford,n2u484x,4.0,1lyhrx3
comment,n30tzkp,CrunchingTackle3000,,1,2025-07-14 04:38:57,,,,Amen,n2umc3c,5.0,1lyhrx3
comment,n2vc8vj,SatansFriendlyCat,,8,2025-07-13 09:12:10,,,,In addition to what everyone else is correctly telling you about the amazing games the C64 is considered one of the big stars of the Chiptune scene which you may have heard of The electronic music which sounds like its from an oldskool computer sometimes people refer to it as 8bit music because its from the 8Bit computers of the era The Commodore 64 had a dedicated sound processor called the SID chip which was pretty versatile bit could also be made to behave in even more versatile ways than designed using clever programming It gave the C64 much better audio than most of its competitors and this in an era where the PC said beep only You could get some pretty awesome sounds out of it and theres still a dedicated composing scene for tunes using this chip Google SIDtunes and suchlike if youre curious,n2u484x,4.0,1lyhrx3
comment,n2uawk9,kitliasteele,,7,2025-07-13 03:44:32,,,,It is definitely telling of my age when others ask this Others have already answered it just I felt I needed to reminisce on this given my DOS gaming days on an ol AST Advantage 486SX33 myself,n2u484x,4.0,1lyhrx3
comment,n2u4vnl,critical2210,,11,2025-07-13 03:02:13,,,,Mostly arcade ports of games of the time paired with a few made bespoke for the platform Platformers galaga clones and the like mostly It was a very diverse platform though plenty of stuff out there of varying quality levels,n2u484x,4.0,1lyhrx3
comment,n2u8z52,Actedpie,,14,2025-07-13 03:30:52,,,,I wasnt around for that era Gen Z but I think its fascinating how much of a Wild West that era was Everyone pirated games people just wrote BASIC programs or just inputted code they found in their magazines and every game had its own weird control quirk The C64 was so decentralized and people used to be so involved with their computing its cool,n2u4vnl,5.0,1lyhrx3
comment,n2us4mg,Roadside_Prophet,,7,2025-07-13 06:00:28,,,,You had to input code just to run a game Nothing autoloaded or installed a nice shortcut for you to click Its been a while but iirc it was something like LOAD 81,n2u8z52,6.0,1lyhrx3
comment,n2uy4kf,Lyuseefur,,2,2025-07-13 06:56:03,,,,Its where loadstar comes from,n2us4mg,7.0,1lyhrx3
comment,n2wajae,10fingers6strings,,2,2025-07-13 13:43:21,,,,Lode Runner,n2uy4kf,8.0,1lyhrx3
comment,n2x1wle,Lyuseefur,,1,2025-07-13 16:05:44,,,,,n2wajae,9.0,1lyhrx3
comment,n2xfhdx,10fingers6strings,,1,2025-07-13 17:13:40,,,,Yes Loadstar made me think of lode runner Its been awhile,n2x1wle,10.0,1lyhrx3
comment,n2useui,Actedpie,,1,2025-07-13 06:02:57,,,,Thats what I thought as well looked it up earlier The nice thing is that a lot of the C64s command syntax has carried over to modern systems as well Like the asterisk specifies the file and what the numbers specify what youre loading from and where in memory to load it,n2us4mg,7.0,1lyhrx3
comment,n2v8s31,til_noon,,4,2025-07-13 08:38:10,,,,Wizard of wor,n2u484x,4.0,1lyhrx3
comment,n2vvw2r,coani,,4,2025-07-13 12:07:41,,,,smh nobody mentioned The Last Ninja 123,n2u484x,4.0,1lyhrx3
comment,n2yhujh,Dawlin42,,2,2025-07-13 20:22:45,,,,Absolutely groundbreaking graphics for the time and an excellent execellent game,n2vvw2r,5.0,1lyhrx3
comment,n2yt1fh,coani,,1,2025-07-13 21:18:01,,,,I LOVED the soundtrack on the first game played so many times through it just to listen to the whole of it,n2yhujh,6.0,1lyhrx3
comment,n30u3m7,CrunchingTackle3000,,2,2025-07-14 04:39:48,,,,Goddamn,n2vvw2r,5.0,1lyhrx3
comment,n2v2qth,_PM_ME_PANGOLINS_,,3,2025-07-13 07:39:41,,,,Personally Monty on the Run Ducktales Jet Set Willy Maniac Mansion Frak Bubble Bobble Chuckie Egg Dizzy,n2u484x,4.0,1lyhrx3
comment,n2wi2x9,tbarlow13,,3,2025-07-13 14:25:32,,,,I played a ton of dig dug and some stock simulator,n2u484x,4.0,1lyhrx3
comment,n2wrap1,reliks84,,3,2025-07-13 15:12:28,,,,Zork Hitchhikers Guide to the Galaxy which Douglas Adams actually worked on and a long list of other classic games by Infocom Not to mention Pirates the Windham Classics games eg Below the Root Alice in Wonderland Swiss Family Robinson Maniac Mansion Impossible Mission Jumpman and many many more,n2u484x,4.0,1lyhrx3
comment,n3036ot,FloatsWithBoats,,2,2025-07-14 01:40:16,,,,Took too long to come across Zork and Hitchhikers Would also bring Scott Adams text based adventure games,n2wrap1,5.0,1lyhrx3
comment,n2u8tov,zoequinnfuckedmetoo,,5,2025-07-13 03:29:47,,,,I played harrier and longbow on it Wrote a pitfall clone for it in 6th grade,n2u484x,4.0,1lyhrx3
comment,n2u9k5n,WeakTransportation37,,3,2025-07-13 03:35:03,,,,Pitfall clone Thats sweet,n2u8tov,5.0,1lyhrx3
comment,n2ux7yp,heliskinki,,2,2025-07-13 06:47:37,,,,Wizball Speedball The Sentinel Elite Iridis Alpha Ah memories,n2u484x,4.0,1lyhrx3
comment,n2wacy9,10fingers6strings,,2,2025-07-13 13:42:18,,,,Ultima,n2u484x,4.0,1lyhrx3
comment,n30txu4,CrunchingTackle3000,,2,2025-07-14 04:38:35,,,,International Karate plus my bro,n2u484x,4.0,1lyhrx3
comment,n2v6gqy,CzarDale04,,2,2025-07-13 08:15:11,,,,Black Gold an oil tycoon game You had to start small and try to find oil and become a tycoon Floppy disk got damaged,n2u484x,4.0,1lyhrx3
comment,n2xwgxe,ignomax,,1,2025-07-13 18:36:20,,,,Winter Games especially loved biathlon event,n2u484x,4.0,1lyhrx3
comment,n2zbvs6,shadrap,,1,2025-07-13 23:00:39,,,,Zork,n2u484x,4.0,1lyhrx3
comment,n308loo,Initial-Bass-6751,,1,2025-07-14 02:12:53,,,,My favorite was racing destruction set and one on one bird vs dr j,n2u484x,4.0,1lyhrx3
comment,n32sjfl,Drysander,,1,2025-07-14 14:00:14,,,,There wasnt a huge game market yet I learned how to program with Basic with mine By todays standards games were really primitive and slooow,n2u484x,4.0,1lyhrx3
comment,n2ua568,WeakTransportation37,,1,2025-07-13 03:39:05,,,,A little tune about the 16k era,n2u21mn,2.0,1lyhrx3
comment,n2x2vbc,Jurlaub12,,1,2025-07-13 16:10:33,,,,Totally agree its cool theyre doing actual hardware instead of just another emulator box might be a good way to get younger folks into retro computing without hunting down 40 year old equipment,n2u1d98,1.0,1lyhrx3
comment,n2xf0gl,NoFeetSmell,,1,2025-07-13 17:11:23,,,,I had a Commodore 128 with the builtin disk drive back in the day though because it was so expensive my folks only sprung for the greenscreen monitor P Also given that I had to type a command every time it booted up just to revert it to C64 mode it was actually less convenient yet more expensive Im not sure if the 128 provided me with any benefit over the C64 whatsoever but I truly loved gaming on it back in the day even if I would often die to something I couldnt discern cos of the greenscreen,n2u1d98,1.0,1lyhrx3
comment,n2xwa4l,critical2210,,3,2025-07-13 18:35:24,,,,128 never had any benefit compared to the 64 if you ran any original 64 applications I will say the keyboard feels moderately less shitty though I doubt anyone knew any better back then If you had business applications that genuinely used the 128 which were few and far between it was a worthy successor,n2xf0gl,2.0,1lyhrx3
comment,n2y03z8,NoFeetSmell,,1,2025-07-13 18:54:29,,,,Yeah it was very much my first lesson that upgrades arent actually upgrades if the added functions are of no benefit for your particular usecase Id have definitely been better off with a C64 and a colour monitor but iirc they were sold out of the C64s and only had the 128 in stock though that could have been a wily salesmans trick I suppose The greenscreen monitor was definitely a letdown and I was waaaay too young to even be aware of useful business applications let alone be enthused about the extra power I could leverage for them I exclusively used it for the C64 games my older cousins had copied to disk for me,n2xwa4l,3.0,1lyhrx3
comment,n2tzztr,chrisdh79,,225,2025-07-13 02:29:48,,,,From the article The Commodore 64 Ultimate will be the first new hardware released under the auspices of the new management This new home computer product is now available for preorder starting from 299 but shipping wont happen until October at the earliest For your cash you will get a device which resolutely isnt a software emulator but is built around an AMD Artix 7 FPGA and is claimed to be compatible with 10000 original games cartridges and peripherals We had an inkling that some hardware like this would be announced soon as Commodore Corporation recently had its entire management structure commandeered by enthusiasts Retro Recipes TechTuber Christian Peri Fractic Simpson is now at the helm Two weeks ago Simpson stated that he was now the acting CEO of Commodore Corporation had been joined by several iconic Commodore names and teased a new hardware reveal The Commodore Corporations acquisition seems to be in the bag but worryingly funding doesnt seem to be complete yet for the low sevenfigure deal to be finalized,,0.0,1lyhrx3
comment,n2ueu1n,andynator1000,,120,2025-07-13 04:12:57,,,,Retro Recipes TechTuber Christian Peri Fractic Simpson Thats quite a mouthful,n2tzztr,1.0,1lyhrx3
comment,n2uur2j,ThePrussianGrippe,,44,2025-07-13 06:23:53,,,,You can sing Retro Recipes TechTuber Christian Peri Fractic Simpson to the tune of itsy bitsy teenie weenie yellow polka dot bikini,n2ueu1n,2.0,1lyhrx3
comment,n2vb571,SatansFriendlyCat,,18,2025-07-13 09:01:13,,,,Only if you elide a syllable out of existence somewhere most probably in recipes turning it into resspees or Christian turning it into chrischn,n2uur2j,3.0,1lyhrx3
comment,n2vfs2t,KaiJustissCW,,7,2025-07-13 09:47:15,,,,Do you pronounce Christian as Christeean,n2vb571,4.0,1lyhrx3
comment,n2vi3o1,SatansFriendlyCat,,1,2025-07-13 10:09:52,,,,Yes I do sometimes slur the ti into a tchee a little but I keep it the three syllables I commonly hear it spoken both as 2 or 3 syllable forms though,n2vfs2t,5.0,1lyhrx3
comment,n2xuocc,KaiJustissCW,,3,2025-07-13 18:27:21,,,,Ive never heard anyone pronounce it in 3 syllables where are you from,n2vi3o1,6.0,1lyhrx3
comment,n303roc,SatansFriendlyCat,,3,2025-07-14 01:43:46,,,,Ive lived for long periods of time in several places in the UK and then Australia English is pretty diverse though particularly within England where there are a range of very distinct accents and dialects within very short distances of each other Much less homogeneous than places with fewer influences or which were settled in the age of easily accessible transportation or mass communication The US has less variety than the UK but more variety than Australia yet Ive heard both variations readily enough even in Aus Its not at all uncommon in my experience but I dont have any difficulty believing you in this case nor anyone who says theyve only heard one variation or another of any given word The world is big,n2xuocc,7.0,1lyhrx3
comment,n33gp4v,KaiJustissCW,,3,2025-07-14 15:57:16,,,,Yes I live in the Midwest of the US and Ive only ever heard Christian as Chrischin Didnt know that anyone did pronounce it with three syllables,n303roc,8.0,1lyhrx3
comment,n36l966,SatansFriendlyCat,,2,2025-07-15 01:15:48,,,,Language is a fun thing,n33gp4v,9.0,1lyhrx3
comment,n2uwmt1,bullcitytarheel,,3,2025-07-13 06:41:35,,,,gifgiphy3og0IMJcSI8p6hYQXS,n2uur2j,3.0,1lyhrx3
comment,n2wh3x8,Jasong222,,2,2025-07-13 14:20:21,,,,I was doing supercalifragilisticexpialidocious,n2uur2j,3.0,1lyhrx3
comment,n2uyggp,rebbsitor,,29,2025-07-13 06:59:06,,,,Two weeks ago Simpson stated that he was now the acting CEO of Commodore Corporation had been joined by several iconic Commodore names and teased a new hardware reveal The Commodore Corporations acquisition seems to be in the bag but worryingly funding doesnt seem to be complete yet for the low sevenfigure deal to be finalized Id love for this to go well but I worry itll be like other attempts at resurrecting the past or creating spiritual successors like Star Citizen Chris Roberts Shroud of the Avatar Richard Garriott Intellivision Amico Tommy Tallarico etc I love the C64 as it was my second computer and I was heavily into the retrocomputing scene in 2000s2010s Theres a lots of great software and hardware that have been built around it by enthusiasts Its a very niche market though Its hard to envision building a viable large scale business based on the Commodore IP Whats been developed in the past 25 years hasnt really needed or used the IP its hobbiests building their own new things around it,n2tzztr,1.0,1lyhrx3
comment,n2v10em,RandomGuyPii,,17,2025-07-13 07:23:03,,,,The resurrection of Microprose seems to be going okay so hopefully commodore can do it too,n2uyggp,2.0,1lyhrx3
comment,n2zbvjl,Plank_With_A_Nail_In,,3,2025-07-13 23:00:37,,,,Its acting solely as a publisher now and all that requires is money,n2v10em,3.0,1lyhrx3
comment,n30pu0e,RandomGuyPii,,2,2025-07-14 04:07:33,,,,Im quite fond of both Boat Crew and Sea Power,n2zbvjl,4.0,1lyhrx3
comment,n2xcwsp,CrazyLlama71,,9,2025-07-13 17:01:08,,,,Man I feel old I had the original C64 in 1982 Was my first computer My grandfather got it for me and started teaching me to code,n2uyggp,2.0,1lyhrx3
comment,n2vqb1s,wrathek,,16,2025-07-13 11:23:49,,,,Im actually really confused as to how there was still a Commodore Corporation after all this time Wtf did they do,n2tzztr,1.0,1lyhrx3
comment,n2w4clx,Dampmaskin,,27,2025-07-13 13:05:19,,,,I think the name has basically been changing hands between people who refuse to let it die for the last 30 years,n2vqb1s,2.0,1lyhrx3
comment,n3kl7rm,HAL_9OOO_,,1,2025-07-17 04:01:28,,,,Thats true for a lot of brand names Bugatti pretends to be the same company from the 1930s,n2w4clx,3.0,1lyhrx3
comment,n2xcgw5,djshadesuk,,14,2025-07-13 16:58:59,,,,Can We Save The COMMODORE Brand My Biggest Project Yet Lets Buy Commodore pt 1 Were Bringing Back COMMODORE Lets Buy Commodore Part 2,n2vqb1s,2.0,1lyhrx3
comment,n386oco,Digifiend84,,1,2025-07-15 08:27:16,,,,Yeah I thought they went bust in the mid 90s Amiga was sold off and the C64 discontinued as a result,n2vqb1s,2.0,1lyhrx3
comment,n2vp085,yearz,,21,2025-07-13 11:12:49,,,,Amazing accomplishment rebuild ancient technology with new technology without any cost savings,n2tzztr,1.0,1lyhrx3
comment,n2w9lzd,Dampmaskin,,8,2025-07-13 13:37:52,,,,Dominating the emerging quantum computing market or whatever wouldnt be a realistic goal anyway I guess they could aim at becoming just another PC peripherals manufacturer among thousands of others But I think theyre right in being careful with introducing new tech because that can easily disrupt any nostalgic vibes And its hard to get away from the fact that nostalgia is the brands biggest strength at this point in time The cost savings versions have already been done eg the C64 Mini plus you can build your own custom one with a Raspberry Pi The market for that is probably saturated as it is Most of the potential customers have more money than ever before anyway In my opinion it makes sense to focus on style quality of life and tickling that nostalgia neuron as best as they can Anything else others can do better and I think theyll be wise to recognize that,n2vp085,2.0,1lyhrx3
comment,n2zc2tx,Plank_With_A_Nail_In,,1,2025-07-13 23:01:44,,,,New device can be a lot smaller though,n2vp085,2.0,1lyhrx3
comment,n2uhf4b,lostinspaz,,5,2025-07-13 04:32:07,,,,heres an earlier article on the buyout,n2tzztr,1.0,1lyhrx3
comment,n2yxmn4,gorkish,,4,2025-07-13 21:41:48,,,,Commandeered is a funny way to describe paying a few million bucks for something,n2tzztr,1.0,1lyhrx3
comment,n2u5odc,REpassword,,73,2025-07-13 03:07:40,,,,Of course Im getting ahead of myself but how about an Amiga down the line gifgiphyZVD9x1qTIy38ipqJEfdownsized,,0.0,1lyhrx3
comment,n2uajbe,yello_downunder,,27,2025-07-13 03:41:54,,,,I read they got the rights to Commodore but not the Amiga brand so no Amiga forthcoming I have a dead A3000 sitting on my desk that I wish I could still use,n2u5odc,1.0,1lyhrx3
comment,n2v0pf2,HopingillWin,,2,2025-07-13 07:20:10,,,,Fix it,n2uajbe,2.0,1lyhrx3
comment,n2vsol8,El_Paco,,4,2025-07-13 11:43:14,,,,Or like my parents trying to get an inanimate object to start working just yell at it,n2v0pf2,3.0,1lyhrx3
comment,n2y8s2j,IMissNarwhalBacon,,1,2025-07-13 19:38:06,,,,I dont believe youre inanimate for one second,n2vsol8,4.0,1lyhrx3
comment,n2xlkba,yello_downunder,,1,2025-07-13 17:42:43,,,,Needs a replacement motherboard I tried looking them up and found a couple but I think they were out of stock There are some design files that I was thinking of sending to JLCPCB to get manufactured but its going to be a pretty expensive mistake if it doesnt work Until I learn circuit design its going to continue sitting on my desk,n2v0pf2,3.0,1lyhrx3
comment,n2xoplg,twaxana,,2,2025-07-13 17:57:48,,,,Is it that bad or is it just some capacitors that need replaced,n2xlkba,4.0,1lyhrx3
comment,n340rcf,yello_downunder,,2,2025-07-14 17:30:15,,,,Its pretty bad I think I counted that battery leakage ate through 4 of the 6 layers of the motherboard I think the right thing is to replace the motherboard and if I do that maybe I should go for a fancy motherboard and if I do that I should recap the supply etc etc So in the meantime it just sits,n2xoplg,5.0,1lyhrx3
comment,n34sjuj,twaxana,,1,2025-07-14 19:40:51,,,,Dang that sucks,n340rcf,6.0,1lyhrx3
comment,n2xpgox,HopingillWin,,1,2025-07-13 18:01:28,,,,There are verified replacement boards so no risk really One such example is reAmiga 300 Im sure there are others,n2xlkba,4.0,1lyhrx3
comment,n2w4bbj,TehErk,,1,2025-07-13 13:05:05,,,,Theyre apparently working on it though,n2uajbe,2.0,1lyhrx3
comment,n2xjpk0,REpassword,,1,2025-07-13 17:33:56,,,,gifgiphyBWjTRoBsEKnIIdownsized,n2w4bbj,3.0,1lyhrx3
comment,n2xqu49,notquite20characters,,1,2025-07-13 18:08:18,,,,So theyll do a C128 next,n2uajbe,2.0,1lyhrx3
comment,n2uax2z,mash3d,,9,2025-07-13 03:44:38,,,,Ahh but which one 500 1000 2000 2500 3000 4000,n2u5odc,1.0,1lyhrx3
